,ball,batsman,batsman_id,bowler,bowler_id,commentary,innings,otherBatsman,otherBatsman_id,otherBowler,otherBowler_id,overs,playType,runs,runs_scored,score,shortText,speed,text,wickets
405,97,Paul Collingwood,10772,James Hopes,5702,"Hopes to Collingwood, 1 run Hopes lands his busy right-arm medium on and around off stump, Collingwood must recognise the bowling as reminiscent of his own, and guides it to third man for one",2nd innings,Eoin Morgan,24598,Shaun Tait,8076,16.1,run,72,1,72/3,"Hopes to Collingwood, 1 run",,"Hopes lands his busy right-arm medium on and around off stump, Collingwood must recognise the bowling as reminiscent of his own, and guides it to third man for one",3
406,98,Eoin Morgan,24598,James Hopes,5702,"Hopes to Morgan, no run good ball here, nothing for Morgan to latch on to, so instead it's tapped gently back to the bowler",2nd innings,Paul Collingwood,10772,Shaun Tait,8076,16.2,no run,72,0,72/3,"Hopes to Morgan, no run",,"good ball here, nothing for Morgan to latch on to, so instead it's tapped gently back to the bowler",3
407,99,Eoin Morgan,24598,James Hopes,5702,"Hopes to Morgan, 1 run drifting a fraction down the leg side, Morgan tickles it round the corner for one",2nd innings,Paul Collingwood,10772,Shaun Tait,8076,16.3,run,73,1,73/3,"Hopes to Morgan, 1 run",,"drifting a fraction down the leg side, Morgan tickles it round the corner for one",3
408,100,Paul Collingwood,10772,James Hopes,5702,"Hopes to Collingwood, 2 runs Collingwood managed to get this away for a couple, good calm stuff from him",2nd innings,Eoin Morgan,24598,Shaun Tait,8076,16.4,run,75,2,75/3,"Hopes to Collingwood, 2 runs",,"Collingwood managed to get this away for a couple, good calm stuff from him",3
409,101,Paul Collingwood,10772,James Hopes,5702,"Hopes to Collingwood, no run this time it's on a line and length and Collingwood pushes it back to the bowler",2nd innings,Eoin Morgan,24598,Shaun Tait,8076,16.5,no run,75,0,75/3,"Hopes to Collingwood, no run",,this time it's on a line and length and Collingwood pushes it back to the bowler,3
410,102,Paul Collingwood,10772,James Hopes,5702,"Hopes to Collingwood, no run good finish from Hopes and it's full-faced back to the bowler",2nd innings,Eoin Morgan,24598,Shaun Tait,8076,16.6,no run,75,0,75/3,"Hopes to Collingwood, no run",,good finish from Hopes and it's full-faced back to the bowler,3
411,103,Eoin Morgan,24598,Steven Smith,267192,"Smith to Morgan, 2 runs ooh, close here, Morgan's greeted Smith by dancing down the wicket and flicking airily through midwicket, only just out the reach of a diving Ponting",2nd innings,Paul Collingwood,10772,James Hopes,5702,17.1,run,77,2,77/3,"Smith to Morgan, 2 runs",,"ooh, close here, Morgan's greeted Smith by dancing down the wicket and flicking airily through midwicket, only just out the reach of a diving Ponting",3
412,104,Eoin Morgan,24598,Steven Smith,267192,"Smith to Morgan, 1 run this time it's more secure from Morgan, chipping down the crease again and working it for a single in front of square on the leg side",2nd innings,Paul Collingwood,10772,James Hopes,5702,17.2,run,78,1,78/3,"Smith to Morgan, 1 run",,"this time it's more secure from Morgan, chipping down the crease again and working it for a single in front of square on the leg side",3
413,105,Paul Collingwood,10772,Steven Smith,267192,"Smith to Collingwood, no run good ball from Smith, classic legspinner's stock, pitching around leg, spinning away, Collingwood is forward and blocks",2nd innings,Eoin Morgan,24598,James Hopes,5702,17.3,no run,78,0,78/3,"Smith to Collingwood, no run",,"good ball from Smith, classic legspinner's stock, pitching around leg, spinning away, Collingwood is forward and blocks",3
414,106,Paul Collingwood,10772,Steven Smith,267192,"Smith to Collingwood, 1 run too short and Collingwood cuts, firmly, but to the deep point fielder",2nd innings,Eoin Morgan,24598,James Hopes,5702,17.4,run,79,1,79/3,"Smith to Collingwood, 1 run",,"too short and Collingwood cuts, firmly, but to the deep point fielder",3
415,107,Eoin Morgan,24598,Steven Smith,267192,"Smith to Morgan, 1 run poor ball, deserved more than it got, was very short and Morgan pulled hard but out to deep midwicket",2nd innings,Paul Collingwood,10772,James Hopes,5702,17.5,run,80,1,80/3,"Smith to Morgan, 1 run",,"poor ball, deserved more than it got, was very short and Morgan pulled hard but out to deep midwicket",3
416,108,Paul Collingwood,10772,Steven Smith,267192,"Smith to Collingwood, 2 runs good running from Collingwood earns two as he tickled this round the corner towards backward square leg",2nd innings,Eoin Morgan,24598,James Hopes,5702,17.6,run,82,2,82/3,"Smith to Collingwood, 2 runs",,good running from Collingwood earns two as he tickled this round the corner towards backward square leg,3
417,109,Eoin Morgan,24598,James Hopes,5702,"Hopes to Morgan, no run good from Hopes, nothing fancy, just busy, back of a length outside off and Morgan blocks",2nd innings,Paul Collingwood,10772,Steven Smith,267192,18.1,no run,82,0,82/3,"Hopes to Morgan, no run",,"good from Hopes, nothing fancy, just busy, back of a length outside off and Morgan blocks",3
418,110,Eoin Morgan,24598,James Hopes,5702,"Hopes to Morgan, no run touch fuller, Morgan aims a drive but doesn't time it at all",2nd innings,Paul Collingwood,10772,Steven Smith,267192,18.2,no run,82,0,82/3,"Hopes to Morgan, no run",,"touch fuller, Morgan aims a drive but doesn't time it at all",3
419,111,Eoin Morgan,24598,James Hopes,5702,"Hopes to Morgan, 2 runs good running again from these two, Morgan whipped it down to fine leg, where a good sliding stop on the boundary could have kept it to one, but he was back in a flash",2nd innings,Paul Collingwood,10772,Steven Smith,267192,18.3,run,84,2,84/3,"Hopes to Morgan, 2 runs",,"good running again from these two, Morgan whipped it down to fine leg, where a good sliding stop on the boundary could have kept it to one, but he was back in a flash",3
420,112,Eoin Morgan,24598,James Hopes,5702,"Hopes to Morgan, no run nothing here, just dabbed into the cover region",2nd innings,Paul Collingwood,10772,Steven Smith,267192,18.4,no run,84,0,84/3,"Hopes to Morgan, no run",,"nothing here, just dabbed into the cover region",3
421,113,Eoin Morgan,24598,James Hopes,5702,"Hopes to Morgan, 1 leg bye once again Morgan looking for the leg-side whip, but can't connect and it thuds off the pads for a single",2nd innings,Paul Collingwood,10772,Steven Smith,267192,18.5,leg bye,85,1,85/3,"Hopes to Morgan, 1 leg bye",,"once again Morgan looking for the leg-side whip, but can't connect and it thuds off the pads for a single",3
422,114,Paul Collingwood,10772,James Hopes,5702,"Hopes to Collingwood, 1 run touch slower from Hopes and Collingwood eases it down to long on for a strike-stealing single",2nd innings,Eoin Morgan,24598,Steven Smith,267192,18.6,run,86,1,86/3,"Hopes to Collingwood, 1 run",,touch slower from Hopes and Collingwood eases it down to long on for a strike-stealing single,3
423,115,Paul Collingwood,10772,Steven Smith,267192,"Smith to Collingwood, FOUR runs Collingwood committed to a sweep very early, but played the shot superbly, picking a gap at fine, fine leg and dabbing it just where he planned for four",2nd innings,Eoin Morgan,24598,James Hopes,5702,19.1,four,90,4,90/3,"Smith to Collingwood, FOUR runs",,"Collingwood committed to a sweep very early, but played the shot superbly, picking a gap at fine, fine leg and dabbing it just where he planned for four",3
424,116,Paul Collingwood,10772,Steven Smith,267192,"Smith to Collingwood, OUT great response from Smith and Collingwood has gone! Top stuff from Smith, but Collingwood looks unlucky here, he pushed forward to defend and the ball rapped him on the front pad, looked outside the line though",2nd innings,Eoin Morgan,24598,James Hopes,5702,19.2,out,90,0,90/4,"Smith to Collingwood, OUT",,"great response from Smith and Collingwood has gone! Top stuff from Smith, but Collingwood looks unlucky here, he pushed forward to defend and the ball rapped him on the front pad, looked outside the line though",4
425,117,Michael Yardy,23523,Steven Smith,267192,"Smith to Yardy, 1 run Yardy starts well enough, pushing into the covers for one",2nd innings,Eoin Morgan,24598,James Hopes,5702,19.3,run,91,1,91/4,"Smith to Yardy, 1 run",,"Yardy starts well enough, pushing into the covers for one",4
426,118,Eoin Morgan,24598,Steven Smith,267192,"Smith to Morgan, FOUR runs well, how about that! Lovely shot from Morgan, stuck his foot outside off stump and flicked it over midwicket for four",2nd innings,Michael Yardy,23523,James Hopes,5702,19.4,four,95,4,95/4,"Smith to Morgan, FOUR runs",,"well, how about that! Lovely shot from Morgan, stuck his foot outside off stump and flicked it over midwicket for four",4
427,119,Eoin Morgan,24598,Steven Smith,267192,"Smith to Morgan, no run this time he plays the shot a touch more circumspectly, working it along the ground",2nd innings,Michael Yardy,23523,James Hopes,5702,19.5,no run,95,0,95/4,"Smith to Morgan, no run",,"this time he plays the shot a touch more circumspectly, working it along the ground",4
428,120,Eoin Morgan,24598,Steven Smith,267192,"Smith to Morgan, 1 run finds the gap this time, picking a single into the leg side to keep the strike",2nd innings,Michael Yardy,23523,James Hopes,5702,19.6,run,96,1,96/4,"Smith to Morgan, 1 run",,"finds the gap this time, picking a single into the leg side to keep the strike",4
429,121,Eoin Morgan,24598,James Hopes,5702,"Hopes to Morgan, no run good stuff from Hopes, maintaining a tight line and Morgan defends",2nd innings,Michael Yardy,23523,Steven Smith,267192,20.1,no run,96,0,96/4,"Hopes to Morgan, no run",,"good stuff from Hopes, maintaining a tight line and Morgan defends",4
430,122,Eoin Morgan,24598,James Hopes,5702,"Hopes to Morgan, 1 run this time Morgan manages to flick it to midwicket for a single",2nd innings,Michael Yardy,23523,Steven Smith,267192,20.2,run,97,1,97/4,"Hopes to Morgan, 1 run",,this time Morgan manages to flick it to midwicket for a single,4
431,123,Michael Yardy,23523,James Hopes,5702,"Hopes to Yardy, no run hopes really marching around busily, which suits his new shaven head, and lands this on middle stump for Yardy to defend",2nd innings,Eoin Morgan,24598,Steven Smith,267192,20.3,no run,97,0,97/4,"Hopes to Yardy, no run",,"hopes really marching around busily, which suits his new shaven head, and lands this on middle stump for Yardy to defend",4
432,124,Michael Yardy,23523,James Hopes,5702,"Hopes to Yardy, no run pushed across the left hander, was there for a cut shot, which Yardy plays, but misses",2nd innings,Eoin Morgan,24598,Steven Smith,267192,20.4,no run,97,0,97/4,"Hopes to Yardy, no run",,"pushed across the left hander, was there for a cut shot, which Yardy plays, but misses",4
433,125,Michael Yardy,23523,James Hopes,5702,"Hopes to Yardy, 1 run Yardy gets another chance to play the shot, and does so, guiding it down the third man for one",2nd innings,Eoin Morgan,24598,Steven Smith,267192,20.5,run,98,1,98/4,"Hopes to Yardy, 1 run",,"Yardy gets another chance to play the shot, and does so, guiding it down the third man for one",4
434,126,Eoin Morgan,24598,James Hopes,5702,"Hopes to Morgan, no run Hopes's military-medium is working well here, on off stump and Morgan can't squeeze a cut shot away",2nd innings,Michael Yardy,23523,Steven Smith,267192,20.6,no run,98,0,98/4,"Hopes to Morgan, no run",,"Hopes's military-medium is working well here, on off stump and Morgan can't squeeze a cut shot away",4
435,127,Michael Yardy,23523,Steven Smith,267192,"Smith to Yardy, FOUR runs nicely played by Yardy, down on one knee and sweeping very crisply backward of square for four to bring up England's hundred",2nd innings,Eoin Morgan,24598,James Hopes,5702,21.1,four,102,4,102/4,"Smith to Yardy, FOUR runs",,"nicely played by Yardy, down on one knee and sweeping very crisply backward of square for four to bring up England's hundred",4
436,128,Michael Yardy,23523,Steven Smith,267192,"Smith to Yardy, 1 run this time it's worked away into the midwicket region for a single",2nd innings,Eoin Morgan,24598,James Hopes,5702,21.2,run,103,1,103/4,"Smith to Yardy, 1 run",,this time it's worked away into the midwicket region for a single,4
437,129,Eoin Morgan,24598,Steven Smith,267192,"Smith to Morgan, 1 run Morgan repeats the dose, nudging a single into the leg side",2nd innings,Michael Yardy,23523,James Hopes,5702,21.3,run,104,1,104/4,"Smith to Morgan, 1 run",,"Morgan repeats the dose, nudging a single into the leg side",4
438,130,Michael Yardy,23523,Steven Smith,267192,"Smith to Yardy, 1 run nicely bowled from Smith, flatter and quicker, Yardy played it very carefully towards mid on for one",2nd innings,Eoin Morgan,24598,James Hopes,5702,21.4,run,105,1,105/4,"Smith to Yardy, 1 run",,"nicely bowled from Smith, flatter and quicker, Yardy played it very carefully towards mid on for one",4
439,131,Eoin Morgan,24598,Steven Smith,267192,"Smith to Morgan, 1 run Morgan keeps England ticking with a gentle push in front of the wicket on the leg side for a  single",2nd innings,Michael Yardy,23523,James Hopes,5702,21.5,run,106,1,106/4,"Smith to Morgan, 1 run",,Morgan keeps England ticking with a gentle push in front of the wicket on the leg side for a  single,4
440,132,Michael Yardy,23523,Steven Smith,267192,"Smith to Yardy, no run nicely bowled, touch of air and thrown up outside off inviting a drive, Yardy obliged and didn't time it",2nd innings,Eoin Morgan,24598,James Hopes,5702,21.6,no run,106,0,106/4,"Smith to Yardy, no run",,"nicely bowled, touch of air and thrown up outside off inviting a drive, Yardy obliged and didn't time it",4
441,133,Eoin Morgan,24598,James Hopes,5702,"Hopes to Morgan, 2 runs good cricket this, more bustling, accurate medium from Hopes, Morgan flicks it in front of square on the leg side to collect a couple",2nd innings,Michael Yardy,23523,Steven Smith,267192,22.1,run,108,2,108/4,"Hopes to Morgan, 2 runs",,"good cricket this, more bustling, accurate medium from Hopes, Morgan flicks it in front of square on the leg side to collect a couple",4
442,134,Eoin Morgan,24598,James Hopes,5702,"Hopes to Morgan, no run this time it's a tighter line and Morgan can only defend",2nd innings,Michael Yardy,23523,Steven Smith,267192,22.2,no run,108,0,108/4,"Hopes to Morgan, no run",,this time it's a tighter line and Morgan can only defend,4
443,135,Eoin Morgan,24598,James Hopes,5702,"Hopes to Morgan, no run Morgan tries to manufacture something here, giving himself some room, but he's hurried on a cut shot and can't time it",2nd innings,Michael Yardy,23523,Steven Smith,267192,22.3,no run,108,0,108/4,"Hopes to Morgan, no run",,"Morgan tries to manufacture something here, giving himself some room, but he's hurried on a cut shot and can't time it",4
444,136,Eoin Morgan,24598,James Hopes,5702,"Hopes to Morgan, no run cracking stuff from Hopes, giving nothing away, Morgan can only defend",2nd innings,Michael Yardy,23523,Steven Smith,267192,22.4,no run,108,0,108/4,"Hopes to Morgan, no run",,"cracking stuff from Hopes, giving nothing away, Morgan can only defend",4
445,137,Eoin Morgan,24598,James Hopes,5702,"Hopes to Morgan, 2 runs ooh, the pressure almost told there, Morgan sliced an airy drive, but it avoided the fielders and he collected a couple to deep cover",2nd innings,Michael Yardy,23523,Steven Smith,267192,22.5,run,110,2,110/4,"Hopes to Morgan, 2 runs",,"ooh, the pressure almost told there, Morgan sliced an airy drive, but it avoided the fielders and he collected a couple to deep cover",4
446,138,Eoin Morgan,24598,James Hopes,5702,"Hopes to Morgan, no run good finish from Hopes, on a length, on a line and Morgan defends",2nd innings,Michael Yardy,23523,Steven Smith,267192,22.6,no run,110,0,110/4,"Hopes to Morgan, no run",,"good finish from Hopes, on a length, on a line and Morgan defends",4
447,139,Michael Yardy,23523,Steven Smith,267192,"Smith to Yardy, 2 runs Yardy will be pleased with this, picking the gap in front of square on the leg side with a crisp sweep to collect a couple",2nd innings,Eoin Morgan,24598,James Hopes,5702,23.1,run,112,2,112/4,"Smith to Yardy, 2 runs",,"Yardy will be pleased with this, picking the gap in front of square on the leg side with a crisp sweep to collect a couple",4
448,140,Michael Yardy,23523,Steven Smith,267192,"Smith to Yardy, 1 run touch short from Smith, in less circumspect times Yardy might have had a swipe at that, here he is content to push for a single to mid on",2nd innings,Eoin Morgan,24598,James Hopes,5702,23.2,run,113,1,113/4,"Smith to Yardy, 1 run",,"touch short from Smith, in less circumspect times Yardy might have had a swipe at that, here he is content to push for a single to mid on",4
449,141,Eoin Morgan,24598,Steven Smith,267192,"Smith to Morgan, no run nothing for Morgan here as he defends quietly off the front foot",2nd innings,Michael Yardy,23523,James Hopes,5702,23.3,no run,113,0,113/4,"Smith to Morgan, no run",,nothing for Morgan here as he defends quietly off the front foot,4
450,142,Eoin Morgan,24598,Steven Smith,267192,"Smith to Morgan, 1 run thrown up well outside off again, Morgan watches it turn and deftly nudges a single",2nd innings,Michael Yardy,23523,James Hopes,5702,23.4,run,114,1,114/4,"Smith to Morgan, 1 run",,"thrown up well outside off again, Morgan watches it turn and deftly nudges a single",4
451,143,Michael Yardy,23523,Steven Smith,267192,"Smith to Yardy, 1 run this time it's spinning down the leg side, Yardy helps it on its way but some swift fielding on the fine leg boundary keeps it to one",2nd innings,Eoin Morgan,24598,James Hopes,5702,23.5,run,115,1,115/4,"Smith to Yardy, 1 run",,"this time it's spinning down the leg side, Yardy helps it on its way but some swift fielding on the fine leg boundary keeps it to one",4
452,144,Eoin Morgan,24598,Steven Smith,267192,"Smith to Morgan, 1 run another single, worked behind square on the leg side",2nd innings,Michael Yardy,23523,James Hopes,5702,23.6,run,116,1,116/4,"Smith to Morgan, 1 run",,"another single, worked behind square on the leg side",4
453,145,Eoin Morgan,24598,James Hopes,5702,"Hopes to Morgan, 1 run Australia really rushing through their overs here, Hopes continues and Morgan flips this behind him for one",2nd innings,Michael Yardy,23523,Steven Smith,267192,24.1,run,117,1,117/4,"Hopes to Morgan, 1 run",,"Australia really rushing through their overs here, Hopes continues and Morgan flips this behind him for one",4
454,146,Michael Yardy,23523,James Hopes,5702,"Hopes to Yardy, 1 run good from Yardy, nothing fancy, just pushing the ball into some space towards mid on for one",2nd innings,Eoin Morgan,24598,Steven Smith,267192,24.2,run,118,1,118/4,"Hopes to Yardy, 1 run",,"good from Yardy, nothing fancy, just pushing the ball into some space towards mid on for one",4
455,147,Eoin Morgan,24598,James Hopes,5702,"Hopes to Morgan, 1 run touch too short, Morgan latched on to a pull shot in a flash, but picked out deep midwicket",2nd innings,Michael Yardy,23523,Steven Smith,267192,24.3,run,119,1,119/4,"Hopes to Morgan, 1 run",,"touch too short, Morgan latched on to a pull shot in a flash, but picked out deep midwicket",4
456,148,Michael Yardy,23523,James Hopes,5702,"Hopes to Yardy, 1 bye nicely bowled from Hopes, a touch slower outside off and Yardy was through his drive too quickly, Paine, standing up to the stumps, couldn't collect cleanly, so they stole a bye",2nd innings,Eoin Morgan,24598,Steven Smith,267192,24.4,bye,120,1,120/4,"Hopes to Yardy, 1 bye",,"nicely bowled from Hopes, a touch slower outside off and Yardy was through his drive too quickly, Paine, standing up to the stumps, couldn't collect cleanly, so they stole a bye",4
457,149,Eoin Morgan,24598,James Hopes,5702,"Hopes to Morgan, 1 run fuller here and Morgan bunted it down the ground for a gentle single",2nd innings,Michael Yardy,23523,Steven Smith,267192,24.5,run,121,1,121/4,"Hopes to Morgan, 1 run",,fuller here and Morgan bunted it down the ground for a gentle single,4
458,150,Michael Yardy,23523,James Hopes,5702,"Hopes to Yardy, 1 run Hopes round the wicket this time, trying to cramp Yardy for room, it works, in a way, but the mistimed cut trickles for a swift single",2nd innings,Eoin Morgan,24598,Steven Smith,267192,24.6,run,122,1,122/4,"Hopes to Yardy, 1 run",,"Hopes round the wicket this time, trying to cramp Yardy for room, it works, in a way, but the mistimed cut trickles for a swift single",4
459,151,Michael Yardy,23523,Doug Bollinger,4508,"Bollinger to Yardy, 1 run almost squeezes through first ball, swinging in a fraction and forcing Yardy to play around his front pad, almost gets through but a touch of wood send it to midwicket for one",2nd innings,Eoin Morgan,24598,James Hopes,5702,25.1,run,123,1,123/4,"Bollinger to Yardy, 1 run",,"almost squeezes through first ball, swinging in a fraction and forcing Yardy to play around his front pad, almost gets through but a touch of wood send it to midwicket for one",4
460,152,Eoin Morgan,24598,Doug Bollinger,4508,"Bollinger to Morgan, no run well, if Morgan has a weakness it could be in that area, just hanging outside off stump and Morgan fences at it",2nd innings,Michael Yardy,23523,James Hopes,5702,25.2,no run,123,0,123/4,"Bollinger to Morgan, no run",,"well, if Morgan has a weakness it could be in that area, just hanging outside off stump and Morgan fences at it",4
461,153,Eoin Morgan,24598,Doug Bollinger,4508,"Bollinger to Morgan, no run much fuller this time, Morgan more comfortable, working it to mid on",2nd innings,Michael Yardy,23523,James Hopes,5702,25.3,no run,123,0,123/4,"Bollinger to Morgan, no run",,"much fuller this time, Morgan more comfortable, working it to mid on",4
462,154,Eoin Morgan,24598,Doug Bollinger,4508,"Bollinger to Morgan, no run oh dear, grubber! Pitched on a decent length and burrowed under Morgan's bat through to Paine",2nd innings,Michael Yardy,23523,James Hopes,5702,25.4,no run,123,0,123/4,"Bollinger to Morgan, no run",,"oh dear, grubber! Pitched on a decent length and burrowed under Morgan's bat through to Paine",4
463,155,Eoin Morgan,24598,Doug Bollinger,4508,"Bollinger to Morgan, 1 run Morgan tells himself to 'watch the ball' as Bollinger runs up, sound advice at any level, he watches it all the way on to his bat and flicks to square leg for one",2nd innings,Michael Yardy,23523,James Hopes,5702,25.5,run,124,1,124/4,"Bollinger to Morgan, 1 run",,"Morgan tells himself to 'watch the ball' as Bollinger runs up, sound advice at any level, he watches it all the way on to his bat and flicks to square leg for one",4
464,156,Michael Yardy,23523,Doug Bollinger,4508,"Bollinger to Yardy, no run Yardy is shuffling all over the place, eventually he ends up in an orthodox position, but duly plays and misses",2nd innings,Eoin Morgan,24598,James Hopes,5702,25.6,no run,124,0,124/4,"Bollinger to Yardy, no run",,"Yardy is shuffling all over the place, eventually he ends up in an orthodox position, but duly plays and misses",4
465,157,Eoin Morgan,24598,James Hopes,5702,"Hopes to Morgan, SIX runs this will help! Morgan planted his front foot down the ground and swung hard across the line, pinging it into the crowds over deep midwicket",2nd innings,Michael Yardy,23523,Doug Bollinger,4508,26.1,six,130,6,130/4,"Hopes to Morgan, SIX runs",,"this will help! Morgan planted his front foot down the ground and swung hard across the line, pinging it into the crowds over deep midwicket",4
466,158,Eoin Morgan,24598,James Hopes,5702,"Hopes to Morgan, SIX runs and again! Even bigger this time, Morgan cleared his front leg and smashed it over a straight midwicket a long, long way",2nd innings,Michael Yardy,23523,Doug Bollinger,4508,26.2,six,136,6,136/4,"Hopes to Morgan, SIX runs",,"and again! Even bigger this time, Morgan cleared his front leg and smashed it over a straight midwicket a long, long way",4
467,159,Eoin Morgan,24598,James Hopes,5702,"Hopes to Morgan, no run slower ball this time, and Morgan mistimes a drive down the ground",2nd innings,Michael Yardy,23523,Doug Bollinger,4508,26.3,no run,136,0,136/4,"Hopes to Morgan, no run",,"slower ball this time, and Morgan mistimes a drive down the ground",4
468,160,Eoin Morgan,24598,James Hopes,5702,"Hopes to Morgan, 1 run this time he collects one, knocking into space",2nd innings,Michael Yardy,23523,Doug Bollinger,4508,26.4,run,137,1,137/4,"Hopes to Morgan, 1 run",,"this time he collects one, knocking into space",4
469,161,Michael Yardy,23523,James Hopes,5702,"Hopes to Yardy, 1 run Yardy leans forward and squirts a defensive prod towards point for a single",2nd innings,Eoin Morgan,24598,Doug Bollinger,4508,26.5,run,138,1,138/4,"Hopes to Yardy, 1 run",,Yardy leans forward and squirts a defensive prod towards point for a single,4
470,162,Eoin Morgan,24598,James Hopes,5702,"Hopes to Morgan, 1 run single to finish the over, pushed into space on the off side",2nd innings,Michael Yardy,23523,Doug Bollinger,4508,26.6,run,139,1,139/4,"Hopes to Morgan, 1 run",,"single to finish the over, pushed into space on the off side",4
471,163,Eoin Morgan,24598,Doug Bollinger,4508,"Bollinger to Morgan, no run plenty of shouts from the fielders as Yardy backed up a long way, Morgan punched into the covers",2nd innings,Michael Yardy,23523,James Hopes,5702,27.1,no run,139,0,139/4,"Bollinger to Morgan, no run",,"plenty of shouts from the fielders as Yardy backed up a long way, Morgan punched into the covers",4
472,164,Eoin Morgan,24598,Doug Bollinger,4508,"Bollinger to Morgan, 1 run neatly done here from Morgan to bring up the 50 stand, pushed to long on for one",2nd innings,Michael Yardy,23523,James Hopes,5702,27.2,run,140,1,140/4,"Bollinger to Morgan, 1 run",,"neatly done here from Morgan to bring up the 50 stand, pushed to long on for one",4
