,ball,batsman,batsman_id,bowler,bowler_id,commentary,innings,otherBatsman,otherBatsman_id,otherBowler,otherBowler_id,overs,playType,runs,runs_scored,score,shortText,speed,text,wickets
261,259,Jean-Paul Duminy,44932,Shahid Afridi,42639,"Shahid Afridi to Duminy, 1 run tossed up on the off, pushed down towards long-on for a single",1st innings,Colin Ingram,45705,Shoaib Akhtar,42655,43.1,run,209,1,209/4,"Shahid Afridi to Duminy, 1 run",,"tossed up on the off, pushed down towards long-on for a single",4
262,260,Colin Ingram,45705,Shahid Afridi,42639,"Shahid Afridi to Ingram, 1 run <b>dropped</b>, that was the offspinner, Ingram made room to cut, got a thick edge but Haider couldn't snap it behind the stumps",1st innings,Jean-Paul Duminy,44932,Shoaib Akhtar,42655,43.2,run,210,1,210/4,"Shahid Afridi to Ingram, 1 run",,"<b>dropped</b>, that was the offspinner, Ingram made room to cut, got a thick edge but Haider couldn't snap it behind the stumps",4
263,260,Jean-Paul Duminy,44932,Shahid Afridi,42639,"Shahid Afridi to Duminy, 1 wide fires it down the leg side and it's called a wide, Duminy misses the sweep",1st innings,Colin Ingram,45705,Shoaib Akhtar,42655,43.2,wide,211,1,211/4,"Shahid Afridi to Duminy, 1 wide",,"fires it down the leg side and it's called a wide, Duminy misses the sweep",4
264,261,Jean-Paul Duminy,44932,Shahid Afridi,42639,"Shahid Afridi to Duminy, no run the offspinner again and beats the batsman completely as it shoots away from middle to beat the outside edge",1st innings,Colin Ingram,45705,Shoaib Akhtar,42655,43.3,no run,211,0,211/4,"Shahid Afridi to Duminy, no run",,the offspinner again and beats the batsman completely as it shoots away from middle to beat the outside edge,4
265,262,Jean-Paul Duminy,44932,Shahid Afridi,42639,"Shahid Afridi to Duminy, 1 run the offspinner again, is pushed away into the off side",1st innings,Colin Ingram,45705,Shoaib Akhtar,42655,43.4,run,212,1,212/4,"Shahid Afridi to Duminy, 1 run",,"the offspinner again, is pushed away into the off side",4
266,263,Colin Ingram,45705,Shahid Afridi,42639,"Shahid Afridi to Ingram, FOUR runs a quicker delivery down the leg side and Ingram goes for the sweep, catches the glove to beat the keeper and short fine leg for a boundary",1st innings,Jean-Paul Duminy,44932,Shoaib Akhtar,42655,43.5,four,216,4,216/4,"Shahid Afridi to Ingram, FOUR runs",,"a quicker delivery down the leg side and Ingram goes for the sweep, catches the glove to beat the keeper and short fine leg for a boundary",4
267,264,Colin Ingram,45705,Shahid Afridi,42639,"Shahid Afridi to Ingram, 1 run short outside off, slashes hard, gets a lot of elevation on it but not the intended direction, just the single towards deep cover",1st innings,Jean-Paul Duminy,44932,Shoaib Akhtar,42655,43.6,run,217,1,217/4,"Shahid Afridi to Ingram, 1 run",,"short outside off, slashes hard, gets a lot of elevation on it but not the intended direction, just the single towards deep cover",4
268,265,Colin Ingram,45705,Wahab Riaz,43590,"Wahab Riaz to Ingram, no run full outside off, moves across to thwack it into the leg side, misses and it goes through to the keeper",1st innings,Jean-Paul Duminy,44932,Shahid Afridi,42639,44.1,no run,217,0,217/4,"Wahab Riaz to Ingram, no run",,"full outside off, moves across to thwack it into the leg side, misses and it goes through to the keeper",4
269,266,Colin Ingram,45705,Wahab Riaz,43590,"Wahab Riaz to Ingram, no run yorker length, just missed leg stump, through Ingram as he tries to crack it through midwicket, can't connect",1st innings,Jean-Paul Duminy,44932,Shahid Afridi,42639,44.2,no run,217,0,217/4,"Wahab Riaz to Ingram, no run",,"yorker length, just missed leg stump, through Ingram as he tries to crack it through midwicket, can't connect",4
270,267,Colin Ingram,45705,Wahab Riaz,43590,"Wahab Riaz to Ingram, 1 run slower one bowled short outside off, punched off the back foot to extra cover, <B>direct hit from Younis Khan</b> and it's referred, replays show Ingram has just made it in",1st innings,Jean-Paul Duminy,44932,Shahid Afridi,42639,44.3,run,218,1,218/4,"Wahab Riaz to Ingram, 1 run",,"slower one bowled short outside off, punched off the back foot to extra cover, <B>direct hit from Younis Khan</b> and it's referred, replays show Ingram has just made it in",4
271,268,Jean-Paul Duminy,44932,Wahab Riaz,43590,"Wahab Riaz to Duminy, 1 run pitched it up outside off, mistimes a drive and plays it to point",1st innings,Colin Ingram,45705,Shahid Afridi,42639,44.4,run,219,1,219/4,"Wahab Riaz to Duminy, 1 run",,"pitched it up outside off, mistimes a drive and plays it to point",4
272,269,Colin Ingram,45705,Wahab Riaz,43590,"Wahab Riaz to Ingram, no run lands on a good length outside off, made room to carve that over the in-field on the off side, missed out",1st innings,Jean-Paul Duminy,44932,Shahid Afridi,42639,44.5,no run,219,0,219/4,"Wahab Riaz to Ingram, no run",,"lands on a good length outside off, made room to carve that over the in-field on the off side, missed out",4
273,270,Colin Ingram,45705,Wahab Riaz,43590,"Wahab Riaz to Ingram, 1 run lands on a good length outside off, drags it towards deep square leg, just the single, a tight over from Riaz",1st innings,Jean-Paul Duminy,44932,Shahid Afridi,42639,44.6,run,220,1,220/4,"Wahab Riaz to Ingram, 1 run",,"lands on a good length outside off, drags it towards deep square leg, just the single, a tight over from Riaz",4
274,271,Colin Ingram,45705,Mohammad Hafeez,41434,"Mohammad Hafeez to Ingram, 1 run in the blockhole outside off, digs it out behind point who dives to his right to keep  them down to one",1st innings,Jean-Paul Duminy,44932,Wahab Riaz,43590,45.1,run,221,1,221/4,"Mohammad Hafeez to Ingram, 1 run",,"in the blockhole outside off, digs it out behind point who dives to his right to keep  them down to one",4
275,272,Jean-Paul Duminy,44932,Mohammad Hafeez,41434,"Mohammad Hafeez to Duminy, 2 runs well placed, pushed into the leg side well wide of the bowler, Hafeez has to run back and haul it in, they've had enough time to complete the second",1st innings,Colin Ingram,45705,Wahab Riaz,43590,45.2,run,223,2,223/4,"Mohammad Hafeez to Duminy, 2 runs",,"well placed, pushed into the leg side well wide of the bowler, Hafeez has to run back and haul it in, they've had enough time to complete the second",4
276,273,Jean-Paul Duminy,44932,Mohammad Hafeez,41434,"Mohammad Hafeez to Duminy, 1 run short of a length on the off, cut just wide of point for a quick single",1st innings,Colin Ingram,45705,Wahab Riaz,43590,45.3,run,224,1,224/4,"Mohammad Hafeez to Duminy, 1 run",,"short of a length on the off, cut just wide of point for a quick single",4
277,274,Colin Ingram,45705,Mohammad Hafeez,41434,"Mohammad Hafeez to Ingram, 1 run <b>dropped</b>, Pakistan haven't been great in the field today, short and it's pulled straight to deep midwicket and Farhat spills a sitter",1st innings,Jean-Paul Duminy,44932,Wahab Riaz,43590,45.4,run,225,1,225/4,"Mohammad Hafeez to Ingram, 1 run",,"<b>dropped</b>, Pakistan haven't been great in the field today, short and it's pulled straight to deep midwicket and Farhat spills a sitter",4
278,275,Jean-Paul Duminy,44932,Mohammad Hafeez,41434,"Mohammad Hafeez to Duminy, no run quicker ball on middle and leg, played back to the bowler",1st innings,Colin Ingram,45705,Wahab Riaz,43590,45.5,no run,225,0,225/4,"Mohammad Hafeez to Duminy, no run",,"quicker ball on middle and leg, played back to the bowler",4
279,276,Jean-Paul Duminy,44932,Mohammad Hafeez,41434,"Mohammad Hafeez to Duminy, 1 run short on the off, punched off the back foot to extra cover on the edge of the circle, single taken",1st innings,Colin Ingram,45705,Wahab Riaz,43590,45.6,run,226,1,226/4,"Mohammad Hafeez to Duminy, 1 run",,"short on the off, punched off the back foot to extra cover on the edge of the circle, single taken",4
280,277,Jean-Paul Duminy,44932,Wahab Riaz,43590,"Wahab Riaz to Duminy, OUT bowled'im. Yorker on middle and leg, Duminy made room and wanted to swing it over midwicket, swung hard but missed and the stumps took a beating",1st innings,Colin Ingram,45705,Mohammad Hafeez,41434,46.1,out,226,0,226/5,"Wahab Riaz to Duminy, OUT",,"bowled'im. Yorker on middle and leg, Duminy made room and wanted to swing it over midwicket, swung hard but missed and the stumps took a beating",5
281,278,David Miller,321777,Wahab Riaz,43590,"Wahab Riaz to Miller, OUT two in two, lovely bowling, on a hat-trick now, the inswinging yorker and Miller can't dig it out, a nightmare of a ball to receive first up and he can't negotiate it, Pakistan, again, have clawed back",1st innings,Colin Ingram,45705,Mohammad Hafeez,41434,46.2,out,226,0,226/6,"Wahab Riaz to Miller, OUT",,"two in two, lovely bowling, on a hat-trick now, the inswinging yorker and Miller can't dig it out, a nightmare of a ball to receive first up and he can't negotiate it, Pakistan, again, have clawed back",6
282,279,Johan Botha,44149,Wahab Riaz,43590,"Wahab Riaz to Botha, no run yorker again, but it's dug out, just a fraction outside off and it's played wide of midwicket, survives",1st innings,Colin Ingram,45705,Mohammad Hafeez,41434,46.3,no run,226,0,226/6,"Wahab Riaz to Botha, no run",,"yorker again, but it's dug out, just a fraction outside off and it's played wide of midwicket, survives",6
283,280,Johan Botha,44149,Wahab Riaz,43590,"Wahab Riaz to Botha, FOUR runs four, short and wide and he slashes hard, gets a thick outside edge over slip for a one bounce four",1st innings,Colin Ingram,45705,Mohammad Hafeez,41434,46.4,four,230,4,230/6,"Wahab Riaz to Botha, FOUR runs",,"four, short and wide and he slashes hard, gets a thick outside edge over slip for a one bounce four",6
284,281,Johan Botha,44149,Wahab Riaz,43590,"Wahab Riaz to Botha, FOUR runs Botha doing his bit here, full toss, attempting another yorker but couldn't quite get it right this time, punched hard past extra cover and the fielder in the deep dives valiantly but can't get to it",1st innings,Colin Ingram,45705,Mohammad Hafeez,41434,46.5,four,234,4,234/6,"Wahab Riaz to Botha, FOUR runs",,"Botha doing his bit here, full toss, attempting another yorker but couldn't quite get it right this time, punched hard past extra cover and the fielder in the deep dives valiantly but can't get to it",6
285,282,Johan Botha,44149,Wahab Riaz,43590,"Wahab Riaz to Botha, 1 run full on middle, driven back hard but the bowler kicks it away, just the single wide of square leg, a slightly expensive over but two wickets more than make up for it",1st innings,Colin Ingram,45705,Mohammad Hafeez,41434,46.6,run,235,1,235/6,"Wahab Riaz to Botha, 1 run",,"full on middle, driven back hard but the bowler kicks it away, just the single wide of square leg, a slightly expensive over but two wickets more than make up for it",6
286,283,Johan Botha,44149,Mohammad Hafeez,41434,"Mohammad Hafeez to Botha, FOUR runs shot, had made his mind up, Hafeez pushed it full on middle and Botha reverse-swept it hard over point for a one bounce four, he's stepping up here",1st innings,Colin Ingram,45705,Wahab Riaz,43590,47.1,four,239,4,239/6,"Mohammad Hafeez to Botha, FOUR runs",,"shot, had made his mind up, Hafeez pushed it full on middle and Botha reverse-swept it hard over point for a one bounce four, he's stepping up here",6
287,284,Johan Botha,44149,Mohammad Hafeez,41434,"Mohammad Hafeez to Botha, no run down the leg side but not given a wide because Botha tried playing the reverse-sweep again",1st innings,Colin Ingram,45705,Wahab Riaz,43590,47.2,no run,239,0,239/6,"Mohammad Hafeez to Botha, no run",,down the leg side but not given a wide because Botha tried playing the reverse-sweep again,6
288,285,Johan Botha,44149,Mohammad Hafeez,41434,"Mohammad Hafeez to Botha, FOUR runs another four, pushed it quick but Botha's committed to the reverse-sweep and places it perfectly past point",1st innings,Colin Ingram,45705,Wahab Riaz,43590,47.3,four,243,4,243/6,"Mohammad Hafeez to Botha, FOUR runs",,"another four, pushed it quick but Botha's committed to the reverse-sweep and places it perfectly past point",6
289,286,Johan Botha,44149,Mohammad Hafeez,41434,"Mohammad Hafeez to Botha, 1 run short on middle, rocks back and pulls it down to deep square leg for a single",1st innings,Colin Ingram,45705,Wahab Riaz,43590,47.4,run,244,1,244/6,"Mohammad Hafeez to Botha, 1 run",,"short on middle, rocks back and pulls it down to deep square leg for a single",6
290,287,Colin Ingram,45705,Mohammad Hafeez,41434,"Mohammad Hafeez to Ingram, 1 run tossed up on the off, makes room and cracks it wide of Afridi at extra cover, he slides to his right and keeps them down to a single",1st innings,Johan Botha,44149,Wahab Riaz,43590,47.5,run,245,1,245/6,"Mohammad Hafeez to Ingram, 1 run",,"tossed up on the off, makes room and cracks it wide of Afridi at extra cover, he slides to his right and keeps them down to a single",6
291,288,Johan Botha,44149,Mohammad Hafeez,41434,"Mohammad Hafeez to Botha, no run fires it wide of off stump, Botha wants to reverse-paddle that but it was bowled a touch too quick and he missed the bus",1st innings,Colin Ingram,45705,Wahab Riaz,43590,47.6,no run,245,0,245/6,"Mohammad Hafeez to Botha, no run",,"fires it wide of off stump, Botha wants to reverse-paddle that but it was bowled a touch too quick and he missed the bus",6
292,289,Colin Ingram,45705,Wahab Riaz,43590,"Wahab Riaz to Ingram, FOUR runs aiming for the yorker but went wrong, full toss and Ingram tonks him over mid-off for an easy boundary, the field is up and it's as bad a ball that he can  bowl",1st innings,Johan Botha,44149,Mohammad Hafeez,41434,48.1,four,249,4,249/6,"Wahab Riaz to Ingram, FOUR runs",,"aiming for the yorker but went wrong, full toss and Ingram tonks him over mid-off for an easy boundary, the field is up and it's as bad a ball that he can  bowl",6
293,290,Colin Ingram,45705,Wahab Riaz,43590,"Wahab Riaz to Ingram, 1 leg bye missed out this time, an inswinging full toss, tries to smack it through midwicket but missed and was struck on the pad, a leg bye is all he'll get, 250 up",1st innings,Johan Botha,44149,Mohammad Hafeez,41434,48.2,leg bye,250,1,250/6,"Wahab Riaz to Ingram, 1 leg bye",,"missed out this time, an inswinging full toss, tries to smack it through midwicket but missed and was struck on the pad, a leg bye is all he'll get, 250 up",6
294,291,Johan Botha,44149,Wahab Riaz,43590,"Wahab Riaz to Botha, FOUR runs lovely paddle, pre-meditated, full on the off stump, moved his front foot across and Marilliered it over short fine for a one bounce four, almost went all the way, what a wonderful cameo this is",1st innings,Colin Ingram,45705,Mohammad Hafeez,41434,48.3,four,254,4,254/6,"Wahab Riaz to Botha, FOUR runs",,"lovely paddle, pre-meditated, full on the off stump, moved his front foot across and Marilliered it over short fine for a one bounce four, almost went all the way, what a wonderful cameo this is",6
295,292,Johan Botha,44149,Wahab Riaz,43590,"Wahab Riaz to Botha, 1 leg bye swinging in, lands on a length, tries to force it through midwicket, is struck on the pads, gets a leg bye",1st innings,Colin Ingram,45705,Mohammad Hafeez,41434,48.4,leg bye,255,1,255/6,"Wahab Riaz to Botha, 1 leg bye",,"swinging in, lands on a length, tries to force it through midwicket, is struck on the pads, gets a leg bye",6
296,292,Colin Ingram,45705,Wahab Riaz,43590,"Wahab Riaz to Ingram, (no ball) 2 runs called a no-ball for height, was over the waist and Ingram mistimed a pull wide of deep midwicket, a couple of runs",1st innings,Johan Botha,44149,Mohammad Hafeez,41434,48.4,run,258,3,258/6,"Wahab Riaz to Ingram, (no ball) 2 runs",,"called a no-ball for height, was over the waist and Ingram mistimed a pull wide of deep midwicket, a couple of runs",6
297,293,Colin Ingram,45705,Wahab Riaz,43590,"Wahab Riaz to Ingram, 1 run another full toss, tries a shot similar to the one he played earlier in the over, aiming to cart it over mid-off but mistimes it this time, just the single",1st innings,Johan Botha,44149,Mohammad Hafeez,41434,48.5,run,259,1,259/6,"Wahab Riaz to Ingram, 1 run",,"another full toss, tries a shot similar to the one he played earlier in the over, aiming to cart it over mid-off but mistimes it this time, just the single",6
298,294,Johan Botha,44149,Wahab Riaz,43590,"Wahab Riaz to Botha, FOUR runs Botha's toying with the bowling here, Riaz's yorker have disappeared, he's not able to get them through and South Africa are cashing in on the full tosses, a low full toss outside off and out comes the paddle again, over short fine for four more",1st innings,Colin Ingram,45705,Mohammad Hafeez,41434,48.6,four,263,4,263/6,"Wahab Riaz to Botha, FOUR runs",,"Botha's toying with the bowling here, Riaz's yorker have disappeared, he's not able to get them through and South Africa are cashing in on the full tosses, a low full toss outside off and out comes the paddle again, over short fine for four more",6
299,295,Colin Ingram,45705,Shoaib Akhtar,42655,"Shoaib Akhtar to Ingram, 1 run yorker first up, digs it out towards point for a single",1st innings,Johan Botha,44149,Wahab Riaz,43590,49.1,run,264,1,264/6,"Shoaib Akhtar to Ingram, 1 run",,"yorker first up, digs it out towards point for a single",6
300,296,Johan Botha,44149,Shoaib Akhtar,42655,"Shoaib Akhtar to Botha, no run almost bowled, inswinging yorker, made too much room did Botha and couldn't quite reach it in the end, didn't miss the off stump by much",1st innings,Colin Ingram,45705,Wahab Riaz,43590,49.2,no run,264,0,264/6,"Shoaib Akhtar to Botha, no run",,"almost bowled, inswinging yorker, made too much room did Botha and couldn't quite reach it in the end, didn't miss the off stump by much",6
301,297,Johan Botha,44149,Shoaib Akhtar,42655,"Shoaib Akhtar to Botha, 1 run full outside off and tries to thwack that through the covers, driven straight to extra cover, just the single",1st innings,Colin Ingram,45705,Wahab Riaz,43590,49.3,run,265,1,265/6,"Shoaib Akhtar to Botha, 1 run",,"full outside off and tries to thwack that through the covers, driven straight to extra cover, just the single",6
302,298,Colin Ingram,45705,Shoaib Akhtar,42655,"Shoaib Akhtar to Ingram, 1 run superb yorker on middle, not much Ingram can do, dabs it towards point for a single",1st innings,Johan Botha,44149,Wahab Riaz,43590,49.4,run,266,1,266/6,"Shoaib Akhtar to Ingram, 1 run",,"superb yorker on middle, not much Ingram can do, dabs it towards point for a single",6
303,298,Johan Botha,44149,Shoaib Akhtar,42655,"Shoaib Akhtar to Botha, 3 wides too wide, called one by the umpire, they steal a bye and Haider's throw has no one to back up, another run, three in all",1st innings,Colin Ingram,45705,Wahab Riaz,43590,49.4,wide,269,3,269/6,"Shoaib Akhtar to Botha, 3 wides",,"too wide, called one by the umpire, they steal a bye and Haider's throw has no one to back up, another run, three in all",6
304,299,Johan Botha,44149,Shoaib Akhtar,42655,"Shoaib Akhtar to Botha, 1 run another yorker, made room and respectfully dropped that in front of point for a single",1st innings,Colin Ingram,45705,Wahab Riaz,43590,49.5,run,270,1,270/6,"Shoaib Akhtar to Botha, 1 run",,"another yorker, made room and respectfully dropped that in front of point for a single",6
305,300,Colin Ingram,45705,Shoaib Akhtar,42655,"Shoaib Akhtar to Ingram, FOUR runs aiming for another yorker but can't get it right this time, full toss that is thumped over the covers for a boundary",1st innings,Johan Botha,44149,Wahab Riaz,43590,49.6,four,274,4,274/6,"Shoaib Akhtar to Ingram, FOUR runs",,"aiming for another yorker but can't get it right this time, full toss that is thumped over the covers for a boundary",6
306,1,Imran Farhat,40582,Morne Morkel,46538,"Morkel to Imran Farhat, 2 runs short of a length on the hip and neatly worked out through square leg...it's important to make the most of the hard, new ball both for the batsmen and bowlers",2nd innings,Mohammad Hafeez,41434,,,0.1,run,2,2,2/0,"Morkel to Imran Farhat, 2 runs",,"short of a length on the hip and neatly worked out through square leg...it's important to make the most of the hard, new ball both for the batsmen and bowlers",0
307,2,Imran Farhat,40582,Morne Morkel,46538,"Morkel to Imran Farhat, 1 leg bye on leg stump again, takes the pad this time towards fine leg",2nd innings,Mohammad Hafeez,41434,,,0.2,leg bye,3,1,3/0,"Morkel to Imran Farhat, 1 leg bye",,"on leg stump again, takes the pad this time towards fine leg",0
308,3,Mohammad Hafeez,41434,Morne Morkel,46538,"Morkel to Mohammad Hafeez, no run well bowled, but a poor shot, as this one is full outside off but Hafeez plays a half-hearted drive and gets beaten",2nd innings,Imran Farhat,40582,,,0.3,no run,3,0,3/0,"Morkel to Mohammad Hafeez, no run",,"well bowled, but a poor shot, as this one is full outside off but Hafeez plays a half-hearted drive and gets beaten",0
309,4,Mohammad Hafeez,41434,Morne Morkel,46538,"Morkel to Mohammad Hafeez, 2 runs makes good connection this time, it's on off stump and he leans into a strong drive which finds its way through the cover ring...but the outfield is fairly heavy and the ball slows up",2nd innings,Imran Farhat,40582,,,0.4,run,5,2,5/0,"Morkel to Mohammad Hafeez, 2 runs",,"makes good connection this time, it's on off stump and he leans into a strong drive which finds its way through the cover ring...but the outfield is fairly heavy and the ball slows up",0
310,5,Mohammad Hafeez,41434,Morne Morkel,46538,"Morkel to Mohammad Hafeez, 1 run finds the outside edge as he pushes off the back foot and it flew through a fine gully position down to third man",2nd innings,Imran Farhat,40582,,,0.5,run,6,1,6/0,"Morkel to Mohammad Hafeez, 1 run",,finds the outside edge as he pushes off the back foot and it flew through a fine gully position down to third man,0
311,6,Imran Farhat,40582,Morne Morkel,46538,"Morkel to Imran Farhat, OUT gone! Early breakthrough. Morkel goes round the wicket and the plan pays off as this full delivery catches Farhat flat-footed on the crease. He tried to drive, but didn't make contact and was taken in front of off stump",2nd innings,Mohammad Hafeez,41434,,,0.6,out,6,0,6/1,"Morkel to Imran Farhat, OUT",,"gone! Early breakthrough. Morkel goes round the wicket and the plan pays off as this full delivery catches Farhat flat-footed on the crease. He tried to drive, but didn't make contact and was taken in front of off stump",1
312,7,Mohammad Hafeez,41434,Wayne Parnell,265564,"Parnell to Mohammad Hafeez, 3 runs carved in the air just over backward point, not far away from a catch, and it races towards third man where Morkel makes a good save",2nd innings,Younis Khan,43652,Morne Morkel,46538,1.1,run,9,3,9/1,"Parnell to Mohammad Hafeez, 3 runs",,"carved in the air just over backward point, not far away from a catch, and it races towards third man where Morkel makes a good save",1
313,8,Younis Khan,43652,Wayne Parnell,265564,"Parnell to Younis Khan, no run outside off stump, comes forward with bat and pad together and defends to cover",2nd innings,Mohammad Hafeez,41434,Morne Morkel,46538,1.2,no run,9,0,9/1,"Parnell to Younis Khan, no run",,"outside off stump, comes forward with bat and pad together and defends to cover",1
314,9,Younis Khan,43652,Wayne Parnell,265564,"Parnell to Younis Khan, no run defended to cover again",2nd innings,Mohammad Hafeez,41434,Morne Morkel,46538,1.3,no run,9,0,9/1,"Parnell to Younis Khan, no run",,defended to cover again,1
315,10,Younis Khan,43652,Wayne Parnell,265564,"Parnell to Younis Khan, 3 runs more excellent fielding, this time from Graeme Smith, as he chases this drive out to the cover boundary and saves a run",2nd innings,Mohammad Hafeez,41434,Morne Morkel,46538,1.4,run,12,3,12/1,"Parnell to Younis Khan, 3 runs",,"more excellent fielding, this time from Graeme Smith, as he chases this drive out to the cover boundary and saves a run",1
316,11,Mohammad Hafeez,41434,Wayne Parnell,265564,"Parnell to Mohammad Hafeez, 1 run a slower ball which is punched up to mid-off",2nd innings,Younis Khan,43652,Morne Morkel,46538,1.5,run,13,1,13/1,"Parnell to Mohammad Hafeez, 1 run",,a slower ball which is punched up to mid-off,1
317,12,Younis Khan,43652,Wayne Parnell,265564,"Parnell to Younis Khan, 2 runs lucky! He comes forward and gets an inside edge past the stumps which shoots towards fine leg where there's another sprawling South African fielding to stop a boundary",2nd innings,Mohammad Hafeez,41434,Morne Morkel,46538,1.6,run,15,2,15/1,"Parnell to Younis Khan, 2 runs",,lucky! He comes forward and gets an inside edge past the stumps which shoots towards fine leg where there's another sprawling South African fielding to stop a boundary,1
318,13,Mohammad Hafeez,41434,Morne Morkel,46538,"Morkel to Mohammad Hafeez, no run full on the stumps and worked out to square leg",2nd innings,Younis Khan,43652,Wayne Parnell,265564,2.1,no run,15,0,15/1,"Morkel to Mohammad Hafeez, no run",,full on the stumps and worked out to square leg,1
319,14,Mohammad Hafeez,41434,Morne Morkel,46538,"Morkel to Mohammad Hafeez, 3 runs flicked in the air but beautifully timed through midwicket...again, though, the outfield plays a part in preventing a boundary",2nd innings,Younis Khan,43652,Wayne Parnell,265564,2.2,run,18,3,18/1,"Morkel to Mohammad Hafeez, 3 runs",,"flicked in the air but beautifully timed through midwicket...again, though, the outfield plays a part in preventing a boundary",1
320,15,Younis Khan,43652,Morne Morkel,46538,"Morkel to Younis Khan, no run very full at the stumps and Younis drives it down to mid-off",2nd innings,Mohammad Hafeez,41434,Wayne Parnell,265564,2.3,no run,18,0,18/1,"Morkel to Younis Khan, no run",,very full at the stumps and Younis drives it down to mid-off,1
