,ball,batsman,batsman_id,bowler,bowler_id,commentary,innings,otherBatsman,otherBatsman_id,otherBowler,otherBowler_id,overs,playType,runs,runs_scored,score,shortText,speed,text,wickets
0,1,Graeme Smith,47270,Shoaib Akhtar,42655,"Shoaib Akhtar to Smith, 1 run tries to rap him on the gloves there, banged in short on middle, Smith moved back, closed the face and turned it behind square for a single",1st innings,Hashim Amla,43906,,,0.1,run,1,1,1/0,"Shoaib Akhtar to Smith, 1 run",,"tries to rap him on the gloves there, banged in short on middle, Smith moved back, closed the face and turned it behind square for a single",0
1,2,Hashim Amla,43906,Shoaib Akhtar,42655,"Shoaib Akhtar to Amla, no run short of a good length on the off, gets on the back foot and cracks it towards point with an open face, bowled at 146.2 kph",1st innings,Graeme Smith,47270,,,0.2,no run,1,0,1/0,"Shoaib Akhtar to Amla, no run",,"short of a good length on the off, gets on the back foot and cracks it towards point with an open face, bowled at 146.2 kph",0
2,3,Hashim Amla,43906,Shoaib Akhtar,42655,"Shoaib Akhtar to Amla, 1 run hitting the bat hard is the man, bowled beautifully in the last game, was deceptive with his slower deliveries, this one's hit the pitch hard, jumps up from middle and is punched into the off side for a quick single",1st innings,Graeme Smith,47270,,,0.3,run,2,1,2/0,"Shoaib Akhtar to Amla, 1 run",,"hitting the bat hard is the man, bowled beautifully in the last game, was deceptive with his slower deliveries, this one's hit the pitch hard, jumps up from middle and is punched into the off side for a quick single",0
3,4,Graeme Smith,47270,Shoaib Akhtar,42655,"Shoaib Akhtar to Smith, no run short of a good length on leg stump, pushes it with a straight bat towards a widish mid-on",1st innings,Hashim Amla,43906,,,0.4,no run,2,0,2/0,"Shoaib Akhtar to Smith, no run",,"short of a good length on leg stump, pushes it with a straight bat towards a widish mid-on",0
4,5,Graeme Smith,47270,Shoaib Akhtar,42655,"Shoaib Akhtar to Smith, no run short of a good length again, no movement yet, no swing at all, holds its line, defended solidly in the direction of cover",1st innings,Hashim Amla,43906,,,0.5,no run,2,0,2/0,"Shoaib Akhtar to Smith, no run",,"short of a good length again, no movement yet, no swing at all, holds its line, defended solidly in the direction of cover",0
5,6,Graeme Smith,47270,Shoaib Akhtar,42655,"Shoaib Akhtar to Smith, no run strikes him on the thigh as he tries to whip it square, lands outside leg, rolls towards point, good start by Shoaib",1st innings,Hashim Amla,43906,,,0.6,no run,2,0,2/0,"Shoaib Akhtar to Smith, no run",,"strikes him on the thigh as he tries to whip it square, lands outside leg, rolls towards point, good start by Shoaib",0
6,7,Hashim Amla,43906,Abdul Razzaq,39836,"Abdul Razzaq to Amla, 1 run gentle medium to begin with, 124.9 kmph, lands on a good length on middle, pushed wide of mid-on for a single",1st innings,Graeme Smith,47270,Shoaib Akhtar,42655,1.1,run,3,1,3/0,"Abdul Razzaq to Amla, 1 run",,"gentle medium to begin with, 124.9 kmph, lands on a good length on middle, pushed wide of mid-on for a single",0
7,8,Graeme Smith,47270,Abdul Razzaq,39836,"Abdul Razzaq to Smith, no run just a hint of inward movement there, drew him forward with a good length delivery and nipped back in just as he reached to push that towards mid-off",1st innings,Hashim Amla,43906,Shoaib Akhtar,42655,1.2,no run,3,0,3/0,"Abdul Razzaq to Smith, no run",,"just a hint of inward movement there, drew him forward with a good length delivery and nipped back in just as he reached to push that towards mid-off",0
8,9,Graeme Smith,47270,Abdul Razzaq,39836,"Abdul Razzaq to Smith, FOUR runs shot, short of a good length, stands tall and crunches it between point and cover for the game's first boundary, opened the face and cracked it square",1st innings,Hashim Amla,43906,Shoaib Akhtar,42655,1.3,four,7,4,7/0,"Abdul Razzaq to Smith, FOUR runs",,"shot, short of a good length, stands tall and crunches it between point and cover for the game's first boundary, opened the face and cracked it square",0
9,10,Graeme Smith,47270,Abdul Razzaq,39836,"Abdul Razzaq to Smith, no run maintaining that length, takes a couple of steps forward on the pitch and dabs him towards point",1st innings,Hashim Amla,43906,Shoaib Akhtar,42655,1.4,no run,7,0,7/0,"Abdul Razzaq to Smith, no run",,"maintaining that length, takes a couple of steps forward on the pitch and dabs him towards point",0
10,11,Graeme Smith,47270,Abdul Razzaq,39836,"Abdul Razzaq to Smith, 2 runs the bounce is true on this pitch, landed short outside off and he pulled it slightly uppishly between midwicket and mid-on for a brace",1st innings,Hashim Amla,43906,Shoaib Akhtar,42655,1.5,run,9,2,9/0,"Abdul Razzaq to Smith, 2 runs",,"the bounce is true on this pitch, landed short outside off and he pulled it slightly uppishly between midwicket and mid-on for a brace",0
11,12,Graeme Smith,47270,Abdul Razzaq,39836,"Abdul Razzaq to Smith, 1 run just one slip and that was edged, would have been well wide of second as well, wanted to drive that on the up through the off side, rolls down towards third man for a single",1st innings,Hashim Amla,43906,Shoaib Akhtar,42655,1.6,run,10,1,10/0,"Abdul Razzaq to Smith, 1 run",,"just one slip and that was edged, would have been well wide of second as well, wanted to drive that on the up through the off side, rolls down towards third man for a single",0
12,13,Graeme Smith,47270,Shoaib Akhtar,42655,"Shoaib Akhtar to Smith, 1 bye the slower one again, cut away, bowled at 123 kmph, landed on middle and Smith played it too early, nipped away past the outside edge deceiving even the wicketkeeper who conceded a bye",1st innings,Hashim Amla,43906,Abdul Razzaq,39836,2.1,bye,11,1,11/0,"Shoaib Akhtar to Smith, 1 bye",,"the slower one again, cut away, bowled at 123 kmph, landed on middle and Smith played it too early, nipped away past the outside edge deceiving even the wicketkeeper who conceded a bye",0
13,14,Hashim Amla,43906,Shoaib Akhtar,42655,"Shoaib Akhtar to Amla, no run short on the off, rose up and he was in a good position to play the pull but didn't time it well enough, straight to mid-on",1st innings,Graeme Smith,47270,Abdul Razzaq,39836,2.2,no run,11,0,11/0,"Shoaib Akhtar to Amla, no run",,"short on the off, rose up and he was in a good position to play the pull but didn't time it well enough, straight to mid-on",0
14,15,Hashim Amla,43906,Shoaib Akhtar,42655,"Shoaib Akhtar to Amla, no run nipped back in from a good length outside off, Amla was cramped there, knocked it down on the pitch, it bounced back into his pads",1st innings,Graeme Smith,47270,Abdul Razzaq,39836,2.3,no run,11,0,11/0,"Shoaib Akhtar to Amla, no run",,"nipped back in from a good length outside off, Amla was cramped there, knocked it down on the pitch, it bounced back into his pads",0
15,16,Hashim Amla,43906,Shoaib Akhtar,42655,"Shoaib Akhtar to Amla, 1 run slower one bowled fuller outside off, turns the face and places it wide of midwicket for a quick single, picked it this time, the offcutter again",1st innings,Graeme Smith,47270,Abdul Razzaq,39836,2.4,run,12,1,12/0,"Shoaib Akhtar to Amla, 1 run",,"slower one bowled fuller outside off, turns the face and places it wide of midwicket for a quick single, picked it this time, the offcutter again",0
16,17,Graeme Smith,47270,Shoaib Akhtar,42655,"Shoaib Akhtar to Smith, no run short on middle, gets back and drops it back towards the bowler with a straight bat",1st innings,Hashim Amla,43906,Abdul Razzaq,39836,2.5,no run,12,0,12/0,"Shoaib Akhtar to Smith, no run",,"short on middle, gets back and drops it back towards the bowler with a straight bat",0
17,18,Graeme Smith,47270,Shoaib Akhtar,42655,"Shoaib Akhtar to Smith, no run slower one again, held back the length there, Smith was content to stay in his crease and play it towards cover",1st innings,Hashim Amla,43906,Abdul Razzaq,39836,2.6,no run,12,0,12/0,"Shoaib Akhtar to Smith, no run",,"slower one again, held back the length there, Smith was content to stay in his crease and play it towards cover",0
18,19,Hashim Amla,43906,Abdul Razzaq,39836,"Abdul Razzaq to Amla, 1 run a fraction short outside off, waits for it and taps it down towards third man for a single",1st innings,Graeme Smith,47270,Shoaib Akhtar,42655,3.1,run,13,1,13/0,"Abdul Razzaq to Amla, 1 run",,"a fraction short outside off, waits for it and taps it down towards third man for a single",0
19,20,Graeme Smith,47270,Abdul Razzaq,39836,"Abdul Razzaq to Smith, no run cautiously played, moved back in his crease to that shortish delivery and patted it back with a full face",1st innings,Hashim Amla,43906,Shoaib Akhtar,42655,3.2,no run,13,0,13/0,"Abdul Razzaq to Smith, no run",,"cautiously played, moved back in his crease to that shortish delivery and patted it back with a full face",0
20,21,Graeme Smith,47270,Abdul Razzaq,39836,"Abdul Razzaq to Smith, no run bowls it on a good length, steps forward and pushes it firmly towards extra cover",1st innings,Hashim Amla,43906,Shoaib Akhtar,42655,3.3,no run,13,0,13/0,"Abdul Razzaq to Smith, no run",,"bowls it on a good length, steps forward and pushes it firmly towards extra cover",0
21,22,Graeme Smith,47270,Abdul Razzaq,39836,"Abdul Razzaq to Smith, no run slower one bowled full outside off, mistimes a drive straight to mid-off",1st innings,Hashim Amla,43906,Shoaib Akhtar,42655,3.4,no run,13,0,13/0,"Abdul Razzaq to Smith, no run",,"slower one bowled full outside off, mistimes a drive straight to mid-off",0
22,23,Graeme Smith,47270,Abdul Razzaq,39836,"Abdul Razzaq to Smith, no run bowls it short of a good length on the off, punched towards extra cover",1st innings,Hashim Amla,43906,Shoaib Akhtar,42655,3.5,no run,13,0,13/0,"Abdul Razzaq to Smith, no run",,"bowls it short of a good length on the off, punched towards extra cover",0
23,24,Graeme Smith,47270,Abdul Razzaq,39836,"Abdul Razzaq to Smith, FOUR runs slower one, a bit of width this time and Smith cashes in, gets to the pitch and flays it wide of cover for a boundary, freed his arms there, a gift ball of sorts after a reasonably tight over",1st innings,Hashim Amla,43906,Shoaib Akhtar,42655,3.6,four,17,4,17/0,"Abdul Razzaq to Smith, FOUR runs",,"slower one, a bit of width this time and Smith cashes in, gets to the pitch and flays it wide of cover for a boundary, freed his arms there, a gift ball of sorts after a reasonably tight over",0
24,25,Hashim Amla,43906,Shoaib Akhtar,42655,"Shoaib Akhtar to Amla, no run didn't pick the slower one there though the idea was right, short ball well outside off and Amla had made his mind up to dispatch it over midwicket, couldn't connect though",1st innings,Graeme Smith,47270,Abdul Razzaq,39836,4.1,no run,17,0,17/0,"Shoaib Akhtar to Amla, no run",,"didn't pick the slower one there though the idea was right, short ball well outside off and Amla had made his mind up to dispatch it over midwicket, couldn't connect though",0
25,26,Hashim Amla,43906,Shoaib Akhtar,42655,"Shoaib Akhtar to Amla, 1 run short, quicker this time, and pulled hard but just wide of Wahab Riaz at mid-on who dives but can't quite stop it, not much damage done, just the single",1st innings,Graeme Smith,47270,Abdul Razzaq,39836,4.2,run,18,1,18/0,"Shoaib Akhtar to Amla, 1 run",,"short, quicker this time, and pulled hard but just wide of Wahab Riaz at mid-on who dives but can't quite stop it, not much damage done, just the single",0
26,27,Graeme Smith,47270,Shoaib Akhtar,42655,"Shoaib Akhtar to Smith, FOUR runs lovely timing, that's his favourite shot, good length ball on the pads and it's a flick past midwicket, Asad Shafiq gives chase and dives needlessly, that was always going to be four",1st innings,Hashim Amla,43906,Abdul Razzaq,39836,4.3,four,22,4,22/0,"Shoaib Akhtar to Smith, FOUR runs",,"lovely timing, that's his favourite shot, good length ball on the pads and it's a flick past midwicket, Asad Shafiq gives chase and dives needlessly, that was always going to be four",0
27,28,Graeme Smith,47270,Shoaib Akhtar,42655,"Shoaib Akhtar to Smith, no run pushed off the front foot towards mid-off, there's no slip now",1st innings,Hashim Amla,43906,Abdul Razzaq,39836,4.4,no run,22,0,22/0,"Shoaib Akhtar to Smith, no run",,"pushed off the front foot towards mid-off, there's no slip now",0
28,29,Graeme Smith,47270,Shoaib Akhtar,42655,"Shoaib Akhtar to Smith, 2 runs nice timing again, shortish delivery on leg stump and it's punched past a short midwicket who's been placed there exactly for that shot, Akhtar is not happy with himself",1st innings,Hashim Amla,43906,Abdul Razzaq,39836,4.5,run,24,2,24/0,"Shoaib Akhtar to Smith, 2 runs",,"nice timing again, shortish delivery on leg stump and it's punched past a short midwicket who's been placed there exactly for that shot, Akhtar is not happy with himself",0
29,30,Graeme Smith,47270,Shoaib Akhtar,42655,"Shoaib Akhtar to Smith, no run slower one on the off stump, 118 kmph and it's driven hard and beautifully but Akhtar gets in the way, kicking it away and giving the batsman a cold stare. A solid start this for South Africa",1st innings,Hashim Amla,43906,Abdul Razzaq,39836,4.6,no run,24,0,24/0,"Shoaib Akhtar to Smith, no run",,"slower one on the off stump, 118 kmph and it's driven hard and beautifully but Akhtar gets in the way, kicking it away and giving the batsman a cold stare. A solid start this for South Africa",0
30,31,Hashim Amla,43906,Abdul Razzaq,39836,"Abdul Razzaq to Amla, 1 run lovely, that was bowled reasonably wide of the off stump, Amla moved all the way across and whipped it through square leg, there's protection in the deep though",1st innings,Graeme Smith,47270,Shoaib Akhtar,42655,5.1,run,25,1,25/0,"Abdul Razzaq to Amla, 1 run",,"lovely, that was bowled reasonably wide of the off stump, Amla moved all the way across and whipped it through square leg, there's protection in the deep though",0
31,32,Graeme Smith,47270,Abdul Razzaq,39836,"Abdul Razzaq to Smith, no run short, and it's crashed off the back foot but it's well fielded by Shafiq at point who hurls himself to his right",1st innings,Hashim Amla,43906,Shoaib Akhtar,42655,5.2,no run,25,0,25/0,"Abdul Razzaq to Smith, no run",,"short, and it's crashed off the back foot but it's well fielded by Shafiq at point who hurls himself to his right",0
32,33,Graeme Smith,47270,Abdul Razzaq,39836,"Abdul Razzaq to Smith, no run defended solidly on the side of the pitch",1st innings,Hashim Amla,43906,Shoaib Akhtar,42655,5.3,no run,25,0,25/0,"Abdul Razzaq to Smith, no run",,defended solidly on the side of the pitch,0
33,34,Graeme Smith,47270,Abdul Razzaq,39836,"Abdul Razzaq to Smith, no run pitched up slightly, driven firmly but straight to mid-off",1st innings,Hashim Amla,43906,Shoaib Akhtar,42655,5.4,no run,25,0,25/0,"Abdul Razzaq to Smith, no run",,"pitched up slightly, driven firmly but straight to mid-off",0
34,35,Graeme Smith,47270,Abdul Razzaq,39836,"Abdul Razzaq to Smith, 1 run mid-on is a little deep and Smith, this time, just pushes it gently towards that fielder to sneak in a quick single",1st innings,Hashim Amla,43906,Shoaib Akhtar,42655,5.5,run,26,1,26/0,"Abdul Razzaq to Smith, 1 run",,"mid-on is a little deep and Smith, this time, just pushes it gently towards that fielder to sneak in a quick single",0
35,36,Hashim Amla,43906,Abdul Razzaq,39836,"Abdul Razzaq to Amla, FOUR runs easily done, a rubbish delivery outside off, short and wide and it's smacked through point for a boundary",1st innings,Graeme Smith,47270,Shoaib Akhtar,42655,5.6,four,30,4,30/0,"Abdul Razzaq to Amla, FOUR runs",,"easily done, a rubbish delivery outside off, short and wide and it's smacked through point for a boundary",0
36,37,Graeme Smith,47270,Shoaib Akhtar,42655,"Shoaib Akhtar to Smith, FOUR runs Smith and Amla are looking good here, seized the length early, Shoaib dragged that short on middle and it was thumped through midwicket",1st innings,Hashim Amla,43906,Abdul Razzaq,39836,6.1,four,34,4,34/0,"Shoaib Akhtar to Smith, FOUR runs",,"Smith and Amla are looking good here, seized the length early, Shoaib dragged that short on middle and it was thumped through midwicket",0
37,38,Graeme Smith,47270,Shoaib Akhtar,42655,"Shoaib Akhtar to Smith, no run fires it on a good length on middle and is met respectfully by Smith onto the pitch",1st innings,Hashim Amla,43906,Abdul Razzaq,39836,6.2,no run,34,0,34/0,"Shoaib Akhtar to Smith, no run",,fires it on a good length on middle and is met respectfully by Smith onto the pitch,0
38,39,Graeme Smith,47270,Shoaib Akhtar,42655,"Shoaib Akhtar to Smith, no run bangs it short outside off, it's handled well by Smith who gets on top of it and takes his bottom-hand off, nicely done",1st innings,Hashim Amla,43906,Abdul Razzaq,39836,6.3,no run,34,0,34/0,"Shoaib Akhtar to Smith, no run",,"bangs it short outside off, it's handled well by Smith who gets on top of it and takes his bottom-hand off, nicely done",0
39,40,Graeme Smith,47270,Shoaib Akhtar,42655,"Shoaib Akhtar to Smith, no run slower one this time, Smith came down the track while simultaneously making room, picked the slower one there but again, drove it well but straight to mid-off",1st innings,Hashim Amla,43906,Abdul Razzaq,39836,6.4,no run,34,0,34/0,"Shoaib Akhtar to Smith, no run",,"slower one this time, Smith came down the track while simultaneously making room, picked the slower one there but again, drove it well but straight to mid-off",0
40,41,Graeme Smith,47270,Shoaib Akhtar,42655,"Shoaib Akhtar to Smith, 1 run there is a deep square leg in place and this one goes straight to him, whipped off the back foot",1st innings,Hashim Amla,43906,Abdul Razzaq,39836,6.5,run,35,1,35/0,"Shoaib Akhtar to Smith, 1 run",,"there is a deep square leg in place and this one goes straight to him, whipped off the back foot",0
41,42,Hashim Amla,43906,Shoaib Akhtar,42655,"Shoaib Akhtar to Amla, OUT short of a length outside off, Amla senses a chance and rightly opts for a pull but was a little late on the shot it seems, tried to smack it over midwicket, got the top edge and was taken comfortably by Imran Farhat at midwicket",1st innings,Graeme Smith,47270,Abdul Razzaq,39836,6.6,out,35,0,35/1,"Shoaib Akhtar to Amla, OUT",,"short of a length outside off, Amla senses a chance and rightly opts for a pull but was a little late on the shot it seems, tried to smack it over midwicket, got the top edge and was taken comfortably by Imran Farhat at midwicket",1
42,43,Graeme Smith,47270,Abdul Razzaq,39836,"Abdul Razzaq to Smith, 2 runs short on middle by Razzaq, is pulled away by Smith well wide of deep square leg for a couple of runs",1st innings,Jacques Kallis,45789,Shoaib Akhtar,42655,7.1,run,37,2,37/1,"Abdul Razzaq to Smith, 2 runs",,"short on middle by Razzaq, is pulled away by Smith well wide of deep square leg for a couple of runs",1
43,44,Graeme Smith,47270,Abdul Razzaq,39836,"Abdul Razzaq to Smith, no run bowled it on a good length on the off, defended watchfully by Smith into the leg side",1st innings,Jacques Kallis,45789,Shoaib Akhtar,42655,7.2,no run,37,0,37/1,"Abdul Razzaq to Smith, no run",,"bowled it on a good length on the off, defended watchfully by Smith into the leg side",1
44,45,Graeme Smith,47270,Abdul Razzaq,39836,"Abdul Razzaq to Smith, no run shortish on leg stump, attempting his favoured flick again but can't connect, is struck on the thigh",1st innings,Jacques Kallis,45789,Shoaib Akhtar,42655,7.3,no run,37,0,37/1,"Abdul Razzaq to Smith, no run",,"shortish on leg stump, attempting his favoured flick again but can't connect, is struck on the thigh",1
45,46,Graeme Smith,47270,Abdul Razzaq,39836,"Abdul Razzaq to Smith, no run midwicket, straight to him, straying on leg stump and it's Smith's zone but can't quite pierce the field this time",1st innings,Jacques Kallis,45789,Shoaib Akhtar,42655,7.4,no run,37,0,37/1,"Abdul Razzaq to Smith, no run",,"midwicket, straight to him, straying on leg stump and it's Smith's zone but can't quite pierce the field this time",1
46,47,Graeme Smith,47270,Abdul Razzaq,39836,"Abdul Razzaq to Smith, no run holds its line, lands on a good length on the off, 127.6 kmph, and is defended solidly",1st innings,Jacques Kallis,45789,Shoaib Akhtar,42655,7.5,no run,37,0,37/1,"Abdul Razzaq to Smith, no run",,"holds its line, lands on a good length on the off, 127.6 kmph, and is defended solidly",1
47,48,Graeme Smith,47270,Abdul Razzaq,39836,"Abdul Razzaq to Smith, no run slower one bowled short outside leg and cuts back in, tries to turn the face on it but can't connect and is struck on the pad",1st innings,Jacques Kallis,45789,Shoaib Akhtar,42655,7.6,no run,37,0,37/1,"Abdul Razzaq to Smith, no run",,"slower one bowled short outside leg and cuts back in, tries to turn the face on it but can't connect and is struck on the pad",1
48,49,Jacques Kallis,45789,Shoaib Akhtar,42655,"Shoaib Akhtar to Kallis, 1 run ruffles up Kallis with a short delivery on middle, fends it away towards fine leg for a single to get off the mark",1st innings,Graeme Smith,47270,Abdul Razzaq,39836,8.1,run,38,1,38/1,"Shoaib Akhtar to Kallis, 1 run",,"ruffles up Kallis with a short delivery on middle, fends it away towards fine leg for a single to get off the mark",1
49,50,Graeme Smith,47270,Shoaib Akhtar,42655,"Shoaib Akhtar to Smith, 1 run round the wicket to Smith who knocks it just wide of midwicket for a quick single",1st innings,Jacques Kallis,45789,Abdul Razzaq,39836,8.2,run,39,1,39/1,"Shoaib Akhtar to Smith, 1 run",,round the wicket to Smith who knocks it just wide of midwicket for a quick single,1
50,51,Jacques Kallis,45789,Shoaib Akhtar,42655,"Shoaib Akhtar to Kallis, 1 run worked away into the leg side towards midwicket, not far from the fielder and he opts for the single, makes it in time and would have been in even if it was a direct hit, stretched hard and tumbled and hurt his wrist in the process, the magic spray is out",1st innings,Graeme Smith,47270,Abdul Razzaq,39836,8.3,run,40,1,40/1,"Shoaib Akhtar to Kallis, 1 run",,"worked away into the leg side towards midwicket, not far from the fielder and he opts for the single, makes it in time and would have been in even if it was a direct hit, stretched hard and tumbled and hurt his wrist in the process, the magic spray is out",1
51,52,Graeme Smith,47270,Shoaib Akhtar,42655,"Shoaib Akhtar to Smith, 1 run slower one bowled short outside off, guided off the back foot towards third man for a single",1st innings,Jacques Kallis,45789,Abdul Razzaq,39836,8.4,run,41,1,41/1,"Shoaib Akhtar to Smith, 1 run",,"slower one bowled short outside off, guided off the back foot towards third man for a single",1
52,53,Jacques Kallis,45789,Shoaib Akhtar,42655,"Shoaib Akhtar to Kallis, no run punched towards point, targeting the off stump is Shoaib",1st innings,Graeme Smith,47270,Abdul Razzaq,39836,8.5,no run,41,0,41/1,"Shoaib Akhtar to Kallis, no run",,"punched towards point, targeting the off stump is Shoaib",1
53,54,Jacques Kallis,45789,Shoaib Akhtar,42655,"Shoaib Akhtar to Kallis, no run short of a good length on the off, gets back and pushes it towards extra cover",1st innings,Graeme Smith,47270,Abdul Razzaq,39836,8.6,no run,41,0,41/1,"Shoaib Akhtar to Kallis, no run",,"short of a good length on the off, gets back and pushes it towards extra cover",1
54,55,Graeme Smith,47270,Abdul Razzaq,39836,"Abdul Razzaq to Smith, 1 run that's 5000 runs for Smith as a captain, whipped towards fine leg for a single.",1st innings,Jacques Kallis,45789,Shoaib Akhtar,42655,9.1,run,42,1,42/1,"Abdul Razzaq to Smith, 1 run",,"that's 5000 runs for Smith as a captain, whipped towards fine leg for a single.",1
55,56,Jacques Kallis,45789,Abdul Razzaq,39836,"Abdul Razzaq to Kallis, FOUR runs confidently played, full, a meaty ball on middle and leg and is driven stylishly down the ground to beat mid-on to the ropes",1st innings,Graeme Smith,47270,Shoaib Akhtar,42655,9.2,four,46,4,46/1,"Abdul Razzaq to Kallis, FOUR runs",,"confidently played, full, a meaty ball on middle and leg and is driven stylishly down the ground to beat mid-on to the ropes",1
56,57,Jacques Kallis,45789,Abdul Razzaq,39836,"Abdul Razzaq to Kallis, no run turned the face a little too early there, was looking for the on-drive past mid-on, it held its line and took the leading edge, rolled towards extra cover",1st innings,Graeme Smith,47270,Shoaib Akhtar,42655,9.3,no run,46,0,46/1,"Abdul Razzaq to Kallis, no run",,"turned the face a little too early there, was looking for the on-drive past mid-on, it held its line and took the leading edge, rolled towards extra cover",1
57,58,Jacques Kallis,45789,Abdul Razzaq,39836,"Abdul Razzaq to Kallis, no run short of a good length outside off, cracked straight towards point",1st innings,Graeme Smith,47270,Shoaib Akhtar,42655,9.4,no run,46,0,46/1,"Abdul Razzaq to Kallis, no run",,"short of a good length outside off, cracked straight towards point",1
58,59,Jacques Kallis,45789,Abdul Razzaq,39836,"Abdul Razzaq to Kallis, FOUR runs poor delivery on the leg stump, Kallis comes forward a couple of steps and clips it over short fine leg for an easy boundary, more a leg gully that, Akhtar's the man there",1st innings,Graeme Smith,47270,Shoaib Akhtar,42655,9.5,four,50,4,50/1,"Abdul Razzaq to Kallis, FOUR runs",,"poor delivery on the leg stump, Kallis comes forward a couple of steps and clips it over short fine leg for an easy boundary, more a leg gully that, Akhtar's the man there",1
59,60,Jacques Kallis,45789,Abdul Razzaq,39836,"Abdul Razzaq to Kallis, no run pitched up outside off, driven crisply but to mid-off",1st innings,Graeme Smith,47270,Shoaib Akhtar,42655,9.6,no run,50,0,50/1,"Abdul Razzaq to Kallis, no run",,"pitched up outside off, driven crisply but to mid-off",1
