,ball,batsman,batsman_id,bowler,bowler_id,commentary,innings,overs,playType,runs,runs_scored,score,shortText,speed,text,wickets
412,112,Junaid Siddique,55946,Ray Price,55698,"Price to Junaid Siddique, 1 run backs away outside leg, but there is no room and he hits it back to Price",2nd innings,18.4,run,70,1,70/1,"Price to Junaid Siddique, 1 run",,"backs away outside leg, but there is no room and he hits it back to Price",1
413,113,Imrul Kayes,280734,Ray Price,55698,"Price to Imrul Kayes, no run gets some width this time, and punches to wide long off",2nd innings,18.5,no run,70,0,70/1,"Price to Imrul Kayes, no run",,"gets some width this time, and punches to wide long off",1
414,114,Imrul Kayes,280734,Ray Price,55698,"Price to Imrul Kayes, 1 run tossed up delivery, clipped away in front of square who fails to pick it up cleanly",2nd innings,18.6,run,71,1,71/1,"Price to Imrul Kayes, 1 run",,"tossed up delivery, clipped away in front of square who fails to pick it up cleanly",1
415,115,Imrul Kayes,280734,Prosper Utseya,55820,"Utseya to Imrul Kayes, no run tossed up on middle, gets forward to push it back to the bowler",2nd innings,19.1,no run,71,0,71/1,"Utseya to Imrul Kayes, no run",,"tossed up on middle, gets forward to push it back to the bowler",1
416,116,Imrul Kayes,280734,Prosper Utseya,55820,"Utseya to Imrul Kayes, no run looks to come down the track, but can only defend it down the track",2nd innings,19.2,no run,71,0,71/1,"Utseya to Imrul Kayes, no run",,"looks to come down the track, but can only defend it down the track",1
417,117,Imrul Kayes,280734,Prosper Utseya,55820,"Utseya to Imrul Kayes, no run fires it in quicker, he jams down his bat to block it",2nd innings,19.3,no run,71,0,71/1,"Utseya to Imrul Kayes, no run",,"fires it in quicker, he jams down his bat to block it",1
418,118,Imrul Kayes,280734,Prosper Utseya,55820,"Utseya to Imrul Kayes, FOUR runs flighted around off and almost gets him, he drove it in the air over extra cover, and it almost carried to the man running in from long off, but he missed it and it rolled away for four",2nd innings,19.4,four,75,4,75/1,"Utseya to Imrul Kayes, FOUR runs",,"flighted around off and almost gets him, he drove it in the air over extra cover, and it almost carried to the man running in from long off, but he missed it and it rolled away for four",1
419,119,Imrul Kayes,280734,Prosper Utseya,55820,"Utseya to Imrul Kayes, no run defended off the front foot",2nd innings,19.5,no run,75,0,75/1,"Utseya to Imrul Kayes, no run",,defended off the front foot,1
420,120,Imrul Kayes,280734,Prosper Utseya,55820,"Utseya to Imrul Kayes, 1 run defended towards cover and the single is on",2nd innings,19.6,run,76,1,76/1,"Utseya to Imrul Kayes, 1 run",,defended towards cover and the single is on,1
421,121,Imrul Kayes,280734,Ray Price,55698,"Price to Imrul Kayes, no run clipped away to midwicket",2nd innings,20.1,no run,76,0,76/1,"Price to Imrul Kayes, no run",,clipped away to midwicket,1
422,122,Imrul Kayes,280734,Ray Price,55698,"Price to Imrul Kayes, no run sweeps straight to backward square leg",2nd innings,20.2,no run,76,0,76/1,"Price to Imrul Kayes, no run",,sweeps straight to backward square leg,1
423,123,Imrul Kayes,280734,Ray Price,55698,"Price to Imrul Kayes, no run turned to midwicket off the back foot",2nd innings,20.3,no run,76,0,76/1,"Price to Imrul Kayes, no run",,turned to midwicket off the back foot,1
424,124,Imrul Kayes,280734,Ray Price,55698,"Price to Imrul Kayes, OUT and he's holed out to deep midwicket here! it was tossed up around middle, he skipped down the track, and swung it straight to the man there on the midwicket boundary, Price lets out a roar, Kayes has to walk back",2nd innings,20.4,out,76,0,76/2,"Price to Imrul Kayes, OUT",,"and he's holed out to deep midwicket here! it was tossed up around middle, he skipped down the track, and swung it straight to the man there on the midwicket boundary, Price lets out a roar, Kayes has to walk back",2
425,125,Junaid Siddique,55946,Ray Price,55698,"Price to Junaid Siddique, 1 run flighted nicely outside off, driven down to long off",2nd innings,20.5,run,77,1,77/2,"Price to Junaid Siddique, 1 run",,"flighted nicely outside off, driven down to long off",2
426,126,Mohammad Ashraful,55988,Ray Price,55698,"Price to Mohammad Ashraful, FOUR runs and he is off with a sweep to the deep backward square leg boundary, it was full on the stumps, and he got the placement alright, the crowd comes alive",2nd innings,20.6,four,81,4,81/2,"Price to Mohammad Ashraful, FOUR runs",,"and he is off with a sweep to the deep backward square leg boundary, it was full on the stumps, and he got the placement alright, the crowd comes alive",2
427,127,Junaid Siddique,55946,Prosper Utseya,55820,"Utseya to Junaid Siddique, 1 run tossed up on the stumps, he stays back and punches to long off, Utseya cannot cut it off even as he runs across",2nd innings,21.1,run,82,1,82/2,"Utseya to Junaid Siddique, 1 run",,"tossed up on the stumps, he stays back and punches to long off, Utseya cannot cut it off even as he runs across",2
428,128,Mohammad Ashraful,55988,Prosper Utseya,55820,"Utseya to Mohammad Ashraful, OUT pushes this tossed up delivery in front of point, and they go through with the risky single, the throw is right on the stumps, Taibu has the bails off in a flash, and Junaid is run out by miles, he starts to walk back even before the red light comes on from the third umpire, game on here",2nd innings,21.2,out,82,0,82/3,"Utseya to Mohammad Ashraful, OUT",,"pushes this tossed up delivery in front of point, and they go through with the risky single, the throw is right on the stumps, Taibu has the bails off in a flash, and Junaid is run out by miles, he starts to walk back even before the red light comes on from the third umpire, game on here",3
429,129,Shakib Al Hasan,56143,Prosper Utseya,55820,"Utseya to Shakib Al Hasan, 1 run and is away as he eases this flighted delivery through extra cover for a single",2nd innings,21.3,run,83,1,83/3,"Utseya to Shakib Al Hasan, 1 run",,and is away as he eases this flighted delivery through extra cover for a single,3
430,130,Mohammad Ashraful,55988,Prosper Utseya,55820,"Utseya to Mohammad Ashraful, no run gets forward to this delivery turning in and gets an inside edge that rolls away on the leg side",2nd innings,21.4,no run,83,0,83/3,"Utseya to Mohammad Ashraful, no run",,gets forward to this delivery turning in and gets an inside edge that rolls away on the leg side,3
431,131,Mohammad Ashraful,55988,Prosper Utseya,55820,"Utseya to Mohammad Ashraful, no run pushes down the track off the front foot",2nd innings,21.5,no run,83,0,83/3,"Utseya to Mohammad Ashraful, no run",,pushes down the track off the front foot,3
432,132,Mohammad Ashraful,55988,Prosper Utseya,55820,"Utseya to Mohammad Ashraful, no run goes across the stumps, and tries to work this one away fine, but there is a man at short fine leg and he cuts it off",2nd innings,21.6,no run,83,0,83/3,"Utseya to Mohammad Ashraful, no run",,"goes across the stumps, and tries to work this one away fine, but there is a man at short fine leg and he cuts it off",3
433,133,Shakib Al Hasan,56143,Ray Price,55698,"Price to Shakib Al Hasan, 1 run gets the the pitch of this tossed up delivery, and drives it along the ground to long off",2nd innings,22.1,run,84,1,84/3,"Price to Shakib Al Hasan, 1 run",,"gets the the pitch of this tossed up delivery, and drives it along the ground to long off",3
434,134,Mohammad Ashraful,55988,Ray Price,55698,"Price to Mohammad Ashraful, no run shortish and going on straight with the arm, punched away to cover",2nd innings,22.2,no run,84,0,84/3,"Price to Mohammad Ashraful, no run",,"shortish and going on straight with the arm, punched away to cover",3
435,135,Mohammad Ashraful,55988,Ray Price,55698,"Price to Mohammad Ashraful, 1 run worked away square off the front foot, and hares across for the single even as the throw comes in at the non-striker's end",2nd innings,22.3,run,85,1,85/3,"Price to Mohammad Ashraful, 1 run",,"worked away square off the front foot, and hares across for the single even as the throw comes in at the non-striker's end",3
436,136,Shakib Al Hasan,56143,Ray Price,55698,"Price to Shakib Al Hasan, no run turns this tossed up ball to midwicket off the back foot",2nd innings,22.4,no run,85,0,85/3,"Price to Shakib Al Hasan, no run",,turns this tossed up ball to midwicket off the back foot,3
437,137,Shakib Al Hasan,56143,Ray Price,55698,"Price to Shakib Al Hasan, no run goes back and cuts this delivery turning in from off stump, but straight to cover",2nd innings,22.5,no run,85,0,85/3,"Price to Shakib Al Hasan, no run",,"goes back and cuts this delivery turning in from off stump, but straight to cover",3
438,138,Shakib Al Hasan,56143,Ray Price,55698,"Price to Shakib Al Hasan, 1 run punched down to long off to retain strike",2nd innings,22.6,run,86,1,86/3,"Price to Shakib Al Hasan, 1 run",,punched down to long off to retain strike,3
439,139,Shakib Al Hasan,56143,Prosper Utseya,55820,"Utseya to Shakib Al Hasan, no run turned to midwicket off the back foot",2nd innings,23.1,no run,86,0,86/3,"Utseya to Shakib Al Hasan, no run",,turned to midwicket off the back foot,3
440,140,Shakib Al Hasan,56143,Prosper Utseya,55820,"Utseya to Shakib Al Hasan, 1 run punched down to long on off the back foot",2nd innings,23.2,run,87,1,87/3,"Utseya to Shakib Al Hasan, 1 run",,punched down to long on off the back foot,3
441,141,Mohammad Ashraful,55988,Prosper Utseya,55820,"Utseya to Mohammad Ashraful, 1 run short and turning in from outside off, cuts it away to sweeper cover",2nd innings,23.3,run,88,1,88/3,"Utseya to Mohammad Ashraful, 1 run",,"short and turning in from outside off, cuts it away to sweeper cover",3
442,142,Shakib Al Hasan,56143,Prosper Utseya,55820,"Utseya to Shakib Al Hasan, 1 run turned in the air but into the gap through midwicket, that could have been close",2nd innings,23.4,run,89,1,89/3,"Utseya to Shakib Al Hasan, 1 run",,"turned in the air but into the gap through midwicket, that could have been close",3
443,143,Mohammad Ashraful,55988,Prosper Utseya,55820,"Utseya to Mohammad Ashraful, no run gets forward to defend this flat delivery down the track",2nd innings,23.5,no run,89,0,89/3,"Utseya to Mohammad Ashraful, no run",,gets forward to defend this flat delivery down the track,3
444,144,Mohammad Ashraful,55988,Prosper Utseya,55820,"Utseya to Mohammad Ashraful, OUT and Ashraful is gone! he gave himself room to steer this delivery that turned in quite a bit from outside off, missed the line completely, and heard the death rattle behind him, an early dismissal for Ashraful on his comeback, Zimbabwe are right in this game",2nd innings,23.6,out,89,0,89/4,"Utseya to Mohammad Ashraful, OUT",,"and Ashraful is gone! he gave himself room to steer this delivery that turned in quite a bit from outside off, missed the line completely, and heard the death rattle behind him, an early dismissal for Ashraful on his comeback, Zimbabwe are right in this game",4
445,145,Shakib Al Hasan,56143,Ray Price,55698,"Price to Shakib Al Hasan, 1 run takes a step down, and drives in the air to the right of a diving midwicket, but it was too far from him and it rolled down to long on",2nd innings,24.1,run,90,1,90/4,"Price to Shakib Al Hasan, 1 run",,"takes a step down, and drives in the air to the right of a diving midwicket, but it was too far from him and it rolled down to long on",4
446,146,Mushfiqur Rahim,56029,Ray Price,55698,"Price to Mushfiqur Rahim, no run ",2nd innings,24.2,no run,90,0,90/4,"Price to Mushfiqur Rahim, no run",,,4
447,147,Mushfiqur Rahim,56029,Ray Price,55698,"Price to Mushfiqur Rahim, no run gets right forward to defend down the track",2nd innings,24.3,no run,90,0,90/4,"Price to Mushfiqur Rahim, no run",,gets right forward to defend down the track,4
448,148,Mushfiqur Rahim,56029,Ray Price,55698,"Price to Mushfiqur Rahim, no run gets behind the line of this tossed up delivery and defends down the pitch",2nd innings,24.4,no run,90,0,90/4,"Price to Mushfiqur Rahim, no run",,gets behind the line of this tossed up delivery and defends down the pitch,4
449,149,Mushfiqur Rahim,56029,Ray Price,55698,"Price to Mushfiqur Rahim, no run teasing flight from Price, trying to prise out a wicket, Rahim gets forward in defence",2nd innings,24.5,no run,90,0,90/4,"Price to Mushfiqur Rahim, no run",,"teasing flight from Price, trying to prise out a wicket, Rahim gets forward in defence",4
450,150,Mushfiqur Rahim,56029,Ray Price,55698,"Price to Mushfiqur Rahim, no run hits him on the pads with a quicker one, but that looked to be going down leg, and Price's appeal is turned down, he knows how close it was",2nd innings,24.6,no run,90,0,90/4,"Price to Mushfiqur Rahim, no run",,"hits him on the pads with a quicker one, but that looked to be going down leg, and Price's appeal is turned down, he knows how close it was",4
451,151,Shakib Al Hasan,56143,Prosper Utseya,55820,"Utseya to Shakib Al Hasan, 2 runs clipped away backward of square off his toes, they go for the second, and Shakib makes it back comfortably",2nd innings,25.1,run,92,2,92/4,"Utseya to Shakib Al Hasan, 2 runs",,"clipped away backward of square off his toes, they go for the second, and Shakib makes it back comfortably",4
452,152,Shakib Al Hasan,56143,Prosper Utseya,55820,"Utseya to Shakib Al Hasan, FOUR runs gets some width outside off, and he rocks back and cuts it in a flash through backward point for a boundary",2nd innings,25.2,four,96,4,96/4,"Utseya to Shakib Al Hasan, FOUR runs",,"gets some width outside off, and he rocks back and cuts it in a flash through backward point for a boundary",4
453,153,Shakib Al Hasan,56143,Prosper Utseya,55820,"Utseya to Shakib Al Hasan, 1 run gets down the track and eases it down to long on",2nd innings,25.3,run,97,1,97/4,"Utseya to Shakib Al Hasan, 1 run",,gets down the track and eases it down to long on,4
454,154,Mushfiqur Rahim,56029,Prosper Utseya,55820,"Utseya to Mushfiqur Rahim, no run flights this one on off stump, he digs it out towards mid on, the bowler runs across and fields, and Rahim rushes back, he was half way down the track already",2nd innings,25.4,no run,97,0,97/4,"Utseya to Mushfiqur Rahim, no run",,"flights this one on off stump, he digs it out towards mid on, the bowler runs across and fields, and Rahim rushes back, he was half way down the track already",4
455,155,Mushfiqur Rahim,56029,Prosper Utseya,55820,"Utseya to Mushfiqur Rahim, 1 run makes room and hits this one turning in down to long on",2nd innings,25.5,run,98,1,98/4,"Utseya to Mushfiqur Rahim, 1 run",,makes room and hits this one turning in down to long on,4
456,156,Shakib Al Hasan,56143,Prosper Utseya,55820,"Utseya to Shakib Al Hasan, no run that could have been close, Shakib got a leading edge as he went back to this one, and it looped up in the air to fall short of Utseya",2nd innings,25.6,no run,98,0,98/4,"Utseya to Shakib Al Hasan, no run",,"that could have been close, Shakib got a leading edge as he went back to this one, and it looped up in the air to fall short of Utseya",4
457,157,Mushfiqur Rahim,56029,Ray Price,55698,"Price to Mushfiqur Rahim, no run worked away square off the back foot, now Shakib wants the single, and is down half way, but is sent back rightly by Rahim",2nd innings,26.1,no run,98,0,98/4,"Price to Mushfiqur Rahim, no run",,"worked away square off the back foot, now Shakib wants the single, and is down half way, but is sent back rightly by Rahim",4
458,158,Mushfiqur Rahim,56029,Ray Price,55698,"Price to Mushfiqur Rahim, OUT bowled 'em! beats him in flight, it was tossed up around middle and leg, almost yorker length, he played all around it, and it crashed into the stumps, Bangladesh are getting a taste of their own medicine here, Zimbabwe's spinners are on fire at the moment",2nd innings,26.2,out,98,0,98/5,"Price to Mushfiqur Rahim, OUT",,"bowled 'em! beats him in flight, it was tossed up around middle and leg, almost yorker length, he played all around it, and it crashed into the stumps, Bangladesh are getting a taste of their own medicine here, Zimbabwe's spinners are on fire at the moment",5
459,159,Sohrawordi Shuvo,56138,Ray Price,55698,"Price to Sohrawordi Shuvo, no run defended off the front foot",2nd innings,26.3,no run,98,0,98/5,"Price to Sohrawordi Shuvo, no run",,defended off the front foot,5
460,160,Sohrawordi Shuvo,56138,Ray Price,55698,"Price to Sohrawordi Shuvo, no run calmly pushed down the track off the front foot",2nd innings,26.4,no run,98,0,98/5,"Price to Sohrawordi Shuvo, no run",,calmly pushed down the track off the front foot,5
461,161,Sohrawordi Shuvo,56138,Ray Price,55698,"Price to Sohrawordi Shuvo, no run tossed up and angling across the left-hander, driven off the front foot to extra cover",2nd innings,26.5,no run,98,0,98/5,"Price to Sohrawordi Shuvo, no run",,"tossed up and angling across the left-hander, driven off the front foot to extra cover",5
462,162,Sohrawordi Shuvo,56138,Ray Price,55698,"Price to Sohrawordi Shuvo, no run nicely flighted up, he was in two minds, whether to go back of forward, decided to stay back in the end and played it out on the leg side",2nd innings,26.6,no run,98,0,98/5,"Price to Sohrawordi Shuvo, no run",,"nicely flighted up, he was in two minds, whether to go back of forward, decided to stay back in the end and played it out on the leg side",5
463,163,Shakib Al Hasan,56143,Keith Dabengwa,55388,"Dabengwa to Shakib Al Hasan, no run punched back to the bowler",2nd innings,27.1,no run,98,0,98/5,"Dabengwa to Shakib Al Hasan, no run",,punched back to the bowler,5
464,164,Shakib Al Hasan,56143,Keith Dabengwa,55388,"Dabengwa to Shakib Al Hasan, 1 run pitches it fuller, and he gets forward and drives down to long on",2nd innings,27.2,run,99,1,99/5,"Dabengwa to Shakib Al Hasan, 1 run",,"pitches it fuller, and he gets forward and drives down to long on",5
465,165,Sohrawordi Shuvo,56138,Keith Dabengwa,55388,"Dabengwa to Sohrawordi Shuvo, no run much fuller this time outside off, driven to short extra cover",2nd innings,27.3,no run,99,0,99/5,"Dabengwa to Sohrawordi Shuvo, no run",,"much fuller this time outside off, driven to short extra cover",5
466,166,Sohrawordi Shuvo,56138,Keith Dabengwa,55388,"Dabengwa to Sohrawordi Shuvo, no run comes forward and defends down the track, good steady stuff",2nd innings,27.4,no run,99,0,99/5,"Dabengwa to Sohrawordi Shuvo, no run",,"comes forward and defends down the track, good steady stuff",5
467,167,Sohrawordi Shuvo,56138,Keith Dabengwa,55388,"Dabengwa to Sohrawordi Shuvo, 1 run on the leg stump, driven down wide of long on for a single to bring up the 100",2nd innings,27.5,run,100,1,100/5,"Dabengwa to Sohrawordi Shuvo, 1 run",,"on the leg stump, driven down wide of long on for a single to bring up the 100",5
468,168,Shakib Al Hasan,56143,Keith Dabengwa,55388,"Dabengwa to Shakib Al Hasan, no run goes back in the crease and pushes back to the bowler",2nd innings,27.6,no run,100,0,100/5,"Dabengwa to Shakib Al Hasan, no run",,goes back in the crease and pushes back to the bowler,5
469,169,Sohrawordi Shuvo,56138,Brendan Taylor,55814,"Taylor to Sohrawordi Shuvo, 2 runs gives him some width and he hammers it wide of long off for a couple of runs",2nd innings,28.1,run,102,2,102/5,"Taylor to Sohrawordi Shuvo, 2 runs",,gives him some width and he hammers it wide of long off for a couple of runs,5
470,170,Sohrawordi Shuvo,56138,Brendan Taylor,55814,"Taylor to Sohrawordi Shuvo, 1 run shorter this time, pulled away to deep square leg, missed out there",2nd innings,28.2,run,103,1,103/5,"Taylor to Sohrawordi Shuvo, 1 run",,"shorter this time, pulled away to deep square leg, missed out there",5
471,171,Shakib Al Hasan,56143,Brendan Taylor,55814,"Taylor to Shakib Al Hasan, no run tossed up on off stump, driven to extra cover",2nd innings,28.3,no run,103,0,103/5,"Taylor to Shakib Al Hasan, no run",,"tossed up on off stump, driven to extra cover",5
472,172,Shakib Al Hasan,56143,Brendan Taylor,55814,"Taylor to Shakib Al Hasan, no run pushed back to the bowler",2nd innings,28.4,no run,103,0,103/5,"Taylor to Shakib Al Hasan, no run",,pushed back to the bowler,5
473,173,Shakib Al Hasan,56143,Brendan Taylor,55814,"Taylor to Shakib Al Hasan, 1 run driven down to sweeper cover for a single",2nd innings,28.5,run,104,1,104/5,"Taylor to Shakib Al Hasan, 1 run",,driven down to sweeper cover for a single,5
474,174,Sohrawordi Shuvo,56138,Brendan Taylor,55814,"Taylor to Sohrawordi Shuvo, no run glided into the gap between cover and point",2nd innings,28.6,no run,104,0,104/5,"Taylor to Sohrawordi Shuvo, no run",,glided into the gap between cover and point,5
475,175,Shakib Al Hasan,56143,Keith Dabengwa,55388,"Dabengwa to Shakib Al Hasan, 1 run tossed up outside off and turning in, lashes against the turn to deep cover",2nd innings,29.1,run,105,1,105/5,"Dabengwa to Shakib Al Hasan, 1 run",,"tossed up outside off and turning in, lashes against the turn to deep cover",5
476,176,Sohrawordi Shuvo,56138,Keith Dabengwa,55388,"Dabengwa to Sohrawordi Shuvo, no run over-pitched on middle and leg, punched with the full face to mid-on",2nd innings,29.2,no run,105,0,105/5,"Dabengwa to Sohrawordi Shuvo, no run",,"over-pitched on middle and leg, punched with the full face to mid-on",5
477,177,Sohrawordi Shuvo,56138,Keith Dabengwa,55388,"Dabengwa to Sohrawordi Shuvo, 1 run ",2nd innings,29.3,run,106,1,106/5,"Dabengwa to Sohrawordi Shuvo, 1 run",,,5
478,178,Shakib Al Hasan,56143,Keith Dabengwa,55388,"Dabengwa to Shakib Al Hasan, 1 run back of a length on off stump and coming in, he rocks back and cuts it through the covers",2nd innings,29.4,run,107,1,107/5,"Dabengwa to Shakib Al Hasan, 1 run",,"back of a length on off stump and coming in, he rocks back and cuts it through the covers",5
479,179,Sohrawordi Shuvo,56138,Keith Dabengwa,55388,"Dabengwa to Sohrawordi Shuvo, 1 run looks to loft with the spin over mid-on, but can't get it away for a boundary. The pressure mounts",2nd innings,29.5,run,108,1,108/5,"Dabengwa to Sohrawordi Shuvo, 1 run",,"looks to loft with the spin over mid-on, but can't get it away for a boundary. The pressure mounts",5
480,180,Shakib Al Hasan,56143,Keith Dabengwa,55388,"Dabengwa to Shakib Al Hasan, no run stays in the crease this time and plays him with the spin towards mid-on",2nd innings,29.6,no run,108,0,108/5,"Dabengwa to Shakib Al Hasan, no run",,stays in the crease this time and plays him with the spin towards mid-on,5
481,181,Sohrawordi Shuvo,56138,Brendan Taylor,55814,"Taylor to Sohrawordi Shuvo, no run tossed up on leg, he looks to work it against the spin through the leg side and gets a bit of a leading edge, but it falls safe",2nd innings,30.1,no run,108,0,108/5,"Taylor to Sohrawordi Shuvo, no run",,"tossed up on leg, he looks to work it against the spin through the leg side and gets a bit of a leading edge, but it falls safe",5
482,182,Sohrawordi Shuvo,56138,Brendan Taylor,55814,"Taylor to Sohrawordi Shuvo, 1 run Shuvo reaches out and drives through the covers, with the spin for a safe single",2nd innings,30.2,run,109,1,109/5,"Taylor to Sohrawordi Shuvo, 1 run",,"Shuvo reaches out and drives through the covers, with the spin for a safe single",5
483,183,Shakib Al Hasan,56143,Brendan Taylor,55814,"Taylor to Shakib Al Hasan, no run Shakib looks to work one off the pads and misses, bowler and keeper go up in a loud appeal, but that was mostly in hope. It landed a few inches outside leg.",2nd innings,30.3,no run,109,0,109/5,"Taylor to Shakib Al Hasan, no run",,"Shakib looks to work one off the pads and misses, bowler and keeper go up in a loud appeal, but that was mostly in hope. It landed a few inches outside leg.",5
484,184,Shakib Al Hasan,56143,Brendan Taylor,55814,"Taylor to Shakib Al Hasan, no run plays watchfully into the off side",2nd innings,30.4,no run,109,0,109/5,"Taylor to Shakib Al Hasan, no run",,plays watchfully into the off side,5
485,185,Shakib Al Hasan,56143,Brendan Taylor,55814,"Taylor to Shakib Al Hasan, 1 run clips him off the pads against the spin and he will pick a single to square leg",2nd innings,30.5,run,110,1,110/5,"Taylor to Shakib Al Hasan, 1 run",,clips him off the pads against the spin and he will pick a single to square leg,5
486,186,Sohrawordi Shuvo,56138,Brendan Taylor,55814,"Taylor to Sohrawordi Shuvo, no run ",2nd innings,30.6,no run,110,0,110/5,"Taylor to Sohrawordi Shuvo, no run",,,5
487,187,Shakib Al Hasan,56143,Keith Dabengwa,55388,"Dabengwa to Shakib Al Hasan, no run another loud appeal, Shakib is hit on the pads as he looks to work it from outside off. Turned down.",2nd innings,31.1,no run,110,0,110/5,"Dabengwa to Shakib Al Hasan, no run",,"another loud appeal, Shakib is hit on the pads as he looks to work it from outside off. Turned down.",5
488,188,Shakib Al Hasan,56143,Keith Dabengwa,55388,"Dabengwa to Shakib Al Hasan, no run defends this one from off stump line towards the covers",2nd innings,31.2,no run,110,0,110/5,"Dabengwa to Shakib Al Hasan, no run",,defends this one from off stump line towards the covers,5
489,189,Shakib Al Hasan,56143,Keith Dabengwa,55388,"Dabengwa to Shakib Al Hasan, 1 run over-pitched on middle and leg, he drives it towards midwicket",2nd innings,31.3,run,111,1,111/5,"Dabengwa to Shakib Al Hasan, 1 run",,"over-pitched on middle and leg, he drives it towards midwicket",5
490,190,Sohrawordi Shuvo,56138,Keith Dabengwa,55388,"Dabengwa to Sohrawordi Shuvo, FOUR runs edged? steered? Shuvo will say it was the latter, he did belatedly open the face and guided it perilously close to the keeper. Oohs and aahs all around but it purrs away to the boundary",2nd innings,31.4,four,115,4,115/5,"Dabengwa to Sohrawordi Shuvo, FOUR runs",,"edged? steered? Shuvo will say it was the latter, he did belatedly open the face and guided it perilously close to the keeper. Oohs and aahs all around but it purrs away to the boundary",5
