,ball,batsman,batsman_id,bowler,bowler_id,commentary,innings,overs,playType,runs,runs_scored,score,shortText,speed,text,wickets
0,0,Brendan Taylor,55814,Mashrafe Mortaza,56007,"Mashrafe Mortaza to Taylor, 5 wides strays way down the leg side first up, Rahim had no chance behind the stumps",1st innings,0.0,wide,5,5,5/0,"Mashrafe Mortaza to Taylor, 5 wides",,"strays way down the leg side first up, Rahim had no chance behind the stumps",0
1,1,Brendan Taylor,55814,Mashrafe Mortaza,56007,"Mashrafe Mortaza to Taylor, no run better line this time from Mash, gets some shape away from outside off stump, left alone",1st innings,0.1,no run,5,0,5/0,"Mashrafe Mortaza to Taylor, no run",,"better line this time from Mash, gets some shape away from outside off stump, left alone",0
2,2,Brendan Taylor,55814,Mashrafe Mortaza,56007,"Mashrafe Mortaza to Taylor, no run now this one comes in from around off, Taylor thought it would go away and was in no position to play as it jagged back in, and was beaten",1st innings,0.2,no run,5,0,5/0,"Mashrafe Mortaza to Taylor, no run",,"now this one comes in from around off, Taylor thought it would go away and was in no position to play as it jagged back in, and was beaten",0
3,3,Brendan Taylor,55814,Mashrafe Mortaza,56007,"Mashrafe Mortaza to Taylor, 1 run gives him an offcutter now, off the inside edge to fine leg",1st innings,0.3,run,6,1,6/0,"Mashrafe Mortaza to Taylor, 1 run",,"gives him an offcutter now, off the inside edge to fine leg",0
4,4,Chamu Chibhabha,55354,Mashrafe Mortaza,56007,"Mashrafe Mortaza to Chibhabha, no run in the zone outside off from Mash, Chamu lets it go, again some away shape for the bowler",1st innings,0.4,no run,6,0,6/0,"Mashrafe Mortaza to Chibhabha, no run",,"in the zone outside off from Mash, Chamu lets it go, again some away shape for the bowler",0
5,5,Chamu Chibhabha,55354,Mashrafe Mortaza,56007,"Mashrafe Mortaza to Chibhabha, no run goes back in the crease to defend this length ball on off to cover",1st innings,0.5,no run,6,0,6/0,"Mashrafe Mortaza to Chibhabha, no run",,goes back in the crease to defend this length ball on off to cover,0
6,6,Chamu Chibhabha,55354,Mashrafe Mortaza,56007,"Mashrafe Mortaza to Chibhabha, 1 run straighter this time on middle and leg, clipped in the gap at midwicket for a single, tight lines from Mash after that wayward delivery first up",1st innings,0.6,run,7,1,7/0,"Mashrafe Mortaza to Chibhabha, 1 run",,"straighter this time on middle and leg, clipped in the gap at midwicket for a single, tight lines from Mash after that wayward delivery first up",0
7,7,Chamu Chibhabha,55354,Shafiul Islam,288305,"Shafiul Islam to Chibhabha, no run lovely delivery from Shafiul, around off stump, and nipping away off the seam, he pushes forward and is beaten comprehensively",1st innings,1.1,no run,7,0,7/0,"Shafiul Islam to Chibhabha, no run",,"lovely delivery from Shafiul, around off stump, and nipping away off the seam, he pushes forward and is beaten comprehensively",0
8,8,Chamu Chibhabha,55354,Shafiul Islam,288305,"Shafiul Islam to Chibhabha, no run fuller now, driven forcefully down to mid off",1st innings,1.2,no run,7,0,7/0,"Shafiul Islam to Chibhabha, no run",,"fuller now, driven forcefully down to mid off",0
9,9,Chamu Chibhabha,55354,Shafiul Islam,288305,"Shafiul Islam to Chibhabha, FOUR runs digs it short, and Chibhabha goes for the pull, but he was late on the shot, and got it in the air just wide of the diving mid on fielder for the first boundary of the match",1st innings,1.3,four,11,4,11/0,"Shafiul Islam to Chibhabha, FOUR runs",,"digs it short, and Chibhabha goes for the pull, but he was late on the shot, and got it in the air just wide of the diving mid on fielder for the first boundary of the match",0
10,10,Chamu Chibhabha,55354,Shafiul Islam,288305,"Shafiul Islam to Chibhabha, no run goes for the cut to a ball shaping away from him off a length, and misses",1st innings,1.4,no run,11,0,11/0,"Shafiul Islam to Chibhabha, no run",,"goes for the cut to a ball shaping away from him off a length, and misses",0
11,11,Chamu Chibhabha,55354,Shafiul Islam,288305,"Shafiul Islam to Chibhabha, 1 leg bye dug in shortish again and angled into the body, he is hit high on the thigh pad, and they take a quick leg bye as it rolls away in front of point",1st innings,1.5,leg bye,12,1,12/0,"Shafiul Islam to Chibhabha, 1 leg bye",,"dug in shortish again and angled into the body, he is hit high on the thigh pad, and they take a quick leg bye as it rolls away in front of point",0
12,12,Brendan Taylor,55814,Shafiul Islam,288305,"Shafiul Islam to Taylor, 1 run stays back in the crease, and guides this length delivery to third man for a single, deftly done",1st innings,1.6,run,13,1,13/0,"Shafiul Islam to Taylor, 1 run",,"stays back in the crease, and guides this length delivery to third man for a single, deftly done",0
13,13,Brendan Taylor,55814,Mashrafe Mortaza,56007,"Mashrafe Mortaza to Taylor, 1 run tucked away behind short square leg off the pads, and they rush through for a single",1st innings,2.1,run,14,1,14/0,"Mashrafe Mortaza to Taylor, 1 run",,"tucked away behind short square leg off the pads, and they rush through for a single",0
14,14,Chamu Chibhabha,55354,Mashrafe Mortaza,56007,"Mashrafe Mortaza to Chibhabha, no run left alone outside off stump",1st innings,2.2,no run,14,0,14/0,"Mashrafe Mortaza to Chibhabha, no run",,left alone outside off stump,0
15,15,Chamu Chibhabha,55354,Mashrafe Mortaza,56007,"Mashrafe Mortaza to Chibhabha, no run worked away to midwicket off the back foot",1st innings,2.3,no run,14,0,14/0,"Mashrafe Mortaza to Chibhabha, no run",,worked away to midwicket off the back foot,0
16,16,Chamu Chibhabha,55354,Mashrafe Mortaza,56007,"Mashrafe Mortaza to Chibhabha, no run gives him no room as he digs this one into the body, defended down the track",1st innings,2.4,no run,14,0,14/0,"Mashrafe Mortaza to Chibhabha, no run",,"gives him no room as he digs this one into the body, defended down the track",0
17,17,Chamu Chibhabha,55354,Mashrafe Mortaza,56007,"Mashrafe Mortaza to Chibhabha, no run that was close! it was a pacy delivery on the stumps, and Chibhabha was hit high on the thigh pad, as the ball rolled away towards the off side, Taylor rushed half way down the pitch for a single, Chibhabha was in no position to run, Taylor rushed back and if the throw had hit, he would have struggled",1st innings,2.5,no run,14,0,14/0,"Mashrafe Mortaza to Chibhabha, no run",,"that was close! it was a pacy delivery on the stumps, and Chibhabha was hit high on the thigh pad, as the ball rolled away towards the off side, Taylor rushed half way down the pitch for a single, Chibhabha was in no position to run, Taylor rushed back and if the throw had hit, he would have struggled",0
18,18,Chamu Chibhabha,55354,Mashrafe Mortaza,56007,"Mashrafe Mortaza to Chibhabha, no run left well alone outside off",1st innings,2.6,no run,14,0,14/0,"Mashrafe Mortaza to Chibhabha, no run",,left well alone outside off,0
19,19,Brendan Taylor,55814,Shafiul Islam,288305,"Shafiul Islam to Taylor, FOUR runs thwack! it as in the slot outside off, and Taylor got down on one knee, and sent it racing through the covers for a boundary, excellent placement",1st innings,3.1,four,18,4,18/0,"Shafiul Islam to Taylor, FOUR runs",,"thwack! it as in the slot outside off, and Taylor got down on one knee, and sent it racing through the covers for a boundary, excellent placement",0
20,20,Brendan Taylor,55814,Shafiul Islam,288305,"Shafiul Islam to Taylor, no run loud appeal for leg before, but there was an inside edge there as he looked to clip the angled delivery through midiwicket",1st innings,3.2,no run,18,0,18/0,"Shafiul Islam to Taylor, no run",,"loud appeal for leg before, but there was an inside edge there as he looked to clip the angled delivery through midiwicket",0
21,21,Brendan Taylor,55814,Shafiul Islam,288305,"Shafiul Islam to Taylor, no run this one kept a bit low, and Taylor went back to punch it to Shafiul",1st innings,3.3,no run,18,0,18/0,"Shafiul Islam to Taylor, no run",,"this one kept a bit low, and Taylor went back to punch it to Shafiul",0
22,22,Brendan Taylor,55814,Shafiul Islam,288305,"Shafiul Islam to Taylor, no run squares him up a bit, he was trying to guide this length ball through midwicket, and it skidded through and he got a leading edge into the off side",1st innings,3.4,no run,18,0,18/0,"Shafiul Islam to Taylor, no run",,"squares him up a bit, he was trying to guide this length ball through midwicket, and it skidded through and he got a leading edge into the off side",0
23,23,Brendan Taylor,55814,Shafiul Islam,288305,"Shafiul Islam to Taylor, no run fuller on the stumps, driven down to mid on",1st innings,3.5,no run,18,0,18/0,"Shafiul Islam to Taylor, no run",,"fuller on the stumps, driven down to mid on",0
24,24,Brendan Taylor,55814,Shafiul Islam,288305,"Shafiul Islam to Taylor, no run similar delivery, a touch wider outside off, he finds mid off this time with the drive",1st innings,3.6,no run,18,0,18/0,"Shafiul Islam to Taylor, no run",,"similar delivery, a touch wider outside off, he finds mid off this time with the drive",0
25,25,Chamu Chibhabha,55354,Mashrafe Mortaza,56007,"Mashrafe Mortaza to Chibhabha, 1 run gets half forward and runs down a length delivery to third man for a single",1st innings,4.1,run,19,1,19/0,"Mashrafe Mortaza to Chibhabha, 1 run",,gets half forward and runs down a length delivery to third man for a single,0
26,26,Brendan Taylor,55814,Mashrafe Mortaza,56007,"Mashrafe Mortaza to Taylor, FOUR runs short and wide, and he stands tall and slaps it through extra cover, who ends up chasing it all the way to the boundary, Razzak it was",1st innings,4.2,four,23,4,23/0,"Mashrafe Mortaza to Taylor, FOUR runs",,"short and wide, and he stands tall and slaps it through extra cover, who ends up chasing it all the way to the boundary, Razzak it was",0
27,27,Brendan Taylor,55814,Mashrafe Mortaza,56007,"Mashrafe Mortaza to Taylor, FOUR runs another one now, take that, this ball was a touch fuller, he eased it into the gap at extra cover for another boundary",1st innings,4.3,four,27,4,27/0,"Mashrafe Mortaza to Taylor, FOUR runs",,"another one now, take that, this ball was a touch fuller, he eased it into the gap at extra cover for another boundary",0
28,28,Brendan Taylor,55814,Mashrafe Mortaza,56007,"Mashrafe Mortaza to Taylor, 1 run <b>run out opportunity missed</b> it was tucked away to deep square, they went for the second which wasn't there, the throw came to Rahim at a comfortable height on the stumps, the batsman was not even in the picture, but Rahim could not collect, what a let off",1st innings,4.4,run,28,1,28/0,"Mashrafe Mortaza to Taylor, 1 run",,"<b>run out opportunity missed</b> it was tucked away to deep square, they went for the second which wasn't there, the throw came to Rahim at a comfortable height on the stumps, the batsman was not even in the picture, but Rahim could not collect, what a let off",0
29,29,Chamu Chibhabha,55354,Mashrafe Mortaza,56007,"Mashrafe Mortaza to Chibhabha, no run cuts him in half as it jags back from a length outside off",1st innings,4.5,no run,28,0,28/0,"Mashrafe Mortaza to Chibhabha, no run",,cuts him in half as it jags back from a length outside off,0
30,30,Chamu Chibhabha,55354,Mashrafe Mortaza,56007,"Mashrafe Mortaza to Chibhabha, no run defended to cover",1st innings,4.6,no run,28,0,28/0,"Mashrafe Mortaza to Chibhabha, no run",,defended to cover,0
31,31,Brendan Taylor,55814,Shafiul Islam,288305,"Shafiul Islam to Taylor, 2 runs pulled away to backward square, they are pushing for the second run now, Taylor just about makes his ground as this time Rahim makes no mistake with the take, and whips off the bails, replays confirm that",1st innings,5.1,run,30,2,30/0,"Shafiul Islam to Taylor, 2 runs",,"pulled away to backward square, they are pushing for the second run now, Taylor just about makes his ground as this time Rahim makes no mistake with the take, and whips off the bails, replays confirm that",0
32,32,Brendan Taylor,55814,Shafiul Islam,288305,"Shafiul Islam to Taylor, no run defended off the back foot in to the off side, off an inside edge",1st innings,5.2,no run,30,0,30/0,"Shafiul Islam to Taylor, no run",,"defended off the back foot in to the off side, off an inside edge",0
33,33,Brendan Taylor,55814,Shafiul Islam,288305,"Shafiul Islam to Taylor, no run mid on puts in the dive and saves a certain boundary, it was driven hard down the ground close to the non-striker, but the fielder ran across and saved four runs",1st innings,5.3,no run,30,0,30/0,"Shafiul Islam to Taylor, no run",,"mid on puts in the dive and saves a certain boundary, it was driven hard down the ground close to the non-striker, but the fielder ran across and saved four runs",0
34,34,Brendan Taylor,55814,Shafiul Islam,288305,"Shafiul Islam to Taylor, no run fuller outside off, gets forward to ease it to point",1st innings,5.4,no run,30,0,30/0,"Shafiul Islam to Taylor, no run",,"fuller outside off, gets forward to ease it to point",0
35,35,Brendan Taylor,55814,Shafiul Islam,288305,"Shafiul Islam to Taylor, no run another good effort in the field, this time at point, saves some more runs for Bangladesh",1st innings,5.5,no run,30,0,30/0,"Shafiul Islam to Taylor, no run",,"another good effort in the field, this time at point, saves some more runs for Bangladesh",0
36,36,Brendan Taylor,55814,Shafiul Islam,288305,"Shafiul Islam to Taylor, 2 runs worked away into the gap at midwicket for a couple, not enough power on the shot to take it all the way",1st innings,5.6,run,32,2,32/0,"Shafiul Islam to Taylor, 2 runs",,"worked away into the gap at midwicket for a couple, not enough power on the shot to take it all the way",0
37,37,Chamu Chibhabha,55354,Mashrafe Mortaza,56007,"Mashrafe Mortaza to Chibhabha, no run Bangladesh are throwing themselves in the field, it was cut away to the left of Shuvo at point who dived across and saved a certain boundary",1st innings,6.1,no run,32,0,32/0,"Mashrafe Mortaza to Chibhabha, no run",,"Bangladesh are throwing themselves in the field, it was cut away to the left of Shuvo at point who dived across and saved a certain boundary",0
38,38,Chamu Chibhabha,55354,Mashrafe Mortaza,56007,"Mashrafe Mortaza to Chibhabha, FOUR runs no saving this one, overpitched on leg, and lifted over mid on for a boundary, clean hit",1st innings,6.2,four,36,4,36/0,"Mashrafe Mortaza to Chibhabha, FOUR runs",,"no saving this one, overpitched on leg, and lifted over mid on for a boundary, clean hit",0
39,39,Chamu Chibhabha,55354,Mashrafe Mortaza,56007,"Mashrafe Mortaza to Chibhabha, no run driven to extra cover, cannot beat the off side ring",1st innings,6.3,no run,36,0,36/0,"Mashrafe Mortaza to Chibhabha, no run",,"driven to extra cover, cannot beat the off side ring",0
40,40,Chamu Chibhabha,55354,Mashrafe Mortaza,56007,"Mashrafe Mortaza to Chibhabha, no run punched off the back foot to mid off",1st innings,6.4,no run,36,0,36/0,"Mashrafe Mortaza to Chibhabha, no run",,punched off the back foot to mid off,0
41,41,Chamu Chibhabha,55354,Mashrafe Mortaza,56007,"Mashrafe Mortaza to Chibhabha, no run good slower one outside off, Chibhabha was too early into the cut, and missed out completely",1st innings,6.5,no run,36,0,36/0,"Mashrafe Mortaza to Chibhabha, no run",,"good slower one outside off, Chibhabha was too early into the cut, and missed out completely",0
42,42,Chamu Chibhabha,55354,Mashrafe Mortaza,56007,"Mashrafe Mortaza to Chibhabha, FOUR runs stays back on the crease this time, and eases another slower one in the gap between cover and point for a boundary, well played",1st innings,6.6,four,40,4,40/0,"Mashrafe Mortaza to Chibhabha, FOUR runs",,"stays back on the crease this time, and eases another slower one in the gap between cover and point for a boundary, well played",0
43,43,Brendan Taylor,55814,Abdur Razzak,56283,"Abdur Razzak to Taylor, no run and gets some turn right away outside off, Taylor is beaten as he pushes forward",1st innings,7.1,no run,40,0,40/0,"Abdur Razzak to Taylor, no run",,"and gets some turn right away outside off, Taylor is beaten as he pushes forward",0
44,44,Brendan Taylor,55814,Abdur Razzak,56283,"Abdur Razzak to Taylor, 1 run reaches out to drive this tossed up ball to long off",1st innings,7.2,run,41,1,41/0,"Abdur Razzak to Taylor, 1 run",,reaches out to drive this tossed up ball to long off,0
45,45,Chamu Chibhabha,55354,Abdur Razzak,56283,"Abdur Razzak to Chibhabha, FOUR runs Chibhabha waits for this one to turn, and cuts it away between cover and point for a boundary",1st innings,7.3,four,45,4,45/0,"Abdur Razzak to Chibhabha, FOUR runs",,"Chibhabha waits for this one to turn, and cuts it away between cover and point for a boundary",0
46,46,Chamu Chibhabha,55354,Abdur Razzak,56283,"Abdur Razzak to Chibhabha, 1 run gets forward to drive this one wide of mid on",1st innings,7.4,run,46,1,46/0,"Abdur Razzak to Chibhabha, 1 run",,gets forward to drive this one wide of mid on,0
47,47,Brendan Taylor,55814,Abdur Razzak,56283,"Abdur Razzak to Taylor, no run defended towards short midwicket",1st innings,7.5,no run,46,0,46/0,"Abdur Razzak to Taylor, no run",,defended towards short midwicket,0
48,48,Brendan Taylor,55814,Abdur Razzak,56283,"Abdur Razzak to Taylor, no run quicker on the stumps, he pushes forward to defend down the track",1st innings,7.6,no run,46,0,46/0,"Abdur Razzak to Taylor, no run",,"quicker on the stumps, he pushes forward to defend down the track",0
49,49,Chamu Chibhabha,55354,Mashrafe Mortaza,56007,"Mashrafe Mortaza to Chibhabha, no run goes across and tries to work this back of a length delivery to midwicket, gets it down to mid on, they abandon premature thoughts of a single",1st innings,8.1,no run,46,0,46/0,"Mashrafe Mortaza to Chibhabha, no run",,"goes across and tries to work this back of a length delivery to midwicket, gets it down to mid on, they abandon premature thoughts of a single",0
50,50,Chamu Chibhabha,55354,Mashrafe Mortaza,56007,"Mashrafe Mortaza to Chibhabha, 3 runs another run out chance, Chibhabha had punched a length delivery thorough cover, and they decided to go for the third, Chibhabha was a bit late in going for the run and had to put in a full length dive at the non-striker's even as Ashraful whipped off the bails, replays show he had just about made it",1st innings,8.2,run,49,3,49/0,"Mashrafe Mortaza to Chibhabha, 3 runs",,"another run out chance, Chibhabha had punched a length delivery thorough cover, and they decided to go for the third, Chibhabha was a bit late in going for the run and had to put in a full length dive at the non-striker's even as Ashraful whipped off the bails, replays show he had just about made it",0
51,51,Brendan Taylor,55814,Mashrafe Mortaza,56007,"Mashrafe Mortaza to Taylor, no run Mash is getting the ball to shape away from a length around off, Taylor lets it go",1st innings,8.3,no run,49,0,49/0,"Mashrafe Mortaza to Taylor, no run",,"Mash is getting the ball to shape away from a length around off, Taylor lets it go",0
52,52,Brendan Taylor,55814,Mashrafe Mortaza,56007,"Mashrafe Mortaza to Taylor, no run more away shape for Mash outside off, Taylor gets forward and shoulders arms",1st innings,8.4,no run,49,0,49/0,"Mashrafe Mortaza to Taylor, no run",,"more away shape for Mash outside off, Taylor gets forward and shoulders arms",0
53,53,Brendan Taylor,55814,Mashrafe Mortaza,56007,"Mashrafe Mortaza to Taylor, 1 run opens the face of the bat to guide this length delivery to the left of point for a quick single, and that brings up the 50 stand",1st innings,8.5,run,50,1,50/0,"Mashrafe Mortaza to Taylor, 1 run",,"opens the face of the bat to guide this length delivery to the left of point for a quick single, and that brings up the 50 stand",0
54,54,Chamu Chibhabha,55354,Mashrafe Mortaza,56007,"Mashrafe Mortaza to Chibhabha, 2 runs gets forward and gets a thick outside edge in front of third man, and good running gives them two runs",1st innings,8.6,run,52,2,52/0,"Mashrafe Mortaza to Chibhabha, 2 runs",,"gets forward and gets a thick outside edge in front of third man, and good running gives them two runs",0
55,55,Brendan Taylor,55814,Abdur Razzak,56283,"Abdur Razzak to Taylor, no run defended off the front foot into the off side",1st innings,9.1,no run,52,0,52/0,"Abdur Razzak to Taylor, no run",,defended off the front foot into the off side,0
56,56,Brendan Taylor,55814,Abdur Razzak,56283,"Abdur Razzak to Taylor, no run slapped back to the bowler off the back foot",1st innings,9.2,no run,52,0,52/0,"Abdur Razzak to Taylor, no run",,slapped back to the bowler off the back foot,0
57,57,Brendan Taylor,55814,Abdur Razzak,56283,"Abdur Razzak to Taylor, 1 run pushed down to long off for a single",1st innings,9.3,run,53,1,53/0,"Abdur Razzak to Taylor, 1 run",,pushed down to long off for a single,0
58,58,Chamu Chibhabha,55354,Abdur Razzak,56283,"Abdur Razzak to Chibhabha, no run quicker and going straight on the stumps, he goes back to cut it to point",1st innings,9.4,no run,53,0,53/0,"Abdur Razzak to Chibhabha, no run",,"quicker and going straight on the stumps, he goes back to cut it to point",0
59,59,Chamu Chibhabha,55354,Abdur Razzak,56283,"Abdur Razzak to Chibhabha, no run turned to short midwicket who dives and fields",1st innings,9.5,no run,53,0,53/0,"Abdur Razzak to Chibhabha, no run",,turned to short midwicket who dives and fields,0
60,60,Chamu Chibhabha,55354,Abdur Razzak,56283,"Abdur Razzak to Chibhabha, OUT bowled 'em! spin gets Bangladesh the breakthrough, it was flighted nicely on the stumps, Chibhabha went for the big heave over midwicket on one knee, was beaten in flight, and the ball crashed into the stumps, he has thrown away a good start here",1st innings,9.6,out,53,0,53/1,"Abdur Razzak to Chibhabha, OUT",,"bowled 'em! spin gets Bangladesh the breakthrough, it was flighted nicely on the stumps, Chibhabha went for the big heave over midwicket on one knee, was beaten in flight, and the ball crashed into the stumps, he has thrown away a good start here",1
61,61,Brendan Taylor,55814,Mashrafe Mortaza,56007,"Mashrafe Mortaza to Taylor, no run goes back to defend this back of a length delivery back to the bowler",1st innings,10.1,no run,53,0,53/1,"Mashrafe Mortaza to Taylor, no run",,goes back to defend this back of a length delivery back to the bowler,1
62,62,Brendan Taylor,55814,Mashrafe Mortaza,56007,"Mashrafe Mortaza to Taylor, FOUR runs Mash produces the edge, as the batsman poked at a delivery outside off, and it runs to the right of Rahim for a boundary, Mortaza can't believe it",1st innings,10.2,four,57,4,57/1,"Mashrafe Mortaza to Taylor, FOUR runs",,"Mash produces the edge, as the batsman poked at a delivery outside off, and it runs to the right of Rahim for a boundary, Mortaza can't believe it",1
63,63,Brendan Taylor,55814,Mashrafe Mortaza,56007,"Mashrafe Mortaza to Taylor, 1 leg bye now he strays down the leg side, the ball dies on its way to the keeper, and he fails to collect even as he puts in the dive",1st innings,10.3,leg bye,58,1,58/1,"Mashrafe Mortaza to Taylor, 1 leg bye",,"now he strays down the leg side, the ball dies on its way to the keeper, and he fails to collect even as he puts in the dive",1
64,64,Regis Chakabva,293831,Mashrafe Mortaza,56007,"Mashrafe Mortaza to Chakabva, no run overpitched on the stumps, driven but finds short extra cover in the way",1st innings,10.4,no run,58,0,58/1,"Mashrafe Mortaza to Chakabva, no run",,"overpitched on the stumps, driven but finds short extra cover in the way",1
65,65,Regis Chakabva,293831,Mashrafe Mortaza,56007,"Mashrafe Mortaza to Chakabva, no run gets forward and leaves this length ball outside off with a flourish",1st innings,10.5,no run,58,0,58/1,"Mashrafe Mortaza to Chakabva, no run",,gets forward and leaves this length ball outside off with a flourish,1
66,66,Regis Chakabva,293831,Mashrafe Mortaza,56007,"Mashrafe Mortaza to Chakabva, no run gets an inside edge towards square leg as he defends off the back foot",1st innings,10.6,no run,58,0,58/1,"Mashrafe Mortaza to Chakabva, no run",,gets an inside edge towards square leg as he defends off the back foot,1
67,67,Brendan Taylor,55814,Abdur Razzak,56283,"Abdur Razzak to Taylor, no run tossed up and turning outside off, left alone",1st innings,11.1,no run,58,0,58/1,"Abdur Razzak to Taylor, no run",,"tossed up and turning outside off, left alone",1
68,68,Brendan Taylor,55814,Abdur Razzak,56283,"Abdur Razzak to Taylor, OUT this is lovely bowling, it was flighted teasingly around off, and lured him forward, it turned across the bat face and Rahim had the bails off in a flash, replays show Taylor's foot was in the air as he pushed forward, he failed to get it back in time, and Razzak has removed the openers",1st innings,11.2,out,58,0,58/2,"Abdur Razzak to Taylor, OUT",,"this is lovely bowling, it was flighted teasingly around off, and lured him forward, it turned across the bat face and Rahim had the bails off in a flash, replays show Taylor's foot was in the air as he pushed forward, he failed to get it back in time, and Razzak has removed the openers",2
69,69,Elton Chigumbura,55343,Abdur Razzak,56283,"Abdur Razzak to Chigumbura, no run another tossed up ball around off, Elton gets forward to push out to point",1st innings,11.3,no run,58,0,58/2,"Abdur Razzak to Chigumbura, no run",,"another tossed up ball around off, Elton gets forward to push out to point",2
70,70,Elton Chigumbura,55343,Abdur Razzak,56283,"Abdur Razzak to Chigumbura, no run turns across the batsman, who leaves it alone",1st innings,11.4,no run,58,0,58/2,"Abdur Razzak to Chigumbura, no run",,"turns across the batsman, who leaves it alone",2
71,71,Elton Chigumbura,55343,Abdur Razzak,56283,"Abdur Razzak to Chigumbura, 1 run waits for it to turn, it was a touch short too, and cuts it away to sweeper cover",1st innings,11.5,run,59,1,59/2,"Abdur Razzak to Chigumbura, 1 run",,"waits for it to turn, it was a touch short too, and cuts it away to sweeper cover",2
