,ball,batsman,batsman_id,bowler,bowler_id,commentary,innings,overs,playType,runs,runs_scored,score,shortText,speed,text,wickets
395,95,Brad Haddin,5560,Luke Wright,23460,"Wright to Haddin, FOUR runs and this time Haddin finds the gap behind square with his pull around the corner, Wright has been much too straight this over, trying to overcorrect and not allow Haddin to go over the off side",2nd innings,15.5,four,80,4,80/3,"Wright to Haddin, FOUR runs",,"and this time Haddin finds the gap behind square with his pull around the corner, Wright has been much too straight this over, trying to overcorrect and not allow Haddin to go over the off side",3
396,96,Brad Haddin,5560,Luke Wright,23460,"Wright to Haddin, 1 run another one angles down leg, and this time Haddin glances behind square",2nd innings,15.6,run,81,1,81/3,"Wright to Haddin, 1 run",,"another one angles down leg, and this time Haddin glances behind square",3
397,97,Brad Haddin,5560,Chris Woakes,247235,"Woakes to Haddin, no run Haddin defends solidly now, he's pinned inside the crease with Prior up to the stumps",2nd innings,16.1,no run,81,0,81/3,"Woakes to Haddin, no run",,"Haddin defends solidly now, he's pinned inside the crease with Prior up to the stumps",3
398,98,Brad Haddin,5560,Chris Woakes,247235,"Woakes to Haddin, 1 run a single this time as Haddin late cuts and gets un under-edge into the turf, just wide of Prior",2nd innings,16.2,run,82,1,82/3,"Woakes to Haddin, 1 run",,"a single this time as Haddin late cuts and gets un under-edge into the turf, just wide of Prior",3
399,99,Cameron White,8291,Chris Woakes,247235,"Woakes to White, no run pushed away to the off side",2nd innings,16.3,no run,82,0,82/3,"Woakes to White, no run",,pushed away to the off side,3
400,100,Cameron White,8291,Chris Woakes,247235,"Woakes to White, 3 runs White is sick of being bogged down, and he launches everything at a big drive over the off side, getting it much higher than he intended but it lands safely in the outfield, not timed as he would have liked",2nd innings,16.4,run,85,3,85/3,"Woakes to White, 3 runs",,"White is sick of being bogged down, and he launches everything at a big drive over the off side, getting it much higher than he intended but it lands safely in the outfield, not timed as he would have liked",3
401,101,Brad Haddin,5560,Chris Woakes,247235,"Woakes to Haddin, 1 run Haddin, though, is in control, and he drives along the ground through mid-off",2nd innings,16.5,run,86,1,86/3,"Woakes to Haddin, 1 run",,"Haddin, though, is in control, and he drives along the ground through mid-off",3
402,102,Cameron White,8291,Chris Woakes,247235,"Woakes to White, 1 run White punches to point and takes off for a quick single, that's good running to keep the scoreboard ticking over",2nd innings,16.6,run,87,1,87/3,"Woakes to White, 1 run",,"White punches to point and takes off for a quick single, that's good running to keep the scoreboard ticking over",3
403,103,Cameron White,8291,Michael Yardy,23523,"Yardy to White, no run cut away to point but can't find the gap",2nd innings,17.1,no run,87,0,87/3,"Yardy to White, no run",,cut away to point but can't find the gap,3
404,104,Cameron White,8291,Michael Yardy,23523,"Yardy to White, no run White leans forward and defends",2nd innings,17.2,no run,87,0,87/3,"Yardy to White, no run",,White leans forward and defends,3
405,105,Cameron White,8291,Michael Yardy,23523,"Yardy to White, no run Yardy angles it in to White, who defends",2nd innings,17.3,no run,87,0,87/3,"Yardy to White, no run",,"Yardy angles it in to White, who defends",3
406,106,Cameron White,8291,Michael Yardy,23523,"Yardy to White, 1 run White comes down the pitch now and just works a single through mid-on",2nd innings,17.4,run,88,1,88/3,"Yardy to White, 1 run",,White comes down the pitch now and just works a single through mid-on,3
407,107,Brad Haddin,5560,Michael Yardy,23523,"Yardy to Haddin, FOUR runs lovely shot! The man at deep point had just that very ball come into the circle, and Haddin eased one, just steered it, forward of point and away to the newly vacated boundary",2nd innings,17.5,four,92,4,92/3,"Yardy to Haddin, FOUR runs",,"lovely shot! The man at deep point had just that very ball come into the circle, and Haddin eased one, just steered it, forward of point and away to the newly vacated boundary",3
408,108,Brad Haddin,5560,Michael Yardy,23523,"Yardy to Haddin, no run defended back down the pitch",2nd innings,17.6,no run,92,0,92/3,"Yardy to Haddin, no run",,defended back down the pitch,3
409,109,Cameron White,8291,Paul Collingwood,10772,"Collingwood to White, no run White walks across and clunks it back to Collingwood",2nd innings,18.1,no run,92,0,92/3,"Collingwood to White, no run",,White walks across and clunks it back to Collingwood,3
410,110,Cameron White,8291,Paul Collingwood,10772,"Collingwood to White, OUT White is gone! Collingwood strikes! Angling the ball in, he strikes White on the pad and Reiffel gives him out. White wants a <b>review</b> - there were two noises and height looked like it would be an issue, but the replays show that hit both pads, and was clipping the top of leg stump, so the decision stands",2nd innings,18.2,out,92,0,92/4,"Collingwood to White, OUT",,"White is gone! Collingwood strikes! Angling the ball in, he strikes White on the pad and Reiffel gives him out. White wants a <b>review</b> - there were two noises and height looked like it would be an issue, but the replays show that hit both pads, and was clipping the top of leg stump, so the decision stands",4
411,110,David Hussey,5766,Paul Collingwood,10772,"Collingwood to Hussey, 1 wide pushed well wide of off stump and Hussey leaves it, the umpire calls wide",2nd innings,18.2,wide,93,1,93/4,"Collingwood to Hussey, 1 wide",,"pushed well wide of off stump and Hussey leaves it, the umpire calls wide",4
412,111,David Hussey,5766,Paul Collingwood,10772,"Collingwood to Hussey, no run Hussey leans across and defends to off",2nd innings,18.3,no run,93,0,93/4,"Collingwood to Hussey, no run",,Hussey leans across and defends to off,4
413,112,David Hussey,5766,Paul Collingwood,10772,"Collingwood to Hussey, no run Collingwood angles it in again and it's defended back down the pitch",2nd innings,18.4,no run,93,0,93/4,"Collingwood to Hussey, no run",,Collingwood angles it in again and it's defended back down the pitch,4
414,113,David Hussey,5766,Paul Collingwood,10772,"Collingwood to Hussey, no run punched to cover and can't find the gap",2nd innings,18.5,no run,93,0,93/4,"Collingwood to Hussey, no run",,punched to cover and can't find the gap,4
415,114,David Hussey,5766,Paul Collingwood,10772,"Collingwood to Hussey, 1 run punched through cover and Hussey gets a single to get off the mark",2nd innings,18.6,run,94,1,94/4,"Collingwood to Hussey, 1 run",,punched through cover and Hussey gets a single to get off the mark,4
416,115,David Hussey,5766,Michael Yardy,23523,"Yardy to Hussey, 1 leg bye angled down leg and Hussey gets a tickle of pad on that, past Prior",2nd innings,19.1,leg bye,95,1,95/4,"Yardy to Hussey, 1 leg bye",,"angled down leg and Hussey gets a tickle of pad on that, past Prior",4
417,116,Brad Haddin,5560,Michael Yardy,23523,"Yardy to Haddin, no run defended away to the off side",2nd innings,19.2,no run,95,0,95/4,"Yardy to Haddin, no run",,defended away to the off side,4
418,117,Brad Haddin,5560,Michael Yardy,23523,"Yardy to Haddin, no run pushed away defensively again",2nd innings,19.3,no run,95,0,95/4,"Yardy to Haddin, no run",,pushed away defensively again,4
419,118,Brad Haddin,5560,Michael Yardy,23523,"Yardy to Haddin, 1 run well done by Haddin to wait on this outside off and then dab a safe single through the vacant slips region",2nd innings,19.4,run,96,1,96/4,"Yardy to Haddin, 1 run",,well done by Haddin to wait on this outside off and then dab a safe single through the vacant slips region,4
420,119,David Hussey,5766,Michael Yardy,23523,"Yardy to Hussey, 1 run nudged away to point and Hussey gets a single",2nd innings,19.5,run,97,1,97/4,"Yardy to Hussey, 1 run",,nudged away to point and Hussey gets a single,4
421,120,Brad Haddin,5560,Michael Yardy,23523,"Yardy to Haddin, 1 run tossed up and curving in to leg, Haddin just eases a single down to long-on",2nd innings,19.6,run,98,1,98/4,"Yardy to Haddin, 1 run",,"tossed up and curving in to leg, Haddin just eases a single down to long-on",4
422,121,Brad Haddin,5560,Paul Collingwood,10772,"Collingwood to Haddin, no run Haddin opens the face and runs it to short third man, can't find a run",2nd innings,20.1,no run,98,0,98/4,"Collingwood to Haddin, no run",,"Haddin opens the face and runs it to short third man, can't find a run",4
423,122,Brad Haddin,5560,Paul Collingwood,10772,"Collingwood to Haddin, no run defended back down the pitch",2nd innings,20.2,no run,98,0,98/4,"Collingwood to Haddin, no run",,defended back down the pitch,4
424,123,Brad Haddin,5560,Paul Collingwood,10772,"Collingwood to Haddin, no run good, accurate stuff from Collingwood and Haddin can only defend",2nd innings,20.3,no run,98,0,98/4,"Collingwood to Haddin, no run",,"good, accurate stuff from Collingwood and Haddin can only defend",4
425,124,Brad Haddin,5560,Paul Collingwood,10772,"Collingwood to Haddin, 1 run deftly done by Haddin, dabs this fine enough to get a single but third man gets across to cut it off",2nd innings,20.4,run,99,1,99/4,"Collingwood to Haddin, 1 run",,"deftly done by Haddin, dabs this fine enough to get a single but third man gets across to cut it off",4
426,125,David Hussey,5766,Paul Collingwood,10772,"Collingwood to Hussey, 1 run Hussey pushes quite hard to mid-off but is confident there's a run there, and indeed, there is",2nd innings,20.5,run,100,1,100/4,"Collingwood to Hussey, 1 run",,"Hussey pushes quite hard to mid-off but is confident there's a run there, and indeed, there is",4
427,126,Brad Haddin,5560,Paul Collingwood,10772,"Collingwood to Haddin, OUT massive wicket! Huge wicket for England as Haddin tries to drive Collingwood over the boundary but he's only managed to chip it to long-on, where Woakes takes a reasonably straightforward catch",2nd innings,20.6,out,100,0,100/5,"Collingwood to Haddin, OUT",,"massive wicket! Huge wicket for England as Haddin tries to drive Collingwood over the boundary but he's only managed to chip it to long-on, where Woakes takes a reasonably straightforward catch",5
428,127,David Hussey,5766,Michael Yardy,23523,"Yardy to Hussey, 1 run Hussey clips a single down to long-on",2nd innings,21.1,run,101,1,101/5,"Yardy to Hussey, 1 run",,Hussey clips a single down to long-on,5
429,128,Steven Smith,267192,Michael Yardy,23523,"Yardy to Smith, no run good curve in from Yardy coming around the wicket, and Smith defends",2nd innings,21.2,no run,101,0,101/5,"Yardy to Smith, no run",,"good curve in from Yardy coming around the wicket, and Smith defends",5
430,129,Steven Smith,267192,Michael Yardy,23523,"Yardy to Smith, 1 run on the toes and Smith clips through square leg to get off the mark",2nd innings,21.3,run,102,1,102/5,"Yardy to Smith, 1 run",,on the toes and Smith clips through square leg to get off the mark,5
431,130,David Hussey,5766,Michael Yardy,23523,"Yardy to Hussey, no run Hussey leans forward and waits on this one, then dead-bats into the ground",2nd innings,21.4,no run,102,0,102/5,"Yardy to Hussey, no run",,"Hussey leans forward and waits on this one, then dead-bats into the ground",5
432,131,David Hussey,5766,Michael Yardy,23523,"Yardy to Hussey, no run Hussey tries to work through midwicket but finds the fielder",2nd innings,21.5,no run,102,0,102/5,"Yardy to Hussey, no run",,Hussey tries to work through midwicket but finds the fielder,5
433,132,David Hussey,5766,Michael Yardy,23523,"Yardy to Hussey, no run half a thought of a single here as Hussey nudges to cover, then decides against the run",2nd innings,21.6,no run,102,0,102/5,"Yardy to Hussey, no run",,"half a thought of a single here as Hussey nudges to cover, then decides against the run",5
434,133,Steven Smith,267192,Paul Collingwood,10772,"Collingwood to Smith, no run Collingwood attacks the stumps and gives Smith nothing, all he can do is defend",2nd innings,22.1,no run,102,0,102/5,"Collingwood to Smith, no run",,"Collingwood attacks the stumps and gives Smith nothing, all he can do is defend",5
435,134,Steven Smith,267192,Paul Collingwood,10772,"Collingwood to Smith, no run fuller now and Smith drives to cover",2nd innings,22.2,no run,102,0,102/5,"Collingwood to Smith, no run",,fuller now and Smith drives to cover,5
436,135,Steven Smith,267192,Paul Collingwood,10772,"Collingwood to Smith, no run Smith opens the face now and tries to run it fine but gully gets across to save it",2nd innings,22.3,no run,102,0,102/5,"Collingwood to Smith, no run",,Smith opens the face now and tries to run it fine but gully gets across to save it,5
437,136,Steven Smith,267192,Paul Collingwood,10772,"Collingwood to Smith, 1 run similar shot now but more forceful from Smith, and he gets a single to third man",2nd innings,22.4,run,103,1,103/5,"Collingwood to Smith, 1 run",,"similar shot now but more forceful from Smith, and he gets a single to third man",5
438,137,David Hussey,5766,Paul Collingwood,10772,"Collingwood to Hussey, no run punched back past the bowler and it's collected at mid-off",2nd innings,22.5,no run,103,0,103/5,"Collingwood to Hussey, no run",,punched back past the bowler and it's collected at mid-off,5
439,138,David Hussey,5766,Paul Collingwood,10772,"Collingwood to Hussey, no run Hussey tries to flick through leg but finds the man at midwicket",2nd innings,22.6,no run,103,0,103/5,"Collingwood to Hussey, no run",,Hussey tries to flick through leg but finds the man at midwicket,5
440,139,Steven Smith,267192,Michael Yardy,23523,"Yardy to Smith, 1 run full toss and it's clipped through midwicket",2nd innings,23.1,run,104,1,104/5,"Yardy to Smith, 1 run",,full toss and it's clipped through midwicket,5
441,140,David Hussey,5766,Michael Yardy,23523,"Yardy to Hussey, no run Yardy strolls in, tongue waggling like he's Brad Hogg, and drifts it in to Hussey, who defends",2nd innings,23.2,no run,104,0,104/5,"Yardy to Hussey, no run",,"Yardy strolls in, tongue waggling like he's Brad Hogg, and drifts it in to Hussey, who defends",5
442,141,David Hussey,5766,Michael Yardy,23523,"Yardy to Hussey, 1 run driven down past mid-on",2nd innings,23.3,run,105,1,105/5,"Yardy to Hussey, 1 run",,driven down past mid-on,5
443,142,Steven Smith,267192,Michael Yardy,23523,"Yardy to Smith, no run Smith leans forward with bat and pad, and defends",2nd innings,23.4,no run,105,0,105/5,"Yardy to Smith, no run",,"Smith leans forward with bat and pad, and defends",5
444,143,Steven Smith,267192,Michael Yardy,23523,"Yardy to Smith, no run curving in again, and Smith defends watchfully",2nd innings,23.5,no run,105,0,105/5,"Yardy to Smith, no run",,"curving in again, and Smith defends watchfully",5
445,144,Steven Smith,267192,Michael Yardy,23523,"Yardy to Smith, no run another one defended safely to off",2nd innings,23.6,no run,105,0,105/5,"Yardy to Smith, no run",,another one defended safely to off,5
446,145,David Hussey,5766,Paul Collingwood,10772,"Collingwood to Hussey, 2 runs immediately Hussey calls 'two, two, two' as he punches through cover, and they run hard and indeed get the two runs",2nd innings,24.1,run,107,2,107/5,"Collingwood to Hussey, 2 runs",,"immediately Hussey calls 'two, two, two' as he punches through cover, and they run hard and indeed get the two runs",5
447,146,David Hussey,5766,Paul Collingwood,10772,"Collingwood to Hussey, 1 leg bye down leg side now and Hussey gets a leg bye",2nd innings,24.2,leg bye,108,1,108/5,"Collingwood to Hussey, 1 leg bye",,down leg side now and Hussey gets a leg bye,5
448,147,Steven Smith,267192,Paul Collingwood,10772,"Collingwood to Smith, no run defended again, a tad uppishly, but safely to the leg side",2nd innings,24.3,no run,108,0,108/5,"Collingwood to Smith, no run",,"defended again, a tad uppishly, but safely to the leg side",5
449,148,Steven Smith,267192,Paul Collingwood,10772,"Collingwood to Smith, SIX runs yes, it was only a matter of time before Smith decided to go after a ball, and he's got enough on it over square leg! He's just slogged that, lifting it high and just over the rope",2nd innings,24.4,six,114,6,114/5,"Collingwood to Smith, SIX runs",,"yes, it was only a matter of time before Smith decided to go after a ball, and he's got enough on it over square leg! He's just slogged that, lifting it high and just over the rope",5
450,149,Steven Smith,267192,Paul Collingwood,10772,"Collingwood to Smith, no run and he's back into solid defence, bat and pad close together",2nd innings,24.5,no run,114,0,114/5,"Collingwood to Smith, no run",,"and he's back into solid defence, bat and pad close together",5
451,150,Steven Smith,267192,Paul Collingwood,10772,"Collingwood to Smith, no run again Smith defends as Collingwood sends down a slower - that is to say, even slower - ball",2nd innings,24.6,no run,114,0,114/5,"Collingwood to Smith, no run",,"again Smith defends as Collingwood sends down a slower - that is to say, even slower - ball",5
452,151,David Hussey,5766,Ajmal Shahzad,21431,"Shahzad to Hussey, no run left alone outside off stump",2nd innings,25.1,no run,114,0,114/5,"Shahzad to Hussey, no run",,left alone outside off stump,5
453,152,David Hussey,5766,Ajmal Shahzad,21431,"Shahzad to Hussey, no run probing outside off and Hussey tries to drive through mid-on, can't find the gap",2nd innings,25.2,no run,114,0,114/5,"Shahzad to Hussey, no run",,"probing outside off and Hussey tries to drive through mid-on, can't find the gap",5
454,153,David Hussey,5766,Ajmal Shahzad,21431,"Shahzad to Hussey, no run ah, edgy! Angles it in to the stumps and Hussey just gets a leading edge away to point, not where he intended that to go",2nd innings,25.3,no run,114,0,114/5,"Shahzad to Hussey, no run",,"ah, edgy! Angles it in to the stumps and Hussey just gets a leading edge away to point, not where he intended that to go",5
455,154,David Hussey,5766,Ajmal Shahzad,21431,"Shahzad to Hussey, 1 run bangs it in short but doesn't quite get the direction right, and Hussey slaps a single out through cover point",2nd innings,25.4,run,115,1,115/5,"Shahzad to Hussey, 1 run",,"bangs it in short but doesn't quite get the direction right, and Hussey slaps a single out through cover point",5
456,155,Steven Smith,267192,Ajmal Shahzad,21431,"Shahzad to Smith, no run good line just outside off, and Smith leaves it alone",2nd innings,25.5,no run,115,0,115/5,"Shahzad to Smith, no run",,"good line just outside off, and Smith leaves it alone",5
457,156,Steven Smith,267192,Ajmal Shahzad,21431,"Shahzad to Smith, no run good yorker and Smith keeps it out",2nd innings,25.6,no run,115,0,115/5,"Shahzad to Smith, no run",,good yorker and Smith keeps it out,5
458,157,David Hussey,5766,Paul Collingwood,10772,"Collingwood to Hussey, no run Hussey punches to cover and the call is 'yeah, no!' but quick enough that Smith has time to turn back safely",2nd innings,26.1,no run,115,0,115/5,"Collingwood to Hussey, no run",,"Hussey punches to cover and the call is 'yeah, no!' but quick enough that Smith has time to turn back safely",5
459,158,David Hussey,5766,Paul Collingwood,10772,"Collingwood to Hussey, no run really accurate from Collingwood, and Hussey defends",2nd innings,26.2,no run,115,0,115/5,"Collingwood to Hussey, no run",,"really accurate from Collingwood, and Hussey defends",5
460,159,David Hussey,5766,Paul Collingwood,10772,"Collingwood to Hussey, no run Hussey misses this one but nobody is interested in an lbw shout, it was a bit too high",2nd innings,26.3,no run,115,0,115/5,"Collingwood to Hussey, no run",,"Hussey misses this one but nobody is interested in an lbw shout, it was a bit too high",5
461,160,David Hussey,5766,Paul Collingwood,10772,"Collingwood to Hussey, no run Hussey defends back down the pitch",2nd innings,26.4,no run,115,0,115/5,"Collingwood to Hussey, no run",,Hussey defends back down the pitch,5
462,161,David Hussey,5766,Paul Collingwood,10772,"Collingwood to Hussey, no run Hussey goes for the drive now but straight to the man at cover",2nd innings,26.5,no run,115,0,115/5,"Collingwood to Hussey, no run",,Hussey goes for the drive now but straight to the man at cover,5
463,162,David Hussey,5766,Paul Collingwood,10772,"Collingwood to Hussey, 2 runs Hussey finds the gap now and cuts wide of third man, who gets across but can't prevent the second run",2nd innings,26.6,run,117,2,117/5,"Collingwood to Hussey, 2 runs",,"Hussey finds the gap now and cuts wide of third man, who gets across but can't prevent the second run",5
464,163,Steven Smith,267192,Ajmal Shahzad,21431,"Shahzad to Smith, 1 run Smith joins Hussey in double figures now with a slapped pull through square leg",2nd innings,27.1,run,118,1,118/5,"Shahzad to Smith, 1 run",,Smith joins Hussey in double figures now with a slapped pull through square leg,5
465,164,David Hussey,5766,Ajmal Shahzad,21431,"Shahzad to Hussey, 1 run another late cut as Hussey just guides it behind point",2nd innings,27.2,run,119,1,119/5,"Shahzad to Hussey, 1 run",,another late cut as Hussey just guides it behind point,5
466,165,Steven Smith,267192,Ajmal Shahzad,21431,"Shahzad to Smith, no run good bounce and carry through to Prior as Smith leaves it alone",2nd innings,27.3,no run,119,0,119/5,"Shahzad to Smith, no run",,good bounce and carry through to Prior as Smith leaves it alone,5
467,166,Steven Smith,267192,Ajmal Shahzad,21431,"Shahzad to Smith, FOUR runs very good shot! That's a forceful square drive, hit on the up but safely behind point, and with enough timing that third man has no hope of getting across to prevent that reaching the boundary",2nd innings,27.4,four,123,4,123/5,"Shahzad to Smith, FOUR runs",,"very good shot! That's a forceful square drive, hit on the up but safely behind point, and with enough timing that third man has no hope of getting across to prevent that reaching the boundary",5
468,167,Steven Smith,267192,Ajmal Shahzad,21431,"Shahzad to Smith, 2 runs fuller this time and Smith drives to mid-on, and there's a direct hit at the non-striker's end with Smith safely in his ground, and the deflection allows an overthrow",2nd innings,27.5,run,125,2,125/5,"Shahzad to Smith, 2 runs",,"fuller this time and Smith drives to mid-on, and there's a direct hit at the non-striker's end with Smith safely in his ground, and the deflection allows an overthrow",5
469,168,Steven Smith,267192,Ajmal Shahzad,21431,"Shahzad to Smith, no run left alone outside off, and that ends a good over for the Australians, who now are within 90 of victory",2nd innings,27.6,no run,125,0,125/5,"Shahzad to Smith, no run",,"left alone outside off, and that ends a good over for the Australians, who now are within 90 of victory",5
470,169,David Hussey,5766,Paul Collingwood,10772,"Collingwood to Hussey, no run defended away to the off side",2nd innings,28.1,no run,125,0,125/5,"Collingwood to Hussey, no run",,defended away to the off side,5
471,170,David Hussey,5766,Paul Collingwood,10772,"Collingwood to Hussey, no run again Hussey watchfully pushes to the off side, not in any hurry to go after Collingwood",2nd innings,28.2,no run,125,0,125/5,"Collingwood to Hussey, no run",,"again Hussey watchfully pushes to the off side, not in any hurry to go after Collingwood",5
472,171,David Hussey,5766,Paul Collingwood,10772,"Collingwood to Hussey, 1 run on the back foot now, Hussey forces a single through midwicket",2nd innings,28.3,run,126,1,126/5,"Collingwood to Hussey, 1 run",,"on the back foot now, Hussey forces a single through midwicket",5
473,172,Steven Smith,267192,Paul Collingwood,10772,"Collingwood to Smith, 1 run on the pads of Smith, who clips through square leg, and he's starting to look reasonably fluent",2nd innings,28.4,run,127,1,127/5,"Collingwood to Smith, 1 run",,"on the pads of Smith, who clips through square leg, and he's starting to look reasonably fluent",5
474,173,David Hussey,5766,Paul Collingwood,10772,"Collingwood to Hussey, no run good length from Collingwood, Hussey just defends",2nd innings,28.5,no run,127,0,127/5,"Collingwood to Hussey, no run",,"good length from Collingwood, Hussey just defends",5
475,174,David Hussey,5766,Paul Collingwood,10772,"Collingwood to Hussey, 1 run flicked through midwicket for another single and Hussey continues to work himself in, slowly",2nd innings,28.6,run,128,1,128/5,"Collingwood to Hussey, 1 run",,"flicked through midwicket for another single and Hussey continues to work himself in, slowly",5
476,175,David Hussey,5766,Chris Woakes,247235,"Woakes to Hussey, FOUR runs well played, that's Hussey's first boundary as Woakes dishes up a half-volley to start with, Hussey drives confidently through the gap at cover and it runs away to the rope",2nd innings,29.1,four,132,4,132/5,"Woakes to Hussey, FOUR runs",,"well played, that's Hussey's first boundary as Woakes dishes up a half-volley to start with, Hussey drives confidently through the gap at cover and it runs away to the rope",5
477,176,David Hussey,5766,Chris Woakes,247235,"Woakes to Hussey, 1 run pushed away to point and finds a quick single",2nd innings,29.2,run,133,1,133/5,"Woakes to Hussey, 1 run",,pushed away to point and finds a quick single,5
478,177,Steven Smith,267192,Chris Woakes,247235,"Woakes to Smith, no run angled in to Smith, who takes a big stride forward and defends with the bat right under his nose",2nd innings,29.3,no run,133,0,133/5,"Woakes to Smith, no run",,"angled in to Smith, who takes a big stride forward and defends with the bat right under his nose",5
