,ball,batsman,batsman_id,bowler,bowler_id,commentary,innings,otherBatsman,otherBatsman_id,otherBowler,otherBowler_id,overs,playType,runs,runs_scored,score,shortText,speed,text,wickets
123,121,Kumar Sangakkara,50710,Harbhajan Singh,29264,"Harbhajan Singh to Sangakkara, no run Sangakkara plays back now, just waiting to see the turn of this one, and defends to off",1st innings,Mahela Jayawardene,49289,Sreesanth,34274,20.1,no run,83,0,83/2,"Harbhajan Singh to Sangakkara, no run",,"Sangakkara plays back now, just waiting to see the turn of this one, and defends to off",2
124,122,Kumar Sangakkara,50710,Harbhajan Singh,29264,"Harbhajan Singh to Sangakkara, no run cuts forward of point, who gets across in time to save this one",1st innings,Mahela Jayawardene,49289,Sreesanth,34274,20.2,no run,83,0,83/2,"Harbhajan Singh to Sangakkara, no run",,"cuts forward of point, who gets across in time to save this one",2
125,123,Kumar Sangakkara,50710,Harbhajan Singh,29264,"Harbhajan Singh to Sangakkara, no run there's an lbw shout from Harbhajan but even he didn't look totally convinced. Sangakkara got a huge stride in, in fact he was about three steps down the wicket, and probably outside the line",1st innings,Mahela Jayawardene,49289,Sreesanth,34274,20.3,no run,83,0,83/2,"Harbhajan Singh to Sangakkara, no run",,"there's an lbw shout from Harbhajan but even he didn't look totally convinced. Sangakkara got a huge stride in, in fact he was about three steps down the wicket, and probably outside the line",2
126,124,Kumar Sangakkara,50710,Harbhajan Singh,29264,"Harbhajan Singh to Sangakkara, 2 runs good, positive stuff now as Sangakkara uses the feet again and clips it through midwicket, it's chased down on the boundary",1st innings,Mahela Jayawardene,49289,Sreesanth,34274,20.4,run,85,2,85/2,"Harbhajan Singh to Sangakkara, 2 runs",,"good, positive stuff now as Sangakkara uses the feet again and clips it through midwicket, it's chased down on the boundary",2
127,125,Kumar Sangakkara,50710,Harbhajan Singh,29264,"Harbhajan Singh to Sangakkara, no run plays back to this one and it's a good straight ball",1st innings,Mahela Jayawardene,49289,Sreesanth,34274,20.5,no run,85,0,85/2,"Harbhajan Singh to Sangakkara, no run",,plays back to this one and it's a good straight ball,2
128,126,Kumar Sangakkara,50710,Harbhajan Singh,29264,"Harbhajan Singh to Sangakkara, 1 run driven out through the off side and just gets a single now",1st innings,Mahela Jayawardene,49289,Sreesanth,34274,20.6,run,86,1,86/2,"Harbhajan Singh to Sangakkara, 1 run",,driven out through the off side and just gets a single now,2
129,127,Kumar Sangakkara,50710,Yuvraj Singh,36084,"Yuvraj Singh to Sangakkara, no run Yuvraj is around the wicket to Sangakkara, who defends from a leg-stump line",1st innings,Mahela Jayawardene,49289,Harbhajan Singh,29264,21.1,no run,86,0,86/2,"Yuvraj Singh to Sangakkara, no run",,"Yuvraj is around the wicket to Sangakkara, who defends from a leg-stump line",2
130,128,Kumar Sangakkara,50710,Yuvraj Singh,36084,"Yuvraj Singh to Sangakkara, 1 run some aggression now as Sangakkara tries to slog this one over midwicket, it's collected on the bounce by the man in the deep",1st innings,Mahela Jayawardene,49289,Harbhajan Singh,29264,21.2,run,87,1,87/2,"Yuvraj Singh to Sangakkara, 1 run",,"some aggression now as Sangakkara tries to slog this one over midwicket, it's collected on the bounce by the man in the deep",2
131,129,Mahela Jayawardene,49289,Yuvraj Singh,36084,"Yuvraj Singh to Jayawardene, 1 run some drift in now, and Jayawardene just punches a single through the off side",1st innings,Kumar Sangakkara,50710,Harbhajan Singh,29264,21.3,run,88,1,88/2,"Yuvraj Singh to Jayawardene, 1 run",,"some drift in now, and Jayawardene just punches a single through the off side",2
132,130,Kumar Sangakkara,50710,Yuvraj Singh,36084,"Yuvraj Singh to Sangakkara, 1 run soft hands now as Sangakkara clips a single off his pads",1st innings,Mahela Jayawardene,49289,Harbhajan Singh,29264,21.4,run,89,1,89/2,"Yuvraj Singh to Sangakkara, 1 run",,soft hands now as Sangakkara clips a single off his pads,2
133,131,Mahela Jayawardene,49289,Yuvraj Singh,36084,"Yuvraj Singh to Jayawardene, FOUR runs too short. Bad ball, really, from Yuvraj. And despite not quite timing it to perfection, Mahela has still got enough on that pull for it to trickle into the boundary at deep midwicket",1st innings,Kumar Sangakkara,50710,Harbhajan Singh,29264,21.5,four,93,4,93/2,"Yuvraj Singh to Jayawardene, FOUR runs",,"too short. Bad ball, really, from Yuvraj. And despite not quite timing it to perfection, Mahela has still got enough on that pull for it to trickle into the boundary at deep midwicket",2
134,132,Mahela Jayawardene,49289,Yuvraj Singh,36084,"Yuvraj Singh to Jayawardene, 1 run pushed away forward of point for a single",1st innings,Kumar Sangakkara,50710,Harbhajan Singh,29264,21.6,run,94,1,94/2,"Yuvraj Singh to Jayawardene, 1 run",,pushed away forward of point for a single,2
135,133,Mahela Jayawardene,49289,Harbhajan Singh,29264,"Harbhajan Singh to Jayawardene, 1 run clipped away to the on side for an easy single",1st innings,Kumar Sangakkara,50710,Yuvraj Singh,36084,22.1,run,95,1,95/2,"Harbhajan Singh to Jayawardene, 1 run",,clipped away to the on side for an easy single,2
136,134,Kumar Sangakkara,50710,Harbhajan Singh,29264,"Harbhajan Singh to Sangakkara, no run good ball. That one curves in and hurries Sangakkara, who cuts but doesn't find the gap",1st innings,Mahela Jayawardene,49289,Yuvraj Singh,36084,22.2,no run,95,0,95/2,"Harbhajan Singh to Sangakkara, no run",,"good ball. That one curves in and hurries Sangakkara, who cuts but doesn't find the gap",2
137,135,Kumar Sangakkara,50710,Harbhajan Singh,29264,"Harbhajan Singh to Sangakkara, no run a slight change of pace as this one drifts a bit slower, Sangakkara defends",1st innings,Mahela Jayawardene,49289,Yuvraj Singh,36084,22.3,no run,95,0,95/2,"Harbhajan Singh to Sangakkara, no run",,"a slight change of pace as this one drifts a bit slower, Sangakkara defends",2
138,136,Kumar Sangakkara,50710,Harbhajan Singh,29264,"Harbhajan Singh to Sangakkara, no run Sangakkara is on the back foot and defending again",1st innings,Mahela Jayawardene,49289,Yuvraj Singh,36084,22.4,no run,95,0,95/2,"Harbhajan Singh to Sangakkara, no run",,Sangakkara is on the back foot and defending again,2
139,137,Kumar Sangakkara,50710,Harbhajan Singh,29264,"Harbhajan Singh to Sangakkara, 1 run a little straighter now and it's flicked forward of midwicket for a run",1st innings,Mahela Jayawardene,49289,Yuvraj Singh,36084,22.5,run,96,1,96/2,"Harbhajan Singh to Sangakkara, 1 run",,a little straighter now and it's flicked forward of midwicket for a run,2
140,138,Mahela Jayawardene,49289,Harbhajan Singh,29264,"Harbhajan Singh to Jayawardene, no run turned to leg and can't find a run",1st innings,Kumar Sangakkara,50710,Yuvraj Singh,36084,22.6,no run,96,0,96/2,"Harbhajan Singh to Jayawardene, no run",,turned to leg and can't find a run,2
141,139,Kumar Sangakkara,50710,Yuvraj Singh,36084,"Yuvraj Singh to Sangakkara, no run Sangakkara defends a straight ball",1st innings,Mahela Jayawardene,49289,Harbhajan Singh,29264,23.1,no run,96,0,96/2,"Yuvraj Singh to Sangakkara, no run",,Sangakkara defends a straight ball,2
142,140,Kumar Sangakkara,50710,Yuvraj Singh,36084,"Yuvraj Singh to Sangakkara, no run on the pads and he can't find a gap at midwicket",1st innings,Mahela Jayawardene,49289,Harbhajan Singh,29264,23.2,no run,96,0,96/2,"Yuvraj Singh to Sangakkara, no run",,on the pads and he can't find a gap at midwicket,2
143,141,Kumar Sangakkara,50710,Yuvraj Singh,36084,"Yuvraj Singh to Sangakkara, 1 run bad ball, there's a full toss from Yuvraj and he's lucky to get away with that - Sangakkara drives to long-on and only gets a single",1st innings,Mahela Jayawardene,49289,Harbhajan Singh,29264,23.3,run,97,1,97/2,"Yuvraj Singh to Sangakkara, 1 run",,"bad ball, there's a full toss from Yuvraj and he's lucky to get away with that - Sangakkara drives to long-on and only gets a single",2
144,142,Mahela Jayawardene,49289,Yuvraj Singh,36084,"Yuvraj Singh to Jayawardene, no run drift from Yuvraj, that's a pretty slow pace and Jayawardene just defends",1st innings,Kumar Sangakkara,50710,Harbhajan Singh,29264,23.4,no run,97,0,97/2,"Yuvraj Singh to Jayawardene, no run",,"drift from Yuvraj, that's a pretty slow pace and Jayawardene just defends",2
145,143,Mahela Jayawardene,49289,Yuvraj Singh,36084,"Yuvraj Singh to Jayawardene, 1 run curving in and it's driven towards cover, Raina can't save the single",1st innings,Kumar Sangakkara,50710,Harbhajan Singh,29264,23.5,run,98,1,98/2,"Yuvraj Singh to Jayawardene, 1 run",,"curving in and it's driven towards cover, Raina can't save the single",2
146,144,Kumar Sangakkara,50710,Yuvraj Singh,36084,"Yuvraj Singh to Sangakkara, 2 runs a bit shorter and outside off, Sangakkara rocks back to cut this through point and hares back for a second run",1st innings,Mahela Jayawardene,49289,Harbhajan Singh,29264,23.6,run,100,2,100/2,"Yuvraj Singh to Sangakkara, 2 runs",,"a bit shorter and outside off, Sangakkara rocks back to cut this through point and hares back for a second run",2
147,145,Mahela Jayawardene,49289,Harbhajan Singh,29264,"Harbhajan Singh to Jayawardene, 1 run turned past the man at leg slip and Jayawardene gets a single, India's spinners still going for the leg-stump line",1st innings,Kumar Sangakkara,50710,Yuvraj Singh,36084,24.1,run,101,1,101/2,"Harbhajan Singh to Jayawardene, 1 run",,"turned past the man at leg slip and Jayawardene gets a single, India's spinners still going for the leg-stump line",2
148,146,Kumar Sangakkara,50710,Harbhajan Singh,29264,"Harbhajan Singh to Sangakkara, 2 runs Sangakkara turns this one behind square leg and they take off for a quick single, the throw goes to Sangakkara's end and hits the stumps with him safely home, and they pick up an overthrow from the ricochet",1st innings,Mahela Jayawardene,49289,Yuvraj Singh,36084,24.2,run,103,2,103/2,"Harbhajan Singh to Sangakkara, 2 runs",,"Sangakkara turns this one behind square leg and they take off for a quick single, the throw goes to Sangakkara's end and hits the stumps with him safely home, and they pick up an overthrow from the ricochet",2
149,147,Kumar Sangakkara,50710,Harbhajan Singh,29264,"Harbhajan Singh to Sangakkara, no run pushed away to the off side",1st innings,Mahela Jayawardene,49289,Yuvraj Singh,36084,24.3,no run,103,0,103/2,"Harbhajan Singh to Sangakkara, no run",,pushed away to the off side,2
150,148,Kumar Sangakkara,50710,Harbhajan Singh,29264,"Harbhajan Singh to Sangakkara, no run tossed up on off stump now and it's defended",1st innings,Mahela Jayawardene,49289,Yuvraj Singh,36084,24.4,no run,103,0,103/2,"Harbhajan Singh to Sangakkara, no run",,tossed up on off stump now and it's defended,2
151,149,Kumar Sangakkara,50710,Harbhajan Singh,29264,"Harbhajan Singh to Sangakkara, 1 run again Harbhajan gives it plenty of air, Sangakkara pushes a single through point",1st innings,Mahela Jayawardene,49289,Yuvraj Singh,36084,24.5,run,104,1,104/2,"Harbhajan Singh to Sangakkara, 1 run",,"again Harbhajan gives it plenty of air, Sangakkara pushes a single through point",2
152,150,Mahela Jayawardene,49289,Harbhajan Singh,29264,"Harbhajan Singh to Jayawardene, 1 run on the pads and Jayawardene turns a single through midwicket",1st innings,Kumar Sangakkara,50710,Yuvraj Singh,36084,24.6,run,105,1,105/2,"Harbhajan Singh to Jayawardene, 1 run",,on the pads and Jayawardene turns a single through midwicket,2
153,151,Mahela Jayawardene,49289,Yuvraj Singh,36084,"Yuvraj Singh to Jayawardene, 1 run tossed up on the stumps and it's a low full toss, Jayawardene flicks a single through mid-on",1st innings,Kumar Sangakkara,50710,Harbhajan Singh,29264,25.1,run,106,1,106/2,"Yuvraj Singh to Jayawardene, 1 run",,"tossed up on the stumps and it's a low full toss, Jayawardene flicks a single through mid-on",2
154,152,Kumar Sangakkara,50710,Yuvraj Singh,36084,"Yuvraj Singh to Sangakkara, 1 run Sangakkara goes back into his crease to pull a ball that wasn't that short, and it's fielded on the bounce at deep square leg",1st innings,Mahela Jayawardene,49289,Harbhajan Singh,29264,25.2,run,107,1,107/2,"Yuvraj Singh to Sangakkara, 1 run",,"Sangakkara goes back into his crease to pull a ball that wasn't that short, and it's fielded on the bounce at deep square leg",2
155,153,Mahela Jayawardene,49289,Yuvraj Singh,36084,"Yuvraj Singh to Jayawardene, no run Jayawardene opens the face and tries to run this one to third man - can't connect, and Dhoni drops it",1st innings,Kumar Sangakkara,50710,Harbhajan Singh,29264,25.3,no run,107,0,107/2,"Yuvraj Singh to Jayawardene, no run",,"Jayawardene opens the face and tries to run this one to third man - can't connect, and Dhoni drops it",2
156,154,Mahela Jayawardene,49289,Yuvraj Singh,36084,"Yuvraj Singh to Jayawardene, no run punched to cover and can't find the gap",1st innings,Kumar Sangakkara,50710,Harbhajan Singh,29264,25.4,no run,107,0,107/2,"Yuvraj Singh to Jayawardene, no run",,punched to cover and can't find the gap,2
157,155,Mahela Jayawardene,49289,Yuvraj Singh,36084,"Yuvraj Singh to Jayawardene, FOUR runs what a good shot - Jayawardene has waited on this one and cut it very late, finding the gap behind point and the fielder can't chase it down inside the boundary. Excellent stroke.",1st innings,Kumar Sangakkara,50710,Harbhajan Singh,29264,25.5,four,111,4,111/2,"Yuvraj Singh to Jayawardene, FOUR runs",,"what a good shot - Jayawardene has waited on this one and cut it very late, finding the gap behind point and the fielder can't chase it down inside the boundary. Excellent stroke.",2
158,156,Mahela Jayawardene,49289,Yuvraj Singh,36084,"Yuvraj Singh to Jayawardene, no run cut away to the fielder this time",1st innings,Kumar Sangakkara,50710,Harbhajan Singh,29264,25.6,no run,111,0,111/2,"Yuvraj Singh to Jayawardene, no run",,cut away to the fielder this time,2
159,157,Kumar Sangakkara,50710,Harbhajan Singh,29264,"Harbhajan Singh to Sangakkara, no run Sangakkara defends off the back foot",1st innings,Mahela Jayawardene,49289,Yuvraj Singh,36084,26.1,no run,111,0,111/2,"Harbhajan Singh to Sangakkara, no run",,Sangakkara defends off the back foot,2
160,158,Kumar Sangakkara,50710,Harbhajan Singh,29264,"Harbhajan Singh to Sangakkara, no run drifts on to the stumps and the batsman defends",1st innings,Mahela Jayawardene,49289,Yuvraj Singh,36084,26.2,no run,111,0,111/2,"Harbhajan Singh to Sangakkara, no run",,drifts on to the stumps and the batsman defends,2
161,159,Kumar Sangakkara,50710,Harbhajan Singh,29264,"Harbhajan Singh to Sangakkara, no run width now and Sangakkara goes for a big wind-up and misses his attempted cover drive, and Dhoni also misses the take, the extra spin did for him",1st innings,Mahela Jayawardene,49289,Yuvraj Singh,36084,26.3,no run,111,0,111/2,"Harbhajan Singh to Sangakkara, no run",,"width now and Sangakkara goes for a big wind-up and misses his attempted cover drive, and Dhoni also misses the take, the extra spin did for him",2
162,160,Kumar Sangakkara,50710,Harbhajan Singh,29264,"Harbhajan Singh to Sangakkara, 1 run clipped away to the leg side",1st innings,Mahela Jayawardene,49289,Yuvraj Singh,36084,26.4,run,112,1,112/2,"Harbhajan Singh to Sangakkara, 1 run",,clipped away to the leg side,2
163,161,Mahela Jayawardene,49289,Harbhajan Singh,29264,"Harbhajan Singh to Jayawardene, no run ah, nearly got him! Jayawardene again went for the late cut but he's missed it and that ball was very straight, only <i>just</i> missing the off stump. Hands-on-head time for Harbhajan",1st innings,Kumar Sangakkara,50710,Yuvraj Singh,36084,26.5,no run,112,0,112/2,"Harbhajan Singh to Jayawardene, no run",,"ah, nearly got him! Jayawardene again went for the late cut but he's missed it and that ball was very straight, only <i>just</i> missing the off stump. Hands-on-head time for Harbhajan",2
164,162,Mahela Jayawardene,49289,Harbhajan Singh,29264,"Harbhajan Singh to Jayawardene, 2 runs this time Mahela does get the late cut away but can't get it all the way to the boundary",1st innings,Kumar Sangakkara,50710,Yuvraj Singh,36084,26.6,run,114,2,114/2,"Harbhajan Singh to Jayawardene, 2 runs",,this time Mahela does get the late cut away but can't get it all the way to the boundary,2
165,163,Kumar Sangakkara,50710,Yuvraj Singh,36084,"Yuvraj Singh to Sangakkara, 2 runs driven through cover as Sangakkara gets a bit of width outside off, and Tendulkar is sweeping on the boundary",1st innings,Mahela Jayawardene,49289,Harbhajan Singh,29264,27.1,run,116,2,116/2,"Yuvraj Singh to Sangakkara, 2 runs",,"driven through cover as Sangakkara gets a bit of width outside off, and Tendulkar is sweeping on the boundary",2
166,164,Kumar Sangakkara,50710,Yuvraj Singh,36084,"Yuvraj Singh to Sangakkara, FOUR runs super stroke! Sangakkara uses his feet, gets down the pitch and clips Yuvraj between mid-on and midwicket and it's timed and placed to perfection. Classy.",1st innings,Mahela Jayawardene,49289,Harbhajan Singh,29264,27.2,four,120,4,120/2,"Yuvraj Singh to Sangakkara, FOUR runs",,"super stroke! Sangakkara uses his feet, gets down the pitch and clips Yuvraj between mid-on and midwicket and it's timed and placed to perfection. Classy.",2
167,165,Kumar Sangakkara,50710,Yuvraj Singh,36084,"Yuvraj Singh to Sangakkara, 1 run clipped away through the leg side for a single",1st innings,Mahela Jayawardene,49289,Harbhajan Singh,29264,27.3,run,121,1,121/2,"Yuvraj Singh to Sangakkara, 1 run",,clipped away through the leg side for a single,2
168,166,Mahela Jayawardene,49289,Yuvraj Singh,36084,"Yuvraj Singh to Jayawardene, 1 run soft hands now as Jayawardene turns this one behind square",1st innings,Kumar Sangakkara,50710,Harbhajan Singh,29264,27.4,run,122,1,122/2,"Yuvraj Singh to Jayawardene, 1 run",,soft hands now as Jayawardene turns this one behind square,2
169,167,Kumar Sangakkara,50710,Yuvraj Singh,36084,"Yuvraj Singh to Sangakkara, OUT gone! Caught behind trying to cut! Yuvraj pushed this one across Sangakkara, whose eyes lit up as he went hard at the shot and got an edge through to Dhoni, who made no mistake. What a massive blow that is, Sangakkara was starting to look really good. And golden-arm Yuvraj does it again!",1st innings,Mahela Jayawardene,49289,Harbhajan Singh,29264,27.5,out,122,0,122/3,"Yuvraj Singh to Sangakkara, OUT",,"gone! Caught behind trying to cut! Yuvraj pushed this one across Sangakkara, whose eyes lit up as he went hard at the shot and got an edge through to Dhoni, who made no mistake. What a massive blow that is, Sangakkara was starting to look really good. And golden-arm Yuvraj does it again!",3
170,168,Thilan Samaraweera,50424,Yuvraj Singh,36084,"Yuvraj Singh to Samaraweera, no run tossed up outside off and Samaraweera reaches forward to defend",1st innings,Mahela Jayawardene,49289,Harbhajan Singh,29264,27.6,no run,122,0,122/3,"Yuvraj Singh to Samaraweera, no run",,tossed up outside off and Samaraweera reaches forward to defend,3
171,169,Mahela Jayawardene,49289,Sreesanth,34274,"Sreesanth to Jayawardene, no run fullish and straightish and drivenish to mid-onish",1st innings,Thilan Samaraweera,50424,Yuvraj Singh,36084,28.1,no run,122,0,122/3,"Sreesanth to Jayawardene, no run",,fullish and straightish and drivenish to mid-onish,3
172,170,Mahela Jayawardene,49289,Sreesanth,34274,"Sreesanth to Jayawardene, 1 run opens the face and guides this one to third man",1st innings,Thilan Samaraweera,50424,Yuvraj Singh,36084,28.2,run,123,1,123/3,"Sreesanth to Jayawardene, 1 run",,opens the face and guides this one to third man,3
173,171,Thilan Samaraweera,50424,Sreesanth,34274,"Sreesanth to Samaraweera, no run again Sreesanth goes straight, and it's driven to mid-on",1st innings,Mahela Jayawardene,49289,Yuvraj Singh,36084,28.3,no run,123,0,123/3,"Sreesanth to Samaraweera, no run",,"again Sreesanth goes straight, and it's driven to mid-on",3
174,172,Thilan Samaraweera,50424,Sreesanth,34274,"Sreesanth to Samaraweera, FOUR runs there's a boundary for Samaraweera, he got a ball that was a touch short and just slightly wide, he's opened the fave and steered that to third man, where Yuvraj dives and belly-flops trying to make the save. It was in vain.",1st innings,Mahela Jayawardene,49289,Yuvraj Singh,36084,28.4,four,127,4,127/3,"Sreesanth to Samaraweera, FOUR runs",,"there's a boundary for Samaraweera, he got a ball that was a touch short and just slightly wide, he's opened the fave and steered that to third man, where Yuvraj dives and belly-flops trying to make the save. It was in vain.",3
175,173,Thilan Samaraweera,50424,Sreesanth,34274,"Sreesanth to Samaraweera, no run pushed away to the off side",1st innings,Mahela Jayawardene,49289,Yuvraj Singh,36084,28.5,no run,127,0,127/3,"Sreesanth to Samaraweera, no run",,pushed away to the off side,3
176,174,Thilan Samaraweera,50424,Sreesanth,34274,"Sreesanth to Samaraweera, 1 run driven through cover point and there's a single to the sweeper",1st innings,Mahela Jayawardene,49289,Yuvraj Singh,36084,28.6,run,128,1,128/3,"Sreesanth to Samaraweera, 1 run",,driven through cover point and there's a single to the sweeper,3
177,175,Thilan Samaraweera,50424,Yuvraj Singh,36084,"Yuvraj Singh to Samaraweera, no run straightening around off stump, eased away to covers off the back foot",1st innings,Mahela Jayawardene,49289,Sreesanth,34274,29.1,no run,128,0,128/3,"Yuvraj Singh to Samaraweera, no run",,"straightening around off stump, eased away to covers off the back foot",3
178,176,Thilan Samaraweera,50424,Yuvraj Singh,36084,"Yuvraj Singh to Samaraweera, no run opens him up with one that turns across from middle, played out towards point, Thilan wants a single, Mahela is in two minds, Thilan hurries back in the end",1st innings,Mahela Jayawardene,49289,Sreesanth,34274,29.2,no run,128,0,128/3,"Yuvraj Singh to Samaraweera, no run",,"opens him up with one that turns across from middle, played out towards point, Thilan wants a single, Mahela is in two minds, Thilan hurries back in the end",3
179,177,Thilan Samaraweera,50424,Yuvraj Singh,36084,"Yuvraj Singh to Samaraweera, FOUR runs this time they don't need to run, he goes back and at the last instant, opens the face to run it past slip for a boundary, made good use of Yuvraj's skiddy pace there",1st innings,Mahela Jayawardene,49289,Sreesanth,34274,29.3,four,132,4,132/3,"Yuvraj Singh to Samaraweera, FOUR runs",,"this time they don't need to run, he goes back and at the last instant, opens the face to run it past slip for a boundary, made good use of Yuvraj's skiddy pace there",3
180,178,Thilan Samaraweera,50424,Yuvraj Singh,36084,"Yuvraj Singh to Samaraweera, no run pushed to short extra cover off the front foot",1st innings,Mahela Jayawardene,49289,Sreesanth,34274,29.4,no run,132,0,132/3,"Yuvraj Singh to Samaraweera, no run",,pushed to short extra cover off the front foot,3
181,179,Thilan Samaraweera,50424,Yuvraj Singh,36084,"Yuvraj Singh to Samaraweera, no run fuller from yuvraj, he drives it back to the bowler",1st innings,Mahela Jayawardene,49289,Sreesanth,34274,29.5,no run,132,0,132/3,"Yuvraj Singh to Samaraweera, no run",,"fuller from yuvraj, he drives it back to the bowler",3
182,180,Thilan Samaraweera,50424,Yuvraj Singh,36084,"Yuvraj Singh to Samaraweera, no run cannot get the width to drive through covers, pushes one around off to short extra cover",1st innings,Mahela Jayawardene,49289,Sreesanth,34274,29.6,no run,132,0,132/3,"Yuvraj Singh to Samaraweera, no run",,"cannot get the width to drive through covers, pushes one around off to short extra cover",3
183,181,Mahela Jayawardene,49289,Sreesanth,34274,"Sreesanth to Jayawardene, 1 run very full around leg stump, Mahela eases it wide of mid on and takes on the man there with the single, easily done in the end",1st innings,Thilan Samaraweera,50424,Yuvraj Singh,36084,30.1,run,133,1,133/3,"Sreesanth to Jayawardene, 1 run",,"very full around leg stump, Mahela eases it wide of mid on and takes on the man there with the single, easily done in the end",3
184,182,Thilan Samaraweera,50424,Sreesanth,34274,"Sreesanth to Samaraweera, 1 run shuffles and walks outside off stump and a couple of steps down the track, works this back of a length ball towards midwicket for another single",1st innings,Mahela Jayawardene,49289,Yuvraj Singh,36084,30.2,run,134,1,134/3,"Sreesanth to Samaraweera, 1 run",,"shuffles and walks outside off stump and a couple of steps down the track, works this back of a length ball towards midwicket for another single",3
185,183,Mahela Jayawardene,49289,Sreesanth,34274,"Sreesanth to Jayawardene, FOUR runs given width, Mahela cuts it behind point, languidly, as if that was the easiest thing to do in the world, third man didn't have much chance, got to the ball with a long run but dived over it in the end",1st innings,Thilan Samaraweera,50424,Yuvraj Singh,36084,30.3,four,138,4,138/3,"Sreesanth to Jayawardene, FOUR runs",,"given width, Mahela cuts it behind point, languidly, as if that was the easiest thing to do in the world, third man didn't have much chance, got to the ball with a long run but dived over it in the end",3
186,184,Mahela Jayawardene,49289,Sreesanth,34274,"Sreesanth to Jayawardene, no run Sreesanth tests out the bounce in the wicket, finds out there is lot of it as this short one takes off outside off stump, Mahela stays in the crease and lets it go",1st innings,Thilan Samaraweera,50424,Yuvraj Singh,36084,30.4,no run,138,0,138/3,"Sreesanth to Jayawardene, no run",,"Sreesanth tests out the bounce in the wicket, finds out there is lot of it as this short one takes off outside off stump, Mahela stays in the crease and lets it go",3
