,ball,batsman,batsman_id,bowler,bowler_id,commentary,innings,otherBatsman,otherBatsman_id,otherBowler,otherBowler_id,overs,playType,runs,runs_scored,score,shortText,speed,text,wickets
421,110,Gautam Gambhir,28763,Muttiah Muralitharan,49636,"Muralitharan to Gambhir, 2 runs oh, is that a <b>missed run-out</b>? Gambhir punches off the back foot through point and they hurry back for two runs, the throw from the deep bounces awkwardly just short of Sangakkara, who can't take it cleanly. Had he done so, a diving Gambhir may well have been in trouble!",2nd innings,Virat Kohli,253802,Suraj Randiv,50438,18.2,run,98,2,98/2,"Muralitharan to Gambhir, 2 runs",,"oh, is that a <b>missed run-out</b>? Gambhir punches off the back foot through point and they hurry back for two runs, the throw from the deep bounces awkwardly just short of Sangakkara, who can't take it cleanly. Had he done so, a diving Gambhir may well have been in trouble!",2
422,111,Gautam Gambhir,28763,Muttiah Muralitharan,49636,"Muralitharan to Gambhir, no run and now a leading edge the the off side as Gambhir can't work it where he intended, to the leg side",2nd innings,Virat Kohli,253802,Suraj Randiv,50438,18.3,no run,98,0,98/2,"Muralitharan to Gambhir, no run",,"and now a leading edge the the off side as Gambhir can't work it where he intended, to the leg side",2
423,112,Gautam Gambhir,28763,Muttiah Muralitharan,49636,"Muralitharan to Gambhir, 1 run leans forward and gets a single to midwicket, and that's a very important half-century for Gambhir. Can he win this for India?",2nd innings,Virat Kohli,253802,Suraj Randiv,50438,18.4,run,99,1,99/2,"Muralitharan to Gambhir, 1 run",,"leans forward and gets a single to midwicket, and that's a very important half-century for Gambhir. Can he win this for India?",2
424,113,Virat Kohli,253802,Muttiah Muralitharan,49636,"Muralitharan to Kohli, no run around the wicket to Kohli, who gets the straighter ball and defends it off middle stump",2nd innings,Gautam Gambhir,28763,Suraj Randiv,50438,18.5,no run,99,0,99/2,"Muralitharan to Kohli, no run",,"around the wicket to Kohli, who gets the straighter ball and defends it off middle stump",2
425,114,Virat Kohli,253802,Muttiah Muralitharan,49636,"Muralitharan to Kohli, no run a little too short, but Kohli can't put it away, pulling straight to midwicket",2nd innings,Gautam Gambhir,28763,Suraj Randiv,50438,18.6,no run,99,0,99/2,"Muralitharan to Kohli, no run",,"a little too short, but Kohli can't put it away, pulling straight to midwicket",2
426,115,Gautam Gambhir,28763,Suraj Randiv,50438,"Randiv to Gambhir, no run aha! Some really sharp offspin now from Randiv, and Gambhir playing back is beaten by the spin and the bounce",2nd innings,Virat Kohli,253802,Muttiah Muralitharan,49636,19.1,no run,99,0,99/2,"Randiv to Gambhir, no run",,"aha! Some really sharp offspin now from Randiv, and Gambhir playing back is beaten by the spin and the bounce",2
427,116,Gautam Gambhir,28763,Suraj Randiv,50438,"Randiv to Gambhir, no run punched to point",2nd innings,Virat Kohli,253802,Muttiah Muralitharan,49636,19.2,no run,99,0,99/2,"Randiv to Gambhir, no run",,punched to point,2
428,117,Gautam Gambhir,28763,Suraj Randiv,50438,"Randiv to Gambhir, 1 run Gambhir leans forward and pushes to midwicket, that brings up the 100 for India",2nd innings,Virat Kohli,253802,Muttiah Muralitharan,49636,19.3,run,100,1,100/2,"Randiv to Gambhir, 1 run",,"Gambhir leans forward and pushes to midwicket, that brings up the 100 for India",2
429,118,Virat Kohli,253802,Suraj Randiv,50438,"Randiv to Kohli, FOUR runs wrong line, and bad fielding. Oh dear. Randiv turns this one down leg and Kohli flicks it off his hips, Malinga at fine leg runs around and should have cut this off, he's done the old Sydney Harbour Bridge dive, the ball sails under his body",2nd innings,Gautam Gambhir,28763,Muttiah Muralitharan,49636,19.4,four,104,4,104/2,"Randiv to Kohli, FOUR runs",,"wrong line, and bad fielding. Oh dear. Randiv turns this one down leg and Kohli flicks it off his hips, Malinga at fine leg runs around and should have cut this off, he's done the old Sydney Harbour Bridge dive, the ball sails under his body",2
430,119,Virat Kohli,253802,Suraj Randiv,50438,"Randiv to Kohli, 1 run flicked away through the leg side",2nd innings,Gautam Gambhir,28763,Muttiah Muralitharan,49636,19.5,run,105,1,105/2,"Randiv to Kohli, 1 run",,flicked away through the leg side,2
431,120,Gautam Gambhir,28763,Suraj Randiv,50438,"Randiv to Gambhir, no run Gambhir leans forward and defends",2nd innings,Virat Kohli,253802,Muttiah Muralitharan,49636,19.6,no run,105,0,105/2,"Randiv to Gambhir, no run",,Gambhir leans forward and defends,2
432,121,Virat Kohli,253802,Muttiah Muralitharan,49636,"Muralitharan to Kohli, 1 run Kohli plays off the back foot, cutting through point",2nd innings,Gautam Gambhir,28763,Suraj Randiv,50438,20.1,run,106,1,106/2,"Muralitharan to Kohli, 1 run",,"Kohli plays off the back foot, cutting through point",2
433,122,Gautam Gambhir,28763,Muttiah Muralitharan,49636,"Muralitharan to Gambhir, no run Gambhir gets bat and pad close together and defends",2nd innings,Virat Kohli,253802,Suraj Randiv,50438,20.2,no run,106,0,106/2,"Muralitharan to Gambhir, no run",,Gambhir gets bat and pad close together and defends,2
434,123,Gautam Gambhir,28763,Muttiah Muralitharan,49636,"Muralitharan to Gambhir, no run Murali gives Gambhir a little extra width and the batsman tries the big cover-drive, under-edging it into the ground and through to the keeper",2nd innings,Virat Kohli,253802,Suraj Randiv,50438,20.3,no run,106,0,106/2,"Muralitharan to Gambhir, no run",,"Murali gives Gambhir a little extra width and the batsman tries the big cover-drive, under-edging it into the ground and through to the keeper",2
435,124,Gautam Gambhir,28763,Muttiah Muralitharan,49636,"Muralitharan to Gambhir, 1 run defended away to the off side and they hurry through for a well-judged single",2nd innings,Virat Kohli,253802,Suraj Randiv,50438,20.4,run,107,1,107/2,"Muralitharan to Gambhir, 1 run",,defended away to the off side and they hurry through for a well-judged single,2
436,125,Virat Kohli,253802,Muttiah Muralitharan,49636,"Muralitharan to Kohli, 1 run driven uppishly down to long-off, but the fielder didn't even have to move - just picked it up and kept it to a single",2nd innings,Gautam Gambhir,28763,Suraj Randiv,50438,20.5,run,108,1,108/2,"Muralitharan to Kohli, 1 run",,"driven uppishly down to long-off, but the fielder didn't even have to move - just picked it up and kept it to a single",2
437,126,Gautam Gambhir,28763,Muttiah Muralitharan,49636,"Muralitharan to Gambhir, 1 run driven to long-off for another single",2nd innings,Virat Kohli,253802,Suraj Randiv,50438,20.6,run,109,1,109/2,"Muralitharan to Gambhir, 1 run",,driven to long-off for another single,2
438,127,Gautam Gambhir,28763,Tillakaratne Dilshan,48472,"Dilshan to Gambhir, 1 run Gambhir, who now has a giant brownish-red stain on his shirt from that dive to avoid a run-out, gets this one wide of slip for a single",2nd innings,Virat Kohli,253802,Muttiah Muralitharan,49636,21.1,run,110,1,110/2,"Dilshan to Gambhir, 1 run",,"Gambhir, who now has a giant brownish-red stain on his shirt from that dive to avoid a run-out, gets this one wide of slip for a single",2
439,128,Virat Kohli,253802,Tillakaratne Dilshan,48472,"Dilshan to Kohli, no run worked off the pads to square leg, can't find the gap",2nd innings,Gautam Gambhir,28763,Muttiah Muralitharan,49636,21.2,no run,110,0,110/2,"Dilshan to Kohli, no run",,"worked off the pads to square leg, can't find the gap",2
440,129,Virat Kohli,253802,Tillakaratne Dilshan,48472,"Dilshan to Kohli, FOUR runs ah, lovely cut! That wasn't that short, but he's managed to get it right through the gap and that races away for a boundary",2nd innings,Gautam Gambhir,28763,Muttiah Muralitharan,49636,21.3,four,114,4,114/2,"Dilshan to Kohli, FOUR runs",,"ah, lovely cut! That wasn't that short, but he's managed to get it right through the gap and that races away for a boundary",2
441,130,Virat Kohli,253802,Tillakaratne Dilshan,48472,"Dilshan to Kohli, OUT Dilshan! He's taken a blinder off his own bowling! Kohli drives and tries to get it back past the bowler, towards long-on, but Dilshan just sticks his right hand up in the air, almost in front of the non-striker's face, and plucks a magnificent catch! Could that be a decisive moment? It could very well be!",2nd innings,Gautam Gambhir,28763,Muttiah Muralitharan,49636,21.4,out,114,0,114/3,"Dilshan to Kohli, OUT",,"Dilshan! He's taken a blinder off his own bowling! Kohli drives and tries to get it back past the bowler, towards long-on, but Dilshan just sticks his right hand up in the air, almost in front of the non-striker's face, and plucks a magnificent catch! Could that be a decisive moment? It could very well be!",3
442,131,MS Dhoni,28081,Tillakaratne Dilshan,48472,"Dilshan to Dhoni, no run quicker ball, and Dhoni gets forward to defend",2nd innings,Gautam Gambhir,28763,Muttiah Muralitharan,49636,21.5,no run,114,0,114/3,"Dilshan to Dhoni, no run",,"quicker ball, and Dhoni gets forward to defend",3
443,132,MS Dhoni,28081,Tillakaratne Dilshan,48472,"Dilshan to Dhoni, 1 bye Dhoni tries for a drive here and can't get bat on ball, it also beats Sangakkara, who couldn't taken it cleanly. And it may have been a <b>missed stumping</b>, as Dhoni seemed to have dragged his foot out of the crease. Even if he'd taken it cleanly, though, he'd have to have whipped the bails off like lightning.",2nd innings,Gautam Gambhir,28763,Muttiah Muralitharan,49636,21.6,bye,115,1,115/3,"Dilshan to Dhoni, 1 bye",,"Dhoni tries for a drive here and can't get bat on ball, it also beats Sangakkara, who couldn't taken it cleanly. And it may have been a <b>missed stumping</b>, as Dhoni seemed to have dragged his foot out of the crease. Even if he'd taken it cleanly, though, he'd have to have whipped the bails off like lightning.",3
444,133,MS Dhoni,28081,Muttiah Muralitharan,49636,"Muralitharan to Dhoni, no run Dhoni gets forward to defend",2nd innings,Gautam Gambhir,28763,Tillakaratne Dilshan,48472,22.1,no run,115,0,115/3,"Muralitharan to Dhoni, no run",,Dhoni gets forward to defend,3
445,134,MS Dhoni,28081,Muttiah Muralitharan,49636,"Muralitharan to Dhoni, no run watchfully, Dhoni pushes this to leg",2nd innings,Gautam Gambhir,28763,Tillakaratne Dilshan,48472,22.2,no run,115,0,115/3,"Muralitharan to Dhoni, no run",,"watchfully, Dhoni pushes this to leg",3
446,135,MS Dhoni,28081,Muttiah Muralitharan,49636,"Muralitharan to Dhoni, 1 leg bye this was really tossed up but down leg side, Dhoni tries a sort of swipey flick fine, but can only get a bit of pad on the ball",2nd innings,Gautam Gambhir,28763,Tillakaratne Dilshan,48472,22.3,leg bye,116,1,116/3,"Muralitharan to Dhoni, 1 leg bye",,"this was really tossed up but down leg side, Dhoni tries a sort of swipey flick fine, but can only get a bit of pad on the ball",3
447,136,Gautam Gambhir,28763,Muttiah Muralitharan,49636,"Muralitharan to Gambhir, no run driven back towards the bowler",2nd innings,MS Dhoni,28081,Tillakaratne Dilshan,48472,22.4,no run,116,0,116/3,"Muralitharan to Gambhir, no run",,driven back towards the bowler,3
448,137,Gautam Gambhir,28763,Muttiah Muralitharan,49636,"Muralitharan to Gambhir, 1 run too short from Murali, but there's a man at deep point to keep that cut to a single",2nd innings,MS Dhoni,28081,Tillakaratne Dilshan,48472,22.5,run,117,1,117/3,"Muralitharan to Gambhir, 1 run",,"too short from Murali, but there's a man at deep point to keep that cut to a single",3
449,138,MS Dhoni,28081,Muttiah Muralitharan,49636,"Muralitharan to Dhoni, no run flighted again, and again on the pads, Dhoni just chips it back to Murali",2nd innings,Gautam Gambhir,28763,Tillakaratne Dilshan,48472,22.6,no run,117,0,117/3,"Muralitharan to Dhoni, no run",,"flighted again, and again on the pads, Dhoni just chips it back to Murali",3
450,139,Gautam Gambhir,28763,Tillakaratne Dilshan,48472,"Dilshan to Gambhir, 2 runs Gambhir punches this off the back foot forward of point but it's cut off in the deep",2nd innings,MS Dhoni,28081,Muttiah Muralitharan,49636,23.1,run,119,2,119/3,"Dilshan to Gambhir, 2 runs",,Gambhir punches this off the back foot forward of point but it's cut off in the deep,3
451,140,Gautam Gambhir,28763,Tillakaratne Dilshan,48472,"Dilshan to Gambhir, 1 run pushed to midwicket and Gambhir runs, or rather, walks, through for a single",2nd innings,MS Dhoni,28081,Muttiah Muralitharan,49636,23.2,run,120,1,120/3,"Dilshan to Gambhir, 1 run",,"pushed to midwicket and Gambhir runs, or rather, walks, through for a single",3
452,141,MS Dhoni,28081,Tillakaratne Dilshan,48472,"Dilshan to Dhoni, no run Dhoni comes down the pitch and meets this ball, driving it back towards the bowler",2nd innings,Gautam Gambhir,28763,Muttiah Muralitharan,49636,23.3,no run,120,0,120/3,"Dilshan to Dhoni, no run",,"Dhoni comes down the pitch and meets this ball, driving it back towards the bowler",3
453,142,MS Dhoni,28081,Tillakaratne Dilshan,48472,"Dilshan to Dhoni, 1 run turning down the leg side and Dhoni whips this one just behind square leg, the man dives across to his right but can't cut it off, and it's collected in the deep",2nd innings,Gautam Gambhir,28763,Muttiah Muralitharan,49636,23.4,run,121,1,121/3,"Dilshan to Dhoni, 1 run",,"turning down the leg side and Dhoni whips this one just behind square leg, the man dives across to his right but can't cut it off, and it's collected in the deep",3
454,143,Gautam Gambhir,28763,Tillakaratne Dilshan,48472,"Dilshan to Gambhir, 1 run pushed comfortably to deep cover",2nd innings,MS Dhoni,28081,Muttiah Muralitharan,49636,23.5,run,122,1,122/3,"Dilshan to Gambhir, 1 run",,pushed comfortably to deep cover,3
455,144,MS Dhoni,28081,Tillakaratne Dilshan,48472,"Dilshan to Dhoni, no run Dhoni's on the move again, plays this one almost as he's walking, and clips it to midwicket",2nd innings,Gautam Gambhir,28763,Muttiah Muralitharan,49636,23.6,no run,122,0,122/3,"Dilshan to Dhoni, no run",,"Dhoni's on the move again, plays this one almost as he's walking, and clips it to midwicket",3
456,145,Gautam Gambhir,28763,Muttiah Muralitharan,49636,"Muralitharan to Gambhir, no run Gambhir cuts but the point/backward point area is being patrolled by more than one man, and that's easily cut off",2nd innings,MS Dhoni,28081,Tillakaratne Dilshan,48472,24.1,no run,122,0,122/3,"Muralitharan to Gambhir, no run",,"Gambhir cuts but the point/backward point area is being patrolled by more than one man, and that's easily cut off",3
457,146,Gautam Gambhir,28763,Muttiah Muralitharan,49636,"Muralitharan to Gambhir, no run doesn't quite get this one away as he intended, it ends up dribbling out to the leg side",2nd innings,MS Dhoni,28081,Tillakaratne Dilshan,48472,24.2,no run,122,0,122/3,"Muralitharan to Gambhir, no run",,"doesn't quite get this one away as he intended, it ends up dribbling out to the leg side",3
458,147,Gautam Gambhir,28763,Muttiah Muralitharan,49636,"Muralitharan to Gambhir, 1 run Gambhir leans out to flick this to midwicket",2nd innings,MS Dhoni,28081,Tillakaratne Dilshan,48472,24.3,run,123,1,123/3,"Muralitharan to Gambhir, 1 run",,Gambhir leans out to flick this to midwicket,3
459,148,MS Dhoni,28081,Muttiah Muralitharan,49636,"Muralitharan to Dhoni, 1 run Dhoni uses his feet again, and drives this down to long-on",2nd innings,Gautam Gambhir,28763,Tillakaratne Dilshan,48472,24.4,run,124,1,124/3,"Muralitharan to Dhoni, 1 run",,"Dhoni uses his feet again, and drives this down to long-on",3
460,149,Gautam Gambhir,28763,Muttiah Muralitharan,49636,"Muralitharan to Gambhir, no run driven to cover and can't find the gap",2nd innings,MS Dhoni,28081,Tillakaratne Dilshan,48472,24.5,no run,124,0,124/3,"Muralitharan to Gambhir, no run",,driven to cover and can't find the gap,3
461,150,Gautam Gambhir,28763,Muttiah Muralitharan,49636,"Muralitharan to Gambhir, no run soft hands from Gambhir as he guides this past slip",2nd innings,MS Dhoni,28081,Tillakaratne Dilshan,48472,24.6,no run,124,0,124/3,"Muralitharan to Gambhir, no run",,soft hands from Gambhir as he guides this past slip,3
462,151,MS Dhoni,28081,Tillakaratne Dilshan,48472,"Dilshan to Dhoni, 1 run again Dhoni uses his feet and drives back past the bowler",2nd innings,Gautam Gambhir,28763,Muttiah Muralitharan,49636,25.1,run,125,1,125/3,"Dilshan to Dhoni, 1 run",,again Dhoni uses his feet and drives back past the bowler,3
463,152,Gautam Gambhir,28763,Tillakaratne Dilshan,48472,"Dilshan to Gambhir, no run Gambhir goes for the cut, but backward point cuts it off",2nd innings,MS Dhoni,28081,Muttiah Muralitharan,49636,25.2,no run,125,0,125/3,"Dilshan to Gambhir, no run",,"Gambhir goes for the cut, but backward point cuts it off",3
464,153,Gautam Gambhir,28763,Tillakaratne Dilshan,48472,"Dilshan to Gambhir, no run more work for Malinga at backward point as Gambhir can't find the gap",2nd innings,MS Dhoni,28081,Muttiah Muralitharan,49636,25.3,no run,125,0,125/3,"Dilshan to Gambhir, no run",,more work for Malinga at backward point as Gambhir can't find the gap,3
465,154,Gautam Gambhir,28763,Tillakaratne Dilshan,48472,"Dilshan to Gambhir, 1 run Gambhir pushes this to midwicket and gets a run",2nd innings,MS Dhoni,28081,Muttiah Muralitharan,49636,25.4,run,126,1,126/3,"Dilshan to Gambhir, 1 run",,Gambhir pushes this to midwicket and gets a run,3
466,155,MS Dhoni,28081,Tillakaratne Dilshan,48472,"Dilshan to Dhoni, 1 run gentle, very deftly glanced fine by Dhoni, but it is cut off on the boundary",2nd innings,Gautam Gambhir,28763,Muttiah Muralitharan,49636,25.5,run,127,1,127/3,"Dilshan to Dhoni, 1 run",,"gentle, very deftly glanced fine by Dhoni, but it is cut off on the boundary",3
467,156,Gautam Gambhir,28763,Tillakaratne Dilshan,48472,"Dilshan to Gambhir, 1 run Gambhir cuts hard and gets this one forward of point",2nd innings,MS Dhoni,28081,Muttiah Muralitharan,49636,25.6,run,128,1,128/3,"Dilshan to Gambhir, 1 run",,Gambhir cuts hard and gets this one forward of point,3
468,157,Gautam Gambhir,28763,Lasith Malinga,49758,"Malinga to Gambhir, no run immediately the pace is difficult, and Gambhir just clunks the ball down into the turf",2nd innings,MS Dhoni,28081,Tillakaratne Dilshan,48472,26.1,no run,128,0,128/3,"Malinga to Gambhir, no run",,"immediately the pace is difficult, and Gambhir just clunks the ball down into the turf",3
469,158,Gautam Gambhir,28763,Lasith Malinga,49758,"Malinga to Gambhir, 1 run Malinga kisses the ball and runs in, sends down a good yorker that is well driven square by Gambhir, he's done well to get that away, but there's a man at deep point",2nd innings,MS Dhoni,28081,Tillakaratne Dilshan,48472,26.2,run,129,1,129/3,"Malinga to Gambhir, 1 run",,"Malinga kisses the ball and runs in, sends down a good yorker that is well driven square by Gambhir, he's done well to get that away, but there's a man at deep point",3
470,159,MS Dhoni,28081,Lasith Malinga,49758,"Malinga to Dhoni, no run good line! That action, and the little bit of late swing in, makes it very important that Dhoni gets the bat back down very quickly, which he does and defends",2nd innings,Gautam Gambhir,28763,Tillakaratne Dilshan,48472,26.3,no run,129,0,129/3,"Malinga to Dhoni, no run",,"good line! That action, and the little bit of late swing in, makes it very important that Dhoni gets the bat back down very quickly, which he does and defends",3
471,160,MS Dhoni,28081,Lasith Malinga,49758,"Malinga to Dhoni, 1 run nice shot, as Dhoni drives through cover point",2nd innings,Gautam Gambhir,28763,Tillakaratne Dilshan,48472,26.4,run,130,1,130/3,"Malinga to Dhoni, 1 run",,"nice shot, as Dhoni drives through cover point",3
472,161,Gautam Gambhir,28763,Lasith Malinga,49758,"Malinga to Gambhir, FOUR runs another good yorker but Gambhir has got a boundary from it! He's jammed the bat down on this one, which is just outside off stump, and Gambhir gets a thick edge away through the vacant cordon",2nd innings,MS Dhoni,28081,Tillakaratne Dilshan,48472,26.5,four,134,4,134/3,"Malinga to Gambhir, FOUR runs",,"another good yorker but Gambhir has got a boundary from it! He's jammed the bat down on this one, which is just outside off stump, and Gambhir gets a thick edge away through the vacant cordon",3
473,162,Gautam Gambhir,28763,Lasith Malinga,49758,"Malinga to Gambhir, no run again he goes for the yorker, this one becomes a low full toss, though, as Malinga doesn't quite get the length right, and Gambhir works it to leg",2nd innings,MS Dhoni,28081,Tillakaratne Dilshan,48472,26.6,no run,134,0,134/3,"Malinga to Gambhir, no run",,"again he goes for the yorker, this one becomes a low full toss, though, as Malinga doesn't quite get the length right, and Gambhir works it to leg",3
474,163,MS Dhoni,28081,Tillakaratne Dilshan,48472,"Dilshan to Dhoni, 1 run Dhoni dances down the pitch and works this one wide of mid-on, he picks up a single",2nd innings,Gautam Gambhir,28763,Lasith Malinga,49758,27.1,run,135,1,135/3,"Dilshan to Dhoni, 1 run",,"Dhoni dances down the pitch and works this one wide of mid-on, he picks up a single",3
475,164,Gautam Gambhir,28763,Tillakaratne Dilshan,48472,"Dilshan to Gambhir, no run Dilshan really tosses this one up from around the wicket, and Gambhir drives to cover",2nd innings,MS Dhoni,28081,Lasith Malinga,49758,27.2,no run,135,0,135/3,"Dilshan to Gambhir, no run",,"Dilshan really tosses this one up from around the wicket, and Gambhir drives to cover",3
476,165,Gautam Gambhir,28763,Tillakaratne Dilshan,48472,"Dilshan to Gambhir, no run cut away behind point, Gambhir gets a single",2nd innings,MS Dhoni,28081,Lasith Malinga,49758,27.3,no run,135,0,135/3,"Dilshan to Gambhir, no run",,"cut away behind point, Gambhir gets a single",3
477,166,Gautam Gambhir,28763,Tillakaratne Dilshan,48472,"Dilshan to Gambhir, 2 runs and now Gambhir uses his feet, meets this ball and flicks it through the gap at midwicket",2nd innings,MS Dhoni,28081,Lasith Malinga,49758,27.4,run,137,2,137/3,"Dilshan to Gambhir, 2 runs",,"and now Gambhir uses his feet, meets this ball and flicks it through the gap at midwicket",3
478,167,Gautam Gambhir,28763,Tillakaratne Dilshan,48472,"Dilshan to Gambhir, FOUR runs oh, Gambhir is lucky to get away with this! He uses the feet again, and gets a thick inside edge to a fullish ball that flies to the right of Sangakkara, not a drop, but had he got his hands to it he could have stumped Gambhir. But it was a big deflection, so there wasn't much Sangakkara could do",2nd innings,MS Dhoni,28081,Lasith Malinga,49758,27.5,four,141,4,141/3,"Dilshan to Gambhir, FOUR runs",,"oh, Gambhir is lucky to get away with this! He uses the feet again, and gets a thick inside edge to a fullish ball that flies to the right of Sangakkara, not a drop, but had he got his hands to it he could have stumped Gambhir. But it was a big deflection, so there wasn't much Sangakkara could do",3
479,168,Gautam Gambhir,28763,Tillakaratne Dilshan,48472,"Dilshan to Gambhir, 1 run worked away for a single to end the over",2nd innings,MS Dhoni,28081,Lasith Malinga,49758,27.6,run,142,1,142/3,"Dilshan to Gambhir, 1 run",,worked away for a single to end the over,3
480,169,Gautam Gambhir,28763,Muttiah Muralitharan,49636,"Muralitharan to Gambhir, no run Gambhir reaches outside off now, and gets it to cover - there's the risk of an edge to slip, reaching like that",2nd innings,MS Dhoni,28081,Tillakaratne Dilshan,48472,28.1,no run,142,0,142/3,"Muralitharan to Gambhir, no run",,"Gambhir reaches outside off now, and gets it to cover - there's the risk of an edge to slip, reaching like that",3
481,170,Gautam Gambhir,28763,Muttiah Muralitharan,49636,"Muralitharan to Gambhir, 1 run flicked to midwicket for a single",2nd innings,MS Dhoni,28081,Tillakaratne Dilshan,48472,28.2,run,143,1,143/3,"Muralitharan to Gambhir, 1 run",,flicked to midwicket for a single,3
482,171,MS Dhoni,28081,Muttiah Muralitharan,49636,"Muralitharan to Dhoni, 1 run this one straightens to the middle-stump line and Dhoni drives back past the bowler for a single",2nd innings,Gautam Gambhir,28763,Tillakaratne Dilshan,48472,28.3,run,144,1,144/3,"Muralitharan to Dhoni, 1 run",,this one straightens to the middle-stump line and Dhoni drives back past the bowler for a single,3
483,172,Gautam Gambhir,28763,Muttiah Muralitharan,49636,"Muralitharan to Gambhir, 1 run a good late cut but the two men at point and backward point combine to cut that off, and the throw to Murali almost results in an overthrow, but India decide better of it",2nd innings,MS Dhoni,28081,Tillakaratne Dilshan,48472,28.4,run,145,1,145/3,"Muralitharan to Gambhir, 1 run",,"a good late cut but the two men at point and backward point combine to cut that off, and the throw to Murali almost results in an overthrow, but India decide better of it",3
484,173,MS Dhoni,28081,Muttiah Muralitharan,49636,"Muralitharan to Dhoni, no run a real reach down the pitch there from Dhoni, who pushes it back past the bowler",2nd innings,Gautam Gambhir,28763,Tillakaratne Dilshan,48472,28.5,no run,145,0,145/3,"Muralitharan to Dhoni, no run",,"a real reach down the pitch there from Dhoni, who pushes it back past the bowler",3
485,174,MS Dhoni,28081,Muttiah Muralitharan,49636,"Muralitharan to Dhoni, 1 run Dhoni advances again and drives towards long-off",2nd innings,Gautam Gambhir,28763,Tillakaratne Dilshan,48472,28.6,run,146,1,146/3,"Muralitharan to Dhoni, 1 run",,Dhoni advances again and drives towards long-off,3
486,175,MS Dhoni,28081,Thisara Perera,233514,"Perera to Dhoni, 2 runs on the pads to start with and Dhoni clips it behind square leg, and that's good running to get back for two",2nd innings,Gautam Gambhir,28763,Muttiah Muralitharan,49636,29.1,run,148,2,148/3,"Perera to Dhoni, 2 runs",,"on the pads to start with and Dhoni clips it behind square leg, and that's good running to get back for two",3
