,ball,batsman,batsman_id,bowler,bowler_id,commentary,innings,otherBatsman,otherBatsman_id,otherBowler,otherBowler_id,overs,playType,runs,runs_scored,score,shortText,speed,text,wickets
249,243,Mahela Jayawardene,49289,Yuvraj Singh,36084,"Yuvraj Singh to Jayawardene, no run slows it down and Mahela almost ends up spooning it to short extra cover",1st innings,Nuwan Kulasekara,49535,Zaheer Khan,30102,40.3,no run,184,0,184/5,"Yuvraj Singh to Jayawardene, no run",,slows it down and Mahela almost ends up spooning it to short extra cover,5
250,244,Mahela Jayawardene,49289,Yuvraj Singh,36084,"Yuvraj Singh to Jayawardene, 1 run Dhoni goes charging after this nudge on the leg side, and direct hit from him would have got the batsman as they went for the quick run, lot of turn for Yuvraj on that one",1st innings,Nuwan Kulasekara,49535,Zaheer Khan,30102,40.4,run,185,1,185/5,"Yuvraj Singh to Jayawardene, 1 run",,"Dhoni goes charging after this nudge on the leg side, and direct hit from him would have got the batsman as they went for the quick run, lot of turn for Yuvraj on that one",5
251,245,Nuwan Kulasekara,49535,Yuvraj Singh,36084,"Yuvraj Singh to Kulasekara, no run quicker one defended down the track",1st innings,Mahela Jayawardene,49289,Zaheer Khan,30102,40.5,no run,185,0,185/5,"Yuvraj Singh to Kulasekara, no run",,quicker one defended down the track,5
252,246,Nuwan Kulasekara,49535,Yuvraj Singh,36084,"Yuvraj Singh to Kulasekara, 1 run pushed out in front of point, end of Yuvraj's quota, well bowled, yet again",1st innings,Mahela Jayawardene,49289,Zaheer Khan,30102,40.6,run,186,1,186/5,"Yuvraj Singh to Kulasekara, 1 run",,"pushed out in front of point, end of Yuvraj's quota, well bowled, yet again",5
253,247,Nuwan Kulasekara,49535,Munaf Patel,32965,"Patel to Kulasekara, 1 run bowls it on a tight length on off stump, and he pushes it back down the track, but Munaf fails to stop the ball and concedes the single",1st innings,Mahela Jayawardene,49289,Yuvraj Singh,36084,41.1,run,187,1,187/5,"Patel to Kulasekara, 1 run",,"bowls it on a tight length on off stump, and he pushes it back down the track, but Munaf fails to stop the ball and concedes the single",5
254,248,Mahela Jayawardene,49289,Munaf Patel,32965,"Patel to Jayawardene, 1 run 118.4 kph slower one, played away to point, Virat scores a direct hit, but Mahela was home. Munaf is nowhere close to the stumps, he was dawdlng around in his followthrough, and they take another run as the ball ricochets",1st innings,Nuwan Kulasekara,49535,Yuvraj Singh,36084,41.2,run,188,1,188/5,"Patel to Jayawardene, 1 run",,"118.4 kph slower one, played away to point, Virat scores a direct hit, but Mahela was home. Munaf is nowhere close to the stumps, he was dawdlng around in his followthrough, and they take another run as the ball ricochets",5
255,249,Nuwan Kulasekara,49535,Munaf Patel,32965,"Patel to Kulasekara, 2 runs Yuvraj has been brilliant today, dives to his left after running a mile at long leg to keep them down to two, it was timed really well",1st innings,Mahela Jayawardene,49289,Yuvraj Singh,36084,41.3,run,190,2,190/5,"Patel to Kulasekara, 2 runs",,"Yuvraj has been brilliant today, dives to his left after running a mile at long leg to keep them down to two, it was timed really well",5
256,250,Nuwan Kulasekara,49535,Munaf Patel,32965,"Patel to Kulasekara, no run driven solidly off the front foot but right to short extra cover",1st innings,Mahela Jayawardene,49289,Yuvraj Singh,36084,41.4,no run,190,0,190/5,"Patel to Kulasekara, no run",,driven solidly off the front foot but right to short extra cover,5
257,251,Nuwan Kulasekara,49535,Munaf Patel,32965,"Patel to Kulasekara, 2 runs fuller length from Munaf again, this time he gets the drive past extra cover and wide of sweeper cover as well",1st innings,Mahela Jayawardene,49289,Yuvraj Singh,36084,41.5,run,192,2,192/5,"Patel to Kulasekara, 2 runs",,"fuller length from Munaf again, this time he gets the drive past extra cover and wide of sweeper cover as well",5
258,252,Nuwan Kulasekara,49535,Munaf Patel,32965,"Patel to Kulasekara, no run pushed out to point, it was a length ball from Munaf",1st innings,Mahela Jayawardene,49289,Yuvraj Singh,36084,41.6,no run,192,0,192/5,"Patel to Kulasekara, no run",,"pushed out to point, it was a length ball from Munaf",5
259,253,Mahela Jayawardene,49289,Harbhajan Singh,29264,"Harbhajan Singh to Jayawardene, 1 run tossed up full on leg stump from round the wicket, flicked towards square leg",1st innings,Nuwan Kulasekara,49535,Munaf Patel,32965,42.1,run,193,1,193/5,"Harbhajan Singh to Jayawardene, 1 run",,"tossed up full on leg stump from round the wicket, flicked towards square leg",5
260,254,Nuwan Kulasekara,49535,Harbhajan Singh,29264,"Harbhajan Singh to Kulasekara, 1 run driven hard down the track, and Harbhajan does not manage to stop it",1st innings,Mahela Jayawardene,49289,Munaf Patel,32965,42.2,run,194,1,194/5,"Harbhajan Singh to Kulasekara, 1 run",,"driven hard down the track, and Harbhajan does not manage to stop it",5
261,254,Mahela Jayawardene,49289,Harbhajan Singh,29264,"Harbhajan Singh to Jayawardene, 1 wide bowls it short and wide down the leg side, Mahela misses out even as he swivels",1st innings,Nuwan Kulasekara,49535,Munaf Patel,32965,42.2,wide,195,1,195/5,"Harbhajan Singh to Jayawardene, 1 wide",,"bowls it short and wide down the leg side, Mahela misses out even as he swivels",5
262,255,Mahela Jayawardene,49289,Harbhajan Singh,29264,"Harbhajan Singh to Jayawardene, 1 run turned in front of square off the back foot",1st innings,Nuwan Kulasekara,49535,Munaf Patel,32965,42.3,run,196,1,196/5,"Harbhajan Singh to Jayawardene, 1 run",,turned in front of square off the back foot,5
263,256,Nuwan Kulasekara,49535,Harbhajan Singh,29264,"Harbhajan Singh to Kulasekara, 1 run turns in sharply from outside off, and he works it to short fine leg who is a bit slow off the blocks",1st innings,Mahela Jayawardene,49289,Munaf Patel,32965,42.4,run,197,1,197/5,"Harbhajan Singh to Kulasekara, 1 run",,"turns in sharply from outside off, and he works it to short fine leg who is a bit slow off the blocks",5
264,257,Mahela Jayawardene,49289,Harbhajan Singh,29264,"Harbhajan Singh to Jayawardene, 1 run rolls away in the direction of short fine leg, who is not short enough as he concedes another run",1st innings,Nuwan Kulasekara,49535,Munaf Patel,32965,42.5,run,198,1,198/5,"Harbhajan Singh to Jayawardene, 1 run",,"rolls away in the direction of short fine leg, who is not short enough as he concedes another run",5
265,258,Nuwan Kulasekara,49535,Harbhajan Singh,29264,"Harbhajan Singh to Kulasekara, 1 run more turn for Harbhajan, but ending on leg stump, and they easily take the single with a nudge towards square leg",1st innings,Mahela Jayawardene,49289,Munaf Patel,32965,42.6,run,199,1,199/5,"Harbhajan Singh to Kulasekara, 1 run",,"more turn for Harbhajan, but ending on leg stump, and they easily take the single with a nudge towards square leg",5
266,259,Nuwan Kulasekara,49535,Munaf Patel,32965,"Patel to Kulasekara, no run Kula misses the cut, Dhoni collects and immediately goes up for the catch, Munaf thinks he has got his man too, umpire Dar shakes his head, Dhoni wants another <b>review</b>, there seems to be no indication of an edge there, seemed like a review in hope rather than conviction, there was some sort of noise as the ball passed the bat, but that will not earn India a wicket",1st innings,Mahela Jayawardene,49289,Harbhajan Singh,29264,43.1,no run,199,0,199/5,"Patel to Kulasekara, no run",,"Kula misses the cut, Dhoni collects and immediately goes up for the catch, Munaf thinks he has got his man too, umpire Dar shakes his head, Dhoni wants another <b>review</b>, there seems to be no indication of an edge there, seemed like a review in hope rather than conviction, there was some sort of noise as the ball passed the bat, but that will not earn India a wicket",5
267,260,Nuwan Kulasekara,49535,Munaf Patel,32965,"Patel to Kulasekara, no run pushed back to the bowler",1st innings,Mahela Jayawardene,49289,Harbhajan Singh,29264,43.2,no run,199,0,199/5,"Patel to Kulasekara, no run",,pushed back to the bowler,5
268,261,Nuwan Kulasekara,49535,Munaf Patel,32965,"Patel to Kulasekara, 1 run 126.8 kph short delivery that sits up, Kula goes for the pull, and it loops in the air but falls well short of long leg",1st innings,Mahela Jayawardene,49289,Harbhajan Singh,29264,43.3,run,200,1,200/5,"Patel to Kulasekara, 1 run",,"126.8 kph short delivery that sits up, Kula goes for the pull, and it loops in the air but falls well short of long leg",5
269,262,Mahela Jayawardene,49289,Munaf Patel,32965,"Patel to Jayawardene, FOUR runs India have been largely brilliant in the field today, but that was sloppy from Virat, Mahela drove fiercely off the front foot, and Virat let it through his hands at point as it bounced in front of him",1st innings,Nuwan Kulasekara,49535,Harbhajan Singh,29264,43.4,four,204,4,204/5,"Patel to Jayawardene, FOUR runs",,"India have been largely brilliant in the field today, but that was sloppy from Virat, Mahela drove fiercely off the front foot, and Virat let it through his hands at point as it bounced in front of him",5
270,263,Mahela Jayawardene,49289,Munaf Patel,32965,"Patel to Jayawardene, 1 run slower one outside off, he stays in the crease and pushes it to point",1st innings,Nuwan Kulasekara,49535,Harbhajan Singh,29264,43.5,run,205,1,205/5,"Patel to Jayawardene, 1 run",,"slower one outside off, he stays in the crease and pushes it to point",5
271,264,Nuwan Kulasekara,49535,Munaf Patel,32965,"Patel to Kulasekara, no run Kula began the over with a play-and-miss, and finishes it with another attempted cut, the extra bounce beats him",1st innings,Mahela Jayawardene,49289,Harbhajan Singh,29264,43.6,no run,205,0,205/5,"Patel to Kulasekara, no run",,"Kula began the over with a play-and-miss, and finishes it with another attempted cut, the extra bounce beats him",5
272,265,Mahela Jayawardene,49289,Harbhajan Singh,29264,"Harbhajan Singh to Jayawardene, 1 run fuller one on leg stump, flicked behind square",1st innings,Nuwan Kulasekara,49535,Munaf Patel,32965,44.1,run,206,1,206/5,"Harbhajan Singh to Jayawardene, 1 run",,"fuller one on leg stump, flicked behind square",5
273,266,Nuwan Kulasekara,49535,Harbhajan Singh,29264,"Harbhajan Singh to Kulasekara, 2 runs pushes on the off side and they go for the run, Dhoni's throw is wayward and another overthrow is conceded",1st innings,Mahela Jayawardene,49289,Munaf Patel,32965,44.2,run,208,2,208/5,"Harbhajan Singh to Kulasekara, 2 runs",,"pushes on the off side and they go for the run, Dhoni's throw is wayward and another overthrow is conceded",5
274,267,Nuwan Kulasekara,49535,Harbhajan Singh,29264,"Harbhajan Singh to Kulasekara, 1 run sharp turn from outside off but short in length, and they take another run backward of square leg",1st innings,Mahela Jayawardene,49289,Munaf Patel,32965,44.3,run,209,1,209/5,"Harbhajan Singh to Kulasekara, 1 run",,"sharp turn from outside off but short in length, and they take another run backward of square leg",5
275,268,Mahela Jayawardene,49289,Harbhajan Singh,29264,"Harbhajan Singh to Jayawardene, 1 run yet another single taken in the direction of square leg",1st innings,Nuwan Kulasekara,49535,Munaf Patel,32965,44.4,run,210,1,210/5,"Harbhajan Singh to Jayawardene, 1 run",,yet another single taken in the direction of square leg,5
276,269,Nuwan Kulasekara,49535,Harbhajan Singh,29264,"Harbhajan Singh to Kulasekara, no run slows it down, and he goes back to dab it to short third man",1st innings,Mahela Jayawardene,49289,Munaf Patel,32965,44.5,no run,210,0,210/5,"Harbhajan Singh to Kulasekara, no run",,"slows it down, and he goes back to dab it to short third man",5
277,270,Nuwan Kulasekara,49535,Harbhajan Singh,29264,"Harbhajan Singh to Kulasekara, 1 run pushed on the leg side and even as Dhoni charges after it, they have time to take the single, helps that the throw to Harbhajan is weak",1st innings,Mahela Jayawardene,49289,Munaf Patel,32965,44.6,run,211,1,211/5,"Harbhajan Singh to Kulasekara, 1 run",,"pushed on the leg side and even as Dhoni charges after it, they have time to take the single, helps that the throw to Harbhajan is weak",5
278,271,Nuwan Kulasekara,49535,Zaheer Khan,30102,"Khan to Kulasekara, 1 run bangs this one in short around middle and leg, Kula pulls in the air down to deep midwicket, Mahela on strike now",1st innings,Mahela Jayawardene,49289,Harbhajan Singh,29264,45.1,run,212,1,212/5,"Khan to Kulasekara, 1 run",,"bangs this one in short around middle and leg, Kula pulls in the air down to deep midwicket, Mahela on strike now",5
279,272,Mahela Jayawardene,49289,Zaheer Khan,30102,"Khan to Jayawardene, 1 run gets on top of a 120.7 kph short delivery, and rolls his wrists over it to keep the pull down, and wide of deep midwicket",1st innings,Nuwan Kulasekara,49535,Harbhajan Singh,29264,45.2,run,213,1,213/5,"Khan to Jayawardene, 1 run",,"gets on top of a 120.7 kph short delivery, and rolls his wrists over it to keep the pull down, and wide of deep midwicket",5
280,273,Nuwan Kulasekara,49535,Zaheer Khan,30102,"Khan to Kulasekara, 1 run not short enough, but Kula nevertheless slogs it away, to deep midwicket again",1st innings,Mahela Jayawardene,49289,Harbhajan Singh,29264,45.3,run,214,1,214/5,"Khan to Kulasekara, 1 run",,"not short enough, but Kula nevertheless slogs it away, to deep midwicket again",5
281,274,Mahela Jayawardene,49289,Zaheer Khan,30102,"Khan to Jayawardene, 1 run Zaheer goes right in the blockhole with the yorker, Mahela digs it out in front of point",1st innings,Nuwan Kulasekara,49535,Harbhajan Singh,29264,45.4,run,215,1,215/5,"Khan to Jayawardene, 1 run",,"Zaheer goes right in the blockhole with the yorker, Mahela digs it out in front of point",5
282,275,Nuwan Kulasekara,49535,Zaheer Khan,30102,"Khan to Kulasekara, 1 run 119.7 kph slower ball, and right on middle and leg, pushed down to mid on for a single",1st innings,Mahela Jayawardene,49289,Harbhajan Singh,29264,45.5,run,216,1,216/5,"Khan to Kulasekara, 1 run",,"119.7 kph slower ball, and right on middle and leg, pushed down to mid on for a single",5
283,276,Mahela Jayawardene,49289,Zaheer Khan,30102,"Khan to Jayawardene, FOUR runs but there is no one at sweeper cover, Mahela makes room, opens the face of the bat and gets this full delivery past extra cover, nine off the over",1st innings,Nuwan Kulasekara,49535,Harbhajan Singh,29264,45.6,four,220,4,220/5,"Khan to Jayawardene, FOUR runs",,"but there is no one at sweeper cover, Mahela makes room, opens the face of the bat and gets this full delivery past extra cover, nine off the over",5
284,277,Nuwan Kulasekara,49535,Munaf Patel,32965,"Patel to Kulasekara, FOUR runs with fine leg in the circle, Munaf bowls a short slow delivery that sits up on leg stump, Kula pulls it over that man and gets the boundary",1st innings,Mahela Jayawardene,49289,Zaheer Khan,30102,46.1,four,224,4,224/5,"Patel to Kulasekara, FOUR runs",,"with fine leg in the circle, Munaf bowls a short slow delivery that sits up on leg stump, Kula pulls it over that man and gets the boundary",5
285,278,Nuwan Kulasekara,49535,Munaf Patel,32965,"Patel to Kulasekara, 1 run targets the blockhole this time, he manages to hit it wide of mid on",1st innings,Mahela Jayawardene,49289,Zaheer Khan,30102,46.2,run,225,1,225/5,"Patel to Kulasekara, 1 run",,"targets the blockhole this time, he manages to hit it wide of mid on",5
286,279,Mahela Jayawardene,49289,Munaf Patel,32965,"Patel to Jayawardene, FOUR runs Mahela, elegant brilliance, makes room to a length ball, slashes in the air, third man is  in the circle, and he gets it right over his head",1st innings,Nuwan Kulasekara,49535,Zaheer Khan,30102,46.3,four,229,4,229/5,"Patel to Jayawardene, FOUR runs",,"Mahela, elegant brilliance, makes room to a length ball, slashes in the air, third man is  in the circle, and he gets it right over his head",5
287,280,Mahela Jayawardene,49289,Munaf Patel,32965,"Patel to Jayawardene, 1 run guided towards point and Mahela takes the single",1st innings,Nuwan Kulasekara,49535,Zaheer Khan,30102,46.4,run,230,1,230/5,"Patel to Jayawardene, 1 run",,guided towards point and Mahela takes the single,5
288,281,Nuwan Kulasekara,49535,Munaf Patel,32965,"Patel to Kulasekara, no run now Kula backs away outside leg stump, but Munaf bowls a yorker and he can only dig it back to the bowler",1st innings,Mahela Jayawardene,49289,Zaheer Khan,30102,46.5,no run,230,0,230/5,"Patel to Kulasekara, no run",,"now Kula backs away outside leg stump, but Munaf bowls a yorker and he can only dig it back to the bowler",5
289,282,Nuwan Kulasekara,49535,Munaf Patel,32965,"Patel to Kulasekara, 1 run wants to slog this fuller one away through midwicket, but Munaf slows it down and he will get only the single",1st innings,Mahela Jayawardene,49289,Zaheer Khan,30102,46.6,run,231,1,231/5,"Patel to Kulasekara, 1 run",,"wants to slog this fuller one away through midwicket, but Munaf slows it down and he will get only the single",5
290,283,Nuwan Kulasekara,49535,Zaheer Khan,30102,"Khan to Kulasekara, SIX runs Kula takes off in the Mumbai evening, gets a length ball in the slot and smashes it over deep midwicket, just stood in the crease and swung it hard",1st innings,Mahela Jayawardene,49289,Munaf Patel,32965,47.1,six,237,6,237/5,"Khan to Kulasekara, SIX runs",,"Kula takes off in the Mumbai evening, gets a length ball in the slot and smashes it over deep midwicket, just stood in the crease and swung it hard",5
291,284,Nuwan Kulasekara,49535,Zaheer Khan,30102,"Khan to Kulasekara, 1 run now he brings Mahela on strike with a single towards mid on",1st innings,Mahela Jayawardene,49289,Munaf Patel,32965,47.2,run,238,1,238/5,"Khan to Kulasekara, 1 run",,now he brings Mahela on strike with a single towards mid on,5
292,285,Mahela Jayawardene,49289,Zaheer Khan,30102,"Khan to Jayawardene, 2 runs short one from Zaheer, Mahela goes for the pull, and gloves it over Dhoni who runs back but the ball drops just over his head, Mahela lives on",1st innings,Nuwan Kulasekara,49535,Munaf Patel,32965,47.3,run,240,2,240/5,"Khan to Jayawardene, 2 runs",,"short one from Zaheer, Mahela goes for the pull, and gloves it over Dhoni who runs back but the ball drops just over his head, Mahela lives on",5
293,286,Mahela Jayawardene,49289,Zaheer Khan,30102,"Khan to Jayawardene, FOUR runs 118.9 kph short one gone horribly wrong for Zaheer, width outside off, Mahela backs away outside leg, and cuts it over and in the gap between short third man and point, then jogs all the way to the non-striker's end in typical fashion",1st innings,Nuwan Kulasekara,49535,Munaf Patel,32965,47.4,four,244,4,244/5,"Khan to Jayawardene, FOUR runs",,"118.9 kph short one gone horribly wrong for Zaheer, width outside off, Mahela backs away outside leg, and cuts it over and in the gap between short third man and point, then jogs all the way to the non-striker's end in typical fashion",5
294,287,Mahela Jayawardene,49289,Zaheer Khan,30102,"Khan to Jayawardene, FOUR runs century for Mahela Jayawardene, pure class, Zaheer bowls it full, but again offers some width, Mahela tees off over mid off, what a champion, he has not done much in this tournament, but what an occasion to come good",1st innings,Nuwan Kulasekara,49535,Munaf Patel,32965,47.5,four,248,4,248/5,"Khan to Jayawardene, FOUR runs",,"century for Mahela Jayawardene, pure class, Zaheer bowls it full, but again offers some width, Mahela tees off over mid off, what a champion, he has not done much in this tournament, but what an occasion to come good",5
295,288,Mahela Jayawardene,49289,Zaheer Khan,30102,"Khan to Jayawardene, OUT India get a wicket, but it is Kula, they tried to steal a run down the leg side, but Dhoni was spot-on with the under-arm lob",1st innings,Nuwan Kulasekara,49535,Munaf Patel,32965,47.6,out,248,0,248/6,"Khan to Jayawardene, OUT",,"India get a wicket, but it is Kula, they tried to steal a run down the leg side, but Dhoni was spot-on with the under-arm lob",6
296,289,Mahela Jayawardene,49289,Harbhajan Singh,29264,"Harbhajan Singh to Jayawardene, 1 run goes for the big slog over midwicket but gets it off the toe end of the bat",1st innings,Thisara Perera,233514,Zaheer Khan,30102,48.1,run,249,1,249/6,"Harbhajan Singh to Jayawardene, 1 run",,goes for the big slog over midwicket but gets it off the toe end of the bat,6
297,290,Thisara Perera,233514,Harbhajan Singh,29264,"Harbhajan Singh to Perera, no run Harbhajan offers lots of width outside off, but also bowls it quick and flat, and he misses on the cut",1st innings,Mahela Jayawardene,49289,Zaheer Khan,30102,48.2,no run,249,0,249/6,"Harbhajan Singh to Perera, no run",,"Harbhajan offers lots of width outside off, but also bowls it quick and flat, and he misses on the cut",6
298,291,Thisara Perera,233514,Harbhajan Singh,29264,"Harbhajan Singh to Perera, 1 run smashed down to long off, Mahela on strike now",1st innings,Mahela Jayawardene,49289,Zaheer Khan,30102,48.3,run,250,1,250/6,"Harbhajan Singh to Perera, 1 run",,"smashed down to long off, Mahela on strike now",6
299,292,Mahela Jayawardene,49289,Harbhajan Singh,29264,"Harbhajan Singh to Jayawardene, 1 run fires it in on the pads, 113 kph. he slogs it to midwicket, who lobs an under-arm throw, enabling them to easily complete the single",1st innings,Thisara Perera,233514,Zaheer Khan,30102,48.4,run,251,1,251/6,"Harbhajan Singh to Jayawardene, 1 run",,"fires it in on the pads, 113 kph. he slogs it to midwicket, who lobs an under-arm throw, enabling them to easily complete the single",6
300,293,Thisara Perera,233514,Harbhajan Singh,29264,"Harbhajan Singh to Perera, FOUR runs another quicker one, this time flat, short and on the stumps, Thisara takes all those hints and lifts it over Harbhajan's head for another boundary",1st innings,Mahela Jayawardene,49289,Zaheer Khan,30102,48.5,four,255,4,255/6,"Harbhajan Singh to Perera, FOUR runs",,"another quicker one, this time flat, short and on the stumps, Thisara takes all those hints and lifts it over Harbhajan's head for another boundary",6
301,294,Thisara Perera,233514,Harbhajan Singh,29264,"Harbhajan Singh to Perera, 1 leg bye darts this one full and in to his pads, he wanted to go over midwicket, but was beaten by the pace from Harbhajan and the ball rolls away on the off side",1st innings,Mahela Jayawardene,49289,Zaheer Khan,30102,48.6,leg bye,256,1,256/6,"Harbhajan Singh to Perera, 1 leg bye",,"darts this one full and in to his pads, he wanted to go over midwicket, but was beaten by the pace from Harbhajan and the ball rolls away on the off side",6
302,295,Thisara Perera,233514,Zaheer Khan,30102,"Khan to Perera, 1 run Zaheer bowls one full on the stump, and Thisara smokes it down to long off, absolutely smoked",1st innings,Mahela Jayawardene,49289,Harbhajan Singh,29264,49.1,run,257,1,257/6,"Khan to Perera, 1 run",,"Zaheer bowls one full on the stump, and Thisara smokes it down to long off, absolutely smoked",6
303,296,Mahela Jayawardene,49289,Zaheer Khan,30102,"Khan to Jayawardene, 1 run Zaheer follows Mahela down the leg side with a yorker, but Mahela is in such good touch that he manages to squeeze it late to short third man",1st innings,Thisara Perera,233514,Harbhajan Singh,29264,49.2,run,258,1,258/6,"Khan to Jayawardene, 1 run",,"Zaheer follows Mahela down the leg side with a yorker, but Mahela is in such good touch that he manages to squeeze it late to short third man",6
304,297,Thisara Perera,233514,Zaheer Khan,30102,"Khan to Perera, FOUR runs serves up a low full around off stump, and thisara makes some room, and whacks it past extra cover for another boundary, that is what you do in the batting Powerplay, take full toll of it",1st innings,Mahela Jayawardene,49289,Harbhajan Singh,29264,49.3,four,262,4,262/6,"Khan to Perera, FOUR runs",,"serves up a low full around off stump, and thisara makes some room, and whacks it past extra cover for another boundary, that is what you do in the batting Powerplay, take full toll of it",6
305,298,Thisara Perera,233514,Zaheer Khan,30102,"Khan to Perera, FOUR runs that is why Kula came in ahead of Thisara, who can take off in these end overs, gets a full delivery, and launches it with a powerful swing, and the ball just beats a leaping mid on",1st innings,Mahela Jayawardene,49289,Harbhajan Singh,29264,49.4,four,266,4,266/6,"Khan to Perera, FOUR runs",,"that is why Kula came in ahead of Thisara, who can take off in these end overs, gets a full delivery, and launches it with a powerful swing, and the ball just beats a leaping mid on",6
306,299,Thisara Perera,233514,Zaheer Khan,30102,"Khan to Perera, 2 runs super commitment from Mahela, it was slogged wide of deep midwicket, Mahela pushed Thisara for the second, and backed up his intentions with a screaming dive to get in the crease",1st innings,Mahela Jayawardene,49289,Harbhajan Singh,29264,49.5,run,268,2,268/6,"Khan to Perera, 2 runs",,"super commitment from Mahela, it was slogged wide of deep midwicket, Mahela pushed Thisara for the second, and backed up his intentions with a screaming dive to get in the crease",6
307,300,Thisara Perera,233514,Zaheer Khan,30102,"Khan to Perera, SIX runs 63 runs off the batting Powerplay, 22 off 9 for Thisara, gets a fuller delivery in his swinging zone, swivels, and hammers it over deep square leg for maximum",1st innings,Mahela Jayawardene,49289,Harbhajan Singh,29264,49.6,six,274,6,274/6,"Khan to Perera, SIX runs",,"63 runs off the batting Powerplay, 22 off 9 for Thisara, gets a fuller delivery in his swinging zone, swivels, and hammers it over deep square leg for maximum",6
