,ball,batsman,batsman_id,bowler,bowler_id,commentary,innings,overs,playType,runs,runs_scored,score,shortText,speed,text,wickets
177,175,Shane Watson,8180,Marlon Samuels,52983,"Samuels to Watson, no run tossed up, driven to cover",1st innings,29.1,no run,158,0,158/1,"Samuels to Watson, no run",,"tossed up, driven to cover",1
178,176,Shane Watson,8180,Marlon Samuels,52983,"Samuels to Watson, no run length, on the stumps, defended back to the bowler",1st innings,29.2,no run,158,0,158/1,"Samuels to Watson, no run",,"length, on the stumps, defended back to the bowler",1
179,177,Shane Watson,8180,Marlon Samuels,52983,"Samuels to Watson, 1 run picked up from just outside off and driven down the ground",1st innings,29.3,run,159,1,159/1,"Samuels to Watson, 1 run",,picked up from just outside off and driven down the ground,1
180,178,Peter Forrest,232285,Marlon Samuels,52983,"Samuels to Forrest, no run on the stumps, bit of bounce and Forrest edges to short third man trying to turn the ball to leg",1st innings,29.4,no run,159,0,159/1,"Samuels to Forrest, no run",,"on the stumps, bit of bounce and Forrest edges to short third man trying to turn the ball to leg",1
181,179,Peter Forrest,232285,Marlon Samuels,52983,"Samuels to Forrest, 1 run driven down the ground to long-off",1st innings,29.5,run,160,1,160/1,"Samuels to Forrest, 1 run",,driven down the ground to long-off,1
182,180,Shane Watson,8180,Marlon Samuels,52983,"Samuels to Watson, 1 run flighted outside off, punched to long-off again",1st innings,29.6,run,161,1,161/1,"Samuels to Watson, 1 run",,"flighted outside off, punched to long-off again",1
183,181,Shane Watson,8180,Andre Russell,276298,"Russell to Watson, OUT and now they have one! Russell rolled a bouncer out of his hand and Watson opened the face and guided it to third man like it was on a string. There just wasn't enough pace on it to go all the way ... and Watson, like Warner, fails to go on",1st innings,30.1,out,161,0,161/2,"Russell to Watson, OUT",,"and now they have one! Russell rolled a bouncer out of his hand and Watson opened the face and guided it to third man like it was on a string. There just wasn't enough pace on it to go all the way ... and Watson, like Warner, fails to go on",2
184,182,George Bailey,4451,Andre Russell,276298,"Russell to Bailey, 1 run pitched up, outside off, whipped through square leg and Bailey is off the mark",1st innings,30.2,run,162,1,162/2,"Russell to Bailey, 1 run",,"pitched up, outside off, whipped through square leg and Bailey is off the mark",2
185,183,Peter Forrest,232285,Andre Russell,276298,"Russell to Forrest, 1 run pushed to cover on the back foot ... but Sammy's shy at the non-striker's end concedes a run",1st innings,30.3,run,163,1,163/2,"Russell to Forrest, 1 run",,pushed to cover on the back foot ... but Sammy's shy at the non-striker's end concedes a run,2
186,184,George Bailey,4451,Andre Russell,276298,"Russell to Bailey, 1 bye leg-stump bouncer that veers even further in the air and Carlton Baugh channels Peter Schmeichel to fingertip the ball round the post/prevent a boundary",1st innings,30.4,bye,164,1,164/2,"Russell to Bailey, 1 bye",,leg-stump bouncer that veers even further in the air and Carlton Baugh channels Peter Schmeichel to fingertip the ball round the post/prevent a boundary,2
187,185,Peter Forrest,232285,Andre Russell,276298,"Russell to Forrest, 1 run dropped short on the off side and Russell hits the stumps after fielding in his follow-through. He's quite the athlete, this guy",1st innings,30.5,run,165,1,165/2,"Russell to Forrest, 1 run",,"dropped short on the off side and Russell hits the stumps after fielding in his follow-through. He's quite the athlete, this guy",2
188,186,George Bailey,4451,Andre Russell,276298,"Russell to Bailey, 1 run back of a length, on the stumps, Bailey plays back, patting the to short midwicket",1st innings,30.6,run,166,1,166/2,"Russell to Bailey, 1 run",,"back of a length, on the stumps, Bailey plays back, patting the to short midwicket",2
189,187,George Bailey,4451,Marlon Samuels,52983,"Samuels to Bailey, 1 run tossed up, driven between mid-on and midwicket",1st innings,31.1,run,167,1,167/2,"Samuels to Bailey, 1 run",,"tossed up, driven between mid-on and midwicket",2
190,188,Peter Forrest,232285,Marlon Samuels,52983,"Samuels to Forrest, no run flighted in towards the stumps from wide of the crease, driven to mid-off",1st innings,31.2,no run,167,0,167/2,"Samuels to Forrest, no run",,"flighted in towards the stumps from wide of the crease, driven to mid-off",2
191,189,Peter Forrest,232285,Marlon Samuels,52983,"Samuels to Forrest, no run length ball, dabbed into the off side",1st innings,31.3,no run,167,0,167/2,"Samuels to Forrest, no run",,"length ball, dabbed into the off side",2
192,190,Peter Forrest,232285,Marlon Samuels,52983,"Samuels to Forrest, FOUR runs full, Forrest picks it up quickly and crashes a cover drive to the boundary",1st innings,31.4,four,171,4,171/2,"Samuels to Forrest, FOUR runs",,"full, Forrest picks it up quickly and crashes a cover drive to the boundary",2
193,191,Peter Forrest,232285,Marlon Samuels,52983,"Samuels to Forrest, no run steady line and length outside off, steered to short third man",1st innings,31.5,no run,171,0,171/2,"Samuels to Forrest, no run",,"steady line and length outside off, steered to short third man",2
194,192,Peter Forrest,232285,Marlon Samuels,52983,"Samuels to Forrest, no run on the stumps, pushed to midwicket",1st innings,31.6,no run,171,0,171/2,"Samuels to Forrest, no run",,"on the stumps, pushed to midwicket",2
195,192,George Bailey,4451,Dwayne Bravo,51439,"DJ Bravo to Bailey, 1 wide flings a loosener down the leg side, which Bailey can't get anything on",1st innings,32.0,wide,172,1,172/2,"DJ Bravo to Bailey, 1 wide",,"flings a loosener down the leg side, which Bailey can't get anything on",2
196,193,George Bailey,4451,Dwayne Bravo,51439,"DJ Bravo to Bailey, 1 run slower ball, tossed up outside off, clipped in the air through midwicket, the bat turning in Bailey's hands",1st innings,32.1,run,173,1,173/2,"DJ Bravo to Bailey, 1 run",,"slower ball, tossed up outside off, clipped in the air through midwicket, the bat turning in Bailey's hands",2
197,194,Peter Forrest,232285,Dwayne Bravo,51439,"DJ Bravo to Forrest, no run slightly back of a length, cut to point",1st innings,32.2,no run,173,0,173/2,"DJ Bravo to Forrest, no run",,"slightly back of a length, cut to point",2
198,195,Peter Forrest,232285,Dwayne Bravo,51439,"DJ Bravo to Forrest, 1 run draws the batsman across outside off, dropped short just off the wicket for a quick single",1st innings,32.3,run,174,1,174/2,"DJ Bravo to Forrest, 1 run",,"draws the batsman across outside off, dropped short just off the wicket for a quick single",2
199,196,George Bailey,4451,Dwayne Bravo,51439,"DJ Bravo to Bailey, 2 runs full length, Bailey shuffles across and shovels off his legs",1st innings,32.4,run,176,2,176/2,"DJ Bravo to Bailey, 2 runs",,"full length, Bailey shuffles across and shovels off his legs",2
200,197,George Bailey,4451,Dwayne Bravo,51439,"DJ Bravo to Bailey, 2 runs short and wide, cut hard to deep backward point where Johnson Charles saves a couple with a diving stop",1st innings,32.5,run,178,2,178/2,"DJ Bravo to Bailey, 2 runs",,"short and wide, cut hard to deep backward point where Johnson Charles saves a couple with a diving stop",2
201,198,George Bailey,4451,Dwayne Bravo,51439,"DJ Bravo to Bailey, no run length ball, in the corridor outside off, blocked back to the bowler",1st innings,32.6,no run,178,0,178/2,"DJ Bravo to Bailey, no run",,"length ball, in the corridor outside off, blocked back to the bowler",2
202,199,Peter Forrest,232285,Marlon Samuels,52983,"Samuels to Forrest, no run goes back and stabs it back to the bowler",1st innings,33.1,no run,178,0,178/2,"Samuels to Forrest, no run",,goes back and stabs it back to the bowler,2
203,200,Peter Forrest,232285,Marlon Samuels,52983,"Samuels to Forrest, no run gets forward and pushes it back to the bowler",1st innings,33.2,no run,178,0,178/2,"Samuels to Forrest, no run",,gets forward and pushes it back to the bowler,2
204,201,Peter Forrest,232285,Marlon Samuels,52983,"Samuels to Forrest, no run gets forward and drives to the off side",1st innings,33.3,no run,178,0,178/2,"Samuels to Forrest, no run",,gets forward and drives to the off side,2
205,202,Peter Forrest,232285,Marlon Samuels,52983,"Samuels to Forrest, 1 run comes well forward and pushes it towards extra cover",1st innings,33.4,run,179,1,179/2,"Samuels to Forrest, 1 run",,comes well forward and pushes it towards extra cover,2
206,203,George Bailey,4451,Marlon Samuels,52983,"Samuels to Bailey, 1 run gets a leading edge that lobs in front of point",1st innings,33.5,run,180,1,180/2,"Samuels to Bailey, 1 run",,gets a leading edge that lobs in front of point,2
207,204,Peter Forrest,232285,Marlon Samuels,52983,"Samuels to Forrest, no run gets forward to defend and he's beaten",1st innings,33.6,no run,180,0,180/2,"Samuels to Forrest, no run",,gets forward to defend and he's beaten,2
208,205,George Bailey,4451,Dwayne Bravo,51439,"DJ Bravo to Bailey, no run moves across and pushes it down to mid-on",1st innings,34.1,no run,180,0,180/2,"DJ Bravo to Bailey, no run",,moves across and pushes it down to mid-on,2
209,206,George Bailey,4451,Dwayne Bravo,51439,"DJ Bravo to Bailey, no run mistimes the punch towards point",1st innings,34.2,no run,180,0,180/2,"DJ Bravo to Bailey, no run",,mistimes the punch towards point,2
210,207,George Bailey,4451,Dwayne Bravo,51439,"DJ Bravo to Bailey, FOUR runs excellent shot, Bailey creates an opportunity for a boundary, he knew there was no slip, delicately dabbed it down to third man, the fielder was a bit square",1st innings,34.3,four,184,4,184/2,"DJ Bravo to Bailey, FOUR runs",,"excellent shot, Bailey creates an opportunity for a boundary, he knew there was no slip, delicately dabbed it down to third man, the fielder was a bit square",2
211,208,George Bailey,4451,Dwayne Bravo,51439,"DJ Bravo to Bailey, no run bowls it straighter and he goes back and defends to the on side",1st innings,34.4,no run,184,0,184/2,"DJ Bravo to Bailey, no run",,bowls it straighter and he goes back and defends to the on side,2
212,208,George Bailey,4451,Dwayne Bravo,51439,"DJ Bravo to Bailey, 1 wide drifts wide down the leg side, tries to flick it away",1st innings,34.4,wide,185,1,185/2,"DJ Bravo to Bailey, 1 wide",,"drifts wide down the leg side, tries to flick it away",2
213,209,George Bailey,4451,Dwayne Bravo,51439,"DJ Bravo to Bailey, 1 run stabs it down to long-on for a quick single",1st innings,34.5,run,186,1,186/2,"DJ Bravo to Bailey, 1 run",,stabs it down to long-on for a quick single,2
214,210,Peter Forrest,232285,Dwayne Bravo,51439,"DJ Bravo to Forrest, no run good slower ball, he tries to flick it away but the ball hits his thigh and nearly dribbles back to the stumps",1st innings,34.6,no run,186,0,186/2,"DJ Bravo to Forrest, no run",,"good slower ball, he tries to flick it away but the ball hits his thigh and nearly dribbles back to the stumps",2
215,211,George Bailey,4451,Marlon Samuels,52983,"Samuels to Bailey, FOUR runs and there's a boundary straightaway, fires it down the leg side and he gets on his knee early and sweeps to fine leg",1st innings,35.1,four,190,4,190/2,"Samuels to Bailey, FOUR runs",,"and there's a boundary straightaway, fires it down the leg side and he gets on his knee early and sweeps to fine leg",2
216,212,George Bailey,4451,Marlon Samuels,52983,"Samuels to Bailey, no run pushes it quicker, he tries to flick but misses",1st innings,35.2,no run,190,0,190/2,"Samuels to Bailey, no run",,"pushes it quicker, he tries to flick but misses",2
217,213,George Bailey,4451,Marlon Samuels,52983,"Samuels to Bailey, no run fires in a yorker and he fails to squirt it out",1st innings,35.3,no run,190,0,190/2,"Samuels to Bailey, no run",,fires in a yorker and he fails to squirt it out,2
218,214,George Bailey,4451,Marlon Samuels,52983,"Samuels to Bailey, no run another yorker and he jams it hard on the pitch and lobs to the bowler",1st innings,35.4,no run,190,0,190/2,"Samuels to Bailey, no run",,another yorker and he jams it hard on the pitch and lobs to the bowler,2
219,215,George Bailey,4451,Marlon Samuels,52983,"Samuels to Bailey, no run works another full delivery down to mid-on",1st innings,35.5,no run,190,0,190/2,"Samuels to Bailey, no run",,works another full delivery down to mid-on,2
220,216,George Bailey,4451,Marlon Samuels,52983,"Samuels to Bailey, no run he opens the face of the bat and steers it to short third man",1st innings,35.6,no run,190,0,190/2,"Samuels to Bailey, no run",,he opens the face of the bat and steers it to short third man,2
221,217,Peter Forrest,232285,Kemar Roach,230553,"Roach to Forrest, 1 run short and wide and he fails to put that away, ends up chopping it down to point",1st innings,36.1,run,191,1,191/2,"Roach to Forrest, 1 run",,"short and wide and he fails to put that away, ends up chopping it down to point",2
222,218,George Bailey,4451,Kemar Roach,230553,"Roach to Bailey, 1 run gives him width and he tries to cut and nearly squeezes it past the gap between point and cover, the fielder gets a hand to it",1st innings,36.2,run,192,1,192/2,"Roach to Bailey, 1 run",,"gives him width and he tries to cut and nearly squeezes it past the gap between point and cover, the fielder gets a hand to it",2
223,219,Peter Forrest,232285,Kemar Roach,230553,"Roach to Forrest, 1 run he opens the face of the bat and runs it down to third man",1st innings,36.3,run,193,1,193/2,"Roach to Forrest, 1 run",,he opens the face of the bat and runs it down to third man,2
224,220,George Bailey,4451,Kemar Roach,230553,"Roach to Bailey, OUT Roach gets a wicket off a full toss, lucky break for the West Indies, Roach angles it in, Bailey tries to clear the infield off a low full toss, can't beat Russell at mid-on, easily taken",1st innings,36.4,out,193,0,193/3,"Roach to Bailey, OUT",,"Roach gets a wicket off a full toss, lucky break for the West Indies, Roach angles it in, Bailey tries to clear the infield off a low full toss, can't beat Russell at mid-on, easily taken",3
225,221,Brett Lee,6278,Kemar Roach,230553,"Roach to Lee, 1 run gets a quick one on the body and he uneasily fends it off to the on side",1st innings,36.5,run,194,1,194/3,"Roach to Lee, 1 run",,gets a quick one on the body and he uneasily fends it off to the on side,3
226,222,Peter Forrest,232285,Kemar Roach,230553,"Roach to Forrest, no run gets beside the line and steers it to point",1st innings,36.6,no run,194,0,194/3,"Roach to Forrest, no run",,gets beside the line and steers it to point,3
227,223,Brett Lee,6278,Marlon Samuels,52983,"Samuels to Lee, no run fires it full again and he jams it back to the bowler",1st innings,37.1,no run,194,0,194/3,"Samuels to Lee, no run",,fires it full again and he jams it back to the bowler,3
228,224,Brett Lee,6278,Marlon Samuels,52983,"Samuels to Lee, 1 run gets his high backlift down and thuds it to long-off",1st innings,37.2,run,195,1,195/3,"Samuels to Lee, 1 run",,gets his high backlift down and thuds it to long-off,3
229,225,Peter Forrest,232285,Marlon Samuels,52983,"Samuels to Forrest, 1 run drifts on the body and he clips it down to short fine leg",1st innings,37.3,run,196,1,196/3,"Samuels to Forrest, 1 run",,drifts on the body and he clips it down to short fine leg,3
230,226,Brett Lee,6278,Marlon Samuels,52983,"Samuels to Lee, 1 run another full toss but no second time lucky for West Indies as he slaps it down to long-on",1st innings,37.4,run,197,1,197/3,"Samuels to Lee, 1 run",,another full toss but no second time lucky for West Indies as he slaps it down to long-on,3
231,227,Peter Forrest,232285,Marlon Samuels,52983,"Samuels to Forrest, FOUR runs poor line from Samuels, drifts down the leg side and Forrest gets enough bat to beat short fine  leg",1st innings,37.5,four,201,4,201/3,"Samuels to Forrest, FOUR runs",,"poor line from Samuels, drifts down the leg side and Forrest gets enough bat to beat short fine  leg",3
232,228,Peter Forrest,232285,Marlon Samuels,52983,"Samuels to Forrest, no run tries to work it away to the leg side but the ball clips his pad and rolls to the off side",1st innings,37.6,no run,201,0,201/3,"Samuels to Forrest, no run",,tries to work it away to the leg side but the ball clips his pad and rolls to the off side,3
233,229,Brett Lee,6278,Kemar Roach,230553,"Roach to Lee, no run makes room and tries to slog him away but he swishes at thin air",1st innings,38.1,no run,201,0,201/3,"Roach to Lee, no run",,makes room and tries to slog him away but he swishes at thin air,3
234,230,Brett Lee,6278,Kemar Roach,230553,"Roach to Lee, FOUR runs Lee welcomes the resumption with a boundary, makes room and crashes a length ball over mid-on, not the length to bowl to a pinch-hitter",1st innings,38.2,four,205,4,205/3,"Roach to Lee, FOUR runs",,"Lee welcomes the resumption with a boundary, makes room and crashes a length ball over mid-on, not the length to bowl to a pinch-hitter",3
235,231,Brett Lee,6278,Kemar Roach,230553,"Roach to Lee, no run Lee makes room to a delivery from round the wicket, beaten for pace and bounce, fails to make contact",1st innings,38.3,no run,205,0,205/3,"Roach to Lee, no run",,"Lee makes room to a delivery from round the wicket, beaten for pace and bounce, fails to make contact",3
236,232,Brett Lee,6278,Kemar Roach,230553,"Roach to Lee, FOUR runs Roach errs by bowling length again from round the wicket, Lee backs away and swings and gets an outside edge that clears the keeper, one bounce and four",1st innings,38.4,four,209,4,209/3,"Roach to Lee, FOUR runs",,"Roach errs by bowling length again from round the wicket, Lee backs away and swings and gets an outside edge that clears the keeper, one bounce and four",3
237,233,Brett Lee,6278,Kemar Roach,230553,"Roach to Lee, 1 run aims for the body and Lee backs away and clips it to the on side",1st innings,38.5,run,210,1,210/3,"Roach to Lee, 1 run",,aims for the body and Lee backs away and clips it to the on side,3
238,234,Peter Forrest,232285,Kemar Roach,230553,"Roach to Forrest, 1 run fuller delivery and he knocks it to the off side",1st innings,38.6,run,211,1,211/3,"Roach to Forrest, 1 run",,fuller delivery and he knocks it to the off side,3
239,235,Peter Forrest,232285,Sunil Narine,230558,"Narine to Forrest, 1 run comes well forward and punches it back to the bowler",1st innings,39.1,run,212,1,212/3,"Narine to Forrest, 1 run",,comes well forward and punches it back to the bowler,3
240,236,Brett Lee,6278,Sunil Narine,230558,"Narine to Lee, OUT through the gate! Looked like the off cutter, landed on middle and turned in slightly, clipped the pad and hit the stumps, Lee left a big gap between bat and pad, Roach ran across to congratulate Narine and he ran quite close to Lee",1st innings,39.2,out,212,0,212/4,"Narine to Lee, OUT",,"through the gate! Looked like the off cutter, landed on middle and turned in slightly, clipped the pad and hit the stumps, Lee left a big gap between bat and pad, Roach ran across to congratulate Narine and he ran quite close to Lee",4
241,237,Michael Hussey,5939,Sunil Narine,230558,"Narine to MEK Hussey, 1 run full outside the off stump and driven to sweeper cover",1st innings,39.3,run,213,1,213/4,"Narine to MEK Hussey, 1 run",,full outside the off stump and driven to sweeper cover,4
242,238,Peter Forrest,232285,Sunil Narine,230558,"Narine to Forrest, 2 runs shuffles a long way across and works it with the turn to fine leg",1st innings,39.4,run,215,2,215/4,"Narine to Forrest, 2 runs",,shuffles a long way across and works it with the turn to fine leg,4
243,239,Peter Forrest,232285,Sunil Narine,230558,"Narine to Forrest, 1 run ",1st innings,39.5,run,216,1,216/4,"Narine to Forrest, 1 run",,,4
244,240,Michael Hussey,5939,Sunil Narine,230558,"Narine to MEK Hussey, no run turns and bounces, Hussey's forced on the back foot and he stabs at it",1st innings,39.6,no run,216,0,216/4,"Narine to MEK Hussey, no run",,"turns and bounces, Hussey's forced on the back foot and he stabs at it",4
245,241,Peter Forrest,232285,Kemar Roach,230553,"Roach to Forrest, 1 run drifts on the pads and he shuffles and works it with the angle down to deep midwicket",1st innings,40.1,run,217,1,217/4,"Roach to Forrest, 1 run",,drifts on the pads and he shuffles and works it with the angle down to deep midwicket,4
246,242,Michael Hussey,5939,Kemar Roach,230553,"Roach to MEK Hussey, 1 run angles across the left-hander and he opens the face and steers it down to third man",1st innings,40.2,run,218,1,218/4,"Roach to MEK Hussey, 1 run",,angles across the left-hander and he opens the face and steers it down to third man,4
247,243,Peter Forrest,232285,Kemar Roach,230553,"Roach to Forrest, 1 run fires it on middle and he works it with the angle to the deep again",1st innings,40.3,run,219,1,219/4,"Roach to Forrest, 1 run",,fires it on middle and he works it with the angle to the deep again,4
248,244,Michael Hussey,5939,Kemar Roach,230553,"Roach to MEK Hussey, 1 run shuffles and knocks it to the leg side",1st innings,40.4,run,220,1,220/4,"Roach to MEK Hussey, 1 run",,shuffles and knocks it to the leg side,4
249,245,Peter Forrest,232285,Kemar Roach,230553,"Roach to Forrest, 1 run Forrest goes on the back foot and clips it to the on side again, he's picking the singles there",1st innings,40.5,run,221,1,221/4,"Roach to Forrest, 1 run",,"Forrest goes on the back foot and clips it to the on side again, he's picking the singles there",4
250,246,Michael Hussey,5939,Kemar Roach,230553,"Roach to MEK Hussey, no run forces Hussey on the back foot, he steers it to the off side but can't pinch a single",1st innings,40.6,no run,221,0,221/4,"Roach to MEK Hussey, no run",,"forces Hussey on the back foot, he steers it to the off side but can't pinch a single",4
251,247,Peter Forrest,232285,Sunil Narine,230558,"Narine to Forrest, 1 run makes room and steers it towards third man",1st innings,41.1,run,222,1,222/4,"Narine to Forrest, 1 run",,makes room and steers it towards third man,4
252,248,Michael Hussey,5939,Sunil Narine,230558,"Narine to MEK Hussey, 1 run tosses it full on the pads and he gently works it wide of midwicket",1st innings,41.2,run,223,1,223/4,"Narine to MEK Hussey, 1 run",,tosses it full on the pads and he gently works it wide of midwicket,4
253,249,Peter Forrest,232285,Sunil Narine,230558,"Narine to Forrest, 1 run gets well forward and drives towards cover",1st innings,41.3,run,224,1,224/4,"Narine to Forrest, 1 run",,gets well forward and drives towards cover,4
254,250,Michael Hussey,5939,Sunil Narine,230558,"Narine to MEK Hussey, no run Hussey goes across his stumps and tries to paddle sweep but the ball spins away and knocks him on the body",1st innings,41.4,no run,224,0,224/4,"Narine to MEK Hussey, no run",,Hussey goes across his stumps and tries to paddle sweep but the ball spins away and knocks him on the body,4
255,251,Michael Hussey,5939,Sunil Narine,230558,"Narine to MEK Hussey, 1 run drives towards cover for a single",1st innings,41.5,run,225,1,225/4,"Narine to MEK Hussey, 1 run",,drives towards cover for a single,4
256,252,Peter Forrest,232285,Sunil Narine,230558,"Narine to Forrest, 1 run goes back and punches it towards sweeper cover",1st innings,41.6,run,226,1,226/4,"Narine to Forrest, 1 run",,goes back and punches it towards sweeper cover,4
257,253,Peter Forrest,232285,Kemar Roach,230553,"Roach to Forrest, 1 run goes back at the crease and knocks it down to midwicket",1st innings,42.1,run,227,1,227/4,"Roach to Forrest, 1 run",,goes back at the crease and knocks it down to midwicket,4
258,254,Michael Hussey,5939,Kemar Roach,230553,"Roach to MEK Hussey, FOUR runs drops it short,  Hussey swivels at the crease and pulls it hard along the ground behind square, he picked a huge gap there",1st innings,42.2,four,231,4,231/4,"Roach to MEK Hussey, FOUR runs",,"drops it short,  Hussey swivels at the crease and pulls it hard along the ground behind square, he picked a huge gap there",4
259,255,Michael Hussey,5939,Kemar Roach,230553,"Roach to MEK Hussey, 1 run goes back at the crease and steers him down to third man",1st innings,42.3,run,232,1,232/4,"Roach to MEK Hussey, 1 run",,goes back at the crease and steers him down to third man,4
260,256,Peter Forrest,232285,Kemar Roach,230553,"Roach to Forrest, 1 run quick low full toss and he punches it down to long-on and that's his half-century",1st innings,42.4,run,233,1,233/4,"Roach to Forrest, 1 run",,quick low full toss and he punches it down to long-on and that's his half-century,4
261,256,Michael Hussey,5939,Kemar Roach,230553,"Roach to MEK Hussey, 1 wide drifts wide down the leg side and he tries to flick it away",1st innings,42.4,wide,234,1,234/4,"Roach to MEK Hussey, 1 wide",,drifts wide down the leg side and he tries to flick it away,4
262,257,Michael Hussey,5939,Kemar Roach,230553,"Roach to MEK Hussey, no run fires it full on the pads and he gets across and whips it towards midwicket",1st innings,42.5,no run,234,0,234/4,"Roach to MEK Hussey, no run",,fires it full on the pads and he gets across and whips it towards midwicket,4
263,258,Michael Hussey,5939,Kemar Roach,230553,"Roach to MEK Hussey, no run full and wide outside the off stump and he smashes it straight to cover, direct hit at the bowler's end but the batsman times his dive well",1st innings,42.6,no run,234,0,234/4,"Roach to MEK Hussey, no run",,"full and wide outside the off stump and he smashes it straight to cover, direct hit at the bowler's end but the batsman times his dive well",4
264,259,Peter Forrest,232285,Sunil Narine,230558,"Narine to Forrest, 1 run sharp turn for Narine, Forrest stays back and just about manages to knock it to the on side",1st innings,43.1,run,235,1,235/4,"Narine to Forrest, 1 run",,"sharp turn for Narine, Forrest stays back and just about manages to knock it to the on side",4
