,ball,batsman,batsman_id,bowler,bowler_id,commentary,innings,overs,playType,runs,runs_scored,score,shortText,speed,text,wickets
265,260,Michael Hussey,5939,Sunil Narine,230558,"Narine to MEK Hussey, 1 run steers it to point and takes a quick single",1st innings,43.2,run,236,1,236/4,"Narine to MEK Hussey, 1 run",,steers it to point and takes a quick single,4
266,261,Peter Forrest,232285,Sunil Narine,230558,"Narine to Forrest, 1 run gets to the pitch of the ball and strikes it to long-on",1st innings,43.3,run,237,1,237/4,"Narine to Forrest, 1 run",,gets to the pitch of the ball and strikes it to long-on,4
267,262,Michael Hussey,5939,Sunil Narine,230558,"Narine to MEK Hussey, 1 run on the pads and he works it to the on side",1st innings,43.4,run,238,1,238/4,"Narine to MEK Hussey, 1 run",,on the pads and he works it to the on side,4
268,263,Peter Forrest,232285,Sunil Narine,230558,"Narine to Forrest, 1 run goes back at the crease and pulls him down to midwicket",1st innings,43.5,run,239,1,239/4,"Narine to Forrest, 1 run",,goes back at the crease and pulls him down to midwicket,4
269,264,Michael Hussey,5939,Sunil Narine,230558,"Narine to MEK Hussey, 1 run gets forward and drives down to sweeper cover",1st innings,43.6,run,240,1,240/4,"Narine to MEK Hussey, 1 run",,gets forward and drives down to sweeper cover,4
270,265,Michael Hussey,5939,Andre Russell,276298,"Russell to MEK Hussey, 1 run he's not afraid of pitching it a bit short to Hussey, swivels and pulls in front of square straight to the sweeper",1st innings,44.1,run,241,1,241/4,"Russell to MEK Hussey, 1 run",,"he's not afraid of pitching it a bit short to Hussey, swivels and pulls in front of square straight to the sweeper",4
271,266,Peter Forrest,232285,Andre Russell,276298,"Russell to Forrest, OUT the bowling change works for West Indies, Russell bowls a length ball which rises, short enough to pull but Forrest ends up placing it straight to Roach at midwicket",1st innings,44.2,out,241,0,241/5,"Russell to Forrest, OUT",,"the bowling change works for West Indies, Russell bowls a length ball which rises, short enough to pull but Forrest ends up placing it straight to Roach at midwicket",5
272,267,David Hussey,5766,Andre Russell,276298,"Russell to DJ Hussey, OUT and Russell is on a hat-trick! He gets David Hussey with a snorter, short delivery which fizzes past the batsman and forces him to weave backwards, Hussey tries to upper cut him over third man but the ball hits the face of the bat and the keeper takes it easily",1st innings,44.3,out,241,0,241/6,"Russell to DJ Hussey, OUT",,"and Russell is on a hat-trick! He gets David Hussey with a snorter, short delivery which fizzes past the batsman and forces him to weave backwards, Hussey tries to upper cut him over third man but the ball hits the face of the bat and the keeper takes it easily",6
273,268,Matthew Wade,230193,Andre Russell,276298,"Russell to Wade, 1 run Wade nudges the hat-trick ball down to third man, there were two slips in place",1st innings,44.4,run,242,1,242/6,"Russell to Wade, 1 run",,"Wade nudges the hat-trick ball down to third man, there were two slips in place",6
274,269,Michael Hussey,5939,Andre Russell,276298,"Russell to MEK Hussey, 1 run short again and he swivels and pulls him to deep midwicket",1st innings,44.5,run,243,1,243/6,"Russell to MEK Hussey, 1 run",,short again and he swivels and pulls him to deep midwicket,6
275,270,Matthew Wade,230193,Andre Russell,276298,"Russell to Wade, 1 run another gentle nudge down to third man, he beats the diving slip fielder",1st innings,44.6,run,244,1,244/6,"Russell to Wade, 1 run",,"another gentle nudge down to third man, he beats the diving slip fielder",6
276,270,Matthew Wade,230193,Marlon Samuels,52983,"Samuels to Wade, 1 wide fires it wide down the leg side, fails to get bat on it",1st innings,45.0,wide,245,1,245/6,"Samuels to Wade, 1 wide",,"fires it wide down the leg side, fails to get bat on it",6
277,271,Matthew Wade,230193,Marlon Samuels,52983,"Samuels to Wade, no run gets forward and pushes it to the off side",1st innings,45.1,no run,245,0,245/6,"Samuels to Wade, no run",,gets forward and pushes it to the off side,6
278,272,Matthew Wade,230193,Marlon Samuels,52983,"Samuels to Wade, 1 run opens the face of the bat and steers it to third man",1st innings,45.2,run,246,1,246/6,"Samuels to Wade, 1 run",,opens the face of the bat and steers it to third man,6
279,273,Michael Hussey,5939,Marlon Samuels,52983,"Samuels to MEK Hussey, no run angles it across him and he punches it down to point",1st innings,45.3,no run,246,0,246/6,"Samuels to MEK Hussey, no run",,angles it across him and he punches it down to point,6
280,274,Michael Hussey,5939,Marlon Samuels,52983,"Samuels to MEK Hussey, 1 run fires it on the pads and he works it down to deep square leg",1st innings,45.4,run,247,1,247/6,"Samuels to MEK Hussey, 1 run",,fires it on the pads and he works it down to deep square leg,6
281,275,Matthew Wade,230193,Marlon Samuels,52983,"Samuels to Wade, 1 run inside edge to the on side and he scampers the single",1st innings,45.5,run,248,1,248/6,"Samuels to Wade, 1 run",,inside edge to the on side and he scampers the single,6
282,276,Michael Hussey,5939,Marlon Samuels,52983,"Samuels to MEK Hussey, no run another inside edge and Hussey nearly drags it on to his stumps",1st innings,45.6,no run,248,0,248/6,"Samuels to MEK Hussey, no run",,another inside edge and Hussey nearly drags it on to his stumps,6
283,277,Matthew Wade,230193,Andre Russell,276298,"Russell to Wade, no run bangs it in short and he weaves out of that fizzer, well bowled again",1st innings,46.1,no run,248,0,248/6,"Russell to Wade, no run",,"bangs it in short and he weaves out of that fizzer, well bowled again",6
284,278,Matthew Wade,230193,Andre Russell,276298,"Russell to Wade, 1 run steers it to the off side and he pinches a quick single, the fielder didn't gather it quickly enough",1st innings,46.2,run,249,1,249/6,"Russell to Wade, 1 run",,"steers it to the off side and he pinches a quick single, the fielder didn't gather it quickly enough",6
285,279,Michael Hussey,5939,Andre Russell,276298,"Russell to MEK Hussey, 1 run drops it with soft hands to the off side and Russell did well to run across the pitch and pick up, the throw was wide of the stumps though and beat the keeper",1st innings,46.3,run,250,1,250/6,"Russell to MEK Hussey, 1 run",,"drops it with soft hands to the off side and Russell did well to run across the pitch and pick up, the throw was wide of the stumps though and beat the keeper",6
286,280,Matthew Wade,230193,Andre Russell,276298,"Russell to Wade, 1 run Russell falls over as he delivers, the batsman works it to the on side",1st innings,46.4,run,251,1,251/6,"Russell to Wade, 1 run",,"Russell falls over as he delivers, the batsman works it to the on side",6
287,281,Michael Hussey,5939,Andre Russell,276298,"Russell to MEK Hussey, 1 run fires it on the pads and he works it down to square leg",1st innings,46.5,run,252,1,252/6,"Russell to MEK Hussey, 1 run",,fires it on the pads and he works it down to square leg,6
288,282,Matthew Wade,230193,Andre Russell,276298,"Russell to Wade, 1 run angles it across the left-hander and he works it down to third man, Australia need boundaries",1st innings,46.6,run,253,1,253/6,"Russell to Wade, 1 run",,"angles it across the left-hander and he works it down to third man, Australia need boundaries",6
289,283,Matthew Wade,230193,Marlon Samuels,52983,"Samuels to Wade, 1 run fullish on the pads and he works it to the on side",1st innings,47.1,run,254,1,254/6,"Samuels to Wade, 1 run",,fullish on the pads and he works it to the on side,6
290,284,Michael Hussey,5939,Marlon Samuels,52983,"Samuels to MEK Hussey, 2 runs full on the stumps and he works it wide of midwicket",1st innings,47.2,run,256,2,256/6,"Samuels to MEK Hussey, 2 runs",,full on the stumps and he works it wide of midwicket,6
291,285,Michael Hussey,5939,Marlon Samuels,52983,"Samuels to MEK Hussey, no run thats a good yorker, manages to dig it out",1st innings,47.3,no run,256,0,256/6,"Samuels to MEK Hussey, no run",,"thats a good yorker, manages to dig it out",6
292,286,Michael Hussey,5939,Marlon Samuels,52983,"Samuels to MEK Hussey, 1 run jams a full delivery down to long-on",1st innings,47.4,run,257,1,257/6,"Samuels to MEK Hussey, 1 run",,jams a full delivery down to long-on,6
293,287,Matthew Wade,230193,Marlon Samuels,52983,"Samuels to Wade, 1 run he muscles it down to long-on for a single",1st innings,47.5,run,258,1,258/6,"Samuels to Wade, 1 run",,he muscles it down to long-on for a single,6
294,288,Michael Hussey,5939,Marlon Samuels,52983,"Samuels to MEK Hussey, no run that's an appeal for a stumping,  Hussey was well forward and was beaten, manages to drag his foot back, the third umpire takes a look",1st innings,47.6,no run,258,0,258/6,"Samuels to MEK Hussey, no run",,"that's an appeal for a stumping,  Hussey was well forward and was beaten, manages to drag his foot back, the third umpire takes a look",6
295,289,Matthew Wade,230193,Andre Russell,276298,"Russell to Wade, FOUR runs makes room and Wade slashes and gets an outside edge that races to third man",1st innings,48.1,four,262,4,262/6,"Russell to Wade, FOUR runs",,makes room and Wade slashes and gets an outside edge that races to third man,6
296,290,Matthew Wade,230193,Andre Russell,276298,"Russell to Wade, SIX runs bangs it in short and Wade swivels and clubs it just over Pollard's reach at deep square leg, just enough elevation",1st innings,48.2,six,268,6,268/6,"Russell to Wade, SIX runs",,"bangs it in short and Wade swivels and clubs it just over Pollard's reach at deep square leg, just enough elevation",6
297,291,Matthew Wade,230193,Andre Russell,276298,"Russell to Wade, SIX runs add 6 more! Australia are finally pushing on here, Wade makes room to a shortish delivery and slaps it to the roof at the deep cover boundary, the ball's lost",1st innings,48.3,six,274,6,274/6,"Russell to Wade, SIX runs",,"add 6 more! Australia are finally pushing on here, Wade makes room to a shortish delivery and slaps it to the roof at the deep cover boundary, the ball's lost",6
298,292,Matthew Wade,230193,Andre Russell,276298,"Russell to Wade, 1 run swings and the ball hits his bat and then his helmet, they take a single",1st innings,48.4,run,275,1,275/6,"Russell to Wade, 1 run",,"swings and the ball hits his bat and then his helmet, they take a single",6
299,293,Michael Hussey,5939,Andre Russell,276298,"Russell to MEK Hussey, FOUR runs the nightmare gets worse for Russell, he sprays this one full and wide and Hussey makes enough room to thud that wide of deep cover",1st innings,48.5,four,279,4,279/6,"Russell to MEK Hussey, FOUR runs",,"the nightmare gets worse for Russell, he sprays this one full and wide and Hussey makes enough room to thud that wide of deep cover",6
300,294,Michael Hussey,5939,Andre Russell,276298,"Russell to MEK Hussey, OUT Russell has something to shout about after the hammering, change of pace, slower ball, Hussey makes room and tries to clear deep midwicket but Pollard's there",1st innings,48.6,out,279,0,279/7,"Russell to MEK Hussey, OUT",,"Russell has something to shout about after the hammering, change of pace, slower ball, Hussey makes room and tries to clear deep midwicket but Pollard's there",7
301,295,Clint McKay,6903,Kemar Roach,230553,"Roach to McKay, no run McKay makes room but Roach is too quick for him, he ends up pushing it softly back to the bowler",1st innings,49.1,no run,279,0,279/7,"Roach to McKay, no run",,"McKay makes room but Roach is too quick for him, he ends up pushing it softly back to the bowler",7
302,296,Clint McKay,6903,Kemar Roach,230553,"Roach to McKay, OUT McKay makes a lot of room to swing a short delivery over the on side, didn't time it well and the ball swirled to deep midwicket, Darren Bravo ran forward to take the catch",1st innings,49.2,out,279,0,279/8,"Roach to McKay, OUT",,"McKay makes a lot of room to swing a short delivery over the on side, didn't time it well and the ball swirled to deep midwicket, Darren Bravo ran forward to take the catch",8
303,297,Matthew Wade,230193,Kemar Roach,230553,"Roach to Wade, no run Wade tries to get cheeky and plays a reverse paddle but fails to make contact",1st innings,49.3,no run,279,0,279/8,"Roach to Wade, no run",,Wade tries to get cheeky and plays a reverse paddle but fails to make contact,8
304,298,Matthew Wade,230193,Kemar Roach,230553,"Roach to Wade, OUT Bravo takes another! This time just inches off the ground, Wade makes room and tries to slap it over deep cover, the ball dips to Bravo and he gets his fingers underneath it even as his hands were touching the turf",1st innings,49.4,out,279,0,279/9,"Roach to Wade, OUT",,"Bravo takes another! This time just inches off the ground, Wade makes room and tries to slap it over deep cover, the ball dips to Bravo and he gets his fingers underneath it even as his hands were touching the turf",9
305,299,Xavier Doherty,5017,Kemar Roach,230553,"Roach to Doherty, 1 run a run at last! Doherty swings and mistimes the pull to long-on",1st innings,49.5,run,280,1,280/9,"Roach to Doherty, 1 run",,a run at last! Doherty swings and mistimes the pull to long-on,9
306,300,Ben Hilfenhaus,5941,Kemar Roach,230553,"Roach to Hilfenhaus, 1 bye makes room and swings and they scramble a bye, Baugh's throw is to the bowler, Roach breaks the stumps but he's in",1st innings,49.6,bye,281,1,281/9,"Roach to Hilfenhaus, 1 bye",,"makes room and swings and they scramble a bye, Baugh's throw is to the bowler, Roach breaks the stumps but he's in",9
307,1,Johnson Charles,333066,Brett Lee,6278,"Lee to Charles, no run pitched up and swinging away, Charles barely acknowledges its passing through to the keeper",2nd innings,0.1,no run,0,0,0/0,"Lee to Charles, no run",,"pitched up and swinging away, Charles barely acknowledges its passing through to the keeper",0
308,2,Johnson Charles,333066,Brett Lee,6278,"Lee to Charles, no run again nice and full, outside off and moving away, same response from the batsman",2nd innings,0.2,no run,0,0,0/0,"Lee to Charles, no run",,"again nice and full, outside off and moving away, same response from the batsman",0
309,3,Johnson Charles,333066,Brett Lee,6278,"Lee to Charles, no run line and length, this one doesn't swing, Charles steps across and shoulder arms",2nd innings,0.3,no run,0,0,0/0,"Lee to Charles, no run",,"line and length, this one doesn't swing, Charles steps across and shoulder arms",0
310,4,Johnson Charles,333066,Brett Lee,6278,"Lee to Charles, no run length, on the stumps this time and Charles gets an edge on to his pads trying to whip to leg",2nd innings,0.4,no run,0,0,0/0,"Lee to Charles, no run",,"length, on the stumps this time and Charles gets an edge on to his pads trying to whip to leg",0
311,5,Johnson Charles,333066,Brett Lee,6278,"Lee to Charles, OUT got him! Charles plays an unconvincing swipe and loops a return catch off the splice of the bat. The ball was short and arrived quicker than he expected as he tried to hook. The St Lucian is out and West Indies' hopes take an early knock",2nd innings,0.5,out,0,0,0/1,"Lee to Charles, OUT",,got him! Charles plays an unconvincing swipe and loops a return catch off the splice of the bat. The ball was short and arrived quicker than he expected as he tried to hook. The St Lucian is out and West Indies' hopes take an early knock,1
312,6,Marlon Samuels,52983,Brett Lee,6278,"Lee to Samuels, no run length ball, defended on the back foot outside off",2nd innings,0.6,no run,0,0,0/1,"Lee to Samuels, no run",,"length ball, defended on the back foot outside off",1
313,6,Adrian Barath,274926,Ben Hilfenhaus,5941,"Hilfenhaus to Barath, 1 wide angled across and drifting down the leg side",2nd innings,1.0,wide,1,1,1/1,"Hilfenhaus to Barath, 1 wide",,angled across and drifting down the leg side,1
314,7,Adrian Barath,274926,Ben Hilfenhaus,5941,"Hilfenhaus to Barath, no run right line from Hilfenhaus, touch of swing away from the right-hander and Barath leaves",2nd innings,1.1,no run,1,0,1/1,"Hilfenhaus to Barath, no run",,"right line from Hilfenhaus, touch of swing away from the right-hander and Barath leaves",1
315,8,Adrian Barath,274926,Ben Hilfenhaus,5941,"Hilfenhaus to Barath, no run Hilfenhaus repeats the trick and the batsman leaves again",2nd innings,1.2,no run,1,0,1/1,"Hilfenhaus to Barath, no run",,Hilfenhaus repeats the trick and the batsman leaves again,1
316,9,Adrian Barath,274926,Ben Hilfenhaus,5941,"Hilfenhaus to Barath, no run length, outside off, played into the covers",2nd innings,1.3,no run,1,0,1/1,"Hilfenhaus to Barath, no run",,"length, outside off, played into the covers",1
317,10,Adrian Barath,274926,Ben Hilfenhaus,5941,"Hilfenhaus to Barath, FOUR runs straight - too straight - and Barath clumps a shot off his legs to the square boundary",2nd innings,1.4,four,5,4,5/1,"Hilfenhaus to Barath, FOUR runs",,straight - too straight - and Barath clumps a shot off his legs to the square boundary,1
318,11,Adrian Barath,274926,Ben Hilfenhaus,5941,"Hilfenhaus to Barath, no run defended on the back foot outside off",2nd innings,1.5,no run,5,0,5/1,"Hilfenhaus to Barath, no run",,defended on the back foot outside off,1
319,12,Adrian Barath,274926,Ben Hilfenhaus,5941,"Hilfenhaus to Barath, no run slightly back of a length, outside off, inside-edge off a cut pings past the wicket to short leg",2nd innings,1.6,no run,5,0,5/1,"Hilfenhaus to Barath, no run",,"slightly back of a length, outside off, inside-edge off a cut pings past the wicket to short leg",1
320,13,Marlon Samuels,52983,Brett Lee,6278,"Lee to Samuels, OUT Lee strikes again! Pitched on a good length, the ball rose sharply and brushed Samuel's glove on its way through. That was a devilish delivery and already West Indies are behind the eight ball! Samuels fails again, though he couldn't do much to get out the way of that one",2nd innings,2.1,out,5,0,5/2,"Lee to Samuels, OUT",,"Lee strikes again! Pitched on a good length, the ball rose sharply and brushed Samuel's glove on its way through. That was a devilish delivery and already West Indies are behind the eight ball! Samuels fails again, though he couldn't do much to get out the way of that one",2
321,14,Darren Bravo,277472,Brett Lee,6278,"Lee to DM Bravo, no run length, angled across the left-hander and defended",2nd innings,2.2,no run,5,0,5/2,"Lee to DM Bravo, no run",,"length, angled across the left-hander and defended",2
322,15,Darren Bravo,277472,Brett Lee,6278,"Lee to DM Bravo, no run straighter line, attacking the stumps, Bravo gets in line and defends solidly",2nd innings,2.3,no run,5,0,5/2,"Lee to DM Bravo, no run",,"straighter line, attacking the stumps, Bravo gets in line and defends solidly",2
323,16,Darren Bravo,277472,Brett Lee,6278,"Lee to DM Bravo, no run length, drifting across then seaming back a touch, left by the batsman",2nd innings,2.4,no run,5,0,5/2,"Lee to DM Bravo, no run",,"length, drifting across then seaming back a touch, left by the batsman",2
324,17,Darren Bravo,277472,Brett Lee,6278,"Lee to DM Bravo, no run quick and bouncy, almost wicket to wicket, defended on the back foot towards cover-point",2nd innings,2.5,no run,5,0,5/2,"Lee to DM Bravo, no run",,"quick and bouncy, almost wicket to wicket, defended on the back foot towards cover-point",2
325,18,Darren Bravo,277472,Brett Lee,6278,"Lee to DM Bravo, no run beauty of a delivery, slightly full, enticing Bravo forwards and then seaming away, blowing kisses at the outside edge of the bat on its way past",2nd innings,2.6,no run,5,0,5/2,"Lee to DM Bravo, no run",,"beauty of a delivery, slightly full, enticing Bravo forwards and then seaming away, blowing kisses at the outside edge of the bat on its way past",2
326,19,Adrian Barath,274926,Ben Hilfenhaus,5941,"Hilfenhaus to Barath, no run bumper from Hilfenhaus, slammed in short and directed at the batsman - Barath drops the hands and takes evasive action",2nd innings,3.1,no run,5,0,5/2,"Hilfenhaus to Barath, no run",,"bumper from Hilfenhaus, slammed in short and directed at the batsman - Barath drops the hands and takes evasive action",2
327,20,Adrian Barath,274926,Ben Hilfenhaus,5941,"Hilfenhaus to Barath, no run length, in the corridor outside off, defended",2nd innings,3.2,no run,5,0,5/2,"Hilfenhaus to Barath, no run",,"length, in the corridor outside off, defended",2
328,21,Adrian Barath,274926,Ben Hilfenhaus,5941,"Hilfenhaus to Barath, no run a shocker from Hilfenhaus, who delivers the ball about five yards down the pitch - it bounces several times then rolls off the cut strip but is called dead ball, rather than wide. Barath defends the follow-up",2nd innings,3.3,no run,5,0,5/2,"Hilfenhaus to Barath, no run",,"a shocker from Hilfenhaus, who delivers the ball about five yards down the pitch - it bounces several times then rolls off the cut strip but is called dead ball, rather than wide. Barath defends the follow-up",2
329,22,Adrian Barath,274926,Ben Hilfenhaus,5941,"Hilfenhaus to Barath, 1 run leg-stump line and clipped to deep backward square",2nd innings,3.4,run,6,1,6/2,"Hilfenhaus to Barath, 1 run",,leg-stump line and clipped to deep backward square,2
330,23,Darren Bravo,277472,Ben Hilfenhaus,5941,"Hilfenhaus to DM Bravo, no run angled across, defended out to point",2nd innings,3.5,no run,6,0,6/2,"Hilfenhaus to DM Bravo, no run",,"angled across, defended out to point",2
331,23,Darren Bravo,277472,Ben Hilfenhaus,5941,"Hilfenhaus to DM Bravo, 1 wide down the leg side, wrong line to the lefty",2nd innings,3.5,wide,7,1,7/2,"Hilfenhaus to DM Bravo, 1 wide",,"down the leg side, wrong line to the lefty",2
332,24,Darren Bravo,277472,Ben Hilfenhaus,5941,"Hilfenhaus to DM Bravo, no run length, touch of movement back in as Bravo leaves",2nd innings,3.6,no run,7,0,7/2,"Hilfenhaus to DM Bravo, no run",,"length, touch of movement back in as Bravo leaves",2
333,25,Adrian Barath,274926,Brett Lee,6278,"Lee to Barath, no run length, defended on the back foot outside off",2nd innings,4.1,no run,7,0,7/2,"Lee to Barath, no run",,"length, defended on the back foot outside off",2
334,26,Adrian Barath,274926,Brett Lee,6278,"Lee to Barath, no run on the stumps, nudged into the leg side",2nd innings,4.2,no run,7,0,7/2,"Lee to Barath, no run",,"on the stumps, nudged into the leg side",2
335,27,Adrian Barath,274926,Brett Lee,6278,"Lee to Barath, no run shorter ball, wide and swinging further - Barath attempts to uppercut but can't lay bat on it",2nd innings,4.3,no run,7,0,7/2,"Lee to Barath, no run",,"shorter ball, wide and swinging further - Barath attempts to uppercut but can't lay bat on it",2
336,28,Adrian Barath,274926,Brett Lee,6278,"Lee to Barath, no run straighter line of attack, goes back and across to defend towards mid-on",2nd innings,4.4,no run,7,0,7/2,"Lee to Barath, no run",,"straighter line of attack, goes back and across to defend towards mid-on",2
337,29,Adrian Barath,274926,Brett Lee,6278,"Lee to Barath, no run length ball, off-stump line and nipping back a little, edged into the leg side as Barath pushes forward",2nd innings,4.5,no run,7,0,7/2,"Lee to Barath, no run",,"length ball, off-stump line and nipping back a little, edged into the leg side as Barath pushes forward",2
338,30,Adrian Barath,274926,Brett Lee,6278,"Lee to Barath, no run back of a length, left as the ball swings away from outside off",2nd innings,4.6,no run,7,0,7/2,"Lee to Barath, no run",,"back of a length, left as the ball swings away from outside off",2
339,31,Darren Bravo,277472,Ben Hilfenhaus,5941,"Hilfenhaus to DM Bravo, no run on the legs, clipped square but straight to the fielder",2nd innings,5.1,no run,7,0,7/2,"Hilfenhaus to DM Bravo, no run",,"on the legs, clipped square but straight to the fielder",2
340,32,Darren Bravo,277472,Ben Hilfenhaus,5941,"Hilfenhaus to DM Bravo, no run back of a length, defended on the back foot in front of the stumps",2nd innings,5.2,no run,7,0,7/2,"Hilfenhaus to DM Bravo, no run",,"back of a length, defended on the back foot in front of the stumps",2
341,33,Darren Bravo,277472,Ben Hilfenhaus,5941,"Hilfenhaus to DM Bravo, no run length ball, angled across outside off and pushed to cover",2nd innings,5.3,no run,7,0,7/2,"Hilfenhaus to DM Bravo, no run",,"length ball, angled across outside off and pushed to cover",2
342,34,Darren Bravo,277472,Ben Hilfenhaus,5941,"Hilfenhaus to DM Bravo, no run drops short, targeting the batsman's ribs, jabbed short on the leg side",2nd innings,5.4,no run,7,0,7/2,"Hilfenhaus to DM Bravo, no run",,"drops short, targeting the batsman's ribs, jabbed short on the leg side",2
343,35,Darren Bravo,277472,Ben Hilfenhaus,5941,"Hilfenhaus to DM Bravo, no run teasing length, drifting across Bravo, who stands back and swishes in the wind",2nd innings,5.5,no run,7,0,7/2,"Hilfenhaus to DM Bravo, no run",,"teasing length, drifting across Bravo, who stands back and swishes in the wind",2
344,36,Darren Bravo,277472,Ben Hilfenhaus,5941,"Hilfenhaus to DM Bravo, no run off-stump line, driven to cover",2nd innings,5.6,no run,7,0,7/2,"Hilfenhaus to DM Bravo, no run",,"off-stump line, driven to cover",2
345,37,Adrian Barath,274926,Brett Lee,6278,"Lee to Barath, no run pacy, line and length outside off, Barath hops back and dabs to point",2nd innings,6.1,no run,7,0,7/2,"Lee to Barath, no run",,"pacy, line and length outside off, Barath hops back and dabs to point",2
346,38,Adrian Barath,274926,Brett Lee,6278,"Lee to Barath, no run length delivery, on off stump and Barath shows it the full face of the bat in defence",2nd innings,6.2,no run,7,0,7/2,"Lee to Barath, no run",,"length delivery, on off stump and Barath shows it the full face of the bat in defence",2
