,ball,batsman,batsman_id,bowler,bowler_id,commentary,innings,overs,playType,runs,runs_scored,score,shortText,speed,text,wickets
447,153,Paul Stirling,303427,Shoaib Malik,42657,"Shoaib Malik to Stirling, 1 run flicked to deep midwicket",2nd innings,25.3,run,126,1,126/1,"Shoaib Malik to Stirling, 1 run",,flicked to deep midwicket,1
448,154,Ed Joyce,24249,Shoaib Malik,42657,"Shoaib Malik to Joyce, 1 run turned through midwicket once again",2nd innings,25.4,run,127,1,127/1,"Shoaib Malik to Joyce, 1 run",,turned through midwicket once again,1
449,155,Paul Stirling,303427,Shoaib Malik,42657,"Shoaib Malik to Stirling, 1 run ",2nd innings,25.5,run,128,1,128/1,"Shoaib Malik to Stirling, 1 run",,,1
450,156,Ed Joyce,24249,Shoaib Malik,42657,"Shoaib Malik to Joyce, no run just flicked short of the bowler in the air",2nd innings,26.0,no run,128,0,128/1,"Shoaib Malik to Joyce, no run",,just flicked short of the bowler in the air,1
451,157,Paul Stirling,303427,Saeed Ajmal,42699,"Saeed Ajmal to Stirling, SIX runs massive slog sweep over the deep midwicket boundary",2nd innings,26.1,six,134,6,134/1,"Saeed Ajmal to Stirling, SIX runs",,massive slog sweep over the deep midwicket boundary,1
452,158,Paul Stirling,303427,Saeed Ajmal,42699,"Saeed Ajmal to Stirling, 1 run flicked through midwicket for a single",2nd innings,26.2,run,135,1,135/1,"Saeed Ajmal to Stirling, 1 run",,flicked through midwicket for a single,1
453,159,Ed Joyce,24249,Saeed Ajmal,42699,"Saeed Ajmal to Joyce, no run finds the man at midwicket this time",2nd innings,26.3,no run,135,0,135/1,"Saeed Ajmal to Joyce, no run",,finds the man at midwicket this time,1
454,160,Ed Joyce,24249,Saeed Ajmal,42699,"Saeed Ajmal to Joyce, no run ",2nd innings,26.4,no run,135,0,135/1,"Saeed Ajmal to Joyce, no run",,,1
455,161,Ed Joyce,24249,Saeed Ajmal,42699,"Saeed Ajmal to Joyce, 1 run pushed down to long on",2nd innings,26.5,run,136,1,136/1,"Saeed Ajmal to Joyce, 1 run",,pushed down to long on,1
456,162,Paul Stirling,303427,Saeed Ajmal,42699,"Saeed Ajmal to Stirling, 1 run another single goes down to long on",2nd innings,27.0,run,137,1,137/1,"Saeed Ajmal to Stirling, 1 run",,another single goes down to long on,1
457,163,Paul Stirling,303427,Shoaib Malik,42657,"Shoaib Malik to Stirling, no run pushed back to the bowler",2nd innings,27.1,no run,137,0,137/1,"Shoaib Malik to Stirling, no run",,pushed back to the bowler,1
458,163,Paul Stirling,303427,Shoaib Malik,42657,"Shoaib Malik to Stirling, 1 wide down the leg side",2nd innings,27.1,wide,138,1,138/1,"Shoaib Malik to Stirling, 1 wide",,down the leg side,1
459,164,Paul Stirling,303427,Shoaib Malik,42657,"Shoaib Malik to Stirling, no run edged but drops safely",2nd innings,27.2,no run,138,0,138/1,"Shoaib Malik to Stirling, no run",,edged but drops safely,1
460,165,Paul Stirling,303427,Shoaib Malik,42657,"Shoaib Malik to Stirling, 2 runs swept fine and just pulled in before the rope",2nd innings,27.3,run,140,2,140/1,"Shoaib Malik to Stirling, 2 runs",,swept fine and just pulled in before the rope,1
461,166,Paul Stirling,303427,Shoaib Malik,42657,"Shoaib Malik to Stirling, no run ",2nd innings,27.4,no run,140,0,140/1,"Shoaib Malik to Stirling, no run",,,1
462,167,Paul Stirling,303427,Shoaib Malik,42657,"Shoaib Malik to Stirling, 1 run driven firmly down to long on",2nd innings,27.5,run,141,1,141/1,"Shoaib Malik to Stirling, 1 run",,driven firmly down to long on,1
463,168,Ed Joyce,24249,Shoaib Malik,42657,"Shoaib Malik to Joyce, 1 run nice paddle shot but it only goes for a single",2nd innings,28.0,run,142,1,142/1,"Shoaib Malik to Joyce, 1 run",,nice paddle shot but it only goes for a single,1
464,169,Ed Joyce,24249,Saeed Ajmal,42699,"Saeed Ajmal to Joyce, no run ",2nd innings,28.1,no run,142,0,142/1,"Saeed Ajmal to Joyce, no run",,,1
465,170,Ed Joyce,24249,Saeed Ajmal,42699,"Saeed Ajmal to Joyce, no run played to man at midwicket",2nd innings,28.2,no run,142,0,142/1,"Saeed Ajmal to Joyce, no run",,played to man at midwicket,1
466,171,Ed Joyce,24249,Saeed Ajmal,42699,"Saeed Ajmal to Joyce, no run comes down the pitch and plays it back to the bowler",2nd innings,28.3,no run,142,0,142/1,"Saeed Ajmal to Joyce, no run",,comes down the pitch and plays it back to the bowler,1
467,172,Ed Joyce,24249,Saeed Ajmal,42699,"Saeed Ajmal to Joyce, no run squirts into the off side",2nd innings,28.4,no run,142,0,142/1,"Saeed Ajmal to Joyce, no run",,squirts into the off side,1
468,173,Ed Joyce,24249,Saeed Ajmal,42699,"Saeed Ajmal to Joyce, no run just passes the outside edge",2nd innings,28.5,no run,142,0,142/1,"Saeed Ajmal to Joyce, no run",,just passes the outside edge,1
469,174,Ed Joyce,24249,Saeed Ajmal,42699,"Saeed Ajmal to Joyce, 1 run hacked away through the covers",2nd innings,29.0,run,143,1,143/1,"Saeed Ajmal to Joyce, 1 run",,hacked away through the covers,1
470,175,Ed Joyce,24249,Shoaib Malik,42657,"Shoaib Malik to Joyce, 1 run played through midwicket",2nd innings,29.1,run,144,1,144/1,"Shoaib Malik to Joyce, 1 run",,played through midwicket,1
471,176,Paul Stirling,303427,Shoaib Malik,42657,"Shoaib Malik to Stirling, no run ",2nd innings,29.2,no run,144,0,144/1,"Shoaib Malik to Stirling, no run",,,1
472,177,Paul Stirling,303427,Shoaib Malik,42657,"Shoaib Malik to Stirling, no run misses the sweep and there's a big appeal but nothing is given",2nd innings,29.3,no run,144,0,144/1,"Shoaib Malik to Stirling, no run",,misses the sweep and there's a big appeal but nothing is given,1
473,178,Paul Stirling,303427,Shoaib Malik,42657,"Shoaib Malik to Stirling, 1 run ",2nd innings,29.4,run,145,1,145/1,"Shoaib Malik to Stirling, 1 run",,,1
474,179,Ed Joyce,24249,Shoaib Malik,42657,"Shoaib Malik to Joyce, FOUR runs comes down the wicket a touch and hammers it through the covers for a much need boundary",2nd innings,29.5,four,149,4,149/1,"Shoaib Malik to Joyce, FOUR runs",,comes down the wicket a touch and hammers it through the covers for a much need boundary,1
475,180,Ed Joyce,24249,Shoaib Malik,42657,"Shoaib Malik to Joyce, 1 run driven down to long on",2nd innings,30.0,run,150,1,150/1,"Shoaib Malik to Joyce, 1 run",,driven down to long on,1
476,181,Ed Joyce,24249,Mohammad Hafeez,41434,"Mohammad Hafeez to Joyce, no run strikes him on the pads but there's only a half hearted appeal",2nd innings,30.1,no run,150,0,150/1,"Mohammad Hafeez to Joyce, no run",,strikes him on the pads but there's only a half hearted appeal,1
477,182,Ed Joyce,24249,Mohammad Hafeez,41434,"Mohammad Hafeez to Joyce, no run mistimed drive to point",2nd innings,30.2,no run,150,0,150/1,"Mohammad Hafeez to Joyce, no run",,mistimed drive to point,1
478,183,Ed Joyce,24249,Mohammad Hafeez,41434,"Mohammad Hafeez to Joyce, 1 run flicked out to deep midwicket for a single",2nd innings,30.3,run,151,1,151/1,"Mohammad Hafeez to Joyce, 1 run",,flicked out to deep midwicket for a single,1
479,184,Paul Stirling,303427,Mohammad Hafeez,41434,"Mohammad Hafeez to Stirling, 1 run turned through the leg side once again",2nd innings,30.4,run,152,1,152/1,"Mohammad Hafeez to Stirling, 1 run",,turned through the leg side once again,1
480,185,Ed Joyce,24249,Mohammad Hafeez,41434,"Mohammad Hafeez to Joyce, no run can't get him away and it squirts out to point",2nd innings,30.5,no run,152,0,152/1,"Mohammad Hafeez to Joyce, no run",,can't get him away and it squirts out to point,1
481,186,Ed Joyce,24249,Mohammad Hafeez,41434,"Mohammad Hafeez to Joyce, 1 run very diffilcult chance at midwicket which he can only get his fingertips to",2nd innings,31.0,run,153,1,153/1,"Mohammad Hafeez to Joyce, 1 run",,very diffilcult chance at midwicket which he can only get his fingertips to,1
482,187,Ed Joyce,24249,Mohammad Irfan,429981,"Mohammad Irfan to Joyce, 1 run single scampered in the off side, good running",2nd innings,31.1,run,154,1,154/1,"Mohammad Irfan to Joyce, 1 run",,"single scampered in the off side, good running",1
483,188,Paul Stirling,303427,Mohammad Irfan,429981,"Mohammad Irfan to Stirling, 2 runs edged down to third man",2nd innings,31.2,run,156,2,156/1,"Mohammad Irfan to Stirling, 2 runs",,edged down to third man,1
484,189,Paul Stirling,303427,Mohammad Irfan,429981,"Mohammad Irfan to Stirling, 1 run hacked down into the off side and it's another quick single",2nd innings,31.3,run,157,1,157/1,"Mohammad Irfan to Stirling, 1 run",,hacked down into the off side and it's another quick single,1
485,190,Ed Joyce,24249,Mohammad Irfan,429981,"Mohammad Irfan to Joyce, no run play and a miss outside the off stump",2nd innings,31.4,no run,157,0,157/1,"Mohammad Irfan to Joyce, no run",,play and a miss outside the off stump,1
486,191,Ed Joyce,24249,Mohammad Irfan,429981,"Mohammad Irfan to Joyce, no run full delivery and it's dug out into the covers",2nd innings,31.5,no run,157,0,157/1,"Mohammad Irfan to Joyce, no run",,full delivery and it's dug out into the covers,1
487,192,Ed Joyce,24249,Mohammad Irfan,429981,"Mohammad Irfan to Joyce, no run good stop at backward point",2nd innings,32.0,no run,157,0,157/1,"Mohammad Irfan to Joyce, no run",,good stop at backward point,1
488,193,Paul Stirling,303427,Mohammad Hafeez,41434,"Mohammad Hafeez to Stirling, no run pushed into the leg side",2nd innings,32.1,no run,157,0,157/1,"Mohammad Hafeez to Stirling, no run",,pushed into the leg side,1
489,194,Paul Stirling,303427,Mohammad Hafeez,41434,"Mohammad Hafeez to Stirling, no run driven back to the bowler",2nd innings,32.2,no run,157,0,157/1,"Mohammad Hafeez to Stirling, no run",,driven back to the bowler,1
490,195,Paul Stirling,303427,Mohammad Hafeez,41434,"Mohammad Hafeez to Stirling, 1 run a single through midwicket",2nd innings,32.3,run,158,1,158/1,"Mohammad Hafeez to Stirling, 1 run",,a single through midwicket,1
491,196,Ed Joyce,24249,Mohammad Hafeez,41434,"Mohammad Hafeez to Joyce, no run defended into the off side",2nd innings,32.4,no run,158,0,158/1,"Mohammad Hafeez to Joyce, no run",,defended into the off side,1
492,197,Ed Joyce,24249,Mohammad Hafeez,41434,"Mohammad Hafeez to Joyce, OUT lovely delivery from Hafeez which deceives the batsman who plays around it and he's bowled",2nd innings,32.5,out,158,0,158/2,"Mohammad Hafeez to Joyce, OUT",,lovely delivery from Hafeez which deceives the batsman who plays around it and he's bowled,2
493,198,Kevin O'Brien,24605,Mohammad Hafeez,41434,"Mohammad Hafeez to KJ O'Brien, no run well fielded by the bowler",2nd innings,33.0,no run,158,0,158/2,"Mohammad Hafeez to KJ O'Brien, no run",,well fielded by the bowler,2
494,199,Paul Stirling,303427,Mohammad Irfan,429981,"Mohammad Irfan to Stirling, 1 run guided down to third man",2nd innings,33.1,run,159,1,159/2,"Mohammad Irfan to Stirling, 1 run",,guided down to third man,2
495,200,Kevin O'Brien,24605,Mohammad Irfan,429981,"Mohammad Irfan to KJ O'Brien, 2 runs ",2nd innings,33.2,run,161,2,161/2,"Mohammad Irfan to KJ O'Brien, 2 runs",,,2
496,201,Kevin O'Brien,24605,Mohammad Irfan,429981,"Mohammad Irfan to KJ O'Brien, 1 leg bye almost a run out but Irfan can't get to the stumps in time",2nd innings,33.3,leg bye,162,1,162/2,"Mohammad Irfan to KJ O'Brien, 1 leg bye",,almost a run out but Irfan can't get to the stumps in time,2
497,202,Paul Stirling,303427,Mohammad Irfan,429981,"Mohammad Irfan to Stirling, 1 run cut away through the off side and that's his fifth ODI hundred and his second against Pakistan",2nd innings,33.4,run,163,1,163/2,"Mohammad Irfan to Stirling, 1 run",,cut away through the off side and that's his fifth ODI hundred and his second against Pakistan,2
498,203,Kevin O'Brien,24605,Mohammad Irfan,429981,"Mohammad Irfan to KJ O'Brien, no run ",2nd innings,33.5,no run,163,0,163/2,"Mohammad Irfan to KJ O'Brien, no run",,,2
499,203,Kevin O'Brien,24605,Mohammad Irfan,429981,"Mohammad Irfan to KJ O'Brien, 1 wide down the leg side",2nd innings,33.5,wide,164,1,164/2,"Mohammad Irfan to KJ O'Brien, 1 wide",,down the leg side,2
500,204,Kevin O'Brien,24605,Mohammad Irfan,429981,"Mohammad Irfan to KJ O'Brien, 1 run flicked through midwicket",2nd innings,34.0,run,165,1,165/2,"Mohammad Irfan to KJ O'Brien, 1 run",,flicked through midwicket,2
501,205,Kevin O'Brien,24605,Mohammad Hafeez,41434,"Mohammad Hafeez to KJ O'Brien, 1 run flicked behind square leg",2nd innings,34.1,run,166,1,166/2,"Mohammad Hafeez to KJ O'Brien, 1 run",,flicked behind square leg,2
502,206,Paul Stirling,303427,Mohammad Hafeez,41434,"Mohammad Hafeez to Stirling, 1 run swept backward of square for a single",2nd innings,34.2,run,167,1,167/2,"Mohammad Hafeez to Stirling, 1 run",,swept backward of square for a single,2
503,207,Kevin O'Brien,24605,Mohammad Hafeez,41434,"Mohammad Hafeez to KJ O'Brien, 1 run similar shot from O'Brien for another single",2nd innings,34.3,run,168,1,168/2,"Mohammad Hafeez to KJ O'Brien, 1 run",,similar shot from O'Brien for another single,2
504,208,Paul Stirling,303427,Mohammad Hafeez,41434,"Mohammad Hafeez to Stirling, 1 run cracked hard at point",2nd innings,34.4,run,169,1,169/2,"Mohammad Hafeez to Stirling, 1 run",,cracked hard at point,2
505,209,Kevin O'Brien,24605,Mohammad Hafeez,41434,"Mohammad Hafeez to KJ O'Brien, 1 run ",2nd innings,34.5,run,170,1,170/2,"Mohammad Hafeez to KJ O'Brien, 1 run",,,2
506,210,Paul Stirling,303427,Mohammad Hafeez,41434,"Mohammad Hafeez to Stirling, 1 run swept through square for another single",2nd innings,35.0,run,171,1,171/2,"Mohammad Hafeez to Stirling, 1 run",,swept through square for another single,2
507,211,Paul Stirling,303427,Mohammad Irfan,429981,"Mohammad Irfan to Stirling, no run tries a big shot but can't connect and it goes through to the keeper",2nd innings,35.1,no run,171,0,171/2,"Mohammad Irfan to Stirling, no run",,tries a big shot but can't connect and it goes through to the keeper,2
508,212,Paul Stirling,303427,Mohammad Irfan,429981,"Mohammad Irfan to Stirling, OUT tries another big heave this time he only gets a top edge and he's caught easily in the off side",2nd innings,35.2,out,171,0,171/3,"Mohammad Irfan to Stirling, OUT",,tries another big heave this time he only gets a top edge and he's caught easily in the off side,3
509,213,Kevin O'Brien,24605,Mohammad Irfan,429981,"Mohammad Irfan to KJ O'Brien, FOUR runs flicked fine for a boundary",2nd innings,35.3,four,175,4,175/3,"Mohammad Irfan to KJ O'Brien, FOUR runs",,flicked fine for a boundary,3
510,214,Kevin O'Brien,24605,Mohammad Irfan,429981,"Mohammad Irfan to KJ O'Brien, 1 run ",2nd innings,35.4,run,176,1,176/3,"Mohammad Irfan to KJ O'Brien, 1 run",,,3
511,215,Gary Wilson,24609,Mohammad Irfan,429981,"Mohammad Irfan to Wilson, no run fullish quick ball and it strikes Wilson in a place you really don't want to be hit",2nd innings,35.5,no run,176,0,176/3,"Mohammad Irfan to Wilson, no run",,fullish quick ball and it strikes Wilson in a place you really don't want to be hit,3
512,216,Gary Wilson,24609,Mohammad Irfan,429981,"Mohammad Irfan to Wilson, 1 run quick single taken to mid off",2nd innings,36.0,run,177,1,177/3,"Mohammad Irfan to Wilson, 1 run",,quick single taken to mid off,3
513,217,Gary Wilson,24609,Saeed Ajmal,42699,"Saeed Ajmal to Wilson, no run tries the reverse sweep and it hits the keeper on the pads",2nd innings,36.1,no run,177,0,177/3,"Saeed Ajmal to Wilson, no run",,tries the reverse sweep and it hits the keeper on the pads,3
514,218,Gary Wilson,24609,Saeed Ajmal,42699,"Saeed Ajmal to Wilson, 1 run turned behind square for a single",2nd innings,36.2,run,178,1,178/3,"Saeed Ajmal to Wilson, 1 run",,turned behind square for a single,3
515,219,Kevin O'Brien,24605,Saeed Ajmal,42699,"Saeed Ajmal to KJ O'Brien, 1 run well stopped at point",2nd innings,36.3,run,179,1,179/3,"Saeed Ajmal to KJ O'Brien, 1 run",,well stopped at point,3
516,220,Gary Wilson,24609,Saeed Ajmal,42699,"Saeed Ajmal to Wilson, 1 run played through midwicket",2nd innings,36.4,run,180,1,180/3,"Saeed Ajmal to Wilson, 1 run",,played through midwicket,3
517,221,Kevin O'Brien,24605,Saeed Ajmal,42699,"Saeed Ajmal to KJ O'Brien, SIX runs huge hit over deep midwicket",2nd innings,36.5,six,186,6,186/3,"Saeed Ajmal to KJ O'Brien, SIX runs",,huge hit over deep midwicket,3
518,222,Kevin O'Brien,24605,Saeed Ajmal,42699,"Saeed Ajmal to KJ O'Brien, 1 run quick single taken in the off side",2nd innings,37.0,run,187,1,187/3,"Saeed Ajmal to KJ O'Brien, 1 run",,quick single taken in the off side,3
519,223,Kevin O'Brien,24605,Mohammad Irfan,429981,"Mohammad Irfan to KJ O'Brien, FOUR runs tried to smack over long off and Malik <b> drops </b> it at the boundary",2nd innings,37.1,four,191,4,191/3,"Mohammad Irfan to KJ O'Brien, FOUR runs",,tried to smack over long off and Malik <b> drops </b> it at the boundary,3
520,224,Kevin O'Brien,24605,Mohammad Irfan,429981,"Mohammad Irfan to KJ O'Brien, FOUR runs another big drive to deep midwicket",2nd innings,37.2,four,195,4,195/3,"Mohammad Irfan to KJ O'Brien, FOUR runs",,another big drive to deep midwicket,3
521,225,Kevin O'Brien,24605,Mohammad Irfan,429981,"Mohammad Irfan to KJ O'Brien, 1 leg bye ",2nd innings,37.3,leg bye,196,1,196/3,"Mohammad Irfan to KJ O'Brien, 1 leg bye",,,3
522,226,Gary Wilson,24609,Mohammad Irfan,429981,"Mohammad Irfan to Wilson, no run swing and a miss",2nd innings,37.4,no run,196,0,196/3,"Mohammad Irfan to Wilson, no run",,swing and a miss,3
523,227,Gary Wilson,24609,Mohammad Irfan,429981,"Mohammad Irfan to Wilson, no run ",2nd innings,37.5,no run,196,0,196/3,"Mohammad Irfan to Wilson, no run",,,3
524,228,Gary Wilson,24609,Mohammad Irfan,429981,"Mohammad Irfan to Wilson, FOUR runs hacked away didn't quite get all of it but the man coming round from third man couldn't stop it at the rope",2nd innings,38.0,four,200,4,200/3,"Mohammad Irfan to Wilson, FOUR runs",,hacked away didn't quite get all of it but the man coming round from third man couldn't stop it at the rope,3
525,229,Kevin O'Brien,24605,Saeed Ajmal,42699,"Saeed Ajmal to KJ O'Brien, 1 run flicked to deep backward square leg",2nd innings,38.1,run,201,1,201/3,"Saeed Ajmal to KJ O'Brien, 1 run",,flicked to deep backward square leg,3
526,230,Gary Wilson,24609,Saeed Ajmal,42699,"Saeed Ajmal to Wilson, 1 leg bye misses the sweep and hits the pads, keeper appeals",2nd innings,38.2,leg bye,202,1,202/3,"Saeed Ajmal to Wilson, 1 leg bye",,"misses the sweep and hits the pads, keeper appeals",3
527,231,Kevin O'Brien,24605,Saeed Ajmal,42699,"Saeed Ajmal to KJ O'Brien, FOUR runs smashed through extra cover for another boundary",2nd innings,38.3,four,206,4,206/3,"Saeed Ajmal to KJ O'Brien, FOUR runs",,smashed through extra cover for another boundary,3
528,232,Kevin O'Brien,24605,Saeed Ajmal,42699,"Saeed Ajmal to KJ O'Brien, 1 run just pushed into the leg side and they run a quick single",2nd innings,38.4,run,207,1,207/3,"Saeed Ajmal to KJ O'Brien, 1 run",,just pushed into the leg side and they run a quick single,3
529,233,Gary Wilson,24609,Saeed Ajmal,42699,"Saeed Ajmal to Wilson, no run can't get that one away and it squirts into the off side",2nd innings,38.5,no run,207,0,207/3,"Saeed Ajmal to Wilson, no run",,can't get that one away and it squirts into the off side,3
530,234,Gary Wilson,24609,Saeed Ajmal,42699,"Saeed Ajmal to Wilson, no run misses with the sweep, bigger appeal this time but the umpire is unmoved again",2nd innings,39.0,no run,207,0,207/3,"Saeed Ajmal to Wilson, no run",,"misses with the sweep, bigger appeal this time but the umpire is unmoved again",3
531,235,Kevin O'Brien,24605,Junaid Khan,259551,"Junaid Khan to KJ O'Brien, FOUR runs hit in the air towards Irfan who doesn't pick it up and it goes over his head and on to the boundary!",2nd innings,39.1,four,211,4,211/3,"Junaid Khan to KJ O'Brien, FOUR runs",,hit in the air towards Irfan who doesn't pick it up and it goes over his head and on to the boundary!,3
532,236,Kevin O'Brien,24605,Junaid Khan,259551,"Junaid Khan to KJ O'Brien, no run finds the fielder at extra cover",2nd innings,39.2,no run,211,0,211/3,"Junaid Khan to KJ O'Brien, no run",,finds the fielder at extra cover,3
533,237,Kevin O'Brien,24605,Junaid Khan,259551,"Junaid Khan to KJ O'Brien, FOUR runs smashes a straight drive and it's one bounce and to the rope",2nd innings,39.3,four,215,4,215/3,"Junaid Khan to KJ O'Brien, FOUR runs",,smashes a straight drive and it's one bounce and to the rope,3
534,238,Kevin O'Brien,24605,Junaid Khan,259551,"Junaid Khan to KJ O'Brien, 1 run short and it's hooked away, missed out a big one there you feel",2nd innings,39.4,run,216,1,216/3,"Junaid Khan to KJ O'Brien, 1 run",,"short and it's hooked away, missed out a big one there you feel",3
535,239,Gary Wilson,24609,Junaid Khan,259551,"Junaid Khan to Wilson, 1 run just punched into the cover region and it's an easy single",2nd innings,39.5,run,217,1,217/3,"Junaid Khan to Wilson, 1 run",,just punched into the cover region and it's an easy single,3
536,240,Kevin O'Brien,24605,Junaid Khan,259551,"Junaid Khan to KJ O'Brien, 1 run turned towards deep backward square leg",2nd innings,40.0,run,218,1,218/3,"Junaid Khan to KJ O'Brien, 1 run",,turned towards deep backward square leg,3
537,241,Kevin O'Brien,24605,Saeed Ajmal,42699,"Saeed Ajmal to KJ O'Brien, no run pushed to point ",2nd innings,40.1,no run,218,0,218/3,"Saeed Ajmal to KJ O'Brien, no run",,pushed to point ,3
538,242,Kevin O'Brien,24605,Saeed Ajmal,42699,"Saeed Ajmal to KJ O'Brien, 1 run ",2nd innings,40.2,run,219,1,219/3,"Saeed Ajmal to KJ O'Brien, 1 run",,,3
539,243,Gary Wilson,24609,Saeed Ajmal,42699,"Saeed Ajmal to Wilson, 1 run reverse sweep but the man is up and there's only a single",2nd innings,40.3,run,220,1,220/3,"Saeed Ajmal to Wilson, 1 run",,reverse sweep but the man is up and there's only a single,3
540,244,Kevin O'Brien,24605,Saeed Ajmal,42699,"Saeed Ajmal to KJ O'Brien, 2 runs turned very fine",2nd innings,40.4,run,222,2,222/3,"Saeed Ajmal to KJ O'Brien, 2 runs",,turned very fine,3
541,245,Kevin O'Brien,24605,Saeed Ajmal,42699,"Saeed Ajmal to KJ O'Brien, FOUR runs fantastic drive through extra cover",2nd innings,40.5,four,226,4,226/3,"Saeed Ajmal to KJ O'Brien, FOUR runs",,fantastic drive through extra cover,3
542,246,Kevin O'Brien,24605,Saeed Ajmal,42699,"Saeed Ajmal to KJ O'Brien, 1 run turned to the short fine leg",2nd innings,41.0,run,227,1,227/3,"Saeed Ajmal to KJ O'Brien, 1 run",,turned to the short fine leg,3
543,247,Kevin O'Brien,24605,Junaid Khan,259551,"Junaid Khan to KJ O'Brien, 1 run flicked through midwicket",2nd innings,41.1,run,228,1,228/3,"Junaid Khan to KJ O'Brien, 1 run",,flicked through midwicket,3
544,248,Gary Wilson,24609,Junaid Khan,259551,"Junaid Khan to Wilson, no run tries a paddle shot without success",2nd innings,41.2,no run,228,0,228/3,"Junaid Khan to Wilson, no run",,tries a paddle shot without success,3
545,249,Gary Wilson,24609,Junaid Khan,259551,"Junaid Khan to Wilson, 2 runs hooked and a misfield allows the second",2nd innings,41.3,run,230,2,230/3,"Junaid Khan to Wilson, 2 runs",,hooked and a misfield allows the second,3
546,250,Gary Wilson,24609,Junaid Khan,259551,"Junaid Khan to Wilson, OUT comes down the pitch slightly but doesn't get near it and his middle stump is hit",2nd innings,41.4,out,230,0,230/4,"Junaid Khan to Wilson, OUT",,comes down the pitch slightly but doesn't get near it and his middle stump is hit,4
547,251,Niall O'Brien,24289,Junaid Khan,259551,"Junaid Khan to NJ O'Brien, no run just passes the outside edge",2nd innings,41.5,no run,230,0,230/4,"Junaid Khan to NJ O'Brien, no run",,just passes the outside edge,4
548,252,Niall O'Brien,24289,Junaid Khan,259551,"Junaid Khan to NJ O'Brien, 2 runs flicked to deep midwicket for a couple",2nd innings,42.0,run,232,2,232/4,"Junaid Khan to NJ O'Brien, 2 runs",,flicked to deep midwicket for a couple,4
549,253,Kevin O'Brien,24605,Saeed Ajmal,42699,"Saeed Ajmal to KJ O'Brien, 1 run played through the leg side",2nd innings,42.1,run,233,1,233/4,"Saeed Ajmal to KJ O'Brien, 1 run",,played through the leg side,4
550,254,Niall O'Brien,24289,Saeed Ajmal,42699,"Saeed Ajmal to NJ O'Brien, 1 run swept to the man in the deep on the leg side",2nd innings,42.2,run,234,1,234/4,"Saeed Ajmal to NJ O'Brien, 1 run",,swept to the man in the deep on the leg side,4
551,255,Kevin O'Brien,24605,Saeed Ajmal,42699,"Saeed Ajmal to KJ O'Brien, 1 run calmly played through midwicket",2nd innings,42.3,run,235,1,235/4,"Saeed Ajmal to KJ O'Brien, 1 run",,calmly played through midwicket,4
552,256,Niall O'Brien,24289,Saeed Ajmal,42699,"Saeed Ajmal to NJ O'Brien, no run good stop by Ajmal",2nd innings,42.4,no run,235,0,235/4,"Saeed Ajmal to NJ O'Brien, no run",,good stop by Ajmal,4
553,257,Niall O'Brien,24289,Saeed Ajmal,42699,"Saeed Ajmal to NJ O'Brien, 1 run swept fine and even with a misfield they only get a single",2nd innings,42.5,run,236,1,236/4,"Saeed Ajmal to NJ O'Brien, 1 run",,swept fine and even with a misfield they only get a single,4
554,258,Kevin O'Brien,24605,Saeed Ajmal,42699,"Saeed Ajmal to KJ O'Brien, FOUR runs well timed drive through the covers",2nd innings,43.0,four,240,4,240/4,"Saeed Ajmal to KJ O'Brien, FOUR runs",,well timed drive through the covers,4
555,259,Niall O'Brien,24289,Junaid Khan,259551,"Junaid Khan to NJ O'Brien, OUT tried to launch it over long-on but only finds the big man Irfan at mid-on",2nd innings,43.1,out,240,0,240/5,"Junaid Khan to NJ O'Brien, OUT",,tried to launch it over long-on but only finds the big man Irfan at mid-on,5
556,260,Kevin O'Brien,24605,Junaid Khan,259551,"Junaid Khan to KJ O'Brien, 1 run driven firmly to Irfan at mid on",2nd innings,43.2,run,241,1,241/5,"Junaid Khan to KJ O'Brien, 1 run",,driven firmly to Irfan at mid on,5
557,261,Trent Johnston,6038,Junaid Khan,259551,"Junaid Khan to Johnston, 1 run nicely steered down to third man",2nd innings,43.3,run,242,1,242/5,"Junaid Khan to Johnston, 1 run",,nicely steered down to third man,5
558,262,Kevin O'Brien,24605,Junaid Khan,259551,"Junaid Khan to KJ O'Brien, FOUR runs hooked away to deep midwicket",2nd innings,43.4,four,246,4,246/5,"Junaid Khan to KJ O'Brien, FOUR runs",,hooked away to deep midwicket,5
