,ball,batsman,batsman_id,bowler,bowler_id,commentary,innings,otherBatsman,otherBatsman_id,otherBowler,otherBowler_id,overs,playType,runs,runs_scored,score,shortText,speed,text,wickets
441,131,Denesh Ramdin,52917,Stephen Parry,215058,"Parry to Ramdin, 1 run tucks this off leg stump to deep square",2nd innings,Dwayne Bravo,51439,Ben Stokes,311158,21.5,run,92,1,92/5,"Parry to Ramdin, 1 run",,tucks this off leg stump to deep square,5
442,132,Dwayne Bravo,51439,Stephen Parry,215058,"Parry to DJ Bravo, 1 run comes forward and drives out to deep cover",2nd innings,Denesh Ramdin,52917,Ben Stokes,311158,21.6,run,93,1,93/5,"Parry to DJ Bravo, 1 run",,comes forward and drives out to deep cover,5
443,133,Dwayne Bravo,51439,Ben Stokes,311158,"Stokes to DJ Bravo, no run full at middle and off, defended to cover",2nd innings,Denesh Ramdin,52917,Stephen Parry,215058,22.1,no run,93,0,93/5,"Stokes to DJ Bravo, no run",,"full at middle and off, defended to cover",5
444,134,Dwayne Bravo,51439,Ben Stokes,311158,"Stokes to DJ Bravo, 2 runs another nice piece of timing, this time he opens the face and places it square through the off side to give the sweeper some work",2nd innings,Denesh Ramdin,52917,Stephen Parry,215058,22.2,run,95,2,95/5,"Stokes to DJ Bravo, 2 runs",,"another nice piece of timing, this time he opens the face and places it square through the off side to give the sweeper some work",5
445,135,Dwayne Bravo,51439,Ben Stokes,311158,"Stokes to DJ Bravo, no run short of a length, on off stump, played to point",2nd innings,Denesh Ramdin,52917,Stephen Parry,215058,22.3,no run,95,0,95/5,"Stokes to DJ Bravo, no run",,"short of a length, on off stump, played to point",5
446,136,Dwayne Bravo,51439,Ben Stokes,311158,"Stokes to DJ Bravo, no run keeps it back of a length, defended up to mid-off",2nd innings,Denesh Ramdin,52917,Stephen Parry,215058,22.4,no run,95,0,95/5,"Stokes to DJ Bravo, no run",,"keeps it back of a length, defended up to mid-off",5
447,137,Dwayne Bravo,51439,Ben Stokes,311158,"Stokes to DJ Bravo, no run bouncer over middle and leg, loops over Bravo's back",2nd innings,Denesh Ramdin,52917,Stephen Parry,215058,22.5,no run,95,0,95/5,"Stokes to DJ Bravo, no run",,"bouncer over middle and leg, loops over Bravo's back",5
448,138,Dwayne Bravo,51439,Ben Stokes,311158,"Stokes to DJ Bravo, 1 run pulls off one leg, splits the men in the deep at square leg and long leg",2nd innings,Denesh Ramdin,52917,Stephen Parry,215058,22.6,run,96,1,96/5,"Stokes to DJ Bravo, 1 run",,"pulls off one leg, splits the men in the deep at square leg and long leg",5
449,139,Dwayne Bravo,51439,Stephen Parry,215058,"Parry to DJ Bravo, 1 run driven out to deep cover",2nd innings,Denesh Ramdin,52917,Ben Stokes,311158,23.1,run,97,1,97/5,"Parry to DJ Bravo, 1 run",,driven out to deep cover,5
450,140,Denesh Ramdin,52917,Stephen Parry,215058,"Parry to Ramdin, no run strides forward and plays it back to Parry",2nd innings,Dwayne Bravo,51439,Ben Stokes,311158,23.2,no run,97,0,97/5,"Parry to Ramdin, no run",,strides forward and plays it back to Parry,5
451,141,Denesh Ramdin,52917,Stephen Parry,215058,"Parry to Ramdin, no run defended towards the leg side, solid stuff again from Parry",2nd innings,Dwayne Bravo,51439,Ben Stokes,311158,23.3,no run,97,0,97/5,"Parry to Ramdin, no run",,"defended towards the leg side, solid stuff again from Parry",5
452,142,Denesh Ramdin,52917,Stephen Parry,215058,"Parry to Ramdin, no run drops this a touch short outside off but gets away with it as the cut goes to point",2nd innings,Dwayne Bravo,51439,Ben Stokes,311158,23.4,no run,97,0,97/5,"Parry to Ramdin, no run",,drops this a touch short outside off but gets away with it as the cut goes to point,5
453,143,Denesh Ramdin,52917,Stephen Parry,215058,"Parry to Ramdin, no run fuller delivery, whipped off the stumps to mid-on",2nd innings,Dwayne Bravo,51439,Ben Stokes,311158,23.5,no run,97,0,97/5,"Parry to Ramdin, no run",,"fuller delivery, whipped off the stumps to mid-on",5
454,144,Denesh Ramdin,52917,Stephen Parry,215058,"Parry to Ramdin, FOUR runs dragged down short and this time it costs a boundary as he it gets pulled through square leg...a rare poor delivery",2nd innings,Dwayne Bravo,51439,Ben Stokes,311158,23.6,four,101,4,101/5,"Parry to Ramdin, FOUR runs",,dragged down short and this time it costs a boundary as he it gets pulled through square leg...a rare poor delivery,5
455,145,Dwayne Bravo,51439,Ben Stokes,311158,"Stokes to DJ Bravo, 2 runs heaves a full delivery through the leg side, goes in the air bit wide of midwicket",2nd innings,Denesh Ramdin,52917,Stephen Parry,215058,24.1,run,103,2,103/5,"Stokes to DJ Bravo, 2 runs",,"heaves a full delivery through the leg side, goes in the air bit wide of midwicket",5
456,146,Dwayne Bravo,51439,Ben Stokes,311158,"Stokes to DJ Bravo, no run a flamboyant drive to a full delivery on off stump but he picks out backward point",2nd innings,Denesh Ramdin,52917,Stephen Parry,215058,24.2,no run,103,0,103/5,"Stokes to DJ Bravo, no run",,a flamboyant drive to a full delivery on off stump but he picks out backward point,5
457,147,Dwayne Bravo,51439,Ben Stokes,311158,"Stokes to DJ Bravo, no run gets behind the line and defends",2nd innings,Denesh Ramdin,52917,Stephen Parry,215058,24.3,no run,103,0,103/5,"Stokes to DJ Bravo, no run",,gets behind the line and defends,5
458,148,Dwayne Bravo,51439,Ben Stokes,311158,"Stokes to DJ Bravo, 1 run some width this time, Bravo leans back and drives out to deep cover",2nd innings,Denesh Ramdin,52917,Stephen Parry,215058,24.4,run,104,1,104/5,"Stokes to DJ Bravo, 1 run",,"some width this time, Bravo leans back and drives out to deep cover",5
459,149,Denesh Ramdin,52917,Ben Stokes,311158,"Stokes to Ramdin, no run better ball, full on middle and off, pushed into the covers",2nd innings,Dwayne Bravo,51439,Stephen Parry,215058,24.5,no run,104,0,104/5,"Stokes to Ramdin, no run",,"better ball, full on middle and off, pushed into the covers",5
460,150,Denesh Ramdin,52917,Ben Stokes,311158,"Stokes to Ramdin, no run touch of extra bounce this time, takes Ramdin by surprise and the lobs into space on the leg side off the splice",2nd innings,Dwayne Bravo,51439,Stephen Parry,215058,24.6,no run,104,0,104/5,"Stokes to Ramdin, no run",,"touch of extra bounce this time, takes Ramdin by surprise and the lobs into space on the leg side off the splice",5
461,151,Dwayne Bravo,51439,Stephen Parry,215058,"Parry to DJ Bravo, 1 run not far from a leading edge as he plays across the line of a full delivery, but gets it safely down to long-on",2nd innings,Denesh Ramdin,52917,Ben Stokes,311158,25.1,run,105,1,105/5,"Parry to DJ Bravo, 1 run",,"not far from a leading edge as he plays across the line of a full delivery, but gets it safely down to long-on",5
462,152,Denesh Ramdin,52917,Stephen Parry,215058,"Parry to Ramdin, 2 leg byes angled down the leg side, he goes for the sweep but just takes a glance off the pad past the keeper",2nd innings,Dwayne Bravo,51439,Ben Stokes,311158,25.2,leg bye,107,2,107/5,"Parry to Ramdin, 2 leg byes",,"angled down the leg side, he goes for the sweep but just takes a glance off the pad past the keeper",5
463,153,Denesh Ramdin,52917,Stephen Parry,215058,"Parry to Ramdin, 1 run back on off stump, driven down the ground",2nd innings,Dwayne Bravo,51439,Ben Stokes,311158,25.3,run,108,1,108/5,"Parry to Ramdin, 1 run",,"back on off stump, driven down the ground",5
464,154,Dwayne Bravo,51439,Stephen Parry,215058,"Parry to DJ Bravo, 1 run push and run into the off side",2nd innings,Denesh Ramdin,52917,Ben Stokes,311158,25.4,run,109,1,109/5,"Parry to DJ Bravo, 1 run",,push and run into the off side,5
465,155,Denesh Ramdin,52917,Stephen Parry,215058,"Parry to Ramdin, no run shorter outside off, again it doesn't cost anything as Ramdin finds point",2nd innings,Dwayne Bravo,51439,Ben Stokes,311158,25.5,no run,109,0,109/5,"Parry to Ramdin, no run",,"shorter outside off, again it doesn't cost anything as Ramdin finds point",5
466,156,Denesh Ramdin,52917,Stephen Parry,215058,"Parry to Ramdin, 1 run worked off the pads out to deep midwicket",2nd innings,Dwayne Bravo,51439,Ben Stokes,311158,25.6,run,110,1,110/5,"Parry to Ramdin, 1 run",,worked off the pads out to deep midwicket,5
467,157,Denesh Ramdin,52917,Ben Stokes,311158,"Stokes to Ramdin, no run very full, almost a yorker, gets a thick inside edge into his boot",2nd innings,Dwayne Bravo,51439,Stephen Parry,215058,26.1,no run,110,0,110/5,"Stokes to Ramdin, no run",,"very full, almost a yorker, gets a thick inside edge into his boot",5
468,158,Denesh Ramdin,52917,Ben Stokes,311158,"Stokes to Ramdin, 1 run top edges a pull but it falls short of long leg as he runs off the boundary",2nd innings,Dwayne Bravo,51439,Stephen Parry,215058,26.2,run,111,1,111/5,"Stokes to Ramdin, 1 run",,top edges a pull but it falls short of long leg as he runs off the boundary,5
469,159,Dwayne Bravo,51439,Ben Stokes,311158,"Stokes to DJ Bravo, FOUR runs thick outside edge to third man, it was full and wide, Bravo didn't hold back with his drive and the slip cordon is empty",2nd innings,Denesh Ramdin,52917,Stephen Parry,215058,26.3,four,115,4,115/5,"Stokes to DJ Bravo, FOUR runs",,"thick outside edge to third man, it was full and wide, Bravo didn't hold back with his drive and the slip cordon is empty",5
470,160,Dwayne Bravo,51439,Ben Stokes,311158,"Stokes to DJ Bravo, 1 run short of a length, gets inside the length and tucks it off his body to deep square",2nd innings,Denesh Ramdin,52917,Stephen Parry,215058,26.4,run,116,1,116/5,"Stokes to DJ Bravo, 1 run",,"short of a length, gets inside the length and tucks it off his body to deep square",5
471,161,Denesh Ramdin,52917,Ben Stokes,311158,"Stokes to Ramdin, no run full outside off, Ramdin doesn't really time his drive and finds cover",2nd innings,Dwayne Bravo,51439,Stephen Parry,215058,26.5,no run,116,0,116/5,"Stokes to Ramdin, no run",,"full outside off, Ramdin doesn't really time his drive and finds cover",5
472,162,Denesh Ramdin,52917,Ben Stokes,311158,"Stokes to Ramdin, 1 run alternating between full and short, this is shorter and pulled through midwicket",2nd innings,Dwayne Bravo,51439,Stephen Parry,215058,26.6,run,117,1,117/5,"Stokes to Ramdin, 1 run",,"alternating between full and short, this is shorter and pulled through midwicket",5
473,163,Denesh Ramdin,52917,Ravi Bopara,10582,"Bopara to Ramdin, FOUR runs short, angled down the leg side, pulled away fine",2nd innings,Dwayne Bravo,51439,Ben Stokes,311158,27.1,four,121,4,121/5,"Bopara to Ramdin, FOUR runs",,"short, angled down the leg side, pulled away fine",5
474,164,Denesh Ramdin,52917,Ravi Bopara,10582,"Bopara to Ramdin, no run makes a sharp take as Ramdin misses his cut",2nd innings,Dwayne Bravo,51439,Ben Stokes,311158,27.2,no run,121,0,121/5,"Bopara to Ramdin, no run",,makes a sharp take as Ramdin misses his cut,5
475,165,Denesh Ramdin,52917,Ravi Bopara,10582,"Bopara to Ramdin, no run low full toss, Ramdin whacks it onto his boot...he felt that",2nd innings,Dwayne Bravo,51439,Ben Stokes,311158,27.3,no run,121,0,121/5,"Bopara to Ramdin, no run",,"low full toss, Ramdin whacks it onto his boot...he felt that",5
476,166,Denesh Ramdin,52917,Ravi Bopara,10582,"Bopara to Ramdin, 1 run just short of a length, he goes for the pull and finds midwicket",2nd innings,Dwayne Bravo,51439,Ben Stokes,311158,27.4,run,122,1,122/5,"Bopara to Ramdin, 1 run",,"just short of a length, he goes for the pull and finds midwicket",5
477,167,Dwayne Bravo,51439,Ravi Bopara,10582,"Bopara to DJ Bravo, FOUR runs that's a more powerful pull, picked up from outside off and rockets it through straight midwicket",2nd innings,Denesh Ramdin,52917,Ben Stokes,311158,27.5,four,126,4,126/5,"Bopara to DJ Bravo, FOUR runs",,"that's a more powerful pull, picked up from outside off and rockets it through straight midwicket",5
478,168,Dwayne Bravo,51439,Ravi Bopara,10582,"Bopara to DJ Bravo, no run back outside off stump, fuller, driven to backward point",2nd innings,Denesh Ramdin,52917,Ben Stokes,311158,27.6,no run,126,0,126/5,"Bopara to DJ Bravo, no run",,"back outside off stump, fuller, driven to backward point",5
479,169,Denesh Ramdin,52917,James Tredwell,21646,"Tredwell to Ramdin, 1 run round the wicket, on leg stump, tucked off the pads",2nd innings,Dwayne Bravo,51439,Ravi Bopara,10582,28.1,run,127,1,127/5,"Tredwell to Ramdin, 1 run",,"round the wicket, on leg stump, tucked off the pads",5
480,170,Dwayne Bravo,51439,James Tredwell,21646,"Tredwell to DJ Bravo, no run on off stump, defended",2nd innings,Denesh Ramdin,52917,Ravi Bopara,10582,28.2,no run,127,0,127/5,"Tredwell to DJ Bravo, no run",,"on off stump, defended",5
481,171,Dwayne Bravo,51439,James Tredwell,21646,"Tredwell to DJ Bravo, no run comes forward and blocks to the off side",2nd innings,Denesh Ramdin,52917,Ravi Bopara,10582,28.3,no run,127,0,127/5,"Tredwell to DJ Bravo, no run",,comes forward and blocks to the off side,5
482,172,Dwayne Bravo,51439,James Tredwell,21646,"Tredwell to DJ Bravo, no run touch flatter this time, nothing expansive from Bravo as he defends",2nd innings,Denesh Ramdin,52917,Ravi Bopara,10582,28.4,no run,127,0,127/5,"Tredwell to DJ Bravo, no run",,"touch flatter this time, nothing expansive from Bravo as he defends",5
483,173,Dwayne Bravo,51439,James Tredwell,21646,"Tredwell to DJ Bravo, 1 run worked off the pads through square leg",2nd innings,Denesh Ramdin,52917,Ravi Bopara,10582,28.5,run,128,1,128/5,"Tredwell to DJ Bravo, 1 run",,worked off the pads through square leg,5
484,174,Denesh Ramdin,52917,James Tredwell,21646,"Tredwell to Ramdin, 1 run clubbed down the ground but just another single...England won't mind them",2nd innings,Dwayne Bravo,51439,Ravi Bopara,10582,28.6,run,129,1,129/5,"Tredwell to Ramdin, 1 run",,clubbed down the ground but just another single...England won't mind them,5
485,175,Denesh Ramdin,52917,Ravi Bopara,10582,"Bopara to Ramdin, 1 run full outside off, driven to deep cover",2nd innings,Dwayne Bravo,51439,James Tredwell,21646,29.1,run,130,1,130/5,"Bopara to Ramdin, 1 run",,"full outside off, driven to deep cover",5
486,175,Dwayne Bravo,51439,Ravi Bopara,10582,"Bopara to DJ Bravo, 1 wide slower ball, might have been a legspinner, but loses the line down the leg side",2nd innings,Denesh Ramdin,52917,James Tredwell,21646,29.1,wide,131,1,131/5,"Bopara to DJ Bravo, 1 wide",,"slower ball, might have been a legspinner, but loses the line down the leg side",5
487,176,Dwayne Bravo,51439,Ravi Bopara,10582,"Bopara to DJ Bravo, OUT Ravi strikes! Back of a length on off stump, Bravo trying to work it down to third man and the edge is very well held by Buttler up to the timber",2nd innings,Denesh Ramdin,52917,James Tredwell,21646,29.2,out,131,0,131/6,"Bopara to DJ Bravo, OUT",,"Ravi strikes! Back of a length on off stump, Bravo trying to work it down to third man and the edge is very well held by Buttler up to the timber",6
488,177,Daren Sammy,53115,Ravi Bopara,10582,"Bopara to Sammy, no run slightly back of a length outside off, Sammy lets this through to the keeper",2nd innings,Denesh Ramdin,52917,James Tredwell,21646,29.3,no run,131,0,131/6,"Bopara to Sammy, no run",,"slightly back of a length outside off, Sammy lets this through to the keeper",6
489,178,Daren Sammy,53115,Ravi Bopara,10582,"Bopara to Sammy, no run short again, this time Sammy frees the arms through a whip-crack pull but midwicket sprawls to stop it",2nd innings,Denesh Ramdin,52917,James Tredwell,21646,29.4,no run,131,0,131/6,"Bopara to Sammy, no run",,"short again, this time Sammy frees the arms through a whip-crack pull but midwicket sprawls to stop it",6
490,179,Daren Sammy,53115,Ravi Bopara,10582,"Bopara to Sammy, no run brisk-ish 78mph, on off stump, Sammy shows it a straight bat",2nd innings,Denesh Ramdin,52917,James Tredwell,21646,29.5,no run,131,0,131/6,"Bopara to Sammy, no run",,"brisk-ish 78mph, on off stump, Sammy shows it a straight bat",6
491,180,Daren Sammy,53115,Ravi Bopara,10582,"Bopara to Sammy, 1 run shuffles across and nudges a single back past the bowler to long-on",2nd innings,Denesh Ramdin,52917,James Tredwell,21646,29.6,run,132,1,132/6,"Bopara to Sammy, 1 run",,shuffles across and nudges a single back past the bowler to long-on,6
492,181,Daren Sammy,53115,James Tredwell,21646,"Tredwell to Sammy, no run floated up and straightening on middle and off, defended pressing forwards",2nd innings,Denesh Ramdin,52917,Ravi Bopara,10582,30.1,no run,132,0,132/6,"Tredwell to Sammy, no run",,"floated up and straightening on middle and off, defended pressing forwards",6
493,182,Daren Sammy,53115,James Tredwell,21646,"Tredwell to Sammy, no run slightly short, sliding across the batsman, Sammy swings and misses",2nd innings,Denesh Ramdin,52917,Ravi Bopara,10582,30.2,no run,132,0,132/6,"Tredwell to Sammy, no run",,"slightly short, sliding across the batsman, Sammy swings and misses",6
494,183,Daren Sammy,53115,James Tredwell,21646,"Tredwell to Sammy, no run tossed up on the stumps, goes back and across to defend",2nd innings,Denesh Ramdin,52917,Ravi Bopara,10582,30.3,no run,132,0,132/6,"Tredwell to Sammy, no run",,"tossed up on the stumps, goes back and across to defend",6
495,184,Daren Sammy,53115,James Tredwell,21646,"Tredwell to Sammy, no run length ball on off, pushed back to the bowler",2nd innings,Denesh Ramdin,52917,Ravi Bopara,10582,30.4,no run,132,0,132/6,"Tredwell to Sammy, no run",,"length ball on off, pushed back to the bowler",6
496,185,Daren Sammy,53115,James Tredwell,21646,"Tredwell to Sammy, 1 run lunges forward to defend, the ball rolls short on the leg side and they steal one",2nd innings,Denesh Ramdin,52917,Ravi Bopara,10582,30.5,run,133,1,133/6,"Tredwell to Sammy, 1 run",,"lunges forward to defend, the ball rolls short on the leg side and they steal one",6
497,186,Denesh Ramdin,52917,James Tredwell,21646,"Tredwell to Ramdin, no run bit of extra flight, Ramdin gets solidly behind it in front of middle stump",2nd innings,Daren Sammy,53115,Ravi Bopara,10582,30.6,no run,133,0,133/6,"Tredwell to Ramdin, no run",,"bit of extra flight, Ramdin gets solidly behind it in front of middle stump",6
498,187,Daren Sammy,53115,Ravi Bopara,10582,"Bopara to Sammy, 1 run comes forward and pushes one down the ground",2nd innings,Denesh Ramdin,52917,James Tredwell,21646,31.1,run,134,1,134/6,"Bopara to Sammy, 1 run",,comes forward and pushes one down the ground,6
499,188,Denesh Ramdin,52917,Ravi Bopara,10582,"Bopara to Ramdin, no run length ball, bit of width but Ramdin cracks it to backward point from deep in the crease",2nd innings,Daren Sammy,53115,James Tredwell,21646,31.2,no run,134,0,134/6,"Bopara to Ramdin, no run",,"length ball, bit of width but Ramdin cracks it to backward point from deep in the crease",6
500,189,Denesh Ramdin,52917,Ravi Bopara,10582,"Bopara to Ramdin, no run slightly full, tailing in, leans on a drive but can't beat the man in the covers",2nd innings,Daren Sammy,53115,James Tredwell,21646,31.3,no run,134,0,134/6,"Bopara to Ramdin, no run",,"slightly full, tailing in, leans on a drive but can't beat the man in the covers",6
501,190,Denesh Ramdin,52917,Ravi Bopara,10582,"Bopara to Ramdin, 1 run full and tailing in towards middle and leg, whipped from in front of the pad through backward square",2nd innings,Daren Sammy,53115,James Tredwell,21646,31.4,run,135,1,135/6,"Bopara to Ramdin, 1 run",,"full and tailing in towards middle and leg, whipped from in front of the pad through backward square",6
502,191,Daren Sammy,53115,Ravi Bopara,10582,"Bopara to Sammy, no run slower ball from Bopara, outside the line of off, Sammy props forward to defend",2nd innings,Denesh Ramdin,52917,James Tredwell,21646,31.5,no run,135,0,135/6,"Bopara to Sammy, no run",,"slower ball from Bopara, outside the line of off, Sammy props forward to defend",6
503,192,Daren Sammy,53115,Ravi Bopara,10582,"Bopara to Sammy, FOUR runs Sammy knows his way around some late-overs carnage, of course, and he times a crunching drive through the covers, albeit with the aid of a slightly tired dive from the fielder",2nd innings,Denesh Ramdin,52917,James Tredwell,21646,31.6,four,139,4,139/6,"Bopara to Sammy, FOUR runs",,"Sammy knows his way around some late-overs carnage, of course, and he times a crunching drive through the covers, albeit with the aid of a slightly tired dive from the fielder",6
504,193,Denesh Ramdin,52917,James Tredwell,21646,"Tredwell to Ramdin, 1 run tossed up and chopped into the ground, past the tumbling Tredwell for one down the ground",2nd innings,Daren Sammy,53115,Ravi Bopara,10582,32.1,run,140,1,140/6,"Tredwell to Ramdin, 1 run",,"tossed up and chopped into the ground, past the tumbling Tredwell for one down the ground",6
505,194,Daren Sammy,53115,James Tredwell,21646,"Tredwell to Sammy, no run goes back, straightening outside leg, pushed to mid-on",2nd innings,Denesh Ramdin,52917,Ravi Bopara,10582,32.2,no run,140,0,140/6,"Tredwell to Sammy, no run",,"goes back, straightening outside leg, pushed to mid-on",6
506,195,Daren Sammy,53115,James Tredwell,21646,"Tredwell to Sammy, no run length ball skidding on outside off, driven into the covers off the back foot",2nd innings,Denesh Ramdin,52917,Ravi Bopara,10582,32.3,no run,140,0,140/6,"Tredwell to Sammy, no run",,"length ball skidding on outside off, driven into the covers off the back foot",6
507,196,Daren Sammy,53115,James Tredwell,21646,"Tredwell to Sammy, no run played back gently towards the bowler",2nd innings,Denesh Ramdin,52917,Ravi Bopara,10582,32.4,no run,140,0,140/6,"Tredwell to Sammy, no run",,played back gently towards the bowler,6
508,197,Daren Sammy,53115,James Tredwell,21646,"Tredwell to Sammy, no run on the stumps, pushed through, forcefully driven back along the ground to Tredwell, who fields",2nd innings,Denesh Ramdin,52917,Ravi Bopara,10582,32.5,no run,140,0,140/6,"Tredwell to Sammy, no run",,"on the stumps, pushed through, forcefully driven back along the ground to Tredwell, who fields",6
509,198,Daren Sammy,53115,James Tredwell,21646,"Tredwell to Sammy, no run tossed up on the stumps and again Sammy covers up",2nd innings,Denesh Ramdin,52917,Ravi Bopara,10582,32.6,no run,140,0,140/6,"Tredwell to Sammy, no run",,tossed up on the stumps and again Sammy covers up,6
510,199,Denesh Ramdin,52917,Stephen Parry,215058,"Parry to Ramdin, 1 run he's got the diminutive Ramdin on strike to begin with, tossed up and he nudges one short into the leg side",2nd innings,Daren Sammy,53115,James Tredwell,21646,33.1,run,141,1,141/6,"Parry to Ramdin, 1 run",,"he's got the diminutive Ramdin on strike to begin with, tossed up and he nudges one short into the leg side",6
511,200,Daren Sammy,53115,Stephen Parry,215058,"Parry to Sammy, no run pushed through flat and quick outside off, sits back and cracks the ball to point along the ground",2nd innings,Denesh Ramdin,52917,James Tredwell,21646,33.2,no run,141,0,141/6,"Parry to Sammy, no run",,"pushed through flat and quick outside off, sits back and cracks the ball to point along the ground",6
512,201,Daren Sammy,53115,Stephen Parry,215058,"Parry to Sammy, no run tight on off, good length and holding its line, cuts into the ground this time",2nd innings,Denesh Ramdin,52917,James Tredwell,21646,33.3,no run,141,0,141/6,"Parry to Sammy, no run",,"tight on off, good length and holding its line, cuts into the ground this time",6
513,202,Daren Sammy,53115,Stephen Parry,215058,"Parry to Sammy, 1 run tossed up outside the line of off, pushes forward and dabs one into the covers",2nd innings,Denesh Ramdin,52917,James Tredwell,21646,33.4,run,142,1,142/6,"Parry to Sammy, 1 run",,"tossed up outside the line of off, pushes forward and dabs one into the covers",6
514,203,Denesh Ramdin,52917,Stephen Parry,215058,"Parry to Ramdin, no run checks his drive and the ball <i>nearly</i> carries back to the bowler - Parry down on his knees, couldn't quite get his hands to it, the delivery just holding in the surface as Ramdin pushed forwards",2nd innings,Daren Sammy,53115,James Tredwell,21646,33.5,no run,142,0,142/6,"Parry to Ramdin, no run",,"checks his drive and the ball <i>nearly</i> carries back to the bowler - Parry down on his knees, couldn't quite get his hands to it, the delivery just holding in the surface as Ramdin pushed forwards",6
515,204,Denesh Ramdin,52917,Stephen Parry,215058,"Parry to Ramdin, 1 run works a single back through mid-on",2nd innings,Daren Sammy,53115,James Tredwell,21646,33.6,run,143,1,143/6,"Parry to Ramdin, 1 run",,works a single back through mid-on,6
516,205,Denesh Ramdin,52917,Stuart Broad,10617,"Broad to Ramdin, 1 run good length outside off, shows it a straight bat and taps towards cover",2nd innings,Daren Sammy,53115,Stephen Parry,215058,34.1,run,144,1,144/6,"Broad to Ramdin, 1 run",,"good length outside off, shows it a straight bat and taps towards cover",6
517,206,Daren Sammy,53115,Stuart Broad,10617,"Broad to Sammy, 1 run Ramdin edges across in front of his stumps and swings from the hip, comes off the hip and bounces towards point",2nd innings,Denesh Ramdin,52917,Stephen Parry,215058,34.2,run,145,1,145/6,"Broad to Sammy, 1 run",,"Ramdin edges across in front of his stumps and swings from the hip, comes off the hip and bounces towards point",6
518,207,Denesh Ramdin,52917,Stuart Broad,10617,"Broad to Ramdin, no run in the corridor outside off, comes across to block",2nd innings,Daren Sammy,53115,Stephen Parry,215058,34.3,no run,145,0,145/6,"Broad to Ramdin, no run",,"in the corridor outside off, comes across to block",6
519,207,Denesh Ramdin,52917,Stuart Broad,10617,"Broad to Ramdin, 1 wide dug in short and Ramdin sways under it - called wide on height",2nd innings,Daren Sammy,53115,Stephen Parry,215058,34.3,wide,146,1,146/6,"Broad to Ramdin, 1 wide",,dug in short and Ramdin sways under it - called wide on height,6
