,ball,batsman,batsman_id,bowler,bowler_id,commentary,innings,overs,playType,runs,runs_scored,score,shortText,speed,text,wickets
323,13,Dinesh Chandimal,300628,Umesh Yadav,376116,"Yadav to Chandimal, no run short of a length, into the pads, Chandimal doesn't get a touch on it, is hit on the thigh",2nd innings,2.1,no run,10,0,10/1,"Yadav to Chandimal, no run",,"short of a length, into the pads, Chandimal doesn't get a touch on it, is hit on the thigh",1
324,14,Dinesh Chandimal,300628,Umesh Yadav,376116,"Yadav to Chandimal, no run short of a length, 145ks, good bounce, Chandimal is on his toes and defends",2nd innings,2.2,no run,10,0,10/1,"Yadav to Chandimal, no run",,"short of a length, 145ks, good bounce, Chandimal is on his toes and defends",1
325,15,Dinesh Chandimal,300628,Umesh Yadav,376116,"Yadav to Chandimal, no run on a length, holding its line outside off, left alone",2nd innings,2.3,no run,10,0,10/1,"Yadav to Chandimal, no run",,"on a length, holding its line outside off, left alone",1
326,16,Dinesh Chandimal,300628,Umesh Yadav,376116,"Yadav to Chandimal, no run fuller, closer to off, driven nicely, but can't beat mid-off",2nd innings,2.4,no run,10,0,10/1,"Yadav to Chandimal, no run",,"fuller, closer to off, driven nicely, but can't beat mid-off",1
327,17,Dinesh Chandimal,300628,Umesh Yadav,376116,"Yadav to Chandimal, no run looks to pull this short ball from well outside off. There is no timing on this, and he has tucked this away to square leg",2nd innings,2.5,no run,10,0,10/1,"Yadav to Chandimal, no run",,"looks to pull this short ball from well outside off. There is no timing on this, and he has tucked this away to square leg",1
328,18,Dinesh Chandimal,300628,Umesh Yadav,376116,"Yadav to Chandimal, FOUR runs the mid-off is wide, and Chandimal beats him easily. Drives this length ball on the up, and beats the man to his right",2nd innings,2.6,four,14,4,14/1,"Yadav to Chandimal, FOUR runs",,"the mid-off is wide, and Chandimal beats him easily. Drives this length ball on the up, and beats the man to his right",1
329,19,Tillakaratne Dilshan,48472,Stuart Binny,27223,"Binny to Dilshan, no run nice outswinger. Not quite a half-volley, Dilshan has to be careful and allow for the movement, and he ends up playing it defensively to short cover",2nd innings,3.1,no run,14,0,14/1,"Binny to Dilshan, no run",,"nice outswinger. Not quite a half-volley, Dilshan has to be careful and allow for the movement, and he ends up playing it defensively to short cover",1
330,20,Tillakaratne Dilshan,48472,Stuart Binny,27223,"Binny to Dilshan, no run slightly short of a length, Dilshan gets tall to punch it, but can't beat backward point",2nd innings,3.2,no run,14,0,14/1,"Binny to Dilshan, no run",,"slightly short of a length, Dilshan gets tall to punch it, but can't beat backward point",1
331,21,Tillakaratne Dilshan,48472,Stuart Binny,27223,"Binny to Dilshan, 1 run Kohli makes a diving save at mid-off to save three runs. This is driven on the up, past short cover and well wide of mid-off, but Kohli runs hard and dives to his left to keep it in",2nd innings,3.3,run,15,1,15/1,"Binny to Dilshan, 1 run",,"Kohli makes a diving save at mid-off to save three runs. This is driven on the up, past short cover and well wide of mid-off, but Kohli runs hard and dives to his left to keep it in",1
332,22,Dinesh Chandimal,300628,Stuart Binny,27223,"Binny to Chandimal, no run on a length, outside off, defended with an open face",2nd innings,3.4,no run,15,0,15/1,"Binny to Chandimal, no run",,"on a length, outside off, defended with an open face",1
333,23,Dinesh Chandimal,300628,Stuart Binny,27223,"Binny to Chandimal, no run on a length outside off, holds its line a little, pushed to mid-off",2nd innings,3.5,no run,15,0,15/1,"Binny to Chandimal, no run",,"on a length outside off, holds its line a little, pushed to mid-off",1
334,24,Dinesh Chandimal,300628,Stuart Binny,27223,"Binny to Chandimal, FOUR runs nice drive. This is a wide outswinger, Chandimal plants the front foot across, gets close to the pitch of the ball, and places the drive between mid-off and extra cover",2nd innings,3.6,four,19,4,19/1,"Binny to Chandimal, FOUR runs",,"nice drive. This is a wide outswinger, Chandimal plants the front foot across, gets close to the pitch of the ball, and places the drive between mid-off and extra cover",1
335,25,Tillakaratne Dilshan,48472,Umesh Yadav,376116,"Yadav to Dilshan, no run beaten for pace as Dilshan looks to crunch this through the leg side. This one angles in, beats his inside edge and hits him on the pad",2nd innings,4.1,no run,19,0,19/1,"Yadav to Dilshan, no run",,"beaten for pace as Dilshan looks to crunch this through the leg side. This one angles in, beats his inside edge and hits him on the pad",1
336,26,Tillakaratne Dilshan,48472,Umesh Yadav,376116,"Yadav to Dilshan, no run Yadav is quick again, on a length, at 143ks, hits the inside half of the bat hard",2nd innings,4.2,no run,19,0,19/1,"Yadav to Dilshan, no run",,"Yadav is quick again, on a length, at 143ks, hits the inside half of the bat hard",1
337,27,Tillakaratne Dilshan,48472,Umesh Yadav,376116,"Yadav to Dilshan, 2 runs slightly short of a length, he manages to pull it, to left of deep square for two",2nd innings,4.3,run,21,2,21/1,"Yadav to Dilshan, 2 runs",,"slightly short of a length, he manages to pull it, to left of deep square for two",1
338,28,Tillakaratne Dilshan,48472,Umesh Yadav,376116,"Yadav to Dilshan, FOUR runs this is even shorter, and Dilshan stands tall to pull this over square leg for four runs",2nd innings,4.4,four,25,4,25/1,"Yadav to Dilshan, FOUR runs",,"this is even shorter, and Dilshan stands tall to pull this over square leg for four runs",1
339,29,Tillakaratne Dilshan,48472,Umesh Yadav,376116,"Yadav to Dilshan, no run again he almost beats Dilshan for pace. This is full and straight, and Dilshan is late on the drive. Gets an inside edge onto the pad",2nd innings,4.5,no run,25,0,25/1,"Yadav to Dilshan, no run",,"again he almost beats Dilshan for pace. This is full and straight, and Dilshan is late on the drive. Gets an inside edge onto the pad",1
340,30,Tillakaratne Dilshan,48472,Umesh Yadav,376116,"Yadav to Dilshan, no run slower ball, 116ks, on a length outside off, defended",2nd innings,4.6,no run,25,0,25/1,"Yadav to Dilshan, no run",,"slower ball, 116ks, on a length outside off, defended",1
341,31,Dinesh Chandimal,300628,Stuart Binny,27223,"Binny to Chandimal, no run length ball outside off, swings away a little, left alone",2nd innings,5.1,no run,25,0,25/1,"Binny to Chandimal, no run",,"length ball outside off, swings away a little, left alone",1
342,32,Dinesh Chandimal,300628,Stuart Binny,27223,"Binny to Chandimal, 1 run opens the face to push this length ball past backward point for one",2nd innings,5.2,run,26,1,26/1,"Binny to Chandimal, 1 run",,opens the face to push this length ball past backward point for one,1
343,33,Tillakaratne Dilshan,48472,Stuart Binny,27223,"Binny to Dilshan, FOUR runs too short for Binny's pace. Dilshan crashes this over square leg for four",2nd innings,5.3,four,30,4,30/1,"Binny to Dilshan, FOUR runs",,too short for Binny's pace. Dilshan crashes this over square leg for four,1
344,34,Tillakaratne Dilshan,48472,Stuart Binny,27223,"Binny to Dilshan, 1 run nice outswinger, on a length, middle and off, moves towards off, defended to mid-off, but they come through for a quick single",2nd innings,5.4,run,31,1,31/1,"Binny to Dilshan, 1 run",,"nice outswinger, on a length, middle and off, moves towards off, defended to mid-off, but they come through for a quick single",1
345,35,Dinesh Chandimal,300628,Stuart Binny,27223,"Binny to Chandimal, no run a floater well outside off, Chandimal gets a stride in, but leaves it alone",2nd innings,5.5,no run,31,0,31/1,"Binny to Chandimal, no run",,"a floater well outside off, Chandimal gets a stride in, but leaves it alone",1
346,36,Dinesh Chandimal,300628,Stuart Binny,27223,"Binny to Chandimal, OUT another wicket down. That man at short cover does it. Binny has done well whenever he has pitched the ball up. This is a teasing length. Not the driving length, but it teases Chandimal, who ends up pushing at it well in front of his body. Easy catch for Raina at short cover",2nd innings,5.6,out,31,0,31/2,"Binny to Chandimal, OUT",,"another wicket down. That man at short cover does it. Binny has done well whenever he has pitched the ball up. This is a teasing length. Not the driving length, but it teases Chandimal, who ends up pushing at it well in front of his body. Easy catch for Raina at short cover",2
347,37,Tillakaratne Dilshan,48472,Umesh Yadav,376116,"Yadav to Dilshan, no run length ball, on off, driven hard, but straight to cover",2nd innings,6.1,no run,31,0,31/2,"Yadav to Dilshan, no run",,"length ball, on off, driven hard, but straight to cover",2
348,38,Tillakaratne Dilshan,48472,Umesh Yadav,376116,"Yadav to Dilshan, no run short of a length, holds its line in front of off, beats the outside edge, and sails over the off stump",2nd innings,6.2,no run,31,0,31/2,"Yadav to Dilshan, no run",,"short of a length, holds its line in front of off, beats the outside edge, and sails over the off stump",2
349,39,Tillakaratne Dilshan,48472,Umesh Yadav,376116,"Yadav to Dilshan, FOUR runs 147ks, but too short, Dilshan is not entirely in control of this, but he has managed to place the pull between square leg and midwicket",2nd innings,6.3,four,35,4,35/2,"Yadav to Dilshan, FOUR runs",,"147ks, but too short, Dilshan is not entirely in control of this, but he has managed to place the pull between square leg and midwicket",2
350,40,Tillakaratne Dilshan,48472,Umesh Yadav,376116,"Yadav to Dilshan, no run length ball angling in, beats the inside edge, hits him on the pad",2nd innings,6.4,no run,35,0,35/2,"Yadav to Dilshan, no run",,"length ball angling in, beats the inside edge, hits him on the pad",2
351,41,Tillakaratne Dilshan,48472,Umesh Yadav,376116,"Yadav to Dilshan, no run there is a flying Raina at short cover. Slower ball, driven hard, Raina dives to his left at short cover, and saves four runs",2nd innings,6.5,no run,35,0,35/2,"Yadav to Dilshan, no run",,"there is a flying Raina at short cover. Slower ball, driven hard, Raina dives to his left at short cover, and saves four runs",2
352,42,Tillakaratne Dilshan,48472,Umesh Yadav,376116,"Yadav to Dilshan, no run quick shortish ball, seams back in, hits him high on the pad. Yadav appeals for lbw but this is headed down leg. There is possibly an inside edge involved, but the ball doesn't carry to the diving wicketkeeper, Uthappa",2nd innings,6.6,no run,35,0,35/2,"Yadav to Dilshan, no run",,"quick shortish ball, seams back in, hits him high on the pad. Yadav appeals for lbw but this is headed down leg. There is possibly an inside edge involved, but the ball doesn't carry to the diving wicketkeeper, Uthappa",2
353,43,Mahela Jayawardene,49289,Stuart Binny,27223,"Binny to Jayawardene, 1 run short of a length, into the pads, turned around the corner for one",2nd innings,7.1,run,36,1,36/2,"Binny to Jayawardene, 1 run",,"short of a length, into the pads, turned around the corner for one",2
354,44,Tillakaratne Dilshan,48472,Stuart Binny,27223,"Binny to Dilshan, no run on a length, outside off, pushed towards cover",2nd innings,7.2,no run,36,0,36/2,"Binny to Dilshan, no run",,"on a length, outside off, pushed towards cover",2
355,45,Tillakaratne Dilshan,48472,Stuart Binny,27223,"Binny to Dilshan, FOUR runs and Dilshan pulls out the ramp. Plants his front foot across, gets on a knee, gets under a length ball, and uses his wrists to send it fine of the diving Rohit Sharma at fine leg",2nd innings,7.3,four,40,4,40/2,"Binny to Dilshan, FOUR runs",,"and Dilshan pulls out the ramp. Plants his front foot across, gets on a knee, gets under a length ball, and uses his wrists to send it fine of the diving Rohit Sharma at fine leg",2
356,46,Tillakaratne Dilshan,48472,Stuart Binny,27223,"Binny to Dilshan, 1 run short of a length, outside off, runs this down to third man for one",2nd innings,7.4,run,41,1,41/2,"Binny to Dilshan, 1 run",,"short of a length, outside off, runs this down to third man for one",2
357,47,Mahela Jayawardene,49289,Stuart Binny,27223,"Binny to Jayawardene, no run nice little outswinger outside off, holds its line to beat Jayawardene's outside edge",2nd innings,7.5,no run,41,0,41/2,"Binny to Jayawardene, no run",,"nice little outswinger outside off, holds its line to beat Jayawardene's outside edge",2
358,48,Mahela Jayawardene,49289,Stuart Binny,27223,"Binny to Jayawardene, 1 run another outswinger, Jayawardene is looking to leave but is a little late, and ends up running this off the face to third man for one",2nd innings,7.6,run,42,1,42/2,"Binny to Jayawardene, 1 run",,"another outswinger, Jayawardene is looking to leave but is a little late, and ends up running this off the face to third man for one",2
359,49,Mahela Jayawardene,49289,Umesh Yadav,376116,"Yadav to Jayawardene, no run nicely driven on the up, but straight to cover",2nd innings,8.1,no run,42,0,42/2,"Yadav to Jayawardene, no run",,"nicely driven on the up, but straight to cover",2
360,50,Mahela Jayawardene,49289,Umesh Yadav,376116,"Yadav to Jayawardene, OUT Mahela doesn't look happy with this, but this is a pretty good decision. Yadav is full and straight, Jayawardene is deep in the crease, and plays across its line. This looks good to hit leg stump as it has hit his pad in front of middle and leg and doesn't have too far to travel",2nd innings,8.2,out,42,0,42/3,"Yadav to Jayawardene, OUT",,"Mahela doesn't look happy with this, but this is a pretty good decision. Yadav is full and straight, Jayawardene is deep in the crease, and plays across its line. This looks good to hit leg stump as it has hit his pad in front of middle and leg and doesn't have too far to travel",3
361,51,Angelo Mathews,49764,Umesh Yadav,376116,"Yadav to Mathews, no run full and straight, swinging away too, defended from the crease",2nd innings,8.3,no run,42,0,42/3,"Yadav to Mathews, no run",,"full and straight, swinging away too, defended from the crease",3
362,52,Angelo Mathews,49764,Umesh Yadav,376116,"Yadav to Mathews, 1 run short of a length, into the pads, helped away to deep square leg",2nd innings,8.4,run,43,1,43/3,"Yadav to Mathews, 1 run",,"short of a length, into the pads, helped away to deep square leg",3
363,53,Tillakaratne Dilshan,48472,Umesh Yadav,376116,"Yadav to Dilshan, 1 run short of a length, widish, punched away to third man for one",2nd innings,8.5,run,44,1,44/3,"Yadav to Dilshan, 1 run",,"short of a length, widish, punched away to third man for one",3
364,54,Angelo Mathews,49764,Umesh Yadav,376116,"Yadav to Mathews, no run <b>another appeal for lbw</b> as this one jags back in from short of a length and outside off. This one looks pretty straight, but is not given. Could be the bounce",2nd innings,8.6,no run,44,0,44/3,"Yadav to Mathews, no run",,"<b>another appeal for lbw</b> as this one jags back in from short of a length and outside off. This one looks pretty straight, but is not given. Could be the bounce",3
365,55,Tillakaratne Dilshan,48472,Stuart Binny,27223,"Binny to Dilshan, 1 run on a length, middle and off, swinging towards off, worked away into the leg side for one",2nd innings,9.1,run,45,1,45/3,"Binny to Dilshan, 1 run",,"on a length, middle and off, swinging towards off, worked away into the leg side for one",3
366,56,Angelo Mathews,49764,Stuart Binny,27223,"Binny to Mathews, 1 run nice outswinger, short of driving length, Mathews is squared up, but gets enough bat on it take a single square of the wicket",2nd innings,9.2,run,46,1,46/3,"Binny to Mathews, 1 run",,"nice outswinger, short of driving length, Mathews is squared up, but gets enough bat on it take a single square of the wicket",3
367,57,Tillakaratne Dilshan,48472,Stuart Binny,27223,"Binny to Dilshan, 2 runs this is the one angled in, Dilshan is a little surprised that it doesn't swing away, but gets the bat down in time to take a couple to leg",2nd innings,9.3,run,48,2,48/3,"Binny to Dilshan, 2 runs",,"this is the one angled in, Dilshan is a little surprised that it doesn't swing away, but gets the bat down in time to take a couple to leg",3
368,58,Tillakaratne Dilshan,48472,Stuart Binny,27223,"Binny to Dilshan, OUT Raina is flying at short cover again, and he is coming up with balls in hand. Short of a length, around off, Dilshan looks to work this to leg but is early into the shot. The leading edge goes to the right of short cover, but not beyond the reach of Raina's dive",2nd innings,9.4,out,48,0,48/4,"Binny to Dilshan, OUT",,"Raina is flying at short cover again, and he is coming up with balls in hand. Short of a length, around off, Dilshan looks to work this to leg but is early into the shot. The leading edge goes to the right of short cover, but not beyond the reach of Raina's dive",4
369,59,Lahiru Thirimanne,301236,Stuart Binny,27223,"Binny to Thirimanne, no run full, swinging in towards Thirimanne, pushed to mid-off",2nd innings,9.5,no run,48,0,48/4,"Binny to Thirimanne, no run",,"full, swinging in towards Thirimanne, pushed to mid-off",4
370,60,Lahiru Thirimanne,301236,Stuart Binny,27223,"Binny to Thirimanne, no run short of a length, angling in, towards top of off, defended off the back foot",2nd innings,9.6,no run,48,0,48/4,"Binny to Thirimanne, no run",,"short of a length, angling in, towards top of off, defended off the back foot",4
371,61,Angelo Mathews,49764,Umesh Yadav,376116,"Yadav to Mathews, FOUR runs on a length, holds its line, runs off the outer half of the bat on this drive, and goes through the gap between cover and extra cover",2nd innings,10.1,four,52,4,52/4,"Yadav to Mathews, FOUR runs",,"on a length, holds its line, runs off the outer half of the bat on this drive, and goes through the gap between cover and extra cover",4
372,62,Angelo Mathews,49764,Umesh Yadav,376116,"Yadav to Mathews, 1 run a thick outside edge again as Mathews is squared up. Doesn't beat point this time",2nd innings,10.2,run,53,1,53/4,"Yadav to Mathews, 1 run",,a thick outside edge again as Mathews is squared up. Doesn't beat point this time,4
373,63,Lahiru Thirimanne,301236,Umesh Yadav,376116,"Yadav to Thirimanne, no run on a length, angling towards off, defended from the crease by Thirimanne",2nd innings,10.3,no run,53,0,53/4,"Yadav to Thirimanne, no run",,"on a length, angling towards off, defended from the crease by Thirimanne",4
374,64,Lahiru Thirimanne,301236,Umesh Yadav,376116,"Yadav to Thirimanne, no run short of a length, middle and leg, defended",2nd innings,10.4,no run,53,0,53/4,"Yadav to Thirimanne, no run",,"short of a length, middle and leg, defended",4
375,65,Lahiru Thirimanne,301236,Umesh Yadav,376116,"Yadav to Thirimanne, no run that's a superb ball. Yadav;s bowling this series has been a big positive. Not very short, 140ks, but it rears off, stunning Thirimanne. There is an appeal for the catch at the wicket, but this has gone off his shoulder",2nd innings,10.5,no run,53,0,53/4,"Yadav to Thirimanne, no run",,"that's a superb ball. Yadav;s bowling this series has been a big positive. Not very short, 140ks, but it rears off, stunning Thirimanne. There is an appeal for the catch at the wicket, but this has gone off his shoulder",4
376,66,Lahiru Thirimanne,301236,Umesh Yadav,376116,"Yadav to Thirimanne, no run full, on off, defended",2nd innings,10.6,no run,53,0,53/4,"Yadav to Thirimanne, no run",,"full, on off, defended",4
377,67,Angelo Mathews,49764,Stuart Binny,27223,"Binny to Mathews, no run this one swings from middle and leg, and Mathews can't do much more than defend it with respect",2nd innings,11.1,no run,53,0,53/4,"Binny to Mathews, no run",,"this one swings from middle and leg, and Mathews can't do much more than defend it with respect",4
378,68,Angelo Mathews,49764,Stuart Binny,27223,"Binny to Mathews, no run on a length, middle and leg, defended to mid-on",2nd innings,11.2,no run,53,0,53/4,"Binny to Mathews, no run",,"on a length, middle and leg, defended to mid-on",4
379,69,Angelo Mathews,49764,Stuart Binny,27223,"Binny to Mathews, FOUR runs a desperate shot from Mathews as he jumps out of the crease and gets a thick edge over the slip for four",2nd innings,11.3,four,57,4,57/4,"Binny to Mathews, FOUR runs",,a desperate shot from Mathews as he jumps out of the crease and gets a thick edge over the slip for four,4
380,70,Angelo Mathews,49764,Stuart Binny,27223,"Binny to Mathews, no run bouncer this time, Mathews is a little surprised, and he ducks under it",2nd innings,11.4,no run,57,0,57/4,"Binny to Mathews, no run",,"bouncer this time, Mathews is a little surprised, and he ducks under it",4
381,71,Angelo Mathews,49764,Stuart Binny,27223,"Binny to Mathews, FOUR runs outswinger, middle and leg, just a push from Mathews and he has timed it well to the left of mid-on for four",2nd innings,11.5,four,61,4,61/4,"Binny to Mathews, FOUR runs",,"outswinger, middle and leg, just a push from Mathews and he has timed it well to the left of mid-on for four",4
382,72,Angelo Mathews,49764,Stuart Binny,27223,"Binny to Mathews, 1 run a length ball on middle and off, defended to mid-on for a quick single",2nd innings,11.6,run,62,1,62/4,"Binny to Mathews, 1 run",,"a length ball on middle and off, defended to mid-on for a quick single",4
383,73,Angelo Mathews,49764,Dhawal Kulkarni,277955,"Kulkarni to Mathews, 1 run and immediately a drop in pace. Pushes a length ball outside off for a single to cover",2nd innings,12.1,run,63,1,63/4,"Kulkarni to Mathews, 1 run",,and immediately a drop in pace. Pushes a length ball outside off for a single to cover,4
384,74,Lahiru Thirimanne,301236,Dhawal Kulkarni,277955,"Kulkarni to Thirimanne, 1 run short of a length, angling away, runs it to third man for one",2nd innings,12.2,run,64,1,64/4,"Kulkarni to Thirimanne, 1 run",,"short of a length, angling away, runs it to third man for one",4
385,75,Angelo Mathews,49764,Dhawal Kulkarni,277955,"Kulkarni to Mathews, FOUR runs short of a length, into the legs, and Mathews closes the face at the right time to send it hurrying to square leg for four",2nd innings,12.3,four,68,4,68/4,"Kulkarni to Mathews, FOUR runs",,"short of a length, into the legs, and Mathews closes the face at the right time to send it hurrying to square leg for four",4
386,76,Angelo Mathews,49764,Dhawal Kulkarni,277955,"Kulkarni to Mathews, 1 run short of a length, into the pads again, worked away for a single",2nd innings,12.4,run,69,1,69/4,"Kulkarni to Mathews, 1 run",,"short of a length, into the pads again, worked away for a single",4
387,77,Lahiru Thirimanne,301236,Dhawal Kulkarni,277955,"Kulkarni to Thirimanne, no run short of a length, pitches middle and off, angles away, left alone",2nd innings,12.5,no run,69,0,69/4,"Kulkarni to Thirimanne, no run",,"short of a length, pitches middle and off, angles away, left alone",4
388,78,Lahiru Thirimanne,301236,Dhawal Kulkarni,277955,"Kulkarni to Thirimanne, FOUR runs lovely shot. Kulkarni is short of a length, at a gentle pace, Thirmanne moves across, punches this on the top, sends it past cover",2nd innings,12.6,four,73,4,73/4,"Kulkarni to Thirimanne, FOUR runs",,"lovely shot. Kulkarni is short of a length, at a gentle pace, Thirmanne moves across, punches this on the top, sends it past cover",4
389,79,Angelo Mathews,49764,Karn Sharma,30288,"KV Sharma to Mathews, no run slightly short, Mathews stays back to cut, but can't beat point",2nd innings,13.1,no run,73,0,73/4,"KV Sharma to Mathews, no run",,"slightly short, Mathews stays back to cut, but can't beat point",4
390,80,Angelo Mathews,49764,Karn Sharma,30288,"KV Sharma to Mathews, no run tosses this one up nicely, on off, defended solidly off the frront foot",2nd innings,13.2,no run,73,0,73/4,"KV Sharma to Mathews, no run",,"tosses this one up nicely, on off, defended solidly off the frront foot",4
391,81,Angelo Mathews,49764,Karn Sharma,30288,"KV Sharma to Mathews, 1 run slower through the air, Mathews shimmies down to drive this to long-off for one",2nd innings,13.3,run,74,1,74/4,"KV Sharma to Mathews, 1 run",,"slower through the air, Mathews shimmies down to drive this to long-off for one",4
392,82,Lahiru Thirimanne,301236,Karn Sharma,30288,"KV Sharma to Thirimanne, 2 runs flat, short of a length, Thirmanne stays back to punch him fine of deep point for two",2nd innings,13.4,run,76,2,76/4,"KV Sharma to Thirimanne, 2 runs",,"flat, short of a length, Thirmanne stays back to punch him fine of deep point for two",4
393,83,Lahiru Thirimanne,301236,Karn Sharma,30288,"KV Sharma to Thirimanne, no run flighted outside off, defended off the front foot",2nd innings,13.5,no run,76,0,76/4,"KV Sharma to Thirimanne, no run",,"flighted outside off, defended off the front foot",4
394,84,Lahiru Thirimanne,301236,Karn Sharma,30288,"KV Sharma to Thirimanne, no run slightly short again, but gets some extra bounce, which means Thirmanne can't play the forceful shot he wants to play",2nd innings,13.6,no run,76,0,76/4,"KV Sharma to Thirimanne, no run",,"slightly short again, but gets some extra bounce, which means Thirmanne can't play the forceful shot he wants to play",4
395,85,Angelo Mathews,49764,Dhawal Kulkarni,277955,"Kulkarni to Mathews, no run length ball outside off, driven on the up, but straight to mid-off",2nd innings,14.1,no run,76,0,76/4,"Kulkarni to Mathews, no run",,"length ball outside off, driven on the up, but straight to mid-off",4
396,86,Angelo Mathews,49764,Dhawal Kulkarni,277955,"Kulkarni to Mathews, 1 run short and wide, but he has sweeper cover in place to keep them to one",2nd innings,14.2,run,77,1,77/4,"Kulkarni to Mathews, 1 run",,"short and wide, but he has sweeper cover in place to keep them to one",4
