,ball,batsman,batsman_id,bowler,bowler_id,commentary,innings,overs,playType,runs,runs_scored,score,shortText,speed,text,wickets
163,161,Joe Root,303669,Jeevan Mendis,49700,"BMAJ Mendis to Root, 1 run full length on off stump, driven firmly down to long-on",1st innings,26.5,run,117,1,117/4,"BMAJ Mendis to Root, 1 run",,"full length on off stump, driven firmly down to long-on",4
164,162,Ravi Bopara,10582,Jeevan Mendis,49700,"BMAJ Mendis to Bopara, no run more air, carefully defended in front of middle stumps in the crease",1st innings,26.6,no run,117,0,117/4,"BMAJ Mendis to Bopara, no run",,"more air, carefully defended in front of middle stumps in the crease",4
165,163,Joe Root,303669,Angelo Mathews,49764,"Mathews to Root, OUT full length at the stumps, Root seems to play all around it, huge appeal for lbw and <b>instantly given out</b>. It seemed to be just a straight delivery angled into the stumps, Root was aiming too leg side and when he missed, he was in big trouble, Steve Davis greedily getting his finger up almost before Mathews had the chance to turn around",1st innings,27.1,out,117,0,117/5,"Mathews to Root, OUT",,"full length at the stumps, Root seems to play all around it, huge appeal for lbw and <b>instantly given out</b>. It seemed to be just a straight delivery angled into the stumps, Root was aiming too leg side and when he missed, he was in big trouble, Steve Davis greedily getting his finger up almost before Mathews had the chance to turn around",5
166,163,Jos Buttler,308967,Angelo Mathews,49764,"Mathews to Buttler, 1 wide bumper, easily ducked under",1st innings,27.1,wide,118,1,118/5,"Mathews to Buttler, 1 wide",,"bumper, easily ducked under",5
167,164,Jos Buttler,308967,Angelo Mathews,49764,"Mathews to Buttler, no run full length on the off stump, defended up the wicket",1st innings,27.2,no run,118,0,118/5,"Mathews to Buttler, no run",,"full length on the off stump, defended up the wicket",5
168,165,Jos Buttler,308967,Angelo Mathews,49764,"Mathews to Buttler, no run more of a good length, Buttler defending forward and almost running this back onto his own stumps, manages to kick this away",1st innings,27.3,no run,118,0,118/5,"Mathews to Buttler, no run",,"more of a good length, Buttler defending forward and almost running this back onto his own stumps, manages to kick this away",5
169,166,Jos Buttler,308967,Angelo Mathews,49764,"Mathews to Buttler, no run another calm defensive shot in front of off stump",1st innings,27.4,no run,118,0,118/5,"Mathews to Buttler, no run",,another calm defensive shot in front of off stump,5
170,167,Jos Buttler,308967,Angelo Mathews,49764,"Mathews to Buttler, 1 run poor line drifting down leg but Buttler can only tickle it to long leg",1st innings,27.5,run,119,1,119/5,"Mathews to Buttler, 1 run",,poor line drifting down leg but Buttler can only tickle it to long leg,5
171,168,Ravi Bopara,10582,Angelo Mathews,49764,"Mathews to Bopara, 1 run short and Bopara is hurried into pulling, getting this off the glove down to long leg",1st innings,27.6,run,120,1,120/5,"Mathews to Bopara, 1 run",,"short and Bopara is hurried into pulling, getting this off the glove down to long leg",5
172,169,Ravi Bopara,10582,Jeevan Mendis,49700,"BMAJ Mendis to Bopara, 1 run swept off middle and leg out to deep backward square",1st innings,28.1,run,121,1,121/5,"BMAJ Mendis to Bopara, 1 run",,swept off middle and leg out to deep backward square,5
173,170,Jos Buttler,308967,Jeevan Mendis,49700,"BMAJ Mendis to Buttler, no run waited for and nudged off the back foot to backward point who scrambles to his right and makes a smart save",1st innings,28.2,no run,121,0,121/5,"BMAJ Mendis to Buttler, no run",,waited for and nudged off the back foot to backward point who scrambles to his right and makes a smart save,5
174,171,Jos Buttler,308967,Jeevan Mendis,49700,"BMAJ Mendis to Buttler, 1 run pressed firmly over the top and almost carries this to long-off rushing in",1st innings,28.3,run,122,1,122/5,"BMAJ Mendis to Buttler, 1 run",,pressed firmly over the top and almost carries this to long-off rushing in,5
175,172,Ravi Bopara,10582,Jeevan Mendis,49700,"BMAJ Mendis to Bopara, 1 run sharp single attempted to mid-on and they get home easily, the fielder a little sluggish",1st innings,28.4,run,123,1,123/5,"BMAJ Mendis to Bopara, 1 run",,"sharp single attempted to mid-on and they get home easily, the fielder a little sluggish",5
176,173,Jos Buttler,308967,Jeevan Mendis,49700,"BMAJ Mendis to Buttler, 1 run back and pressing towards mid-on, they take the fielder on again and for a second time get in easily",1st innings,28.5,run,124,1,124/5,"BMAJ Mendis to Buttler, 1 run",,"back and pressing towards mid-on, they take the fielder on again and for a second time get in easily",5
177,174,Ravi Bopara,10582,Jeevan Mendis,49700,"BMAJ Mendis to Bopara, no run waited for and pushed back only as far as the bowler",1st innings,28.6,no run,124,0,124/5,"BMAJ Mendis to Bopara, no run",,waited for and pushed back only as far as the bowler,5
178,175,Jos Buttler,308967,Angelo Mathews,49764,"Mathews to Buttler, no run forward to a ball on off stump, dropped into the covers, nothing available",1st innings,29.1,no run,124,0,124/5,"Mathews to Buttler, no run",,"forward to a ball on off stump, dropped into the covers, nothing available",5
179,176,Jos Buttler,308967,Angelo Mathews,49764,"Mathews to Buttler, 1 run fuller ball, pushed wide enough of mid-off for a quick single",1st innings,29.2,run,125,1,125/5,"Mathews to Buttler, 1 run",,"fuller ball, pushed wide enough of mid-off for a quick single",5
180,177,Ravi Bopara,10582,Angelo Mathews,49764,"Mathews to Bopara, no run change-up towards off stump, Bopara can only fiddle it back to the bowler",1st innings,29.3,no run,125,0,125/5,"Mathews to Bopara, no run",,"change-up towards off stump, Bopara can only fiddle it back to the bowler",5
181,178,Ravi Bopara,10582,Angelo Mathews,49764,"Mathews to Bopara, no run another one, a cutter this, blocked out to Dilshan at backward point, patrolling like a hawk in there",1st innings,29.4,no run,125,0,125/5,"Mathews to Bopara, no run",,"another one, a cutter this, blocked out to Dilshan at backward point, patrolling like a hawk in there",5
182,179,Ravi Bopara,10582,Angelo Mathews,49764,"Mathews to Bopara, no run full sliding down the leg side, clips the pad and Sangakkara gets across to save any extras",1st innings,29.5,no run,125,0,125/5,"Mathews to Bopara, no run",,"full sliding down the leg side, clips the pad and Sangakkara gets across to save any extras",5
183,180,Ravi Bopara,10582,Angelo Mathews,49764,"Mathews to Bopara, 1 run good length just outside off, this is nudged to deep cover for an easy run",1st innings,29.6,run,126,1,126/5,"Mathews to Bopara, 1 run",,"good length just outside off, this is nudged to deep cover for an easy run",5
184,181,Ravi Bopara,10582,Jeevan Mendis,49700,"BMAJ Mendis to Bopara, no run nicely looped up on off stump, draws Bopara forward and he drives to point",1st innings,30.1,no run,126,0,126/5,"BMAJ Mendis to Bopara, no run",,"nicely looped up on off stump, draws Bopara forward and he drives to point",5
185,182,Ravi Bopara,10582,Jeevan Mendis,49700,"BMAJ Mendis to Bopara, no run exposes all his stumps and defends to cover",1st innings,30.2,no run,126,0,126/5,"BMAJ Mendis to Bopara, no run",,exposes all his stumps and defends to cover,5
186,183,Ravi Bopara,10582,Jeevan Mendis,49700,"BMAJ Mendis to Bopara, no run fuller again, opens the face as he drives but again finds point",1st innings,30.3,no run,126,0,126/5,"BMAJ Mendis to Bopara, no run",,"fuller again, opens the face as he drives but again finds point",5
187,184,Ravi Bopara,10582,Jeevan Mendis,49700,"BMAJ Mendis to Bopara, 2 runs paddle-sweeps a straight delivery through short fine-leg and he scampers a second",1st innings,30.4,run,128,2,128/5,"BMAJ Mendis to Bopara, 2 runs",,paddle-sweeps a straight delivery through short fine-leg and he scampers a second,5
188,185,Ravi Bopara,10582,Jeevan Mendis,49700,"BMAJ Mendis to Bopara, 1 run a similar sweep to the previous ball, taken from off stump behind square on the leg side",1st innings,30.5,run,129,1,129/5,"BMAJ Mendis to Bopara, 1 run",,"a similar sweep to the previous ball, taken from off stump behind square on the leg side",5
189,186,Jos Buttler,308967,Jeevan Mendis,49700,"BMAJ Mendis to Buttler, 1 run pushes square to backward point who is quite deep and Bopara spots the chance for a single",1st innings,30.6,run,130,1,130/5,"BMAJ Mendis to Buttler, 1 run",,pushes square to backward point who is quite deep and Bopara spots the chance for a single,5
190,187,Jos Buttler,308967,Dhammika Prasad,50163,"Prasad to Buttler, 2 runs full outside off, driven firmly through the covers and place wide of the sweeper",1st innings,31.1,run,132,2,132/5,"Prasad to Buttler, 2 runs",,"full outside off, driven firmly through the covers and place wide of the sweeper",5
191,188,Jos Buttler,308967,Dhammika Prasad,50163,"Prasad to Buttler, no run full on off stump, bat and pad together as he defends",1st innings,31.2,no run,132,0,132/5,"Prasad to Buttler, no run",,"full on off stump, bat and pad together as he defends",5
192,189,Jos Buttler,308967,Dhammika Prasad,50163,"Prasad to Buttler, no run lovely delivery, draws him forward outside off and moves off the seam to beat the outside edge",1st innings,31.3,no run,132,0,132/5,"Prasad to Buttler, no run",,"lovely delivery, draws him forward outside off and moves off the seam to beat the outside edge",5
193,190,Jos Buttler,308967,Dhammika Prasad,50163,"Prasad to Buttler, OUT well, Buttler won't be targetting Prasad. He's fallen to him for the second time in two innings. And in very similar manner, getting an inside edge on a length delivery which cannons into the stumps",1st innings,31.4,out,132,0,132/6,"Prasad to Buttler, OUT",,"well, Buttler won't be targetting Prasad. He's fallen to him for the second time in two innings. And in very similar manner, getting an inside edge on a length delivery which cannons into the stumps",6
194,191,Chris Woakes,247235,Dhammika Prasad,50163,"Prasad to Woakes, no run full outside off, left alone, good carry through the keeper...after waiting a long time to bowl, he's been right on the money",1st innings,31.5,no run,132,0,132/6,"Prasad to Woakes, no run",,"full outside off, left alone, good carry through the keeper...after waiting a long time to bowl, he's been right on the money",6
195,192,Chris Woakes,247235,Dhammika Prasad,50163,"Prasad to Woakes, no run another one through the keeper, excellent over",1st innings,31.6,no run,132,0,132/6,"Prasad to Woakes, no run",,"another one through the keeper, excellent over",6
196,193,Ravi Bopara,10582,Jeevan Mendis,49700,"BMAJ Mendis to Bopara, 1 run he likes the paddle-sweep today - England's players always like the sweep - and helps it to deep square",1st innings,32.1,run,133,1,133/6,"BMAJ Mendis to Bopara, 1 run",,he likes the paddle-sweep today - England's players always like the sweep - and helps it to deep square,6
197,194,Chris Woakes,247235,Jeevan Mendis,49700,"BMAJ Mendis to Woakes, no run forward on off stump, defended",1st innings,32.2,no run,133,0,133/6,"BMAJ Mendis to Woakes, no run",,"forward on off stump, defended",6
198,195,Chris Woakes,247235,Jeevan Mendis,49700,"BMAJ Mendis to Woakes, 1 run driven down the ground to long off",1st innings,32.3,run,134,1,134/6,"BMAJ Mendis to Woakes, 1 run",,driven down the ground to long off,6
199,196,Ravi Bopara,10582,Jeevan Mendis,49700,"BMAJ Mendis to Bopara, 1 run shorter outside off, doesn't really come into the bat as Bopara cuts to the cover sweeper",1st innings,32.4,run,135,1,135/6,"BMAJ Mendis to Bopara, 1 run",,"shorter outside off, doesn't really come into the bat as Bopara cuts to the cover sweeper",6
200,197,Chris Woakes,247235,Jeevan Mendis,49700,"BMAJ Mendis to Woakes, no run spins away quite wide of Woakes, he drives off the back foot and finds the energetic Dilshan at cover",1st innings,32.5,no run,135,0,135/6,"BMAJ Mendis to Woakes, no run",,"spins away quite wide of Woakes, he drives off the back foot and finds the energetic Dilshan at cover",6
201,198,Chris Woakes,247235,Jeevan Mendis,49700,"BMAJ Mendis to Woakes, no run again he picks out cover from a delivery that should have gone for runs",1st innings,32.6,no run,135,0,135/6,"BMAJ Mendis to Woakes, no run",,again he picks out cover from a delivery that should have gone for runs,6
202,199,Ravi Bopara,10582,Dhammika Prasad,50163,"Prasad to Bopara, 1 run comes onto the front foot and drives this to deep cover",1st innings,33.1,run,136,1,136/6,"Prasad to Bopara, 1 run",,comes onto the front foot and drives this to deep cover,6
203,200,Chris Woakes,247235,Dhammika Prasad,50163,"Prasad to Woakes, 1 run <b>dropped</b> by Sangakkara, although not sure Woakes edged it...he drove over a full delivery, Sanga couldn't gather it and no signal from umpire Davis. Would have been an interesting review, looks like bat hit ground",1st innings,33.2,run,137,1,137/6,"Prasad to Woakes, 1 run",,"<b>dropped</b> by Sangakkara, although not sure Woakes edged it...he drove over a full delivery, Sanga couldn't gather it and no signal from umpire Davis. Would have been an interesting review, looks like bat hit ground",6
204,201,Ravi Bopara,10582,Dhammika Prasad,50163,"Prasad to Bopara, no run lovely stuff, nips away off the seam and zips past the outside edge",1st innings,33.3,no run,137,0,137/6,"Prasad to Bopara, no run",,"lovely stuff, nips away off the seam and zips past the outside edge",6
205,202,Ravi Bopara,10582,Dhammika Prasad,50163,"Prasad to Bopara, no run fuller, he walks into the shot and punches to cover",1st innings,33.4,no run,137,0,137/6,"Prasad to Bopara, no run",,"fuller, he walks into the shot and punches to cover",6
206,203,Ravi Bopara,10582,Dhammika Prasad,50163,"Prasad to Bopara, no run can't pierce the off-side field as he drives a full delivery off the bottom of the bat to mid-off",1st innings,33.5,no run,137,0,137/6,"Prasad to Bopara, no run",,can't pierce the off-side field as he drives a full delivery off the bottom of the bat to mid-off,6
207,204,Ravi Bopara,10582,Dhammika Prasad,50163,"Prasad to Bopara, 1 run finds mid-off again, initially the single was cut-off but the shy at the stumps ricochets away for an overthrow...or 'buzzers'",1st innings,33.6,run,138,1,138/6,"Prasad to Bopara, 1 run",,"finds mid-off again, initially the single was cut-off but the shy at the stumps ricochets away for an overthrow...or 'buzzers'",6
208,205,Ravi Bopara,10582,Rangana Herath,49178,"Herath to Bopara, 1 run round the wicket, floated up full, driven down the ground",1st innings,34.1,run,139,1,139/6,"Herath to Bopara, 1 run",,"round the wicket, floated up full, driven down the ground",6
209,206,Chris Woakes,247235,Rangana Herath,49178,"Herath to Woakes, 1 leg bye angled into the pads, glances off square of the wicket...Sangakkara sprints after it",1st innings,34.2,leg bye,140,1,140/6,"Herath to Woakes, 1 leg bye",,"angled into the pads, glances off square of the wicket...Sangakkara sprints after it",6
210,207,Ravi Bopara,10582,Rangana Herath,49178,"Herath to Bopara, 1 run full and straight, swept firmly to deep square",1st innings,34.3,run,141,1,141/6,"Herath to Bopara, 1 run",,"full and straight, swept firmly to deep square",6
211,208,Chris Woakes,247235,Rangana Herath,49178,"Herath to Woakes, no run this one grips and turns past the outside edge as Woakes presses forward",1st innings,34.4,no run,141,0,141/6,"Herath to Woakes, no run",,this one grips and turns past the outside edge as Woakes presses forward,6
212,209,Chris Woakes,247235,Rangana Herath,49178,"Herath to Woakes, 1 run comes down the pitch, bunts down to long off",1st innings,34.5,run,142,1,142/6,"Herath to Woakes, 1 run",,"comes down the pitch, bunts down to long off",6
213,210,Ravi Bopara,10582,Rangana Herath,49178,"Herath to Bopara, 1 run opens the face to place this out to deep cover",1st innings,34.6,run,143,1,143/6,"Herath to Bopara, 1 run",,opens the face to place this out to deep cover,6
214,211,Ravi Bopara,10582,Dhammika Prasad,50163,"Prasad to Bopara, no run good work by Prasad in his follow through as he intercepts the punch-drive...Bopara had already set off for a run, but managed to abort",1st innings,35.1,no run,143,0,143/6,"Prasad to Bopara, no run",,"good work by Prasad in his follow through as he intercepts the punch-drive...Bopara had already set off for a run, but managed to abort",6
215,212,Ravi Bopara,10582,Dhammika Prasad,50163,"Prasad to Bopara, no run he throws his arms at a wide delivery, aiming for a drive on the up, but doesn't make any contact...more shape away from Prasad",1st innings,35.2,no run,143,0,143/6,"Prasad to Bopara, no run",,"he throws his arms at a wide delivery, aiming for a drive on the up, but doesn't make any contact...more shape away from Prasad",6
216,213,Ravi Bopara,10582,Dhammika Prasad,50163,"Prasad to Bopara, no run drives on the up again, reasonable connection this time but finds cover",1st innings,35.3,no run,143,0,143/6,"Prasad to Bopara, no run",,"drives on the up again, reasonable connection this time but finds cover",6
217,214,Ravi Bopara,10582,Dhammika Prasad,50163,"Prasad to Bopara, no run can't thread the needle, drives off the front foot but finds one of the cover ring",1st innings,35.4,no run,143,0,143/6,"Prasad to Bopara, no run",,"can't thread the needle, drives off the front foot but finds one of the cover ring",6
218,214,Ravi Bopara,10582,Dhammika Prasad,50163,"Prasad to Bopara, (no ball) 1 run ooh, this one slips out as a big full toss which Bopara manages to deflect down to third man...perhaps an attempted slower ball. Called a no-ball for height",1st innings,35.4,run,145,2,145/6,"Prasad to Bopara, (no ball) 1 run",,"ooh, this one slips out as a big full toss which Bopara manages to deflect down to third man...perhaps an attempted slower ball. Called a no-ball for height",6
219,215,Chris Woakes,247235,Dhammika Prasad,50163,"Prasad to Woakes, FOUR runs full outside off, a controlled edge down to third man and the boundary drought is broken courtesy of a misfield which parries the ball over the rope. Rare error from Sri Lanka in the field",1st innings,35.5,four,149,4,149/6,"Prasad to Woakes, FOUR runs",,"full outside off, a controlled edge down to third man and the boundary drought is broken courtesy of a misfield which parries the ball over the rope. Rare error from Sri Lanka in the field",6
220,216,Chris Woakes,247235,Dhammika Prasad,50163,"Prasad to Woakes, no run play and miss outside off, ball doesn't reach Sangakkara on the full",1st innings,35.6,no run,149,0,149/6,"Prasad to Woakes, no run",,"play and miss outside off, ball doesn't reach Sangakkara on the full",6
221,217,Ravi Bopara,10582,Rangana Herath,49178,"Herath to Bopara, no run full and straight, sweeps to short fine-leg",1st innings,36.1,no run,149,0,149/6,"Herath to Bopara, no run",,"full and straight, sweeps to short fine-leg",6
222,218,Ravi Bopara,10582,Rangana Herath,49178,"Herath to Bopara, no run defended back to the bowler",1st innings,36.2,no run,149,0,149/6,"Herath to Bopara, no run",,defended back to the bowler,6
223,219,Ravi Bopara,10582,Rangana Herath,49178,"Herath to Bopara, 1 run stays leg-side of the ball, opens the face and dabs into the covers",1st innings,36.3,run,150,1,150/6,"Herath to Bopara, 1 run",,"stays leg-side of the ball, opens the face and dabs into the covers",6
224,220,Chris Woakes,247235,Rangana Herath,49178,"Herath to Woakes, 1 run a good stride forward and a gentle push down the ground",1st innings,36.4,run,151,1,151/6,"Herath to Woakes, 1 run",,a good stride forward and a gentle push down the ground,6
225,221,Ravi Bopara,10582,Rangana Herath,49178,"Herath to Bopara, 1 run greater aggression this time, down the pitch and drills it along the ground to mid-on",1st innings,36.5,run,152,1,152/6,"Herath to Bopara, 1 run",,"greater aggression this time, down the pitch and drills it along the ground to mid-on",6
226,222,Chris Woakes,247235,Rangana Herath,49178,"Herath to Woakes, 1 run worked off the stumps into midwicket",1st innings,36.6,run,153,1,153/6,"Herath to Woakes, 1 run",,worked off the stumps into midwicket,6
227,223,Chris Woakes,247235,Ajantha Mendis,268739,"BAW Mendis to Woakes, 1 run full on middle, takes an inside edge into square leg",1st innings,37.1,run,154,1,154/6,"BAW Mendis to Woakes, 1 run",,"full on middle, takes an inside edge into square leg",6
228,224,Ravi Bopara,10582,Ajantha Mendis,268739,"BAW Mendis to Bopara, 2 runs strong shot, drives sweetly straight down the ground - just past the on side of the stumps - and there's more good fielding as Jeevan Mendis dives around the boundary",1st innings,37.2,run,156,2,156/6,"BAW Mendis to Bopara, 2 runs",,"strong shot, drives sweetly straight down the ground - just past the on side of the stumps - and there's more good fielding as Jeevan Mendis dives around the boundary",6
229,225,Ravi Bopara,10582,Ajantha Mendis,268739,"BAW Mendis to Bopara, 2 runs well placed into the leg side, good weighting off the clip so it bisects deep midwicket and long on",1st innings,37.3,run,158,2,158/6,"BAW Mendis to Bopara, 2 runs",,"well placed into the leg side, good weighting off the clip so it bisects deep midwicket and long on",6
230,226,Ravi Bopara,10582,Ajantha Mendis,268739,"BAW Mendis to Bopara, no run pats this back down the pitch",1st innings,37.4,no run,158,0,158/6,"BAW Mendis to Bopara, no run",,pats this back down the pitch,6
231,227,Ravi Bopara,10582,Ajantha Mendis,268739,"BAW Mendis to Bopara, 1 run moves across his stumps then nudges off his pads to square leg",1st innings,37.5,run,159,1,159/6,"BAW Mendis to Bopara, 1 run",,moves across his stumps then nudges off his pads to square leg,6
232,228,Chris Woakes,247235,Ajantha Mendis,268739,"BAW Mendis to Woakes, FOUR runs a bonus boundary as Woakes drives at a wider delivery and gets a bottom edge through the legs of Sangakkara. Jayawardene chases hard from slip but can't quite flick it back, he signals that it hit the rope",1st innings,37.6,four,163,4,163/6,"BAW Mendis to Woakes, FOUR runs",,"a bonus boundary as Woakes drives at a wider delivery and gets a bottom edge through the legs of Sangakkara. Jayawardene chases hard from slip but can't quite flick it back, he signals that it hit the rope",6
233,229,Ravi Bopara,10582,Rangana Herath,49178,"Herath to Bopara, no run drives on the up, and in the air, but it falls short of mid-off",1st innings,38.1,no run,163,0,163/6,"Herath to Bopara, no run",,"drives on the up, and in the air, but it falls short of mid-off",6
234,230,Ravi Bopara,10582,Rangana Herath,49178,"Herath to Bopara, 1 run down the pitch again, makes it a very full delivery and clubs towards deepish mid-on",1st innings,38.2,run,164,1,164/6,"Herath to Bopara, 1 run",,"down the pitch again, makes it a very full delivery and clubs towards deepish mid-on",6
235,231,Chris Woakes,247235,Rangana Herath,49178,"Herath to Woakes, no run defended to short cover",1st innings,38.3,no run,164,0,164/6,"Herath to Woakes, no run",,defended to short cover,6
236,232,Chris Woakes,247235,Rangana Herath,49178,"Herath to Woakes, 1 run drives out to deep cover",1st innings,38.4,run,165,1,165/6,"Herath to Woakes, 1 run",,drives out to deep cover,6
237,233,Ravi Bopara,10582,Rangana Herath,49178,"Herath to Bopara, 1 run skipping out of his crease and but this takes the bottom of the bat towards long off",1st innings,38.5,run,166,1,166/6,"Herath to Bopara, 1 run",,skipping out of his crease and but this takes the bottom of the bat towards long off,6
238,234,Chris Woakes,247235,Rangana Herath,49178,"Herath to Woakes, no run down the pitch on the line of leg stump to try and open the off side but finds short cover",1st innings,38.6,no run,166,0,166/6,"Herath to Woakes, no run",,down the pitch on the line of leg stump to try and open the off side but finds short cover,6
239,235,Ravi Bopara,10582,Ajantha Mendis,268739,"BAW Mendis to Bopara, 2 runs short of a length and heaved through the leg side with a pull-whip shot, wide of deep midwicket",1st innings,39.1,run,168,2,168/6,"BAW Mendis to Bopara, 2 runs",,"short of a length and heaved through the leg side with a pull-whip shot, wide of deep midwicket",6
240,236,Ravi Bopara,10582,Ajantha Mendis,268739,"BAW Mendis to Bopara, 2 runs <b>dropped</b>, and was Mathews put off by Thisara Perera? Bopara top-edged a short delivery, basically a long hop, as he went for the pull...Mathews tracked back from short fine-leg and Perera was running in, probably got into the corner of the captain's eye. He pull off a full-length dive and it didn't stick",1st innings,39.2,run,170,2,170/6,"BAW Mendis to Bopara, 2 runs",,"<b>dropped</b>, and was Mathews put off by Thisara Perera? Bopara top-edged a short delivery, basically a long hop, as he went for the pull...Mathews tracked back from short fine-leg and Perera was running in, probably got into the corner of the captain's eye. He pull off a full-length dive and it didn't stick",6
241,237,Ravi Bopara,10582,Ajantha Mendis,268739,"BAW Mendis to Bopara, 2 runs driven strong through the off side",1st innings,39.3,run,172,2,172/6,"BAW Mendis to Bopara, 2 runs",,driven strong through the off side,6
242,238,Ravi Bopara,10582,Ajantha Mendis,268739,"BAW Mendis to Bopara, 1 run dabbed off the pads to short fine-leg",1st innings,39.4,run,173,1,173/6,"BAW Mendis to Bopara, 1 run",,dabbed off the pads to short fine-leg,6
