,ball,batsman,batsman_id,bowler,bowler_id,commentary,innings,overs,playType,runs,runs_scored,score,shortText,speed,text,wickets
399,88,Ahmed Shehzad,259410,Alex Cusack,293983,"Cusack to Ahmed Shehzad, 1 run short of a length, angling in, lazy push by Shehzad, gets a single off the inside edge",2nd innings,14.4,run,87,1,87/0,"Cusack to Ahmed Shehzad, 1 run",,"short of a length, angling in, lazy push by Shehzad, gets a single off the inside edge",0
400,89,Sarfaraz Ahmed,227760,Alex Cusack,293983,"Cusack to Sarfraz Ahmed, 1 run short and wide, cut away to third man for one",2nd innings,14.5,run,88,1,88/0,"Cusack to Sarfraz Ahmed, 1 run",,"short and wide, cut away to third man for one",0
401,90,Ahmed Shehzad,259410,Alex Cusack,293983,"Cusack to Ahmed Shehzad, 1 run steers this down to third man for a single",2nd innings,14.6,run,89,1,89/0,"Cusack to Ahmed Shehzad, 1 run",,steers this down to third man for a single,0
402,91,Ahmed Shehzad,259410,Kevin O'Brien,24605,"KJ O'Brien to Ahmed Shehzad, no run full and straight, pushed back to O'Brien",2nd innings,15.1,no run,89,0,89/0,"KJ O'Brien to Ahmed Shehzad, no run",,"full and straight, pushed back to O'Brien",0
403,92,Ahmed Shehzad,259410,Kevin O'Brien,24605,"KJ O'Brien to Ahmed Shehzad, 1 run wide length ball, driven square for a single to third man",2nd innings,15.2,run,90,1,90/0,"KJ O'Brien to Ahmed Shehzad, 1 run",,"wide length ball, driven square for a single to third man",0
404,93,Sarfaraz Ahmed,227760,Kevin O'Brien,24605,"KJ O'Brien to Sarfraz Ahmed, no run bouncer with the keeper up. That's not very generous on Wilson. Sarfraz bails out of this ramp at the last moment",2nd innings,15.3,no run,90,0,90/0,"KJ O'Brien to Sarfraz Ahmed, no run",,bouncer with the keeper up. That's not very generous on Wilson. Sarfraz bails out of this ramp at the last moment,0
405,94,Sarfaraz Ahmed,227760,Kevin O'Brien,24605,"KJ O'Brien to Sarfraz Ahmed, no run <b>dropped him</b>. A little legcutter from O'Brien. Short of a length, moves away, takes the edge, goes straight into Wilson's gloves but doesn't settle there. Biggish deflection so not quite an easy chance",2nd innings,15.4,no run,90,0,90/0,"KJ O'Brien to Sarfraz Ahmed, no run",,"<b>dropped him</b>. A little legcutter from O'Brien. Short of a length, moves away, takes the edge, goes straight into Wilson's gloves but doesn't settle there. Biggish deflection so not quite an easy chance",0
406,95,Sarfaraz Ahmed,227760,Kevin O'Brien,24605,"KJ O'Brien to Sarfraz Ahmed, 2 runs angling in, worked fine of fine leg",2nd innings,15.5,run,92,2,92/0,"KJ O'Brien to Sarfraz Ahmed, 2 runs",,"angling in, worked fine of fine leg",0
407,96,Sarfaraz Ahmed,227760,Kevin O'Brien,24605,"KJ O'Brien to Sarfraz Ahmed, 1 run length ball, on the pads, worked away to fine leg for one",2nd innings,15.6,run,93,1,93/0,"KJ O'Brien to Sarfraz Ahmed, 1 run",,"length ball, on the pads, worked away to fine leg for one",0
408,97,Sarfaraz Ahmed,227760,Alex Cusack,293983,"Cusack to Sarfraz Ahmed, 1 run short of a length, angling in, worked away to leg",2nd innings,16.1,run,94,1,94/0,"Cusack to Sarfraz Ahmed, 1 run",,"short of a length, angling in, worked away to leg",0
409,98,Ahmed Shehzad,259410,Alex Cusack,293983,"Cusack to Ahmed Shehzad, 1 run half-volley outside leg, clipped away for a single that brings up his fifty in a crucial chase",2nd innings,16.2,run,95,1,95/0,"Cusack to Ahmed Shehzad, 1 run",,"half-volley outside leg, clipped away for a single that brings up his fifty in a crucial chase",0
410,99,Sarfaraz Ahmed,227760,Alex Cusack,293983,"Cusack to Sarfraz Ahmed, no run short of a length, looks to punch this, is beaten",2nd innings,16.3,no run,95,0,95/0,"Cusack to Sarfraz Ahmed, no run",,"short of a length, looks to punch this, is beaten",0
411,100,Sarfaraz Ahmed,227760,Alex Cusack,293983,"Cusack to Sarfraz Ahmed, no run full, angling in, pushed to that short mid-on",2nd innings,16.4,no run,95,0,95/0,"Cusack to Sarfraz Ahmed, no run",,"full, angling in, pushed to that short mid-on",0
412,101,Sarfaraz Ahmed,227760,Alex Cusack,293983,"Cusack to Sarfraz Ahmed, no run full, outside off, driven to mid-off this time",2nd innings,16.5,no run,95,0,95/0,"Cusack to Sarfraz Ahmed, no run",,"full, outside off, driven to mid-off this time",0
413,102,Sarfaraz Ahmed,227760,Alex Cusack,293983,"Cusack to Sarfraz Ahmed, 1 run short of a length, angling in, he opens the face late, takes a single to third man",2nd innings,16.6,run,96,1,96/0,"Cusack to Sarfraz Ahmed, 1 run",,"short of a length, angling in, he opens the face late, takes a single to third man",0
414,103,Sarfaraz Ahmed,227760,Kevin O'Brien,24605,"KJ O'Brien to Sarfraz Ahmed, no run looks to ramp this short ball towards third man, but is beaten",2nd innings,17.1,no run,96,0,96/0,"KJ O'Brien to Sarfraz Ahmed, no run",,"looks to ramp this short ball towards third man, but is beaten",0
415,104,Sarfaraz Ahmed,227760,Kevin O'Brien,24605,"KJ O'Brien to Sarfraz Ahmed, no run on a length, just outside off, opens the face, can't beat point",2nd innings,17.2,no run,96,0,96/0,"KJ O'Brien to Sarfraz Ahmed, no run",,"on a length, just outside off, opens the face, can't beat point",0
416,105,Sarfaraz Ahmed,227760,Kevin O'Brien,24605,"KJ O'Brien to Sarfraz Ahmed, 2 runs puled away in the air, agonisingly wide of short midwicket. Agonising for Ireland, that is",2nd innings,17.3,run,98,2,98/0,"KJ O'Brien to Sarfraz Ahmed, 2 runs",,"puled away in the air, agonisingly wide of short midwicket. Agonising for Ireland, that is",0
417,106,Sarfaraz Ahmed,227760,Kevin O'Brien,24605,"KJ O'Brien to Sarfraz Ahmed, 1 run short of a length, drops this n front of point and takes a single. This is what didn't happen in Sarfraz's absence",2nd innings,17.4,run,99,1,99/0,"KJ O'Brien to Sarfraz Ahmed, 1 run",,"short of a length, drops this n front of point and takes a single. This is what didn't happen in Sarfraz's absence",0
418,107,Ahmed Shehzad,259410,Kevin O'Brien,24605,"KJ O'Brien to Ahmed Shehzad, no run bouncer, pretty sharp, just outside off, left alone",2nd innings,17.5,no run,99,0,99/0,"KJ O'Brien to Ahmed Shehzad, no run",,"bouncer, pretty sharp, just outside off, left alone",0
419,108,Ahmed Shehzad,259410,Kevin O'Brien,24605,"KJ O'Brien to Ahmed Shehzad, no run on a length, angling in, pushed to mid-on",2nd innings,17.6,no run,99,0,99/0,"KJ O'Brien to Ahmed Shehzad, no run",,"on a length, angling in, pushed to mid-on",0
420,109,Sarfaraz Ahmed,227760,Stuart Thompson,414821,"Thompson to Sarfraz Ahmed, 1 run wide length ball, pushed to deep cover for one that brings up the 100-run stand. Great news for Pakistan",2nd innings,18.1,run,100,1,100/0,"Thompson to Sarfraz Ahmed, 1 run",,"wide length ball, pushed to deep cover for one that brings up the 100-run stand. Great news for Pakistan",0
421,110,Ahmed Shehzad,259410,Stuart Thompson,414821,"Thompson to Ahmed Shehzad, no run short and wide, but cut away straight to point",2nd innings,18.2,no run,100,0,100/0,"Thompson to Ahmed Shehzad, no run",,"short and wide, but cut away straight to point",0
422,111,Ahmed Shehzad,259410,Stuart Thompson,414821,"Thompson to Ahmed Shehzad, 1 run length ball, angling in, moves inside the line to work this for one",2nd innings,18.3,run,101,1,101/0,"Thompson to Ahmed Shehzad, 1 run",,"length ball, angling in, moves inside the line to work this for one",0
423,112,Sarfaraz Ahmed,227760,Stuart Thompson,414821,"Thompson to Sarfraz Ahmed, 1 run short of a length, on off, worked to square leg for one",2nd innings,18.4,run,102,1,102/0,"Thompson to Sarfraz Ahmed, 1 run",,"short of a length, on off, worked to square leg for one",0
424,113,Ahmed Shehzad,259410,Stuart Thompson,414821,"Thompson to Ahmed Shehzad, 1 run short of a length, angling in, worked away for a single to square leg",2nd innings,18.5,run,103,1,103/0,"Thompson to Ahmed Shehzad, 1 run",,"short of a length, angling in, worked away for a single to square leg",0
425,114,Sarfaraz Ahmed,227760,Stuart Thompson,414821,"Thompson to Sarfraz Ahmed, 2 runs wide half-volley, squeezed out in front of third man for a couple",2nd innings,18.6,run,105,2,105/0,"Thompson to Sarfraz Ahmed, 2 runs",,"wide half-volley, squeezed out in front of third man for a couple",0
426,115,Ahmed Shehzad,259410,Kevin O'Brien,24605,"KJ O'Brien to Ahmed Shehzad, no run moves his back foot across, O'brien bowls the bouncer, outside off, left alone",2nd innings,19.1,no run,105,0,105/0,"KJ O'Brien to Ahmed Shehzad, no run",,"moves his back foot across, O'brien bowls the bouncer, outside off, left alone",0
427,116,Ahmed Shehzad,259410,Kevin O'Brien,24605,"KJ O'Brien to Ahmed Shehzad, FOUR runs short and wide, and cut away in front of point. Deep cover Mooney misfields, and allows three extra runs",2nd innings,19.2,four,109,4,109/0,"KJ O'Brien to Ahmed Shehzad, FOUR runs",,"short and wide, and cut away in front of point. Deep cover Mooney misfields, and allows three extra runs",0
428,117,Ahmed Shehzad,259410,Kevin O'Brien,24605,"KJ O'Brien to Ahmed Shehzad, no run on a length, just outside off, a legcutter. Defended from the crease",2nd innings,19.3,no run,109,0,109/0,"KJ O'Brien to Ahmed Shehzad, no run",,"on a length, just outside off, a legcutter. Defended from the crease",0
429,118,Ahmed Shehzad,259410,Kevin O'Brien,24605,"KJ O'Brien to Ahmed Shehzad, no run slower ball again, on off, defended from the crease",2nd innings,19.4,no run,109,0,109/0,"KJ O'Brien to Ahmed Shehzad, no run",,"slower ball again, on off, defended from the crease",0
430,119,Ahmed Shehzad,259410,Kevin O'Brien,24605,"KJ O'Brien to Ahmed Shehzad, 1 run pulled away in front of square. Rolls his wrists to keep it down",2nd innings,19.5,run,110,1,110/0,"KJ O'Brien to Ahmed Shehzad, 1 run",,pulled away in front of square. Rolls his wrists to keep it down,0
431,120,Sarfaraz Ahmed,227760,Kevin O'Brien,24605,"KJ O'Brien to Sarfraz Ahmed, 1 run slower legcutter, steers this down to third man to bring up his fifty. What an addition he has been to this XI",2nd innings,19.6,run,111,1,111/0,"KJ O'Brien to Sarfraz Ahmed, 1 run",,"slower legcutter, steers this down to third man to bring up his fifty. What an addition he has been to this XI",0
432,121,Sarfaraz Ahmed,227760,Stuart Thompson,414821,"Thompson to Sarfraz Ahmed, no run short of a length, just outside off, punched to point",2nd innings,20.1,no run,111,0,111/0,"Thompson to Sarfraz Ahmed, no run",,"short of a length, just outside off, punched to point",0
433,122,Sarfaraz Ahmed,227760,Stuart Thompson,414821,"Thompson to Sarfraz Ahmed, no run short of a length, just outside off, defended to point",2nd innings,20.2,no run,111,0,111/0,"Thompson to Sarfraz Ahmed, no run",,"short of a length, just outside off, defended to point",0
434,123,Sarfaraz Ahmed,227760,Stuart Thompson,414821,"Thompson to Sarfraz Ahmed, no run driven on the up, but straight to mid-on",2nd innings,20.3,no run,111,0,111/0,"Thompson to Sarfraz Ahmed, no run",,"driven on the up, but straight to mid-on",0
435,124,Sarfaraz Ahmed,227760,Stuart Thompson,414821,"Thompson to Sarfraz Ahmed, no run short of a length, looks to run this down to third man, but the ball skids off and beats him for pace",2nd innings,20.4,no run,111,0,111/0,"Thompson to Sarfraz Ahmed, no run",,"short of a length, looks to run this down to third man, but the ball skids off and beats him for pace",0
436,125,Sarfaraz Ahmed,227760,Stuart Thompson,414821,"Thompson to Sarfraz Ahmed, 3 runs short and wide, deliberately bunted over point for three",2nd innings,20.5,run,114,3,114/0,"Thompson to Sarfraz Ahmed, 3 runs",,"short and wide, deliberately bunted over point for three",0
437,126,Ahmed Shehzad,259410,Stuart Thompson,414821,"Thompson to Ahmed Shehzad, 1 run short of a length, into the pads, tucked away for a single",2nd innings,20.6,run,115,1,115/0,"Thompson to Ahmed Shehzad, 1 run",,"short of a length, into the pads, tucked away for a single",0
438,127,Ahmed Shehzad,259410,Kevin O'Brien,24605,"KJ O'Brien to Ahmed Shehzad, no run short of a length, wide, punched on the up, but can't beat point",2nd innings,21.1,no run,115,0,115/0,"KJ O'Brien to Ahmed Shehzad, no run",,"short of a length, wide, punched on the up, but can't beat point",0
439,128,Ahmed Shehzad,259410,Kevin O'Brien,24605,"KJ O'Brien to Ahmed Shehzad, no run bouncer, just outside off, sways out of its line",2nd innings,21.2,no run,115,0,115/0,"KJ O'Brien to Ahmed Shehzad, no run",,"bouncer, just outside off, sways out of its line",0
440,129,Ahmed Shehzad,259410,Kevin O'Brien,24605,"KJ O'Brien to Ahmed Shehzad, no run on a length, outside off, defended to cover",2nd innings,21.3,no run,115,0,115/0,"KJ O'Brien to Ahmed Shehzad, no run",,"on a length, outside off, defended to cover",0
441,130,Ahmed Shehzad,259410,Kevin O'Brien,24605,"KJ O'Brien to Ahmed Shehzad, 1 run pulled away to deep midwicket for one",2nd innings,21.4,run,116,1,116/0,"KJ O'Brien to Ahmed Shehzad, 1 run",,pulled away to deep midwicket for one,0
442,131,Sarfaraz Ahmed,227760,Kevin O'Brien,24605,"KJ O'Brien to Sarfraz Ahmed, no run slower ball, driven uppishly, on the first bounce to mid-off",2nd innings,21.5,no run,116,0,116/0,"KJ O'Brien to Sarfraz Ahmed, no run",,"slower ball, driven uppishly, on the first bounce to mid-off",0
443,132,Sarfaraz Ahmed,227760,Kevin O'Brien,24605,"KJ O'Brien to Sarfraz Ahmed, no run pulled down, to short midwicket",2nd innings,21.6,no run,116,0,116/0,"KJ O'Brien to Sarfraz Ahmed, no run",,"pulled down, to short midwicket",0
444,133,Ahmed Shehzad,259410,Stuart Thompson,414821,"Thompson to Ahmed Shehzad, no run driven on the up, but straight to mid-off",2nd innings,22.1,no run,116,0,116/0,"Thompson to Ahmed Shehzad, no run",,"driven on the up, but straight to mid-off",0
445,134,Ahmed Shehzad,259410,Stuart Thompson,414821,"Thompson to Ahmed Shehzad, FOUR runs mid-on is up, he takes him on by charging at him and chipping this shortish ball over mid-on",2nd innings,22.2,four,120,4,120/0,"Thompson to Ahmed Shehzad, FOUR runs",,"mid-on is up, he takes him on by charging at him and chipping this shortish ball over mid-on",0
446,135,Ahmed Shehzad,259410,Stuart Thompson,414821,"Thompson to Ahmed Shehzad, no run driven hard back at him, and he fields well in the follow-through",2nd innings,22.3,no run,120,0,120/0,"Thompson to Ahmed Shehzad, no run",,"driven hard back at him, and he fields well in the follow-through",0
447,136,Ahmed Shehzad,259410,Stuart Thompson,414821,"Thompson to Ahmed Shehzad, OUT and Shehzad has thrown it away. Seems like he has made his mind beforehand that this ball has to go. Thompson bowls short, he pulls from outside off, gets a top edge, and mid-on catches it. He is disappointed that he has not gone on to score a hundred, and so he should be",2nd innings,22.4,out,120,0,120/1,"Thompson to Ahmed Shehzad, OUT",,"and Shehzad has thrown it away. Seems like he has made his mind beforehand that this ball has to go. Thompson bowls short, he pulls from outside off, gets a top edge, and mid-on catches it. He is disappointed that he has not gone on to score a hundred, and so he should be",1
448,137,Sarfaraz Ahmed,227760,Stuart Thompson,414821,"Thompson to Sarfraz Ahmed, 1 run full, angling in, pushed wide of mid-on",2nd innings,22.5,run,121,1,121/1,"Thompson to Sarfraz Ahmed, 1 run",,"full, angling in, pushed wide of mid-on",1
449,138,Haris Sohail,318788,Stuart Thompson,414821,"Thompson to Haris Sohail, 2 runs short of a length, angling in, he works it wide of deep midwicket to get off the mark with a couple",2nd innings,22.6,run,123,2,123/1,"Thompson to Haris Sohail, 2 runs",,"short of a length, angling in, he works it wide of deep midwicket to get off the mark with a couple",1
450,139,Sarfaraz Ahmed,227760,Paul Stirling,303427,"Stirling to Sarfraz Ahmed, 1 run full ball, driven to long-on for one",2nd innings,23.1,run,124,1,124/1,"Stirling to Sarfraz Ahmed, 1 run",,"full ball, driven to long-on for one",1
451,140,Haris Sohail,318788,Paul Stirling,303427,"Stirling to Haris Sohail, no run full, outside off, no turn, defended back to him",2nd innings,23.2,no run,124,0,124/1,"Stirling to Haris Sohail, no run",,"full, outside off, no turn, defended back to him",1
452,141,Haris Sohail,318788,Paul Stirling,303427,"Stirling to Haris Sohail, no run down the wicket, too close to the pitch of the ball, defended back to him",2nd innings,23.3,no run,124,0,124/1,"Stirling to Haris Sohail, no run",,"down the wicket, too close to the pitch of the ball, defended back to him",1
453,142,Haris Sohail,318788,Paul Stirling,303427,"Stirling to Haris Sohail, no run flatter, he goes back to punch it, but finds short straight cover",2nd innings,23.4,no run,124,0,124/1,"Stirling to Haris Sohail, no run",,"flatter, he goes back to punch it, but finds short straight cover",1
454,143,Haris Sohail,318788,Paul Stirling,303427,"Stirling to Haris Sohail, no run leaves hi crease, he is beaten in the flight by the dipping offbreak. Hit on the pad",2nd innings,23.5,no run,124,0,124/1,"Stirling to Haris Sohail, no run",,"leaves hi crease, he is beaten in the flight by the dipping offbreak. Hit on the pad",1
455,144,Haris Sohail,318788,Paul Stirling,303427,"Stirling to Haris Sohail, no run no turn, pitched up outside off, pushed off the inside half of the bat back to Stirling",2nd innings,23.6,no run,124,0,124/1,"Stirling to Haris Sohail, no run",,"no turn, pitched up outside off, pushed off the inside half of the bat back to Stirling",1
456,145,Sarfaraz Ahmed,227760,George Dockrell,348034,"Dockrell to Sarfraz Ahmed, 1 run length ball, middle and leg, pushed to long-on for one",2nd innings,24.1,run,125,1,125/1,"Dockrell to Sarfraz Ahmed, 1 run",,"length ball, middle and leg, pushed to long-on for one",1
457,146,Haris Sohail,318788,George Dockrell,348034,"Dockrell to Haris Sohail, 1 run short of a length, punched down to long-no for one",2nd innings,24.2,run,126,1,126/1,"Dockrell to Haris Sohail, 1 run",,"short of a length, punched down to long-no for one",1
458,147,Sarfaraz Ahmed,227760,George Dockrell,348034,"Dockrell to Sarfraz Ahmed, OUT Sarfraz has run Sohail out. That's what Solhail lets Sarfraz know. This is short of a length, has been turned around the corner, towards short fine leg, both start running before Sarfraz stops midway. No time left for Sohail to get back. He seems to be telling Sarfraz, 'Mera call tha' [It was my call] before departing. And he is right as this has gone behind square",2nd innings,24.3,out,126,0,126/2,"Dockrell to Sarfraz Ahmed, OUT",,"Sarfraz has run Sohail out. That's what Solhail lets Sarfraz know. This is short of a length, has been turned around the corner, towards short fine leg, both start running before Sarfraz stops midway. No time left for Sohail to get back. He seems to be telling Sarfraz, 'Mera call tha' [It was my call] before departing. And he is right as this has gone behind square",2
459,148,Sarfaraz Ahmed,227760,George Dockrell,348034,"Dockrell to Sarfraz Ahmed, 1 run tossed up on off, driven to long-off for one",2nd innings,24.4,run,127,1,127/2,"Dockrell to Sarfraz Ahmed, 1 run",,"tossed up on off, driven to long-off for one",2
460,149,Misbah-ul-Haq,41378,George Dockrell,348034,"Dockrell to Misbah-ul-Haq, no run on a length, middle and leg, pushed to midwicket",2nd innings,24.5,no run,127,0,127/2,"Dockrell to Misbah-ul-Haq, no run",,"on a length, middle and leg, pushed to midwicket",2
461,150,Misbah-ul-Haq,41378,George Dockrell,348034,"Dockrell to Misbah-ul-Haq, no run defended off the front foot",2nd innings,24.6,no run,127,0,127/2,"Dockrell to Misbah-ul-Haq, no run",,defended off the front foot,2
462,151,Sarfaraz Ahmed,227760,Stuart Thompson,414821,"Thompson to Sarfraz Ahmed, 2 runs on a length, angling in, clipped wide of midwicket for a couple",2nd innings,25.1,run,129,2,129/2,"Thompson to Sarfraz Ahmed, 2 runs",,"on a length, angling in, clipped wide of midwicket for a couple",2
463,152,Sarfaraz Ahmed,227760,Stuart Thompson,414821,"Thompson to Sarfraz Ahmed, no run short, down the leg side, but not called wide as it has moved away after passing the stumps",2nd innings,25.2,no run,129,0,129/2,"Thompson to Sarfraz Ahmed, no run",,"short, down the leg side, but not called wide as it has moved away after passing the stumps",2
464,153,Sarfaraz Ahmed,227760,Stuart Thompson,414821,"Thompson to Sarfraz Ahmed, 1 run short of a length, on off, dropped into the off side for a single",2nd innings,25.3,run,130,1,130/2,"Thompson to Sarfraz Ahmed, 1 run",,"short of a length, on off, dropped into the off side for a single",2
465,154,Misbah-ul-Haq,41378,Stuart Thompson,414821,"Thompson to Misbah-ul-Haq, 1 run short of a length, angling in, worked to leg for a single",2nd innings,25.4,run,131,1,131/2,"Thompson to Misbah-ul-Haq, 1 run",,"short of a length, angling in, worked to leg for a single",2
466,155,Sarfaraz Ahmed,227760,Stuart Thompson,414821,"Thompson to Sarfraz Ahmed, 3 runs half-volley outside off with no mid-off. Pushed away through that region for easy runs. That gap has presented itself because of his earlier shot through midwicket, which means an extra fielder on the leg side. Sarf has earned this runs",2nd innings,25.5,run,134,3,134/2,"Thompson to Sarfraz Ahmed, 3 runs",,"half-volley outside off with no mid-off. Pushed away through that region for easy runs. That gap has presented itself because of his earlier shot through midwicket, which means an extra fielder on the leg side. Sarf has earned this runs",2
467,156,Misbah-ul-Haq,41378,Stuart Thompson,414821,"Thompson to Misbah-ul-Haq, 1 run more uncertain calling. This is pushed to the right of square leg. Misbah wants one, Sarfraz sends him back. But then a misfield lets them take a the single",2nd innings,25.6,run,135,1,135/2,"Thompson to Misbah-ul-Haq, 1 run",,"more uncertain calling. This is pushed to the right of square leg. Misbah wants one, Sarfraz sends him back. But then a misfield lets them take a the single",2
468,157,Misbah-ul-Haq,41378,George Dockrell,348034,"Dockrell to Misbah-ul-Haq, no run tossed up on off, no turn, pushed back to Stirling",2nd innings,26.1,no run,135,0,135/2,"Dockrell to Misbah-ul-Haq, no run",,"tossed up on off, no turn, pushed back to Stirling",2
469,158,Misbah-ul-Haq,41378,George Dockrell,348034,"Dockrell to Misbah-ul-Haq, 1 run pushed to long-off for a single",2nd innings,26.2,run,136,1,136/2,"Dockrell to Misbah-ul-Haq, 1 run",,pushed to long-off for a single,2
470,159,Sarfaraz Ahmed,227760,George Dockrell,348034,"Dockrell to Sarfraz Ahmed, no run some dip on this one, forces a front-foot defensive from Sarfraz",2nd innings,26.3,no run,136,0,136/2,"Dockrell to Sarfraz Ahmed, no run",,"some dip on this one, forces a front-foot defensive from Sarfraz",2
471,160,Sarfaraz Ahmed,227760,George Dockrell,348034,"Dockrell to Sarfraz Ahmed, no run fired down the leg side for a wide. Oh not called. The umpire reckons there is pad involved",2nd innings,26.4,no run,136,0,136/2,"Dockrell to Sarfraz Ahmed, no run",,fired down the leg side for a wide. Oh not called. The umpire reckons there is pad involved,2
472,161,Sarfaraz Ahmed,227760,George Dockrell,348034,"Dockrell to Sarfraz Ahmed, no run more uncertain running. This time it is Misbah who has turned down an easy single to the right of point",2nd innings,26.5,no run,136,0,136/2,"Dockrell to Sarfraz Ahmed, no run",,more uncertain running. This time it is Misbah who has turned down an easy single to the right of point,2
473,162,Sarfaraz Ahmed,227760,George Dockrell,348034,"Dockrell to Sarfraz Ahmed, 1 run and they get one this time after hitting straight to point. Unnecessary throw, and they get an overthrow",2nd innings,26.6,run,137,1,137/2,"Dockrell to Sarfraz Ahmed, 1 run",,"and they get one this time after hitting straight to point. Unnecessary throw, and they get an overthrow",2
474,163,Sarfaraz Ahmed,227760,Stuart Thompson,414821,"Thompson to Sarfraz Ahmed, 3 runs again no mid-off. And he has punched this length ball through that gap for three more",2nd innings,27.1,run,140,3,140/2,"Thompson to Sarfraz Ahmed, 3 runs",,again no mid-off. And he has punched this length ball through that gap for three more,2
475,164,Misbah-ul-Haq,41378,Stuart Thompson,414821,"Thompson to Misbah-ul-Haq, no run front-foot defensive as he pitches outside off",2nd innings,27.2,no run,140,0,140/2,"Thompson to Misbah-ul-Haq, no run",,front-foot defensive as he pitches outside off,2
476,165,Misbah-ul-Haq,41378,Stuart Thompson,414821,"Thompson to Misbah-ul-Haq, no run wide length ball, defended off the front foot",2nd innings,27.3,no run,140,0,140/2,"Thompson to Misbah-ul-Haq, no run",,"wide length ball, defended off the front foot",2
477,166,Misbah-ul-Haq,41378,Stuart Thompson,414821,"Thompson to Misbah-ul-Haq, no run bouncer, middle and leg, he ducks under it",2nd innings,27.4,no run,140,0,140/2,"Thompson to Misbah-ul-Haq, no run",,"bouncer, middle and leg, he ducks under it",2
478,167,Misbah-ul-Haq,41378,Stuart Thompson,414821,"Thompson to Misbah-ul-Haq, no run on a length, on off, plays a clip on the run, straight to midwicket",2nd innings,27.5,no run,140,0,140/2,"Thompson to Misbah-ul-Haq, no run",,"on a length, on off, plays a clip on the run, straight to midwicket",2
479,168,Misbah-ul-Haq,41378,Stuart Thompson,414821,"Thompson to Misbah-ul-Haq, no run wide length ball, defended off the front foot",2nd innings,27.6,no run,140,0,140/2,"Thompson to Misbah-ul-Haq, no run",,"wide length ball, defended off the front foot",2
480,169,Sarfaraz Ahmed,227760,George Dockrell,348034,"Dockrell to Sarfraz Ahmed, 1 run flighted on off, driven to long-on for one",2nd innings,28.1,run,141,1,141/2,"Dockrell to Sarfraz Ahmed, 1 run",,"flighted on off, driven to long-on for one",2
481,170,Misbah-ul-Haq,41378,George Dockrell,348034,"Dockrell to Misbah-ul-Haq, 2 runs short, wide, he rocks back to punch this past point for two",2nd innings,28.2,run,143,2,143/2,"Dockrell to Misbah-ul-Haq, 2 runs",,"short, wide, he rocks back to punch this past point for two",2
