,ball,batsman,batsman_id,bowler,bowler_id,commentary,innings,otherBatsman,otherBatsman_id,otherBowler,otherBowler_id,overs,playType,runs,runs_scored,score,shortText,speed,text,wickets
410,101,Jos Buttler,308967,Taskin Ahmed,538506,"Taskin Ahmed to Buttler, FOUR runs what a shot! This is a short-arm swat-pull as he takes it from outside off and bunts it wide of mid-on...not clever from Taskin. Outstanding from Buttler",2nd innings,Jonny Bairstow,297433,Shafiul Islam,288305,16.5,four,81,4,81/4,"Taskin Ahmed to Buttler, FOUR runs",,what a shot! This is a short-arm swat-pull as he takes it from outside off and bunts it wide of mid-on...not clever from Taskin. Outstanding from Buttler,4
411,102,Jos Buttler,308967,Taskin Ahmed,538506,"Taskin Ahmed to Buttler, 1 run fuller, driven on the up out to deep cover",2nd innings,Jonny Bairstow,297433,Shafiul Islam,288305,16.6,run,82,1,82/4,"Taskin Ahmed to Buttler, 1 run",,"fuller, driven on the up out to deep cover",4
412,103,Jos Buttler,308967,Shafiul Islam,288305,"Shafiul Islam to Buttler, no run full outside off, he walks across his crease and flicks to mid-on",2nd innings,Jonny Bairstow,297433,Taskin Ahmed,538506,17.1,no run,82,0,82/4,"Shafiul Islam to Buttler, no run",,"full outside off, he walks across his crease and flicks to mid-on",4
413,104,Jos Buttler,308967,Shafiul Islam,288305,"Shafiul Islam to Buttler, 1 run short of a length, angled in at Buttler, gets inside the line and works to long leg",2nd innings,Jonny Bairstow,297433,Taskin Ahmed,538506,17.2,run,83,1,83/4,"Shafiul Islam to Buttler, 1 run",,"short of a length, angled in at Buttler, gets inside the line and works to long leg",4
414,105,Jonny Bairstow,297433,Shafiul Islam,288305,"Shafiul Islam to Bairstow, no run width outside off, cut firmly towards point",2nd innings,Jos Buttler,308967,Taskin Ahmed,538506,17.3,no run,83,0,83/4,"Shafiul Islam to Bairstow, no run",,"width outside off, cut firmly towards point",4
415,106,Jonny Bairstow,297433,Shafiul Islam,288305,"Shafiul Islam to Bairstow, no run better line, on middle and off, defended back to the bowler",2nd innings,Jos Buttler,308967,Taskin Ahmed,538506,17.4,no run,83,0,83/4,"Shafiul Islam to Bairstow, no run",,"better line, on middle and off, defended back to the bowler",4
416,107,Jonny Bairstow,297433,Shafiul Islam,288305,"Shafiul Islam to Bairstow, no run beats him, a fuller length outside off, still a hint of nibble on offer",2nd innings,Jos Buttler,308967,Taskin Ahmed,538506,17.5,no run,83,0,83/4,"Shafiul Islam to Bairstow, no run",,"beats him, a fuller length outside off, still a hint of nibble on offer",4
417,108,Jonny Bairstow,297433,Shafiul Islam,288305,"Shafiul Islam to Bairstow, 1 run back of a length, pushed square to the off side",2nd innings,Jos Buttler,308967,Taskin Ahmed,538506,17.6,run,84,1,84/4,"Shafiul Islam to Bairstow, 1 run",,"back of a length, pushed square to the off side",4
418,109,Jonny Bairstow,297433,Nasir Hossain,300618,"Nasir Hossain to Bairstow, no run works a length ball to midwicket",2nd innings,Jos Buttler,308967,Shafiul Islam,288305,18.1,no run,84,0,84/4,"Nasir Hossain to Bairstow, no run",,works a length ball to midwicket,4
419,110,Jonny Bairstow,297433,Nasir Hossain,300618,"Nasir Hossain to Bairstow, no run through everything and everyone...basically a straight ball, it skidded on, Bairstow played around it, beat the inside edge, pad and the keeper's gloves",2nd innings,Jos Buttler,308967,Shafiul Islam,288305,18.2,no run,84,0,84/4,"Nasir Hossain to Bairstow, no run",,"through everything and everyone...basically a straight ball, it skidded on, Bairstow played around it, beat the inside edge, pad and the keeper's gloves",4
420,111,Jonny Bairstow,297433,Nasir Hossain,300618,"Nasir Hossain to Bairstow, 1 run flicked to deep midwicket",2nd innings,Jos Buttler,308967,Shafiul Islam,288305,18.3,run,85,1,85/4,"Nasir Hossain to Bairstow, 1 run",,flicked to deep midwicket,4
421,112,Jos Buttler,308967,Nasir Hossain,300618,"Nasir Hossain to Buttler, 1 run uses his feet, flicks off his pads deep to the leg side",2nd innings,Jonny Bairstow,297433,Shafiul Islam,288305,18.4,run,86,1,86/4,"Nasir Hossain to Buttler, 1 run",,"uses his feet, flicks off his pads deep to the leg side",4
422,113,Jonny Bairstow,297433,Nasir Hossain,300618,"Nasir Hossain to Bairstow, 1 run paddle-sweeps this from outside off to backward square leg",2nd innings,Jos Buttler,308967,Shafiul Islam,288305,18.5,run,87,1,87/4,"Nasir Hossain to Bairstow, 1 run",,paddle-sweeps this from outside off to backward square leg,4
423,114,Jos Buttler,308967,Nasir Hossain,300618,"Nasir Hossain to Buttler, 1 run walks down the pitch and nudges to the leg side",2nd innings,Jonny Bairstow,297433,Shafiul Islam,288305,18.6,run,88,1,88/4,"Nasir Hossain to Buttler, 1 run",,walks down the pitch and nudges to the leg side,4
424,115,Jos Buttler,308967,Shafiul Islam,288305,"Shafiul Islam to Buttler, 1 run full outside off, push and run towards mid-off...always scampering",2nd innings,Jonny Bairstow,297433,Nasir Hossain,300618,19.1,run,89,1,89/4,"Shafiul Islam to Buttler, 1 run",,"full outside off, push and run towards mid-off...always scampering",4
425,116,Jonny Bairstow,297433,Shafiul Islam,288305,"Shafiul Islam to Bairstow, 1 run full and wide, Bairstow throws his bat through the line, his bottom hand comes off the bat, backward point makes the save",2nd innings,Jos Buttler,308967,Nasir Hossain,300618,19.2,run,90,1,90/4,"Shafiul Islam to Bairstow, 1 run",,"full and wide, Bairstow throws his bat through the line, his bottom hand comes off the bat, backward point makes the save",4
426,117,Jos Buttler,308967,Shafiul Islam,288305,"Shafiul Islam to Buttler, no run a rare one he doesn't connect with as he swings across the line of a delivery quite wide outside off",2nd innings,Jonny Bairstow,297433,Nasir Hossain,300618,19.3,no run,90,0,90/4,"Shafiul Islam to Buttler, no run",,a rare one he doesn't connect with as he swings across the line of a delivery quite wide outside off,4
427,118,Jos Buttler,308967,Shafiul Islam,288305,"Shafiul Islam to Buttler, no run that's sweetly timed, flicked firmly from outside off but straight to midwicket",2nd innings,Jonny Bairstow,297433,Nasir Hossain,300618,19.4,no run,90,0,90/4,"Shafiul Islam to Buttler, no run",,"that's sweetly timed, flicked firmly from outside off but straight to midwicket",4
428,119,Jos Buttler,308967,Shafiul Islam,288305,"Shafiul Islam to Buttler, 1 run down the pitch outside the line of off stump and then sends this down to long on",2nd innings,Jonny Bairstow,297433,Nasir Hossain,300618,19.5,run,91,1,91/4,"Shafiul Islam to Buttler, 1 run",,down the pitch outside the line of off stump and then sends this down to long on,4
429,120,Jonny Bairstow,297433,Shafiul Islam,288305,"Shafiul Islam to Bairstow, 1 run pulls a short ball, comes off top edge or splice, loops over midwicket inside the circle and falls into space",2nd innings,Jos Buttler,308967,Nasir Hossain,300618,19.6,run,92,1,92/4,"Shafiul Islam to Bairstow, 1 run",,"pulls a short ball, comes off top edge or splice, loops over midwicket inside the circle and falls into space",4
430,121,Jonny Bairstow,297433,Nasir Hossain,300618,"Nasir Hossain to Bairstow, 1 run pushed down to long-on",2nd innings,Jos Buttler,308967,Shafiul Islam,288305,20.1,run,93,1,93/4,"Nasir Hossain to Bairstow, 1 run",,pushed down to long-on,4
431,122,Jos Buttler,308967,Nasir Hossain,300618,"Nasir Hossain to Buttler, 1 run plays with the turn wide of midwicket",2nd innings,Jonny Bairstow,297433,Shafiul Islam,288305,20.2,run,94,1,94/4,"Nasir Hossain to Buttler, 1 run",,plays with the turn wide of midwicket,4
432,123,Jonny Bairstow,297433,Nasir Hossain,300618,"Nasir Hossain to Bairstow, no run flicked from outside off towards midwicket whose dive creates enough doubt over the single",2nd innings,Jos Buttler,308967,Shafiul Islam,288305,20.3,no run,94,0,94/4,"Nasir Hossain to Bairstow, no run",,flicked from outside off towards midwicket whose dive creates enough doubt over the single,4
433,124,Jonny Bairstow,297433,Nasir Hossain,300618,"Nasir Hossain to Bairstow, no run goes for the reverse sweep and finds short third man",2nd innings,Jos Buttler,308967,Shafiul Islam,288305,20.4,no run,94,0,94/4,"Nasir Hossain to Bairstow, no run",,goes for the reverse sweep and finds short third man,4
434,125,Jonny Bairstow,297433,Nasir Hossain,300618,"Nasir Hossain to Bairstow, no run touch shorter, he goes back and punches towards midwicket where Shakib cuts it off again",2nd innings,Jos Buttler,308967,Shafiul Islam,288305,20.5,no run,94,0,94/4,"Nasir Hossain to Bairstow, no run",,"touch shorter, he goes back and punches towards midwicket where Shakib cuts it off again",4
435,126,Jonny Bairstow,297433,Nasir Hossain,300618,"Nasir Hossain to Bairstow, 2 runs worked through square leg and there speed of these two between the wickets makes it an easy couple",2nd innings,Jos Buttler,308967,Shafiul Islam,288305,20.6,run,96,2,96/4,"Nasir Hossain to Bairstow, 2 runs",,worked through square leg and there speed of these two between the wickets makes it an easy couple,4
436,127,Jos Buttler,308967,Shafiul Islam,288305,"Shafiul Islam to Buttler, 1 run full outside off, he likes to take so much to the leg side, works this with a closed face behind square",2nd innings,Jonny Bairstow,297433,Nasir Hossain,300618,21.1,run,97,1,97/4,"Shafiul Islam to Buttler, 1 run",,"full outside off, he likes to take so much to the leg side, works this with a closed face behind square",4
437,128,Jonny Bairstow,297433,Shafiul Islam,288305,"Shafiul Islam to Bairstow, no run at off stump, played back to the bowler",2nd innings,Jos Buttler,308967,Nasir Hossain,300618,21.2,no run,97,0,97/4,"Shafiul Islam to Bairstow, no run",,"at off stump, played back to the bowler",4
438,129,Jonny Bairstow,297433,Shafiul Islam,288305,"Shafiul Islam to Bairstow, 1 run hint of shape back in at Bairstow who comes forward, traps it off a thick inside edge into his front pad",2nd innings,Jos Buttler,308967,Nasir Hossain,300618,21.3,run,98,1,98/4,"Shafiul Islam to Bairstow, 1 run",,"hint of shape back in at Bairstow who comes forward, traps it off a thick inside edge into his front pad",4
439,130,Jos Buttler,308967,Shafiul Islam,288305,"Shafiul Islam to Buttler, 2 runs driven on the walk to mid-off, it's fairly tight but, again, so quick between the sticks and that's England's hundred up",2nd innings,Jonny Bairstow,297433,Nasir Hossain,300618,21.4,run,100,2,100/4,"Shafiul Islam to Buttler, 2 runs",,"driven on the walk to mid-off, it's fairly tight but, again, so quick between the sticks and that's England's hundred up",4
440,131,Jos Buttler,308967,Shafiul Islam,288305,"Shafiul Islam to Buttler, no run back of a length, aims to the leg side, gets a bottom into his leg...fairly close to delicate area",2nd innings,Jonny Bairstow,297433,Nasir Hossain,300618,21.5,no run,100,0,100/4,"Shafiul Islam to Buttler, no run",,"back of a length, aims to the leg side, gets a bottom into his leg...fairly close to delicate area",4
441,132,Jos Buttler,308967,Shafiul Islam,288305,"Shafiul Islam to Buttler, 1 run short of a length outside off, pushed into the covers",2nd innings,Jonny Bairstow,297433,Nasir Hossain,300618,21.6,run,101,1,101/4,"Shafiul Islam to Buttler, 1 run",,"short of a length outside off, pushed into the covers",4
442,133,Jos Buttler,308967,Nasir Hossain,300618,"Nasir Hossain to Buttler, no run down the pitch and flicks to midwicket",2nd innings,Jonny Bairstow,297433,Shafiul Islam,288305,22.1,no run,101,0,101/4,"Nasir Hossain to Buttler, no run",,down the pitch and flicks to midwicket,4
443,134,Jos Buttler,308967,Nasir Hossain,300618,"Nasir Hossain to Buttler, 1 run picks the gap this time, flicks it slightly squarer to beat the man inside the circle",2nd innings,Jonny Bairstow,297433,Shafiul Islam,288305,22.2,run,102,1,102/4,"Nasir Hossain to Buttler, 1 run",,"picks the gap this time, flicks it slightly squarer to beat the man inside the circle",4
444,135,Jonny Bairstow,297433,Nasir Hossain,300618,"Nasir Hossain to Bairstow, no run straight delivery worked to square leg",2nd innings,Jos Buttler,308967,Shafiul Islam,288305,22.3,no run,102,0,102/4,"Nasir Hossain to Bairstow, no run",,straight delivery worked to square leg,4
445,136,Jonny Bairstow,297433,Nasir Hossain,300618,"Nasir Hossain to Bairstow, 1 run plays back, a shorter delivery, turns a bit and is pushed to mid-on",2nd innings,Jos Buttler,308967,Shafiul Islam,288305,22.4,run,103,1,103/4,"Nasir Hossain to Bairstow, 1 run",,"plays back, a shorter delivery, turns a bit and is pushed to mid-on",4
446,137,Jos Buttler,308967,Nasir Hossain,300618,"Nasir Hossain to Buttler, no run flicked on the walk to midwicket",2nd innings,Jonny Bairstow,297433,Shafiul Islam,288305,22.5,no run,103,0,103/4,"Nasir Hossain to Buttler, no run",,flicked on the walk to midwicket,4
447,138,Jos Buttler,308967,Nasir Hossain,300618,"Nasir Hossain to Buttler, 1 run on leg stump, worked way behind square...ticking over is fine for England, required rate is not an issue",2nd innings,Jonny Bairstow,297433,Shafiul Islam,288305,22.6,run,104,1,104/4,"Nasir Hossain to Buttler, 1 run",,"on leg stump, worked way behind square...ticking over is fine for England, required rate is not an issue",4
448,139,Jos Buttler,308967,Taskin Ahmed,538506,"Taskin Ahmed to Buttler, 1 run full at off stump, driven to mid-off who can't prevent the single",2nd innings,Jonny Bairstow,297433,Nasir Hossain,300618,23.1,run,105,1,105/4,"Taskin Ahmed to Buttler, 1 run",,"full at off stump, driven to mid-off who can't prevent the single",4
449,140,Jonny Bairstow,297433,Taskin Ahmed,538506,"Taskin Ahmed to Bairstow, no run perhaps just hint of a shape in at the batsman, this is full at the stumps, punched to mid-on",2nd innings,Jos Buttler,308967,Nasir Hossain,300618,23.2,no run,105,0,105/4,"Taskin Ahmed to Bairstow, no run",,"perhaps just hint of a shape in at the batsman, this is full at the stumps, punched to mid-on",4
450,141,Jonny Bairstow,297433,Taskin Ahmed,538506,"Taskin Ahmed to Bairstow, OUT he's done it! Taskin redeems himself, in some style. Length ball outside off, Bairstow went for a booming drive and gets a thin edge. That zipped off the surface. Nicely bowled",2nd innings,Jos Buttler,308967,Nasir Hossain,300618,23.3,out,105,0,105/5,"Taskin Ahmed to Bairstow, OUT",,"he's done it! Taskin redeems himself, in some style. Length ball outside off, Bairstow went for a booming drive and gets a thin edge. That zipped off the surface. Nicely bowled",5
451,142,Moeen Ali,8917,Taskin Ahmed,538506,"Taskin Ahmed to Ali, no run back of a length at off stump, defended square to point...slippery from Taskin",2nd innings,Jos Buttler,308967,Nasir Hossain,300618,23.4,no run,105,0,105/5,"Taskin Ahmed to Ali, no run",,"back of a length at off stump, defended square to point...slippery from Taskin",5
452,143,Moeen Ali,8917,Taskin Ahmed,538506,"Taskin Ahmed to Ali, no run beats the edge! Goes fuller, outside off, tempts the drive from Moeen whose feet are quite moving yet",2nd innings,Jos Buttler,308967,Nasir Hossain,300618,23.5,no run,105,0,105/5,"Taskin Ahmed to Ali, no run",,"beats the edge! Goes fuller, outside off, tempts the drive from Moeen whose feet are quite moving yet",5
453,144,Moeen Ali,8917,Taskin Ahmed,538506,"Taskin Ahmed to Ali, no run length at middle and off, defended to midwicket",2nd innings,Jos Buttler,308967,Nasir Hossain,300618,23.6,no run,105,0,105/5,"Taskin Ahmed to Ali, no run",,"length at middle and off, defended to midwicket",5
454,145,Jos Buttler,308967,Nasir Hossain,300618,"Nasir Hossain to Buttler, no run worked off the pads round the corner to short fine leg",2nd innings,Moeen Ali,8917,Taskin Ahmed,538506,24.1,no run,105,0,105/5,"Nasir Hossain to Buttler, no run",,worked off the pads round the corner to short fine leg,5
455,146,Jos Buttler,308967,Nasir Hossain,300618,"Nasir Hossain to Buttler, FOUR runs uses his feet, doesn't quite get to the pitch, but manages to adjust and somehow manages to time this through the leg side to the extent he gets four...incredible batting, that's his fifty",2nd innings,Moeen Ali,8917,Taskin Ahmed,538506,24.2,four,109,4,109/5,"Nasir Hossain to Buttler, FOUR runs",,"uses his feet, doesn't quite get to the pitch, but manages to adjust and somehow manages to time this through the leg side to the extent he gets four...incredible batting, that's his fifty",5
456,147,Jos Buttler,308967,Nasir Hossain,300618,"Nasir Hossain to Buttler, 1 run dragged down short, he goes back and flat-bats to long-on",2nd innings,Moeen Ali,8917,Taskin Ahmed,538506,24.3,run,110,1,110/5,"Nasir Hossain to Buttler, 1 run",,"dragged down short, he goes back and flat-bats to long-on",5
457,148,Moeen Ali,8917,Nasir Hossain,300618,"Nasir Hossain to Ali, 1 run round the wicket to the left hander, he presses forward, opens the face into point",2nd innings,Jos Buttler,308967,Taskin Ahmed,538506,24.4,run,111,1,111/5,"Nasir Hossain to Ali, 1 run",,"round the wicket to the left hander, he presses forward, opens the face into point",5
458,149,Jos Buttler,308967,Nasir Hossain,300618,"Nasir Hossain to Buttler, no run pushed to midwicket",2nd innings,Moeen Ali,8917,Taskin Ahmed,538506,24.5,no run,111,0,111/5,"Nasir Hossain to Buttler, no run",,pushed to midwicket,5
459,150,Jos Buttler,308967,Nasir Hossain,300618,"Nasir Hossain to Buttler, 1 run this keeps a little low as Buttler plays back, but he watches it closely and is able to place it down to long-on",2nd innings,Moeen Ali,8917,Taskin Ahmed,538506,24.6,run,112,1,112/5,"Nasir Hossain to Buttler, 1 run",,"this keeps a little low as Buttler plays back, but he watches it closely and is able to place it down to long-on",5
460,151,Jos Buttler,308967,Taskin Ahmed,538506,"Taskin Ahmed to Buttler, no run that's a beauty! He's found something. Short of a length, jags away off the seam to beat Buttler's outside edge by some distance...good carry, too",2nd innings,Moeen Ali,8917,Nasir Hossain,300618,25.1,no run,112,0,112/5,"Taskin Ahmed to Buttler, no run",,"that's a beauty! He's found something. Short of a length, jags away off the seam to beat Buttler's outside edge by some distance...good carry, too",5
461,152,Jos Buttler,308967,Taskin Ahmed,538506,"Taskin Ahmed to Buttler, 1 run moves across his crease and pulls a short ball (although it probably didn't pitch much differently to the previously deliver) and finds deep square",2nd innings,Moeen Ali,8917,Nasir Hossain,300618,25.2,run,113,1,113/5,"Taskin Ahmed to Buttler, 1 run",,moves across his crease and pulls a short ball (although it probably didn't pitch much differently to the previously deliver) and finds deep square,5
462,153,Moeen Ali,8917,Taskin Ahmed,538506,"Taskin Ahmed to Ali, 2 runs short, angling across Moeen who pulls it wide of mid-on",2nd innings,Jos Buttler,308967,Nasir Hossain,300618,25.3,run,115,2,115/5,"Taskin Ahmed to Ali, 2 runs",,"short, angling across Moeen who pulls it wide of mid-on",5
463,154,Moeen Ali,8917,Taskin Ahmed,538506,"Taskin Ahmed to Ali, no run on a fuller length, defended to the bowler",2nd innings,Jos Buttler,308967,Nasir Hossain,300618,25.4,no run,115,0,115/5,"Taskin Ahmed to Ali, no run",,"on a fuller length, defended to the bowler",5
464,155,Moeen Ali,8917,Taskin Ahmed,538506,"Taskin Ahmed to Ali, 4 leg byes short again, he's through his pull and gets taken on the hip then the ball deflects underneath Mushfiqur's gloves",2nd innings,Jos Buttler,308967,Nasir Hossain,300618,25.5,leg bye,119,4,119/5,"Taskin Ahmed to Ali, 4 leg byes",,"short again, he's through his pull and gets taken on the hip then the ball deflects underneath Mushfiqur's gloves",5
465,156,Moeen Ali,8917,Taskin Ahmed,538506,"Taskin Ahmed to Ali, 1 run on the pads, flicked to long leg",2nd innings,Jos Buttler,308967,Nasir Hossain,300618,25.6,run,120,1,120/5,"Taskin Ahmed to Ali, 1 run",,"on the pads, flicked to long leg",5
466,157,Moeen Ali,8917,Nasir Hossain,300618,"Nasir Hossain to Ali, no run slides on with the arm, defended with bat and pad together",2nd innings,Jos Buttler,308967,Taskin Ahmed,538506,26.1,no run,120,0,120/5,"Nasir Hossain to Ali, no run",,"slides on with the arm, defended with bat and pad together",5
467,158,Moeen Ali,8917,Nasir Hossain,300618,"Nasir Hossain to Ali, OUT what a catch! Shakib has pulled off a brilliant grab. Looked a pretty horrid shot from Moeen, went to pull a slightly shorter delivery, was aiming over midwicket and it flies off the top edge into the off side. Shakib has to turn, run and take it over his shoulder with a dive. Superb.",2nd innings,Jos Buttler,308967,Taskin Ahmed,538506,26.2,out,120,0,120/6,"Nasir Hossain to Ali, OUT",,"what a catch! Shakib has pulled off a brilliant grab. Looked a pretty horrid shot from Moeen, went to pull a slightly shorter delivery, was aiming over midwicket and it flies off the top edge into the off side. Shakib has to turn, run and take it over his shoulder with a dive. Superb.",6
468,159,Jos Buttler,308967,Nasir Hossain,300618,"Nasir Hossain to Buttler, no run full, flicked back to the bowler",2nd innings,Chris Woakes,247235,Taskin Ahmed,538506,26.3,no run,120,0,120/6,"Nasir Hossain to Buttler, no run",,"full, flicked back to the bowler",6
469,160,Jos Buttler,308967,Nasir Hossain,300618,"Nasir Hossain to Buttler, 1 run touch shorter, drilled back past the bowler",2nd innings,Chris Woakes,247235,Taskin Ahmed,538506,26.4,run,121,1,121/6,"Nasir Hossain to Buttler, 1 run",,"touch shorter, drilled back past the bowler",6
470,161,Chris Woakes,247235,Nasir Hossain,300618,"Nasir Hossain to Woakes, 1 run goes back and pushes a shortish ball to long-on",2nd innings,Jos Buttler,308967,Taskin Ahmed,538506,26.5,run,122,1,122/6,"Nasir Hossain to Woakes, 1 run",,goes back and pushes a shortish ball to long-on,6
471,162,Jos Buttler,308967,Nasir Hossain,300618,"Nasir Hossain to Buttler, 1 run fuller, eased down the ground",2nd innings,Chris Woakes,247235,Taskin Ahmed,538506,26.6,run,123,1,123/6,"Nasir Hossain to Buttler, 1 run",,"fuller, eased down the ground",6
472,163,Jos Buttler,308967,Taskin Ahmed,538506,"Taskin Ahmed to Buttler, OUT that could be the match! Huge appeal for lbw as Buttler moves across his crease and misses his flick. Not given on the field. They call for the <B>review</b>. Such a key wicket. Well, this is very close. Think it hit him in line. He's down the pitch a bit. He's not hit it. Three reds, he's gone!",2nd innings,Chris Woakes,247235,Nasir Hossain,300618,27.1,out,123,0,123/7,"Taskin Ahmed to Buttler, OUT",,"that could be the match! Huge appeal for lbw as Buttler moves across his crease and misses his flick. Not given on the field. They call for the <B>review</b>. Such a key wicket. Well, this is very close. Think it hit him in line. He's down the pitch a bit. He's not hit it. Three reds, he's gone!",7
473,164,Adil Rashid,244497,Taskin Ahmed,538506,"Taskin Ahmed to Rashid, 1 run full and straight, flicked down to long leg",2nd innings,Chris Woakes,247235,Nasir Hossain,300618,27.2,run,124,1,124/7,"Taskin Ahmed to Rashid, 1 run",,"full and straight, flicked down to long leg",7
474,165,Chris Woakes,247235,Taskin Ahmed,538506,"Taskin Ahmed to Woakes, no run goes for the drive, into the off side",2nd innings,Adil Rashid,244497,Nasir Hossain,300618,27.3,no run,124,0,124/7,"Taskin Ahmed to Woakes, no run",,"goes for the drive, into the off side",7
475,166,Chris Woakes,247235,Taskin Ahmed,538506,"Taskin Ahmed to Woakes, 1 run full outside off, a flowing driven picks out cover",2nd innings,Adil Rashid,244497,Nasir Hossain,300618,27.4,run,125,1,125/7,"Taskin Ahmed to Woakes, 1 run",,"full outside off, a flowing driven picks out cover",7
476,167,Adil Rashid,244497,Taskin Ahmed,538506,"Taskin Ahmed to Rashid, 1 run back of a length outside off, opens the face down to third man",2nd innings,Chris Woakes,247235,Nasir Hossain,300618,27.5,run,126,1,126/7,"Taskin Ahmed to Rashid, 1 run",,"back of a length outside off, opens the face down to third man",7
477,168,Chris Woakes,247235,Taskin Ahmed,538506,"Taskin Ahmed to Woakes, FOUR runs full, wide, and driven beautifully through the off side, beats the cover ring",2nd innings,Adil Rashid,244497,Nasir Hossain,300618,27.6,four,130,4,130/7,"Taskin Ahmed to Woakes, FOUR runs",,"full, wide, and driven beautifully through the off side, beats the cover ring",7
478,169,Adil Rashid,244497,Nasir Hossain,300618,"Nasir Hossain to Rashid, 1 run flicked into the leg side",2nd innings,Chris Woakes,247235,Taskin Ahmed,538506,28.1,run,131,1,131/7,"Nasir Hossain to Rashid, 1 run",,flicked into the leg side,7
479,170,Chris Woakes,247235,Nasir Hossain,300618,"Nasir Hossain to Woakes, no run comes forward and defends",2nd innings,Adil Rashid,244497,Taskin Ahmed,538506,28.2,no run,131,0,131/7,"Nasir Hossain to Woakes, no run",,comes forward and defends,7
480,171,Chris Woakes,247235,Nasir Hossain,300618,"Nasir Hossain to Woakes, no run worked into midwicket",2nd innings,Adil Rashid,244497,Taskin Ahmed,538506,28.3,no run,131,0,131/7,"Nasir Hossain to Woakes, no run",,worked into midwicket,7
481,172,Chris Woakes,247235,Nasir Hossain,300618,"Nasir Hossain to Woakes, no run full at the stumps, patted back to the bowler",2nd innings,Adil Rashid,244497,Taskin Ahmed,538506,28.4,no run,131,0,131/7,"Nasir Hossain to Woakes, no run",,"full at the stumps, patted back to the bowler",7
482,173,Chris Woakes,247235,Nasir Hossain,300618,"Nasir Hossain to Woakes, 1 run bottom hand comes into play as he flicks to long-on",2nd innings,Adil Rashid,244497,Taskin Ahmed,538506,28.5,run,132,1,132/7,"Nasir Hossain to Woakes, 1 run",,bottom hand comes into play as he flicks to long-on,7
483,174,Adil Rashid,244497,Nasir Hossain,300618,"Nasir Hossain to Rashid, no run full and straight, dabbed to the off side",2nd innings,Chris Woakes,247235,Taskin Ahmed,538506,28.6,no run,132,0,132/7,"Nasir Hossain to Rashid, no run",,"full and straight, dabbed to the off side",7
