,ball,batsman,batsman_id,bowler,bowler_id,commentary,innings,overs,playType,runs,runs_scored,score,shortText,speed,text,wickets
143,138,Sean Williams,55870,Sachith Pathirana,212756,"Pathirana to Williams, 1 run pitched up outside off, whipped away to long-on",1st innings,22.6,run,113,1,113/6,"Pathirana to Williams, 1 run",,"pitched up outside off, whipped away to long-on",6
144,139,Sean Williams,55870,Jeffrey Vandersay,370040,"Vandersay to Williams, no run tucked off the pads to short fine leg",1st innings,23.1,no run,113,0,113/6,"Vandersay to Williams, no run",,tucked off the pads to short fine leg,6
145,140,Sean Williams,55870,Jeffrey Vandersay,370040,"Vandersay to Williams, no run nudges off the pads to deep midwicket",1st innings,23.2,no run,113,0,113/6,"Vandersay to Williams, no run",,nudges off the pads to deep midwicket,6
146,141,Sean Williams,55870,Jeffrey Vandersay,370040,"Vandersay to Williams, 1 run ",1st innings,23.3,run,114,1,114/6,"Vandersay to Williams, 1 run",,,6
147,142,Graeme Cremer,55346,Jeffrey Vandersay,370040,"Vandersay to Cremer, no run checks the front foot push and the ball goes in the air but lands short of short cover",1st innings,23.4,no run,114,0,114/6,"Vandersay to Cremer, no run",,checks the front foot push and the ball goes in the air but lands short of short cover,6
148,143,Graeme Cremer,55346,Jeffrey Vandersay,370040,"Vandersay to Cremer, 1 run width on offer outside off, slaps it away to sweeper cover",1st innings,23.5,run,115,1,115/6,"Vandersay to Cremer, 1 run",,"width on offer outside off, slaps it away to sweeper cover",6
149,144,Sean Williams,55870,Jeffrey Vandersay,370040,"Vandersay to Williams, no run pitched right up on the stumps, Waller knocks it to mid-on",1st innings,23.6,no run,115,0,115/6,"Vandersay to Williams, no run",,"pitched right up on the stumps, Waller knocks it to mid-on",6
150,145,Graeme Cremer,55346,Nuwan Kulasekara,49535,"Kulasekara to Cremer, 1 run just some width outside off, slashes at it and gets it off the splice to third man",1st innings,24.1,run,116,1,116/6,"Kulasekara to Cremer, 1 run",,"just some width outside off, slashes at it and gets it off the splice to third man",6
151,146,Sean Williams,55870,Nuwan Kulasekara,49535,"Kulasekara to Williams, no run good length on off, defended off the backfoot",1st innings,24.2,no run,116,0,116/6,"Kulasekara to Williams, no run",,"good length on off, defended off the backfoot",6
152,147,Sean Williams,55870,Nuwan Kulasekara,49535,"Kulasekara to Williams, no run fuller ball, angled across outside off, Williams leans forward and eases into a push that goes to short cover",1st innings,24.3,no run,116,0,116/6,"Kulasekara to Williams, no run",,"fuller ball, angled across outside off, Williams leans forward and eases into a push that goes to short cover",6
153,148,Sean Williams,55870,Nuwan Kulasekara,49535,"Kulasekara to Williams, no run short of a length outside off, Williams stands tall and punches off the backfoot towards mid-off, short cover runs across and cuts it off",1st innings,24.4,no run,116,0,116/6,"Kulasekara to Williams, no run",,"short of a length outside off, Williams stands tall and punches off the backfoot towards mid-off, short cover runs across and cuts it off",6
154,149,Sean Williams,55870,Nuwan Kulasekara,49535,"Kulasekara to Williams, no run good length around off, puts his head down and defends off the front foot into the off side",1st innings,24.5,no run,116,0,116/6,"Kulasekara to Williams, no run",,"good length around off, puts his head down and defends off the front foot into the off side",6
155,150,Sean Williams,55870,Nuwan Kulasekara,49535,"Kulasekara to Williams, 1 run angled across and offers up some width outside off, Williams uses his wrists to ease it away to sweeper cover with an open bat face",1st innings,24.6,run,117,1,117/6,"Kulasekara to Williams, 1 run",,"angled across and offers up some width outside off, Williams uses his wrists to ease it away to sweeper cover with an open bat face",6
156,151,Sean Williams,55870,Jeffrey Vandersay,370040,"Vandersay to Williams, 1 run floats it up too much and offers up a full toss that is turned away to deep midwicket",1st innings,25.1,run,118,1,118/6,"Vandersay to Williams, 1 run",,floats it up too much and offers up a full toss that is turned away to deep midwicket,6
157,152,Graeme Cremer,55346,Jeffrey Vandersay,370040,"Vandersay to Cremer, no run good length, draws the batsman forward and beats him after getting it to spin away sharply, misses the off-stump as well narrowly",1st innings,25.2,no run,118,0,118/6,"Vandersay to Cremer, no run",,"good length, draws the batsman forward and beats him after getting it to spin away sharply, misses the off-stump as well narrowly",6
158,153,Graeme Cremer,55346,Jeffrey Vandersay,370040,"Vandersay to Cremer, no run flighted on off, eased to mid-off off the front foot",1st innings,25.3,no run,118,0,118/6,"Vandersay to Cremer, no run",,"flighted on off, eased to mid-off off the front foot",6
159,154,Graeme Cremer,55346,Jeffrey Vandersay,370040,"Vandersay to Cremer, 1 run fuller outside off, driven away to long-off",1st innings,25.4,run,119,1,119/6,"Vandersay to Cremer, 1 run",,"fuller outside off, driven away to long-off",6
160,155,Sean Williams,55870,Jeffrey Vandersay,370040,"Vandersay to Williams, 1 run flat and short of a length, pulled away to deep square leg",1st innings,25.5,run,120,1,120/6,"Vandersay to Williams, 1 run",,"flat and short of a length, pulled away to deep square leg",6
161,156,Graeme Cremer,55346,Jeffrey Vandersay,370040,"Vandersay to Cremer, no run googly on leg stump channel, hurried him with pace as well and Cremer fails to make contact with the attempted tuck as the ball brushes the pad and goes away to the off side",1st innings,25.6,no run,120,0,120/6,"Vandersay to Cremer, no run",,"googly on leg stump channel, hurried him with pace as well and Cremer fails to make contact with the attempted tuck as the ball brushes the pad and goes away to the off side",6
162,157,Sean Williams,55870,Nuwan Kulasekara,49535,"Kulasekara to Williams, 2 runs bowls it full and on the toes, clipped away through midwicket",1st innings,26.1,run,122,2,122/6,"Kulasekara to Williams, 2 runs",,"bowls it full and on the toes, clipped away through midwicket",6
163,158,Sean Williams,55870,Nuwan Kulasekara,49535,"Kulasekara to Williams, 1 run short ball, pulled towards fine leg, does not get too much power on the shot as there was not enough room and that enables the fielder at deep backward square leg to run forward and field it",1st innings,26.2,run,123,1,123/6,"Kulasekara to Williams, 1 run",,"short ball, pulled towards fine leg, does not get too much power on the shot as there was not enough room and that enables the fielder at deep backward square leg to run forward and field it",6
164,159,Graeme Cremer,55346,Nuwan Kulasekara,49535,"Kulasekara to Cremer, no run good length ball, fends it off to covers",1st innings,26.3,no run,123,0,123/6,"Kulasekara to Cremer, no run",,"good length ball, fends it off to covers",6
165,160,Graeme Cremer,55346,Nuwan Kulasekara,49535,"Kulasekara to Cremer, no run good length, tries to tuck it to the leg side but is late in closing the face of his bat and ends up knocking it back to the bowler",1st innings,26.4,no run,123,0,123/6,"Kulasekara to Cremer, no run",,"good length, tries to tuck it to the leg side but is late in closing the face of his bat and ends up knocking it back to the bowler",6
166,161,Graeme Cremer,55346,Nuwan Kulasekara,49535,"Kulasekara to Cremer, no run defended off the front foot into the off side",1st innings,26.5,no run,123,0,123/6,"Kulasekara to Cremer, no run",,defended off the front foot into the off side,6
167,162,Graeme Cremer,55346,Nuwan Kulasekara,49535,"Kulasekara to Cremer, 1 run good length outside off, presses forward and pushes it through covers",1st innings,26.6,run,124,1,124/6,"Kulasekara to Cremer, 1 run",,"good length outside off, presses forward and pushes it through covers",6
168,163,Graeme Cremer,55346,Jeffrey Vandersay,370040,"Vandersay to Cremer, 1 run pre-meditated. Gets down to scoop this early and ends up getting a favourable full ball, gets it away towards short fine leg",1st innings,27.1,run,125,1,125/6,"Vandersay to Cremer, 1 run",,"pre-meditated. Gets down to scoop this early and ends up getting a favourable full ball, gets it away towards short fine leg",6
169,163,Sean Williams,55870,Jeffrey Vandersay,370040,"Vandersay to Williams, (no ball) 1 run short of a length, tucked off the hips to deep backward square leg",1st innings,27.1,run,127,2,127/6,"Vandersay to Williams, (no ball) 1 run",,"short of a length, tucked off the hips to deep backward square leg",6
170,164,Graeme Cremer,55346,Jeffrey Vandersay,370040,"Vandersay to Cremer, no run good, wide yorker, Cremer slashes and can't make any contact. Seems like the foot came off and Dickwella is excited after taking the bails off. It can't be a run out as the batsman wasn't that far out",1st innings,27.2,no run,127,0,127/6,"Vandersay to Cremer, no run",,"good, wide yorker, Cremer slashes and can't make any contact. Seems like the foot came off and Dickwella is excited after taking the bails off. It can't be a run out as the batsman wasn't that far out",6
171,165,Graeme Cremer,55346,Jeffrey Vandersay,370040,"Vandersay to Cremer, 1 run short and wide, slapped away to sweeper cover. They think of the second momentarily but Lakmal tidies up and fires in a throw",1st innings,27.3,run,128,1,128/6,"Vandersay to Cremer, 1 run",,"short and wide, slapped away to sweeper cover. They think of the second momentarily but Lakmal tidies up and fires in a throw",6
172,166,Sean Williams,55870,Jeffrey Vandersay,370040,"Vandersay to Williams, 1 run pitched up outside off, driven wide of mid-off",1st innings,27.4,run,129,1,129/6,"Vandersay to Williams, 1 run",,"pitched up outside off, driven wide of mid-off",6
173,167,Graeme Cremer,55346,Jeffrey Vandersay,370040,"Vandersay to Cremer, no run poor shot selection. Goes for a lap sweep to a back of a length ball that is spinning away outside off, can't make contact",1st innings,27.5,no run,129,0,129/6,"Vandersay to Cremer, no run",,"poor shot selection. Goes for a lap sweep to a back of a length ball that is spinning away outside off, can't make contact",6
174,168,Graeme Cremer,55346,Jeffrey Vandersay,370040,"Vandersay to Cremer, no run googly from Vandersay. It was full and on off and middle and Cremer was forward looking to flick it away. The ball goes past the inside edge and gets rapped. The umpire says not out but they opt for a review. There was not much gap between bat and pad and he may have got an inside edge on it. Very, very tight and the third umpire takes all of eternity to be sure of that. Eventually decides, after countless replays and angles. There is no conclusive evidence to overturn the on-field umpire's decision and Jeremiah Matibiri's call stays",1st innings,27.6,no run,129,0,129/6,"Vandersay to Cremer, no run",,"googly from Vandersay. It was full and on off and middle and Cremer was forward looking to flick it away. The ball goes past the inside edge and gets rapped. The umpire says not out but they opt for a review. There was not much gap between bat and pad and he may have got an inside edge on it. Very, very tight and the third umpire takes all of eternity to be sure of that. Eventually decides, after countless replays and angles. There is no conclusive evidence to overturn the on-field umpire's decision and Jeremiah Matibiri's call stays",6
175,169,Sean Williams,55870,Asela Gunaratne,360456,"Gunaratne to Williams, no run ",1st innings,28.1,no run,129,0,129/6,"Gunaratne to Williams, no run",,,6
176,170,Sean Williams,55870,Asela Gunaratne,360456,"Gunaratne to Williams, 2 runs very full ball, squeezed out off the front foot to the right of the fielder at extra cover who dives but can't stop it",1st innings,28.2,run,131,2,131/6,"Gunaratne to Williams, 2 runs",,"very full ball, squeezed out off the front foot to the right of the fielder at extra cover who dives but can't stop it",6
177,171,Sean Williams,55870,Asela Gunaratne,360456,"Gunaratne to Williams, no run off-cutter on a fullish length. Gets it to turn slightly line an off-break, pushed off the front foot into the off side",1st innings,28.3,no run,131,0,131/6,"Gunaratne to Williams, no run",,"off-cutter on a fullish length. Gets it to turn slightly line an off-break, pushed off the front foot into the off side",6
178,172,Sean Williams,55870,Asela Gunaratne,360456,"Gunaratne to Williams, no run very full ball, Williams jams his bat down and squeezes it out to covers",1st innings,28.4,no run,131,0,131/6,"Gunaratne to Williams, no run",,"very full ball, Williams jams his bat down and squeezes it out to covers",6
179,173,Sean Williams,55870,Asela Gunaratne,360456,"Gunaratne to Williams, 1 run punched off the backfoot to long-off",1st innings,28.5,run,132,1,132/6,"Gunaratne to Williams, 1 run",,punched off the backfoot to long-off,6
180,174,Graeme Cremer,55346,Asela Gunaratne,360456,"Gunaratne to Cremer, 1 run wristily turns it away from outside off to long-on",1st innings,28.6,run,133,1,133/6,"Gunaratne to Cremer, 1 run",,wristily turns it away from outside off to long-on,6
181,175,Graeme Cremer,55346,Jeffrey Vandersay,370040,"Vandersay to Cremer, no run pushed through at 82kph, blocked off the front foot into the off side",1st innings,29.1,no run,133,0,133/6,"Vandersay to Cremer, no run",82kph,"pushed through at 82kph, blocked off the front foot into the off side",6
182,176,Graeme Cremer,55346,Jeffrey Vandersay,370040,"Vandersay to Cremer, no run tossed up and fuller, pushed to covers off the front foot",1st innings,29.2,no run,133,0,133/6,"Vandersay to Cremer, no run",,"tossed up and fuller, pushed to covers off the front foot",6
183,177,Graeme Cremer,55346,Jeffrey Vandersay,370040,"Vandersay to Cremer, OUT good catch at extra cover. And credit to the bowler too for taking pace off the ball and tossing it up, inviting the drive. Cremer drives and does so uppishly and Kusal Mendis times him jump to perfection to snaffle it. That may have stopped on him a bit",1st innings,29.3,out,133,0,133/7,"Vandersay to Cremer, OUT",,"good catch at extra cover. And credit to the bowler too for taking pace off the ball and tossing it up, inviting the drive. Cremer drives and does so uppishly and Kusal Mendis times him jump to perfection to snaffle it. That may have stopped on him a bit",7
184,178,Donald Tiripano,392945,Jeffrey Vandersay,370040,"Vandersay to Tiripano, no run comes forward to defend but does not pick that it's a googly. Appeal for lbw but not given. But maybe it would have missed leg",1st innings,29.4,no run,133,0,133/7,"Vandersay to Tiripano, no run",,comes forward to defend but does not pick that it's a googly. Appeal for lbw but not given. But maybe it would have missed leg,7
185,179,Donald Tiripano,392945,Jeffrey Vandersay,370040,"Vandersay to Tiripano, 3 runs tucked off the pads and the ball goes to deep fine leg where it is pulled back just before the boundary",1st innings,29.5,run,136,3,136/7,"Vandersay to Tiripano, 3 runs",,tucked off the pads and the ball goes to deep fine leg where it is pulled back just before the boundary,7
186,180,Sean Williams,55870,Jeffrey Vandersay,370040,"Vandersay to Williams, 1 run fuller ball, clipped to deep midwicket",1st innings,29.6,run,137,1,137/7,"Vandersay to Williams, 1 run",,"fuller ball, clipped to deep midwicket",7
187,181,Sean Williams,55870,Asela Gunaratne,360456,"Gunaratne to Williams, 1 run short ball, pulled to deep square leg",1st innings,30.1,run,138,1,138/7,"Gunaratne to Williams, 1 run",,"short ball, pulled to deep square leg",7
188,182,Donald Tiripano,392945,Asela Gunaratne,360456,"Gunaratne to Tiripano, no run beaten on the drive. It was an off-cutter and Tiripano chased after it leaving a big gap between bat and pad",1st innings,30.2,no run,138,0,138/7,"Gunaratne to Tiripano, no run",,beaten on the drive. It was an off-cutter and Tiripano chased after it leaving a big gap between bat and pad,7
189,183,Donald Tiripano,392945,Asela Gunaratne,360456,"Gunaratne to Tiripano, no run pitched up ball, drilled back to the bolwer",1st innings,30.3,no run,138,0,138/7,"Gunaratne to Tiripano, no run",,"pitched up ball, drilled back to the bolwer",7
190,184,Donald Tiripano,392945,Asela Gunaratne,360456,"Gunaratne to Tiripano, 1 run full and outside off, pushed back towards the bowler who gets down but cannot pick it up. Mid-off runs across and responds with a one-handed pick-up s the batsmen try a single off the misfield. Direct hit at the non-striker's  end would have seen the back of Tiripano",1st innings,30.4,run,139,1,139/7,"Gunaratne to Tiripano, 1 run",,"full and outside off, pushed back towards the bowler who gets down but cannot pick it up. Mid-off runs across and responds with a one-handed pick-up s the batsmen try a single off the misfield. Direct hit at the non-striker's  end would have seen the back of Tiripano",7
191,185,Sean Williams,55870,Asela Gunaratne,360456,"Gunaratne to Williams, no run punched off the backfoot to the bowler",1st innings,30.5,no run,139,0,139/7,"Gunaratne to Williams, no run",,punched off the backfoot to the bowler,7
192,186,Sean Williams,55870,Asela Gunaratne,360456,"Gunaratne to Williams, 1 run pitched up on the stumps, eased down to long-off",1st innings,30.6,run,140,1,140/7,"Gunaratne to Williams, 1 run",,"pitched up on the stumps, eased down to long-off",7
193,187,Sean Williams,55870,Jeffrey Vandersay,370040,"Vandersay to Williams, no run blocked down the pitch off the front foot",1st innings,31.1,no run,140,0,140/7,"Vandersay to Williams, no run",,blocked down the pitch off the front foot,7
194,188,Sean Williams,55870,Jeffrey Vandersay,370040,"Vandersay to Williams, no run gets a stride across to meet the pitch of this fuller ball outside off and wristily drills it to the left of the bowler who fields it",1st innings,31.2,no run,140,0,140/7,"Vandersay to Williams, no run",,gets a stride across to meet the pitch of this fuller ball outside off and wristily drills it to the left of the bowler who fields it,7
195,189,Sean Williams,55870,Jeffrey Vandersay,370040,"Vandersay to Williams, 1 run tucked with the spin to backward square leg",1st innings,31.3,run,141,1,141/7,"Vandersay to Williams, 1 run",,tucked with the spin to backward square leg,7
196,190,Donald Tiripano,392945,Jeffrey Vandersay,370040,"Vandersay to Tiripano, 2 runs short and spinning away. Tiripano deliberately opens the face of his bat late and gets it wide of first slip towards third man",1st innings,31.4,run,143,2,143/7,"Vandersay to Tiripano, 2 runs",,short and spinning away. Tiripano deliberately opens the face of his bat late and gets it wide of first slip towards third man,7
197,191,Donald Tiripano,392945,Jeffrey Vandersay,370040,"Vandersay to Tiripano, no run flighted and pitched up on middle, defended off the front foot towards mid-off. The bowler runs back and fields it",1st innings,31.5,no run,143,0,143/7,"Vandersay to Tiripano, no run",,"flighted and pitched up on middle, defended off the front foot towards mid-off. The bowler runs back and fields it",7
198,192,Donald Tiripano,392945,Jeffrey Vandersay,370040,"Vandersay to Tiripano, 2 runs fuller outside off, presses forward to meet the pitch of the ball before easing a drive between extra cover and long-off",1st innings,31.6,run,145,2,145/7,"Vandersay to Tiripano, 2 runs",,"fuller outside off, presses forward to meet the pitch of the ball before easing a drive between extra cover and long-off",7
199,193,Sean Williams,55870,Asela Gunaratne,360456,"Gunaratne to Williams, 1 run punched to sweeper cover",1st innings,32.1,run,146,1,146/7,"Gunaratne to Williams, 1 run",,punched to sweeper cover,7
200,194,Donald Tiripano,392945,Asela Gunaratne,360456,"Gunaratne to Tiripano, no run short of a length, punched off the backfoot straight back to the bowler",1st innings,32.2,no run,146,0,146/7,"Gunaratne to Tiripano, no run",,"short of a length, punched off the backfoot straight back to the bowler",7
201,195,Donald Tiripano,392945,Asela Gunaratne,360456,"Gunaratne to Tiripano, no run full outside off, comes forward to drive and the ball goes off the inside part of the bat to midwicket",1st innings,32.3,no run,146,0,146/7,"Gunaratne to Tiripano, no run",,"full outside off, comes forward to drive and the ball goes off the inside part of the bat to midwicket",7
202,196,Donald Tiripano,392945,Asela Gunaratne,360456,"Gunaratne to Tiripano, no run stays back and tries to tuck behind square but finds short fine leg",1st innings,32.4,no run,146,0,146/7,"Gunaratne to Tiripano, no run",,stays back and tries to tuck behind square but finds short fine leg,7
203,197,Donald Tiripano,392945,Asela Gunaratne,360456,"Gunaratne to Tiripano, no run short of a length, looks to hang back and tuck to the leg side. It was an off-cutter and spins back in sharply to rap Tiripano on the pads. The turn would have taken it down leg",1st innings,32.5,no run,146,0,146/7,"Gunaratne to Tiripano, no run",,"short of a length, looks to hang back and tuck to the leg side. It was an off-cutter and spins back in sharply to rap Tiripano on the pads. The turn would have taken it down leg",7
204,198,Donald Tiripano,392945,Asela Gunaratne,360456,"Gunaratne to Tiripano, no run knocks it uppishly to midwicket but the ball drops in front of him",1st innings,32.6,no run,146,0,146/7,"Gunaratne to Tiripano, no run",,knocks it uppishly to midwicket but the ball drops in front of him,7
205,199,Sean Williams,55870,Jeffrey Vandersay,370040,"Vandersay to Williams, 1 run steered to backward point",1st innings,33.1,run,147,1,147/7,"Vandersay to Williams, 1 run",,steered to backward point,7
206,200,Donald Tiripano,392945,Jeffrey Vandersay,370040,"Vandersay to Tiripano, no run flighted on the stumps, blocked off the front foot into the off side",1st innings,33.2,no run,147,0,147/7,"Vandersay to Tiripano, no run",,"flighted on the stumps, blocked off the front foot into the off side",7
207,201,Donald Tiripano,392945,Jeffrey Vandersay,370040,"Vandersay to Tiripano, no run pitched up and drawing the batsman forward before getting it to spin away sharply, defended",1st innings,33.3,no run,147,0,147/7,"Vandersay to Tiripano, no run",,"pitched up and drawing the batsman forward before getting it to spin away sharply, defended",7
208,202,Donald Tiripano,392945,Jeffrey Vandersay,370040,"Vandersay to Tiripano, 1 run slightly back of a length and spinning away, punched to long-off",1st innings,33.4,run,148,1,148/7,"Vandersay to Tiripano, 1 run",,"slightly back of a length and spinning away, punched to long-off",7
209,203,Sean Williams,55870,Jeffrey Vandersay,370040,"Vandersay to Williams, FOUR runs tossed up on leg stump but gives it too much air. Williams accepts the low full toss, gets down and sweeps to deep backward square leg",1st innings,33.5,four,152,4,152/7,"Vandersay to Williams, FOUR runs",,"tossed up on leg stump but gives it too much air. Williams accepts the low full toss, gets down and sweeps to deep backward square leg",7
210,204,Sean Williams,55870,Jeffrey Vandersay,370040,"Vandersay to Williams, 1 run tucked to deep square leg",1st innings,33.6,run,153,1,153/7,"Vandersay to Williams, 1 run",,tucked to deep square leg,7
211,205,Sean Williams,55870,Asela Gunaratne,360456,"Gunaratne to Williams, no run gets the front foot inside the line of the ballas he comes forward and defends",1st innings,34.1,no run,153,0,153/7,"Gunaratne to Williams, no run",,gets the front foot inside the line of the ballas he comes forward and defends,7
212,206,Sean Williams,55870,Asela Gunaratne,360456,"Gunaratne to Williams, 1 run driven to long-off and they jog trough the single",1st innings,34.2,run,154,1,154/7,"Gunaratne to Williams, 1 run",,driven to long-off and they jog trough the single,7
213,207,Donald Tiripano,392945,Asela Gunaratne,360456,"Gunaratne to Tiripano, 1 run short of a length outside off, shuffles across and tucks it to midwicket",1st innings,34.3,run,155,1,155/7,"Gunaratne to Tiripano, 1 run",,"short of a length outside off, shuffles across and tucks it to midwicket",7
214,208,Sean Williams,55870,Asela Gunaratne,360456,"Gunaratne to Williams, no run fullish and on off, blocked",1st innings,34.4,no run,155,0,155/7,"Gunaratne to Williams, no run",,"fullish and on off, blocked",7
215,209,Sean Williams,55870,Asela Gunaratne,360456,"Gunaratne to Williams, no run short of a length, sees a little bit of width and flays it with a flat bat, can't beat short cover",1st innings,34.5,no run,155,0,155/7,"Gunaratne to Williams, no run",,"short of a length, sees a little bit of width and flays it with a flat bat, can't beat short cover",7
216,210,Sean Williams,55870,Asela Gunaratne,360456,"Gunaratne to Williams, OUT another slog sweep gone awry. Williams gets down and goes across the line of this fuller ball. Skews it off the leading edge to cover where Dhananjaya de Silva pouches it comfortably. That was he off-cutter and Williams did not account for the turn",1st innings,34.6,out,155,0,155/8,"Gunaratne to Williams, OUT",,another slog sweep gone awry. Williams gets down and goes across the line of this fuller ball. Skews it off the leading edge to cover where Dhananjaya de Silva pouches it comfortably. That was he off-cutter and Williams did not account for the turn,8
217,211,Tendai Chisoro,235519,Suranga Lakmal,49619,"Lakmal to Chisoro, no run good length outside off, gets an inside edge on the front foot defence and the ball goes to the leg side",1st innings,35.1,no run,155,0,155/8,"Lakmal to Chisoro, no run",,"good length outside off, gets an inside edge on the front foot defence and the ball goes to the leg side",8
