,ball,batsman,batsman_id,bowler,bowler_id,commentary,innings,overs,playType,runs,runs_scored,score,shortText,speed,text,wickets
377,71,Solomon Mire,290462,Gulbadin Naib,352048,"Gulbadin Naib to Mire, no run length, outside off, defends to the leg side",2nd innings,11.5,no run,62,0,62/0,"Gulbadin Naib to Mire, no run",,"length, outside off, defends to the leg side",0
378,72,Solomon Mire,290462,Gulbadin Naib,352048,"Gulbadin Naib to Mire, no run slower one, outside off, pushed away to the off side",2nd innings,12.0,no run,62,0,62/0,"Gulbadin Naib to Mire, no run",,"slower one, outside off, pushed away to the off side",0
379,73,Peter Moor,333000,Dawlat Zadran,516561,"Dawlat Zadran to Moor, 1 run back of a length, outside off, glanced to the leg side",2nd innings,12.1,run,63,1,63/0,"Dawlat Zadran to Moor, 1 run",,"back of a length, outside off, glanced to the leg side",0
380,74,Solomon Mire,290462,Dawlat Zadran,516561,"Dawlat Zadran to Mire, 1 run short, angling into Mire, who hooks to fine leg",2nd innings,12.2,run,64,1,64/0,"Dawlat Zadran to Mire, 1 run",,"short, angling into Mire, who hooks to fine leg",0
381,75,Peter Moor,333000,Dawlat Zadran,516561,"Dawlat Zadran to Moor, no run full, jags back, Moor is struck on the pad. A huge LBW shout turned down. It must have been an inside edge",2nd innings,12.3,no run,64,0,64/0,"Dawlat Zadran to Moor, no run",,"full, jags back, Moor is struck on the pad. A huge LBW shout turned down. It must have been an inside edge",0
382,76,Peter Moor,333000,Dawlat Zadran,516561,"Dawlat Zadran to Moor, no run back of a length, on middle , Moor jumps as he defends to the off side",2nd innings,12.4,no run,64,0,64/0,"Dawlat Zadran to Moor, no run",,"back of a length, on middle , Moor jumps as he defends to the off side",0
383,77,Peter Moor,333000,Dawlat Zadran,516561,"Dawlat Zadran to Moor, no run short, and wide, Moor cant time it well, gets the bottom edge",2nd innings,12.5,no run,64,0,64/0,"Dawlat Zadran to Moor, no run",,"short, and wide, Moor cant time it well, gets the bottom edge",0
384,78,Peter Moor,333000,Dawlat Zadran,516561,"Dawlat Zadran to Moor, 1 run takes a single off the last ball, leans forward, drives through the gap in the cover fence to sweeper",2nd innings,13.0,run,65,1,65/0,"Dawlat Zadran to Moor, 1 run",,"takes a single off the last ball, leans forward, drives through the gap in the cover fence to sweeper",0
385,79,Peter Moor,333000,Gulbadin Naib,352048,"Gulbadin Naib to Moor, no run back of a length, outside off, Moor pushes it away",2nd innings,13.1,no run,65,0,65/0,"Gulbadin Naib to Moor, no run",,"back of a length, outside off, Moor pushes it away",0
386,80,Peter Moor,333000,Gulbadin Naib,352048,"Gulbadin Naib to Moor, 1 run length, on middle and leg, Moor stands tall, pushes down to long on",2nd innings,13.2,run,66,1,66/0,"Gulbadin Naib to Moor, 1 run",,"length, on middle and leg, Moor stands tall, pushes down to long on",0
387,81,Solomon Mire,290462,Gulbadin Naib,352048,"Gulbadin Naib to Mire, 1 run slow ball, outside off, Mire drives to long on",2nd innings,13.3,run,67,1,67/0,"Gulbadin Naib to Mire, 1 run",,"slow ball, outside off, Mire drives to long on",0
388,82,Peter Moor,333000,Gulbadin Naib,352048,"Gulbadin Naib to Moor, 1 run full, on off, Moor comes forward, drives down to sweeper",2nd innings,13.4,run,68,1,68/0,"Gulbadin Naib to Moor, 1 run",,"full, on off, Moor comes forward, drives down to sweeper",0
389,83,Solomon Mire,290462,Gulbadin Naib,352048,"Gulbadin Naib to Mire, 1 run short, Mire hangs back, pulls with the splice, loops over the bowlers head",2nd innings,13.5,run,69,1,69/0,"Gulbadin Naib to Mire, 1 run",,"short, Mire hangs back, pulls with the splice, loops over the bowlers head",0
390,84,Peter Moor,333000,Gulbadin Naib,352048,"Gulbadin Naib to Moor, no run smart fielding at point, Moor comes forward, tries to squeeze it past point who dives to his left and grabs it",2nd innings,14.0,no run,69,0,69/0,"Gulbadin Naib to Moor, no run",,"smart fielding at point, Moor comes forward, tries to squeeze it past point who dives to his left and grabs it",0
391,85,Solomon Mire,290462,Rashid Khan,793463,"Rashid Khan to Mire, OUT well bowled!, tossed the googly , on off, turns sharply in, Mire goes for the drive, ball snicks through the gate and the stumps are disturbed",2nd innings,14.1,out,69,0,69/1,"Rashid Khan to Mire, OUT",,"well bowled!, tossed the googly , on off, turns sharply in, Mire goes for the drive, ball snicks through the gate and the stumps are disturbed",1
392,86,Craig Ervine,55412,Rashid Khan,793463,"Rashid Khan to Ervine, no run comes forward, defends to the leg side",2nd innings,14.2,no run,69,0,69/1,"Rashid Khan to Ervine, no run",,"comes forward, defends to the leg side",1
393,87,Craig Ervine,55412,Rashid Khan,793463,"Rashid Khan to Ervine, 1 run gets off the mark with a tickle to the leg side for a single",2nd innings,14.3,run,70,1,70/1,"Rashid Khan to Ervine, 1 run",,gets off the mark with a tickle to the leg side for a single,1
394,88,Peter Moor,333000,Rashid Khan,793463,"Rashid Khan to Moor, 1 run flat, on leg, Moor hangs back, drives towards long on, gets one",2nd innings,14.4,run,71,1,71/1,"Rashid Khan to Moor, 1 run",,"flat, on leg, Moor hangs back, drives towards long on, gets one",1
395,89,Craig Ervine,55412,Rashid Khan,793463,"Rashid Khan to Ervine, no run tossed, on middle and off, Ervine lunges forward, defends",2nd innings,14.5,no run,71,0,71/1,"Rashid Khan to Ervine, no run",,"tossed, on middle and off, Ervine lunges forward, defends",1
396,90,Craig Ervine,55412,Rashid Khan,793463,"Rashid Khan to Ervine, no run comes forward, presents the full face of the bat, blocked",2nd innings,15.0,no run,71,0,71/1,"Rashid Khan to Ervine, no run",,"comes forward, presents the full face of the bat, blocked",1
397,91,Peter Moor,333000,Gulbadin Naib,352048,"Gulbadin Naib to Moor, 2 runs full, on off, Moor comes well forward, drills it through the covers, gets back for two",2nd innings,15.1,run,73,2,73/1,"Gulbadin Naib to Moor, 2 runs",,"full, on off, Moor comes well forward, drills it through the covers, gets back for two",1
398,92,Peter Moor,333000,Gulbadin Naib,352048,"Gulbadin Naib to Moor, no run back of a length, on off, pushed to cover",2nd innings,15.2,no run,73,0,73/1,"Gulbadin Naib to Moor, no run",,"back of a length, on off, pushed to cover",1
399,93,Peter Moor,333000,Gulbadin Naib,352048,"Gulbadin Naib to Moor, OUT and there goes the second wicket!, length, just outside the off stump, Moor comes forward to drive, gets a tiny outside edge through to Shahzad , who takes it easily",2nd innings,15.3,out,73,0,73/2,"Gulbadin Naib to Moor, OUT",,"and there goes the second wicket!, length, just outside the off stump, Moor comes forward to drive, gets a tiny outside edge through to Shahzad , who takes it easily",2
400,94,Hamilton Masakadza,55608,Gulbadin Naib,352048,"Gulbadin Naib to Masakadza, 1 run comes back into his crease, punches to the off side",2nd innings,15.4,run,74,1,74/2,"Gulbadin Naib to Masakadza, 1 run",,"comes back into his crease, punches to the off side",2
401,95,Craig Ervine,55412,Gulbadin Naib,352048,"Gulbadin Naib to Ervine, no run comes fully forward, bat to pad, defends to the off side",2nd innings,15.5,no run,74,0,74/2,"Gulbadin Naib to Ervine, no run",,"comes fully forward, bat to pad, defends to the off side",2
402,96,Craig Ervine,55412,Gulbadin Naib,352048,"Gulbadin Naib to Ervine, no run back of a length, outside off, cuts to point to end the over",2nd innings,16.0,no run,74,0,74/2,"Gulbadin Naib to Ervine, no run",,"back of a length, outside off, cuts to point to end the over",2
403,97,Hamilton Masakadza,55608,Rashid Khan,793463,"Rashid Khan to Masakadza, no run tossed, turned into Masakadza, drives to the leg side off the inside edge",2nd innings,16.1,no run,74,0,74/2,"Rashid Khan to Masakadza, no run",,"tossed, turned into Masakadza, drives to the leg side off the inside edge",2
404,98,Hamilton Masakadza,55608,Rashid Khan,793463,"Rashid Khan to Masakadza, no run beats the outside edge as Masakadza tries to defend",2nd innings,16.2,no run,74,0,74/2,"Rashid Khan to Masakadza, no run",,beats the outside edge as Masakadza tries to defend,2
405,99,Hamilton Masakadza,55608,Rashid Khan,793463,"Rashid Khan to Masakadza, no run gets back, blocks",2nd innings,16.3,no run,74,0,74/2,"Rashid Khan to Masakadza, no run",,"gets back, blocks",2
406,100,Hamilton Masakadza,55608,Rashid Khan,793463,"Rashid Khan to Masakadza, 1 run short, Hammy hangs back, pushes to the leg side",2nd innings,16.4,run,75,1,75/2,"Rashid Khan to Masakadza, 1 run",,"short, Hammy hangs back, pushes to the leg side",2
407,101,Craig Ervine,55412,Rashid Khan,793463,"Rashid Khan to Ervine, no run touch full, on leg, pushed to mid wicket",2nd innings,16.5,no run,75,0,75/2,"Rashid Khan to Ervine, no run",,"touch full, on leg, pushed to mid wicket",2
408,102,Craig Ervine,55412,Rashid Khan,793463,"Rashid Khan to Ervine, no run tossed, on leg, glances to the leg side to end the over",2nd innings,17.0,no run,75,0,75/2,"Rashid Khan to Ervine, no run",,"tossed, on leg, glances to the leg side to end the over",2
409,103,Hamilton Masakadza,55608,Gulbadin Naib,352048,"Gulbadin Naib to Masakadza, 1 run short and wide, Hammy frees his arm, cuts , beats man at point but sweeper does the fielding in the deep",2nd innings,17.1,run,76,1,76/2,"Gulbadin Naib to Masakadza, 1 run",,"short and wide, Hammy frees his arm, cuts , beats man at point but sweeper does the fielding in the deep",2
410,104,Craig Ervine,55412,Gulbadin Naib,352048,"Gulbadin Naib to Ervine, 1 run back of a length, outside off, Ervine jumps back, pushes towards extra cover, takes a single",2nd innings,17.2,run,77,1,77/2,"Gulbadin Naib to Ervine, 1 run",,"back of a length, outside off, Ervine jumps back, pushes towards extra cover, takes a single",2
411,105,Hamilton Masakadza,55608,Gulbadin Naib,352048,"Gulbadin Naib to Masakadza, no run short, stays low, Hammy punches it back to the bowler",2nd innings,17.3,no run,77,0,77/2,"Gulbadin Naib to Masakadza, no run",,"short, stays low, Hammy punches it back to the bowler",2
412,106,Hamilton Masakadza,55608,Gulbadin Naib,352048,"Gulbadin Naib to Masakadza, no run solidly forward, Hammy defends solidly yot the off side. The fans aren't impressed by that",2nd innings,17.4,no run,77,0,77/2,"Gulbadin Naib to Masakadza, no run",,"solidly forward, Hammy defends solidly yot the off side. The fans aren't impressed by that",2
413,107,Hamilton Masakadza,55608,Gulbadin Naib,352048,"Gulbadin Naib to Masakadza, 2 runs back of a length, outside off, Masakadza leans back, pushes it wide to the left of sweeper, comes back for two",2nd innings,17.5,run,79,2,79/2,"Gulbadin Naib to Masakadza, 2 runs",,"back of a length, outside off, Masakadza leans back, pushes it wide to the left of sweeper, comes back for two",2
414,108,Hamilton Masakadza,55608,Gulbadin Naib,352048,"Gulbadin Naib to Masakadza, no run hangs back, defends solidly to the off side",2nd innings,18.0,no run,79,0,79/2,"Gulbadin Naib to Masakadza, no run",,"hangs back, defends solidly to the off side",2
415,109,Craig Ervine,55412,Rashid Khan,793463,"Rashid Khan to Ervine, FOUR runs aah good shot! , tossed on leg, Ervine stretches forward, sweeps it past short fine, takes four",2nd innings,18.1,four,83,4,83/2,"Rashid Khan to Ervine, FOUR runs",,"aah good shot! , tossed on leg, Ervine stretches forward, sweeps it past short fine, takes four",2
416,110,Craig Ervine,55412,Rashid Khan,793463,"Rashid Khan to Ervine, no run comes forward, blocks with bat and pad",2nd innings,18.2,no run,83,0,83/2,"Rashid Khan to Ervine, no run",,"comes forward, blocks with bat and pad",2
417,111,Craig Ervine,55412,Rashid Khan,793463,"Rashid Khan to Ervine, no run turns and bounce into the left hander, defends",2nd innings,18.3,no run,83,0,83/2,"Rashid Khan to Ervine, no run",,"turns and bounce into the left hander, defends",2
418,112,Craig Ervine,55412,Rashid Khan,793463,"Rashid Khan to Ervine, no run tossed, on off, Ervine defends to the off side",2nd innings,18.4,no run,83,0,83/2,"Rashid Khan to Ervine, no run",,"tossed, on off, Ervine defends to the off side",2
419,113,Craig Ervine,55412,Rashid Khan,793463,"Rashid Khan to Ervine, 1 run tossed, on off, Ervine defends to the off side",2nd innings,18.5,run,84,1,84/2,"Rashid Khan to Ervine, 1 run",,"tossed, on off, Ervine defends to the off side",2
420,114,Hamilton Masakadza,55608,Rashid Khan,793463,"Rashid Khan to Masakadza, OUT Rashid wins the battle, traps Masakadza plumb in front with his deadly googly. Masakadza plants his front foot forward gets beaten completely , gets struck on the pad and the dreaded finger is up",2nd innings,19.0,out,84,0,84/3,"Rashid Khan to Masakadza, OUT",,"Rashid wins the battle, traps Masakadza plumb in front with his deadly googly. Masakadza plants his front foot forward gets beaten completely , gets struck on the pad and the dreaded finger is up",3
421,115,Craig Ervine,55412,Gulbadin Naib,352048,"Gulbadin Naib to Ervine, no run length, outside off, slammed to the off side",2nd innings,19.1,no run,84,0,84/3,"Gulbadin Naib to Ervine, no run",,"length, outside off, slammed to the off side",3
422,116,Craig Ervine,55412,Gulbadin Naib,352048,"Gulbadin Naib to Ervine, no run shout for LBW , height might have saved him there",2nd innings,19.2,no run,84,0,84/3,"Gulbadin Naib to Ervine, no run",,"shout for LBW , height might have saved him there",3
423,117,Craig Ervine,55412,Gulbadin Naib,352048,"Gulbadin Naib to Ervine, 1 leg bye another shout for LBW , this time going down leg , gets a leg bye",2nd innings,19.3,leg bye,85,1,85/3,"Gulbadin Naib to Ervine, 1 leg bye",,"another shout for LBW , this time going down leg , gets a leg bye",3
424,117,Ryan Burl,495964,Gulbadin Naib,352048,"Gulbadin Naib to Burl, 3 wides Yikes, that's went flying down the leg side, Burl tries the glance, misses, Shahzad flew to his right, gets glove to ball",2nd innings,19.3,wide,88,3,88/3,"Gulbadin Naib to Burl, 3 wides",,"Yikes, that's went flying down the leg side, Burl tries the glance, misses, Shahzad flew to his right, gets glove to ball",3
425,118,Ryan Burl,495964,Gulbadin Naib,352048,"Gulbadin Naib to Burl, no run short, outside off, stays low, Burl misses the drive",2nd innings,19.4,no run,88,0,88/3,"Gulbadin Naib to Burl, no run",,"short, outside off, stays low, Burl misses the drive",3
426,119,Ryan Burl,495964,Gulbadin Naib,352048,"Gulbadin Naib to Burl, no run full, almost a Yorker, on off ,Burl digs it out",2nd innings,19.5,no run,88,0,88/3,"Gulbadin Naib to Burl, no run",,"full, almost a Yorker, on off ,Burl digs it out",3
427,120,Ryan Burl,495964,Gulbadin Naib,352048,"Gulbadin Naib to Burl, no run length, outside off, defends solidly to the off side",2nd innings,20.0,no run,88,0,88/3,"Gulbadin Naib to Burl, no run",,"length, outside off, defends solidly to the off side",3
428,121,Craig Ervine,55412,Rashid Khan,793463,"Rashid Khan to Ervine, 1 run gets down on one knee, sweeps to short fine, takes a single",2nd innings,20.1,run,89,1,89/3,"Rashid Khan to Ervine, 1 run",,"gets down on one knee, sweeps to short fine, takes a single",3
429,122,Ryan Burl,495964,Rashid Khan,793463,"Rashid Khan to Burl, no run full, on middle, Burl finds a tiny edge to the pad",2nd innings,20.2,no run,89,0,89/3,"Rashid Khan to Burl, no run",,"full, on middle, Burl finds a tiny edge to the pad",3
430,123,Ryan Burl,495964,Rashid Khan,793463,"Rashid Khan to Burl, no run full, outside off, punches to the off side",2nd innings,20.3,no run,89,0,89/3,"Rashid Khan to Burl, no run",,"full, outside off, punches to the off side",3
431,124,Ryan Burl,495964,Rashid Khan,793463,"Rashid Khan to Burl, no run on leg stump, pushed away",2nd innings,20.4,no run,89,0,89/3,"Rashid Khan to Burl, no run",,"on leg stump, pushed away",3
432,125,Ryan Burl,495964,Rashid Khan,793463,"Rashid Khan to Burl, no run back of a length, beats the outside edge",2nd innings,20.5,no run,89,0,89/3,"Rashid Khan to Burl, no run",,"back of a length, beats the outside edge",3
433,126,Ryan Burl,495964,Rashid Khan,793463,"Rashid Khan to Burl, no run leans back, drives to cover  to end the over",2nd innings,21.0,no run,89,0,89/3,"Rashid Khan to Burl, no run",,"leans back, drives to cover  to end the over",3
434,127,Craig Ervine,55412,Gulbadin Naib,352048,"Gulbadin Naib to Ervine, 3 runs full, outside off, Ervine unfurls a cracking cover drive to the right of mid off, gets back for three",2nd innings,21.1,run,92,3,92/3,"Gulbadin Naib to Ervine, 3 runs",,"full, outside off, Ervine unfurls a cracking cover drive to the right of mid off, gets back for three",3
435,128,Ryan Burl,495964,Gulbadin Naib,352048,"Gulbadin Naib to Burl, no run solidly forward, defends to the offside",2nd innings,21.2,no run,92,0,92/3,"Gulbadin Naib to Burl, no run",,"solidly forward, defends to the offside",3
436,129,Ryan Burl,495964,Gulbadin Naib,352048,"Gulbadin Naib to Burl, no run blocks it out once again off the front foot",2nd innings,21.3,no run,92,0,92/3,"Gulbadin Naib to Burl, no run",,blocks it out once again off the front foot,3
437,130,Ryan Burl,495964,Gulbadin Naib,352048,"Gulbadin Naib to Burl, 1 run comes forward, pushes this wide to the left of point, takes a single",2nd innings,21.4,run,93,1,93/3,"Gulbadin Naib to Burl, 1 run",,"comes forward, pushes this wide to the left of point, takes a single",3
438,131,Craig Ervine,55412,Gulbadin Naib,352048,"Gulbadin Naib to Ervine, no run length, into the left hander, pushes to mid on",2nd innings,21.5,no run,93,0,93/3,"Gulbadin Naib to Ervine, no run",,"length, into the left hander, pushes to mid on",3
439,132,Craig Ervine,55412,Gulbadin Naib,352048,"Gulbadin Naib to Ervine, 1 run length, outside off, Ervine slaps it through the covers for a single",2nd innings,22.0,run,94,1,94/3,"Gulbadin Naib to Ervine, 1 run",,"length, outside off, Ervine slaps it through the covers for a single",3
440,133,Craig Ervine,55412,Mohammad Nabi,25913,"Mohammad Nabi to Ervine, 1 run tossed, on off, Ervine comes down the track, drills to long on",2nd innings,22.1,run,95,1,95/3,"Mohammad Nabi to Ervine, 1 run",,"tossed, on off, Ervine comes down the track, drills to long on",3
441,134,Ryan Burl,495964,Mohammad Nabi,25913,"Mohammad Nabi to Burl, no run very slow, tossed blocked back to Nabi",2nd innings,22.2,no run,95,0,95/3,"Mohammad Nabi to Burl, no run",,"very slow, tossed blocked back to Nabi",3
442,135,Ryan Burl,495964,Mohammad Nabi,25913,"Mohammad Nabi to Burl, 1 run comes down the track, drives wide of bowler, long on fields",2nd innings,22.3,run,96,1,96/3,"Mohammad Nabi to Burl, 1 run",,"comes down the track, drives wide of bowler, long on fields",3
443,136,Craig Ervine,55412,Mohammad Nabi,25913,"Mohammad Nabi to Ervine, 1 run back of a length, cuts towards point",2nd innings,22.4,run,97,1,97/3,"Mohammad Nabi to Ervine, 1 run",,"back of a length, cuts towards point",3
444,137,Ryan Burl,495964,Mohammad Nabi,25913,"Mohammad Nabi to Burl, 1 run tossed, on off, slammed towards long off, gets one",2nd innings,22.5,run,98,1,98/3,"Mohammad Nabi to Burl, 1 run",,"tossed, on off, slammed towards long off, gets one",3
445,138,Craig Ervine,55412,Mohammad Nabi,25913,"Mohammad Nabi to Ervine, no run steps forward, defends back to the bowler",2nd innings,23.0,no run,98,0,98/3,"Mohammad Nabi to Ervine, no run",,"steps forward, defends back to the bowler",3
446,139,Ryan Burl,495964,Dawlat Zadran,516561,"Dawlat Zadran to Burl, 1 run length, outside off, Burl reaches for it, drives wide of point who dives, but can't stop the single",2nd innings,23.1,run,99,1,99/3,"Dawlat Zadran to Burl, 1 run",,"length, outside off, Burl reaches for it, drives wide of point who dives, but can't stop the single",3
447,140,Craig Ervine,55412,Dawlat Zadran,516561,"Dawlat Zadran to Ervine, 1 run <b> 100 up for Zimbabwe </b>, length, on off, Ervine drives through the covers, takes a single",2nd innings,23.2,run,100,1,100/3,"Dawlat Zadran to Ervine, 1 run",,"<b> 100 up for Zimbabwe </b>, length, on off, Ervine drives through the covers, takes a single",3
448,141,Ryan Burl,495964,Dawlat Zadran,516561,"Dawlat Zadran to Burl, 1 run short and wide, outside off, Burl plays it very late, beats man at point",2nd innings,23.3,run,101,1,101/3,"Dawlat Zadran to Burl, 1 run",,"short and wide, outside off, Burl plays it very late, beats man at point",3
449,142,Craig Ervine,55412,Dawlat Zadran,516561,"Dawlat Zadran to Ervine, 1 run bangs it short, Ervine rides the bounce, guides it past point to thirdman",2nd innings,23.4,run,102,1,102/3,"Dawlat Zadran to Ervine, 1 run",,"bangs it short, Ervine rides the bounce, guides it past point to thirdman",3
450,143,Ryan Burl,495964,Dawlat Zadran,516561,"Dawlat Zadran to Burl, 1 run back of a length, drives to sweeper",2nd innings,23.5,run,103,1,103/3,"Dawlat Zadran to Burl, 1 run",,"back of a length, drives to sweeper",3
451,144,Craig Ervine,55412,Dawlat Zadran,516561,"Dawlat Zadran to Ervine, no run length, on off, drills to mid off",2nd innings,24.0,no run,103,0,103/3,"Dawlat Zadran to Ervine, no run",,"length, on off, drills to mid off",3
452,145,Ryan Burl,495964,Rashid Khan,793463,"Rashid Khan to Burl, 1 run nudges to the leg side for a single",2nd innings,24.1,run,104,1,104/3,"Rashid Khan to Burl, 1 run",,nudges to the leg side for a single,3
453,146,Craig Ervine,55412,Rashid Khan,793463,"Rashid Khan to Ervine, no run gets deep into his crease, guides to gully",2nd innings,24.2,no run,104,0,104/3,"Rashid Khan to Ervine, no run",,"gets deep into his crease, guides to gully",3
454,147,Craig Ervine,55412,Rashid Khan,793463,"Rashid Khan to Ervine, no run tossed, on leg, drives to mid wicket",2nd innings,24.3,no run,104,0,104/3,"Rashid Khan to Ervine, no run",,"tossed, on leg, drives to mid wicket",3
455,148,Craig Ervine,55412,Rashid Khan,793463,"Rashid Khan to Ervine, no run on a length, pacey, defends to the bowler",2nd innings,24.4,no run,104,0,104/3,"Rashid Khan to Ervine, no run",,"on a length, pacey, defends to the bowler",3
456,149,Craig Ervine,55412,Rashid Khan,793463,"Rashid Khan to Ervine, 1 run gets bat to ball very late, got Rashid interested, takes one",2nd innings,24.5,run,105,1,105/3,"Rashid Khan to Ervine, 1 run",,"gets bat to ball very late, got Rashid interested, takes one",3
457,150,Ryan Burl,495964,Rashid Khan,793463,"Rashid Khan to Burl, 1 run oh dear, another misfield through the legs at short fine leg gives away a single",2nd innings,25.0,run,106,1,106/3,"Rashid Khan to Burl, 1 run",,"oh dear, another misfield through the legs at short fine leg gives away a single",3
458,151,Ryan Burl,495964,Mohammad Nabi,25913,"Mohammad Nabi to Burl, no run ",2nd innings,25.1,no run,106,0,106/3,"Mohammad Nabi to Burl, no run",,,3
459,152,Ryan Burl,495964,Mohammad Nabi,25913,"Mohammad Nabi to Burl, no run ",2nd innings,25.2,no run,106,0,106/3,"Mohammad Nabi to Burl, no run",,,3
460,153,Ryan Burl,495964,Mohammad Nabi,25913,"Mohammad Nabi to Burl, no run ",2nd innings,25.3,no run,106,0,106/3,"Mohammad Nabi to Burl, no run",,,3
461,154,Ryan Burl,495964,Mohammad Nabi,25913,"Mohammad Nabi to Burl, 1 run ",2nd innings,25.4,run,107,1,107/3,"Mohammad Nabi to Burl, 1 run",,,3
462,155,Craig Ervine,55412,Mohammad Nabi,25913,"Mohammad Nabi to Ervine, no run ",2nd innings,25.5,no run,107,0,107/3,"Mohammad Nabi to Ervine, no run",,,3
463,156,Craig Ervine,55412,Mohammad Nabi,25913,"Mohammad Nabi to Ervine, 1 run ",2nd innings,26.0,run,108,1,108/3,"Mohammad Nabi to Ervine, 1 run",,,3
464,157,Craig Ervine,55412,Rashid Khan,793463,"Rashid Khan to Ervine, 2 runs ",2nd innings,26.1,run,110,2,110/3,"Rashid Khan to Ervine, 2 runs",,,3
465,158,Craig Ervine,55412,Rashid Khan,793463,"Rashid Khan to Ervine, no run ",2nd innings,26.2,no run,110,0,110/3,"Rashid Khan to Ervine, no run",,,3
466,159,Craig Ervine,55412,Rashid Khan,793463,"Rashid Khan to Ervine, 1 run ",2nd innings,26.3,run,111,1,111/3,"Rashid Khan to Ervine, 1 run",,,3
467,160,Ryan Burl,495964,Rashid Khan,793463,"Rashid Khan to Burl, 1 run ",2nd innings,26.4,run,112,1,112/3,"Rashid Khan to Burl, 1 run",,,3
468,161,Craig Ervine,55412,Rashid Khan,793463,"Rashid Khan to Ervine, 1 run ",2nd innings,26.5,run,113,1,113/3,"Rashid Khan to Ervine, 1 run",,,3
469,161,Ryan Burl,495964,Rashid Khan,793463,"Rashid Khan to Burl, 1 wide ",2nd innings,26.5,wide,114,1,114/3,"Rashid Khan to Burl, 1 wide",,,3
470,162,Ryan Burl,495964,Rashid Khan,793463,"Rashid Khan to Burl, no run ",2nd innings,27.0,no run,114,0,114/3,"Rashid Khan to Burl, no run",,,3
471,163,Craig Ervine,55412,Dawlat Zadran,516561,"Dawlat Zadran to Ervine, no run touch full, outside off, drives to cover",2nd innings,27.1,no run,114,0,114/3,"Dawlat Zadran to Ervine, no run",,"touch full, outside off, drives to cover",3
472,164,Craig Ervine,55412,Dawlat Zadran,516561,"Dawlat Zadran to Ervine, 1 run short, pulled down to fine leg",2nd innings,27.2,run,115,1,115/3,"Dawlat Zadran to Ervine, 1 run",,"short, pulled down to fine leg",3
473,165,Ryan Burl,495964,Dawlat Zadran,516561,"Dawlat Zadran to Burl, 1 run another single down to third man off the back foot",2nd innings,27.3,run,116,1,116/3,"Dawlat Zadran to Burl, 1 run",,another single down to third man off the back foot,3
474,166,Craig Ervine,55412,Dawlat Zadran,516561,"Dawlat Zadran to Ervine, 1 run leans forward, swats it off the sweetest part of the bat, but straight to mid wicket",2nd innings,27.4,run,117,1,117/3,"Dawlat Zadran to Ervine, 1 run",,"leans forward, swats it off the sweetest part of the bat, but straight to mid wicket",3
475,167,Ryan Burl,495964,Dawlat Zadran,516561,"Dawlat Zadran to Burl, no run ",2nd innings,27.5,no run,117,0,117/3,"Dawlat Zadran to Burl, no run",,,3
