,ball,batsman,batsman_id,bowler,bowler_id,commentary,innings,overs,playType,runs,runs_scored,score,shortText,speed,text,wickets
192,190,Asghar Afghan,320652,Solomon Mire,290462,"Mire to Asghar Afghan, no run tries a fuller one this time, pushed back to the bowler",1st innings,31.4,no run,138,0,138/2,"Mire to Asghar Afghan, no run",,"tries a fuller one this time, pushed back to the bowler",2
193,191,Asghar Afghan,320652,Solomon Mire,290462,"Mire to Asghar Afghan, no run back of a length, on off, jumps back, pushes to point",1st innings,31.5,no run,138,0,138/2,"Mire to Asghar Afghan, no run",,"back of a length, on off, jumps back, pushes to point",2
194,192,Asghar Afghan,320652,Solomon Mire,290462,"Mire to Asghar Afghan, no run a lot fuller again, just outside off, drills to mid off",1st innings,32.0,no run,138,0,138/2,"Mire to Asghar Afghan, no run",,"a lot fuller again, just outside off, drills to mid off",2
195,193,Rahmat Shah,533956,Graeme Cremer,55346,"Cremer to Rahmat Shah, 1 run tossed, on middle, drills with the full face to long on",1st innings,32.1,run,139,1,139/2,"Cremer to Rahmat Shah, 1 run",,"tossed, on middle, drills with the full face to long on",2
196,194,Asghar Afghan,320652,Graeme Cremer,55346,"Cremer to Asghar Afghan, OUT <b>taken in the deep!</b>, tossed, outside off, turns away, Stanikzai dances down the track, clobbers it high but lacked the distance towards long off where Musakanda ran to his left , settles under it, takes and tumbles.",1st innings,32.2,out,139,0,139/3,"Cremer to Asghar Afghan, OUT",,"<b>taken in the deep!</b>, tossed, outside off, turns away, Stanikzai dances down the track, clobbers it high but lacked the distance towards long off where Musakanda ran to his left , settles under it, takes and tumbles.",3
197,195,Rahmat Shah,533956,Graeme Cremer,55346,"Cremer to Rahmat Shah, no run solidly comes forward , defends",1st innings,32.3,no run,139,0,139/3,"Cremer to Rahmat Shah, no run",,"solidly comes forward , defends",3
198,196,Rahmat Shah,533956,Graeme Cremer,55346,"Cremer to Rahmat Shah, no run fuller, on leg, drives to mid wicket",1st innings,32.4,no run,139,0,139/3,"Cremer to Rahmat Shah, no run",,"fuller, on leg, drives to mid wicket",3
199,197,Rahmat Shah,533956,Graeme Cremer,55346,"Cremer to Rahmat Shah, 2 runs comes forward, pushes to the leg side, comes back for two, and that's his fifty",1st innings,32.5,run,141,2,141/3,"Cremer to Rahmat Shah, 2 runs",,"comes forward, pushes to the leg side, comes back for two, and that's his fifty",3
200,198,Rahmat Shah,533956,Graeme Cremer,55346,"Cremer to Rahmat Shah, no run comes forward, defends to the off side, Cremer fields",1st innings,33.0,no run,141,0,141/3,"Cremer to Rahmat Shah, no run",,"comes forward, defends to the off side, Cremer fields",3
201,199,Mohammad Nabi,25913,Solomon Mire,290462,"Mire to Mohammad Nabi, 1 run on a length, angling down the leg side, flicked away to the leg side for one",1st innings,33.1,run,142,1,142/3,"Mire to Mohammad Nabi, 1 run",,"on a length, angling down the leg side, flicked away to the leg side for one",3
202,200,Rahmat Shah,533956,Solomon Mire,290462,"Mire to Rahmat Shah, 1 run back of a length, on off, slapped down to deep cover , gets one",1st innings,33.2,run,143,1,143/3,"Mire to Rahmat Shah, 1 run",,"back of a length, on off, slapped down to deep cover , gets one",3
203,201,Mohammad Nabi,25913,Solomon Mire,290462,"Mire to Mohammad Nabi, 2 runs hangs back, pushes it to the leg side, Ngarava misfields and allows the batsmen to come back for two",1st innings,33.3,run,145,2,145/3,"Mire to Mohammad Nabi, 2 runs",,"hangs back, pushes it to the leg side, Ngarava misfields and allows the batsmen to come back for two",3
204,202,Mohammad Nabi,25913,Solomon Mire,290462,"Mire to Mohammad Nabi, 2 leg byes full, on leg, brushes the pad down towards fine leg area",1st innings,33.4,leg bye,147,2,147/3,"Mire to Mohammad Nabi, 2 leg byes",,"full, on leg, brushes the pad down towards fine leg area",3
205,203,Mohammad Nabi,25913,Solomon Mire,290462,"Mire to Mohammad Nabi, no run jumps back, drives to mid wicket",1st innings,33.5,no run,147,0,147/3,"Mire to Mohammad Nabi, no run",,"jumps back, drives to mid wicket",3
206,204,Mohammad Nabi,25913,Solomon Mire,290462,"Mire to Mohammad Nabi, no run back of a length, outside off, pushed towards point off the front foot",1st innings,34.0,no run,147,0,147/3,"Mire to Mohammad Nabi, no run",,"back of a length, outside off, pushed towards point off the front foot",3
207,205,Rahmat Shah,533956,Tendai Chatara,425639,"Chatara to Rahmat Shah, 1 run short and wide, batsman rides on top of the bounce, drives to deep cover",1st innings,34.1,run,148,1,148/3,"Chatara to Rahmat Shah, 1 run",,"short and wide, batsman rides on top of the bounce, drives to deep cover",3
208,206,Mohammad Nabi,25913,Tendai Chatara,425639,"Chatara to Mohammad Nabi, 1 run leans forward, drills it down to sweeper , gets one",1st innings,34.2,run,149,1,149/3,"Chatara to Mohammad Nabi, 1 run",,"leans forward, drills it down to sweeper , gets one",3
209,207,Rahmat Shah,533956,Tendai Chatara,425639,"Chatara to Rahmat Shah, OUT trapped !, length, on off, jags back, Shah is stuck on his back foot, misses the flick to the leg side, gets struck plumb in front of his stump and he walks out",1st innings,34.3,out,149,0,149/4,"Chatara to Rahmat Shah, OUT",,"trapped !, length, on off, jags back, Shah is stuck on his back foot, misses the flick to the leg side, gets struck plumb in front of his stump and he walks out",4
210,208,Najibullah Zadran,524049,Tendai Chatara,425639,"Chatara to Najibullah Zadran, no run full, outside off, pushed away to cover off the front foot",1st innings,34.4,no run,149,0,149/4,"Chatara to Najibullah Zadran, no run",,"full, outside off, pushed away to cover off the front foot",4
211,209,Najibullah Zadran,524049,Tendai Chatara,425639,"Chatara to Najibullah Zadran, no run solidly forward, defends to the off side",1st innings,34.5,no run,149,0,149/4,"Chatara to Najibullah Zadran, no run",,"solidly forward, defends to the off side",4
212,210,Najibullah Zadran,524049,Tendai Chatara,425639,"Chatara to Najibullah Zadran, no run and a dot ball to end the over, back of a length, pushed towards point",1st innings,35.0,no run,149,0,149/4,"Chatara to Najibullah Zadran, no run",,"and a dot ball to end the over, back of a length, pushed towards point",4
213,211,Mohammad Nabi,25913,Solomon Mire,290462,"Mire to Mohammad Nabi, FOUR runs another short ball, sits up, M Nabi leans back, slaps it past H Masakada at mid on, four runs",1st innings,35.1,four,153,4,153/4,"Mire to Mohammad Nabi, FOUR runs",,"another short ball, sits up, M Nabi leans back, slaps it past H Masakada at mid on, four runs",4
214,212,Mohammad Nabi,25913,Solomon Mire,290462,"Mire to Mohammad Nabi, 1 run leans forward, drives through the covers to deep cover",1st innings,35.2,run,154,1,154/4,"Mire to Mohammad Nabi, 1 run",,"leans forward, drives through the covers to deep cover",4
215,213,Najibullah Zadran,524049,Solomon Mire,290462,"Mire to Najibullah Zadran, 1 run short again, whacks it wide of diving point, gets a single",1st innings,35.3,run,155,1,155/4,"Mire to Najibullah Zadran, 1 run",,"short again, whacks it wide of diving point, gets a single",4
216,214,Mohammad Nabi,25913,Solomon Mire,290462,"Mire to Mohammad Nabi, no run better, back of a length, outside off, leans forward, solidly defends",1st innings,35.4,no run,155,0,155/4,"Mire to Mohammad Nabi, no run",,"better, back of a length, outside off, leans forward, solidly defends",4
217,215,Mohammad Nabi,25913,Solomon Mire,290462,"Mire to Mohammad Nabi, 3 runs length, on leg stump, solidly comes forward, drills to the leg side , gets back for three",1st innings,35.5,run,158,3,158/4,"Mire to Mohammad Nabi, 3 runs",,"length, on leg stump, solidly comes forward, drills to the leg side , gets back for three",4
218,216,Najibullah Zadran,524049,Solomon Mire,290462,"Mire to Najibullah Zadran, 1 run nudges to the leg side for a single",1st innings,36.0,run,159,1,159/4,"Mire to Najibullah Zadran, 1 run",,nudges to the leg side for a single,4
219,217,Najibullah Zadran,524049,Tendai Chatara,425639,"Chatara to Najibullah Zadran, FOUR runs back of a length, N Zadran clears his front leg, claps it over mid wicket. Top shot",1st innings,36.1,four,163,4,163/4,"Chatara to Najibullah Zadran, FOUR runs",,"back of a length, N Zadran clears his front leg, claps it over mid wicket. Top shot",4
220,218,Najibullah Zadran,524049,Tendai Chatara,425639,"Chatara to Najibullah Zadran, 1 run guides this down to third man for a single",1st innings,36.2,run,164,1,164/4,"Chatara to Najibullah Zadran, 1 run",,guides this down to third man for a single,4
221,219,Mohammad Nabi,25913,Tendai Chatara,425639,"Chatara to Mohammad Nabi, no run length, on off, stands tall, drives to point",1st innings,36.3,no run,164,0,164/4,"Chatara to Mohammad Nabi, no run",,"length, on off, stands tall, drives to point",4
222,220,Mohammad Nabi,25913,Tendai Chatara,425639,"Chatara to Mohammad Nabi, no run bangs it short, this one is better directed, leaves",1st innings,36.4,no run,164,0,164/4,"Chatara to Mohammad Nabi, no run",,"bangs it short, this one is better directed, leaves",4
223,221,Mohammad Nabi,25913,Tendai Chatara,425639,"Chatara to Mohammad Nabi, 2 runs gets back, chops it over the keeper's head , gets back for two",1st innings,36.5,run,166,2,166/4,"Chatara to Mohammad Nabi, 2 runs",,"gets back, chops it over the keeper's head , gets back for two",4
224,222,Mohammad Nabi,25913,Tendai Chatara,425639,"Chatara to Mohammad Nabi, 1 run short and wide, slapped through the covers for a single to sweeper",1st innings,37.0,run,167,1,167/4,"Chatara to Mohammad Nabi, 1 run",,"short and wide, slapped through the covers for a single to sweeper",4
225,223,Mohammad Nabi,25913,Malcolm Waller,55872,"Waller to Mohammad Nabi, 1 run tossed on leg, punched down the carpet to long on, takes one",1st innings,37.1,run,168,1,168/4,"Waller to Mohammad Nabi, 1 run",,"tossed on leg, punched down the carpet to long on, takes one",4
226,224,Najibullah Zadran,524049,Malcolm Waller,55872,"Waller to Najibullah Zadran, no run tossed, on off, blocked",1st innings,37.2,no run,168,0,168/4,"Waller to Najibullah Zadran, no run",,"tossed, on off, blocked",4
227,225,Najibullah Zadran,524049,Malcolm Waller,55872,"Waller to Najibullah Zadran, 1 run on middle and leg, tucked to the leg side, gets one",1st innings,37.3,run,169,1,169/4,"Waller to Najibullah Zadran, 1 run",,"on middle and leg, tucked to the leg side, gets one",4
228,226,Mohammad Nabi,25913,Malcolm Waller,55872,"Waller to Mohammad Nabi, 1 run some air, lands on off, turning in, drives down to long off",1st innings,37.4,run,170,1,170/4,"Waller to Mohammad Nabi, 1 run",,"some air, lands on off, turning in, drives down to long off",4
229,227,Najibullah Zadran,524049,Malcolm Waller,55872,"Waller to Najibullah Zadran, 1 run on middle, comes forward, flicks to the leg side for a single",1st innings,37.5,run,171,1,171/4,"Waller to Najibullah Zadran, 1 run",,"on middle, comes forward, flicks to the leg side for a single",4
230,228,Mohammad Nabi,25913,Malcolm Waller,55872,"Waller to Mohammad Nabi, 1 run hangs back, drills down to long for one",1st innings,38.0,run,172,1,172/4,"Waller to Mohammad Nabi, 1 run",,"hangs back, drills down to long for one",4
231,229,Mohammad Nabi,25913,Tendai Chatara,425639,"Chatara to Mohammad Nabi, no run dropped a sitter! length, on leg, Nabi whips it straight to Cremer at mid wicket who drops the catch",1st innings,38.1,no run,172,0,172/4,"Chatara to Mohammad Nabi, no run",,"dropped a sitter! length, on leg, Nabi whips it straight to Cremer at mid wicket who drops the catch",4
232,230,Mohammad Nabi,25913,Tendai Chatara,425639,"Chatara to Mohammad Nabi, no run full, on off , defends",1st innings,38.2,no run,172,0,172/4,"Chatara to Mohammad Nabi, no run",,"full, on off , defends",4
233,231,Mohammad Nabi,25913,Tendai Chatara,425639,"Chatara to Mohammad Nabi, 1 run comes forward, drives down deep to the off side",1st innings,38.3,run,173,1,173/4,"Chatara to Mohammad Nabi, 1 run",,"comes forward, drives down deep to the off side",4
234,232,Najibullah Zadran,524049,Tendai Chatara,425639,"Chatara to Najibullah Zadran, 1 run short and wide, cuts it just over Mire at point , takes one",1st innings,38.4,run,174,1,174/4,"Chatara to Najibullah Zadran, 1 run",,"short and wide, cuts it just over Mire at point , takes one",4
235,233,Mohammad Nabi,25913,Tendai Chatara,425639,"Chatara to Mohammad Nabi, 1 run full, on leg, flicks to the leg side",1st innings,38.5,run,175,1,175/4,"Chatara to Mohammad Nabi, 1 run",,"full, on leg, flicks to the leg side",4
236,234,Najibullah Zadran,524049,Tendai Chatara,425639,"Chatara to Najibullah Zadran, no run short, well directed, Zadran ducks under it as it flies over over him",1st innings,39.0,no run,175,0,175/4,"Chatara to Najibullah Zadran, no run",,"short, well directed, Zadran ducks under it as it flies over over him",4
237,235,Mohammad Nabi,25913,Malcolm Waller,55872,"Waller to Mohammad Nabi, SIX runs tossed , outside off, turns a hint towards the batsman who charges out, tonks it high and above long on. Well connected and timed",1st innings,39.1,six,181,6,181/4,"Waller to Mohammad Nabi, SIX runs",,"tossed , outside off, turns a hint towards the batsman who charges out, tonks it high and above long on. Well connected and timed",4
238,236,Mohammad Nabi,25913,Malcolm Waller,55872,"Waller to Mohammad Nabi, 1 run fired on middle, drives, takes the single down to long on",1st innings,39.2,run,182,1,182/4,"Waller to Mohammad Nabi, 1 run",,"fired on middle, drives, takes the single down to long on",4
239,237,Najibullah Zadran,524049,Malcolm Waller,55872,"Waller to Najibullah Zadran, no run a touch short, and wide, turning away, cuts straight to point",1st innings,39.3,no run,182,0,182/4,"Waller to Najibullah Zadran, no run",,"a touch short, and wide, turning away, cuts straight to point",4
240,238,Najibullah Zadran,524049,Malcolm Waller,55872,"Waller to Najibullah Zadran, no run tossed, on off, misses the cut",1st innings,39.4,no run,182,0,182/4,"Waller to Najibullah Zadran, no run",,"tossed, on off, misses the cut",4
241,239,Najibullah Zadran,524049,Malcolm Waller,55872,"Waller to Najibullah Zadran, no run tossed, on off, defends to the off side",1st innings,39.5,no run,182,0,182/4,"Waller to Najibullah Zadran, no run",,"tossed, on off, defends to the off side",4
242,240,Najibullah Zadran,524049,Malcolm Waller,55872,"Waller to Najibullah Zadran, no run some air, on leg, turning away from Zadran, presents the full face and and defends",1st innings,40.0,no run,182,0,182/4,"Waller to Najibullah Zadran, no run",,"some air, on leg, turning away from Zadran, presents the full face and and defends",4
243,241,Mohammad Nabi,25913,Graeme Cremer,55346,"Cremer to Mohammad Nabi, no run tossed, on leg, brushed the pad to the keeper",1st innings,40.1,no run,182,0,182/4,"Cremer to Mohammad Nabi, no run",,"tossed, on leg, brushed the pad to the keeper",4
244,242,Mohammad Nabi,25913,Graeme Cremer,55346,"Cremer to Mohammad Nabi, no run defends back to the bowler",1st innings,40.2,no run,182,0,182/4,"Cremer to Mohammad Nabi, no run",,defends back to the bowler,4
245,243,Mohammad Nabi,25913,Graeme Cremer,55346,"Cremer to Mohammad Nabi, 1 run chops it in the air to the leg side for a single",1st innings,40.3,run,183,1,183/4,"Cremer to Mohammad Nabi, 1 run",,chops it in the air to the leg side for a single,4
246,244,Najibullah Zadran,524049,Graeme Cremer,55346,"Cremer to Najibullah Zadran, no run tossed on leg stump, Zadran tries the reverse sweep, misses get hit on the thigh pad, ball pops up, Moor takes the catch",1st innings,40.4,no run,183,0,183/4,"Cremer to Najibullah Zadran, no run",,"tossed on leg stump, Zadran tries the reverse sweep, misses get hit on the thigh pad, ball pops up, Moor takes the catch",4
247,245,Najibullah Zadran,524049,Graeme Cremer,55346,"Cremer to Najibullah Zadran, no run comes forward and defends",1st innings,40.5,no run,183,0,183/4,"Cremer to Najibullah Zadran, no run",,comes forward and defends,4
248,246,Najibullah Zadran,524049,Graeme Cremer,55346,"Cremer to Najibullah Zadran, 1 run leans back, guides to the off side for a single",1st innings,41.0,run,184,1,184/4,"Cremer to Najibullah Zadran, 1 run",,"leans back, guides to the off side for a single",4
249,247,Najibullah Zadran,524049,Richard Ngarava,806241,"Ngarava to Najibullah Zadran, no run short, well directed, good pace, Zadran isn't interested , ducks under it",1st innings,41.1,no run,184,0,184/4,"Ngarava to Najibullah Zadran, no run",,"short, well directed, good pace, Zadran isn't interested , ducks under it",4
250,248,Najibullah Zadran,524049,Richard Ngarava,806241,"Ngarava to Najibullah Zadran, no run back of a length, outside off, guides it to short third man",1st innings,41.2,no run,184,0,184/4,"Ngarava to Najibullah Zadran, no run",,"back of a length, outside off, guides it to short third man",4
251,249,Najibullah Zadran,524049,Richard Ngarava,806241,"Ngarava to Najibullah Zadran, 1 run back of a length , on middle and leg, Zadran slides deep into his crease, flicks to the off side for a single",1st innings,41.3,run,185,1,185/4,"Ngarava to Najibullah Zadran, 1 run",,"back of a length , on middle and leg, Zadran slides deep into his crease, flicks to the off side for a single",4
252,249,Mohammad Nabi,25913,Richard Ngarava,806241,"Ngarava to Mohammad Nabi, 1 wide slow ball, but it's a wide down the leg side",1st innings,41.3,wide,186,1,186/4,"Ngarava to Mohammad Nabi, 1 wide",,"slow ball, but it's a wide down the leg side",4
253,250,Mohammad Nabi,25913,Richard Ngarava,806241,"Ngarava to Mohammad Nabi, 1 run short and wide, stays low, Nabi reaches for it, cuts to sweeper",1st innings,41.4,run,187,1,187/4,"Ngarava to Mohammad Nabi, 1 run",,"short and wide, stays low, Nabi reaches for it, cuts to sweeper",4
254,251,Najibullah Zadran,524049,Richard Ngarava,806241,"Ngarava to Najibullah Zadran, 1 run fuller, on leg stump, flicked down to fine leg for a single",1st innings,41.5,run,188,1,188/4,"Ngarava to Najibullah Zadran, 1 run",,"fuller, on leg stump, flicked down to fine leg for a single",4
255,252,Mohammad Nabi,25913,Richard Ngarava,806241,"Ngarava to Mohammad Nabi, 1 run slower one once again, the batsman wasn't expecting it, pushes with the bottom edge to long off",1st innings,42.0,run,189,1,189/4,"Ngarava to Mohammad Nabi, 1 run",,"slower one once again, the batsman wasn't expecting it, pushes with the bottom edge to long off",4
256,253,Mohammad Nabi,25913,Graeme Cremer,55346,"Cremer to Mohammad Nabi, 2 runs comes forward, drives to the leg side , gets back for the second run, Zadran losses his bat while taking the second run",1st innings,42.1,run,191,2,191/4,"Cremer to Mohammad Nabi, 2 runs",,"comes forward, drives to the leg side , gets back for the second run, Zadran losses his bat while taking the second run",4
257,254,Mohammad Nabi,25913,Graeme Cremer,55346,"Cremer to Mohammad Nabi, no run comes forward, defends",1st innings,42.2,no run,191,0,191/4,"Cremer to Mohammad Nabi, no run",,"comes forward, defends",4
258,255,Mohammad Nabi,25913,Graeme Cremer,55346,"Cremer to Mohammad Nabi, 1 run leans back, slaps this to deep mid wicket for a single",1st innings,42.3,run,192,1,192/4,"Cremer to Mohammad Nabi, 1 run",,"leans back, slaps this to deep mid wicket for a single",4
259,256,Najibullah Zadran,524049,Graeme Cremer,55346,"Cremer to Najibullah Zadran, no run touch short, turns in, pushed to the bowler",1st innings,42.4,no run,192,0,192/4,"Cremer to Najibullah Zadran, no run",,"touch short, turns in, pushed to the bowler",4
260,257,Najibullah Zadran,524049,Graeme Cremer,55346,"Cremer to Najibullah Zadran, 1 run tossed, on middle, turns in, whips towards deep backwards square leg",1st innings,42.5,run,193,1,193/4,"Cremer to Najibullah Zadran, 1 run",,"tossed, on middle, turns in, whips towards deep backwards square leg",4
261,258,Mohammad Nabi,25913,Graeme Cremer,55346,"Cremer to Mohammad Nabi, no run ouch that must hurt. Nabi runs down the track, clobbers it straight to Zadran's back. Zadran is in pain",1st innings,43.0,no run,193,0,193/4,"Cremer to Mohammad Nabi, no run",,"ouch that must hurt. Nabi runs down the track, clobbers it straight to Zadran's back. Zadran is in pain",4
262,259,Najibullah Zadran,524049,Richard Ngarava,806241,"Ngarava to Najibullah Zadran, no run ",1st innings,43.1,no run,193,0,193/4,"Ngarava to Najibullah Zadran, no run",,,4
263,260,Najibullah Zadran,524049,Richard Ngarava,806241,"Ngarava to Najibullah Zadran, 1 run ",1st innings,43.2,run,194,1,194/4,"Ngarava to Najibullah Zadran, 1 run",,,4
264,261,Mohammad Nabi,25913,Richard Ngarava,806241,"Ngarava to Mohammad Nabi, OUT gone, the short ball works this time short, angling down the leg side, Nabi goes for the pull, tickles it to Moor who takes the catch",1st innings,43.3,out,194,0,194/5,"Ngarava to Mohammad Nabi, OUT",,"gone, the short ball works this time short, angling down the leg side, Nabi goes for the pull, tickles it to Moor who takes the catch",5
265,262,Gulbadin Naib,352048,Richard Ngarava,806241,"Ngarava to Gulbadin Naib, no run ",1st innings,43.4,no run,194,0,194/5,"Ngarava to Gulbadin Naib, no run",,,5
266,263,Gulbadin Naib,352048,Richard Ngarava,806241,"Ngarava to Gulbadin Naib, 1 run ",1st innings,43.5,run,195,1,195/5,"Ngarava to Gulbadin Naib, 1 run",,,5
267,264,Najibullah Zadran,524049,Richard Ngarava,806241,"Ngarava to Najibullah Zadran, 1 run ",1st innings,44.0,run,196,1,196/5,"Ngarava to Najibullah Zadran, 1 run",,,5
268,265,Najibullah Zadran,524049,Chris Mpofu,55633,"Mpofu to Najibullah Zadran, no run slow ball, outside off, Zadran misses the ball",1st innings,44.1,no run,196,0,196/5,"Mpofu to Najibullah Zadran, no run",,"slow ball, outside off, Zadran misses the ball",5
269,266,Najibullah Zadran,524049,Chris Mpofu,55633,"Mpofu to Najibullah Zadran, no run short ball, a bit of pace there, Zadran missesull shot",1st innings,44.2,no run,196,0,196/5,"Mpofu to Najibullah Zadran, no run",,"short ball, a bit of pace there, Zadran missesull shot",5
270,266,Najibullah Zadran,524049,Chris Mpofu,55633,"Mpofu to Najibullah Zadran, 1 wide fires it down the leg side and it's a wide",1st innings,44.2,wide,197,1,197/5,"Mpofu to Najibullah Zadran, 1 wide",,fires it down the leg side and it's a wide,5
271,267,Najibullah Zadran,524049,Chris Mpofu,55633,"Mpofu to Najibullah Zadran, 1 run fuller, on off, drills it down to long off, gets one",1st innings,44.3,run,198,1,198/5,"Mpofu to Najibullah Zadran, 1 run",,"fuller, on off, drills it down to long off, gets one",5
272,268,Gulbadin Naib,352048,Chris Mpofu,55633,"Mpofu to Gulbadin Naib, 2 runs length, outside off, pushed away wide of point, gets back for two, that bring up 200 for Afghanistan",1st innings,44.4,run,200,2,200/5,"Mpofu to Gulbadin Naib, 2 runs",,"length, outside off, pushed away wide of point, gets back for two, that bring up 200 for Afghanistan",5
273,269,Gulbadin Naib,352048,Chris Mpofu,55633,"Mpofu to Gulbadin Naib, no run solidly forward defends back to the bowler",1st innings,44.5,no run,200,0,200/5,"Mpofu to Gulbadin Naib, no run",,solidly forward defends back to the bowler,5
274,270,Gulbadin Naib,352048,Chris Mpofu,55633,"Mpofu to Gulbadin Naib, 1 run full, on leg, flicked to the leg side",1st innings,45.0,run,201,1,201/5,"Mpofu to Gulbadin Naib, 1 run",,"full, on leg, flicked to the leg side",5
275,271,Gulbadin Naib,352048,Richard Ngarava,806241,"Ngarava to Gulbadin Naib, no run slower ball, outside off, Naib swings his bat, misses",1st innings,45.1,no run,201,0,201/5,"Ngarava to Gulbadin Naib, no run",,"slower ball, outside off, Naib swings his bat, misses",5
276,272,Gulbadin Naib,352048,Richard Ngarava,806241,"Ngarava to Gulbadin Naib, no run another slower one, Naib gets bat to all, Cremer fields",1st innings,45.2,no run,201,0,201/5,"Ngarava to Gulbadin Naib, no run",,"another slower one, Naib gets bat to all, Cremer fields",5
277,273,Gulbadin Naib,352048,Richard Ngarava,806241,"Ngarava to Gulbadin Naib, 1 run shorter one this time, naib pulls to deep mid wicket, takes a single",1st innings,45.3,run,202,1,202/5,"Ngarava to Gulbadin Naib, 1 run",,"shorter one this time, naib pulls to deep mid wicket, takes a single",5
278,274,Najibullah Zadran,524049,Richard Ngarava,806241,"Ngarava to Najibullah Zadran, no run well directed bouncer once again, Zadran leaves it",1st innings,45.4,no run,202,0,202/5,"Ngarava to Najibullah Zadran, no run",,"well directed bouncer once again, Zadran leaves it",5
279,275,Najibullah Zadran,524049,Richard Ngarava,806241,"Ngarava to Najibullah Zadran, 1 run Ngarava sees the batsman back peddling , follows him, bowls it full, flicked down to deep sqaure",1st innings,45.5,run,203,1,203/5,"Ngarava to Najibullah Zadran, 1 run",,"Ngarava sees the batsman back peddling , follows him, bowls it full, flicked down to deep sqaure",5
280,276,Gulbadin Naib,352048,Richard Ngarava,806241,"Ngarava to Gulbadin Naib, no run gets forward, punches to the off side",1st innings,46.0,no run,203,0,203/5,"Ngarava to Gulbadin Naib, no run",,"gets forward, punches to the off side",5
281,277,Najibullah Zadran,524049,Chris Mpofu,55633,"Mpofu to Najibullah Zadran, SIX runs Take that!, length, outside off, Zadran has no mercy, whacks it over cow area. Maximum. Well hit",1st innings,46.1,six,209,6,209/5,"Mpofu to Najibullah Zadran, SIX runs",,"Take that!, length, outside off, Zadran has no mercy, whacks it over cow area. Maximum. Well hit",5
