,ball,batsman,batsman_id,bowler,bowler_id,commentary,innings,overs,playType,runs,runs_scored,score,shortText,speed,text,wickets
288,282,Kyle Jarvis,332996,Mustafizur Rahman,330902,"Mustafizur Rahman to Jarvis, no run <b>finds the outside edge this time, but short of the keeper!</b> Full on off stump, and Jarvis goes chasing at it. Defended with soft hands, and takes the edge, but just in front of Mushfiqur. They ask the umpire for the catch, but it had fallen in front",1st innings,46.6,no run,165,0,165/7,"Mustafizur Rahman to Jarvis, no run",,"<b>finds the outside edge this time, but short of the keeper!</b> Full on off stump, and Jarvis goes chasing at it. Defended with soft hands, and takes the edge, but just in front of Mushfiqur. They ask the umpire for the catch, but it had fallen in front",7
289,283,Peter Moor,333000,Rubel Hossain,300619,"Rubel Hossain to Moor, 1 run yorker on middle and leg, dug away over the bowler's head through to mid off. Only a single",1st innings,47.1,run,166,1,166/7,"Rubel Hossain to Moor, 1 run",,"yorker on middle and leg, dug away over the bowler's head through to mid off. Only a single",7
290,284,Kyle Jarvis,332996,Rubel Hossain,300619,"Rubel Hossain to Jarvis, 1 run slow, low, full toss on leg stump. Clipped off his pads to square leg. Can't put this loose ball away",1st innings,47.2,run,167,1,167/7,"Rubel Hossain to Jarvis, 1 run",,"slow, low, full toss on leg stump. Clipped off his pads to square leg. Can't put this loose ball away",7
291,285,Peter Moor,333000,Rubel Hossain,300619,"Rubel Hossain to Moor, OUT <b>yorker on middle stump!</b> Backs away too much, as the delivery crashes into the base of the stumps. Moved away too much, and the ball was accurate!",1st innings,47.3,out,167,0,167/8,"Rubel Hossain to Moor, OUT",,"<b>yorker on middle stump!</b> Backs away too much, as the delivery crashes into the base of the stumps. Moved away too much, and the ball was accurate!",8
292,286,Tendai Chatara,425639,Rubel Hossain,300619,"Rubel Hossain to Chatara, OUT <b>on a hat trick!</b> Inside edge ricochets onto middle stump! Overpitched full and wide outside off, tries to drive at it, but no movement of the feet",1st innings,47.4,out,167,0,167/9,"Rubel Hossain to Chatara, OUT",,"<b>on a hat trick!</b> Inside edge ricochets onto middle stump! Overpitched full and wide outside off, tries to drive at it, but no movement of the feet",9
293,287,Blessing Muzarabani,827051,Rubel Hossain,300619,"Rubel Hossain to Muzarabani, no run That will have to wait. Short and wide outside off, left alone. Not the best ball to bowl to a No. 11. Should've gone full and straight",1st innings,47.5,no run,167,0,167/9,"Rubel Hossain to Muzarabani, no run",,"That will have to wait. Short and wide outside off, left alone. Not the best ball to bowl to a No. 11. Should've gone full and straight",9
294,288,Blessing Muzarabani,827051,Rubel Hossain,300619,"Rubel Hossain to Muzarabani, no run full outside off, muscled back to Rubel off the front foot. Nicely taken by the bowler on his followthrough",1st innings,47.6,no run,167,0,167/9,"Rubel Hossain to Muzarabani, no run",,"full outside off, muscled back to Rubel off the front foot. Nicely taken by the bowler on his followthrough",9
295,289,Kyle Jarvis,332996,Mustafizur Rahman,330902,"Mustafizur Rahman to Jarvis, no run full, slower ball on middle stump, angling away from Jarvis as he tries to slog towards the leg side",1st innings,48.1,no run,167,0,167/9,"Mustafizur Rahman to Jarvis, no run",,"full, slower ball on middle stump, angling away from Jarvis as he tries to slog towards the leg side",9
296,290,Kyle Jarvis,332996,Mustafizur Rahman,330902,"Mustafizur Rahman to Jarvis, 1 run full on leg stump, tries to slog towards the leg side but takes the leading edge over point's head",1st innings,48.2,run,168,1,168/9,"Mustafizur Rahman to Jarvis, 1 run",,"full on leg stump, tries to slog towards the leg side but takes the leading edge over point's head",9
297,291,Blessing Muzarabani,827051,Mustafizur Rahman,330902,"Mustafizur Rahman to Muzarabani, no run full on off stump, but going across the batsman's body. Tries a wild slog but misses",1st innings,48.3,no run,168,0,168/9,"Mustafizur Rahman to Muzarabani, no run",,"full on off stump, but going across the batsman's body. Tries a wild slog but misses",9
298,292,Blessing Muzarabani,827051,Mustafizur Rahman,330902,"Mustafizur Rahman to Muzarabani, 1 run back of a length on leg stump, tries to play towards the leg side but takes another leading edge to short extra cover",1st innings,48.4,run,169,1,169/9,"Mustafizur Rahman to Muzarabani, 1 run",,"back of a length on leg stump, tries to play towards the leg side but takes another leading edge to short extra cover",9
299,293,Kyle Jarvis,332996,Mustafizur Rahman,330902,"Mustafizur Rahman to Jarvis, 1 leg bye full on middle and leg, tries a heave over midwicket, but misses. Hits his pad, but was going to go down leg side, anyway. They scamper through for a single",1st innings,48.5,leg bye,170,1,170/9,"Mustafizur Rahman to Jarvis, 1 leg bye",,"full on middle and leg, tries a heave over midwicket, but misses. Hits his pad, but was going to go down leg side, anyway. They scamper through for a single",9
300,294,Blessing Muzarabani,827051,Mustafizur Rahman,330902,"Mustafizur Rahman to Muzarabani, OUT good length on off stump, and straightens after pitching. The batsman plays down the wrong line as the ball sneaks past the outside of his bat. The cutter earns Fizz another wicket. <b>Zimbabwe are all out for 170.</b>",1st innings,48.6,out,170,0,170/10,"Mustafizur Rahman to Muzarabani, OUT",,"good length on off stump, and straightens after pitching. The batsman plays down the wrong line as the ball sneaks past the outside of his bat. The cutter earns Fizz another wicket. <b>Zimbabwe are all out for 170.</b>",10
301,1,Tamim Iqbal,56194,Kyle Jarvis,332996,"Jarvis to Tamim Iqbal, no run good length, shapes to angle away but nibbles in a touch, defended gingerly to the midwicket region",2nd innings,0.1,no run,0,0,0/0,"Jarvis to Tamim Iqbal, no run",,"good length, shapes to angle away but nibbles in a touch, defended gingerly to the midwicket region",0
302,2,Tamim Iqbal,56194,Kyle Jarvis,332996,"Jarvis to Tamim Iqbal, no run floated full and slanting away outside off with the angle, no shot",2nd innings,0.2,no run,0,0,0/0,"Jarvis to Tamim Iqbal, no run",,"floated full and slanting away outside off with the angle, no shot",0
303,2,Tamim Iqbal,56194,Kyle Jarvis,332996,"Jarvis to Tamim Iqbal, 1 wide even fuller and wider outside off, off-side wide, as Tamim ushers it through to Taylor",2nd innings,0.2,wide,1,1,1/0,"Jarvis to Tamim Iqbal, 1 wide",,"even fuller and wider outside off, off-side wide, as Tamim ushers it through to Taylor",0
304,3,Tamim Iqbal,56194,Kyle Jarvis,332996,"Jarvis to Tamim Iqbal, no run full and straight, Tamim presses forward and pokes an outside edge to backward point. Hint of away movement for Jarvis",2nd innings,0.3,no run,1,0,1/0,"Jarvis to Tamim Iqbal, no run",,"full and straight, Tamim presses forward and pokes an outside edge to backward point. Hint of away movement for Jarvis",0
305,4,Tamim Iqbal,56194,Kyle Jarvis,332996,"Jarvis to Tamim Iqbal, 1 run <strong>explodes from a length</strong> outside off, gets really big on Tamim, who stabs a single past the slip cordon to third man",2nd innings,0.4,run,2,1,2/0,"Jarvis to Tamim Iqbal, 1 run",,"<strong>explodes from a length</strong> outside off, gets really big on Tamim, who stabs a single past the slip cordon to third man",0
306,5,Anamul Haque,380354,Kyle Jarvis,332996,"Jarvis to Anamul Haque, FOUR runs <strong>Anamul marks his return to the ODI fold with a crisp drive</strong> straight of mid-on. He stretches out, meets the pitch, and executes the perfect on drive",2nd innings,0.5,four,6,4,6/0,"Jarvis to Anamul Haque, FOUR runs",,"<strong>Anamul marks his return to the ODI fold with a crisp drive</strong> straight of mid-on. He stretches out, meets the pitch, and executes the perfect on drive",0
307,6,Anamul Haque,380354,Kyle Jarvis,332996,"Jarvis to Anamul Haque, 1 run glanced off the pads to fine leg",2nd innings,0.6,run,7,1,7/0,"Jarvis to Anamul Haque, 1 run",,glanced off the pads to fine leg,0
308,7,Anamul Haque,380354,Tendai Chatara,425639,"Chatara to Anamul Haque, FOUR runs ooooh, that's super <strong>stylish from Anamul</strong>. Sprayed full on the pads, he presses forward, picks it up and whips it with the wrists over square leg",2nd innings,1.1,four,11,4,11/0,"Chatara to Anamul Haque, FOUR runs",,"ooooh, that's super <strong>stylish from Anamul</strong>. Sprayed full on the pads, he presses forward, picks it up and whips it with the wrists over square leg",0
309,7,Anamul Haque,380354,Tendai Chatara,425639,"Chatara to Anamul Haque, (no ball) FOUR runs short, wide, fetch that! Anamul sizes it up and cracks it away to the cover boundary. To add to Zimbabwe's woes, that's a front-foot no-ball",2nd innings,1.1,four,16,5,16/0,"Chatara to Anamul Haque, (no ball) FOUR runs",,"short, wide, fetch that! Anamul sizes it up and cracks it away to the cover boundary. To add to Zimbabwe's woes, that's a front-foot no-ball",0
310,8,Anamul Haque,380354,Tendai Chatara,425639,"Chatara to Anamul Haque, 1 run full and angling in towards middle and leg, Anamul is early into his leg-side swipe, drags an inside edge to deep square leg",2nd innings,1.2,run,17,1,17/0,"Chatara to Anamul Haque, 1 run",,"full and angling in towards middle and leg, Anamul is early into his leg-side swipe, drags an inside edge to deep square leg",0
311,9,Tamim Iqbal,56194,Tendai Chatara,425639,"Chatara to Tamim Iqbal, no run <strong>jumps from a length and pings the glove</strong>. Tamim loosens his grip and fends it off to the off side",2nd innings,1.3,no run,17,0,17/0,"Chatara to Tamim Iqbal, no run",,<strong>jumps from a length and pings the glove</strong>. Tamim loosens his grip and fends it off to the off side,0
312,10,Tamim Iqbal,56194,Tendai Chatara,425639,"Chatara to Tamim Iqbal, 2 runs darted full on the pads, picked off easily behind square on the leg side. Cremer slips in the deep",2nd innings,1.4,run,19,2,19/0,"Chatara to Tamim Iqbal, 2 runs",,"darted full on the pads, picked off easily behind square on the leg side. Cremer slips in the deep",0
313,11,Tamim Iqbal,56194,Tendai Chatara,425639,"Chatara to Tamim Iqbal, FOUR runs full and angling away outside off, too full to be honest, Tamim stretches out and caresses a square-drive. The ball rolls away to the boundary",2nd innings,1.5,four,23,4,23/0,"Chatara to Tamim Iqbal, FOUR runs",,"full and angling away outside off, too full to be honest, Tamim stretches out and caresses a square-drive. The ball rolls away to the boundary",0
314,12,Tamim Iqbal,56194,Tendai Chatara,425639,"Chatara to Tamim Iqbal, no run good length and slanting away outside off, Tamim quietly tucks his bat inside the line",2nd innings,1.6,no run,23,0,23/0,"Chatara to Tamim Iqbal, no run",,"good length and slanting away outside off, Tamim quietly tucks his bat inside the line",0
315,13,Anamul Haque,380354,Kyle Jarvis,332996,"Jarvis to Anamul Haque, no run good length, moves away outside off, <strong>skirts past the outside edge</strong>. Jarvis found extra bounce too",2nd innings,2.1,no run,23,0,23/0,"Jarvis to Anamul Haque, no run",,"good length, moves away outside off, <strong>skirts past the outside edge</strong>. Jarvis found extra bounce too",0
316,14,Anamul Haque,380354,Kyle Jarvis,332996,"Jarvis to Anamul Haque, no run pitched up and outside off, forward and drilled back to Jarvis, the ball bursts out of his hands",2nd innings,2.2,no run,23,0,23/0,"Jarvis to Anamul Haque, no run",,"pitched up and outside off, forward and drilled back to Jarvis, the ball bursts out of his hands",0
317,15,Anamul Haque,380354,Kyle Jarvis,332996,"Jarvis to Anamul Haque, 1 run fullish and on off, Anamul manipulates a single to mid-on with the wrists",2nd innings,2.3,run,24,1,24/0,"Jarvis to Anamul Haque, 1 run",,"fullish and on off, Anamul manipulates a single to mid-on with the wrists",0
318,16,Tamim Iqbal,56194,Kyle Jarvis,332996,"Jarvis to Tamim Iqbal, no run sliding into off stump, jabbed into the covers",2nd innings,2.4,no run,24,0,24/0,"Jarvis to Tamim Iqbal, no run",,"sliding into off stump, jabbed into the covers",0
319,17,Tamim Iqbal,56194,Kyle Jarvis,332996,"Jarvis to Tamim Iqbal, 1 run pitched up and outside off, driven through the line to the right of Mire at mid-off",2nd innings,2.5,run,25,1,25/0,"Jarvis to Tamim Iqbal, 1 run",,"pitched up and outside off, driven through the line to the right of Mire at mid-off",0
320,18,Anamul Haque,380354,Kyle Jarvis,332996,"Jarvis to Anamul Haque, no run good length on a fourth-stump line, Anamul deploys a solid stride and defends it to the off side",2nd innings,2.6,no run,25,0,25/0,"Jarvis to Anamul Haque, no run",,"good length on a fourth-stump line, Anamul deploys a solid stride and defends it to the off side",0
321,19,Tamim Iqbal,56194,Sikandar Raza,299572,"Sikandar Raza to Tamim Iqbal, 1 run skids on full outside off, the new ball usually skids on, tapped down to long-off",2nd innings,3.1,run,26,1,26/0,"Sikandar Raza to Tamim Iqbal, 1 run",,"skids on full outside off, the new ball usually skids on, tapped down to long-off",0
322,20,Anamul Haque,380354,Sikandar Raza,299572,"Sikandar Raza to Anamul Haque, FOUR runs non-turning offbreak on off stump, Anamul attacks it with a ferocious slog-sweep. He stretches out and hits it with the intended break over square leg",2nd innings,3.2,four,30,4,30/0,"Sikandar Raza to Anamul Haque, FOUR runs",,"non-turning offbreak on off stump, Anamul attacks it with a ferocious slog-sweep. He stretches out and hits it with the intended break over square leg",0
323,21,Anamul Haque,380354,Sikandar Raza,299572,"Sikandar Raza to Anamul Haque, no run offbreak, turns in on off, tapped to the leg side with soft hands this time",2nd innings,3.3,no run,30,0,30/0,"Sikandar Raza to Anamul Haque, no run",,"offbreak, turns in on off, tapped to the leg side with soft hands this time",0
324,22,Anamul Haque,380354,Sikandar Raza,299572,"Sikandar Raza to Anamul Haque, no run fast slider, jabbed to midwicket",2nd innings,3.4,no run,30,0,30/0,"Sikandar Raza to Anamul Haque, no run",,"fast slider, jabbed to midwicket",0
325,23,Anamul Haque,380354,Sikandar Raza,299572,"Sikandar Raza to Anamul Haque, no run slides in at 88.3ks and hits the pad, but this was heading down the leg side with the sharp angle",2nd innings,3.5,no run,30,0,30/0,"Sikandar Raza to Anamul Haque, no run",,"slides in at 88.3ks and hits the pad, but this was heading down the leg side with the sharp angle",0
326,24,Anamul Haque,380354,Sikandar Raza,299572,"Sikandar Raza to Anamul Haque, OUT There is only one fielder in the deep on the leg side - and Anamul Haque hits it straight into the lap of that man. This was tossed up slower and higher outside off, he brings out the slog sweep again, makes good connection again, but finds the fielder this time. One shot too many? <b>Anamul's mad dash is over</b>",2nd innings,3.6,out,30,0,30/1,"Sikandar Raza to Anamul Haque, OUT",,"There is only one fielder in the deep on the leg side - and Anamul Haque hits it straight into the lap of that man. This was tossed up slower and higher outside off, he brings out the slog sweep again, makes good connection again, but finds the fielder this time. One shot too many? <b>Anamul's mad dash is over</b>",1
327,25,Tamim Iqbal,56194,Kyle Jarvis,332996,"Jarvis to Tamim Iqbal, no run back of a length and angling away outside off, punched into the covers",2nd innings,4.1,no run,30,0,30/1,"Jarvis to Tamim Iqbal, no run",,"back of a length and angling away outside off, punched into the covers",1
328,26,Tamim Iqbal,56194,Kyle Jarvis,332996,"Jarvis to Tamim Iqbal, no run full and just a shade outside off, Tamim scoops a drive back to the bowler",2nd innings,4.2,no run,30,0,30/1,"Jarvis to Tamim Iqbal, no run",,"full and just a shade outside off, Tamim scoops a drive back to the bowler",1
329,27,Tamim Iqbal,56194,Kyle Jarvis,332996,"Jarvis to Tamim Iqbal, no run attempted slower ball? Finishes on the hips, tucked away behind square for one",2nd innings,4.3,no run,30,0,30/1,"Jarvis to Tamim Iqbal, no run",,"attempted slower ball? Finishes on the hips, tucked away behind square for one",1
330,28,Tamim Iqbal,56194,Kyle Jarvis,332996,"Jarvis to Tamim Iqbal, 1 run tip and run to mid-on for a single. That's the experience of Tamim. That's what Anamul should have done",2nd innings,4.4,run,31,1,31/1,"Jarvis to Tamim Iqbal, 1 run",,tip and run to mid-on for a single. That's the experience of Tamim. That's what Anamul should have done,1
331,29,Shakib Al Hasan,56143,Kyle Jarvis,332996,"Jarvis to Shakib Al Hasan, no run back of a length and angling away outside off, Shakib can't resist a jab away from the body and <strong>nearly plays on</strong>",2nd innings,4.5,no run,31,0,31/1,"Jarvis to Shakib Al Hasan, no run",,"back of a length and angling away outside off, Shakib can't resist a jab away from the body and <strong>nearly plays on</strong>",1
332,30,Shakib Al Hasan,56143,Kyle Jarvis,332996,"Jarvis to Shakib Al Hasan, no run Shakib stretches out to meet this full ball on off. Push-driven to mid-off",2nd innings,4.6,no run,31,0,31/1,"Jarvis to Shakib Al Hasan, no run",,Shakib stretches out to meet this full ball on off. Push-driven to mid-off,1
333,31,Tamim Iqbal,56194,Sikandar Raza,299572,"Sikandar Raza to Tamim Iqbal, 1 run Tamim stays leg-side of this full ball on off and bunts a single to mid-off",2nd innings,5.1,run,32,1,32/1,"Sikandar Raza to Tamim Iqbal, 1 run",,Tamim stays leg-side of this full ball on off and bunts a single to mid-off,1
334,32,Shakib Al Hasan,56143,Sikandar Raza,299572,"Sikandar Raza to Shakib Al Hasan, 1 run back of a length offbreak outside off, Shakib goes deep in the crease and firmly punches to long-off",2nd innings,5.2,run,33,1,33/1,"Sikandar Raza to Shakib Al Hasan, 1 run",,"back of a length offbreak outside off, Shakib goes deep in the crease and firmly punches to long-off",1
335,33,Tamim Iqbal,56194,Sikandar Raza,299572,"Sikandar Raza to Tamim Iqbal, 1 run forced off the pads to midwicket as Raza keeps hitting those hard in-between lengths",2nd innings,5.3,run,34,1,34/1,"Sikandar Raza to Tamim Iqbal, 1 run",,forced off the pads to midwicket as Raza keeps hitting those hard in-between lengths,1
336,34,Shakib Al Hasan,56143,Sikandar Raza,299572,"Sikandar Raza to Shakib Al Hasan, no run flatter and skids on outside off, not quite short enough for a cut, Shakib slashes and misses",2nd innings,5.4,no run,34,0,34/1,"Sikandar Raza to Shakib Al Hasan, no run",,"flatter and skids on outside off, not quite short enough for a cut, Shakib slashes and misses",1
337,35,Shakib Al Hasan,56143,Sikandar Raza,299572,"Sikandar Raza to Shakib Al Hasan, no run tossed up full on middle, pushed back to the right of the bowler",2nd innings,5.5,no run,34,0,34/1,"Sikandar Raza to Shakib Al Hasan, no run",,"tossed up full on middle, pushed back to the right of the bowler",1
338,36,Shakib Al Hasan,56143,Sikandar Raza,299572,"Sikandar Raza to Shakib Al Hasan, 2 runs dropped short and wide outside off, Shakib picks the length and clunks it to cover-point, where the fielder dives to his right and fumbles",2nd innings,5.6,run,36,2,36/1,"Sikandar Raza to Shakib Al Hasan, 2 runs",,"dropped short and wide outside off, Shakib picks the length and clunks it to cover-point, where the fielder dives to his right and fumbles",1
339,37,Tamim Iqbal,56194,Kyle Jarvis,332996,"Jarvis to Tamim Iqbal, no run good length and on middle stump, gently defended back to the bowler",2nd innings,6.1,no run,36,0,36/1,"Jarvis to Tamim Iqbal, no run",,"good length and on middle stump, gently defended back to the bowler",1
340,38,Tamim Iqbal,56194,Kyle Jarvis,332996,"Jarvis to Tamim Iqbal, 2 runs attempted short ball, keeps low on middle, this<strong> shin-high ball is swatted out </strong>to deep square. Great adjustment from Tamim",2nd innings,6.2,run,38,2,38/1,"Jarvis to Tamim Iqbal, 2 runs",,"attempted short ball, keeps low on middle, this<strong> shin-high ball is swatted out </strong>to deep square. Great adjustment from Tamim",1
341,39,Tamim Iqbal,56194,Kyle Jarvis,332996,"Jarvis to Tamim Iqbal, no run floated full and outside off, forward and driven on the up to the covers",2nd innings,6.3,no run,38,0,38/1,"Jarvis to Tamim Iqbal, no run",,"floated full and outside off, forward and driven on the up to the covers",1
342,40,Tamim Iqbal,56194,Kyle Jarvis,332996,"Jarvis to Tamim Iqbal, 2 runs back of a length and angling away outside off, Tamim allows the ball to come to him, then whips it with the wrists to the right of deep midwicket",2nd innings,6.4,run,40,2,40/1,"Jarvis to Tamim Iqbal, 2 runs",,"back of a length and angling away outside off, Tamim allows the ball to come to him, then whips it with the wrists to the right of deep midwicket",1
343,41,Tamim Iqbal,56194,Kyle Jarvis,332996,"Jarvis to Tamim Iqbal, no run short and angling away outside off, keeps low again, Shakib can't slap it past the off-side infield",2nd innings,6.5,no run,40,0,40/1,"Jarvis to Tamim Iqbal, no run",,"short and angling away outside off, keeps low again, Shakib can't slap it past the off-side infield",1
344,42,Tamim Iqbal,56194,Kyle Jarvis,332996,"Jarvis to Tamim Iqbal, 1 run whipped away to deep midwicket again",2nd innings,6.6,run,41,1,41/1,"Jarvis to Tamim Iqbal, 1 run",,whipped away to deep midwicket again,1
345,42,Tamim Iqbal,56194,Sikandar Raza,299572,"Sikandar Raza to Tamim Iqbal, 5 wides sliding down the leg side, past the sweep, past the keeper, rolls away for four wides",2nd innings,7.0,wide,46,5,46/1,"Sikandar Raza to Tamim Iqbal, 5 wides",,"sliding down the leg side, past the sweep, past the keeper, rolls away for four wides",1
346,43,Tamim Iqbal,56194,Sikandar Raza,299572,"Sikandar Raza to Tamim Iqbal, no run Tamim thrusts his bat in front of the pad and blocks this straight ball to the off side",2nd innings,7.1,no run,46,0,46/1,"Sikandar Raza to Tamim Iqbal, no run",,Tamim thrusts his bat in front of the pad and blocks this straight ball to the off side,1
347,44,Tamim Iqbal,56194,Sikandar Raza,299572,"Sikandar Raza to Tamim Iqbal, 1 run this leg-stump ball is knocked through midwicket",2nd innings,7.2,run,47,1,47/1,"Sikandar Raza to Tamim Iqbal, 1 run",,this leg-stump ball is knocked through midwicket,1
348,45,Shakib Al Hasan,56143,Sikandar Raza,299572,"Sikandar Raza to Shakib Al Hasan, no run full and darted on middle, tapped to mid-on",2nd innings,7.3,no run,47,0,47/1,"Sikandar Raza to Shakib Al Hasan, no run",,"full and darted on middle, tapped to mid-on",1
349,46,Shakib Al Hasan,56143,Sikandar Raza,299572,"Sikandar Raza to Shakib Al Hasan, no run full on middle again, defended back to Raza",2nd innings,7.4,no run,47,0,47/1,"Sikandar Raza to Shakib Al Hasan, no run",,"full on middle again, defended back to Raza",1
350,46,Shakib Al Hasan,56143,Sikandar Raza,299572,"Sikandar Raza to Shakib Al Hasan, 1 wide another leg-side wide, beats the sweep but not the keeper",2nd innings,7.4,wide,48,1,48/1,"Sikandar Raza to Shakib Al Hasan, 1 wide",,"another leg-side wide, beats the sweep but not the keeper",1
351,47,Shakib Al Hasan,56143,Sikandar Raza,299572,"Sikandar Raza to Shakib Al Hasan, no run nice dip and turn, takes the outside edge on the drive and rolls to short third man",2nd innings,7.5,no run,48,0,48/1,"Sikandar Raza to Shakib Al Hasan, no run",,"nice dip and turn, takes the outside edge on the drive and rolls to short third man",1
352,48,Shakib Al Hasan,56143,Sikandar Raza,299572,"Sikandar Raza to Shakib Al Hasan, no run speared on off, too full to get under the length, stabbed back to Raza",2nd innings,7.6,no run,48,0,48/1,"Sikandar Raza to Shakib Al Hasan, no run",,"speared on off, too full to get under the length, stabbed back to Raza",1
353,49,Tamim Iqbal,56194,Blessing Muzarabani,827051,"Muzarabani to Tamim Iqbal, no run good length and angling away outside off, watchfully run away to backward point",2nd innings,8.1,no run,48,0,48/1,"Muzarabani to Tamim Iqbal, no run",,"good length and angling away outside off, watchfully run away to backward point",1
354,50,Tamim Iqbal,56194,Blessing Muzarabani,827051,"Muzarabani to Tamim Iqbal, 1 run full and angling away outside off, stabs a drive down the ground, bisecting mid-on and mid-off",2nd innings,8.2,run,49,1,49/1,"Muzarabani to Tamim Iqbal, 1 run",,"full and angling away outside off, stabs a drive down the ground, bisecting mid-on and mid-off",1
355,51,Shakib Al Hasan,56143,Blessing Muzarabani,827051,"Muzarabani to Shakib Al Hasan, 1 run short, wide, Shakib has a crack at it and skies it to third man",2nd innings,8.3,run,50,1,50/1,"Muzarabani to Shakib Al Hasan, 1 run",,"short, wide, Shakib has a crack at it and skies it to third man",1
356,52,Tamim Iqbal,56194,Blessing Muzarabani,827051,"Muzarabani to Tamim Iqbal, 1 run back of a length, tip and run to the off side, beside the pitch",2nd innings,8.4,run,51,1,51/1,"Muzarabani to Tamim Iqbal, 1 run",,"back of a length, tip and run to the off side, beside the pitch",1
357,53,Shakib Al Hasan,56143,Blessing Muzarabani,827051,"Muzarabani to Shakib Al Hasan, no run shorter and angling away outside off, Shakib rides the bounce and guides the ball to backward point",2nd innings,8.5,no run,51,0,51/1,"Muzarabani to Shakib Al Hasan, no run",,"shorter and angling away outside off, Shakib rides the bounce and guides the ball to backward point",1
358,54,Shakib Al Hasan,56143,Blessing Muzarabani,827051,"Muzarabani to Shakib Al Hasan, 1 run eases it off the pads to long leg to close out the over",2nd innings,8.6,run,52,1,52/1,"Muzarabani to Shakib Al Hasan, 1 run",,eases it off the pads to long leg to close out the over,1
