,ball,batsman,batsman_id,bowler,bowler_id,commentary,innings,overs,playType,runs,runs_scored,score,shortText,speed,text,wickets
0,1,Jason Roy,298438,Josh Hazlewood,288284,"Hazlewood to Roy, no run length, 138kph and speared in to hit the pads as Roy moves into line, there's a half-hearted lbw appeal but it looks a touch high and leg side",1st innings,0.1,no run,0,0,0/0,"Hazlewood to Roy, no run",138kph,"length, 138kph and speared in to hit the pads as Roy moves into line, there's a half-hearted lbw appeal but it looks a touch high and leg side",0
1,2,Jason Roy,298438,Josh Hazlewood,288284,"Hazlewood to Roy, OUT got him, slashed to point - <b>Roy goes second ball!</b> Full and quite wide but there was swing for Hazlewood and Roy was reaching for a loose drive without having got his bearings, Smith snaffles the low catch and Australia have nipped out an early one again",1st innings,0.2,out,0,0,0/1,"Hazlewood to Roy, OUT",,"got him, slashed to point - <b>Roy goes second ball!</b> Full and quite wide but there was swing for Hazlewood and Roy was reaching for a loose drive without having got his bearings, Smith snaffles the low catch and Australia have nipped out an early one again",1
2,3,Alex Hales,249866,Josh Hazlewood,288284,"Hazlewood to Hales, no run pitched up in the channel, shaping away a touch as Hales shuffles into line and lets it go",1st innings,0.3,no run,0,0,0/1,"Hazlewood to Hales, no run",,"pitched up in the channel, shaping away a touch as Hales shuffles into line and lets it go",1
3,4,Alex Hales,249866,Josh Hazlewood,288284,"Hazlewood to Hales, no run length, 138kph on a fourth-fifth stump line, Hales shows it the maker's name in defence",1st innings,0.4,no run,0,0,0/1,"Hazlewood to Hales, no run",138kph,"length, 138kph on a fourth-fifth stump line, Hales shows it the maker's name in defence",1
4,5,Alex Hales,249866,Josh Hazlewood,288284,"Hazlewood to Hales, no run tapped into the off side coming across",1st innings,0.5,no run,0,0,0/1,"Hazlewood to Hales, no run",,tapped into the off side coming across,1
5,5,Alex Hales,249866,Josh Hazlewood,288284,"Hazlewood to Hales, 1 wide short and wide, Hales throws the bat and misses... not far off feathering through, from the looks of it, but the umpire decides Hazlewood should bowl that one again",1st innings,0.5,wide,1,1,1/1,"Hazlewood to Hales, 1 wide",,"short and wide, Hales throws the bat and misses... not far off feathering through, from the looks of it, but the umpire decides Hazlewood should bowl that one again",1
6,6,Alex Hales,249866,Josh Hazlewood,288284,"Hazlewood to Hales, 1 run fullish outside off, leans into a punch wide of mid-off and they trot through for the first run off the bat",1st innings,0.6,run,2,1,2/1,"Hazlewood to Hales, 1 run",,"fullish outside off, leans into a punch wide of mid-off and they trot through for the first run off the bat",1
7,7,Alex Hales,249866,Pat Cummins,489889,"Cummins to Hales, no run good length in the channel, trying to tempt something rash from Hales, who's happy to remain circumspect",1st innings,1.1,no run,2,0,2/1,"Cummins to Hales, no run",,"good length in the channel, trying to tempt something rash from Hales, who's happy to remain circumspect",1
8,8,Alex Hales,249866,Pat Cummins,489889,"Cummins to Hales, no run tighter to the stumps and patted towards extra cover",1st innings,1.2,no run,2,0,2/1,"Cummins to Hales, no run",,tighter to the stumps and patted towards extra cover,1
9,9,Alex Hales,249866,Pat Cummins,489889,"Cummins to Hales, 1 run fired in straighter, 143kph on middle stumps, Hales chops down and gets another single through midwicket",1st innings,1.3,run,3,1,3/1,"Cummins to Hales, 1 run",143kph,"fired in straighter, 143kph on middle stumps, Hales chops down and gets another single through midwicket",1
10,10,Jonny Bairstow,297433,Pat Cummins,489889,"Cummins to Bairstow, no run ooh, hit high on the leg, whirring back in at him on the crease",1st innings,1.4,no run,3,0,3/1,"Cummins to Bairstow, no run",,"ooh, hit high on the leg, whirring back in at him on the crease",1
11,11,Jonny Bairstow,297433,Pat Cummins,489889,"Cummins to Bairstow, no run good length, rising on off stump, Bairstow lines this up in defence",1st innings,1.5,no run,3,0,3/1,"Cummins to Bairstow, no run",,"good length, rising on off stump, Bairstow lines this up in defence",1
12,12,Jonny Bairstow,297433,Pat Cummins,489889,"Cummins to Bairstow, no run touch fuller, moves across and taps into the off side",1st innings,1.6,no run,3,0,3/1,"Cummins to Bairstow, no run",,"touch fuller, moves across and taps into the off side",1
13,13,Alex Hales,249866,Josh Hazlewood,288284,"Hazlewood to Hales, no run coming back in and driven on the up, picks out cover",1st innings,2.1,no run,3,0,3/1,"Hazlewood to Hales, no run",,"coming back in and driven on the up, picks out cover",1
14,14,Alex Hales,249866,Josh Hazlewood,288284,"Hazlewood to Hales, 1 run slightly short and wide and Hales rocks back to chop the ball down to third man",1st innings,2.2,run,4,1,4/1,"Hazlewood to Hales, 1 run",,slightly short and wide and Hales rocks back to chop the ball down to third man,1
15,15,Jonny Bairstow,297433,Josh Hazlewood,288284,"Hazlewood to Bairstow, no run length delivery around off stump, YJB prods it away",1st innings,2.3,no run,4,0,4/1,"Hazlewood to Bairstow, no run",,"length delivery around off stump, YJB prods it away",1
16,16,Jonny Bairstow,297433,Josh Hazlewood,288284,"Hazlewood to Bairstow, no run full, Test-match length and looking for some nibble, Bairstow leans into a square punch but doesn't get it through",1st innings,2.4,no run,4,0,4/1,"Hazlewood to Bairstow, no run",,"full, Test-match length and looking for some nibble, Bairstow leans into a square punch but doesn't get it through",1
17,17,Jonny Bairstow,297433,Josh Hazlewood,288284,"Hazlewood to Bairstow, no run fired in on the stumps, 136kph/84mph and bunted towards mid-on",1st innings,2.5,no run,4,0,4/1,"Hazlewood to Bairstow, no run",136kph,"fired in on the stumps, 136kph/84mph and bunted towards mid-on",1
18,18,Jonny Bairstow,297433,Josh Hazlewood,288284,"Hazlewood to Bairstow, no run tight stuff so far from Hazlewood, giving up nothing for free, steered towards point",1st innings,2.6,no run,4,0,4/1,"Hazlewood to Bairstow, no run",,"tight stuff so far from Hazlewood, giving up nothing for free, steered towards point",1
19,19,Alex Hales,249866,Pat Cummins,489889,"Cummins to Hales, no run Cummins trundles in, hits a good length and Hales defends",1st innings,3.1,no run,4,0,4/1,"Cummins to Hales, no run",,"Cummins trundles in, hits a good length and Hales defends",1
20,20,Alex Hales,249866,Pat Cummins,489889,"Cummins to Hales, OUT <b>bowled 'im!</b> Superb ball from Cummins and England are two down for spit! There's been some nip off this fresh surface and Cummins locates the perfect length, it jags back appreciably as Hales presses forwards, flicks the front pad before rattling the off pole",1st innings,3.2,out,4,0,4/2,"Cummins to Hales, OUT",,"<b>bowled 'im!</b> Superb ball from Cummins and England are two down for spit! There's been some nip off this fresh surface and Cummins locates the perfect length, it jags back appreciably as Hales presses forwards, flicks the front pad before rattling the off pole",2
21,21,Joe Root,303669,Pat Cummins,489889,"Cummins to Root, no run fired in straight, Root gets well across and blocks",1st innings,3.3,no run,4,0,4/2,"Cummins to Root, no run",,"fired in straight, Root gets well across and blocks",2
22,22,Joe Root,303669,Pat Cummins,489889,"Cummins to Root, no run length, 142kph and rising up over off stump as Root shows it a straight bat",1st innings,3.4,no run,4,0,4/2,"Cummins to Root, no run",142kph,"length, 142kph and rising up over off stump as Root shows it a straight bat",2
23,23,Joe Root,303669,Pat Cummins,489889,"Cummins to Root, no run touch fuller, skidding on as Root hangs back but lines it up well to block",1st innings,3.5,no run,4,0,4/2,"Cummins to Root, no run",,"touch fuller, skidding on as Root hangs back but lines it up well to block",2
24,24,Joe Root,303669,Pat Cummins,489889,"Cummins to Root, no run heat from Patty C, 145kph around the line of off, prodded into the covers but there's no run there - wicket maiden, Australia have grabbed England by the lapels this avo",1st innings,3.6,no run,4,0,4/2,"Cummins to Root, no run",145kph,"heat from Patty C, 145kph around the line of off, prodded into the covers but there's no run there - wicket maiden, Australia have grabbed England by the lapels this avo",2
25,25,Jonny Bairstow,297433,Josh Hazlewood,288284,"Hazlewood to Bairstow, no run on the stumps, Bairstow watches it under his nose and defends",1st innings,4.1,no run,4,0,4/2,"Hazlewood to Bairstow, no run",,"on the stumps, Bairstow watches it under his nose and defends",2
26,26,Jonny Bairstow,297433,Josh Hazlewood,288284,"Hazlewood to Bairstow, OUT pitched up, <b>finds the outside edge</b> - another one goes! England are tottering like aunty on the gin... Hazlewood went wide on the crease and slid the ball in, enticing the drive but there was <i>just enough</i> seam movement to shift the line and kiss the edge of the bat. Bairstow slopes off in the fifth over for a nine-ball duck",1st innings,4.2,out,4,0,4/3,"Hazlewood to Bairstow, OUT",,"pitched up, <b>finds the outside edge</b> - another one goes! England are tottering like aunty on the gin... Hazlewood went wide on the crease and slid the ball in, enticing the drive but there was <i>just enough</i> seam movement to shift the line and kiss the edge of the bat. Bairstow slopes off in the fifth over for a nine-ball duck",3
27,27,Eoin Morgan,24598,Josh Hazlewood,288284,"Hazlewood to Morgan, no run pitched up on off stump, solid forward press in defence",1st innings,4.3,no run,4,0,4/3,"Hazlewood to Morgan, no run",,"pitched up on off stump, solid forward press in defence",3
28,28,Eoin Morgan,24598,Josh Hazlewood,288284,"Hazlewood to Morgan, no run staying over the wicket, 141kph and pushed across as Morgan gets into line and defends again",1st innings,4.4,no run,4,0,4/3,"Hazlewood to Morgan, no run",141kph,"staying over the wicket, 141kph and pushed across as Morgan gets into line and defends again",3
29,29,Eoin Morgan,24598,Josh Hazlewood,288284,"Hazlewood to Morgan, 2 runs full, gives him a bit of room and Morgan gets the scoreboard moving again with a stab through the covers",1st innings,4.5,run,6,2,6/3,"Hazlewood to Morgan, 2 runs",,"full, gives him a bit of room and Morgan gets the scoreboard moving again with a stab through the covers",3
30,30,Eoin Morgan,24598,Josh Hazlewood,288284,"Hazlewood to Morgan, no run pitched up in the channel, 137kph/85mph and he warily lets this one go",1st innings,4.6,no run,6,0,6/3,"Hazlewood to Morgan, no run",137kph,"pitched up in the channel, 137kph/85mph and he warily lets this one go",3
31,31,Joe Root,303669,Pat Cummins,489889,"Cummins to Root, no run fourth-stump line, Root comes across and pushes the ball square",1st innings,5.1,no run,6,0,6/3,"Cummins to Root, no run",,"fourth-stump line, Root comes across and pushes the ball square",3
32,32,Joe Root,303669,Pat Cummins,489889,"Cummins to Root, no run hammering a good length, Root continues to watch them on to the face of the bat",1st innings,5.2,no run,6,0,6/3,"Cummins to Root, no run",,"hammering a good length, Root continues to watch them on to the face of the bat",3
33,33,Joe Root,303669,Pat Cummins,489889,"Cummins to Root, OUT dug in, Root wafts at a pull, gets a big, ballooning top edge... <b>and Hazlewood pockets the catch at fine leg!</b> Root bags a duck and England are four down! Good pace and bounce, the bumper got too big for Root and he sent it right down the fielder's gullet. This could get <i>ugly</I>",1st innings,5.3,out,6,0,6/4,"Cummins to Root, OUT",,"dug in, Root wafts at a pull, gets a big, ballooning top edge... <b>and Hazlewood pockets the catch at fine leg!</b> Root bags a duck and England are four down! Good pace and bounce, the bumper got too big for Root and he sent it right down the fielder's gullet. This could get <i>ugly</I>",4
34,34,Eoin Morgan,24598,Pat Cummins,489889,"Cummins to Morgan, 2 runs pitched up and Morgan strokes a couple back past the bowler, neatly driven fine of mid-off",1st innings,5.4,run,8,2,8/4,"Cummins to Morgan, 2 runs",,"pitched up and Morgan strokes a couple back past the bowler, neatly driven fine of mid-off",4
35,35,Eoin Morgan,24598,Pat Cummins,489889,"Cummins to Morgan, no run angled across outside off, lets the ball go",1st innings,5.5,no run,8,0,8/4,"Cummins to Morgan, no run",,"angled across outside off, lets the ball go",4
36,36,Eoin Morgan,24598,Pat Cummins,489889,"Cummins to Morgan, no run length ball, Morgan pushes short into the covers and loudly bellows 'No!'",1st innings,5.6,no run,8,0,8/4,"Cummins to Morgan, no run",,"length ball, Morgan pushes short into the covers and loudly bellows 'No!'",4
37,37,Jos Buttler,308967,Josh Hazlewood,288284,"Hazlewood to Buttler, no run length ball around off, Buttler defends",1st innings,6.1,no run,8,0,8/4,"Hazlewood to Buttler, no run",,"length ball around off, Buttler defends",4
38,38,Jos Buttler,308967,Josh Hazlewood,288284,"Hazlewood to Buttler, OUT zips off a length, grazes the outside edge! <b>ENGLAND ARE 8 FOR 5!!!</b> (Or 5 for 8, if you're that sort...) Brilliant ball from Hazlewood, not too much fault with the batsman here: perfect length, seaming a fraction as Buttler felt for it in defence, flicks the bat and Paine swallows another!",1st innings,6.2,out,8,0,8/5,"Hazlewood to Buttler, OUT",,"zips off a length, grazes the outside edge! <b>ENGLAND ARE 8 FOR 5!!!</b> (Or 5 for 8, if you're that sort...) Brilliant ball from Hazlewood, not too much fault with the batsman here: perfect length, seaming a fraction as Buttler felt for it in defence, flicks the bat and Paine swallows another!",5
39,39,Moeen Ali,8917,Josh Hazlewood,288284,"Hazlewood to Ali, no run searing short ball, climbing through as Moeen hangs back",1st innings,6.3,no run,8,0,8/5,"Hazlewood to Ali, no run",,"searing short ball, climbing through as Moeen hangs back",5
40,40,Moeen Ali,8917,Josh Hazlewood,288284,"Hazlewood to Ali, no run angled across in the channel, lets this one go",1st innings,6.4,no run,8,0,8/5,"Hazlewood to Ali, no run",,"angled across in the channel, lets this one go",5
41,41,Moeen Ali,8917,Josh Hazlewood,288284,"Hazlewood to Ali, 1 run length, on middle and leg, Moeen prods a little tentatively and it rolls of the inside edge through midwicket",1st innings,6.5,run,9,1,9/5,"Hazlewood to Ali, 1 run",,"length, on middle and leg, Moeen prods a little tentatively and it rolls of the inside edge through midwicket",5
42,42,Eoin Morgan,24598,Josh Hazlewood,288284,"Hazlewood to Morgan, 1 run short ball, Morgan pulls and splices it... but safely into a gap on the leg side and it bobbles through midwicket for another single - and England are into double-figures, hurrah!",1st innings,6.6,run,10,1,10/5,"Hazlewood to Morgan, 1 run",,"short ball, Morgan pulls and splices it... but safely into a gap on the leg side and it bobbles through midwicket for another single - and England are into double-figures, hurrah!",5
43,43,Eoin Morgan,24598,Pat Cummins,489889,"Cummins to Morgan, 1 run pushed across the bows, Morgan reaches for a prod through cover point for one",1st innings,7.1,run,11,1,11/5,"Cummins to Morgan, 1 run",,"pushed across the bows, Morgan reaches for a prod through cover point for one",5
44,44,Moeen Ali,8917,Pat Cummins,489889,"Cummins to Ali, no run back of a length, lets this one go",1st innings,7.2,no run,11,0,11/5,"Cummins to Ali, no run",,"back of a length, lets this one go",5
45,45,Moeen Ali,8917,Pat Cummins,489889,"Cummins to Ali, 1 run touch short, rising over off stump and Moeen dabs it down short towards cover, they hustle through for one more",1st innings,7.3,run,12,1,12/5,"Cummins to Ali, 1 run",,"touch short, rising over off stump and Moeen dabs it down short towards cover, they hustle through for one more",5
46,46,Eoin Morgan,24598,Pat Cummins,489889,"Cummins to Morgan, 1 run oh, not far from a drag-on! Pitched up and Morgan wanted to drive, ends up thick-edging past his legs for a single",1st innings,7.4,run,13,1,13/5,"Cummins to Morgan, 1 run",,"oh, not far from a drag-on! Pitched up and Morgan wanted to drive, ends up thick-edging past his legs for a single",5
47,47,Moeen Ali,8917,Pat Cummins,489889,"Cummins to Ali, no run touch short of a length, left alone in the corridor",1st innings,7.5,no run,13,0,13/5,"Cummins to Ali, no run",,"touch short of a length, left alone in the corridor",5
48,48,Moeen Ali,8917,Pat Cummins,489889,"Cummins to Ali, no run flying through, 141kph as Moeen stays back and shoulders arms",1st innings,7.6,no run,13,0,13/5,"Cummins to Ali, no run",141kph,"flying through, 141kph as Moeen stays back and shoulders arms",5
49,49,Eoin Morgan,24598,Josh Hazlewood,288284,"Hazlewood to Morgan, no run shout for lbw! Was there bat involved...? Australia decide not to review, Morgan was a little tucked up trying to drive. Hazlewood seems to indicate that he hit it, although replays suggest otherwise",1st innings,8.1,no run,13,0,13/5,"Hazlewood to Morgan, no run",,"shout for lbw! Was there bat involved...? Australia decide not to review, Morgan was a little tucked up trying to drive. Hazlewood seems to indicate that he hit it, although replays suggest otherwise",5
50,50,Eoin Morgan,24598,Josh Hazlewood,288284,"Hazlewood to Morgan, no run skips down and attempts to hit Hazlewood off his length, comes off bat and thigh pad, loops short of the slips",1st innings,8.2,no run,13,0,13/5,"Hazlewood to Morgan, no run",,"skips down and attempts to hit Hazlewood off his length, comes off bat and thigh pad, loops short of the slips",5
51,51,Eoin Morgan,24598,Josh Hazlewood,288284,"Hazlewood to Morgan, no run oof, that's a good ball, 140kph and screeching through past the outside edge as he feels for it coming forward",1st innings,8.3,no run,13,0,13/5,"Hazlewood to Morgan, no run",140kph,"oof, that's a good ball, 140kph and screeching through past the outside edge as he feels for it coming forward",5
52,52,Eoin Morgan,24598,Josh Hazlewood,288284,"Hazlewood to Morgan, 1 run squirted off the pads into the leg side for one more",1st innings,8.4,run,14,1,14/5,"Hazlewood to Morgan, 1 run",,squirted off the pads into the leg side for one more,5
53,53,Moeen Ali,8917,Josh Hazlewood,288284,"Hazlewood to Ali, no run back of a length, Moeen tries to punch the rising ball from the crease but mistimes it",1st innings,8.5,no run,14,0,14/5,"Hazlewood to Ali, no run",,"back of a length, Moeen tries to punch the rising ball from the crease but mistimes it",5
54,54,Moeen Ali,8917,Josh Hazlewood,288284,"Hazlewood to Ali, no run short again, 135kph and prodded towards mid-off",1st innings,8.6,no run,14,0,14/5,"Hazlewood to Ali, no run",135kph,"short again, 135kph and prodded towards mid-off",5
55,54,Eoin Morgan,24598,Pat Cummins,489889,"Cummins to Morgan, 1 wide dug in short - too short, and called wide on height",1st innings,9.0,wide,15,1,15/5,"Cummins to Morgan, 1 wide",,"dug in short - too short, and called wide on height",5
56,55,Eoin Morgan,24598,Pat Cummins,489889,"Cummins to Morgan, no run drops short, 141kph and Morgan swats it into the off side, no timing on the stroke",1st innings,9.1,no run,15,0,15/5,"Cummins to Morgan, no run",141kph,"drops short, 141kph and Morgan swats it into the off side, no timing on the stroke",5
57,56,Eoin Morgan,24598,Pat Cummins,489889,"Cummins to Morgan, no run angled across on off, pushed into the covers",1st innings,9.2,no run,15,0,15/5,"Cummins to Morgan, no run",,"angled across on off, pushed into the covers",5
58,57,Eoin Morgan,24598,Pat Cummins,489889,"Cummins to Morgan, no run serious clicks from Cummins, 148kph and nibbling back to hit the inside edge before deflecting into Morgan's thigh. Yowch!",1st innings,9.3,no run,15,0,15/5,"Cummins to Morgan, no run",148kph,"serious clicks from Cummins, 148kph and nibbling back to hit the inside edge before deflecting into Morgan's thigh. Yowch!",5
59,58,Eoin Morgan,24598,Pat Cummins,489889,"Cummins to Morgan, no run dug in short, 143kph and whistling through as Morgan ducks and covers",1st innings,9.4,no run,15,0,15/5,"Cummins to Morgan, no run",143kph,"dug in short, 143kph and whistling through as Morgan ducks and covers",5
60,59,Eoin Morgan,24598,Pat Cummins,489889,"Cummins to Morgan, no run length, shaping away a fraction in the channel as Morgan leans out and sniffs the sea breeze",1st innings,9.5,no run,15,0,15/5,"Cummins to Morgan, no run",,"length, shaping away a fraction in the channel as Morgan leans out and sniffs the sea breeze",5
61,60,Eoin Morgan,24598,Pat Cummins,489889,"Cummins to Morgan, 3 runs nearly a boundary! But no dice, England... Morgan steps into a straight drive but Warner hares after it and pulls the ball in <i>just</i> in front of the rope at long-off!",1st innings,9.6,run,18,3,18/5,"Cummins to Morgan, 3 runs",,"nearly a boundary! But no dice, England... Morgan steps into a straight drive but Warner hares after it and pulls the ball in <i>just</i> in front of the rope at long-off!",5
62,61,Eoin Morgan,24598,Josh Hazlewood,288284,"Hazlewood to Morgan, 1 run another inside edge as Morgan pushes at a drive! Pings away behind square on the leg side",1st innings,10.1,run,19,1,19/5,"Hazlewood to Morgan, 1 run",,another inside edge as Morgan pushes at a drive! Pings away behind square on the leg side,5
63,62,Moeen Ali,8917,Josh Hazlewood,288284,"Hazlewood to Ali, no run line and length outside off, Moeen lets the ball go",1st innings,10.2,no run,19,0,19/5,"Hazlewood to Ali, no run",,"line and length outside off, Moeen lets the ball go",5
64,63,Moeen Ali,8917,Josh Hazlewood,288284,"Hazlewood to Ali, 1 run good-length ball on the pads, 135kph and Moeen flicks through midwicket",1st innings,10.3,run,20,1,20/5,"Hazlewood to Ali, 1 run",135kph,"good-length ball on the pads, 135kph and Moeen flicks through midwicket",5
65,64,Eoin Morgan,24598,Josh Hazlewood,288284,"Hazlewood to Morgan, no run shuffles into line and defends",1st innings,10.4,no run,20,0,20/5,"Hazlewood to Morgan, no run",,shuffles into line and defends,5
66,65,Eoin Morgan,24598,Josh Hazlewood,288284,"Hazlewood to Morgan, no run length, Morgan attempts to drive on the up, comes off the inside half of the bat and rolls to mid-on",1st innings,10.5,no run,20,0,20/5,"Hazlewood to Morgan, no run",,"length, Morgan attempts to drive on the up, comes off the inside half of the bat and rolls to mid-on",5
67,66,Eoin Morgan,24598,Josh Hazlewood,288284,"Hazlewood to Morgan, 1 run 137kph on the hip and Morgan jabs it away to fine leg",1st innings,10.6,run,21,1,21/5,"Hazlewood to Morgan, 1 run",137kph,137kph on the hip and Morgan jabs it away to fine leg,5
68,67,Eoin Morgan,24598,Mitchell Marsh,272450,"Marsh to Morgan, no run starts on the money, good length around middle and off, Morgan shows it a respectful straight bat",1st innings,11.1,no run,21,0,21/5,"Marsh to Morgan, no run",,"starts on the money, good length around middle and off, Morgan shows it a respectful straight bat",5
69,68,Eoin Morgan,24598,Mitchell Marsh,272450,"Marsh to Morgan, no run full, 134kph and sliding across as Morgan skips out and flays a drive to cover, no timing on that",1st innings,11.2,no run,21,0,21/5,"Marsh to Morgan, no run",134kph,"full, 134kph and sliding across as Morgan skips out and flays a drive to cover, no timing on that",5
70,69,Eoin Morgan,24598,Mitchell Marsh,272450,"Marsh to Morgan, no run fuller, looking for some off-stump nibble, Morgan defends",1st innings,11.3,no run,21,0,21/5,"Marsh to Morgan, no run",,"fuller, looking for some off-stump nibble, Morgan defends",5
71,70,Eoin Morgan,24598,Mitchell Marsh,272450,"Marsh to Morgan, no run ooh, beats the bat, Morgan again trying to whack one, looking for a boundary (and, to be fair, England could do with a couple) but done by the ball decking away just enough",1st innings,11.4,no run,21,0,21/5,"Marsh to Morgan, no run",,"ooh, beats the bat, Morgan again trying to whack one, looking for a boundary (and, to be fair, England could do with a couple) but done by the ball decking away just enough",5
72,71,Eoin Morgan,24598,Mitchell Marsh,272450,"Marsh to Morgan, no run full and driven towards mid-off, again not out of the middle",1st innings,11.5,no run,21,0,21/5,"Marsh to Morgan, no run",,"full and driven towards mid-off, again not out of the middle",5
73,72,Eoin Morgan,24598,Mitchell Marsh,272450,"Marsh to Morgan, no run pitched up, 135kph and Morgan clips this smoothly coming forwards but straight to mid-off",1st innings,11.6,no run,21,0,21/5,"Marsh to Morgan, no run",135kph,"pitched up, 135kph and Morgan clips this smoothly coming forwards but straight to mid-off",5
74,73,Moeen Ali,8917,Andrew Tye,459508,"Tye to Ali, 1 run length ball, touch leg side to start with and Moeen skims it to fine leg",1st innings,12.1,run,22,1,22/5,"Tye to Ali, 1 run",,"length ball, touch leg side to start with and Moeen skims it to fine leg",5
75,74,Eoin Morgan,24598,Andrew Tye,459508,"Tye to Morgan, no run full, outside off and driven, mistimed towards mid-off again",1st innings,12.2,no run,22,0,22/5,"Tye to Morgan, no run",,"full, outside off and driven, mistimed towards mid-off again",5
76,75,Eoin Morgan,24598,Andrew Tye,459508,"Tye to Morgan, no run full, hit on the pads, Tye appeals loudly... leg side, I think. Some swing there, though, made Morgan look very uncomfortable",1st innings,12.3,no run,22,0,22/5,"Tye to Morgan, no run",,"full, hit on the pads, Tye appeals loudly... leg side, I think. Some swing there, though, made Morgan look very uncomfortable",5
77,76,Eoin Morgan,24598,Andrew Tye,459508,"Tye to Morgan, no run on the stumps and prodded away",1st innings,12.4,no run,22,0,22/5,"Tye to Morgan, no run",,on the stumps and prodded away,5
