,ball,batsman,batsman_id,bowler,bowler_id,commentary,innings,overs,playType,runs,runs_scored,score,shortText,speed,text,wickets
176,174,Chris Woakes,247235,Andrew Tye,459508,"Tye to Woakes, 1 run patted into the covers, more solid connection on the front foot, and up comes the 100. Veritable riches, I tell you!",1st innings,28.6,run,100,1,100/6,"Tye to Woakes, 1 run",,"patted into the covers, more solid connection on the front foot, and up comes the 100. Veritable riches, I tell you!",6
177,175,Chris Woakes,247235,Mitchell Marsh,272450,"Marsh to Woakes, no run defended with resolve on the back foot",1st innings,29.1,no run,100,0,100/6,"Marsh to Woakes, no run",,defended with resolve on the back foot,6
178,176,Chris Woakes,247235,Mitchell Marsh,272450,"Marsh to Woakes, no run back of a length, hurried into a defensive push",1st innings,29.2,no run,100,0,100/6,"Marsh to Woakes, no run",,"back of a length, hurried into a defensive push",6
179,177,Chris Woakes,247235,Mitchell Marsh,272450,"Marsh to Woakes, no run nudged into the leg side",1st innings,29.3,no run,100,0,100/6,"Marsh to Woakes, no run",,nudged into the leg side,6
180,178,Chris Woakes,247235,Mitchell Marsh,272450,"Marsh to Woakes, SIX runs <B>slammed over midwicket!</B> Marsh strays a fraction too short and pays the price!",1st innings,29.4,six,106,6,106/6,"Marsh to Woakes, SIX runs",,<B>slammed over midwicket!</B> Marsh strays a fraction too short and pays the price!,6
181,179,Chris Woakes,247235,Mitchell Marsh,272450,"Marsh to Woakes, 1 run good riposte, a better length, inside edge, but a good stolen single nonetheless",1st innings,29.5,run,107,1,107/6,"Marsh to Woakes, 1 run",,"good riposte, a better length, inside edge, but a good stolen single nonetheless",6
182,180,Moeen Ali,8917,Mitchell Marsh,272450,"Marsh to Ali, FOUR runs hauled out through midwicket, too short again and this time the left-handed Moeen is the man to cash in. A good over from England",1st innings,29.6,four,111,4,111/6,"Marsh to Ali, FOUR runs",,"hauled out through midwicket, too short again and this time the left-handed Moeen is the man to cash in. A good over from England",6
183,181,Chris Woakes,247235,Andrew Tye,459508,"Tye to Woakes, no run ",1st innings,30.1,no run,111,0,111/6,"Tye to Woakes, no run",,,6
184,182,Chris Woakes,247235,Andrew Tye,459508,"Tye to Woakes, 1 run on the back foot, another tucked single to leg",1st innings,30.2,run,112,1,112/6,"Tye to Woakes, 1 run",,"on the back foot, another tucked single to leg",6
185,183,Moeen Ali,8917,Andrew Tye,459508,"Tye to Ali, OUT panned out to deep midwicket and <B>picks out the fielder!</B> A sharp double take as Head senses the rope behind him, tosses the ball back into play, and gathers at the second attempt",1st innings,30.3,out,112,0,112/7,"Tye to Ali, OUT",,"panned out to deep midwicket and <B>picks out the fielder!</B> A sharp double take as Head senses the rope behind him, tosses the ball back into play, and gathers at the second attempt",7
186,184,Adil Rashid,244497,Andrew Tye,459508,"Tye to Rashid, no run full and straight, dug out on the crease",1st innings,30.4,no run,112,0,112/7,"Tye to Rashid, no run",,"full and straight, dug out on the crease",7
187,185,Adil Rashid,244497,Andrew Tye,459508,"Tye to Rashid, 1 run tucked into the leg side to get off the mark",1st innings,30.5,run,113,1,113/7,"Tye to Rashid, 1 run",,tucked into the leg side to get off the mark,7
188,186,Chris Woakes,247235,Andrew Tye,459508,"Tye to Woakes, no run beats the edge",1st innings,30.6,no run,113,0,113/7,"Tye to Woakes, no run",,beats the edge,7
189,187,Adil Rashid,244497,Pat Cummins,489889,"Cummins to Rashid, no run an extravagant shouldering of arms",1st innings,31.1,no run,113,0,113/7,"Cummins to Rashid, no run",,an extravagant shouldering of arms,7
190,188,Adil Rashid,244497,Pat Cummins,489889,"Cummins to Rashid, FOUR runs punched through the covers! That's a lovely strike, onto the front foot, weight transferring into the ball",1st innings,31.2,four,117,4,117/7,"Cummins to Rashid, FOUR runs",,"punched through the covers! That's a lovely strike, onto the front foot, weight transferring into the ball",7
191,189,Adil Rashid,244497,Pat Cummins,489889,"Cummins to Rashid, 2 runs back of a length, a bit of an airy slap this time but finds the gap",1st innings,31.3,run,119,2,119/7,"Cummins to Rashid, 2 runs",,"back of a length, a bit of an airy slap this time but finds the gap",7
192,190,Adil Rashid,244497,Pat Cummins,489889,"Cummins to Rashid, no run through to the keeper, tight line",1st innings,31.4,no run,119,0,119/7,"Cummins to Rashid, no run",,"through to the keeper, tight line",7
193,190,Adil Rashid,244497,Pat Cummins,489889,"Cummins to Rashid, 1 wide short and leg-sided",1st innings,31.4,wide,120,1,120/7,"Cummins to Rashid, 1 wide",,short and leg-sided,7
194,191,Adil Rashid,244497,Pat Cummins,489889,"Cummins to Rashid, no run left alone with a flourish",1st innings,31.5,no run,120,0,120/7,"Cummins to Rashid, no run",,left alone with a flourish,7
195,192,Adil Rashid,244497,Pat Cummins,489889,"Cummins to Rashid, OUT back of a length, a simple nibble outside off, and Cummins strikes again!",1st innings,31.6,out,120,0,120/8,"Cummins to Rashid, OUT",,"back of a length, a simple nibble outside off, and Cummins strikes again!",8
196,193,Chris Woakes,247235,Andrew Tye,459508,"Tye to Woakes, 1 run ",1st innings,32.1,run,121,1,121/8,"Tye to Woakes, 1 run",,,8
197,194,Tom Curran,550235,Andrew Tye,459508,"Tye to Curran, 2 runs <B>edged again</b> but this time it doesn't carry! That's because it's the slower ball - the knuckleball - and dies in front of the keeper",1st innings,32.2,run,123,2,123/8,"Tye to Curran, 2 runs",,<B>edged again</b> but this time it doesn't carry! That's because it's the slower ball - the knuckleball - and dies in front of the keeper,8
198,195,Tom Curran,550235,Andrew Tye,459508,"Tye to Curran, 1 run chipped over the covers, a full face of the bat, pushed on the up, and out of the reach of the catcher!",1st innings,32.3,run,124,1,124/8,"Tye to Curran, 1 run",,"chipped over the covers, a full face of the bat, pushed on the up, and out of the reach of the catcher!",8
199,196,Chris Woakes,247235,Andrew Tye,459508,"Tye to Woakes, no run squirted into the covers once more",1st innings,32.4,no run,124,0,124/8,"Tye to Woakes, no run",,squirted into the covers once more,8
200,197,Chris Woakes,247235,Andrew Tye,459508,"Tye to Woakes, no run tapped to the off side",1st innings,32.5,no run,124,0,124/8,"Tye to Woakes, no run",,tapped to the off side,8
201,198,Chris Woakes,247235,Andrew Tye,459508,"Tye to Woakes, no run a slash and a miss",1st innings,32.6,no run,124,0,124/8,"Tye to Woakes, no run",,a slash and a miss,8
202,199,Tom Curran,550235,Pat Cummins,489889,"Cummins to Curran, no run length outside off, Curran swats it into the covers",1st innings,33.1,no run,124,0,124/8,"Cummins to Curran, no run",,"length outside off, Curran swats it into the covers",8
203,200,Tom Curran,550235,Pat Cummins,489889,"Cummins to Curran, no run in the channel, 141kph and Curran gets across to stun it into the off side",1st innings,33.2,no run,124,0,124/8,"Cummins to Curran, no run",141kph,"in the channel, 141kph and Curran gets across to stun it into the off side",8
204,201,Tom Curran,550235,Pat Cummins,489889,"Cummins to Curran, 1 run full and the flings the hands, scythed over backward point but it lands safely for one wide of third man",1st innings,33.3,run,125,1,125/8,"Cummins to Curran, 1 run",,"full and the flings the hands, scythed over backward point but it lands safely for one wide of third man",8
205,202,Chris Woakes,247235,Pat Cummins,489889,"Cummins to Woakes, no run arrowed into the channel, 142kph but Woakes calmly shuffles across and shoulders arms",1st innings,33.4,no run,125,0,125/8,"Cummins to Woakes, no run",142kph,"arrowed into the channel, 142kph but Woakes calmly shuffles across and shoulders arms",8
206,203,Chris Woakes,247235,Pat Cummins,489889,"Cummins to Woakes, no run Woakes hops into line and leaves alone once more",1st innings,33.5,no run,125,0,125/8,"Cummins to Woakes, no run",,Woakes hops into line and leaves alone once more,8
207,204,Chris Woakes,247235,Pat Cummins,489889,"Cummins to Woakes, no run teasing line, draws the fretful prod, takes the edge - <b>but doesn't carry to slip!</b> So close for Cummins, who ends with an immaculate 4 for 24 from his 10, a metre or two short of getting his fifth with the final ball of the spell",1st innings,33.6,no run,125,0,125/8,"Cummins to Woakes, no run",,"teasing line, draws the fretful prod, takes the edge - <b>but doesn't carry to slip!</b> So close for Cummins, who ends with an immaculate 4 for 24 from his 10, a metre or two short of getting his fifth with the final ball of the spell",8
208,205,Tom Curran,550235,Andrew Tye,459508,"Tye to Curran, no run Curran gets into line and defends",1st innings,34.1,no run,125,0,125/8,"Tye to Curran, no run",,Curran gets into line and defends,8
209,206,Tom Curran,550235,Andrew Tye,459508,"Tye to Curran, no run length ball on off, prodded to cover",1st innings,34.2,no run,125,0,125/8,"Tye to Curran, no run",,"length ball on off, prodded to cover",8
210,207,Tom Curran,550235,Andrew Tye,459508,"Tye to Curran, 1 bye woof, that's gone through, 138kph and it cuts through Curran, misses the edge by a whisker and then defeats Paine, deflecting off the gloves for a bye",1st innings,34.3,bye,126,1,126/8,"Tye to Curran, 1 bye",138kph,"woof, that's gone through, 138kph and it cuts through Curran, misses the edge by a whisker and then defeats Paine, deflecting off the gloves for a bye",8
211,208,Chris Woakes,247235,Andrew Tye,459508,"Tye to Woakes, no run angled in with the arm and prodded back towards mid-on",1st innings,34.4,no run,126,0,126/8,"Tye to Woakes, no run",,angled in with the arm and prodded back towards mid-on,8
212,209,Chris Woakes,247235,Andrew Tye,459508,"Tye to Woakes, no run fullish length, 131kph/80mph and pushed square",1st innings,34.5,no run,126,0,126/8,"Tye to Woakes, no run",131kph,"fullish length, 131kph/80mph and pushed square",8
213,210,Chris Woakes,247235,Andrew Tye,459508,"Tye to Woakes, 1 run bit of width and Woakes chops it down to third man for a single",1st innings,34.6,run,127,1,127/8,"Tye to Woakes, 1 run",,bit of width and Woakes chops it down to third man for a single,8
214,211,Chris Woakes,247235,Josh Hazlewood,288284,"Hazlewood to Woakes, 1 run tip and run into the off side, Woakes gets home at the non-striker's end",1st innings,35.1,run,128,1,128/8,"Hazlewood to Woakes, 1 run",,"tip and run into the off side, Woakes gets home at the non-striker's end",8
215,212,Tom Curran,550235,Josh Hazlewood,288284,"Hazlewood to Curran, no run swing and a miss from Curran, standing back and aiming a force through the covers",1st innings,35.2,no run,128,0,128/8,"Hazlewood to Curran, no run",,"swing and a miss from Curran, standing back and aiming a force through the covers",8
216,213,Tom Curran,550235,Josh Hazlewood,288284,"Hazlewood to Curran, 1 run fuller, 138kph outside off, plinked to deep cover coming across",1st innings,35.3,run,129,1,129/8,"Hazlewood to Curran, 1 run",138kph,"fuller, 138kph outside off, plinked to deep cover coming across",8
217,214,Chris Woakes,247235,Josh Hazlewood,288284,"Hazlewood to Woakes, 1 run short and a touch wide, slower delivery from Hazlewood and it's steered away past backward point",1st innings,35.4,run,130,1,130/8,"Hazlewood to Woakes, 1 run",,"short and a touch wide, slower delivery from Hazlewood and it's steered away past backward point",8
218,215,Tom Curran,550235,Josh Hazlewood,288284,"Hazlewood to Curran, FOUR runs short, rising and <i>smashed</i> through midwicket for four! Curran gets a biscuit, shows good technique to swivel-pull his first boundary",1st innings,35.5,four,134,4,134/8,"Hazlewood to Curran, FOUR runs",,"short, rising and <i>smashed</i> through midwicket for four! Curran gets a biscuit, shows good technique to swivel-pull his first boundary",8
219,216,Tom Curran,550235,Josh Hazlewood,288284,"Hazlewood to Curran, 1 run dug in short again, rising at the body as he fences it into the leg side",1st innings,35.6,run,135,1,135/8,"Hazlewood to Curran, 1 run",,"dug in short again, rising at the body as he fences it into the leg side",8
220,217,Tom Curran,550235,Marcus Stoinis,325012,"Stoinis to Curran, 1 run starts on a length outside off and Curran guides one to third man",1st innings,36.1,run,136,1,136/8,"Stoinis to Curran, 1 run",,starts on a length outside off and Curran guides one to third man,8
221,218,Chris Woakes,247235,Marcus Stoinis,325012,"Stoinis to Woakes, 1 run Woakes moves across and dabs another single behind point",1st innings,36.2,run,137,1,137/8,"Stoinis to Woakes, 1 run",,Woakes moves across and dabs another single behind point,8
222,219,Tom Curran,550235,Marcus Stoinis,325012,"Stoinis to Curran, 3 runs pitched up and Curran shows some batting chops once again, a princely straight drive for three",1st innings,36.3,run,140,3,140/8,"Stoinis to Curran, 3 runs",,"pitched up and Curran shows some batting chops once again, a princely straight drive for three",8
223,220,Chris Woakes,247235,Marcus Stoinis,325012,"Stoinis to Woakes, no run on the stumps, Woakes taps it away",1st innings,36.4,no run,140,0,140/8,"Stoinis to Woakes, no run",,"on the stumps, Woakes taps it away",8
224,221,Chris Woakes,247235,Marcus Stoinis,325012,"Stoinis to Woakes, no run rising on middle and off, defended",1st innings,36.5,no run,140,0,140/8,"Stoinis to Woakes, no run",,"rising on middle and off, defended",8
225,222,Chris Woakes,247235,Marcus Stoinis,325012,"Stoinis to Woakes, 1 run banged in, lollipop bouncer and Woakes swats it away through square leg for one",1st innings,36.6,run,141,1,141/8,"Stoinis to Woakes, 1 run",,"banged in, lollipop bouncer and Woakes swats it away through square leg for one",8
226,223,Chris Woakes,247235,Josh Hazlewood,288284,"Hazlewood to Woakes, 1 run good length outside off, runs one more to third man",1st innings,37.1,run,142,1,142/8,"Hazlewood to Woakes, 1 run",,"good length outside off, runs one more to third man",8
227,224,Tom Curran,550235,Josh Hazlewood,288284,"Hazlewood to Curran, 1 run full and driven, high front elbow from Curran, pierces the off side for another single",1st innings,37.2,run,143,1,143/8,"Hazlewood to Curran, 1 run",,"full and driven, high front elbow from Curran, pierces the off side for another single",8
228,225,Chris Woakes,247235,Josh Hazlewood,288284,"Hazlewood to Woakes, no run touch back of a length and jabbed into the covers",1st innings,37.3,no run,143,0,143/8,"Hazlewood to Woakes, no run",,touch back of a length and jabbed into the covers,8
229,226,Chris Woakes,247235,Josh Hazlewood,288284,"Hazlewood to Woakes, no run fullish, 137kph and driven crisply along the carpet to mid-off",1st innings,37.4,no run,143,0,143/8,"Hazlewood to Woakes, no run",137kph,"fullish, 137kph and driven crisply along the carpet to mid-off",8
230,227,Chris Woakes,247235,Josh Hazlewood,288284,"Hazlewood to Woakes, FOUR runs short ball, hoicked into the leg side, it runs away from deep square leg and into the rope - <b>fifty for Woakes</b>, a rhubarb stick of defiance brandished in Australia's direction",1st innings,37.5,four,147,4,147/8,"Hazlewood to Woakes, FOUR runs",,"short ball, hoicked into the leg side, it runs away from deep square leg and into the rope - <b>fifty for Woakes</b>, a rhubarb stick of defiance brandished in Australia's direction",8
231,228,Chris Woakes,247235,Josh Hazlewood,288284,"Hazlewood to Woakes, 2 runs full outside off, 139kph and squirted through backward point for a couple more",1st innings,37.6,run,149,2,149/8,"Hazlewood to Woakes, 2 runs",139kph,"full outside off, 139kph and squirted through backward point for a couple more",8
232,229,Tom Curran,550235,Marcus Stoinis,325012,"Stoinis to Curran, 1 run sliding into the pads and flicked down to fine leg... <b>England raise the 150</b>, to <del>complete indifference</del> polite applause around Adelaide Oval",1st innings,38.1,run,150,1,150/8,"Stoinis to Curran, 1 run",,"sliding into the pads and flicked down to fine leg... <b>England raise the 150</b>, to <del>complete indifference</del> polite applause around Adelaide Oval",8
233,230,Chris Woakes,247235,Marcus Stoinis,325012,"Stoinis to Woakes, 2 runs length, driven on the up through the covers, into a gap for two more",1st innings,38.2,run,152,2,152/8,"Stoinis to Woakes, 2 runs",,"length, driven on the up through the covers, into a gap for two more",8
234,231,Chris Woakes,247235,Marcus Stoinis,325012,"Stoinis to Woakes, no run full, dobbed on middle and off, driven to mid-on but without timing as the bat turned in the hands",1st innings,38.3,no run,152,0,152/8,"Stoinis to Woakes, no run",,"full, dobbed on middle and off, driven to mid-on but without timing as the bat turned in the hands",8
235,232,Chris Woakes,247235,Marcus Stoinis,325012,"Stoinis to Woakes, SIX runs slower delivery, but it's basically a gentle long-hop and <b>Woakes dumps it into the crowd at deep square leg!</b> On he cruises",1st innings,38.4,six,158,6,158/8,"Stoinis to Woakes, SIX runs",,"slower delivery, but it's basically a gentle long-hop and <b>Woakes dumps it into the crowd at deep square leg!</b> On he cruises",8
236,233,Chris Woakes,247235,Marcus Stoinis,325012,"Stoinis to Woakes, no run pitched up and sliding in on middle, pushed back past the bowler, mid-on comes across",1st innings,38.5,no run,158,0,158/8,"Stoinis to Woakes, no run",,"pitched up and sliding in on middle, pushed back past the bowler, mid-on comes across",8
237,234,Chris Woakes,247235,Marcus Stoinis,325012,"Stoinis to Woakes, no run in the channel and patted to cover",1st innings,38.6,no run,158,0,158/8,"Stoinis to Woakes, no run",,in the channel and patted to cover,8
238,235,Tom Curran,550235,Adam Zampa,379504,"Zampa to Curran, 1 run full but drifting leg side and Curran can nurdle one square",1st innings,39.1,run,159,1,159/8,"Zampa to Curran, 1 run",,full but drifting leg side and Curran can nurdle one square,8
239,236,Chris Woakes,247235,Adam Zampa,379504,"Zampa to Woakes, 1 run lobbed up on off, not much turn as Woakes steers a drive through mid-off",1st innings,39.2,run,160,1,160/8,"Zampa to Woakes, 1 run",,"lobbed up on off, not much turn as Woakes steers a drive through mid-off",8
240,237,Tom Curran,550235,Adam Zampa,379504,"Zampa to Curran, no run pushed through a but quicker and Curran drops back to punch into the covers",1st innings,39.3,no run,160,0,160/8,"Zampa to Curran, no run",,pushed through a but quicker and Curran drops back to punch into the covers,8
241,238,Tom Curran,550235,Adam Zampa,379504,"Zampa to Curran, no run tossed up, lots of side spin but the ball skids on and nearly castles Curran as he plays back again",1st innings,39.4,no run,160,0,160/8,"Zampa to Curran, no run",,"tossed up, lots of side spin but the ball skids on and nearly castles Curran as he plays back again",8
242,239,Tom Curran,550235,Adam Zampa,379504,"Zampa to Curran, 1 run flighted, full and wide and lashed away through point",1st innings,39.5,run,161,1,161/8,"Zampa to Curran, 1 run",,"flighted, full and wide and lashed away through point",8
243,240,Chris Woakes,247235,Adam Zampa,379504,"Zampa to Woakes, 1 run tossed up on off and Woakes eases on more through the off side",1st innings,39.6,run,162,1,162/8,"Zampa to Woakes, 1 run",,tossed up on off and Woakes eases on more through the off side,8
244,241,Chris Woakes,247235,Marcus Stoinis,325012,"Stoinis to Woakes, 1 run short ball, rocks back outside off and slices one down to third man",1st innings,40.1,run,163,1,163/8,"Stoinis to Woakes, 1 run",,"short ball, rocks back outside off and slices one down to third man",8
245,242,Tom Curran,550235,Marcus Stoinis,325012,"Stoinis to Curran, 1 run length ball, Curran comes across and punches square for another single",1st innings,40.2,run,164,1,164/8,"Stoinis to Curran, 1 run",,"length ball, Curran comes across and punches square for another single",8
246,243,Chris Woakes,247235,Marcus Stoinis,325012,"Stoinis to Woakes, no run tempter, 129kph in the channel, Woakes flails at it but doesn't connect",1st innings,40.3,no run,164,0,164/8,"Stoinis to Woakes, no run",129kph,"tempter, 129kph in the channel, Woakes flails at it but doesn't connect",8
247,244,Chris Woakes,247235,Marcus Stoinis,325012,"Stoinis to Woakes, SIX runs <b>short-arm jabbed into the stands!</b> That is some strike from Woakes, who is in Ribena form right now... not a terrible ball from Stoinis, slightly short but just helped over the rope at deep midwicket",1st innings,40.4,six,170,6,170/8,"Stoinis to Woakes, SIX runs",,"<b>short-arm jabbed into the stands!</b> That is some strike from Woakes, who is in Ribena form right now... not a terrible ball from Stoinis, slightly short but just helped over the rope at deep midwicket",8
248,245,Chris Woakes,247235,Marcus Stoinis,325012,"Stoinis to Woakes, no run on the stumps, better length and prodded back to the bowler",1st innings,40.5,no run,170,0,170/8,"Stoinis to Woakes, no run",,"on the stumps, better length and prodded back to the bowler",8
249,246,Chris Woakes,247235,Marcus Stoinis,325012,"Stoinis to Woakes, 1 run shovelled down the ground, short of mid-on and they scoot through",1st innings,40.6,run,171,1,171/8,"Stoinis to Woakes, 1 run",,"shovelled down the ground, short of mid-on and they scoot through",8
250,247,Chris Woakes,247235,Adam Zampa,379504,"Zampa to Woakes, 1 run tossed up and tickled down the ground coming forwards",1st innings,41.1,run,172,1,172/8,"Zampa to Woakes, 1 run",,tossed up and tickled down the ground coming forwards,8
251,248,Tom Curran,550235,Adam Zampa,379504,"Zampa to Curran, 1 run flighted, Curran shuffles across and pushes through cover",1st innings,41.2,run,173,1,173/8,"Zampa to Curran, 1 run",,"flighted, Curran shuffles across and pushes through cover",8
252,249,Chris Woakes,247235,Adam Zampa,379504,"Zampa to Woakes, no run tossed up on off and Woakes mistimes a thump",1st innings,41.3,no run,173,0,173/8,"Zampa to Woakes, no run",,tossed up on off and Woakes mistimes a thump,8
253,250,Chris Woakes,247235,Adam Zampa,379504,"Zampa to Woakes, SIX runs heaved leg side, there's a man out there... <b>but it clears Tye and goes for six!</b> Looks like he misjudged that, Zampa thought it was going straight to the man at cow corner, but he came in a few yards and then couldn't lay a hand on it",1st innings,41.4,six,179,6,179/8,"Zampa to Woakes, SIX runs",,"heaved leg side, there's a man out there... <b>but it clears Tye and goes for six!</b> Looks like he misjudged that, Zampa thought it was going straight to the man at cow corner, but he came in a few yards and then couldn't lay a hand on it",8
254,251,Chris Woakes,247235,Adam Zampa,379504,"Zampa to Woakes, no run floated up full, worked back to the bowler",1st innings,41.5,no run,179,0,179/8,"Zampa to Woakes, no run",,"floated up full, worked back to the bowler",8
255,252,Chris Woakes,247235,Adam Zampa,379504,"Zampa to Woakes, no run pushed through and he goes back to try and cut",1st innings,41.6,no run,179,0,179/8,"Zampa to Woakes, no run",,pushed through and he goes back to try and cut,8
256,253,Tom Curran,550235,Andrew Tye,459508,"Tye to Curran, no run full, the knuckle-ball to start with, Curran gets a leading edge",1st innings,42.1,no run,179,0,179/8,"Tye to Curran, no run",,"full, the knuckle-ball to start with, Curran gets a leading edge",8
257,254,Tom Curran,550235,Andrew Tye,459508,"Tye to Curran, 1 run pitched up on the stumps and flicked away to square leg, 'Yar!' barks Curran straight away",1st innings,42.2,run,180,1,180/8,"Tye to Curran, 1 run",,"pitched up on the stumps and flicked away to square leg, 'Yar!' barks Curran straight away",8
258,255,Chris Woakes,247235,Andrew Tye,459508,"Tye to Woakes, no run full length, 135kph outside off and tapped square",1st innings,42.3,no run,180,0,180/8,"Tye to Woakes, no run",135kph,"full length, 135kph outside off and tapped square",8
259,256,Chris Woakes,247235,Andrew Tye,459508,"Tye to Woakes, OUT slower ball, slugged down the ground... <b>and well taken by the fielder running in from long-on!</b> Glenn Maxwell it is, on as a sub, and he's the sort of catcher you want under those. Woakes' impressive counterattack is ended, a wide legcutter from Tye does it and he picks up his second wicket",1st innings,42.4,out,180,0,180/9,"Tye to Woakes, OUT",,"slower ball, slugged down the ground... <b>and well taken by the fielder running in from long-on!</b> Glenn Maxwell it is, on as a sub, and he's the sort of catcher you want under those. Woakes' impressive counterattack is ended, a wide legcutter from Tye does it and he picks up his second wicket",9
260,257,Tom Curran,550235,Andrew Tye,459508,"Tye to Curran, no run fired in straight and jabbed away to leg",1st innings,42.5,no run,180,0,180/9,"Tye to Curran, no run",,fired in straight and jabbed away to leg,9
261,258,Tom Curran,550235,Andrew Tye,459508,"Tye to Curran, 1 run good length, drops on to the back foot and guides a single to third man",1st innings,42.6,run,181,1,181/9,"Tye to Curran, 1 run",,"good length, drops on to the back foot and guides a single to third man",9
262,259,Tom Curran,550235,Adam Zampa,379504,"Zampa to Curran, 1 run floated up and driven through mid-off for one",1st innings,43.1,run,182,1,182/9,"Zampa to Curran, 1 run",,floated up and driven through mid-off for one,9
263,260,Mark Wood,351588,Adam Zampa,379504,"Zampa to Wood, 1 run flighted, outside off and gripping a touch, comes off the edge and runs wide of the keeper",1st innings,43.2,run,183,1,183/9,"Zampa to Wood, 1 run",,"flighted, outside off and gripping a touch, comes off the edge and runs wide of the keeper",9
