,ball,batsman,batsman_id,bowler,bowler_id,commentary,innings,otherBatsman,otherBatsman_id,otherBowler,otherBowler_id,overs,playType,runs,runs_scored,score,shortText,speed,text,wickets
449,141,Marlon Samuels,52983,Sikandar Raza,299572,"Sikandar Raza to Samuels, FOUR runs drags a short ball on middle, he rocks back and powers this pull to beat the midwicket fielder.",2nd innings,Shai Hope,581379,Graeme Cremer,55346,23.3,four,118,4,118/2,"Sikandar Raza to Samuels, FOUR runs",,"drags a short ball on middle, he rocks back and powers this pull to beat the midwicket fielder.",2
450,142,Marlon Samuels,52983,Sikandar Raza,299572,"Sikandar Raza to Samuels, no run nicely tossed up on middle and leg, he gets a good stride forward and works this back towards the bowler",2nd innings,Shai Hope,581379,Graeme Cremer,55346,23.4,no run,118,0,118/2,"Sikandar Raza to Samuels, no run",,"nicely tossed up on middle and leg, he gets a good stride forward and works this back towards the bowler",2
451,143,Marlon Samuels,52983,Sikandar Raza,299572,"Sikandar Raza to Samuels, 2 runs sloppy work. <strong>Jarvis let this go through his legs at midwicket</strong>, didn't bother haring after the ball.",2nd innings,Shai Hope,581379,Graeme Cremer,55346,23.5,run,120,2,120/2,"Sikandar Raza to Samuels, 2 runs",,"sloppy work. <strong>Jarvis let this go through his legs at midwicket</strong>, didn't bother haring after the ball.",2
452,144,Marlon Samuels,52983,Sikandar Raza,299572,"Sikandar Raza to Samuels, 1 run hint of drift away, eased wide of cover",2nd innings,Shai Hope,581379,Graeme Cremer,55346,23.6,run,121,1,121/2,"Sikandar Raza to Samuels, 1 run",,"hint of drift away, eased wide of cover",2
453,145,Marlon Samuels,52983,Sean Williams,55870,"Williams to Samuels, no run tossed up on middle, he lunges forward and blocks.",2nd innings,Shai Hope,581379,Sikandar Raza,299572,24.1,no run,121,0,121/2,"Williams to Samuels, no run",,"tossed up on middle, he lunges forward and blocks.",2
454,146,Marlon Samuels,52983,Sean Williams,55870,"Williams to Samuels, 1 run drills this drive to long-off",2nd innings,Shai Hope,581379,Sikandar Raza,299572,24.2,run,122,1,122/2,"Williams to Samuels, 1 run",,drills this drive to long-off,2
455,147,Shai Hope,581379,Sean Williams,55870,"Williams to Hope, 1 run touch short on middle and leg, whips this to deep midwicket",2nd innings,Marlon Samuels,52983,Sikandar Raza,299572,24.3,run,123,1,123/2,"Williams to Hope, 1 run",,"touch short on middle and leg, whips this to deep midwicket",2
456,148,Marlon Samuels,52983,Sean Williams,55870,"Williams to Samuels, no run nice flight, angling into middle and leg, defended towards short midwicket",2nd innings,Shai Hope,581379,Sikandar Raza,299572,24.4,no run,123,0,123/2,"Williams to Samuels, no run",,"nice flight, angling into middle and leg, defended towards short midwicket",2
457,149,Marlon Samuels,52983,Sean Williams,55870,"Williams to Samuels, no run drifting into the pads, tucks this behind square on the leg side",2nd innings,Shai Hope,581379,Sikandar Raza,299572,24.5,no run,123,0,123/2,"Williams to Samuels, no run",,"drifting into the pads, tucks this behind square on the leg side",2
458,150,Marlon Samuels,52983,Sean Williams,55870,"Williams to Samuels, FOUR runs <b> the wheels are starting to come off or what? </b? The deep square leg fielder lets this through his legs. This was a poor ball to begin with, too short, he rocked back and powered the pull. What should've been a single is now a boundary.",2nd innings,Shai Hope,581379,Sikandar Raza,299572,24.6,four,127,4,127/2,"Williams to Samuels, FOUR runs",,"<b> the wheels are starting to come off or what? </b? The deep square leg fielder lets this through his legs. This was a poor ball to begin with, too short, he rocked back and powered the pull. What should've been a single is now a boundary.",2
459,151,Shai Hope,581379,Tendai Chisoro,235519,"Chisoro to Hope, no run too full outside off, driven to point Excellent work by Masakadza",2nd innings,Marlon Samuels,52983,Sean Williams,55870,25.1,no run,127,0,127/2,"Chisoro to Hope, no run",,"too full outside off, driven to point Excellent work by Masakadza",2
460,152,Shai Hope,581379,Tendai Chisoro,235519,"Chisoro to Hope, 1 run nice flight, gets him to lunge a long way forward as he smothers this",2nd innings,Marlon Samuels,52983,Sean Williams,55870,25.2,run,128,1,128/2,"Chisoro to Hope, 1 run",,"nice flight, gets him to lunge a long way forward as he smothers this",2
461,153,Marlon Samuels,52983,Tendai Chisoro,235519,"Chisoro to Samuels, no run fires this length ball in from around the stumps, defended with soft hands.",2nd innings,Shai Hope,581379,Sean Williams,55870,25.3,no run,128,0,128/2,"Chisoro to Samuels, no run",,"fires this length ball in from around the stumps, defended with soft hands.",2
462,154,Marlon Samuels,52983,Tendai Chisoro,235519,"Chisoro to Samuels, FOUR runs hit-me buffet ball outside off, he rocks back to open up the off side and cuts this behind point. Poor bowling",2nd innings,Shai Hope,581379,Sean Williams,55870,25.4,four,132,4,132/2,"Chisoro to Samuels, FOUR runs",,"hit-me buffet ball outside off, he rocks back to open up the off side and cuts this behind point. Poor bowling",2
463,155,Marlon Samuels,52983,Tendai Chisoro,235519,"Chisoro to Samuels, no run slower length ball on off stump, bunted to cover.",2nd innings,Shai Hope,581379,Sean Williams,55870,25.5,no run,132,0,132/2,"Chisoro to Samuels, no run",,"slower length ball on off stump, bunted to cover.",2
464,156,Marlon Samuels,52983,Tendai Chisoro,235519,"Chisoro to Samuels, no run right behind the line as he defends again.",2nd innings,Shai Hope,581379,Sean Williams,55870,25.6,no run,132,0,132/2,"Chisoro to Samuels, no run",,right behind the line as he defends again.,2
465,157,Shai Hope,581379,Sean Williams,55870,"Williams to Hope, no run drifts in a quicker ball that skids on from middle and leg, he's hit on the thigh pad in trying to work this square on the leg side",2nd innings,Marlon Samuels,52983,Tendai Chisoro,235519,26.1,no run,132,0,132/2,"Williams to Hope, no run",,"drifts in a quicker ball that skids on from middle and leg, he's hit on the thigh pad in trying to work this square on the leg side",2
466,158,Shai Hope,581379,Sean Williams,55870,"Williams to Hope, 1 run shortens his length on middle, punched to long-on",2nd innings,Marlon Samuels,52983,Tendai Chisoro,235519,26.2,run,133,1,133/2,"Williams to Hope, 1 run",,"shortens his length on middle, punched to long-on",2
467,159,Marlon Samuels,52983,Sean Williams,55870,"Williams to Samuels, no run slows it down nicely, Samuels waits inside the crease and blocks",2nd innings,Shai Hope,581379,Tendai Chisoro,235519,26.3,no run,133,0,133/2,"Williams to Samuels, no run",,"slows it down nicely, Samuels waits inside the crease and blocks",2
468,160,Marlon Samuels,52983,Sean Williams,55870,"Williams to Samuels, no run eased back with the spin to the bowler",2nd innings,Shai Hope,581379,Tendai Chisoro,235519,26.4,no run,133,0,133/2,"Williams to Samuels, no run",,eased back with the spin to the bowler,2
469,161,Marlon Samuels,52983,Sean Williams,55870,"Williams to Samuels, 1 run drops short, he rocks back and hammers this pull to deep midwicket",2nd innings,Shai Hope,581379,Tendai Chisoro,235519,26.5,run,134,1,134/2,"Williams to Samuels, 1 run",,"drops short, he rocks back and hammers this pull to deep midwicket",2
470,162,Shai Hope,581379,Sean Williams,55870,"Williams to Hope, no run tossed up on middle and leg, Hope gets forward and smothers the spin",2nd innings,Marlon Samuels,52983,Tendai Chisoro,235519,26.6,no run,134,0,134/2,"Williams to Hope, no run",,"tossed up on middle and leg, Hope gets forward and smothers the spin",2
471,163,Marlon Samuels,52983,Tendai Chisoro,235519,"Chisoro to Samuels, no run slider on middle and leg from around the stumps, defended.",2nd innings,Shai Hope,581379,Sean Williams,55870,27.1,no run,134,0,134/2,"Chisoro to Samuels, no run",,"slider on middle and leg from around the stumps, defended.",2
472,164,Marlon Samuels,52983,Tendai Chisoro,235519,"Chisoro to Samuels, 1 run right to the pitch of the ball as he eases this to long-off",2nd innings,Shai Hope,581379,Sean Williams,55870,27.2,run,135,1,135/2,"Chisoro to Samuels, 1 run",,right to the pitch of the ball as he eases this to long-off,2
473,165,Shai Hope,581379,Tendai Chisoro,235519,"Chisoro to Hope, no run hint of turn from length on off stump, defended back",2nd innings,Marlon Samuels,52983,Sean Williams,55870,27.3,no run,135,0,135/2,"Chisoro to Hope, no run",,"hint of turn from length on off stump, defended back",2
474,166,Shai Hope,581379,Tendai Chisoro,235519,"Chisoro to Hope, 2 runs plays the short-arm jab towards deep square leg, they saunter back for the second",2nd innings,Marlon Samuels,52983,Sean Williams,55870,27.4,run,137,2,137/2,"Chisoro to Hope, 2 runs",,"plays the short-arm jab towards deep square leg, they saunter back for the second",2
475,167,Shai Hope,581379,Tendai Chisoro,235519,"Chisoro to Hope, no run makes room and crashes this to point. Good stop this time",2nd innings,Marlon Samuels,52983,Sean Williams,55870,27.5,no run,137,0,137/2,"Chisoro to Hope, no run",,makes room and crashes this to point. Good stop this time,2
476,168,Shai Hope,581379,Tendai Chisoro,235519,"Chisoro to Hope, no run fired full on off, eased to cover",2nd innings,Marlon Samuels,52983,Sean Williams,55870,27.6,no run,137,0,137/2,"Chisoro to Hope, no run",,"fired full on off, eased to cover",2
477,169,Marlon Samuels,52983,Sean Williams,55870,"Williams to Samuels, 1 run short down leg, he swivels back and pulls to deep square leg",2nd innings,Shai Hope,581379,Tendai Chisoro,235519,28.1,run,138,1,138/2,"Williams to Samuels, 1 run",,"short down leg, he swivels back and pulls to deep square leg",2
478,170,Shai Hope,581379,Sean Williams,55870,"Williams to Hope, 1 run eased with the angle to long-on",2nd innings,Marlon Samuels,52983,Tendai Chisoro,235519,28.2,run,139,1,139/2,"Williams to Hope, 1 run",,eased with the angle to long-on,2
479,171,Marlon Samuels,52983,Sean Williams,55870,"Williams to Samuels, no run stifled appeal as he's hit on the pad, but the ball was sliding down leg.",2nd innings,Shai Hope,581379,Tendai Chisoro,235519,28.3,no run,139,0,139/2,"Williams to Samuels, no run",,"stifled appeal as he's hit on the pad, but the ball was sliding down leg.",2
480,172,Marlon Samuels,52983,Sean Williams,55870,"Williams to Samuels, 1 run turns this gently behind square on the leg side for an easy single",2nd innings,Shai Hope,581379,Tendai Chisoro,235519,28.4,run,140,1,140/2,"Williams to Samuels, 1 run",,turns this gently behind square on the leg side for an easy single,2
481,173,Shai Hope,581379,Sean Williams,55870,"Williams to Hope, 1 run fired full on middle and leg, worked behind square on the leg side again",2nd innings,Marlon Samuels,52983,Tendai Chisoro,235519,28.5,run,141,1,141/2,"Williams to Hope, 1 run",,"fired full on middle and leg, worked behind square on the leg side again",2
482,174,Marlon Samuels,52983,Sean Williams,55870,"Williams to Samuels, no run right forward as he defends this",2nd innings,Shai Hope,581379,Tendai Chisoro,235519,28.6,no run,141,0,141/2,"Williams to Samuels, no run",,right forward as he defends this,2
483,175,Shai Hope,581379,Tendai Chisoro,235519,"Chisoro to Hope, 2 runs excellent work at deep extra cover, but is it a boundary? Looks like he may have pulled the ball back in just before hitting the ropes. This was dropped short and he crashed it hard",2nd innings,Marlon Samuels,52983,Sean Williams,55870,29.1,run,143,2,143/2,"Chisoro to Hope, 2 runs",,"excellent work at deep extra cover, but is it a boundary? Looks like he may have pulled the ball back in just before hitting the ropes. This was dropped short and he crashed it hard",2
484,176,Shai Hope,581379,Tendai Chisoro,235519,"Chisoro to Hope, no run play and a miss. Shaped to cut but this drifted back in to cramp him for room",2nd innings,Marlon Samuels,52983,Sean Williams,55870,29.2,no run,143,0,143/2,"Chisoro to Hope, no run",,play and a miss. Shaped to cut but this drifted back in to cramp him for room,2
485,177,Shai Hope,581379,Tendai Chisoro,235519,"Chisoro to Hope, 1 run works this with the angle behind square on the legside",2nd innings,Marlon Samuels,52983,Sean Williams,55870,29.3,run,144,1,144/2,"Chisoro to Hope, 1 run",,works this with the angle behind square on the legside,2
486,178,Marlon Samuels,52983,Tendai Chisoro,235519,"Chisoro to Samuels, 1 run eases this back to the bowler, down to long-on",2nd innings,Shai Hope,581379,Sean Williams,55870,29.4,run,145,1,145/2,"Chisoro to Samuels, 1 run",,"eases this back to the bowler, down to long-on",2
487,179,Shai Hope,581379,Tendai Chisoro,235519,"Chisoro to Hope, no run goes back into the crease and eases this to point",2nd innings,Marlon Samuels,52983,Sean Williams,55870,29.5,no run,145,0,145/2,"Chisoro to Hope, no run",,goes back into the crease and eases this to point,2
488,180,Shai Hope,581379,Tendai Chisoro,235519,"Chisoro to Hope, 1 run hint of width, he uses the depth of the crease to steer this towards short third man",2nd innings,Marlon Samuels,52983,Sean Williams,55870,29.6,run,146,1,146/2,"Chisoro to Hope, 1 run",,"hint of width, he uses the depth of the crease to steer this towards short third man",2
489,181,Shai Hope,581379,Sean Williams,55870,"Williams to Hope, no run drilled back to the bowler",2nd innings,Marlon Samuels,52983,Tendai Chisoro,235519,30.1,no run,146,0,146/2,"Williams to Hope, no run",,drilled back to the bowler,2
490,182,Shai Hope,581379,Sean Williams,55870,"Williams to Hope, 1 run full outside off, pushed back",2nd innings,Marlon Samuels,52983,Tendai Chisoro,235519,30.2,run,147,1,147/2,"Williams to Hope, 1 run",,"full outside off, pushed back",2
491,183,Marlon Samuels,52983,Sean Williams,55870,"Williams to Samuels, 1 run pitched up on the stumps, eased down to long-on",2nd innings,Shai Hope,581379,Tendai Chisoro,235519,30.3,run,148,1,148/2,"Williams to Samuels, 1 run",,"pitched up on the stumps, eased down to long-on",2
492,184,Shai Hope,581379,Sean Williams,55870,"Williams to Hope, 1 run short of a length, spins away, punched to sweeper cover",2nd innings,Marlon Samuels,52983,Tendai Chisoro,235519,30.4,run,149,1,149/2,"Williams to Hope, 1 run",,"short of a length, spins away, punched to sweeper cover",2
493,185,Marlon Samuels,52983,Sean Williams,55870,"Williams to Samuels, 1 run advances and hammers it straight back, so straight that it shatters the stumps at the other end and they only get a single off the deflection. And the stumps nearly took down the umpire!",2nd innings,Shai Hope,581379,Tendai Chisoro,235519,30.5,run,150,1,150/2,"Williams to Samuels, 1 run",,"advances and hammers it straight back, so straight that it shatters the stumps at the other end and they only get a single off the deflection. And the stumps nearly took down the umpire!",2
494,186,Shai Hope,581379,Sean Williams,55870,"Williams to Hope, 2 runs short, rocks back and pulls away to deep midwicket",2nd innings,Marlon Samuels,52983,Tendai Chisoro,235519,30.6,run,152,2,152/2,"Williams to Hope, 2 runs",,"short, rocks back and pulls away to deep midwicket",2
495,187,Marlon Samuels,52983,Tendai Chisoro,235519,"Chisoro to Samuels, no run drills a fuller one back to the bowler who half-stops it",2nd innings,Shai Hope,581379,Sean Williams,55870,31.1,no run,152,0,152/2,"Chisoro to Samuels, no run",,drills a fuller one back to the bowler who half-stops it,2
496,188,Marlon Samuels,52983,Tendai Chisoro,235519,"Chisoro to Samuels, no run pitched up on middle and leg, driven back",2nd innings,Shai Hope,581379,Sean Williams,55870,31.2,no run,152,0,152/2,"Chisoro to Samuels, no run",,"pitched up on middle and leg, driven back",2
497,189,Marlon Samuels,52983,Tendai Chisoro,235519,"Chisoro to Samuels, no run back of a length on middle, flicked to midwicket",2nd innings,Shai Hope,581379,Sean Williams,55870,31.3,no run,152,0,152/2,"Chisoro to Samuels, no run",,"back of a length on middle, flicked to midwicket",2
498,190,Marlon Samuels,52983,Tendai Chisoro,235519,"Chisoro to Samuels, 1 run flighted on middle and off, driven away to sweeper cover",2nd innings,Shai Hope,581379,Sean Williams,55870,31.4,run,153,1,153/2,"Chisoro to Samuels, 1 run",,"flighted on middle and off, driven away to sweeper cover",2
499,191,Shai Hope,581379,Tendai Chisoro,235519,"Chisoro to Hope, 2 runs short and wide, latches on to a cut through the covers and the sweeper runs across and fields sharply",2nd innings,Marlon Samuels,52983,Sean Williams,55870,31.5,run,155,2,155/2,"Chisoro to Hope, 2 runs",,"short and wide, latches on to a cut through the covers and the sweeper runs across and fields sharply",2
500,192,Shai Hope,581379,Tendai Chisoro,235519,"Chisoro to Hope, no run arm ball, fired in on a length on middle and leg, hurriedly backs away and keeps it out",2nd innings,Marlon Samuels,52983,Sean Williams,55870,31.6,no run,155,0,155/2,"Chisoro to Hope, no run",,"arm ball, fired in on a length on middle and leg, hurriedly backs away and keeps it out",2
501,193,Marlon Samuels,52983,Sean Williams,55870,"Williams to Samuels, 1 run backs away and opens the face to the right of point",2nd innings,Shai Hope,581379,Tendai Chisoro,235519,32.1,run,156,1,156/2,"Williams to Samuels, 1 run",,backs away and opens the face to the right of point,2
502,194,Shai Hope,581379,Sean Williams,55870,"Williams to Hope, 1 run flicked off the pads to square leg and they run sharply. Well-judged single",2nd innings,Marlon Samuels,52983,Tendai Chisoro,235519,32.2,run,157,1,157/2,"Williams to Hope, 1 run",,flicked off the pads to square leg and they run sharply. Well-judged single,2
503,195,Marlon Samuels,52983,Sean Williams,55870,"Williams to Samuels, no run slider on middle and leg, blocked down the pitch",2nd innings,Shai Hope,581379,Tendai Chisoro,235519,32.3,no run,157,0,157/2,"Williams to Samuels, no run",,"slider on middle and leg, blocked down the pitch",2
504,196,Marlon Samuels,52983,Sean Williams,55870,"Williams to Samuels, 1 run makes room and carves a cut to sweeper cover",2nd innings,Shai Hope,581379,Tendai Chisoro,235519,32.4,run,158,1,158/2,"Williams to Samuels, 1 run",,makes room and carves a cut to sweeper cover,2
505,197,Shai Hope,581379,Sean Williams,55870,"Williams to Hope, 1 run short of a length, straightens on off and he punches to deep point",2nd innings,Marlon Samuels,52983,Tendai Chisoro,235519,32.5,run,159,1,159/2,"Williams to Hope, 1 run",,"short of a length, straightens on off and he punches to deep point",2
506,198,Marlon Samuels,52983,Sean Williams,55870,"Williams to Samuels, 1 run drills an extremely full one to long-on",2nd innings,Shai Hope,581379,Tendai Chisoro,235519,32.6,run,160,1,160/2,"Williams to Samuels, 1 run",,drills an extremely full one to long-on,2
507,199,Marlon Samuels,52983,Sikandar Raza,299572,"Sikandar Raza to Samuels, 1 run shortish around off, cuts to extra cover who dives and gets a hand to it",2nd innings,Shai Hope,581379,Sean Williams,55870,33.1,run,161,1,161/2,"Sikandar Raza to Samuels, 1 run",,"shortish around off, cuts to extra cover who dives and gets a hand to it",2
508,200,Shai Hope,581379,Sikandar Raza,299572,"Sikandar Raza to Hope, 1 run back of a length, spinning in, tucked to deep midwicket",2nd innings,Marlon Samuels,52983,Sean Williams,55870,33.2,run,162,1,162/2,"Sikandar Raza to Hope, 1 run",,"back of a length, spinning in, tucked to deep midwicket",2
509,201,Marlon Samuels,52983,Sikandar Raza,299572,"Sikandar Raza to Samuels, 1 run again extra cover intercepts a cut with a dive and half-stops it",2nd innings,Shai Hope,581379,Sean Williams,55870,33.3,run,163,1,163/2,"Sikandar Raza to Samuels, 1 run",,again extra cover intercepts a cut with a dive and half-stops it,2
510,202,Shai Hope,581379,Sikandar Raza,299572,"Sikandar Raza to Hope, 1 run spins in from a length, worked to long-on",2nd innings,Marlon Samuels,52983,Sean Williams,55870,33.4,run,164,1,164/2,"Sikandar Raza to Hope, 1 run",,"spins in from a length, worked to long-on",2
511,203,Marlon Samuels,52983,Sikandar Raza,299572,"Sikandar Raza to Samuels, 1 run slid across off, pushed to long-off",2nd innings,Shai Hope,581379,Sean Williams,55870,33.5,run,165,1,165/2,"Sikandar Raza to Samuels, 1 run",,"slid across off, pushed to long-off",2
512,204,Shai Hope,581379,Sikandar Raza,299572,"Sikandar Raza to Hope, 1 run length, spinning in, flicked to square leg. <b>Fifty for Hope</b>",2nd innings,Marlon Samuels,52983,Sean Williams,55870,33.6,run,166,1,166/2,"Sikandar Raza to Hope, 1 run",,"length, spinning in, flicked to square leg. <b>Fifty for Hope</b>",2
513,205,Shai Hope,581379,Graeme Cremer,55346,"Cremer to Hope, no run slides on leg and straightens to brush the pad as he looks to flick",2nd innings,Marlon Samuels,52983,Sikandar Raza,299572,34.1,no run,166,0,166/2,"Cremer to Hope, no run",,slides on leg and straightens to brush the pad as he looks to flick,2
514,206,Shai Hope,581379,Graeme Cremer,55346,"Cremer to Hope, FOUR runs miscued pull shot, doesn't entirely get hold of it as he's tucked up for room but then he's wristily placed it behind square",2nd innings,Marlon Samuels,52983,Sikandar Raza,299572,34.2,four,170,4,170/2,"Cremer to Hope, FOUR runs",,"miscued pull shot, doesn't entirely get hold of it as he's tucked up for room but then he's wristily placed it behind square",2
515,207,Shai Hope,581379,Graeme Cremer,55346,"Cremer to Hope, no run slides on with the arm and gets an inside edge to short fine leg",2nd innings,Marlon Samuels,52983,Sikandar Raza,299572,34.3,no run,170,0,170/2,"Cremer to Hope, no run",,slides on with the arm and gets an inside edge to short fine leg,2
516,208,Shai Hope,581379,Graeme Cremer,55346,"Cremer to Hope, no run length ball, moves across and flicks to midwicket",2nd innings,Marlon Samuels,52983,Sikandar Raza,299572,34.4,no run,170,0,170/2,"Cremer to Hope, no run",,"length ball, moves across and flicks to midwicket",2
517,209,Shai Hope,581379,Graeme Cremer,55346,"Cremer to Hope, 1 run short of a length, spinning away on off, punched to long-on",2nd innings,Marlon Samuels,52983,Sikandar Raza,299572,34.5,run,171,1,171/2,"Cremer to Hope, 1 run",,"short of a length, spinning away on off, punched to long-on",2
518,210,Marlon Samuels,52983,Graeme Cremer,55346,"Cremer to Samuels, no run full on middle and leg, pushed into the covers",2nd innings,Shai Hope,581379,Sikandar Raza,299572,34.6,no run,171,0,171/2,"Cremer to Samuels, no run",,"full on middle and leg, pushed into the covers",2
519,211,Shai Hope,581379,Sikandar Raza,299572,"Sikandar Raza to Hope, no run stays back to a length ball and jabs it to mid-off",2nd innings,Marlon Samuels,52983,Graeme Cremer,55346,35.1,no run,171,0,171/2,"Sikandar Raza to Hope, no run",,stays back to a length ball and jabs it to mid-off,2
520,212,Shai Hope,581379,Sikandar Raza,299572,"Sikandar Raza to Hope, FOUR runs shortish, tries to make some room but doesn't get enough. Still manages to clear cover with a brutish bottom-handed slap",2nd innings,Marlon Samuels,52983,Graeme Cremer,55346,35.2,four,175,4,175/2,"Sikandar Raza to Hope, FOUR runs",,"shortish, tries to make some room but doesn't get enough. Still manages to clear cover with a brutish bottom-handed slap",2
521,213,Shai Hope,581379,Sikandar Raza,299572,"Sikandar Raza to Hope, 1 run waits for this fuller one outside off and opens the face to third man",2nd innings,Marlon Samuels,52983,Graeme Cremer,55346,35.3,run,176,1,176/2,"Sikandar Raza to Hope, 1 run",,waits for this fuller one outside off and opens the face to third man,2
522,214,Marlon Samuels,52983,Sikandar Raza,299572,"Sikandar Raza to Samuels, SIX runs advances, meets the pitch, gets enough room, and what more do you need? Carted over mid-off for as flat a six as you'll see",2nd innings,Shai Hope,581379,Graeme Cremer,55346,35.4,six,182,6,182/2,"Sikandar Raza to Samuels, SIX runs",,"advances, meets the pitch, gets enough room, and what more do you need? Carted over mid-off for as flat a six as you'll see",2
523,215,Marlon Samuels,52983,Sikandar Raza,299572,"Sikandar Raza to Samuels, SIX runs now he's skewed one off the outside of the bat though he steps down. But enough power on it to clear mid-off. Goes even further this time",2nd innings,Shai Hope,581379,Graeme Cremer,55346,35.5,six,188,6,188/2,"Sikandar Raza to Samuels, SIX runs",,now he's skewed one off the outside of the bat though he steps down. But enough power on it to clear mid-off. Goes even further this time,2
524,216,Marlon Samuels,52983,Sikandar Raza,299572,"Sikandar Raza to Samuels, 1 run that's good cricket. Two sixes followed by the single. Keeps the score ticking and retains strike as well... with a dab to square leg",2nd innings,Shai Hope,581379,Graeme Cremer,55346,35.6,run,189,1,189/2,"Sikandar Raza to Samuels, 1 run",,that's good cricket. Two sixes followed by the single. Keeps the score ticking and retains strike as well... with a dab to square leg,2
525,217,Marlon Samuels,52983,Graeme Cremer,55346,"Cremer to Samuels, 1 run floated up on middle, driven through extra cover",2nd innings,Shai Hope,581379,Sikandar Raza,299572,36.1,run,190,1,190/2,"Cremer to Samuels, 1 run",,"floated up on middle, driven through extra cover",2
526,218,Shai Hope,581379,Graeme Cremer,55346,"Cremer to Hope, 1 run flighted around off, slaps a drive to sweeper cover",2nd innings,Marlon Samuels,52983,Sikandar Raza,299572,36.2,run,191,1,191/2,"Cremer to Hope, 1 run",,"flighted around off, slaps a drive to sweeper cover",2
