,ball,batsman,batsman_id,bowler,bowler_id,commentary,innings,otherBatsman,otherBatsman_id,otherBowler,otherBowler_id,overs,playType,runs,runs_scored,score,shortText,speed,text,wickets
299,293,Solomon Mire,290462,Jason Holder,391485,"Holder to Mire, OUT got him with a beauty of a yorker. This is terrific. Full, straight and honing in towards base of middle from wide of the crease, Mire went for the big hit over long-on, swung through early and heard the ball rattle into the stumps.",1st innings,Tendai Chisoro,235519,Keemo Paul,677081,48.5,out,284,0,284/8,"Holder to Mire, OUT",,"got him with a beauty of a yorker. This is terrific. Full, straight and honing in towards base of middle from wide of the crease, Mire went for the big hit over long-on, swung through early and heard the ball rattle into the stumps.",8
300,294,Kyle Jarvis,332996,Jason Holder,391485,"Holder to Jarvis, no run slips in a full ball towards Jarvis' toe, he somehow manages to keep that out from rolling back onto the stumps.",1st innings,Tendai Chisoro,235519,Keemo Paul,677081,48.6,no run,284,0,284/8,"Holder to Jarvis, no run",,"slips in a full ball towards Jarvis' toe, he somehow manages to keep that out from rolling back onto the stumps.",8
301,295,Tendai Chisoro,235519,Keemo Paul,677081,"Paul to Chisoro, 1 run wild swing down to long-on, far from the middle, won't risk the second",1st innings,Kyle Jarvis,332996,Jason Holder,391485,49.1,run,285,1,285/8,"Paul to Chisoro, 1 run",,"wild swing down to long-on, far from the middle, won't risk the second",8
302,296,Kyle Jarvis,332996,Keemo Paul,677081,"Paul to Jarvis, 1 leg bye yorker length delivery angling in, squeezes off the pad to the off side as they scamper a leg bye",1st innings,Tendai Chisoro,235519,Jason Holder,391485,49.2,leg bye,286,1,286/8,"Paul to Jarvis, 1 leg bye",,"yorker length delivery angling in, squeezes off the pad to the off side as they scamper a leg bye",8
303,297,Tendai Chisoro,235519,Keemo Paul,677081,"Paul to Chisoro, 2 runs back of length delivery outside off, he backs away and squeezes this down to long-off",1st innings,Kyle Jarvis,332996,Jason Holder,391485,49.3,run,288,2,288/8,"Paul to Chisoro, 2 runs",,"back of length delivery outside off, he backs away and squeezes this down to long-off",8
304,298,Tendai Chisoro,235519,Keemo Paul,677081,"Paul to Chisoro, no run backs away and swings this length ball back to Paul, who puts his left hand out on the followthrough.",1st innings,Kyle Jarvis,332996,Jason Holder,391485,49.4,no run,288,0,288/8,"Paul to Chisoro, no run",,"backs away and swings this length ball back to Paul, who puts his left hand out on the followthrough.",8
305,299,Tendai Chisoro,235519,Keemo Paul,677081,"Paul to Chisoro, OUT walloped., has he cleared the ropes? No. Easy catch by Nurse at deep midwicket. Big buckets hands made it easy. He looked to swung this with the angle but got more elevation than distance. Looked to clear the biggest boundary, didn't have the timing.",1st innings,Kyle Jarvis,332996,Jason Holder,391485,49.5,out,288,0,288/9,"Paul to Chisoro, OUT",,"walloped., has he cleared the ropes? No. Easy catch by Nurse at deep midwicket. Big buckets hands made it easy. He looked to swung this with the angle but got more elevation than distance. Looked to clear the biggest boundary, didn't have the timing.",9
306,300,Kyle Jarvis,332996,Keemo Paul,677081,"Paul to Jarvis, 1 run, OUT squeezed towards long-off, there's a scurry for the second but the throw is superb at the keeper's end as the bails are whipped off. He's well short of the crease. Bowled out off the final ball.",1st innings,Blessing Muzarabani,827051,Jason Holder,391485,49.6,run,289,1,289/10,"Paul to Jarvis, 1 run, OUT",,"squeezed towards long-off, there's a scurry for the second but the throw is superb at the keeper's end as the bails are whipped off. He's well short of the crease. Bowled out off the final ball.",10
307,1,Chris Gayle,51880,Kyle Jarvis,332996,"Jarvis to Gayle, no run short of a length, wide outside off, keeps his bat inside the line",2nd innings,Evin Lewis,431901,,,0.1,no run,0,0,0/0,"Jarvis to Gayle, no run",,"short of a length, wide outside off, keeps his bat inside the line",0
308,2,Chris Gayle,51880,Kyle Jarvis,332996,"Jarvis to Gayle, 1 run same length but this time the line's straighter, and Gayle flicks off the hips to midwicket",2nd innings,Evin Lewis,431901,,,0.2,run,1,1,1/0,"Jarvis to Gayle, 1 run",,"same length but this time the line's straighter, and Gayle flicks off the hips to midwicket",0
309,3,Evin Lewis,431901,Kyle Jarvis,332996,"Jarvis to Lewis, no run short of a length outside off, punched to cover",2nd innings,Chris Gayle,51880,,,0.3,no run,1,0,1/0,"Jarvis to Lewis, no run",,"short of a length outside off, punched to cover",0
310,4,Evin Lewis,431901,Kyle Jarvis,332996,"Jarvis to Lewis, no run gets on top of the bounce and punches to point",2nd innings,Chris Gayle,51880,,,0.4,no run,1,0,1/0,"Jarvis to Lewis, no run",,gets on top of the bounce and punches to point,0
311,5,Evin Lewis,431901,Kyle Jarvis,332996,"Jarvis to Lewis, no run <b>is that a drop?</b> Oh, yeah. Would have been a terrific catch, but he probably should have taken it in the end assessment. Lewis flayed this shortish delivery to the left of Raza who flung himself and let the ball burst out after sticking out his left hand. Maybe he should have gone with two hands? You can say a lot in retrospect but it was a good effort",2nd innings,Chris Gayle,51880,,,0.5,no run,1,0,1/0,"Jarvis to Lewis, no run",,"<b>is that a drop?</b> Oh, yeah. Would have been a terrific catch, but he probably should have taken it in the end assessment. Lewis flayed this shortish delivery to the left of Raza who flung himself and let the ball burst out after sticking out his left hand. Maybe he should have gone with two hands? You can say a lot in retrospect but it was a good effort",0
312,6,Evin Lewis,431901,Kyle Jarvis,332996,"Jarvis to Lewis, no run punched to mid-off",2nd innings,Chris Gayle,51880,,,0.6,no run,1,0,1/0,"Jarvis to Lewis, no run",,punched to mid-off,0
313,7,Chris Gayle,51880,Sikandar Raza,299572,"Sikandar Raza to Gayle, 1 run sliding length ball that finds the inside of Gayle's bat and misses the stumps narrowly",2nd innings,Evin Lewis,431901,Kyle Jarvis,332996,1.1,run,2,1,2/0,"Sikandar Raza to Gayle, 1 run",,sliding length ball that finds the inside of Gayle's bat and misses the stumps narrowly,0
314,8,Evin Lewis,431901,Sikandar Raza,299572,"Sikandar Raza to Lewis, no run length ball on middle and off, blocked",2nd innings,Chris Gayle,51880,Kyle Jarvis,332996,1.2,no run,2,0,2/0,"Sikandar Raza to Lewis, no run",,"length ball on middle and off, blocked",0
315,9,Evin Lewis,431901,Sikandar Raza,299572,"Sikandar Raza to Lewis, no run full outside off, driven to the right of the bowler",2nd innings,Chris Gayle,51880,Kyle Jarvis,332996,1.3,no run,2,0,2/0,"Sikandar Raza to Lewis, no run",,"full outside off, driven to the right of the bowler",0
316,10,Evin Lewis,431901,Sikandar Raza,299572,"Sikandar Raza to Lewis, no run flicked off the pads to square leg",2nd innings,Chris Gayle,51880,Kyle Jarvis,332996,1.4,no run,2,0,2/0,"Sikandar Raza to Lewis, no run",,flicked off the pads to square leg,0
317,11,Evin Lewis,431901,Sikandar Raza,299572,"Sikandar Raza to Lewis, no run full on the stumps, defended off the front foot",2nd innings,Chris Gayle,51880,Kyle Jarvis,332996,1.5,no run,2,0,2/0,"Sikandar Raza to Lewis, no run",,"full on the stumps, defended off the front foot",0
318,11,Evin Lewis,431901,Sikandar Raza,299572,"Sikandar Raza to Lewis, 1 wide gets down for a sweep but misses as the ball goes down the leg side",2nd innings,Chris Gayle,51880,Kyle Jarvis,332996,1.5,wide,3,1,3/0,"Sikandar Raza to Lewis, 1 wide",,gets down for a sweep but misses as the ball goes down the leg side,0
319,12,Evin Lewis,431901,Sikandar Raza,299572,"Sikandar Raza to Lewis, 5 runs stays back and turns this fullish one away in front of mid-on. Ah, and they have conceded overthrows. Williams it was, who fired a throw at Gayle's end. Hits the top of Gayle's helmet and then trickles away for four",2nd innings,Chris Gayle,51880,Kyle Jarvis,332996,1.6,run,8,5,8/0,"Sikandar Raza to Lewis, 5 runs",,"stays back and turns this fullish one away in front of mid-on. Ah, and they have conceded overthrows. Williams it was, who fired a throw at Gayle's end. Hits the top of Gayle's helmet and then trickles away for four",0
320,13,Evin Lewis,431901,Kyle Jarvis,332996,"Jarvis to Lewis, no run short and wide, gets on top and middles a punch to cover",2nd innings,Chris Gayle,51880,Sikandar Raza,299572,2.1,no run,8,0,8/0,"Jarvis to Lewis, no run",,"short and wide, gets on top and middles a punch to cover",0
321,14,Evin Lewis,431901,Kyle Jarvis,332996,"Jarvis to Lewis, no run slower full ball at 108ks on middle and off, defended",2nd innings,Chris Gayle,51880,Sikandar Raza,299572,2.2,no run,8,0,8/0,"Jarvis to Lewis, no run",,"slower full ball at 108ks on middle and off, defended",0
322,15,Evin Lewis,431901,Kyle Jarvis,332996,"Jarvis to Lewis, FOUR runs <b>just over mid-on</b>. Had to fetch this pull from outside off, and Lewis mistimed it but had enough power to clear Jarvis",2nd innings,Chris Gayle,51880,Sikandar Raza,299572,2.3,four,12,4,12/0,"Jarvis to Lewis, FOUR runs",,"<b>just over mid-on</b>. Had to fetch this pull from outside off, and Lewis mistimed it but had enough power to clear Jarvis",0
323,16,Evin Lewis,431901,Kyle Jarvis,332996,"Jarvis to Lewis, no run short and wide, another mistimed cut, chopped to point",2nd innings,Chris Gayle,51880,Sikandar Raza,299572,2.4,no run,12,0,12/0,"Jarvis to Lewis, no run",,"short and wide, another mistimed cut, chopped to point",0
324,17,Evin Lewis,431901,Kyle Jarvis,332996,"Jarvis to Lewis, FOUR runs short ball, slower at 114kmph, picked early by Lewis who times a powerful pull that beats deep midwicket diving to his left",2nd innings,Chris Gayle,51880,Sikandar Raza,299572,2.5,four,16,4,16/0,"Jarvis to Lewis, FOUR runs",,"short ball, slower at 114kmph, picked early by Lewis who times a powerful pull that beats deep midwicket diving to his left",0
325,18,Evin Lewis,431901,Kyle Jarvis,332996,"Jarvis to Lewis, no run short, wide, cut to point",2nd innings,Chris Gayle,51880,Sikandar Raza,299572,2.6,no run,16,0,16/0,"Jarvis to Lewis, no run",,"short, wide, cut to point",0
326,19,Chris Gayle,51880,Sikandar Raza,299572,"Sikandar Raza to Gayle, no run pitched up on middle and leg, driven out",2nd innings,Evin Lewis,431901,Kyle Jarvis,332996,3.1,no run,16,0,16/0,"Sikandar Raza to Gayle, no run",,"pitched up on middle and leg, driven out",0
327,20,Chris Gayle,51880,Sikandar Raza,299572,"Sikandar Raza to Gayle, no run blocked into the off side",2nd innings,Evin Lewis,431901,Kyle Jarvis,332996,3.2,no run,16,0,16/0,"Sikandar Raza to Gayle, no run",,blocked into the off side,0
328,21,Chris Gayle,51880,Sikandar Raza,299572,"Sikandar Raza to Gayle, 2 runs <b>in the air and safe</b>. No deep midwicket in place for Gayle, would you believe it? Gets down to sweep and gets a top-edge and lands safe in the deep square leg region",2nd innings,Evin Lewis,431901,Kyle Jarvis,332996,3.3,run,18,2,18/0,"Sikandar Raza to Gayle, 2 runs",,"<b>in the air and safe</b>. No deep midwicket in place for Gayle, would you believe it? Gets down to sweep and gets a top-edge and lands safe in the deep square leg region",0
329,22,Chris Gayle,51880,Sikandar Raza,299572,"Sikandar Raza to Gayle, SIX runs and that's your punishment for that, Zimbabwe. Take it! Clean swing of the arms as he effortlessly dispatches this fuller one straight over",2nd innings,Evin Lewis,431901,Kyle Jarvis,332996,3.4,six,24,6,24/0,"Sikandar Raza to Gayle, SIX runs",,"and that's your punishment for that, Zimbabwe. Take it! Clean swing of the arms as he effortlessly dispatches this fuller one straight over",0
330,23,Chris Gayle,51880,Sikandar Raza,299572,"Sikandar Raza to Gayle, SIX runs skips down the track, gets to the pitch, and now deposits it over long-on. Barely any effort, but such is the weight behind each shot",2nd innings,Evin Lewis,431901,Kyle Jarvis,332996,3.5,six,30,6,30/0,"Sikandar Raza to Gayle, SIX runs",,"skips down the track, gets to the pitch, and now deposits it over long-on. Barely any effort, but such is the weight behind each shot",0
331,24,Chris Gayle,51880,Sikandar Raza,299572,"Sikandar Raza to Gayle, no run walks down the ground and flicks in front of mid-on. Expensive over from Raza",2nd innings,Evin Lewis,431901,Kyle Jarvis,332996,3.6,no run,30,0,30/0,"Sikandar Raza to Gayle, no run",,walks down the ground and flicks in front of mid-on. Expensive over from Raza,0
332,25,Evin Lewis,431901,Kyle Jarvis,332996,"Jarvis to Lewis, no run shuffles across and punches a back of a length delivery to mid-off",2nd innings,Chris Gayle,51880,Sikandar Raza,299572,4.1,no run,30,0,30/0,"Jarvis to Lewis, no run",,shuffles across and punches a back of a length delivery to mid-off,0
333,26,Evin Lewis,431901,Kyle Jarvis,332996,"Jarvis to Lewis, no run good length outside off, takes the front foot across and blocks down the pitch",2nd innings,Chris Gayle,51880,Sikandar Raza,299572,4.2,no run,30,0,30/0,"Jarvis to Lewis, no run",,"good length outside off, takes the front foot across and blocks down the pitch",0
334,27,Evin Lewis,431901,Kyle Jarvis,332996,"Jarvis to Lewis, no run short of a length, jumps and punches to cover",2nd innings,Chris Gayle,51880,Sikandar Raza,299572,4.3,no run,30,0,30/0,"Jarvis to Lewis, no run",,"short of a length, jumps and punches to cover",0
335,28,Evin Lewis,431901,Kyle Jarvis,332996,"Jarvis to Lewis, no run short of good length, stops a little outside off, pushed uppishly but lands in front of point",2nd innings,Chris Gayle,51880,Sikandar Raza,299572,4.4,no run,30,0,30/0,"Jarvis to Lewis, no run",,"short of good length, stops a little outside off, pushed uppishly but lands in front of point",0
336,29,Evin Lewis,431901,Kyle Jarvis,332996,"Jarvis to Lewis, FOUR runs finally he's found the gap! Only barely, though, but he'll take it. Another short of a length delivery with ample width, and he's punched it away off the backfoot",2nd innings,Chris Gayle,51880,Sikandar Raza,299572,4.5,four,34,4,34/0,"Jarvis to Lewis, FOUR runs",,"finally he's found the gap! Only barely, though, but he'll take it. Another short of a length delivery with ample width, and he's punched it away off the backfoot",0
337,30,Evin Lewis,431901,Kyle Jarvis,332996,"Jarvis to Lewis, 2 runs that's the length. Drawing him out of the confines of his crease with a length ball and finding the outside edge to third man after getting it to nip away",2nd innings,Chris Gayle,51880,Sikandar Raza,299572,4.6,run,36,2,36/0,"Jarvis to Lewis, 2 runs",,that's the length. Drawing him out of the confines of his crease with a length ball and finding the outside edge to third man after getting it to nip away,0
338,31,Chris Gayle,51880,Blessing Muzarabani,827051,"Muzarabani to Gayle, no run short of a length on middle, blocked",2nd innings,Evin Lewis,431901,Kyle Jarvis,332996,5.1,no run,36,0,36/0,"Muzarabani to Gayle, no run",,"short of a length on middle, blocked",0
339,32,Chris Gayle,51880,Blessing Muzarabani,827051,"Muzarabani to Gayle, 1 run comes down the ground and backs away and pushes in front of mid-on to take off for a quick single. Rare, diligence in strike-rotation from Gayle",2nd innings,Evin Lewis,431901,Kyle Jarvis,332996,5.2,run,37,1,37/0,"Muzarabani to Gayle, 1 run",,"comes down the ground and backs away and pushes in front of mid-on to take off for a quick single. Rare, diligence in strike-rotation from Gayle",0
340,33,Evin Lewis,431901,Blessing Muzarabani,827051,"Muzarabani to Lewis, 1 run tucked off the hips to midwicket and this time they jog the single",2nd innings,Chris Gayle,51880,Kyle Jarvis,332996,5.3,run,38,1,38/0,"Muzarabani to Lewis, 1 run",,tucked off the hips to midwicket and this time they jog the single,0
341,34,Chris Gayle,51880,Blessing Muzarabani,827051,"Muzarabani to Gayle, no run short, angled across, tries to pull and gets beaten",2nd innings,Evin Lewis,431901,Kyle Jarvis,332996,5.4,no run,38,0,38/0,"Muzarabani to Gayle, no run",,"short, angled across, tries to pull and gets beaten",0
342,35,Chris Gayle,51880,Blessing Muzarabani,827051,"Muzarabani to Gayle, OUT there goes Gayle. Blessing strikes early to get the crowd all worked up. And it's the big fish. It's short and angled across and Gayle scythes at it.The sharp angle and extra bounce results in the ball skewing off the outside edge of the lower part of the bat and lobbing to third man",2nd innings,Evin Lewis,431901,Kyle Jarvis,332996,5.5,out,38,0,38/1,"Muzarabani to Gayle, OUT",,there goes Gayle. Blessing strikes early to get the crowd all worked up. And it's the big fish. It's short and angled across and Gayle scythes at it.The sharp angle and extra bounce results in the ball skewing off the outside edge of the lower part of the bat and lobbing to third man,1
343,36,Shai Hope,581379,Blessing Muzarabani,827051,"Muzarabani to Hope, no run short, a charged-up bouncer outside off, Hope sways out of the line",2nd innings,Evin Lewis,431901,Kyle Jarvis,332996,5.6,no run,38,0,38/1,"Muzarabani to Hope, no run",,"short, a charged-up bouncer outside off, Hope sways out of the line",1
344,37,Evin Lewis,431901,Kyle Jarvis,332996,"Jarvis to Lewis, SIX runs that's a flat six. Can't bowl there to Lewis, who swivels and helps along a short ball off the hips over backward square leg",2nd innings,Shai Hope,581379,Blessing Muzarabani,827051,6.1,six,44,6,44/1,"Jarvis to Lewis, SIX runs",,"that's a flat six. Can't bowl there to Lewis, who swivels and helps along a short ball off the hips over backward square leg",1
345,38,Evin Lewis,431901,Kyle Jarvis,332996,"Jarvis to Lewis, no run back of a length, shuffles across and lets it go",2nd innings,Shai Hope,581379,Blessing Muzarabani,827051,6.2,no run,44,0,44/1,"Jarvis to Lewis, no run",,"back of a length, shuffles across and lets it go",1
346,39,Evin Lewis,431901,Kyle Jarvis,332996,"Jarvis to Lewis, no run good length, outside off, left alone",2nd innings,Shai Hope,581379,Blessing Muzarabani,827051,6.3,no run,44,0,44/1,"Jarvis to Lewis, no run",,"good length, outside off, left alone",1
347,40,Evin Lewis,431901,Kyle Jarvis,332996,"Jarvis to Lewis, no run short of a length, angled across, shuffles across and lets it go",2nd innings,Shai Hope,581379,Blessing Muzarabani,827051,6.4,no run,44,0,44/1,"Jarvis to Lewis, no run",,"short of a length, angled across, shuffles across and lets it go",1
348,41,Evin Lewis,431901,Kyle Jarvis,332996,"Jarvis to Lewis, no run shuffles and blocks a back of a length delivery to cover",2nd innings,Shai Hope,581379,Blessing Muzarabani,827051,6.5,no run,44,0,44/1,"Jarvis to Lewis, no run",,shuffles and blocks a back of a length delivery to cover,1
349,42,Evin Lewis,431901,Kyle Jarvis,332996,"Jarvis to Lewis, no run punched down to mid-on from front of off",2nd innings,Shai Hope,581379,Blessing Muzarabani,827051,6.6,no run,44,0,44/1,"Jarvis to Lewis, no run",,punched down to mid-on from front of off,1
350,43,Shai Hope,581379,Blessing Muzarabani,827051,"Muzarabani to Hope, no run short of a length, shifts back and keeps it out",2nd innings,Evin Lewis,431901,Kyle Jarvis,332996,7.1,no run,44,0,44/1,"Muzarabani to Hope, no run",,"short of a length, shifts back and keeps it out",1
351,44,Shai Hope,581379,Blessing Muzarabani,827051,"Muzarabani to Hope, 1 run <b>oh, missed chance, but what an effort!</b> Would have been one of the finest ever if he'd pulled it off. Top-edge on the pull and the fielder at deep backward square runs to his right and dives forward and gets a palm to it as he sticks the right hand out. While the catch may not have been taken, he's saved four, Kyle Jarvis!",2nd innings,Evin Lewis,431901,Kyle Jarvis,332996,7.2,run,45,1,45/1,"Muzarabani to Hope, 1 run",,"<b>oh, missed chance, but what an effort!</b> Would have been one of the finest ever if he'd pulled it off. Top-edge on the pull and the fielder at deep backward square runs to his right and dives forward and gets a palm to it as he sticks the right hand out. While the catch may not have been taken, he's saved four, Kyle Jarvis!",1
352,45,Evin Lewis,431901,Blessing Muzarabani,827051,"Muzarabani to Lewis, no run ",2nd innings,Shai Hope,581379,Kyle Jarvis,332996,7.3,no run,45,0,45/1,"Muzarabani to Lewis, no run",,,1
353,46,Evin Lewis,431901,Blessing Muzarabani,827051,"Muzarabani to Lewis, 1 run flicked off the pads behind square",2nd innings,Shai Hope,581379,Kyle Jarvis,332996,7.4,run,46,1,46/1,"Muzarabani to Lewis, 1 run",,flicked off the pads behind square,1
354,47,Shai Hope,581379,Blessing Muzarabani,827051,"Muzarabani to Hope, no run short of a length on the stumps, blocked to point",2nd innings,Evin Lewis,431901,Kyle Jarvis,332996,7.5,no run,46,0,46/1,"Muzarabani to Hope, no run",,"short of a length on the stumps, blocked to point",1
355,48,Shai Hope,581379,Blessing Muzarabani,827051,"Muzarabani to Hope, no run nudged away into the on side",2nd innings,Evin Lewis,431901,Kyle Jarvis,332996,7.6,no run,46,0,46/1,"Muzarabani to Hope, no run",,nudged away into the on side,1
356,49,Evin Lewis,431901,Kyle Jarvis,332996,"Jarvis to Lewis, no run short of a length, angled across, left alone",2nd innings,Shai Hope,581379,Blessing Muzarabani,827051,8.1,no run,46,0,46/1,"Jarvis to Lewis, no run",,"short of a length, angled across, left alone",1
357,50,Evin Lewis,431901,Kyle Jarvis,332996,"Jarvis to Lewis, no run back of a length, angled across, left alone",2nd innings,Shai Hope,581379,Blessing Muzarabani,827051,8.2,no run,46,0,46/1,"Jarvis to Lewis, no run",,"back of a length, angled across, left alone",1
358,51,Evin Lewis,431901,Kyle Jarvis,332996,"Jarvis to Lewis, no run full on leg, pushed back",2nd innings,Shai Hope,581379,Blessing Muzarabani,827051,8.3,no run,46,0,46/1,"Jarvis to Lewis, no run",,"full on leg, pushed back",1
359,52,Evin Lewis,431901,Kyle Jarvis,332996,"Jarvis to Lewis, 1 run back of a length, shuffles and drops in front of mid-on for a quick one",2nd innings,Shai Hope,581379,Blessing Muzarabani,827051,8.4,run,47,1,47/1,"Jarvis to Lewis, 1 run",,"back of a length, shuffles and drops in front of mid-on for a quick one",1
360,53,Shai Hope,581379,Kyle Jarvis,332996,"Jarvis to Hope, no run short of a length, holding its line, left alone outside off",2nd innings,Evin Lewis,431901,Blessing Muzarabani,827051,8.5,no run,47,0,47/1,"Jarvis to Hope, no run",,"short of a length, holding its line, left alone outside off",1
361,54,Shai Hope,581379,Kyle Jarvis,332996,"Jarvis to Hope, no run short of a length outside off, punched to point",2nd innings,Evin Lewis,431901,Blessing Muzarabani,827051,8.6,no run,47,0,47/1,"Jarvis to Hope, no run",,"short of a length outside off, punched to point",1
362,55,Evin Lewis,431901,Blessing Muzarabani,827051,"Muzarabani to Lewis, no run angled across outside off, left alone",2nd innings,Shai Hope,581379,Kyle Jarvis,332996,9.1,no run,47,0,47/1,"Muzarabani to Lewis, no run",,"angled across outside off, left alone",1
363,56,Evin Lewis,431901,Blessing Muzarabani,827051,"Muzarabani to Lewis, 1 run back of a length, flicked to short fine off the pads",2nd innings,Shai Hope,581379,Kyle Jarvis,332996,9.2,run,48,1,48/1,"Muzarabani to Lewis, 1 run",,"back of a length, flicked to short fine off the pads",1
364,57,Shai Hope,581379,Blessing Muzarabani,827051,"Muzarabani to Hope, no run cuts in off the seam to find the inside edge as he defends, and goes into the leg side",2nd innings,Evin Lewis,431901,Kyle Jarvis,332996,9.3,no run,48,0,48/1,"Muzarabani to Hope, no run",,"cuts in off the seam to find the inside edge as he defends, and goes into the leg side",1
365,58,Shai Hope,581379,Blessing Muzarabani,827051,"Muzarabani to Hope, no run short outside off, fails to get entirely on top of it and miscues his slash off the inside of the bat",2nd innings,Evin Lewis,431901,Kyle Jarvis,332996,9.4,no run,48,0,48/1,"Muzarabani to Hope, no run",,"short outside off, fails to get entirely on top of it and miscues his slash off the inside of the bat",1
366,59,Shai Hope,581379,Blessing Muzarabani,827051,"Muzarabani to Hope, no run back of a length, blocked off the backfoot",2nd innings,Evin Lewis,431901,Kyle Jarvis,332996,9.5,no run,48,0,48/1,"Muzarabani to Hope, no run",,"back of a length, blocked off the backfoot",1
367,60,Shai Hope,581379,Blessing Muzarabani,827051,"Muzarabani to Hope, SIX runs short again and he gets hold of this one alright, smashes a pull over deep midwicket",2nd innings,Evin Lewis,431901,Kyle Jarvis,332996,9.6,six,54,6,54/1,"Muzarabani to Hope, SIX runs",,"short again and he gets hold of this one alright, smashes a pull over deep midwicket",1
368,61,Evin Lewis,431901,Kyle Jarvis,332996,"Jarvis to Lewis, 1 run covers the line and punches away to sweeper cover",2nd innings,Shai Hope,581379,Blessing Muzarabani,827051,10.1,run,55,1,55/1,"Jarvis to Lewis, 1 run",,covers the line and punches away to sweeper cover,1
369,62,Shai Hope,581379,Kyle Jarvis,332996,"Jarvis to Hope, no run short of a length, nips in and gets past the inside edge as he punches",2nd innings,Evin Lewis,431901,Blessing Muzarabani,827051,10.2,no run,55,0,55/1,"Jarvis to Hope, no run",,"short of a length, nips in and gets past the inside edge as he punches",1
370,63,Shai Hope,581379,Kyle Jarvis,332996,"Jarvis to Hope, no run good length outside off, blocked",2nd innings,Evin Lewis,431901,Blessing Muzarabani,827051,10.3,no run,55,0,55/1,"Jarvis to Hope, no run",,"good length outside off, blocked",1
371,64,Shai Hope,581379,Kyle Jarvis,332996,"Jarvis to Hope, 1 run full outside off, pushed to mid-off",2nd innings,Evin Lewis,431901,Blessing Muzarabani,827051,10.4,run,56,1,56/1,"Jarvis to Hope, 1 run",,"full outside off, pushed to mid-off",1
