,ball,batsman,batsman_id,bowler,bowler_id,commentary,innings,overs,playType,runs,runs_scored,score,shortText,speed,text,wickets
395,146,Dipendra Singh Airee,794707,Pieter Seelaar,208657,"Seelaar to Airee, no run tries to hit this to mid on,gets bottom and goes to bowler",2nd innings,24.2,no run,95,0,95/5,"Seelaar to Airee, no run",,"tries to hit this to mid on,gets bottom and goes to bowler",5
396,147,Dipendra Singh Airee,794707,Pieter Seelaar,208657,"Seelaar to Airee, no run defended this flighted delivery on front foot",2nd innings,24.3,no run,95,0,95/5,"Seelaar to Airee, no run",,defended this flighted delivery on front foot,5
397,148,Dipendra Singh Airee,794707,Pieter Seelaar,208657,"Seelaar to Airee, no run bounce and turn,tries to cut and is beaten",2nd innings,24.4,no run,95,0,95/5,"Seelaar to Airee, no run",,"bounce and turn,tries to cut and is beaten",5
398,149,Dipendra Singh Airee,794707,Pieter Seelaar,208657,"Seelaar to Airee, no run full on to him,he defends on front foot",2nd innings,24.5,no run,95,0,95/5,"Seelaar to Airee, no run",,"full on to him,he defends on front foot",5
399,150,Dipendra Singh Airee,794707,Pieter Seelaar,208657,"Seelaar to Airee, 1 run single from mid on ",2nd innings,25.0,run,96,1,96/5,"Seelaar to Airee, 1 run",,single from mid on ,5
400,151,Dipendra Singh Airee,794707,Michael Rippon,380956,"Rippon to Airee, no run full delivery,he plays it back to bowler",2nd innings,25.1,no run,96,0,96/5,"Rippon to Airee, no run",,"full delivery,he plays it back to bowler",5
401,152,Dipendra Singh Airee,794707,Michael Rippon,380956,"Rippon to Airee, no run flighted delivery,coming in to him,he plays back to bowler",2nd innings,25.2,no run,96,0,96/5,"Rippon to Airee, no run",,"flighted delivery,coming in to him,he plays back to bowler",5
402,153,Dipendra Singh Airee,794707,Michael Rippon,380956,"Rippon to Airee, SIX runs he comes down the ground,hits this straight over the side screen for a welcome SIX",2nd innings,25.3,six,102,6,102/5,"Rippon to Airee, SIX runs",,"he comes down the ground,hits this straight over the side screen for a welcome SIX",5
403,154,Dipendra Singh Airee,794707,Michael Rippon,380956,"Rippon to Airee, 2 runs on backfoot and guides this towards third man area for a double",2nd innings,25.4,run,104,2,104/5,"Rippon to Airee, 2 runs",,on backfoot and guides this towards third man area for a double,5
404,155,Dipendra Singh Airee,794707,Michael Rippon,380956,"Rippon to Airee, no run full and turn,he was on backfoot and is beaten,so very very close to the edge",2nd innings,25.5,no run,104,0,104/5,"Rippon to Airee, no run",,"full and turn,he was on backfoot and is beaten,so very very close to the edge",5
405,156,Dipendra Singh Airee,794707,Michael Rippon,380956,"Rippon to Airee, no run fullish and he plays it back to bowler,good over that for Nepal",2nd innings,26.0,no run,104,0,104/5,"Rippon to Airee, no run",,"fullish and he plays it back to bowler,good over that for Nepal",5
406,157,Basant Regmi,25955,Pieter Seelaar,208657,"Seelaar to Regmi, OUT full delivery,he tries to go big,finds a fielder at long on boundary",2nd innings,26.1,out,104,0,104/6,"Seelaar to Regmi, OUT",,"full delivery,he tries to go big,finds a fielder at long on boundary",6
407,158,Shakti Gauchan,25964,Pieter Seelaar,208657,"Seelaar to Gauchan, no run full delivery and he defends this on front foot",2nd innings,26.2,no run,104,0,104/6,"Seelaar to Gauchan, no run",,full delivery and he defends this on front foot,6
408,159,Shakti Gauchan,25964,Pieter Seelaar,208657,"Seelaar to Gauchan, no run full delivery coming in to him,he defends on front foot",2nd innings,26.3,no run,104,0,104/6,"Seelaar to Gauchan, no run",,"full delivery coming in to him,he defends on front foot",6
409,160,Shakti Gauchan,25964,Pieter Seelaar,208657,"Seelaar to Gauchan, no run full again and defended carefully",2nd innings,26.4,no run,104,0,104/6,"Seelaar to Gauchan, no run",,full again and defended carefully,6
410,161,Shakti Gauchan,25964,Pieter Seelaar,208657,"Seelaar to Gauchan, no run full delivery,he defends this one too",2nd innings,26.5,no run,104,0,104/6,"Seelaar to Gauchan, no run",,"full delivery,he defends this one too",6
411,162,Shakti Gauchan,25964,Pieter Seelaar,208657,"Seelaar to Gauchan, no run blocks this on front foot",2nd innings,27.0,no run,104,0,104/6,"Seelaar to Gauchan, no run",,blocks this on front foot,6
412,163,Dipendra Singh Airee,794707,Paul van Meekeren,348109,"van Meekeren to Airee, no run goes short straigt away,and Airee ducks under this one",2nd innings,27.1,no run,104,0,104/6,"van Meekeren to Airee, no run",,"goes short straigt away,and Airee ducks under this one",6
413,164,Dipendra Singh Airee,794707,Paul van Meekeren,348109,"van Meekeren to Airee, no run short outside off and lets that go",2nd innings,27.2,no run,104,0,104/6,"van Meekeren to Airee, no run",,short outside off and lets that go,6
414,165,Dipendra Singh Airee,794707,Paul van Meekeren,348109,"van Meekeren to Airee, no run short delivery directed to him,he slams that on the ground,more like a tennis shot...to mid wicket",2nd innings,27.3,no run,104,0,104/6,"van Meekeren to Airee, no run",,"short delivery directed to him,he slams that on the ground,more like a tennis shot...to mid wicket",6
415,166,Dipendra Singh Airee,794707,Paul van Meekeren,348109,"van Meekeren to Airee, 1 run short in to him again,he taps in front and ran",2nd innings,27.4,run,105,1,105/6,"van Meekeren to Airee, 1 run",,"short in to him again,he taps in front and ran",6
416,167,Shakti Gauchan,25964,Paul van Meekeren,348109,"van Meekeren to Gauchan, no run short delivery,he dint looked comfortable there,gets edge and lucky landed safely",2nd innings,27.5,no run,105,0,105/6,"van Meekeren to Gauchan, no run",,"short delivery,he dint looked comfortable there,gets edge and lucky landed safely",6
417,168,Shakti Gauchan,25964,Paul van Meekeren,348109,"van Meekeren to Gauchan, no run full on off,play and a miss",2nd innings,28.0,no run,105,0,105/6,"van Meekeren to Gauchan, no run",,"full on off,play and a miss",6
418,169,Dipendra Singh Airee,794707,Pieter Seelaar,208657,"Seelaar to Airee, no run comes down the ground,hits that along the ground pass the bowler and decided not to run after coming almost half way",2nd innings,28.1,no run,105,0,105/6,"Seelaar to Airee, no run",,"comes down the ground,hits that along the ground pass the bowler and decided not to run after coming almost half way",6
419,170,Dipendra Singh Airee,794707,Pieter Seelaar,208657,"Seelaar to Airee, no run played back to bowler",2nd innings,28.2,no run,105,0,105/6,"Seelaar to Airee, no run",,played back to bowler,6
420,171,Dipendra Singh Airee,794707,Pieter Seelaar,208657,"Seelaar to Airee, no run comes down and defends this ",2nd innings,28.3,no run,105,0,105/6,"Seelaar to Airee, no run",,comes down and defends this ,6
421,172,Dipendra Singh Airee,794707,Pieter Seelaar,208657,"Seelaar to Airee, no run quicker one from Seelaar,came in to him and he stops on leg",2nd innings,28.4,no run,105,0,105/6,"Seelaar to Airee, no run",,"quicker one from Seelaar,came in to him and he stops on leg",6
422,173,Dipendra Singh Airee,794707,Pieter Seelaar,208657,"Seelaar to Airee, 1 run taps this to point region from off stump",2nd innings,28.5,run,106,1,106/6,"Seelaar to Airee, 1 run",,taps this to point region from off stump,6
423,174,Shakti Gauchan,25964,Pieter Seelaar,208657,"Seelaar to Gauchan, no run blocks this on backfoot",2nd innings,29.0,no run,106,0,106/6,"Seelaar to Gauchan, no run",,blocks this on backfoot,6
424,175,Dipendra Singh Airee,794707,Paul van Meekeren,348109,"van Meekeren to Airee, 2 runs outside off short delivery and he cuts this just square of third man",2nd innings,29.1,run,108,2,108/6,"van Meekeren to Airee, 2 runs",,outside off short delivery and he cuts this just square of third man,6
425,176,Dipendra Singh Airee,794707,Paul van Meekeren,348109,"van Meekeren to Airee, FOUR runs short delivery,he looks to pull,top edge over keeper's head for a boundary",2nd innings,29.2,four,112,4,112/6,"van Meekeren to Airee, FOUR runs",,"short delivery,he looks to pull,top edge over keeper's head for a boundary",6
426,177,Dipendra Singh Airee,794707,Paul van Meekeren,348109,"van Meekeren to Airee, no run full in to the block hole,and he gets his bat down just in time",2nd innings,29.3,no run,112,0,112/6,"van Meekeren to Airee, no run",,"full in to the block hole,and he gets his bat down just in time",6
427,178,Dipendra Singh Airee,794707,Paul van Meekeren,348109,"van Meekeren to Airee, no run short outside off,he wanted to cut but lets that go",2nd innings,29.4,no run,112,0,112/6,"van Meekeren to Airee, no run",,"short outside off,he wanted to cut but lets that go",6
428,179,Dipendra Singh Airee,794707,Paul van Meekeren,348109,"van Meekeren to Airee, 1 run short in to his body,he pushes that towards deep square leg",2nd innings,29.5,run,113,1,113/6,"van Meekeren to Airee, 1 run",,"short in to his body,he pushes that towards deep square leg",6
429,180,Shakti Gauchan,25964,Paul van Meekeren,348109,"van Meekeren to Gauchan, no run outside off and left alone",2nd innings,30.0,no run,113,0,113/6,"van Meekeren to Gauchan, no run",,outside off and left alone,6
430,181,Dipendra Singh Airee,794707,Pieter Seelaar,208657,"Seelaar to Airee, no run full in to him and blocked",2nd innings,30.1,no run,113,0,113/6,"Seelaar to Airee, no run",,full in to him and blocked,6
431,182,Dipendra Singh Airee,794707,Pieter Seelaar,208657,"Seelaar to Airee, 1 run came down the track,gets bottom of the bat towards mid wicket,fielder does really well to stop that",2nd innings,30.2,run,114,1,114/6,"Seelaar to Airee, 1 run",,"came down the track,gets bottom of the bat towards mid wicket,fielder does really well to stop that",6
432,183,Shakti Gauchan,25964,Pieter Seelaar,208657,"Seelaar to Gauchan, no run full in to him,may be some bat on it...we dont know but it went towards gully",2nd innings,30.3,no run,114,0,114/6,"Seelaar to Gauchan, no run",,"full in to him,may be some bat on it...we dont know but it went towards gully",6
433,184,Shakti Gauchan,25964,Pieter Seelaar,208657,"Seelaar to Gauchan, no run plays this to point",2nd innings,30.4,no run,114,0,114/6,"Seelaar to Gauchan, no run",,plays this to point,6
434,185,Shakti Gauchan,25964,Pieter Seelaar,208657,"Seelaar to Gauchan, no run full in to him,he dead blocks it",2nd innings,30.5,no run,114,0,114/6,"Seelaar to Gauchan, no run",,"full in to him,he dead blocks it",6
435,186,Shakti Gauchan,25964,Pieter Seelaar,208657,"Seelaar to Gauchan, no run in to his pads,he guides to short fine leg,fielder stops no run",2nd innings,31.0,no run,114,0,114/6,"Seelaar to Gauchan, no run",,"in to his pads,he guides to short fine leg,fielder stops no run",6
436,187,Dipendra Singh Airee,794707,Paul van Meekeren,348109,"van Meekeren to Airee, no run outside off,short delivery,play and a miss",2nd innings,31.1,no run,114,0,114/6,"van Meekeren to Airee, no run",,"outside off,short delivery,play and a miss",6
437,188,Dipendra Singh Airee,794707,Paul van Meekeren,348109,"van Meekeren to Airee, no run outside off and short again,maybe a yorker coming ?",2nd innings,31.2,no run,114,0,114/6,"van Meekeren to Airee, no run",,"outside off and short again,maybe a yorker coming ?",6
438,189,Dipendra Singh Airee,794707,Paul van Meekeren,348109,"van Meekeren to Airee, no run third in a row,short and quick,batsmen trying to pull is beaten",2nd innings,31.3,no run,114,0,114/6,"van Meekeren to Airee, no run",,"third in a row,short and quick,batsmen trying to pull is beaten",6
439,190,Dipendra Singh Airee,794707,Paul van Meekeren,348109,"van Meekeren to Airee, 2 runs short in to his ribs,he plays this to fine leg,got his edge couple of bouncess before fileder slides to save this",2nd innings,31.4,run,116,2,116/6,"van Meekeren to Airee, 2 runs",,"short in to his ribs,he plays this to fine leg,got his edge couple of bouncess before fileder slides to save this",6
440,191,Dipendra Singh Airee,794707,Paul van Meekeren,348109,"van Meekeren to Airee, 1 run good length,outside off and he pushes this to deep point cover",2nd innings,31.5,run,117,1,117/6,"van Meekeren to Airee, 1 run",,"good length,outside off and he pushes this to deep point cover",6
441,192,Shakti Gauchan,25964,Paul van Meekeren,348109,"van Meekeren to Gauchan, no run short outside off and Gauchan successfully sees that off",2nd innings,32.0,no run,117,0,117/6,"van Meekeren to Gauchan, no run",,short outside off and Gauchan successfully sees that off,6
442,193,Dipendra Singh Airee,794707,Wesley Barresi,44407,"Barresi to Airee, 1 run full delivery,he comes down and plays along the ground to long on",2nd innings,32.1,run,118,1,118/6,"Barresi to Airee, 1 run",,"full delivery,he comes down and plays along the ground to long on",6
443,194,Shakti Gauchan,25964,Wesley Barresi,44407,"Barresi to Gauchan, no run full in to him,and he plays this back to bowler",2nd innings,32.2,no run,118,0,118/6,"Barresi to Gauchan, no run",,"full in to him,and he plays this back to bowler",6
444,195,Shakti Gauchan,25964,Wesley Barresi,44407,"Barresi to Gauchan, 1 run low full toss,he plays this to long on and finally gets off the mark",2nd innings,32.3,run,119,1,119/6,"Barresi to Gauchan, 1 run",,"low full toss,he plays this to long on and finally gets off the mark",6
445,196,Dipendra Singh Airee,794707,Wesley Barresi,44407,"Barresi to Airee, 1 run full again and driven to long off",2nd innings,32.4,run,120,1,120/6,"Barresi to Airee, 1 run",,full again and driven to long off,6
446,197,Shakti Gauchan,25964,Wesley Barresi,44407,"Barresi to Gauchan, no run defended on front foot",2nd innings,32.5,no run,120,0,120/6,"Barresi to Gauchan, no run",,defended on front foot,6
447,198,Shakti Gauchan,25964,Wesley Barresi,44407,"Barresi to Gauchan, 1 run comes down the track and plays this to long on",2nd innings,33.0,run,121,1,121/6,"Barresi to Gauchan, 1 run",,comes down the track and plays this to long on,6
448,199,Shakti Gauchan,25964,Fred Klaassen,1104703,"Klaassen to Gauchan, no run full coming in to him,he stops it right in front of him",2nd innings,33.1,no run,121,0,121/6,"Klaassen to Gauchan, no run",,"full coming in to him,he stops it right in front of him",6
449,200,Shakti Gauchan,25964,Fred Klaassen,1104703,"Klaassen to Gauchan, no run full on off and defended towards covers",2nd innings,33.2,no run,121,0,121/6,"Klaassen to Gauchan, no run",,full on off and defended towards covers,6
450,201,Shakti Gauchan,25964,Fred Klaassen,1104703,"Klaassen to Gauchan, 1 leg bye on to his pads,runs to fine leg",2nd innings,33.3,leg bye,122,1,122/6,"Klaassen to Gauchan, 1 leg bye",,"on to his pads,runs to fine leg",6
451,202,Dipendra Singh Airee,794707,Fred Klaassen,1104703,"Klaassen to Airee, no run outside off,he was trying to play away from his body and is beaten",2nd innings,33.4,no run,122,0,122/6,"Klaassen to Airee, no run",,"outside off,he was trying to play away from his body and is beaten",6
452,203,Dipendra Singh Airee,794707,Fred Klaassen,1104703,"Klaassen to Airee, no run full delivery on stumps,he plays that to covers",2nd innings,33.5,no run,122,0,122/6,"Klaassen to Airee, no run",,"full delivery on stumps,he plays that to covers",6
453,204,Dipendra Singh Airee,794707,Fred Klaassen,1104703,"Klaassen to Airee, OUT outside off,again away from his body,he gets outside edge this time,regulation catch for keeper",2nd innings,34.0,out,122,0,122/7,"Klaassen to Airee, OUT",,"outside off,again away from his body,he gets outside edge this time,regulation catch for keeper",7
454,205,Shakti Gauchan,25964,Michael Rippon,380956,"Rippon to Gauchan, no run full on off,and defended on backfoot",2nd innings,34.1,no run,122,0,122/7,"Rippon to Gauchan, no run",,"full on off,and defended on backfoot",7
455,206,Shakti Gauchan,25964,Michael Rippon,380956,"Rippon to Gauchan, no run full,he comes on front foot and is beaten by turn",2nd innings,34.2,no run,122,0,122/7,"Rippon to Gauchan, no run",,"full,he comes on front foot and is beaten by turn",7
456,207,Shakti Gauchan,25964,Michael Rippon,380956,"Rippon to Gauchan, no run outside off and he defends that towards offside",2nd innings,34.3,no run,122,0,122/7,"Rippon to Gauchan, no run",,outside off and he defends that towards offside,7
457,208,Shakti Gauchan,25964,Michael Rippon,380956,"Rippon to Gauchan, no run outside off,bit of spin and bounce,beaten",2nd innings,34.4,no run,122,0,122/7,"Rippon to Gauchan, no run",,"outside off,bit of spin and bounce,beaten",7
458,209,Shakti Gauchan,25964,Michael Rippon,380956,"Rippon to Gauchan, no run coming in to him,full delivery and he taps this to leg",2nd innings,34.5,no run,122,0,122/7,"Rippon to Gauchan, no run",,"coming in to him,full delivery and he taps this to leg",7
459,210,Shakti Gauchan,25964,Michael Rippon,380956,"Rippon to Gauchan, no run full delivery and blocked on front foot",2nd innings,35.0,no run,122,0,122/7,"Rippon to Gauchan, no run",,full delivery and blocked on front foot,7
460,211,Karan KC,800675,Fred Klaassen,1104703,"Klaassen to Karan KC, no run outside off on good length,he defends on backfoot",2nd innings,35.1,no run,122,0,122/7,"Klaassen to Karan KC, no run",,"outside off on good length,he defends on backfoot",7
461,212,Karan KC,800675,Fred Klaassen,1104703,"Klaassen to Karan KC, no run short of good length,he blocks",2nd innings,35.2,no run,122,0,122/7,"Klaassen to Karan KC, no run",,"short of good length,he blocks",7
462,213,Karan KC,800675,Fred Klaassen,1104703,"Klaassen to Karan KC, OUT outside off,outside edge and is taken by the keeper",2nd innings,35.3,out,122,0,122/8,"Klaassen to Karan KC, OUT",,"outside off,outside edge and is taken by the keeper",8
463,214,Sandeep Lamichhane,960361,Fred Klaassen,1104703,"Klaassen to Lamichhane, no run outside off and that kept low,batsmen has no idea what was happening there",2nd innings,35.4,no run,122,0,122/8,"Klaassen to Lamichhane, no run",,"outside off and that kept low,batsmen has no idea what was happening there",8
464,215,Sandeep Lamichhane,960361,Fred Klaassen,1104703,"Klaassen to Lamichhane, no run short delivery,outside off,he looks to cut or tap and is beaten",2nd innings,35.5,no run,122,0,122/8,"Klaassen to Lamichhane, no run",,"short delivery,outside off,he looks to cut or tap and is beaten",8
465,216,Sandeep Lamichhane,960361,Fred Klaassen,1104703,"Klaassen to Lamichhane, 1 run outsie off,he pushes this to third man area",2nd innings,36.0,run,123,1,123/8,"Klaassen to Lamichhane, 1 run",,"outsie off,he pushes this to third man area",8
466,217,Sandeep Lamichhane,960361,Michael Rippon,380956,"Rippon to Lamichhane, no run on off,he defends towards leg",2nd innings,36.1,no run,123,0,123/8,"Rippon to Lamichhane, no run",,"on off,he defends towards leg",8
467,218,Sandeep Lamichhane,960361,Michael Rippon,380956,"Rippon to Lamichhane, no run flighted delivery on stumps,he drive to covers",2nd innings,36.2,no run,123,0,123/8,"Rippon to Lamichhane, no run",,"flighted delivery on stumps,he drive to covers",8
468,219,Sandeep Lamichhane,960361,Michael Rippon,380956,"Rippon to Lamichhane, OUT full delivery,played it straight in the hands of covers",2nd innings,36.3,out,123,0,123/9,"Rippon to Lamichhane, OUT",,"full delivery,played it straight in the hands of covers",9
469,220,Sharad Vesawkar,25977,Michael Rippon,380956,"Rippon to Vesawkar, no run he defends this one on back foot",2nd innings,36.4,no run,123,0,123/9,"Rippon to Vesawkar, no run",,he defends this one on back foot,9
470,221,Sharad Vesawkar,25977,Michael Rippon,380956,"Rippon to Vesawkar, no run full delivery defended on front foot",2nd innings,36.5,no run,123,0,123/9,"Rippon to Vesawkar, no run",,full delivery defended on front foot,9
471,222,Sharad Vesawkar,25977,Michael Rippon,380956,"Rippon to Vesawkar, no run spun in to him,he goes on backfoot and defends",2nd innings,37.0,no run,123,0,123/9,"Rippon to Vesawkar, no run",,"spun in to him,he goes on backfoot and defends",9
472,223,Shakti Gauchan,25964,Fred Klaassen,1104703,"Klaassen to Gauchan, no run outside off,short delivery and let that go",2nd innings,37.1,no run,123,0,123/9,"Klaassen to Gauchan, no run",,"outside off,short delivery and let that go",9
473,224,Shakti Gauchan,25964,Fred Klaassen,1104703,"Klaassen to Gauchan, no run good length and came in to him,he stops it..",2nd innings,37.2,no run,123,0,123/9,"Klaassen to Gauchan, no run",,"good length and came in to him,he stops it..",9
474,225,Shakti Gauchan,25964,Fred Klaassen,1104703,"Klaassen to Gauchan, no run short delivery,he steps down and tries to hit,in the air for a while but far from mid off and bowler",2nd innings,37.3,no run,123,0,123/9,"Klaassen to Gauchan, no run",,"short delivery,he steps down and tries to hit,in the air for a while but far from mid off and bowler",9
475,226,Shakti Gauchan,25964,Fred Klaassen,1104703,"Klaassen to Gauchan, no run defends this on backfoot to covers",2nd innings,37.4,no run,123,0,123/9,"Klaassen to Gauchan, no run",,defends this on backfoot to covers,9
476,227,Shakti Gauchan,25964,Fred Klaassen,1104703,"Klaassen to Gauchan, 1 run good length,came in to him and he taps this to square leg",2nd innings,37.5,run,124,1,124/9,"Klaassen to Gauchan, 1 run",,"good length,came in to him and he taps this to square leg",9
477,228,Sharad Vesawkar,25977,Fred Klaassen,1104703,"Klaassen to Vesawkar, no run full delivery and played towards covers",2nd innings,38.0,no run,124,0,124/9,"Klaassen to Vesawkar, no run",,full delivery and played towards covers,9
478,229,Shakti Gauchan,25964,Pieter Seelaar,208657,"Seelaar to Gauchan, no run he lets that full delivery go ",2nd innings,38.1,no run,124,0,124/9,"Seelaar to Gauchan, no run",,he lets that full delivery go ,9
479,230,Shakti Gauchan,25964,Pieter Seelaar,208657,"Seelaar to Gauchan, no run reverse sweep,and dropped at point",2nd innings,38.2,no run,124,0,124/9,"Seelaar to Gauchan, no run",,"reverse sweep,and dropped at point",9
480,231,Shakti Gauchan,25964,Pieter Seelaar,208657,"Seelaar to Gauchan, 1 run drives this to long off",2nd innings,38.3,run,125,1,125/9,"Seelaar to Gauchan, 1 run",,drives this to long off,9
481,232,Sharad Vesawkar,25977,Pieter Seelaar,208657,"Seelaar to Vesawkar, 1 run on backfoot and punches this to deep point cover",2nd innings,38.4,run,126,1,126/9,"Seelaar to Vesawkar, 1 run",,on backfoot and punches this to deep point cover,9
482,233,Shakti Gauchan,25964,Pieter Seelaar,208657,"Seelaar to Gauchan, 1 run pushes from backfoot to sweeper cover",2nd innings,38.5,run,127,1,127/9,"Seelaar to Gauchan, 1 run",,pushes from backfoot to sweeper cover,9
483,234,Sharad Vesawkar,25977,Pieter Seelaar,208657,"Seelaar to Vesawkar, no run defends this towards gully",2nd innings,39.0,no run,127,0,127/9,"Seelaar to Vesawkar, no run",,defends this towards gully,9
484,235,Shakti Gauchan,25964,Bas de Leede,1036191,"de Leede to Gauchan, 1 run short of good length in to his body,he pushes to square leg for a run",2nd innings,39.1,run,128,1,128/9,"de Leede to Gauchan, 1 run",,"short of good length in to his body,he pushes to square leg for a run",9
485,236,Sharad Vesawkar,25977,Bas de Leede,1036191,"de Leede to Vesawkar, no run on off stump,defended on backfoot,wanted a run and sent back",2nd innings,39.2,no run,128,0,128/9,"de Leede to Vesawkar, no run",,"on off stump,defended on backfoot,wanted a run and sent back",9
486,237,Sharad Vesawkar,25977,Bas de Leede,1036191,"de Leede to Vesawkar, no run full outside off,swing and a miss",2nd innings,39.3,no run,128,0,128/9,"de Leede to Vesawkar, no run",,"full outside off,swing and a miss",9
487,238,Sharad Vesawkar,25977,Bas de Leede,1036191,"de Leede to Vesawkar, no run outside off,batsmen let that go",2nd innings,39.4,no run,128,0,128/9,"de Leede to Vesawkar, no run",,"outside off,batsmen let that go",9
488,239,Sharad Vesawkar,25977,Bas de Leede,1036191,"de Leede to Vesawkar, no run full on stumps,he plays towards mid on",2nd innings,39.5,no run,128,0,128/9,"de Leede to Vesawkar, no run",,"full on stumps,he plays towards mid on",9
489,240,Sharad Vesawkar,25977,Bas de Leede,1036191,"de Leede to Vesawkar, no run good length,coming in to him,he taps right in front of him",2nd innings,40.0,no run,128,0,128/9,"de Leede to Vesawkar, no run",,"good length,coming in to him,he taps right in front of him",9
490,241,Shakti Gauchan,25964,Pieter Seelaar,208657,"Seelaar to Gauchan, 1 run goes on backfoot and hits that to long on",2nd innings,40.1,run,129,1,129/9,"Seelaar to Gauchan, 1 run",,goes on backfoot and hits that to long on,9
491,242,Sharad Vesawkar,25977,Pieter Seelaar,208657,"Seelaar to Vesawkar, 1 run sweeps this towards fine leg,backward square leg cuts ",2nd innings,40.2,run,130,1,130/9,"Seelaar to Vesawkar, 1 run",,"sweeps this towards fine leg,backward square leg cuts ",9
492,243,Shakti Gauchan,25964,Pieter Seelaar,208657,"Seelaar to Gauchan, no run defended on front foot",2nd innings,40.3,no run,130,0,130/9,"Seelaar to Gauchan, no run",,defended on front foot,9
493,244,Shakti Gauchan,25964,Pieter Seelaar,208657,"Seelaar to Gauchan, 1 run sweeps this to square leg",2nd innings,40.4,run,131,1,131/9,"Seelaar to Gauchan, 1 run",,sweeps this to square leg,9
494,245,Sharad Vesawkar,25977,Pieter Seelaar,208657,"Seelaar to Vesawkar, 1 run on backfoot and cuts to backward point for a run",2nd innings,40.5,run,132,1,132/9,"Seelaar to Vesawkar, 1 run",,on backfoot and cuts to backward point for a run,9
495,246,Shakti Gauchan,25964,Pieter Seelaar,208657,"Seelaar to Gauchan, no run full delivery,reverse sweep,straight to fielder at point",2nd innings,41.0,no run,132,0,132/9,"Seelaar to Gauchan, no run",,"full delivery,reverse sweep,straight to fielder at point",9
496,247,Sharad Vesawkar,25977,Bas de Leede,1036191,"de Leede to Vesawkar, 1 run full delivery on stumps,driven towards point area",2nd innings,41.1,run,133,1,133/9,"de Leede to Vesawkar, 1 run",,"full delivery on stumps,driven towards point area",9
