,ball,batsman,batsman_id,bowler,bowler_id,commentary,innings,overs,playType,runs,runs_scored,score,shortText,speed,text,wickets
197,236,Michael Rippon,380956,Paras Khadka,25967,"Khadka to Rippon, OUT slow delivery full,Rippon bit early in to the shot could not control and a very good catch at mid on.",1st innings,39.2,out,159,0,159/7,"Khadka to Rippon, OUT",,"slow delivery full,Rippon bit early in to the shot could not control and a very good catch at mid on.",7
198,237,Shane Snater,696143,Paras Khadka,25967,"Khadka to Snater, no run good length on off stump,he taps that on offside",1st innings,39.3,no run,159,0,159/7,"Khadka to Snater, no run",,"good length on off stump,he taps that on offside",7
199,238,Shane Snater,696143,Paras Khadka,25967,"Khadka to Snater, OUT Khadka you beauty,pitched off and came in sharply,knocking the top of his stumps ! two wickets in three deliveries",1st innings,39.4,out,159,0,159/8,"Khadka to Snater, OUT",,"Khadka you beauty,pitched off and came in sharply,knocking the top of his stumps ! two wickets in three deliveries",8
200,239,Fred Klaassen,1104703,Paras Khadka,25967,"Khadka to Klaassen, no run defended this good length delivery on backfoot",1st innings,39.5,no run,159,0,159/8,"Khadka to Klaassen, no run",,defended this good length delivery on backfoot,8
201,240,Fred Klaassen,1104703,Paras Khadka,25967,"Khadka to Klaassen, no run angeled in to him and he pushes this to mid wicket",1st innings,40.0,no run,159,0,159/8,"Khadka to Klaassen, no run",,angeled in to him and he pushes this to mid wicket,8
202,241,Scott Edwards,1127317,Basant Regmi,25955,"Regmi to Edwards, 1 run full delivery and he drives this fron front towards long off",1st innings,40.1,run,160,1,160/8,"Regmi to Edwards, 1 run",,full delivery and he drives this fron front towards long off,8
203,242,Fred Klaassen,1104703,Basant Regmi,25955,"Regmi to Klaassen, no run fullish delivery again and defends on front foot",1st innings,40.2,no run,160,0,160/8,"Regmi to Klaassen, no run",,fullish delivery again and defends on front foot,8
204,243,Fred Klaassen,1104703,Basant Regmi,25955,"Regmi to Klaassen, no run angled in to him,he taps to mid wicket",1st innings,40.3,no run,160,0,160/8,"Regmi to Klaassen, no run",,"angled in to him,he taps to mid wicket",8
205,244,Fred Klaassen,1104703,Basant Regmi,25955,"Regmi to Klaassen, no run fullish delivery driven to covers fielder",1st innings,40.4,no run,160,0,160/8,"Regmi to Klaassen, no run",,fullish delivery driven to covers fielder,8
206,245,Fred Klaassen,1104703,Basant Regmi,25955,"Regmi to Klaassen, 1 run pushed this fullish deliery to square leg",1st innings,40.5,run,161,1,161/8,"Regmi to Klaassen, 1 run",,pushed this fullish deliery to square leg,8
207,246,Scott Edwards,1127317,Basant Regmi,25955,"Regmi to Edwards, 1 run swept this to backward square leg for a run",1st innings,41.0,run,162,1,162/8,"Regmi to Edwards, 1 run",,swept this to backward square leg for a run,8
208,247,Scott Edwards,1127317,Paras Khadka,25967,"Khadka to Edwards, no run outside off on good length,and defneds it to offside",1st innings,41.1,no run,162,0,162/8,"Khadka to Edwards, no run",,"outside off on good length,and defneds it to offside",8
209,248,Scott Edwards,1127317,Paras Khadka,25967,"Khadka to Edwards, no run that angled in to him,he was trying to guide it on leg,to edge just short of keeper",1st innings,41.2,no run,162,0,162/8,"Khadka to Edwards, no run",,"that angled in to him,he was trying to guide it on leg,to edge just short of keeper",8
210,249,Scott Edwards,1127317,Paras Khadka,25967,"Khadka to Edwards, no run he wanted to defend it on front foot,bounced sharply and got hit on gloves",1st innings,41.3,no run,162,0,162/8,"Khadka to Edwards, no run",,"he wanted to defend it on front foot,bounced sharply and got hit on gloves",8
211,250,Scott Edwards,1127317,Paras Khadka,25967,"Khadka to Edwards, 1 run taps to point and sprints in ",1st innings,41.4,run,163,1,163/8,"Khadka to Edwards, 1 run",,taps to point and sprints in ,8
212,251,Fred Klaassen,1104703,Paras Khadka,25967,"Khadka to Klaassen, no run full on off and played to mid off",1st innings,41.5,no run,163,0,163/8,"Khadka to Klaassen, no run",,full on off and played to mid off,8
213,252,Fred Klaassen,1104703,Paras Khadka,25967,"Khadka to Klaassen, no run goog length delivery on off,and he defends",1st innings,42.0,no run,163,0,163/8,"Khadka to Klaassen, no run",,"goog length delivery on off,and he defends",8
214,253,Scott Edwards,1127317,Sandeep Lamichhane,960361,"Lamichhane to Edwards, 1 run sweeps this googly to fine leg",1st innings,42.1,run,164,1,164/8,"Lamichhane to Edwards, 1 run",,sweeps this googly to fine leg,8
215,254,Fred Klaassen,1104703,Sandeep Lamichhane,960361,"Lamichhane to Klaassen, no run defends this full deivery ",1st innings,42.2,no run,164,0,164/8,"Lamichhane to Klaassen, no run",,defends this full deivery ,8
216,255,Fred Klaassen,1104703,Sandeep Lamichhane,960361,"Lamichhane to Klaassen, no run bit short and outside off from leggie,he plays to point from backfoot",1st innings,42.3,no run,164,0,164/8,"Lamichhane to Klaassen, no run",,"bit short and outside off from leggie,he plays to point from backfoot",8
217,256,Fred Klaassen,1104703,Sandeep Lamichhane,960361,"Lamichhane to Klaassen, no run full on off agai,he defends this time and says No for a run",1st innings,42.4,no run,164,0,164/8,"Lamichhane to Klaassen, no run",,"full on off agai,he defends this time and says No for a run",8
218,257,Fred Klaassen,1104703,Sandeep Lamichhane,960361,"Lamichhane to Klaassen, 1 run ",1st innings,42.5,run,165,1,165/8,"Lamichhane to Klaassen, 1 run",,,8
219,258,Scott Edwards,1127317,Sandeep Lamichhane,960361,"Lamichhane to Edwards, no run ",1st innings,43.0,no run,165,0,165/8,"Lamichhane to Edwards, no run",,,8
220,259,Fred Klaassen,1104703,Paras Khadka,25967,"Khadka to Klaassen, FOUR runs Shot,outside off and bit shirt,he extends his arms and cuts this between point and covers",1st innings,43.1,four,169,4,169/8,"Khadka to Klaassen, FOUR runs",,"Shot,outside off and bit shirt,he extends his arms and cuts this between point and covers",8
221,260,Fred Klaassen,1104703,Paras Khadka,25967,"Khadka to Klaassen, no run short of good length he defends this ",1st innings,43.2,no run,169,0,169/8,"Khadka to Klaassen, no run",,short of good length he defends this ,8
222,261,Fred Klaassen,1104703,Paras Khadka,25967,"Khadka to Klaassen, no run slower one,full,he plays to mid wicket",1st innings,43.3,no run,169,0,169/8,"Khadka to Klaassen, no run",,"slower one,full,he plays to mid wicket",8
223,262,Fred Klaassen,1104703,Paras Khadka,25967,"Khadka to Klaassen, no run good length,on offstump and he pushes to mid on ",1st innings,43.4,no run,169,0,169/8,"Khadka to Klaassen, no run",,"good length,on offstump and he pushes to mid on ",8
224,263,Fred Klaassen,1104703,Paras Khadka,25967,"Khadka to Klaassen, 1 run outside off,he drives that bit upish,as the ball goes between covers and point for a run",1st innings,43.5,run,170,1,170/8,"Khadka to Klaassen, 1 run",,"outside off,he drives that bit upish,as the ball goes between covers and point for a run",8
225,264,Scott Edwards,1127317,Paras Khadka,25967,"Khadka to Edwards, no run ",1st innings,44.0,no run,170,0,170/8,"Khadka to Edwards, no run",,,8
226,265,Fred Klaassen,1104703,Sandeep Lamichhane,960361,"Lamichhane to Klaassen, 1 run driven along the ground to long off",1st innings,44.1,run,171,1,171/8,"Lamichhane to Klaassen, 1 run",,driven along the ground to long off,8
227,266,Scott Edwards,1127317,Sandeep Lamichhane,960361,"Lamichhane to Edwards, FOUR runs full delivery and he sweeps this with perfect timing,races away for four at backward square leg",1st innings,44.2,four,175,4,175/8,"Lamichhane to Edwards, FOUR runs",,"full delivery and he sweeps this with perfect timing,races away for four at backward square leg",8
228,267,Scott Edwards,1127317,Sandeep Lamichhane,960361,"Lamichhane to Edwards, 3 runs scoops this one right behind the keeper for three,cheecky !",1st innings,44.3,run,178,3,178/8,"Lamichhane to Edwards, 3 runs",,"scoops this one right behind the keeper for three,cheecky !",8
229,268,Fred Klaassen,1104703,Sandeep Lamichhane,960361,"Lamichhane to Klaassen, no run came in sharply and kept low,he manages to get his bat to it",1st innings,44.4,no run,178,0,178/8,"Lamichhane to Klaassen, no run",,"came in sharply and kept low,he manages to get his bat to it",8
230,269,Fred Klaassen,1104703,Sandeep Lamichhane,960361,"Lamichhane to Klaassen, no run defends this offside ball on offside",1st innings,44.5,no run,178,0,178/8,"Lamichhane to Klaassen, no run",,defends this offside ball on offside,8
231,270,Fred Klaassen,1104703,Sandeep Lamichhane,960361,"Lamichhane to Klaassen, no run finishes the spell from Lamichhane by a tap to mid on,it was fullish on stumps",1st innings,45.0,no run,178,0,178/8,"Lamichhane to Klaassen, no run",,"finishes the spell from Lamichhane by a tap to mid on,it was fullish on stumps",8
232,271,Scott Edwards,1127317,Sompal Kami,701215,"Sompal Kami to Edwards, no run pitched on good length,angeling in,he pushes it to mid wicket",1st innings,45.1,no run,178,0,178/8,"Sompal Kami to Edwards, no run",,"pitched on good length,angeling in,he pushes it to mid wicket",8
233,272,Scott Edwards,1127317,Sompal Kami,701215,"Sompal Kami to Edwards, 1 run short of good length on off stump,he taps to point from backfoot",1st innings,45.2,run,179,1,179/8,"Sompal Kami to Edwards, 1 run",,"short of good length on off stump,he taps to point from backfoot",8
234,273,Fred Klaassen,1104703,Sompal Kami,701215,"Sompal Kami to Klaassen, 1 run full on to his pads,he plays towards mid on",1st innings,45.3,run,180,1,180/8,"Sompal Kami to Klaassen, 1 run",,"full on to his pads,he plays towards mid on",8
235,274,Scott Edwards,1127317,Sompal Kami,701215,"Sompal Kami to Edwards, no run full on off,he hits that to mid off",1st innings,45.4,no run,180,0,180/8,"Sompal Kami to Edwards, no run",,"full on off,he hits that to mid off",8
236,275,Scott Edwards,1127317,Sompal Kami,701215,"Sompal Kami to Edwards, 1 run Short delivery,late on shot,pulls this in the air and between the running fielders at square leg",1st innings,45.5,run,181,1,181/8,"Sompal Kami to Edwards, 1 run",,"Short delivery,late on shot,pulls this in the air and between the running fielders at square leg",8
237,276,Fred Klaassen,1104703,Sompal Kami,701215,"Sompal Kami to Klaassen, no run ",1st innings,46.0,no run,181,0,181/8,"Sompal Kami to Klaassen, no run",,,8
238,277,Scott Edwards,1127317,Karan KC,800675,"Karan KC to Edwards, 1 run played to square leg,in to on his pads",1st innings,46.1,run,182,1,182/8,"Karan KC to Edwards, 1 run",,"played to square leg,in to on his pads",8
239,278,Fred Klaassen,1104703,Karan KC,800675,"Karan KC to Klaassen, 1 run short of good length,outside off,takes his outside edge and runs to third man area",1st innings,46.2,run,183,1,183/8,"Karan KC to Klaassen, 1 run",,"short of good length,outside off,takes his outside edge and runs to third man area",8
240,279,Scott Edwards,1127317,Karan KC,800675,"Karan KC to Edwards, 2 runs plays this from middle stump towards mid wicket,over throw gives them one more",1st innings,46.3,run,185,2,185/8,"Karan KC to Edwards, 2 runs",,"plays this from middle stump towards mid wicket,over throw gives them one more",8
241,280,Scott Edwards,1127317,Karan KC,800675,"Karan KC to Edwards, OUT full on to his pads,loud appeal umpire says OUT !",1st innings,46.4,out,185,0,185/9,"Karan KC to Edwards, OUT",,"full on to his pads,loud appeal umpire says OUT !",9
242,281,Paul van Meekeren,348109,Karan KC,800675,"Karan KC to van Meekeren, 1 run full delivery,outside edge towards gully region ",1st innings,46.5,run,186,1,186/9,"Karan KC to van Meekeren, 1 run",,"full delivery,outside edge towards gully region ",9
243,282,Fred Klaassen,1104703,Karan KC,800675,"Karan KC to Klaassen, no run short delivery outside off,play and a miss",1st innings,47.0,no run,186,0,186/9,"Karan KC to Klaassen, no run",,"short delivery outside off,play and a miss",9
244,283,Paul van Meekeren,348109,Sompal Kami,701215,"Sompal Kami to van Meekeren, 1 run driven nicely to deep covers,it was pitched off ",1st innings,47.1,run,187,1,187/9,"Sompal Kami to van Meekeren, 1 run",,"driven nicely to deep covers,it was pitched off ",9
245,284,Fred Klaassen,1104703,Sompal Kami,701215,"Sompal Kami to Klaassen, 1 run full in to the block hole,he manages to get some bat on to it towards fineleg",1st innings,47.2,run,188,1,188/9,"Sompal Kami to Klaassen, 1 run",,"full in to the block hole,he manages to get some bat on to it towards fineleg",9
246,285,Paul van Meekeren,348109,Sompal Kami,701215,"Sompal Kami to van Meekeren, 1 run pitched off,took his outside edge runs towards third man area for a run",1st innings,47.3,run,189,1,189/9,"Sompal Kami to van Meekeren, 1 run",,"pitched off,took his outside edge runs towards third man area for a run",9
247,286,Fred Klaassen,1104703,Sompal Kami,701215,"Sompal Kami to Klaassen, OUT short delivery,tries to pull,gets top edge,keeper runs to short fine leg and takes this with a full dive,another good catch",1st innings,47.4,out,189,0,189/10,"Sompal Kami to Klaassen, OUT",,"short delivery,tries to pull,gets top edge,keeper runs to short fine leg and takes this with a full dive,another good catch",10
248,1,Gyanendra Malla,233400,Paul van Meekeren,348109,"van Meekeren to Malla, 3 runs full delivery on off to start with,he drove this one to deep covers,fielder does well to chase and keep it in",2nd innings,0.1,run,3,3,3/0,"van Meekeren to Malla, 3 runs",,"full delivery on off to start with,he drove this one to deep covers,fielder does well to chase and keep it in",0
249,2,Anil Sah,1058510,Paul van Meekeren,348109,"van Meekeren to Sah, no run good length on to his thighs and he pushes this to square leg fielder",2nd innings,0.2,no run,3,0,3/0,"van Meekeren to Sah, no run",,good length on to his thighs and he pushes this to square leg fielder,0
250,3,Anil Sah,1058510,Paul van Meekeren,348109,"van Meekeren to Sah, no run short of good length,play and a miss...good pace from Paul",2nd innings,0.3,no run,3,0,3/0,"van Meekeren to Sah, no run",,"short of good length,play and a miss...good pace from Paul",0
251,4,Anil Sah,1058510,Paul van Meekeren,348109,"van Meekeren to Sah, no run defended this good length delivery ",2nd innings,0.4,no run,3,0,3/0,"van Meekeren to Sah, no run",,defended this good length delivery ,0
252,5,Anil Sah,1058510,Paul van Meekeren,348109,"van Meekeren to Sah, 1 run on to his legs,he flicks this to fine leg and fielded ",2nd innings,0.5,run,4,1,4/0,"van Meekeren to Sah, 1 run",,"on to his legs,he flicks this to fine leg and fielded ",0
253,6,Gyanendra Malla,233400,Paul van Meekeren,348109,"van Meekeren to Malla, no run effort ball from bowler,outside off on good length and batsmen decides to let that go",2nd innings,1.0,no run,4,0,4/0,"van Meekeren to Malla, no run",,"effort ball from bowler,outside off on good length and batsmen decides to let that go",0
254,7,Anil Sah,1058510,Fred Klaassen,1104703,"Klaassen to Sah, no run pitched on good length,coming in to him,he plays back to bowler",2nd innings,1.1,no run,4,0,4/0,"Klaassen to Sah, no run",,"pitched on good length,coming in to him,he plays back to bowler",0
255,8,Anil Sah,1058510,Fred Klaassen,1104703,"Klaassen to Sah, 1 run good length on off,he taps behind gully",2nd innings,1.2,run,5,1,5/0,"Klaassen to Sah, 1 run",,"good length on off,he taps behind gully",0
256,9,Gyanendra Malla,233400,Fred Klaassen,1104703,"Klaassen to Malla, no run that came in to him sharply,on to his pads,bit high and hence half hearted dutch appeal",2nd innings,1.3,no run,5,0,5/0,"Klaassen to Malla, no run",,"that came in to him sharply,on to his pads,bit high and hence half hearted dutch appeal",0
257,10,Gyanendra Malla,233400,Fred Klaassen,1104703,"Klaassen to Malla, no run outside off looking to drive and is beaten.. play and a miss",2nd innings,1.4,no run,5,0,5/0,"Klaassen to Malla, no run",,outside off looking to drive and is beaten.. play and a miss,0
258,11,Gyanendra Malla,233400,Fred Klaassen,1104703,"Klaassen to Malla, no run ",2nd innings,1.5,no run,5,0,5/0,"Klaassen to Malla, no run",,,0
259,11,Gyanendra Malla,233400,Fred Klaassen,1104703,"Klaassen to Malla, 1 wide ",2nd innings,1.5,wide,6,1,6/0,"Klaassen to Malla, 1 wide",,,0
260,12,Gyanendra Malla,233400,Fred Klaassen,1104703,"Klaassen to Malla, 1 run ",2nd innings,2.0,run,7,1,7/0,"Klaassen to Malla, 1 run",,,0
261,13,Gyanendra Malla,233400,Paul van Meekeren,348109,"van Meekeren to Malla, no run ",2nd innings,2.1,no run,7,0,7/0,"van Meekeren to Malla, no run",,,0
262,14,Gyanendra Malla,233400,Paul van Meekeren,348109,"van Meekeren to Malla, no run ",2nd innings,2.2,no run,7,0,7/0,"van Meekeren to Malla, no run",,,0
263,15,Gyanendra Malla,233400,Paul van Meekeren,348109,"van Meekeren to Malla, 2 runs full outside off and he hits this straight past the bowler for two",2nd innings,2.3,run,9,2,9/0,"van Meekeren to Malla, 2 runs",,full outside off and he hits this straight past the bowler for two,0
264,16,Gyanendra Malla,233400,Paul van Meekeren,348109,"van Meekeren to Malla, FOUR runs full on to his pads,he guides this between mid wicket and mid on for boundary",2nd innings,2.4,four,13,4,13/0,"van Meekeren to Malla, FOUR runs",,"full on to his pads,he guides this between mid wicket and mid on for boundary",0
265,17,Gyanendra Malla,233400,Paul van Meekeren,348109,"van Meekeren to Malla, no run full delivery in to him and he defends this safely",2nd innings,2.5,no run,13,0,13/0,"van Meekeren to Malla, no run",,full delivery in to him and he defends this safely,0
266,18,Gyanendra Malla,233400,Paul van Meekeren,348109,"van Meekeren to Malla, no run short delivery outside off,and he ducks to let that go",2nd innings,3.0,no run,13,0,13/0,"van Meekeren to Malla, no run",,"short delivery outside off,and he ducks to let that go",0
267,19,Anil Sah,1058510,Fred Klaassen,1104703,"Klaassen to Sah, no run pitched on good length,off stump,play and a miss ",2nd innings,3.1,no run,13,0,13/0,"Klaassen to Sah, no run",,"pitched on good length,off stump,play and a miss ",0
268,20,Anil Sah,1058510,Fred Klaassen,1104703,"Klaassen to Sah, no run pitched on good length again,coming in to him,he defends this ",2nd innings,3.2,no run,13,0,13/0,"Klaassen to Sah, no run",,"pitched on good length again,coming in to him,he defends this ",0
269,21,Anil Sah,1058510,Fred Klaassen,1104703,"Klaassen to Sah, 2 runs low full toss,he pushes this to deep mid wicket",2nd innings,3.3,run,15,2,15/0,"Klaassen to Sah, 2 runs",,"low full toss,he pushes this to deep mid wicket",0
270,22,Anil Sah,1058510,Fred Klaassen,1104703,"Klaassen to Sah, FOUR runs good length on to his pads,he flicks this upish one bounce in to the deep square leg boundary",2nd innings,3.4,four,19,4,19/0,"Klaassen to Sah, FOUR runs",,"good length on to his pads,he flicks this upish one bounce in to the deep square leg boundary",0
271,23,Anil Sah,1058510,Fred Klaassen,1104703,"Klaassen to Sah, no run defends this from backfoot",2nd innings,3.5,no run,19,0,19/0,"Klaassen to Sah, no run",,defends this from backfoot,0
272,24,Anil Sah,1058510,Fred Klaassen,1104703,"Klaassen to Sah, no run quick,outside off,he defends on backfoot",2nd innings,4.0,no run,19,0,19/0,"Klaassen to Sah, no run",,"quick,outside off,he defends on backfoot",0
273,25,Gyanendra Malla,233400,Paul van Meekeren,348109,"van Meekeren to Malla, no run from good length,that bounced sharply surprised him and hit him on his gloves",2nd innings,4.1,no run,19,0,19/0,"van Meekeren to Malla, no run",,"from good length,that bounced sharply surprised him and hit him on his gloves",0
274,26,Gyanendra Malla,233400,Paul van Meekeren,348109,"van Meekeren to Malla, no run outside off and short delivery,batsmen let that go",2nd innings,4.2,no run,19,0,19/0,"van Meekeren to Malla, no run",,"outside off and short delivery,batsmen let that go",0
275,27,Gyanendra Malla,233400,Paul van Meekeren,348109,"van Meekeren to Malla, no run pitched on middle,good length,batsmen defends this with full bat ",2nd innings,4.3,no run,19,0,19/0,"van Meekeren to Malla, no run",,"pitched on middle,good length,batsmen defends this with full bat ",0
276,28,Gyanendra Malla,233400,Paul van Meekeren,348109,"van Meekeren to Malla, no run that surprising bounce again,he hit the deck hard there,top edge and just short of fielder at point.",2nd innings,4.4,no run,19,0,19/0,"van Meekeren to Malla, no run",,"that surprising bounce again,he hit the deck hard there,top edge and just short of fielder at point.",0
277,29,Gyanendra Malla,233400,Paul van Meekeren,348109,"van Meekeren to Malla, 2 runs full on off,and Malla drives this towards long on",2nd innings,4.5,run,21,2,21/0,"van Meekeren to Malla, 2 runs",,"full on off,and Malla drives this towards long on",0
278,30,Gyanendra Malla,233400,Paul van Meekeren,348109,"van Meekeren to Malla, no run pace,outside off and batsmen let that past to the keeper",2nd innings,5.0,no run,21,0,21/0,"van Meekeren to Malla, no run",,"pace,outside off and batsmen let that past to the keeper",0
279,31,Anil Sah,1058510,Fred Klaassen,1104703,"Klaassen to Sah, no run lovely delivery,pitched just outside off on good length,batsmen trying to drive misses..",2nd innings,5.1,no run,21,0,21/0,"Klaassen to Sah, no run",,"lovely delivery,pitched just outside off on good length,batsmen trying to drive misses..",0
280,32,Anil Sah,1058510,Fred Klaassen,1104703,"Klaassen to Sah, no run pitched on middle,good length and gets respected from the batsmen",2nd innings,5.2,no run,21,0,21/0,"Klaassen to Sah, no run",,"pitched on middle,good length and gets respected from the batsmen",0
281,33,Anil Sah,1058510,Fred Klaassen,1104703,"Klaassen to Sah, FOUR runs full on to his pads,he flicks this in the air one bounce in to the empty backward sqaure leg boundary",2nd innings,5.3,four,25,4,25/0,"Klaassen to Sah, FOUR runs",,"full on to his pads,he flicks this in the air one bounce in to the empty backward sqaure leg boundary",0
282,34,Anil Sah,1058510,Fred Klaassen,1104703,"Klaassen to Sah, 1 run on his thighs,he turns this around to square leg for a quick one",2nd innings,5.4,run,26,1,26/0,"Klaassen to Sah, 1 run",,"on his thighs,he turns this around to square leg for a quick one",0
283,35,Gyanendra Malla,233400,Fred Klaassen,1104703,"Klaassen to Malla, no run just short of good length,in to his body,he ducks and let that go",2nd innings,5.5,no run,26,0,26/0,"Klaassen to Malla, no run",,"just short of good length,in to his body,he ducks and let that go",0
284,36,Gyanendra Malla,233400,Fred Klaassen,1104703,"Klaassen to Malla, 1 run this was bit short on middle,batsmen plays this towards backward sqaure for a run",2nd innings,6.0,run,27,1,27/0,"Klaassen to Malla, 1 run",,"this was bit short on middle,batsmen plays this towards backward sqaure for a run",0
285,37,Gyanendra Malla,233400,Paul van Meekeren,348109,"van Meekeren to Malla, FOUR runs that was bowled quick on to his pads,he flicks this to sqaure leg boundary",2nd innings,6.1,four,31,4,31/0,"van Meekeren to Malla, FOUR runs",,"that was bowled quick on to his pads,he flicks this to sqaure leg boundary",0
286,38,Gyanendra Malla,233400,Paul van Meekeren,348109,"van Meekeren to Malla, no run defends this off side off stump delivery towards point",2nd innings,6.2,no run,31,0,31/0,"van Meekeren to Malla, no run",,defends this off side off stump delivery towards point,0
287,39,Gyanendra Malla,233400,Paul van Meekeren,348109,"van Meekeren to Malla, no run outside off again and he let that go",2nd innings,6.3,no run,31,0,31/0,"van Meekeren to Malla, no run",,outside off again and he let that go,0
288,40,Gyanendra Malla,233400,Paul van Meekeren,348109,"van Meekeren to Malla, no run good length delivery,angeled in to him and he defends this with authority",2nd innings,6.4,no run,31,0,31/0,"van Meekeren to Malla, no run",,"good length delivery,angeled in to him and he defends this with authority",0
289,41,Gyanendra Malla,233400,Paul van Meekeren,348109,"van Meekeren to Malla, no run short delivery and defends this from backfoot",2nd innings,6.5,no run,31,0,31/0,"van Meekeren to Malla, no run",,short delivery and defends this from backfoot,0
290,42,Gyanendra Malla,233400,Paul van Meekeren,348109,"van Meekeren to Malla, FOUR runs short delivery outside off,he goes back and punches this past the point for another boundary",2nd innings,7.0,four,35,4,35/0,"van Meekeren to Malla, FOUR runs",,"short delivery outside off,he goes back and punches this past the point for another boundary",0
291,43,Anil Sah,1058510,Shane Snater,696143,"Snater to Sah, no run good delivery to start with,coming from over the wicket,he pitches this outside off play and miss",2nd innings,7.1,no run,35,0,35/0,"Snater to Sah, no run",,"good delivery to start with,coming from over the wicket,he pitches this outside off play and miss",0
292,44,Anil Sah,1058510,Shane Snater,696143,"Snater to Sah, no run outside off and he is beaten again",2nd innings,7.2,no run,35,0,35/0,"Snater to Sah, no run",,outside off and he is beaten again,0
293,45,Anil Sah,1058510,Shane Snater,696143,"Snater to Sah, FOUR runs outside off again and this time he puches it just away from point fielder",2nd innings,7.3,four,39,4,39/0,"Snater to Sah, FOUR runs",,outside off again and this time he puches it just away from point fielder,0
294,46,Anil Sah,1058510,Shane Snater,696143,"Snater to Sah, no run hits this in the same area,point fielder does well to stop",2nd innings,7.4,no run,39,0,39/0,"Snater to Sah, no run",,"hits this in the same area,point fielder does well to stop",0
