,ball,batsman,batsman_id,bowler,bowler_id,commentary,innings,overs,playType,runs,runs_scored,score,shortText,speed,text,wickets
171,170,Sean Williams,55870,Dale Steyn,47492,"Steyn to Williams, 1 run tucks a back of a length ball off the pads to deep square leg",1st innings,28.2,run,131,1,131/4,"Steyn to Williams, 1 run",,tucks a back of a length ball off the pads to deep square leg,4
172,171,Peter Moor,333000,Dale Steyn,47492,"Steyn to Moor, 1 run length outside off, pushed through the covers",1st innings,28.3,run,132,1,132/4,"Steyn to Moor, 1 run",,"length outside off, pushed through the covers",4
173,172,Sean Williams,55870,Dale Steyn,47492,"Steyn to Williams, no run short of a length, tucked to midwicket",1st innings,28.4,no run,132,0,132/4,"Steyn to Williams, no run",,"short of a length, tucked to midwicket",4
174,173,Sean Williams,55870,Dale Steyn,47492,"Steyn to Williams, no run length on off, blocked",1st innings,28.5,no run,132,0,132/4,"Steyn to Williams, no run",,"length on off, blocked",4
175,174,Sean Williams,55870,Dale Steyn,47492,"Steyn to Williams, no run short of length, backs away and finds cover with his cut",1st innings,28.6,no run,132,0,132/4,"Steyn to Williams, no run",,"short of length, backs away and finds cover with his cut",4
176,175,Peter Moor,333000,Tabraiz Shamsi,379145,"Shamsi to Moor, no run pitched up on off, pushed back",1st innings,29.1,no run,132,0,132/4,"Shamsi to Moor, no run",,"pitched up on off, pushed back",4
177,176,Peter Moor,333000,Tabraiz Shamsi,379145,"Shamsi to Moor, no run floated across off, pushed into cover",1st innings,29.2,no run,132,0,132/4,"Shamsi to Moor, no run",,"floated across off, pushed into cover",4
178,177,Peter Moor,333000,Tabraiz Shamsi,379145,"Shamsi to Moor, 1 run spins the other way, the wrong'un, stays back and opens the face through backward point",1st innings,29.3,run,133,1,133/4,"Shamsi to Moor, 1 run",,"spins the other way, the wrong'un, stays back and opens the face through backward point",4
179,178,Sean Williams,55870,Tabraiz Shamsi,379145,"Shamsi to Williams, FOUR runs fuller of a length, gets down and reverse-sweeps through backward point",1st innings,29.4,four,137,4,137/4,"Shamsi to Williams, FOUR runs",,"fuller of a length, gets down and reverse-sweeps through backward point",4
180,179,Sean Williams,55870,Tabraiz Shamsi,379145,"Shamsi to Williams, 1 run lets this length ball spin and knocks it to point",1st innings,29.5,run,138,1,138/4,"Shamsi to Williams, 1 run",,lets this length ball spin and knocks it to point,4
181,180,Peter Moor,333000,Tabraiz Shamsi,379145,"Shamsi to Moor, 1 run length on leg stump, pulled one-bounce to deep midwicket",1st innings,29.6,run,139,1,139/4,"Shamsi to Moor, 1 run",,"length on leg stump, pulled one-bounce to deep midwicket",4
182,181,Peter Moor,333000,Dale Steyn,47492,"Steyn to Moor, no run back of a length outside off. Goes past Moor's shoulders and into the safe hands of the keeper",1st innings,30.1,no run,139,0,139/4,"Steyn to Moor, no run",,back of a length outside off. Goes past Moor's shoulders and into the safe hands of the keeper,4
183,182,Peter Moor,333000,Dale Steyn,47492,"Steyn to Moor, no run length ball outside off, but swinging inwards. Firmly defended off the front foot",1st innings,30.2,no run,139,0,139/4,"Steyn to Moor, no run",,"length ball outside off, but swinging inwards. Firmly defended off the front foot",4
184,183,Peter Moor,333000,Dale Steyn,47492,"Steyn to Moor, no run full outside off, and angling into off stump. Takes a firm stride forward and defends. 143kph",1st innings,30.3,no run,139,0,139/4,"Steyn to Moor, no run",143kph,"full outside off, and angling into off stump. Takes a firm stride forward and defends. 143kph",4
185,184,Peter Moor,333000,Dale Steyn,47492,"Steyn to Moor, no run length ball on the fourth-stump line outside off stump. Opens the bat's face, and steers a back-foot drive to point",1st innings,30.4,no run,139,0,139/4,"Steyn to Moor, no run",,"length ball on the fourth-stump line outside off stump. Opens the bat's face, and steers a back-foot drive to point",4
186,185,Peter Moor,333000,Dale Steyn,47492,"Steyn to Moor, no run decks this short. Lands on middle, and gets big on the batsman's body. but he rides the bounce, and blocks off the back foot",1st innings,30.5,no run,139,0,139/4,"Steyn to Moor, no run",,"decks this short. Lands on middle, and gets big on the batsman's body. but he rides the bounce, and blocks off the back foot",4
187,186,Peter Moor,333000,Dale Steyn,47492,"Steyn to Moor, no run swing and a miss. Full outside off, and he goes for a wild swing to score some runs. Can't connect with the cover drive at all. <B>Maiden</b>",1st innings,30.6,no run,139,0,139/4,"Steyn to Moor, no run",,"swing and a miss. Full outside off, and he goes for a wild swing to score some runs. Can't connect with the cover drive at all. <B>Maiden</b>",4
188,187,Sean Williams,55870,Tabraiz Shamsi,379145,"Shamsi to Williams, FOUR runs <b>slog swept</b> into the deep midwicket boundary. Full on off, and he sweeps this with the spin over the leg side. Lands just short of the boundary",1st innings,31.1,four,143,4,143/4,"Shamsi to Williams, FOUR runs",,"<b>slog swept</b> into the deep midwicket boundary. Full on off, and he sweeps this with the spin over the leg side. Lands just short of the boundary",4
189,188,Sean Williams,55870,Tabraiz Shamsi,379145,"Shamsi to Williams, no run good length on off. Spinning away, and he makes room to cut. Bottom-edges the shot towards the off side",1st innings,31.2,no run,143,0,143/4,"Shamsi to Williams, no run",,"good length on off. Spinning away, and he makes room to cut. Bottom-edges the shot towards the off side",4
190,189,Sean Williams,55870,Tabraiz Shamsi,379145,"Shamsi to Williams, no run full on off, and he goes onto the back foot for a firm punch to cover",1st innings,31.3,no run,143,0,143/4,"Shamsi to Williams, no run",,"full on off, and he goes onto the back foot for a firm punch to cover",4
191,190,Sean Williams,55870,Tabraiz Shamsi,379145,"Shamsi to Williams, 1 run good length outside off, and he flat-bats an innocuous shot down to long off for a walking single",1st innings,31.4,run,144,1,144/4,"Shamsi to Williams, 1 run",,"good length outside off, and he flat-bats an innocuous shot down to long off for a walking single",4
192,191,Peter Moor,333000,Tabraiz Shamsi,379145,"Shamsi to Moor, no run good length on leg stump, and turning further down leg. He whips this off his pads to short fine leg, but can't pinch the single",1st innings,31.5,no run,144,0,144/4,"Shamsi to Moor, no run",,"good length on leg stump, and turning further down leg. He whips this off his pads to short fine leg, but can't pinch the single",4
193,192,Peter Moor,333000,Tabraiz Shamsi,379145,"Shamsi to Moor, SIX runs <b>smacked over deep midwicket!</b> Tossed up on off, and Moor joins in on the fun. Slog-sweeps across the line, and manages to clear the fielder in the deep. Delightful way to get to the <b>team 150</b>",1st innings,31.6,six,150,6,150/4,"Shamsi to Moor, SIX runs",,"<b>smacked over deep midwicket!</b> Tossed up on off, and Moor joins in on the fun. Slog-sweeps across the line, and manages to clear the fielder in the deep. Delightful way to get to the <b>team 150</b>",4
194,193,Sean Williams,55870,Dale Steyn,47492,"Steyn to Williams, 1 run good length on middle, and punched off the back foot. But it takes the outside edge and runs down to third man",1st innings,32.1,run,151,1,151/4,"Steyn to Williams, 1 run",,"good length on middle, and punched off the back foot. But it takes the outside edge and runs down to third man",4
195,194,Peter Moor,333000,Dale Steyn,47492,"Steyn to Moor, no run good length outside off, but tailing inwards. Fended off the back foot to cover",1st innings,32.2,no run,151,0,151/4,"Steyn to Moor, no run",,"good length outside off, but tailing inwards. Fended off the back foot to cover",4
196,195,Peter Moor,333000,Dale Steyn,47492,"Steyn to Moor, OUT <b>ramped to first slip!</b> Pure catching practice there. Good length ball angling in, and he tries to lift this over slip. Not off the bat's middle and flying through fast as well. Hendricks takes a small leap, puts his hand up and takes an excellent catch to get Moor's wicket",1st innings,32.3,out,151,0,151/5,"Steyn to Moor, OUT",,"<b>ramped to first slip!</b> Pure catching practice there. Good length ball angling in, and he tries to lift this over slip. Not off the bat's middle and flying through fast as well. Hendricks takes a small leap, puts his hand up and takes an excellent catch to get Moor's wicket",5
197,196,Elton Chigumbura,55343,Dale Steyn,47492,"Steyn to Chigumbura, no run good length just outside off, and at 145kph. Uncomfortably defended off the back foot",1st innings,32.4,no run,151,0,151/5,"Steyn to Chigumbura, no run",145kph,"good length just outside off, and at 145kph. Uncomfortably defended off the back foot",5
198,197,Elton Chigumbura,55343,Dale Steyn,47492,"Steyn to Chigumbura, no run full and straight on off stump. Forces Chigumbura to cover his off stump, and meet the ball with the bat's full face",1st innings,32.5,no run,151,0,151/5,"Steyn to Chigumbura, no run",,"full and straight on off stump. Forces Chigumbura to cover his off stump, and meet the ball with the bat's full face",5
199,198,Elton Chigumbura,55343,Dale Steyn,47492,"Steyn to Chigumbura, no run aimed at his toes, and this full-pitched delivery lands right on off stump. Chigumbura shuffles and gets his bat down, right in time to wedge the ball away to the leg side",1st innings,32.6,no run,151,0,151/5,"Steyn to Chigumbura, no run",,"aimed at his toes, and this full-pitched delivery lands right on off stump. Chigumbura shuffles and gets his bat down, right in time to wedge the ball away to the leg side",5
200,199,Sean Williams,55870,Tabraiz Shamsi,379145,"Shamsi to Williams, no run lands full on off, and turning away. Pushed off the front foot to cover",1st innings,33.1,no run,151,0,151/5,"Shamsi to Williams, no run",,"lands full on off, and turning away. Pushed off the front foot to cover",5
201,200,Sean Williams,55870,Tabraiz Shamsi,379145,"Shamsi to Williams, FOUR runs good length outside off, and he cuts this off the back foot to the point boundary! Makes room, and keeps his eyes on the ball till the last moment",1st innings,33.2,four,155,4,155/5,"Shamsi to Williams, FOUR runs",,"good length outside off, and he cuts this off the back foot to the point boundary! Makes room, and keeps his eyes on the ball till the last moment",5
202,201,Sean Williams,55870,Tabraiz Shamsi,379145,"Shamsi to Williams, 1 run fuller. Lands outside off, and driven down the ground to long off",1st innings,33.3,run,156,1,156/5,"Shamsi to Williams, 1 run",,"fuller. Lands outside off, and driven down the ground to long off",5
203,202,Elton Chigumbura,55343,Tabraiz Shamsi,379145,"Shamsi to Chigumbura, no run full just outside off, and he leans into a front-foot drive. Intercepted by mid off",1st innings,33.4,no run,156,0,156/5,"Shamsi to Chigumbura, no run",,"full just outside off, and he leans into a front-foot drive. Intercepted by mid off",5
204,203,Elton Chigumbura,55343,Tabraiz Shamsi,379145,"Shamsi to Chigumbura, no run full on middle stump. Spinning into his body, and shoveled off the front foot towards the leg side",1st innings,33.5,no run,156,0,156/5,"Shamsi to Chigumbura, no run",,"full on middle stump. Spinning into his body, and shoveled off the front foot towards the leg side",5
205,203,Elton Chigumbura,55343,Tabraiz Shamsi,379145,"Shamsi to Chigumbura, 1 wide full outside leg, and spinning further away. Tries to sweep behind square, but loses his balance in the process",1st innings,33.5,wide,157,1,157/5,"Shamsi to Chigumbura, 1 wide",,"full outside leg, and spinning further away. Tries to sweep behind square, but loses his balance in the process",5
206,204,Elton Chigumbura,55343,Tabraiz Shamsi,379145,"Shamsi to Chigumbura, 1 run full just outside off, and he's been lured into the cover drive. Comes off the bat's inside edge, and flies between his legs to the on-side",1st innings,33.6,run,158,1,158/5,"Shamsi to Chigumbura, 1 run",,"full just outside off, and he's been lured into the cover drive. Comes off the bat's inside edge, and flies between his legs to the on-side",5
207,205,Elton Chigumbura,55343,Kagiso Rabada,550215,"Rabada to Chigumbura, no run back of a length outside off, and Chigumbura stays on the back foot on this occasion. Defends while riding the bounce, all of it with very soft hands",1st innings,34.1,no run,158,0,158/5,"Rabada to Chigumbura, no run",,"back of a length outside off, and Chigumbura stays on the back foot on this occasion. Defends while riding the bounce, all of it with very soft hands",5
208,206,Elton Chigumbura,55343,Kagiso Rabada,550215,"Rabada to Chigumbura, 1 run full outside off, and angling in. Tries to check-drives, but the ball takes a thick inside-edge and runs past the stumps to fine leg. Lucky",1st innings,34.2,run,159,1,159/5,"Rabada to Chigumbura, 1 run",,"full outside off, and angling in. Tries to check-drives, but the ball takes a thick inside-edge and runs past the stumps to fine leg. Lucky",5
209,207,Sean Williams,55870,Kagiso Rabada,550215,"Rabada to Williams, no run good length on middle, and Williams opens the bat's face to steer this square. Straight to point, and the non-striker says no for a single",1st innings,34.3,no run,159,0,159/5,"Rabada to Williams, no run",,"good length on middle, and Williams opens the bat's face to steer this square. Straight to point, and the non-striker says no for a single",5
210,208,Sean Williams,55870,Kagiso Rabada,550215,"Rabada to Williams, no run <b>teasing!</b> Length ball just outside off. Williams moves away to the leg side and looks to defend off the back foot. But the ball moves away slightly, and flies past his outside edge to the keeper",1st innings,34.4,no run,159,0,159/5,"Rabada to Williams, no run",,"<b>teasing!</b> Length ball just outside off. Williams moves away to the leg side and looks to defend off the back foot. But the ball moves away slightly, and flies past his outside edge to the keeper",5
211,209,Sean Williams,55870,Kagiso Rabada,550215,"Rabada to Williams, OUT <b>taken on the followthrough!</b> Williams wears a disappointed look. Length ball on middle, and he tries to work it towards the leg side. it hits the top-half of his bat, and pops right up towards the non-striker's direction. Rabada spots that early and sprints across to the leg side, and then stretches forward while running to complete another soft catch",1st innings,34.5,out,159,0,159/6,"Rabada to Williams, OUT",,"<b>taken on the followthrough!</b> Williams wears a disappointed look. Length ball on middle, and he tries to work it towards the leg side. it hits the top-half of his bat, and pops right up towards the non-striker's direction. Rabada spots that early and sprints across to the leg side, and then stretches forward while running to complete another soft catch",6
212,210,Donald Tiripano,392945,Kagiso Rabada,550215,"Rabada to Tiripano, no run full just outside off stump. Tiripano meets this on the front foot, and pushes a drive to point",1st innings,34.6,no run,159,0,159/6,"Rabada to Tiripano, no run",,"full just outside off stump. Tiripano meets this on the front foot, and pushes a drive to point",6
213,210,Elton Chigumbura,55343,Imran Tahir,40618,"Imran Tahir to Chigumbura, 1 wide quick and full, but lands outside leg. Tries to sweep, but misses. Sharp collection from Klaasen",1st innings,35.0,wide,160,1,160/6,"Imran Tahir to Chigumbura, 1 wide",,"quick and full, but lands outside leg. Tries to sweep, but misses. Sharp collection from Klaasen",6
214,211,Elton Chigumbura,55343,Imran Tahir,40618,"Imran Tahir to Chigumbura, no run flighted full on off, and this is pushed to cover. The non-striker's already off for the run, but the batsman asks him to return",1st innings,35.1,no run,160,0,160/6,"Imran Tahir to Chigumbura, no run",,"flighted full on off, and this is pushed to cover. The non-striker's already off for the run, but the batsman asks him to return",6
215,212,Elton Chigumbura,55343,Imran Tahir,40618,"Imran Tahir to Chigumbura, no run full outside off. It's the wrong'un that turns into the right hander. Defended off the front foot",1st innings,35.2,no run,160,0,160/6,"Imran Tahir to Chigumbura, no run",,full outside off. It's the wrong'un that turns into the right hander. Defended off the front foot,6
216,213,Elton Chigumbura,55343,Imran Tahir,40618,"Imran Tahir to Chigumbura, no run full toss just outside off, and his straight drive is athletically stopped by Tahir diving to his right",1st innings,35.3,no run,160,0,160/6,"Imran Tahir to Chigumbura, no run",,"full toss just outside off, and his straight drive is athletically stopped by Tahir diving to his right",6
217,214,Elton Chigumbura,55343,Imran Tahir,40618,"Imran Tahir to Chigumbura, no run full on off, and he smothers a front-foot defense to point",1st innings,35.4,no run,160,0,160/6,"Imran Tahir to Chigumbura, no run",,"full on off, and he smothers a front-foot defense to point",6
218,215,Elton Chigumbura,55343,Imran Tahir,40618,"Imran Tahir to Chigumbura, no run flatter. Lands on length and skids through. Punched off the back foot to cover",1st innings,35.5,no run,160,0,160/6,"Imran Tahir to Chigumbura, no run",,flatter. Lands on length and skids through. Punched off the back foot to cover,6
219,216,Elton Chigumbura,55343,Imran Tahir,40618,"Imran Tahir to Chigumbura, 1 run flighted on off stump, and the ball is caressed square to the sweeper fielder on the off side",1st innings,35.6,run,161,1,161/6,"Imran Tahir to Chigumbura, 1 run",,"flighted on off stump, and the ball is caressed square to the sweeper fielder on the off side",6
220,216,Elton Chigumbura,55343,Kagiso Rabada,550215,"Rabada to Chigumbura, 1 wide ",1st innings,36.0,wide,162,1,162/6,"Rabada to Chigumbura, 1 wide",,,6
221,216,Elton Chigumbura,55343,Kagiso Rabada,550215,"Rabada to Chigumbura, 1 wide wayward! Attempts the yorker, but this lands beyond the batsman after going down leg. Klaasen dives to his left and ensures that doesn't go for byes",1st innings,36.0,wide,163,1,163/6,"Rabada to Chigumbura, 1 wide",,"wayward! Attempts the yorker, but this lands beyond the batsman after going down leg. Klaasen dives to his left and ensures that doesn't go for byes",6
222,217,Elton Chigumbura,55343,Kagiso Rabada,550215,"Rabada to Chigumbura, no run full outside off, and skidding through. Sticks his bat out, but the ball's gone past him before he could notice",1st innings,36.1,no run,163,0,163/6,"Rabada to Chigumbura, no run",,"full outside off, and skidding through. Sticks his bat out, but the ball's gone past him before he could notice",6
223,218,Elton Chigumbura,55343,Kagiso Rabada,550215,"Rabada to Chigumbura, no run good length just outside off, and blocked off the back foot",1st innings,36.2,no run,163,0,163/6,"Rabada to Chigumbura, no run",,"good length just outside off, and blocked off the back foot",6
224,219,Elton Chigumbura,55343,Kagiso Rabada,550215,"Rabada to Chigumbura, FOUR runs full on middle, and that's been clipped off his toes past the midwicket fielder! Sweet timing off the bat, and the delivery whizzes away for a much-needed boundary",1st innings,36.3,four,167,4,167/6,"Rabada to Chigumbura, FOUR runs",,"full on middle, and that's been clipped off his toes past the midwicket fielder! Sweet timing off the bat, and the delivery whizzes away for a much-needed boundary",6
225,219,Elton Chigumbura,55343,Kagiso Rabada,550215,"Rabada to Chigumbura, 1 wide back of a length outside off, and that's been left alone by the batsman",1st innings,36.3,wide,168,1,168/6,"Rabada to Chigumbura, 1 wide",,"back of a length outside off, and that's been left alone by the batsman",6
226,220,Elton Chigumbura,55343,Kagiso Rabada,550215,"Rabada to Chigumbura, 1 run good length just outside off, and he pushes this off the front foot to cover. They race away for a run",1st innings,36.4,run,169,1,169/6,"Rabada to Chigumbura, 1 run",,"good length just outside off, and he pushes this off the front foot to cover. They race away for a run",6
227,221,Donald Tiripano,392945,Kagiso Rabada,550215,"Rabada to Tiripano, no run back of a length on middle stump, and going down leg stump. But the umpire reckons it's not a wide, because the ball was near the batsman's playing region",1st innings,36.5,no run,169,0,169/6,"Rabada to Tiripano, no run",,"back of a length on middle stump, and going down leg stump. But the umpire reckons it's not a wide, because the ball was near the batsman's playing region",6
228,222,Donald Tiripano,392945,Kagiso Rabada,550215,"Rabada to Tiripano, no run back of a length outside off, and he defends off the back foot",1st innings,36.6,no run,169,0,169/6,"Rabada to Tiripano, no run",,"back of a length outside off, and he defends off the back foot",6
229,223,Elton Chigumbura,55343,Imran Tahir,40618,"Imran Tahir to Chigumbura, 1 run full just outside off, and driven off the front foot to cover. Played with the turn this time",1st innings,37.1,run,170,1,170/6,"Imran Tahir to Chigumbura, 1 run",,"full just outside off, and driven off the front foot to cover. Played with the turn this time",6
230,224,Donald Tiripano,392945,Imran Tahir,40618,"Imran Tahir to Tiripano, no run full on leg stump, and clipped off his toes to the leg side. They choose not to take the run",1st innings,37.2,no run,170,0,170/6,"Imran Tahir to Tiripano, no run",,"full on leg stump, and clipped off his toes to the leg side. They choose not to take the run",6
231,225,Donald Tiripano,392945,Imran Tahir,40618,"Imran Tahir to Tiripano, no run good length on middle. Turning away after pitching, and blocked off the back foot",1st innings,37.3,no run,170,0,170/6,"Imran Tahir to Tiripano, no run",,"good length on middle. Turning away after pitching, and blocked off the back foot",6
232,226,Donald Tiripano,392945,Imran Tahir,40618,"Imran Tahir to Tiripano, no run <b>the wrong'un!</b> But it's pitched so wide outside off, that the offspin was expected. Defended off the front foot",1st innings,37.4,no run,170,0,170/6,"Imran Tahir to Tiripano, no run",,"<b>the wrong'un!</b> But it's pitched so wide outside off, that the offspin was expected. Defended off the front foot",6
233,227,Donald Tiripano,392945,Imran Tahir,40618,"Imran Tahir to Tiripano, FOUR runs <b>slapped!</b> Length ball outside off, and he backs away to successfully cut this past the diving cover-point fielder",1st innings,37.5,four,174,4,174/6,"Imran Tahir to Tiripano, FOUR runs",,"<b>slapped!</b> Length ball outside off, and he backs away to successfully cut this past the diving cover-point fielder",6
234,228,Donald Tiripano,392945,Imran Tahir,40618,"Imran Tahir to Tiripano, no run full outside off, and he smothers the offbreak towards the leg side with soft hands",1st innings,37.6,no run,174,0,174/6,"Imran Tahir to Tiripano, no run",,"full outside off, and he smothers the offbreak towards the leg side with soft hands",6
235,229,Elton Chigumbura,55343,Kagiso Rabada,550215,"Rabada to Chigumbura, no run misses out on an extravagant square cut. Length ball wide outside off, and Chigumbura threw his bat at this. But the extra bounce takes it over his blade and into the keeper's gloves",1st innings,38.1,no run,174,0,174/6,"Rabada to Chigumbura, no run",,"misses out on an extravagant square cut. Length ball wide outside off, and Chigumbura threw his bat at this. But the extra bounce takes it over his blade and into the keeper's gloves",6
236,230,Elton Chigumbura,55343,Kagiso Rabada,550215,"Rabada to Chigumbura, no run good length outside off, and he steers a back-foot late cut to backward point",1st innings,38.2,no run,174,0,174/6,"Rabada to Chigumbura, no run",,"good length outside off, and he steers a back-foot late cut to backward point",6
237,231,Elton Chigumbura,55343,Kagiso Rabada,550215,"Rabada to Chigumbura, no run slower ball from Rabada. Full just outside off,but he waits for the ball to get to him. Blocked back to the bowler",1st innings,38.3,no run,174,0,174/6,"Rabada to Chigumbura, no run",,"slower ball from Rabada. Full just outside off,but he waits for the ball to get to him. Blocked back to the bowler",6
238,232,Elton Chigumbura,55343,Kagiso Rabada,550215,"Rabada to Chigumbura, no run <b>sends the batsman ducking!</b> Fiery, short and aimed at the batsman's body. Does well to drop his knees and get out of the ball's way",1st innings,38.4,no run,174,0,174/6,"Rabada to Chigumbura, no run",,"<b>sends the batsman ducking!</b> Fiery, short and aimed at the batsman's body. Does well to drop his knees and get out of the ball's way",6
239,233,Elton Chigumbura,55343,Kagiso Rabada,550215,"Rabada to Chigumbura, no run back of a length just outside off. Blocked off the back foot to point",1st innings,38.5,no run,174,0,174/6,"Rabada to Chigumbura, no run",,back of a length just outside off. Blocked off the back foot to point,6
240,234,Elton Chigumbura,55343,Kagiso Rabada,550215,"Rabada to Chigumbura, no run full just outside off, and the cover drive flies off the bat's inside half. Rolls away to midwicket",1st innings,38.6,no run,174,0,174/6,"Rabada to Chigumbura, no run",,"full just outside off, and the cover drive flies off the bat's inside half. Rolls away to midwicket",6
241,235,Donald Tiripano,392945,Imran Tahir,40618,"Imran Tahir to Tiripano, no run full on leg, and spinning across the batsman. But Tiripano negates that with his big stride, and then defends this straight",1st innings,39.1,no run,174,0,174/6,"Imran Tahir to Tiripano, no run",,"full on leg, and spinning across the batsman. But Tiripano negates that with his big stride, and then defends this straight",6
