,ball,batsman,batsman_id,bowler,bowler_id,commentary,innings,overs,playType,runs,runs_scored,score,shortText,speed,text,wickets
242,236,Donald Tiripano,392945,Imran Tahir,40618,"Imran Tahir to Tiripano, FOUR runs length ball on middle that's skidding down leg. The batsman swivels, and gets a feather-touch off his flick, and the ball absolutely races away to the fine-leg boundary for four",1st innings,39.2,four,178,4,178/6,"Imran Tahir to Tiripano, FOUR runs",,"length ball on middle that's skidding down leg. The batsman swivels, and gets a feather-touch off his flick, and the ball absolutely races away to the fine-leg boundary for four",6
243,237,Donald Tiripano,392945,Imran Tahir,40618,"Imran Tahir to Tiripano, no run full and wide outside off. The wrong'un turns in, and he defends off the front foot to cover",1st innings,39.3,no run,178,0,178/6,"Imran Tahir to Tiripano, no run",,"full and wide outside off. The wrong'un turns in, and he defends off the front foot to cover",6
244,238,Donald Tiripano,392945,Imran Tahir,40618,"Imran Tahir to Tiripano, FOUR runs good length outside off, and he waits for the ball to come to him, before pulling this from deep into his crease. Clears the mid-on fielder, and it's running away for another boundary",1st innings,39.4,four,182,4,182/6,"Imran Tahir to Tiripano, FOUR runs",,"good length outside off, and he waits for the ball to come to him, before pulling this from deep into his crease. Clears the mid-on fielder, and it's running away for another boundary",6
245,239,Donald Tiripano,392945,Imran Tahir,40618,"Imran Tahir to Tiripano, no run full outside off, and pushed off the front foot to cover point",1st innings,39.5,no run,182,0,182/6,"Imran Tahir to Tiripano, no run",,"full outside off, and pushed off the front foot to cover point",6
246,240,Donald Tiripano,392945,Imran Tahir,40618,"Imran Tahir to Tiripano, no run full on middle, and blocked off the front foot. <B>Tahir finishes with 2 for 44</b>",1st innings,39.6,no run,182,0,182/6,"Imran Tahir to Tiripano, no run",,"full on middle, and blocked off the front foot. <B>Tahir finishes with 2 for 44</b>",6
247,241,Elton Chigumbura,55343,Andile Phehlukwayo,540316,"Phehlukwayo to Chigumbura, OUT edged and gone. Slashes at the sight of width and the ball gets up a bit more to shave the edge and settle into the keeper's gloves",1st innings,40.1,out,182,0,182/7,"Phehlukwayo to Chigumbura, OUT",,edged and gone. Slashes at the sight of width and the ball gets up a bit more to shave the edge and settle into the keeper's gloves,7
248,242,Brandon Mavuta,806239,Andile Phehlukwayo,540316,"Phehlukwayo to Mavuta, no run full on off, defended",1st innings,40.2,no run,182,0,182/7,"Phehlukwayo to Mavuta, no run",,"full on off, defended",7
249,243,Brandon Mavuta,806239,Andile Phehlukwayo,540316,"Phehlukwayo to Mavuta, no run length on off, blocked to cover",1st innings,40.3,no run,182,0,182/7,"Phehlukwayo to Mavuta, no run",,"length on off, blocked to cover",7
250,244,Brandon Mavuta,806239,Andile Phehlukwayo,540316,"Phehlukwayo to Mavuta, no run short and wide, slaps at it and chops it into the ground",1st innings,40.4,no run,182,0,182/7,"Phehlukwayo to Mavuta, no run",,"short and wide, slaps at it and chops it into the ground",7
251,245,Brandon Mavuta,806239,Andile Phehlukwayo,540316,"Phehlukwayo to Mavuta, no run short of a length around off, tries to run it down and misses",1st innings,40.5,no run,182,0,182/7,"Phehlukwayo to Mavuta, no run",,"short of a length around off, tries to run it down and misses",7
252,246,Brandon Mavuta,806239,Andile Phehlukwayo,540316,"Phehlukwayo to Mavuta, 1 run short of a length, pushes back and drops it to third man",1st innings,40.6,run,183,1,183/7,"Phehlukwayo to Mavuta, 1 run",,"short of a length, pushes back and drops it to third man",7
253,247,Brandon Mavuta,806239,Tabraiz Shamsi,379145,"Shamsi to Mavuta, 2 runs gets down to sweep and guides it past short fine leg",1st innings,41.1,run,185,2,185/7,"Shamsi to Mavuta, 2 runs",,gets down to sweep and guides it past short fine leg,7
254,248,Brandon Mavuta,806239,Tabraiz Shamsi,379145,"Shamsi to Mavuta, FOUR runs full on the pads, clips it away and chips it past mid-on for four",1st innings,41.2,four,189,4,189/7,"Shamsi to Mavuta, FOUR runs",,"full on the pads, clips it away and chips it past mid-on for four",7
255,249,Brandon Mavuta,806239,Tabraiz Shamsi,379145,"Shamsi to Mavuta, 1 run loses control on this sweep and top-edges it to deep square leg, in front of the fielder in the deep",1st innings,41.3,run,190,1,190/7,"Shamsi to Mavuta, 1 run",,"loses control on this sweep and top-edges it to deep square leg, in front of the fielder in the deep",7
256,250,Donald Tiripano,392945,Tabraiz Shamsi,379145,"Shamsi to Tiripano, no run flicks a fuller one into the on side",1st innings,41.4,no run,190,0,190/7,"Shamsi to Tiripano, no run",,flicks a fuller one into the on side,7
257,251,Donald Tiripano,392945,Tabraiz Shamsi,379145,"Shamsi to Tiripano, FOUR runs now he unfurls the reverse sweep, sees the angle as it's slid across and just gets down and guides it fine to third man",1st innings,41.5,four,194,4,194/7,"Shamsi to Tiripano, FOUR runs",,"now he unfurls the reverse sweep, sees the angle as it's slid across and just gets down and guides it fine to third man",7
258,252,Donald Tiripano,392945,Tabraiz Shamsi,379145,"Shamsi to Tiripano, no run blocks a fuller one into the off side",1st innings,41.6,no run,194,0,194/7,"Shamsi to Tiripano, no run",,blocks a fuller one into the off side,7
259,253,Brandon Mavuta,806239,Andile Phehlukwayo,540316,"Phehlukwayo to Mavuta, no run reaches out to a wide one that keeps low and goes to the keeper off the bottom edge",1st innings,42.1,no run,194,0,194/7,"Phehlukwayo to Mavuta, no run",,reaches out to a wide one that keeps low and goes to the keeper off the bottom edge,7
260,254,Brandon Mavuta,806239,Andile Phehlukwayo,540316,"Phehlukwayo to Mavuta, 1 run flicks a fuller one to midwicket",1st innings,42.2,run,195,1,195/7,"Phehlukwayo to Mavuta, 1 run",,flicks a fuller one to midwicket,7
261,255,Donald Tiripano,392945,Andile Phehlukwayo,540316,"Phehlukwayo to Tiripano, no run full on off, defended",1st innings,42.3,no run,195,0,195/7,"Phehlukwayo to Tiripano, no run",,"full on off, defended",7
262,256,Donald Tiripano,392945,Andile Phehlukwayo,540316,"Phehlukwayo to Tiripano, no run tries to cut a wide one and gets beaten as it doesn't quite come on",1st innings,42.4,no run,195,0,195/7,"Phehlukwayo to Tiripano, no run",,tries to cut a wide one and gets beaten as it doesn't quite come on,7
263,257,Donald Tiripano,392945,Andile Phehlukwayo,540316,"Phehlukwayo to Tiripano, 1 run flicks a length ball to midwicket",1st innings,42.5,run,196,1,196/7,"Phehlukwayo to Tiripano, 1 run",,flicks a length ball to midwicket,7
264,258,Brandon Mavuta,806239,Andile Phehlukwayo,540316,"Phehlukwayo to Mavuta, FOUR runs flays at a fuller wide ball and thumps it past extra cover stretching out to his left",1st innings,42.6,four,200,4,200/7,"Phehlukwayo to Mavuta, FOUR runs",,flays at a fuller wide ball and thumps it past extra cover stretching out to his left,7
265,259,Donald Tiripano,392945,Tabraiz Shamsi,379145,"Shamsi to Tiripano, no run floats a fuller one across off, defended off the front foot",1st innings,43.1,no run,200,0,200/7,"Shamsi to Tiripano, no run",,"floats a fuller one across off, defended off the front foot",7
266,260,Donald Tiripano,392945,Tabraiz Shamsi,379145,"Shamsi to Tiripano, 3 byes goes for a big heave but can't get underneath it as the ball spins and bounces past the keeper and the first slip",1st innings,43.2,bye,203,3,203/7,"Shamsi to Tiripano, 3 byes",,goes for a big heave but can't get underneath it as the ball spins and bounces past the keeper and the first slip,7
267,261,Brandon Mavuta,806239,Tabraiz Shamsi,379145,"Shamsi to Mavuta, 2 runs gets down for a reverse sweep and gets a bit of a <b>leading edge past slip</b>",1st innings,43.3,run,205,2,205/7,"Shamsi to Mavuta, 2 runs",,gets down for a reverse sweep and gets a bit of a <b>leading edge past slip</b>,7
268,262,Brandon Mavuta,806239,Tabraiz Shamsi,379145,"Shamsi to Mavuta, no run tries to nudge it into the on side but it keeps low and he barely keeps it out",1st innings,43.4,no run,205,0,205/7,"Shamsi to Mavuta, no run",,tries to nudge it into the on side but it keeps low and he barely keeps it out,7
269,263,Brandon Mavuta,806239,Tabraiz Shamsi,379145,"Shamsi to Mavuta, 1 run another sweep, to a length ball this time, to deep square leg",1st innings,43.5,run,206,1,206/7,"Shamsi to Mavuta, 1 run",,"another sweep, to a length ball this time, to deep square leg",7
270,264,Donald Tiripano,392945,Tabraiz Shamsi,379145,"Shamsi to Tiripano, 1 run reverse-sweeps this from leg stump to the left of sweeper cover",1st innings,43.6,run,207,1,207/7,"Shamsi to Tiripano, 1 run",,reverse-sweeps this from leg stump to the left of sweeper cover,7
271,265,Donald Tiripano,392945,Andile Phehlukwayo,540316,"Phehlukwayo to Tiripano, no run extremely full on middle, dug out to mid-off",1st innings,44.1,no run,207,0,207/7,"Phehlukwayo to Tiripano, no run",,"extremely full on middle, dug out to mid-off",7
272,266,Donald Tiripano,392945,Andile Phehlukwayo,540316,"Phehlukwayo to Tiripano, 1 run opens the face to a length ball and runs it down to third man",1st innings,44.2,run,208,1,208/7,"Phehlukwayo to Tiripano, 1 run",,opens the face to a length ball and runs it down to third man,7
273,267,Brandon Mavuta,806239,Andile Phehlukwayo,540316,"Phehlukwayo to Mavuta, 2 runs advances and swipes across the line to get an inside edge to deep fine leg",1st innings,44.3,run,210,2,210/7,"Phehlukwayo to Mavuta, 2 runs",,advances and swipes across the line to get an inside edge to deep fine leg,7
274,268,Brandon Mavuta,806239,Andile Phehlukwayo,540316,"Phehlukwayo to Mavuta, OUT swipes at a full toss and chips it in the air off the outside of the bat, and du Plessis at mid-off easily grabs it",1st innings,44.4,out,210,0,210/8,"Phehlukwayo to Mavuta, OUT",,"swipes at a full toss and chips it in the air off the outside of the bat, and du Plessis at mid-off easily grabs it",8
275,269,Kyle Jarvis,332996,Andile Phehlukwayo,540316,"Phehlukwayo to Jarvis, no run defends a fuller one outside off",1st innings,44.5,no run,210,0,210/8,"Phehlukwayo to Jarvis, no run",,defends a fuller one outside off,8
276,270,Kyle Jarvis,332996,Andile Phehlukwayo,540316,"Phehlukwayo to Jarvis, no run short ball, gets under it",1st innings,44.6,no run,210,0,210/8,"Phehlukwayo to Jarvis, no run",,"short ball, gets under it",8
277,271,Donald Tiripano,392945,Dale Steyn,47492,"Steyn to Tiripano, 1 run full, clipped off the pads to deep fine leg",1st innings,45.1,run,211,1,211/8,"Steyn to Tiripano, 1 run",,"full, clipped off the pads to deep fine leg",8
278,272,Kyle Jarvis,332996,Dale Steyn,47492,"Steyn to Jarvis, no run short of a length, seams away at 135ks, swings and misses",1st innings,45.2,no run,211,0,211/8,"Steyn to Jarvis, no run",,"short of a length, seams away at 135ks, swings and misses",8
279,273,Kyle Jarvis,332996,Dale Steyn,47492,"Steyn to Jarvis, no run nasty bouncer, well-directed at middle stump, ducked under",1st innings,45.3,no run,211,0,211/8,"Steyn to Jarvis, no run",,"nasty bouncer, well-directed at middle stump, ducked under",8
280,274,Kyle Jarvis,332996,Dale Steyn,47492,"Steyn to Jarvis, no run ",1st innings,45.4,no run,211,0,211/8,"Steyn to Jarvis, no run",,,8
281,275,Kyle Jarvis,332996,Dale Steyn,47492,"Steyn to Jarvis, no run short, fails to get on top of the bounce as he flays at it and misses",1st innings,45.5,no run,211,0,211/8,"Steyn to Jarvis, no run",,"short, fails to get on top of the bounce as he flays at it and misses",8
282,276,Kyle Jarvis,332996,Dale Steyn,47492,"Steyn to Jarvis, no run another short one, leaves him and climbs sharply, can't do much about it",1st innings,45.6,no run,211,0,211/8,"Steyn to Jarvis, no run",,"another short one, leaves him and climbs sharply, can't do much about it",8
283,277,Donald Tiripano,392945,Kagiso Rabada,550215,"Rabada to Tiripano, no run short of a length outside off, guided to point",1st innings,46.1,no run,211,0,211/8,"Rabada to Tiripano, no run",,"short of a length outside off, guided to point",8
284,278,Donald Tiripano,392945,Kagiso Rabada,550215,"Rabada to Tiripano, 2 runs <b>dropped</b>. Very, very tough chance. Phehlukwayo sprints all the way back from midwicket, runs a good 15-20 steps and gets under it but it pops out. It was a cross-seamer, and Tiripano swung blindly looking for a big hit over the leg side",1st innings,46.2,run,213,2,213/8,"Rabada to Tiripano, 2 runs",,"<b>dropped</b>. Very, very tough chance. Phehlukwayo sprints all the way back from midwicket, runs a good 15-20 steps and gets under it but it pops out. It was a cross-seamer, and Tiripano swung blindly looking for a big hit over the leg side",8
285,279,Donald Tiripano,392945,Kagiso Rabada,550215,"Rabada to Tiripano, 1 run ",1st innings,46.3,run,214,1,214/8,"Rabada to Tiripano, 1 run",,,8
286,280,Kyle Jarvis,332996,Kagiso Rabada,550215,"Rabada to Jarvis, no run moves away from a back of a length, stays in the crease and swings and misses",1st innings,46.4,no run,214,0,214/8,"Rabada to Jarvis, no run",,"moves away from a back of a length, stays in the crease and swings and misses",8
287,281,Kyle Jarvis,332996,Kagiso Rabada,550215,"Rabada to Jarvis, FOUR runs now he goes straight over, doesn't make great connection but it's good enough. An off-cutter, slapped over mid-on",1st innings,46.5,four,218,4,218/8,"Rabada to Jarvis, FOUR runs",,"now he goes straight over, doesn't make great connection but it's good enough. An off-cutter, slapped over mid-on",8
288,282,Kyle Jarvis,332996,Kagiso Rabada,550215,"Rabada to Jarvis, no run short around off, backs away and tries to open the face but makes no contact",1st innings,46.6,no run,218,0,218/8,"Rabada to Jarvis, no run",,"short around off, backs away and tries to open the face but makes no contact",8
289,283,Donald Tiripano,392945,Dale Steyn,47492,"Steyn to Tiripano, no run short of a length, stays legside and opens the face to point",1st innings,47.1,no run,218,0,218/8,"Steyn to Tiripano, no run",,"short of a length, stays legside and opens the face to point",8
290,284,Donald Tiripano,392945,Dale Steyn,47492,"Steyn to Tiripano, 1 run slower length ball, steered to third man",1st innings,47.2,run,219,1,219/8,"Steyn to Tiripano, 1 run",,"slower length ball, steered to third man",8
291,285,Kyle Jarvis,332996,Dale Steyn,47492,"Steyn to Jarvis, no run short of a length on off, punched to point",1st innings,47.3,no run,219,0,219/8,"Steyn to Jarvis, no run",,"short of a length on off, punched to point",8
292,286,Kyle Jarvis,332996,Dale Steyn,47492,"Steyn to Jarvis, no run slower shortish ball, makes no effort to get close as he swings, and misses",1st innings,47.4,no run,219,0,219/8,"Steyn to Jarvis, no run",,"slower shortish ball, makes no effort to get close as he swings, and misses",8
293,287,Kyle Jarvis,332996,Dale Steyn,47492,"Steyn to Jarvis, 1 run ",1st innings,47.5,run,220,1,220/8,"Steyn to Jarvis, 1 run",,,8
294,288,Donald Tiripano,392945,Dale Steyn,47492,"Steyn to Tiripano, no run short of a length, fails to get on top and doesn't get much room, top-edges a pull to the vacant midwicket",1st innings,47.6,no run,220,0,220/8,"Steyn to Tiripano, no run",,"short of a length, fails to get on top and doesn't get much room, top-edges a pull to the vacant midwicket",8
295,289,Kyle Jarvis,332996,Kagiso Rabada,550215,"Rabada to Jarvis, 2 runs short, angling into him, pulls to deep square leg",1st innings,48.1,run,222,2,222/8,"Rabada to Jarvis, 2 runs",,"short, angling into him, pulls to deep square leg",8
296,290,Kyle Jarvis,332996,Kagiso Rabada,550215,"Rabada to Jarvis, 1 run shortish outside off, slapped down to mid-off",1st innings,48.2,run,223,1,223/8,"Rabada to Jarvis, 1 run",,"shortish outside off, slapped down to mid-off",8
297,291,Donald Tiripano,392945,Kagiso Rabada,550215,"Rabada to Tiripano, no run backs away but the bowler follows him with a short ball and he makes no contact on the pull",1st innings,48.3,no run,223,0,223/8,"Rabada to Tiripano, no run",,backs away but the bowler follows him with a short ball and he makes no contact on the pull,8
298,292,Donald Tiripano,392945,Kagiso Rabada,550215,"Rabada to Tiripano, 1 run short of length on off, punched to extra cover",1st innings,48.4,run,224,1,224/8,"Rabada to Tiripano, 1 run",,"short of length on off, punched to extra cover",8
299,293,Kyle Jarvis,332996,Kagiso Rabada,550215,"Rabada to Jarvis, OUT rolls his fingers over a length ball and Jarvis takes a swing and connects only well enough to send a catch down the throat of long-on",1st innings,48.5,out,224,0,224/9,"Rabada to Jarvis, OUT",,rolls his fingers over a length ball and Jarvis takes a swing and connects only well enough to send a catch down the throat of long-on,9
300,294,Tendai Chatara,425639,Kagiso Rabada,550215,"Rabada to Chatara, no run full toss on middle, pushes down to long-on and jogs down for a single but it sent back",1st innings,48.6,no run,224,0,224/9,"Rabada to Chatara, no run",,"full toss on middle, pushes down to long-on and jogs down for a single but it sent back",9
301,295,Donald Tiripano,392945,Dale Steyn,47492,"Steyn to Tiripano, FOUR runs back of a length, backs away and slaps it over extra cover for an imperious boundary",1st innings,49.1,four,228,4,228/9,"Steyn to Tiripano, FOUR runs",,"back of a length, backs away and slaps it over extra cover for an imperious boundary",9
302,296,Donald Tiripano,392945,Dale Steyn,47492,"Steyn to Tiripano, no run fuller this time, stays shifts back and tries to loft it over but gets an inside edge to the pad",1st innings,49.2,no run,228,0,228/9,"Steyn to Tiripano, no run",,"fuller this time, stays shifts back and tries to loft it over but gets an inside edge to the pad",9
303,297,Donald Tiripano,392945,Dale Steyn,47492,"Steyn to Tiripano, OUT in the air and taken. That's the end of the innings. Slower ball from Steyn, wide and back of a length, Tiripano has a flat-batted swing at it and the ball shoots up off the splice and goes to Faf at extra cover",1st innings,49.3,out,228,0,228/10,"Steyn to Tiripano, OUT",,"in the air and taken. That's the end of the innings. Slower ball from Steyn, wide and back of a length, Tiripano has a flat-batted swing at it and the ball shoots up off the splice and goes to Faf at extra cover",10
304,1,Aiden Markram,600498,Kyle Jarvis,332996,"Jarvis to Markram, no run good length on off, and Markram gets bat to ball off the first delivery. Rocks back and fends it back to the bowler",2nd innings,0.1,no run,0,0,0/0,"Jarvis to Markram, no run",,"good length on off, and Markram gets bat to ball off the first delivery. Rocks back and fends it back to the bowler",0
305,2,Aiden Markram,600498,Kyle Jarvis,332996,"Jarvis to Markram, no run full and wide outside off. Swinging further away, and left alone by Markram",2nd innings,0.2,no run,0,0,0/0,"Jarvis to Markram, no run",,"full and wide outside off. Swinging further away, and left alone by Markram",0
306,3,Aiden Markram,600498,Kyle Jarvis,332996,"Jarvis to Markram, 1 run full on middle, drifting down leg, and flicked away to fine leg. South Africa get off the mark",2nd innings,0.3,run,1,1,1/0,"Jarvis to Markram, 1 run",,"full on middle, drifting down leg, and flicked away to fine leg. South Africa get off the mark",0
307,4,Reeza Hendricks,269280,Kyle Jarvis,332996,"Jarvis to Hendricks, no run full outside off, and shaping away once again. The batsman looks to drive but eventually pulls out of the shot",2nd innings,0.4,no run,1,0,1/0,"Jarvis to Hendricks, no run",,"full outside off, and shaping away once again. The batsman looks to drive but eventually pulls out of the shot",0
308,4,Reeza Hendricks,269280,Kyle Jarvis,332996,"Jarvis to Hendricks, 1 wide full on middle, but going down leg. Hendricks is happy to let that go",2nd innings,0.4,wide,2,1,2/0,"Jarvis to Hendricks, 1 wide",,"full on middle, but going down leg. Hendricks is happy to let that go",0
309,5,Reeza Hendricks,269280,Kyle Jarvis,332996,"Jarvis to Hendricks, no run good length outside off, and he stands tall to punch through point. But the fielder gets down on both knees and stops the ball from sneaking past him",2nd innings,0.5,no run,2,0,2/0,"Jarvis to Hendricks, no run",,"good length outside off, and he stands tall to punch through point. But the fielder gets down on both knees and stops the ball from sneaking past him",0
310,6,Reeza Hendricks,269280,Kyle Jarvis,332996,"Jarvis to Hendricks, no run full on off stump. He takes a couple of steps forward, and blocks off the front foot",2nd innings,0.6,no run,2,0,2/0,"Jarvis to Hendricks, no run",,"full on off stump. He takes a couple of steps forward, and blocks off the front foot",0
311,7,Aiden Markram,600498,Tendai Chatara,425639,"Chatara to Markram, no run full on off stump. Right on the money, and defended down the ground to mid on",2nd innings,1.1,no run,2,0,2/0,"Chatara to Markram, no run",,"full on off stump. Right on the money, and defended down the ground to mid on",0
312,8,Aiden Markram,600498,Tendai Chatara,425639,"Chatara to Markram, no run full just outside off, and pushed with soft hands to cover",2nd innings,1.2,no run,2,0,2/0,"Chatara to Markram, no run",,"full just outside off, and pushed with soft hands to cover",0
313,9,Aiden Markram,600498,Tendai Chatara,425639,"Chatara to Markram, FOUR runs full on leg, and that's been <b>timed</b> off his toes past square leg. Chase for the infielder but the ball's winning that race",2nd innings,1.3,four,6,4,6/0,"Chatara to Markram, FOUR runs",,"full on leg, and that's been <b>timed</b> off his toes past square leg. Chase for the infielder but the ball's winning that race",0
314,10,Aiden Markram,600498,Tendai Chatara,425639,"Chatara to Markram, no run full on off stump. Markram covers his off stump by shuffling across, and defends off the front foot to mid on",2nd innings,1.4,no run,6,0,6/0,"Chatara to Markram, no run",,"full on off stump. Markram covers his off stump by shuffling across, and defends off the front foot to mid on",0
315,11,Aiden Markram,600498,Tendai Chatara,425639,"Chatara to Markram, FOUR runs <b>flicked!</b> On his pads again, and he whips this off his legs once again over the square-leg umpire for another leg-side boundary",2nd innings,1.5,four,10,4,10/0,"Chatara to Markram, FOUR runs",,"<b>flicked!</b> On his pads again, and he whips this off his legs once again over the square-leg umpire for another leg-side boundary",0
316,12,Aiden Markram,600498,Tendai Chatara,425639,"Chatara to Markram, FOUR runs full on middle, and that's the <b>best of the three boundaries!</b> Just gets his front leg across to off stump, and then thumps an on drive past midwicket",2nd innings,1.6,four,14,4,14/0,"Chatara to Markram, FOUR runs",,"full on middle, and that's the <b>best of the three boundaries!</b> Just gets his front leg across to off stump, and then thumps an on drive past midwicket",0
317,13,Reeza Hendricks,269280,Kyle Jarvis,332996,"Jarvis to Hendricks, no run full just outside off, and his front-foot drive goes straight to mid off. No chance of a run there",2nd innings,2.1,no run,14,0,14/0,"Jarvis to Hendricks, no run",,"full just outside off, and his front-foot drive goes straight to mid off. No chance of a run there",0
318,14,Reeza Hendricks,269280,Kyle Jarvis,332996,"Jarvis to Hendricks, FOUR runs good length on middle, and he works this away off his hips to deep square leg.",2nd innings,2.2,four,18,4,18/0,"Jarvis to Hendricks, FOUR runs",,"good length on middle, and he works this away off his hips to deep square leg.",0
319,15,Reeza Hendricks,269280,Kyle Jarvis,332996,"Jarvis to Hendricks, no run good length outside off, and punched off the back foot to mid off",2nd innings,2.3,no run,18,0,18/0,"Jarvis to Hendricks, no run",,"good length outside off, and punched off the back foot to mid off",0
320,16,Reeza Hendricks,269280,Kyle Jarvis,332996,"Jarvis to Hendricks, no run ",2nd innings,2.4,no run,18,0,18/0,"Jarvis to Hendricks, no run",,,0
321,17,Reeza Hendricks,269280,Kyle Jarvis,332996,"Jarvis to Hendricks, no run back of a length outside off. Much nicer line from Jarvis. Fended off the back foot",2nd innings,2.5,no run,18,0,18/0,"Jarvis to Hendricks, no run",,back of a length outside off. Much nicer line from Jarvis. Fended off the back foot,0
322,18,Reeza Hendricks,269280,Kyle Jarvis,332996,"Jarvis to Hendricks, no run good length outside off, and firmly struck off the back foot. But finds the cover fielder",2nd innings,2.6,no run,18,0,18/0,"Jarvis to Hendricks, no run",,"good length outside off, and firmly struck off the back foot. But finds the cover fielder",0
323,19,Aiden Markram,600498,Tendai Chatara,425639,"Chatara to Markram, FOUR runs <b>crunched!</b> Width offered with a length ball, and he climbs into a superb square-cut off the back foot",2nd innings,3.1,four,22,4,22/0,"Chatara to Markram, FOUR runs",,"<b>crunched!</b> Width offered with a length ball, and he climbs into a superb square-cut off the back foot",0
324,20,Aiden Markram,600498,Tendai Chatara,425639,"Chatara to Markram, no run full on middle, and worked off his toes to the leg side",2nd innings,3.2,no run,22,0,22/0,"Chatara to Markram, no run",,"full on middle, and worked off his toes to the leg side",0
325,21,Aiden Markram,600498,Tendai Chatara,425639,"Chatara to Markram, no run length ball angling in, and clipped off his pads to midwicket",2nd innings,3.3,no run,22,0,22/0,"Chatara to Markram, no run",,"length ball angling in, and clipped off his pads to midwicket",0
